PRO.18.20	Инсаллила икълашейана оᵸхал кен йиᵸзца,
PRO.18.20	гьолцола сикӀаъкьа̄ гувагьийа йаьжла̄на гьолцол баьба-цаᵸ йиᵸхъолца.
PRO.18.21	Мица аьдамна икьеш чӀагона о̄с,
PRO.18.21	тели икълашецалал йикъал нуцӀос гьули.
PRO.18.22	КӀетӀо ахъо йиᵸхъовал кӀетӀослъи йиᵸхъос,
PRO.18.22	БетӀергьаллис баркатна михъос.
PRO.18.23	Мискин-сукӀо гьеренна гьалимна бовагьца,
PRO.18.23	амма бечедабли хъачӀаб жаваб ницца.
PRO.18.24	ВаццалӀо нисоцас сукӀо ваццана ахъаъас,
PRO.18.24	амма гьоᵸсо-гьоᵸс вацца истӀигъана кӀетӀо ахъца.
PRO.19.1	Аᵸцона эᵸкье-гогьцас мискин-сукӀо кӀетӀо гей,
PRO.19.1	сикӀаъ гьилла-макрояб мицна, къаьмиъ аᵸкълона гаьчча сукӀогъа.
PRO.19.2	Илмо-лъайлил гьино гаьччо къаьмна кӀетӀо гаьъа,
PRO.19.2	хаьба йилӀа багъоцас хих тӀотӀечӀена,
PRO.19.2	хаьба на̄ди мехечӀена гьихлъаъас.
PRO.19.3	Гьинилазу аьнтлъила инсан угъолца,
PRO.19.3	амма гьолцола йакӀи БетӀергьалликьа симо бо̄с.
PRO.19.4	Бечелъила вацца̄на тели бовагьца,
PRO.19.4	амма мискинлъила гьоᵸс га̄ьгьийо ваццана ата̄кӀца.
PRO.19.5	ОᵸтӀолана нуьълъи йо̄йо сукӀо тамбигьлиъис тиса уьᵸхаъаш,
PRO.19.5	мекъаб йаьже нисоцас сукӀона хъосар ахъаъас.
PRO.19.6	Телила гургьел-раьгьмо гьарзи бо̄с, гьаькимла̄дой аьᵸйда̄на бечена,
PRO.19.6	тели сайгъатла нийаццала̄сна гьалмагълъилаъ сукӀоназу ахъца.
PRO.19.7	Мискин-сукӀо къацӀцӀола исна̄нна атӀаъас,
PRO.19.7	вацца̄на гьолцодойс йилӀазу ата̄ боьчош.
PRO.19.7	НилӀийо йаьже гьоᵸсна тӀубази йоваъцала
PRO.19.7	гьоллогъой муьгъалӀна гьихлъос гьули.
PRO.19.8	Гьинил жу аццала аᵸкъло-лъай тӀалаб бо̄с,
PRO.19.8	гьинилзу кӀетӀослъилал аᵸкъиллъилаъна цӀодорлъилаъна эчеш гьули.
PRO.19.9	ОᵸтӀолана нуьълъи йо̄йо сукӀо тамбигьлиъис тиса уьᵸхаъаш,
PRO.19.9	мекъаб йаьже нисоцас сукӀона хеллиъис тиса уьᵸхаъаш.
PRO.19.10	Аьбдалликьа гьарзалъи-бечелъи кьухъаъас,
PRO.19.10	йилӀазу кьухъаъас гьаькимла̄кьа кьодо лагъли ханлъи йо̄йолъи.
PRO.19.11	Инсаллила аᵸкълола гьолцос сабру букъкӀис,
PRO.19.11	аьйибликьас кьодос тилӀкийо инсан ца̄ᵸ йеᵸкьейо ахъца.
PRO.19.12	Пачалис симо бӣйолъи йеᵸлъейо йахъца гъалбацӀлила хъаьлӀейалъ,
PRO.19.12	гьолцос кӀетӀо говацӀо̄йолъи йеᵸлъейо йахъца бохакьа йекийа хидалалъ.
PRO.19.13	Аьнтаб оьжо ахъийолъи абос талигь бугъойолъи гей,
PRO.19.13	сикӀо чикейо ахъо – гьоᵸсна йолъечӀе кьамакьас гугьцас ахатӀо гей.
PRO.19.14	БилӀо-аᵸхна маъишатна ийо-абохъас йиᵸхъойо ирс гей,
PRO.19.14	амма цӀодораб ахъо БетӀергьаллис сайгъат гей.
PRO.19.15	КӀаълъила милӀаъ бовахца,
PRO.19.15	огьда̄л атӀаъцалас оᵸх нукона гьихлъос.
PRO.19.16	БетӀергьаллила амролакьа уьᵸхо-аьᵸхецала гьинис руьгь цӀуми бо̄с,
PRO.19.16	Гьолцос гьино йохеэшна угъос.
PRO.19.17	Мискиллил нилӀийо садакъа йахъца БетӀергьаллил нагьлъилаъ нилӀийо окко,
PRO.19.17	йо̄йо кӀетӀослъи Гьолцо йоцӀечӀе йечаннейаъас.
PRO.19.18	Укълъал аьᵸйда̄ бова оьждил адло, бетана аьдада угъос гьули.
PRO.19.19	Симо бигьцалал тамбигь бовал нуцӀос,
PRO.19.19	вагьаллийа сукӀокьа дибо йакӀо йугъона йилӀазу нигъади йахъда,
PRO.19.19	букъо тамбигь бовал нуцӀас.
PRO.19.20	Нисо̄ йоха, насигьат аьᵸдалаъ мейа,
PRO.19.20	дулзу аᵸкъло мокъал.
PRO.19.21	Инсаллила йакӀиъ тели къасдла йа̄хъца,
PRO.19.21	амма БетӀергьалли чахийова̄ъ йахъаъас.
PRO.19.22	Йолъаъцала гургьел-раьгьмоли инсаллис йакӀо рази йо̄с,
PRO.19.22	оᵸтӀола̄лъилагъа мискинлъизу ахо гей.
PRO.19.23	БетӀергьаллихъа гьичӀейа оьмро цӀуми бо̄с,
PRO.19.23	оᵸх йоцӀнана ахъца гьули, кешлъина йеᵸхаъас гьолцолъ.
PRO.19.24	КӀаъабли ко̄ хаьтӀаъ йечаннеш,
PRO.19.24	амма кьа̄ь сикӀадой гьули йезал гьолцол загьмат йахъца.
PRO.19.25	Йаьгь-ламус гаьччо сукӀо зукӀна-аькьелда кьолла̄ аьдамла цӀодорабла ба̄хъца,
PRO.19.25	аᵸкъло гаьгьийал малъзи йова – гьолцол илмо-лъай михъос.
PRO.19.26	Абос адаб боваъцаласна, ийо гиса йоццаласна
PRO.19.26	оьжо инжит-гьаькъир ахъца.
PRO.19.27	Малъилахъа энекзи ахъаъда
PRO.19.27	илмо-лъайлидойс ата̄кца, дие оьжо.
PRO.19.28	Гьилла-макро гаьгьийо нуьъ битӀараб гьоькмо бо̄вакьа кьодо лъоᵸвас,
PRO.19.28	лъаькъейа сукӀос сикӀо кӀортӀолла̄с йоцӀийо йахъца.
PRO.19.29	Йаьгь-ламус гаьчча сукӀоба̄л тамбигь-жаза кьодо йоᵸкъал гьаьдурса йахъца,
PRO.19.29	аьбдалла̄ла михъа̄кьа йаькьелал кӀобала̄на гьаьдурса йа̄хъца.
PRO.20.1	Гъино йаьгь-ламус гаьччо жо бахъца,
PRO.20.1	чӀаъа гьалагаб жо бахъца.
PRO.20.1	Гьолло къонина къосси о̄васна аᵸкъло болъос.
PRO.20.2	Пачалис симо бӣйолъи йеᵸлъейо йахъца гъалбацӀлила хъаьлӀейалъ;
PRO.20.2	гьолцос симо бийиллицала сукӀона хел кьодо кьисас.
PRO.20.3	Даьъба йаьжиъис ата̄ эчелъ инсаллис къадро кьодда̄кца,
PRO.20.3	амма аьбдаьллихъа гьоᵸсна йахъаъас гьинилзу йогъо гунна.
PRO.20.4	КӀаъабли муькъо гьинила замаллиъ йиᵸзаъас,
PRO.20.4	муькъо-бох йуьгьчалаъ,
PRO.20.4	гьули муькъо йиᵸзал уьᵸхолъча, амма гьоьшшона йиᵸхъаъас.
PRO.20.5	Инсаллила йакӀис ният-къас гилъилло ралъад гей, цӀодорабли сукӀол гьолълъос оᵸкьо йиᵸхъос.
PRO.20.6	ЙакӀо-божи гаьгьийа̄ сукӀоба жуво̄л гейлӀо нисона илӀелабацас аьдаьмла тели ба̄хъца,
PRO.20.6	амма божи гаьгьийо сукӀо иᵸхъонна лъо̄хъад ахъца?
PRO.20.7	Муъмин-сукӀо гьаьлаллъилаъ эᵸкье-го̄с,
PRO.20.7	гьардарабла гаьъад гьолцоъкьа̄ ба̄хъийа̄ къована.
PRO.20.8	БитӀараб гьоькмо бовал тахликьа къе̄ эчейа пачали,
PRO.20.8	гьаьй йеᵸхенна, къацӀцӀо кешлъи лъацаййацой исиъца.
PRO.20.9	Лъо̄хъад нисона йахъца до дие йакӀо йаᵸцонна цӀуми йогьналӀо нисона,
PRO.20.9	до мунагьлиъис аᵸцойо гейлӀо?
PRO.20.10	Ахо йаᵸсалаба̄ъцас гирийана, йаьᵸшекӀийо йокьна БетӀергьаллил йа̄тӀаъас.
PRO.20.11	ИтӀина̄кьа бехъхъа гьолцола ишла̄хъана говацӀона йикъеш –
PRO.20.11	йаᵸцо̄ди, ритӀухъабди гей гьолцос уьᵸхо-аьᵸхейолъи.
PRO.20.12	Тухъал аьᵸгъана йега̄л гьаьйна БетӀергьалли йахъилло гей.
PRO.20.13	Дул малӀо йатӀа̄къа – мизу мискин ахъца,
PRO.20.13	гьаьйда йеᵸйагьенна йечабаннейа – баьба-цаᵸ телилъца.
PRO.20.14	Йиᵸсона йохцалаъ нӣйоди гейлӀо, нӣйоди гейлӀо нисос,
PRO.20.14	амма гьули йохна муьгъатта̄ кӀетӀо гейлӀо нисос.
PRO.20.15	Меседна гей, жавгьар-якъутна тели гей,
PRO.20.15	амма цӀодораб сикӀо нигъади-судийа̄ъ йиᵸхъаъас.
PRO.20.16	Йагъа кьодос лъицӀо сукӀола сукӀос жо кьодо йохийа сукӀохъас.
PRO.20.16	Багъа балӀо гулло къай сукӀола сукӀос жо кьодо бохийа сукӀохъас.
PRO.20.17	Гьаьрамаб баьба аьдамлил нийалъца,
PRO.20.17	амма бета гьолцос сикӀо кӀаьчлис йоцца.
PRO.20.18	Аᵸкъло мелъелда, мурадлиъ оᵸкъас;
PRO.20.18	аᵸкъилла̄гъой ургъизи ахъна̄ъ, рагъна бова̄къа.
PRO.20.19	Мицахъалли божилъи йугъолца;
PRO.20.19	сикӀо тели йеᵸгьцаладойс ата̄ эче.
PRO.20.20	Ийо-абол наьъана ниццала сукӀос
PRO.20.20	лампа бишун колӀлӀа мицаъ йедца.
PRO.20.21	Гьех михъова боцӀи-ризкъилакьа ахирна баркат гулаъас.
PRO.20.22	«Ми йо̄йо кешлъи до йоцӀал», – лӀо ниса̄къа.
PRO.20.22	БетӀергьалликьа тӀутӀна йечаннейа, Гьолцо комак бовас дул.
PRO.20.23	Ахо йаᵸсалаба̄ъцас гирийана БетӀергьаллил йа̄тӀаъас,
PRO.20.23	гьилла-макрова гагьийа̄ сайцӀорийана Гьолцол йа̄тӀаъас.
PRO.20.24	БетӀергьаллис амро гаьчӀел инсалли хаьба багъаъас.
PRO.20.25	Пикро бойчӀе гьоᵸс жо БетӀергьаллил назрона йогьна,
PRO.20.25	бета до сийод йо̄йолӀо нисоваъкьа̄ инсаллил къор гулца.
PRO.20.26	Аᵸкъилабли пачали лъаькъейа̄ аьдамла лъацаййацой исибаъца,
PRO.20.26	бета гьоллокьа кьодо йал йолца.
PRO.20.27	БетӀергьалли инсаллис руьгь лампаладцой бабалокӀца,
PRO.20.27	гьолцола йакӀила оᵸкьаъ гаьгьийасна гьаьл бикъелца.
PRO.20.28	Гургьел-рагьмолана божилъилана цӀуми о̄с пача,
PRO.20.28	кӀетӀослъилана гьолцос тах цӀуми бо̄с.
PRO.20.29	Оьлохъалла̄л машгьурлъи гьидела къуват-жалли йиᵸхъолца,
PRO.20.29	ицила̄на гьаьлдийа кеᵸйа̄ кьухъийа̄ бовагьца.
PRO.20.30	ЗукӀна-аькьеллахъа лъаькъейо сукӀо кӀетӀлъис,
PRO.20.30	лаьхъла̄на гьолцос йакӀо йаᵸцойо йо̄с.
PRO.21.1	Пачалис йакӀо БетӀергьаллила ихтийарлиъ гей.
PRO.21.1	ЙатӀа̄цо эᵸхейа йеᵸйагьцалаъцой,
PRO.21.1	Гьолцо пачана гьинил атӀгъа уьᵸхо-аьᵸхелца.
PRO.21.2	Шибабли сукӀол гицца гьинис гьино йаᵸкъойцӀойо гейлӀона,
PRO.21.2	амма БетӀергьалли йаᵸсас гьолцола йакӀиъ гаьгьийо жо.
PRO.21.3	Къурбан муховагъана хирияб гей БетӀергьаллидой аьᵸйда̄
PRO.21.3	ритӀухълъи цӀуми йо̄йолъина
PRO.21.3	аᵸцогъа уьᵸхо-аьᵸхейолъина.
PRO.21.4	Гьаьйда̄ш чӀугьина йакӀис пахрулъина –
PRO.21.4	гьула лъаькъейа сукӀоба̄с лампа, вагьлина мунагьаб гей.
PRO.21.5	КӀаълъи гаьчча̄ пикро-къасла̄ пайда-хайирлиъ бейажеш,
PRO.21.5	эдеъзи ахъийолъила мискинлъилаъ бейажеш.
PRO.21.6	ОᵸтӀолана бокӀолло хазина – залӀи бежена мекьецас готӀ гей.
PRO.21.6	Вагьаллийа хазинали хел кьодо кьисас.
PRO.21.7	Лъаькъейа аьдамла гьидела зулмо-гьаьлли пасад бовагьца,
PRO.21.7	йаᵸкъойцӀова гьидкьа̄ мекьаъцас гаьлълъо гьолло̄л.
PRO.21.8	Аьйиб гаьгьийас гьино чӀикӀ-чӀекӀдийо йахъца,
PRO.21.8	аьйиб гаьччаш ишла кӀетӀа̄ йа̄хъца.
PRO.21.9	Кьамала кьохъкьа оьмро бо̄йолъи ахо гей,
PRO.21.9	сикӀо чикейа ахъхъагъой къацӀо сид билӀоъ эчейагъа.
PRO.21.10	Лъаькъейа сукӀоба̄ла йакӀиъ чикейа къасла йа̄хъца,
PRO.21.10	мадугьаллинна михъаъас гьолцоъкьа̄ гургьел-раьгьмо.
PRO.21.11	Йаьгь-ламус гаьчча сукӀол тамбигь богьцас бегада,
PRO.21.11	кьолло сукӀона цӀодор ахъца.
PRO.21.11	ЦӀодораблила малъилахъа энекзи ахъда,
PRO.21.11	илмо-лъай михъос.
PRO.21.12	Лъаькъейа сукӀола билӀоъ йахъцассинаб йегацас
PRO.21.12	ритӀухъабли Аллагьли гьули пасад о̄с.
PRO.21.13	Мискиллис аьгьи тухъечӀе бахъалъгъа аьᵸгъалакьа ко̄ гулцас сукӀо ахирна жузу илӀела̄л уьᵸхолъча,
PRO.21.13	амма лъона гьолцол жаваб нилӀаъас.
PRO.21.14	Бадлол бикъелечӀе нилӀийа сайгъатли симо болъолца,
PRO.21.14	аᵸгъаъна гунна бакъова ришватли симолис цӀо йедилца.
PRO.21.15	БитӀараб гьоькмо бо̄лъ муъмилла рази ба̄хъца,
PRO.21.15	кешлъи йогьцалал гьинкъи йоᵸкъолца.
PRO.21.16	Аᵸкъиллъила гьидсо оьчойо сукӀо бувагъова̄ла агьлолаъ эᵸдо ахъца.
PRO.21.17	Ихтилат-кеп баццас сукӀо язихлъилаъ оᵸкъос,
PRO.21.17	гъинона маьгь кӀетӀо йеᵸлъна йаццас сукӀо бечед ахъаъас.
PRO.21.18	Лъаькъейа сукӀолъ хуьжона муъмин-сукӀо иᵸхъас,
PRO.21.18	хийанат-сукӀолъ хуьжона ритӀухъаб сукӀо иᵸхъас.
PRO.21.19	БоьчӀчӀа авлахълиъ оьмро бо̄йолъи ахо гей
PRO.21.19	сикӀо чикейана симахъоцалана ахъхъадой шеблаъ эчейагъа.
PRO.21.20	Аᵸкъилаблила билӀоъ йокӀолло жо йолъаъцас йахъца,
PRO.21.20	аьбдаллилӀо нисода билӀоъ гаьгьийо жо залӀил йуьᵸхолча.
PRO.21.21	РитӀухъабна гургьел гаьгьийона ахъал икье-аькьецала сукӀос
PRO.21.21	бетӀербахъи кӀетӀлъис, къадро-къимат кьодда̄кца.
PRO.21.22	Аᵸкъилабли кьодо огицӀна багъос къуватаб тушмалла̄ш шагьар,
PRO.21.22	гьоглол билӀа̄ гейлӀо гицӀийо хъалана пасад бо̄с.
PRO.21.23	Гьинис сикӀона сикӀаъ гаьгьийо мицна цӀуми бо̄ва сукӀо,
PRO.21.23	гьинис руьгьна балагьла̄кьас цӀуми бо̄с.
PRO.21.24	Букъо аьмална ницна гаьччо инсаллихъа̄ъ нисос йаьгь-ламус гаьччо сукӀолӀо,
PRO.21.24	оьрхъилаъас гиса гӯйо чӀугьи-пахрулъи йахъцас йикъе гьолцола йакӀиъ.
PRO.21.25	Хийал-пикрула̄ кӀаъаб сукӀо угъолца,
PRO.21.25	йикье-йаькьечӀе йейачеш гьолцос ко̄дана.
PRO.21.26	Гьаьйл йатӀийосинаб йиᵸхъассаъдилӀона пикрола̄ъ ахъца гьули хискьабехъхъа,
PRO.21.26	муъмин-сукӀо гьинил йиᵸхъо̄назу ко̄ йеᵸццакна нилӀал гьаьдураб ахъца.
PRO.21.27	Лъаькъейа сукӀоба̄с къурбан сурукъабна къаьбигьабна жо гей,
PRO.21.27	гьоло йилӀазу нигъади бахъца йакӀиъ чикейо къасна бахъна мухос зогъда.
PRO.21.28	ОᵸтӀолана нуьълъи йогьцас сукӀо пана ахъца,
PRO.21.28	нуьъла̄хъа энекзи ахъна къадийа бо̄йо гьоькмо муьгъатта̄ гьихлъос.
PRO.21.29	Лъаькъейа сукӀола мотӀолиъ ниц бахъаъас,
PRO.21.29	ритӀухъабли сукӀо пикро богьна̄ъ хаьба багъаъас.
PRO.21.30	БетӀергьаллигъа йижецас аᵸкъиллъина гаьъа, цӀодорлъина гаьъа, ният-къасна гаьъа.
PRO.21.31	Рагълиъ йежеллал шуго̄л гьаьдур йовагьца,
PRO.21.31	амма бергьенлъи БетӀергьаллиъис йахъца.
PRO.22.1	КӀетӀо ца̄ᵸ йукъа бечелъилагъа къиматаб гей,
PRO.22.1	адаб-гьуьрмат окко-меседлигъана кӀетӀо гей.
PRO.22.2	Бечедаблана мискинаблана мейалъейа̄ ба̄хъца:
PRO.22.2	гьолло̄л къацӀцӀа̄ БетӀергьалли ба̄хъинна.
PRO.22.3	Шед-баьчдой оᵸкъолъ, цӀодораб сукӀо балӀо гьидлакьа̄ эᵸкьеш,
PRO.22.3	амма кьолло сукӀо эченоцӀечӀе аьᵸйда̄ эᵸкьеш,
PRO.22.3	бета балагьлиъна кези ахъца.
PRO.22.4	Гьаьлимабна гьеренабна ми ахъда,
PRO.22.4	гьула̄зу БетӀергьаллихъана гьичӀеда,
PRO.22.4	бета дул бечелъина, адаб-гьуьрматна, чӀаголъина насиб йахъца.
PRO.22.5	АпаракӀла̄ла гьинода̄кьа зазна йахъца, гьоллол гулло къорна йахъца;
PRO.22.5	гьидеш руьгь цӀуми бовал батӀийа̄ гьоллодойс ата̄ бечеш.
PRO.22.6	Оьлохъан-сукӀо гьид аᵸкъойцӀо эᵸгьда,
PRO.22.6	ицлолъна муьгъатта̄на гьули гьолълъо гьидсо олъаъас.
PRO.22.7	Бечедабли мискилла̄кьа кьодо ханлъи йо̄с,
PRO.22.7	нагьлъилахъна ахъца гьинил нагьлъилаъ окко нилӀийас лагълъилаъ.
PRO.22.8	Кешлъи йиᵸжецала балагь-азаб муькъо-бохцой йуьᵸвоьш,
PRO.22.8	гьолцола симас лӀуьручӀна йишеш.
PRO.22.9	Сахаватаб сукӀокьа баркат гулца,
PRO.22.9	гьолцо мискилла̄л баьба-цаᵸ нилӀлъо.
PRO.22.10	Йаьгь-ламус гаьччо сукӀо гьицас оцӀа –
PRO.22.10	питна-йаьже ата̄кца, даьъба-йаьжена йолъос.
PRO.22.11	Пачалина гьалмагълъи йо̄с йакӀо йаᵸцо̄лъи
PRO.22.11	йаццала̄гъойна сикӀас калам нийа̄ гаьгьийа сукӀогъойна.
PRO.22.12	Илмо-лъай гаьгьийас БетӀергьалли тӀалаб бо̄с, Гьолцо божи бовал бахъаъцаса ата̄ бовахца.
PRO.22.13	КӀаъабли нисос, гьула, гисда̄ гъалбацӀ гейлӀо,
PRO.22.13	къатӀлиъ жу гисакда икьешлӀо.
PRO.22.14	СукӀола ахъхъас сикӀо-миц – гилъилло куво гей,
PRO.22.14	БетӀергьаллис симо бӣйо гьулиъ экца.
PRO.22.15	Оьлохъаллила йакӀиъ аьнтлъи эᵸдокна гей,
PRO.22.15	аᵸкъло-насигьатлила цӀицӀолид гиса йоцӀал нуцӀос гьули.
PRO.22.16	БоцӀи-ризкъи телилъал батӀна, мискиллил зулмо богьцас,
PRO.22.16	йана бечедаблил сайгъатла нийалӀцас сукӀо мискиндолъца.
PRO.22.17	Аьᵸгъа йохна энекзи ахъ ми аᵸкъилабла̄ла йаьжла̄хъа,
PRO.22.17	до малъзи йогьцалагъойна йакӀона йуьᵸхола.
PRO.22.18	Гьолло̄л йакӀиъ цӀуми йовагьийа̄ рази ба̄хъца,
PRO.22.18	йакӀкьана йоᵸвакъос дул гьолло̄л.
PRO.22.19	БетӀергьаллил дибо михъа̄ тил тухълалъгъа,
PRO.22.19	жейсана ниццас гей до дул аᵸкъло
PRO.22.20	Дул аᵸкъло-насигьатлил лъанайиг кици чахна зукъеэшди до.
PRO.22.21	Дул амро богьцала̄л аᵸкъилабна битӀарабна жаваб дӯхъа нилӀна йа̄хъцаса кицийа гей гьолло̄л.
PRO.22.22	Мискинаб гейлӀо нисона мискин-сукӀо оᵸкьола̄къа,
PRO.22.22	судлил оᵸкъойо пакъирна къарид ова̄къа.
PRO.22.23	БетӀергьан гьоллолъда̄ ахъцас йикъе,
PRO.22.23	гьоллохъас жо йагъова̄с руьгьна Гьолцова̄ъ багъос.
PRO.22.24	Симо бигьцала̄гъойна гьалмагълъи йова̄къа,
PRO.22.24	тӀикъкъо йакӀо гаьгьийа̄гъойна къацӀо жо йова̄къа.
PRO.22.25	Гьоллос аьмална бокчина, дулзу ми къор гулалаъ.
PRO.22.26	Йаьᵸкьенна ко̄ йохна къотӀи богьцала̄лъна сукӀос жо кьодо йохна бечейа̄ аьдамла̄лъна мейалъена муьхо-маьха̄къа.
PRO.22.27	Нагьлъи йоцӀал дибо рес зогъаъда, дӯлӀ лӀийос мокӀолна багъас.
PRO.22.28	Умумалли гулло оьрхъи-бигъа бадо̄цо хуьжа̄къа.
PRO.22.29	Гьинисзу махшел ахо бикъецас сукӀо эгасди дул?
PRO.22.29	Бийакъаъцала халкъилал гаьъа гьолцо хъулухъ богьцас, – пача̄л гей богьцас.
PRO.23.1	Халлигъой къацӀо эсцалаъ, ми ахо гоцӀохъ дудой аьᵸйда̄ сийо гуллахъана.
PRO.23.2	Оᵸх чикейо сукӀо ми зогъда, дибола йислиъ цӀитӀ хаьлӀа.
PRO.23.3	Гьолцола бесал гулла гемоябла ниъматла̄кьа кул бова̄къа, ми оᵸтӀоцас кен гей гьули.
PRO.23.4	Бечед ахъаллӀона ми икье-аькьа̄къа,
PRO.23.4	оьрхъилаъас гисакечӀе гьихлъал нуцӀос ми.
PRO.23.5	Дибо гьаьй йеᵸхейоназу бечелъи аьᵸйда̄ш йоъца –
PRO.23.5	гьабода йа̄хъилца гьолълъо, цуᵸгьацойна гьасаъ йогицца.
PRO.23.6	Гьаьй хоькӀкӀа сукӀос баьба муьхъа̄къа,
PRO.23.6	гьолцола ниъматликьана кул бова̄къа.
PRO.23.7	Гьинхъас йеᵸкьецала харжлила пикрола̄кьа нитоназу гьули ахъца.
PRO.23.7	Йуьᵸхъ-хулӀалӀо нисос, амма гьолцос йакӀо дудойс цӀихода̄ йахъца.
