LUK.2.34	Гьоллол доьъана богьна Симеони нисос Мариянхъа, оьждила ийохъа:
LUK.2.34	– Гьуна, вагьацо оьждиъкьа̄ телида̄с Израил халкъилас аьдамла бейакца, телида̄с кьоддаба̄кца, вагьди къова ахъца Аллагьлис аьламатцой, амма тели аьдамла гьолцол данде бечеш, 
LUK.2.35	– дибона йакӀо балъаййахъа лъукъзи йахъца, – телилас йакӀиъ гаьгьийа̄ пикрована загьир йа̄хъалъгъа.
LUK.2.36	Зукъойо гьулиъ гьиниъ караматлъи гаьгьийо Гьаннат – Пенуэлис кид, Ашерила кьибиллиъис, йилӀа ицлолъийо аьдам. Гьинила бетӀергьаллигъой ахъо йеᵸкьена муьгъатта̄ алӀна лӀи йагъос. 
LUK.2.37	БелӀнайигна оьᵸкъона лӀи йеᵸкьецал къоролай нитоназу Аллагьлила билӀоъос йолъаъас зукъона гей нишена-хискьана БетӀергьаллил какна-кӀална йогьна, тӀаъат-ибадатликьа йечена. 
LUK.2.38	Вагьалълъо мехлаъ гьолълъо Аллагьлил рец-бакъ богьна ме̄ш зукъойо Исас хабар, Иерусалим тапшур боваллакьа йакӀо гаьгьийа къацӀола аьдамла̄л.
LUK.2.39	Бета гьолло̄л, БетӀергьаллила къанонликьа бовал нуцӀойо аьдатна богьна, мекьена мокъос Галилеялиъ, гьидела шагьар Назаретлиъ. 
LUK.2.40	ИтӀино укълъис зукъойо, къуватабна аькъилабна ахъца зукъойо, Аллагьлис баркат зукъойо Гьолцоъ.
LUK.2.41	Шибаб лӀиъ Гьолцос ийо-або мекьа̄гьийо Иерусалимлиъ ПасхалӀо нисоцала ид-водил. 
LUK.2.42	Гьолцол ацӀона къона лӀи йеᵸкьелъ, аьдатликьа ид-водил гьолло̄л мекьейо кьодо Иерусалимлиъ. 
LUK.2.43	Бета ид-водо йолъона муьгъатта̄ гьолло̄л кьа̄ь мекьейо, гьихлъос гьоллос насло Иса Иерусалимлиъ; гьули гьихлъо̄лъи икъаъас ийолна аболна. 
LUK.2.44	ГицӀийолӀо гьодлол Гьули го̄слӀона бадлогъой. ЙалӀокъе̄ш йагъойо гьино йолъона муьгъатта̄, муьхобалъийолӀо гьолло̄л гьули иᵸзал аьгарлъилаъна бега-бийакъейа̄ъна. 
LUK.2.45	Гьулина иᵸхъечӀе, кьа̄ь кӀаьймуьхона мекьейолӀо гьолло̄л Иерусалимлиъ гьолцогъойна миздабана. 
LUK.2.46	Лъанасла водиъ Гьули иᵸхъона гей Аллагьлила билӀоъ муалимла̄ъ алӀо къе̄на эчена, гьоглохъа энекзи ахъна гьоглол суалла нийаццас. 
LUK.2.47	КъацӀцӀа̄ энекзи бахъийа гьайран-гьикмат бовагьца зукъона гьолцола аᵸкълолана жавабла̄на. 
LUK.2.48	Гьули эгалъ, ийо-або гьикмат ба̄хъийо; гьолцола ийо оьждихъа нисос:
LUK.2.48	– Йа̄ дие оьжо, сийод ми илол йо̄йо. Гьуна, дибо абона дона йукъа пашманлъилаъ ми иᵸзийо.
LUK.2.49	Гьолцо гьоллохъа нисос:
LUK.2.49	– Суд миже до иᵸзал нуцӀос? Мизол икъаъасди зукъойо до диела Абола билӀоъ ахъал нуцӀоцаслъи?
LUK.2.50	Амма ийо-абол биджи йахъеэш гьолцо нисо̄ йаьжла̄ш маъна. 
LUK.2.51	Бета Гьули аьгъиъна эᵸкьейо гьоллогъой лӀийо Назаретлиъ. Гьули ийо-або нисогъа уьᵸхо-аьᵸхейо. Ийона гьогцос йаьжбо шоваълечӀе йакӀкьа йовахийо.
LUK.2.52	Иса укълъийо, аьдамла̄ла аᵸкъло-пикролаъ оᵸкъойо, Аллагьлинна аьдамла̄нна Гьули йилӀа атӀийо.
LUK.3.1	Тиберий къайсарлъилаъ ахънас ацӀона лъинас лӀи зукъойо; Ягьудиялиъ наиблъилаъ Понтий Пилат зукъойо; Галилеялиъ ханлъилаъ Гьерод зукъойо; гьолцос ис Филипп зукъойо Итурейлилана Трахонитлилана вилаятлис хан; Лисаний Абиленаллиъ ханлъилаъ зукъойо; 
LUK.3.2	Гьаннана Кайафана бишшун букъа̄ кашишлалъилаъ гаьгьийа мехлаъ, Закарияла оьждил – Ягьял боьчӀчӀа авлахълиъ Аллагьлис йаьже тухъийо. 
LUK.3.3	Гьолцо Иордан эᵸхедой гьица гаьгьийа мица̄ъ кӀаьйлӀона лъӣд ма̄цоллолъи тӀибитӀизи йо̄йо, мизос мунагьла тавба богьда чурзи йа̄хъцалӀо нисойо. 
LUK.3.4	Вагьаддийа йаьжбо ча̄хна гей Ишая авараглила ТӀекликьа:
LUK.3.4	«Гьоᵸс гьокӀ тухъца боьчӀчӀа авлахълиъ:
LUK.3.4	Гьуги оᵸкъолъол гьино къачӀази йова,
LUK.3.4	Кьодда̄лал гьино йаᵸкъойцӀойо йова,
LUK.3.5	Шибаб куво-аьракъ йолъала,
LUK.3.5	шибаб ма̄ь-бизова йеᵸйалъала,
LUK.3.5	ЧӀикӀ-чӀекӀдийо жо йаᵸкъойцӀала, хир-хоькӀила̄ маьче мелъала,
LUK.3.6	Шибаб ругь-чӀаголъилал Аллагьлис хъосарлъи йега̄ла».
LUK.3.7	Гьолцодой ма̄цолал мокъова халкъилала аьламлихъа Ягья ниса̄гьийо:
LUK.3.7	– Гьай миже, цӀодола бекелалис насло! Лъод миже тӀамзи бо̄йо кьодо мокъоцала Аллагьлила симолдойс боьвачал? 
LUK.3.8	Миже бо̄ва тавбалас пихъ йегала. Иле Ирбагьинила наслолас къова̄ гейлӀо нисона бикълабаша̄къа. Гьуна До мизохъа нисос, Аллагьлил йадда вагьаддо̄л кьала̄на Ирбагьинила къова̄л Гьогцохъа йуьᵸвахонна йа̄хъца. 
LUK.3.9	Хоьхила хемухадой оᵸг гуллолъи мизол йикъе. КӀетӀо пихъ кьодо йахъаъцас хоьхо буьчӀна цӀоъ гулцаслъи йикъе.
LUK.3.10	Гьиде сийод йовал нуцӀослӀо нисос зукъойо аьдамла̄. 
LUK.3.11	Ягья жаваб ницца зукъойо:
LUK.3.11	– Къона мухун гаьгьийа гьоᵸсцойс гаьччал нилӀа, кен гаьгьийана вагьалла̄ йова.
LUK.3.12	Мунагьла чурзи йовагьиллал мокъова̄ гьаькъ бокӀолал бечелла̄ аьдамла̄на нисолло гьолцохъа:
LUK.3.12	– Йа̄ Муалим, иле сийод йовал нуцӀос?
LUK.3.13	Гьоллол жаваб нилӀийо Ягья:
LUK.3.13	– Мизол бегаллагъа кьодда̄с багъа̄къа гьаькъ.
LUK.3.14	Вагьалла̄зу рагъухъалла̄на мокъона нисолло:
LUK.3.14	– Илена сийод йовал нуцӀос?
LUK.3.14	Гьоллохъана нисойо:
LUK.3.14	– Гьоᵸссидихъасна гьичӀегонна окко йагъа̄къа, гьоᵸссидикьана гаьччо аьйиб гула̄къа, мизол ниццала харжликьа рази бахъна бече.
LUK.3.15	Масигь оᵸкъаллахъа гувабацӀона бечейаъ, халкъилал пикро бахъца зукъойо Ягья Масигь зогъаллӀона. 
LUK.3.16	Ягья къацӀцӀолал жаваб нилӀийо:
LUK.3.16	– До мизос мунагьла лъӣд йа̄ᵸцолца, амма оᵸкъос дӣгъана йилӀа къудратаб СукӀо. До гей гьолцола гьалалъцола̄с кьохъа̄ йа̄ᵸкал мустагьикъаб гаьччо сукӀо. Гьогцо мизос мунагьла йа̄ᵸцолас Илагьиябли ругьлидна цӀойидна. 
LUK.3.17	Гьогцола каъ аьᵸко гей, нахоъос хъибо мацонна гьинила баькьиъ гулца, нахо гьоᵸсна йедаъцала цӀоъна гунна Гьолцо йекӀелца.
LUK.3.18	Рохеллис Хабар нисона вагьалла̄зу тели баддо̄нна насигьатла Ягья аьдамла̄л йовагьийо.
LUK.3.19	Гьерод ханли гьинила истӀис ахъо Гьеродиада йоᵸкъойолъина, бади гьокцос чороклъина Ягья мотӀолиъ йакьеллъо, 
LUK.3.20	Гьероди Ягья тӀусагъийаъ голло, ханли йовагьийа бадло кешлъила̄кьа кьодо вагьли кешлъина телилъийо.
LUK.3.21	КъацӀцӀо гаьлъда-гаьгьийо аьламна мокъона лъӣд мунагьла йа̄ᵸцолцалаъ, Исана лъӣъна эᵸдокна доьъа бо̄слаъ, гьаᵸса йеᵸйагьейо. 
LUK.3.22	Илбалила суратбакьа Илагьияб Ругь мокъойо гьолцодой. Бета гьаᵸсаъкьа̄ гьокӀ тухъийо:
LUK.3.22	– Ми гей дил аццас дие Оьжо. Дӯкьа До рази гей!
LUK.3.23	Иса Аллагьлил хъуллухъ бовал уьᵸхолъийаъ, гьолцос зукъойо лъанайиглъийо лӀи. Гьолцола умумаллис вагьаддийо кьибил гейлӀо нисос зукъойо: гьолцос або Усуп, гьолцосна або Эли, бета 
LUK.3.24	Маттат, Леви, Малки, Яннай, Усуп, 
LUK.3.25	Матитя, Амос, Нагьум, Гьесли, Наггай, 
LUK.3.26	Магьат, Маттати, Шимъи, Йосех, Йода, 
LUK.3.27	Йогьанан, Реса, Зеруббабел, Шеалтиэл, Нер, 
LUK.3.28	Малки, Адди, Къасам, Алмодам, Эр, 
LUK.3.29	Ешуа, Элиэзер, Йорим, Маттат, Леви, 
LUK.3.30	Шимъон, Ягьуда, Усуп, Йонан, Элякъим, 
LUK.3.31	Мелеа, Менна, Маттата, Натан, Давуд, 
LUK.3.32	Йишай, Йобед, Боаз, Шалмон, Нагьшон, 
LUK.3.33	Аминадаб, Админ, Арам, Гьецрон, Перец, Ягьуда, 
LUK.3.34	Якъуб, Исгьакъ, Ирбагьин, Терагь, Нагьор, 
LUK.3.35	Серуг, Реу, Пелег, Эбер, Шелагь, 
LUK.3.36	Къейнан, Арпакшад, Шем, Нуьгь, Ламек, 
LUK.3.37	Метушелагь, Гьенок, Яред, Магьалалеэл, Къейнан, 
LUK.3.38	Энош, Шит, Адам, Аллагь.
LUK.4.1	Илагьияб Ругьлид оцӀийо Иса Иорданлиъис кӀаьй уьᵸхона го̄йо, бета Ругьли Гьули оᵸкъолло боьчӀчӀа авлахълиъ. 
LUK.4.2	Вагьлиъ йагъойо Иса оьᵸкъонайиг водо. Илбисли гьолцос гьаьлна бикъелло. Вагьлосинаб замаллиъ сикӀаъ лукӀма мейэш. Оьᵸкъонайиг водо йеᵸкьелъ, Гьули нукойо. 
LUK.4.3	Вагьалълъо мехлаъ илбисли нисос Гьолцохъа:
LUK.4.3	– Ми Аллагьлис Оьжо зогъда, вагьалӀо кьалхъа ниса баьбалал йуьᵸхолӀо.
LUK.4.4	Иса гьоглӀол жаваб нилӀийо:
LUK.4.4	– ТӀекликьа чахна гей: «Сид баьбалакьа боваъас инсалли гьинис оьмро».
LUK.4.5	Бета илбисли ма̄ькьана оᵸкъонна, сид лагьзатлиъ дуниялликьа гаьгьийа̄ къацӀцӀа̄ пачалихъла йегабалло Гьолцол. 
LUK.4.6	Бета гьоклӀо нисос:
LUK.4.6	– Вагьадло къацӀцӀола пачалихъла̄с ихтиярна рецна до Дул нилӀал, судлӀо нисода гьолълъос ихтияр дӣхъа нилӀна гей, до дил атӀтӀийал вагьло ницца. 
LUK.4.7	Ми дил сужда богьда, вагьли къацӀцӀо дибо йахъца.
LUK.4.8	Иса жаваб нилӀийо:
LUK.4.8	– ТӀекликьа чахна гей: «Сид Аллагьлилла̄ъ сужда бова̄къа, БетӀергьаллилла̄ъ ибадат бова̄къа».
LUK.4.9	Бета илбисли Гьули Иерусалимлиъ эжена Аллагьлила билӀола кьохъкьана гонна, Гьолцохъа нисос:
LUK.4.9	– Ми Аллагьлис Оьжо зогъда, вагьалӀоъла лӀийо огицӀ! 
LUK.4.10	ТӀекликьа чахна гаьъад: «Аллагьли малаикла̄кьа амро бовас ми цӀуми овалӀо нисона». 
LUK.4.11	Бета: «Малаикла̄ каъ охна эзас кьалил дибо хаьба мехелечӀе».
LUK.4.12	Иса жаваб бо̄йо:
LUK.4.12	– «Ми БетӀергьан, дибола Аллагьлил гьаьлбики йова̄къа» – лӀо нисона чахна ТӀекликьа.
LUK.4.13	Гьолцол къацӀцӀо гьаьлбики йогьна лъикъолъ, илбис гьоᵸс санаъатаб мех мокъоцал боъийо Гьолцодойс.
LUK.4.14	Иса оᵸкъойо Галилеялиъ Илагьияб Ругьна Гьиниъ бахъна. Гьолцос ца̄ᵸ на̄назу со̄ᵸгъой гаьгьийа̄ мица̄ъ йеᵸкьейо. 
LUK.4.15	Синагогла̄ъ эᵸкьена Гьолцо ваъза-насигьатла йовагьийо, къацӀцӀола Гьолцол рец-бакъ бо̄с зукъойо.
LUK.4.16	Бета Иса тарбийа-лъай нилӀийа Назарет шагьарбаъ эᵸкьейо, гьинила аьдатликьа шамат водиъ синагоглиъна эᵸдокийо. Гьоллол ТӀек хъовал минбарликьа кьодокийо. 
LUK.4.17	Ишая авараглис ТӀек нилӀийо Гьолцохъа. Вагьаддийо калима гаьгьийо мицаъ ТӀекна йеᵸгьена, хъо̄йо Гьолцо:
LUK.4.18+LUK.4.19	– «Дӣъ БетӀергьаллис Ругь гей, гьолцо дил ихтияр нилӀийо Рохеллис Хабар мискилла̄хъа мейал, асирлъилаъ гаьгьийа̄ тиса ба̄гъоналӀо, боцдийа̄л канлъи йоᵸкъоналӀо, азаб-акъубалиъ гаьгьийа̄ гиса мегьналӀо. Аллагьлила раьгьматлис мех мокъоналӀо нисал эᵸгьна гей До».
LUK.4.20	Бета Гьули ТӀекна йиᵸхъона, хъулухъчийахъана нилӀна, къе̄ эчейо. Синагоглиъ гаьгьийа̄ къацӀцӀолас гьаьй йеᵸхейо Гьолцокьа. 
LUK.4.21	Иса гьоллохъа нисал уьᵸхотохъийо:
LUK.4.21	– Жейса миже вагьалӀо калималихъа энекзи бахъцалаъ, чахийо жо тӀубази йахъийо.
LUK.4.22	Гьолцола каламли гьоллол букъо асар бо̄йо. Исала сикӀаъкьа̄ гугьцала вагьалълъо баркатаб каламли къацӀцӀа̄ аьжаиб бовагьийо. Бета гьолло нисойо:
LUK.4.22	– Усупис оьжод гей Гьули?
LUK.4.23	Иса нисойо гьоллохъа:
LUK.4.23	– Гьай-гьай миже Дӣхъа кицина бакъона нисас: «Ми дохтур зогъда, гьакъкъа Мизу сагъ ахълӀо. Илол Капернаумлиъ йахъийо шинаб жо тухъийо, же вагьалӀо Дибола абола ракьликьана йова!» – лӀона нисас миже Дӣхъа.
LUK.4.24	Амма Гьогцо гьоглохъа нисойо:
LUK.4.24	– Гьаькъкъаб жо гей, гьоᵸсна авараг гьинила абола ракьликьа бикӀзи оваъас. 
LUK.4.25	Гьаькъкъаб жо нисос До мизохъа: Иляс авараглила замаллиъ лъана лӀина илъна боцо бахъийо мицакьа водо гуйчӀе къацӀцӀо дуниялликьа йукъо ракъи йоᵸкъона. 
LUK.4.26	Израиллиъна тели къоролла зувакъодана, Сидонлидой гьиᵸца гаьгьийа Царепатила сид къоролайдоййаъ эᵸйэш Аллагьли Иляс. 
LUK.4.27	Элиша авараглила замаллиъ Израиллиъна барас унтилаъ кӀовабакӀова тели аьдамла ба̄хъдана, Шамлиъис гьоᵸс НаъманлӀо нисоцас сукӀова̄ъ аᵸцолеэш гьолълъо унтилаъас.
LUK.4.28	Вагьли тухъийоназу, синагоглиъ гаьгьийа̄ аьдамла гьалаг ба̄хъийо. 
LUK.4.29	Баьгъбаъна гьолло Гьули шагьарбаъаш гисана эжена бачилӀ тӀотӀаллӀо нисона, гьидес шагьар бо̄йо бизола раьъалликьа акъос зукъойо. 
LUK.4.30	Амма Иса халкъилаъас алӀос оьчона оъийо.
LUK.4.31	Бета Галилеялила КапернаумлӀо нисоцала шагьарбаъна эᵸкьена, гьоллол шамат водла̄ъ Аллагьлис калам биджи бовал уьᵸхолъийо. 
LUK.4.32	Гьолцола ваъзала̄кьа аьдамла аьжаиб ба̄хъна зувакъойо. Гьолцо нисоцас жо нисос зукъойо Гьиниъ гьаьлкӀолъи гаьгьийаъцой.
LUK.4.33	Синагоглиъ зукъона гей зинналла̄ охийо гьоᵸс сукӀо.
LUK.4.34	– ЭццакӀа! Сийод дул илоъкьа̄ йатӀна, Назаретлиъис Иса! – лӀо нисона йукъо илӀела̄л уьᵸхолъийо гьули сукӀо. – Иле пасад бовалди оᵸкъона Ми! Дил икъеш Ми Аллагьлис Илагьияб СукӀо ахъцаслъи!
LUK.4.35	Иса гьокӀ йоъиллийо гьолълъос:
LUK.4.35	– ГьокӀ йоъла, болъо Ми гьолцола магъоъос!
LUK.4.35	Синагоглиъ алӀлӀода гьули сукӀона къе̄ икьена, гьоьшшона зарал бойчӀе гьолцола магъоъос зиннал гисакийо. 
LUK.4.36	КъацӀцӀа̄ гьайран бахъийо. Гьолло̄л сидхъа гьоᵸсо бикълабашал муьхобалъийо:
LUK.4.36	– Сийо йаьжед гьули, гьинила къуватлидна къудратлидна амро богьцас зинналла̄л; гьолълъогъа муьгъатта̄ гьолло̄лна инсаллила магъоъос гисабакцас, – лӀо нисона.
LUK.4.37	На̄назу со̄ᵸгъой гаьгьийа̄ мица̄ъ митемекьейо Исас хабар.
LUK.4.38	Бета аьгъиъна, синагоглиъисна гисакна, Иса СимонлӀо нисоцала сукӀодой билӀогъа эᵸкьеш. Симонис йукъо ийо йаьчӀ-йиххала унтилаъ йилӀа кӀокӀона йиᵸхъос. Гьоло йахълалӀо нисона гьарзи йо̄с Гьолцохъа. 
LUK.4.39	КӀокӀовадой гьиᵸцана эᵸкьена, йаьжена нисона, гьолълъоъос унти болъолца. Вагьаллиъисзу йаьгъиъна, гьоллол кен-оᵸх гулал йуьᵸхолъча гьоло.
LUK.4.40	Бохъ тӀикейа анталаъ тели кӀовакӀова̄ аьдамлана ба̄къона мокъойо Гьолцодой. Исана шибаблил ко̄ йеᵸхенна гьолло̄л ба̄хъилло. 
LUK.4.41	Лади аьдамла̄ъаш зинналла йовацӀийо.
LUK.4.41	– Ми Аллагьлис Оьжо гей! – лӀо нисона илӀелабас зувакъойо гьолло̄л йоьвачошлаъ.
LUK.4.41	Амма жу Масигь гаьгьийолъи зинналла̄л икъелъ, Иса гьоллос гьокӀа йоваъиллис зукъойо.
LUK.4.42	Бета хиса водо хишейоназу гисакна Гьули боьчӀчӀа авлахълиъ эᵸкьейо. Халкъила Гьули иᵸзийо. Иᵸхъона муьгъатта̄, гьидедойс на̄на эᵸкьа̄къалӀо нисона гьардизи ба̄хъийо. 
LUK.4.43	Амма Иса гьоллохъа нисойо:
LUK.4.43	– Аллагьлис Парчагьлъи йоᵸкъоцалас Рохеллис Хабар нисал До бадло шагьарба̄ъна эᵸкьал нуцӀос, вагьалълъол э̄ᵸйо гей До.
LUK.4.44	Вагьла̄ Ягьудиялила синагогла̄ъ эᵸкьена, Гьолцо ваъза-насигьатла йовагьийо.
LUK.5.1	Аллагьлис калам тухъал батӀийа̄ аьдамла̄ со̄ᵸгъой къацӀобакна гаьгьийа мехлаъ, Гьули зукъойо ГеннисаретлӀо нисоцала ралъадбадой. 
LUK.5.2	Ралъадбаъ къона гама бегас Исал. Биса̄хъла, гамалиъис гисана гугьна, гьидеш биса̄ йовахцас къӣла низабас зувакъойо гьулиъ. 
LUK.5.3	Иса Симонила гамалкьа кьодокийо.
LUK.5.3	– Раъалликьас даьгьаб ралъадбаъ эᵸдда̄ гама беза, – лӀо нисона гьарзи йо̄йо Гьолцо Симонхъа.
LUK.5.3	Гамалкьа къе̄на эчена Гьолцо аьдамла̄л ваъза-насигьат бо̄с зукъойо. 
LUK.5.4	Ваъза-хабар болъолъ, Симонхъа нисос:
LUK.5.4	– Ралъадбала гилъилла мицаъ гамана мокъонна, тӀутӀа дибо биса̄ йовахцас къӣ.
LUK.5.5	Симони Гьолцол жаваб нилӀийо:
LUK.5.5	– Йа̄ НасигьатсукӀо! Гьуᵸлъ нише-хишей ла тӀутӀдана илол гьоᵸсна биса михъеэш. Амма Ми нисойо йаьже йугъолечӀе до гьаᵸкъкъаса̄за къӣ тӀутӀал.
LUK.5.6	Вагьла̄ нисогъа тӀулӀлӀо, гьоллол тели биса михъойо. Биса̄ла йаькъкъолъилахъа къӣ йа̄ьхал йуьᵸхолъийо. 
LUK.5.7	БалӀо гамалкьа гаьгьийа̄ гьалмагъла̄хъа ишан богьна комаклил ийалӀейо. Мокъона гьоллона къацӀо комак богьна, къонана гама̄ бисалис йовацӀилло. Давлалила йаькъкъолъилахъа къонана гама̄ ралъадбаъ гъанкъизи йа̄хъал йуьᵸхоьбалъийо. 
LUK.5.8	Вагьли йегалъ, Симон-Петри Исала мицна̄дой аьᵸйда̄ суждалкьана эчена нисойо:
LUK.5.8	– Йа̄ БетӀерчӀахъаяв, олъо дидойс Ми! До гей мунагьла̄с оцӀийо сукӀо!
LUK.5.9	Вагьла̄ нисаъасди, гьулина гьолцогъой къацӀо гаьгьийа̄на котакалда гьийабачӀена зувакъойо тели бохийо биса бегалъ. 
LUK.5.10	Вагьла̄зу, Симонил гьалмагълъилаъ гаьгьийа̄ Зебедайис оьждаь, Якъубна Иоанна, гьийабачӀейо. Бета Иса Симонхъа нисойо:
LUK.5.10	– ГьицӀа̄къа! Желагъа муьгъатта̄ ми аьдамла бисацой бовахца
LUK.5.11	Гама̄на мицакьана кьисабана, гаьлъгъа къацӀцӀо жона йечаннегьна, гьолло̄л Исагъой къацӀо мекьейо.
