LUK.9.15	Chá'ee namédaqui jíni, jáiwa nawáau quinínamai. 
LUK.9.16	Néenee'e Jesús wína náa'a cinco páanica ya náa'a chámacua cubáica ya licába'ee áacairra, liá'ee Diosru sáicai linácueji liá'a íyacaishica. Linísa'inaami liá Diosru sáicai, lisúbirreda jíni, jáiwa liá nalí jíni náa'a lishínaa éewidenaicoo quéewique'e nachújida chóniwenai íyani. 
LUK.9.17	Náa'a chóniwenai náaya quinínamai cáashia cáawai nayá, ya néenaa náawaqueda doce canasta liá'a máacaderricoo léenaamica.
LUK.9.18	Áabai éerri Jesús óractau liyá bácai ya lishínaa éewidenaicoo yáainai liájcha, lisáta'ee léemiu nayá:
LUK.9.18	—¿Tána chóniwenai ma nunácuchai tánashia nuyái?
LUK.9.19	Néeba'ee lichuáni:
LUK.9.19	—Áabi máinei jiyáca'ee Juan Bautista, áabi máinei jiyáca'ee Elías, ya áabi máinei jiyáca'ee liá'a báqueerri íiwadedeerrimi Dios chuáni báinacu éejuerri'eewoo licáwiacoo.
LUK.9.20	Ne Jesús éejoo'e lisáta léemiu nayá:
LUK.9.20	—Ya iyá, ¿tána imácai tánashia nuyái?
LUK.9.20	Jáiwa'ee Pé'eru éebai:
LUK.9.20	—Jiyáwa liérra Mesías
LUK.9.21	Ne Jesús má'ee nalí jiní béecha íiwerri liyácani liyáwa Mesías. 
LUK.9.22	Limá'ee nalí linácu cháu:
LUK.9.22	—Nuyá Washiálicuerri Dios Cúuleeca, arrúnai'inaa nusúfria bájialanaa, ya nacháaniminaajoni náa'a salínaica, ya nawácanai náa'a sacerdótebinica, ya náa'a quéewidanica ley shínaabinica. Náiinuaminaajoni, ne matálii éerri rícula nucáwiaminaujoo.
LUK.9.23	Néenee limá nalí quinínama:
LUK.9.23	—Ne áicta wówerri já'a limédacoo nushínaa ewidenaicooyu, limíya máechau liyá jájiu liwánacaalacoo, ya línda Dios wánacaala licáwica nácu éerri jútainchu, liyá lichúni carrúni jináatau'inaa ya máanali liyá nunácueji. 
LUK.9.24	Jiníwata liá'a caníinai cába licáwicau líta'aa liéni éerrica, liúca licáwicau jócai amáarra, ne liá'a jócai caníinaa cába licáwicau lítacha liéni éerrica nunácueji, ligáanaminaa lirrúwoo liá'a cáwicashi jócai amáarra. 
LUK.9.25	¿Tána lishírbia lirrú liá'a washiálicuerrica ligáanacta quinínama éerri rícu sái yáca, ya liúca lishínaa licáwicau ya licáarraliau liyá jájiu? 
LUK.9.26	Ne tánashia báiyii nunácueji ya nuchuáni nácueji, nuyá lécchoo Washiálicuerri Dios Cúuleeca báiminaa nuíiwa lináawa lécchoo, jáicta nuíinujoo quinínama nucáamarra yáajchau, ya nusálijinaa cáamarra ya liwítee yáajchau, ya náa'a majíconaa ángelbini shírruedenai nulí. 
LUK.9.27	Ne yáawaiyii numá irrú áabi néenaa náani yáainai áani nunáneewa, jócuminaa máanali nayá cáashia nacába liá'a Dios wánacaalactaca.
LUK.9.28	Liáwinaami ocho éerri néenee litáaniactami liyá nalí, Jesús íirrau áabai dúuli ítala li'óracoo, natálideda liyá Pé'eru, Santiago ya Juan. 
LUK.9.29	Ne nácula li'óracta liyáca, lináni cábacanaa báwachau, ya líibala náawau cabálai ya úcuni lécchoo. 
LUK.9.30	Jáiwa najiáu lirrúi chámata washiálicuenai natáania nayá liájcha. Náawa'ee Moisés ya Elías. 
LUK.9.31	Yáainai nayáca natéeji áabai cáamarrashi úcuni sáictai wérri, ya natáania linácu liá'a Jesús máanalicaica licúmpliani'inaaca Jerusalén néerra. 
LUK.9.32	Áawita Pé'eruca ya náa'a limánabacaca cadájuni wérri nayá, jáiwa cáwi nayácai, nacába Jesús cáamarra ya náa'a chámata washiálicuenai yáainai liájcha néeni. 
LUK.9.33	Qéecha'inaami náacoo náacuwai náa'a washiálicuenaica Jesús yúcha, limá'ee Pé'eruca Jesúsru:
LUK.9.33	—Quéewidacai, ¡sáictai walí wayáca áani! Waméda'aa matálii cuíta rími: áabai jirrú, áabai Moisésru ya áabai Elíasru.
LUK.9.33	Ne Pé'eru jócai yáa léenaa tánashia limácai. 
LUK.9.34	Nácula litáania liyáca, áabai sáanai yúrrucoo libáya nayái, nacába'inaami sáanai dájida nayái, jáiwa cáarru nayái. 
LUK.9.35	Néenee sáanai íbeeji lijiáu áabai chuánshi máirri'e: “Léewa Nucúulee, nuníwani, éemiu lirrú.”
LUK.9.36	Linísa'inaa néemi liá'a chuánshica, Jesús máacau bácai. Jáiwa'ee náa'a éewidenaicoo jiní wérri náiiwadedacta liá'a nacábanimica liyáali éerri.
LUK.9.37	Áabai éerri rícula cajójchanaami, náurrucoo'inaamiu dúuli ítacha, chóniwenai máanabanaami jiáu najúnteda Jesús. 
LUK.9.38	Ya báqueerri washiálicuerri máidada náiibicha limá'ee cadánani wérri:
LUK.9.38	—Quéewidacai, jiméda nulí sáicai, jicábate nucúulee bácai rímii nuwáalianica. 
LUK.9.39	Áabai espíritu wínani, liwána limáidadaca ya liwána licúcunacoo ya cacálibee jiáu linúma licuéji, liwána líinuedacoo jócai liwówai limáacaca. 
LUK.9.40	Nusáta jishínaa éewidenaicoo yúcha, najédaque'e liúchani liérra espírituca, ne jócai néenaa najédaca.
LUK.9.41	Jesús éeba'ee:
LUK.9.41	—¡Wóo, chóniwenai jiníni éebidacta ya máashiicani! ¿Chacálita iwówai nuyá yáajcha mamáarraca jíni ya nuwánta yáajcha jiníni? Jínda liérra jicúuleecoo áani.
LUK.9.42	Quéecha'inaami lirrúnicoo liá'a icúlirrijuica, liá'a demonio yúca cáinabi ricúla, liwána licúcunacoo báaniu; ne Jesús cáita liá'a espíritu máashiica, jáiwa lichúni léji liá'a icúlirrijuimica, ya ta léejueda lisálijinaarru jíni. 
LUK.9.43	Ya quinínama namáacau nacáarrudacoo nacába Dios wítee máanuica.
LUK.9.43	Nacáarrudau nacábacani liá'a Jesús médanica, limá'ee lishínaa éewidenaicoo:
LUK.9.44	—Éemi sáica liéni ya u'imíya máechani: Nuyá Washiálicuerri Dios Cúuleeca, néentregaani'inaami náa'a nacáaji rícula náa'a washiálicuenaica quéewique'e naméda nuájcha léjta nawówau.
LUK.9.45	Ne nayá jócai náa léenaa néemica liá'a limánica, níwata Dios báya nawítee nájbeecha léenaa néemicani; mawí lécchoo cáarru nayá nasáta néemiu Jesús líiwaquinicta nalíni jucámarranaa.
LUK.9.46	Ya néenee náa'a éewidenaicoo nachánau najútacoo nalíwaacoo tánashia néenaa liá'a mawíyii cawéni náiibichai. 
LUK.9.47	Jesús, yá'inaami léenaa liá'a nédacanicoo nácu nayáca, liwína'ee báqueerri samálita, libárrueda'ee léema nácuu wáni. 
LUK.9.48	Jáiwa limá'ee nalí:
LUK.9.48	—Liá'a ríshibierri samálitaca nují'inaa nácu, lirríshibiaminaa nuyá, ne liá'a ríshibierri nuyá, lirríshibiaminaa lécchoo liá'a bánuerri nuyá áaqueji. Tándawa liá'a mawíyii mawéni icábaca quinínama íibichau, léewa cawénii wérri liérra.
LUK.9.49	Juan má'ee Jesúsru:
LUK.9.49	—Quéewidacai, wacába báqueerri jédeerri demonio jijí'inaa nácu, jáiwa jócu waínda limédaqui jíni, jiníwata jóca wáajcha sáini.
LUK.9.50	Jesús éeba'ee lichuáni:
LUK.9.50	—U'imáisaniani liúchani, jiníwata liá'a jócai médau wajúnta, léewa wáajcha sái liérra.
LUK.9.51	Quéecha'inaami urrúni liá'a éerrica Jesús íirractala'inaacoo áacairra, liá'a liwówa dánaniu liácoo Jerusalénra. 
LUK.9.52	Libánua libéechau catéecani chuánshi, náaque'iu áabai chacáalee júbini rícula yáainai Samaria, quéewique'e namúrru liárrui limáacacta'inaacoo. 
LUK.9.53	Ne náa'a samaritánobinica jócai nawówai narríshibiaca, náaca léenaa liácoo Jerusalénra. 
LUK.9.54	Quéecha'inaami lishínaa éewidenaicoo Santiago ya Juan cába léji liéni, namá'ee lirrú:
LUK.9.54	—Wawácali, ¿jiwówai jiwána wáurrucueda chichái áaqueji, quéewique'e wamárda nayá quinínama?
LUK.9.55	Ne Jesús náawau nanácula, jáiwa licáita nayái máashiica nawítee. 
LUK.9.56	Néenee Jesús má'ee: Nuyá jócai íinu nuá chóniwenai jíconaa, nuyá íinuerri nuwáseda nayá najíconaa yúchau. Néenee náau áabata chacáalee júbini rículai.
LUK.9.57	Nácula náau náacoo iníjbaa lícu, báqueerri washiálicuerri má'ee Jesúsru:
LUK.9.57	—Nuwácali, nuwówaicta nusíguia jiyá táshia jiáctalau jíni.
LUK.9.58	Jesús éeba'ee lichuáni:
LUK.9.58	—Náa'a iyáliduca wáalianai útawi nayácta'inaa nawówa íyabacoo ya náa'a míshiiduca wáalianai namúrrubeu; ne nuyá Washiálicuerri Dios Cúuleeca, jiní wíta wáaliacta nuwíta yáarrubai nuwówa íyabacta'inaacoo.
LUK.9.59	Jesús má'ee báqueerrirru:
LUK.9.59	—Jíinu nuíshiirricu.
LUK.9.59	Ne léeba'ee:
LUK.9.59	—Nuwácali, jínda nuáacoo quéecha nuquéni nusálijinau.
LUK.9.60	Jesús éeba'ee lichuáni:
LUK.9.60	—Jínda máanalini quénicoo nayá jájiu, ne jiyá jiáu jíiwadeda Dios wánacaalactaca.
LUK.9.61	Báqueerri má'ee Jesúsru:
LUK.9.61	—Nuwácali, nuwówai méetaa nusíguia jiyá, ne quéecha jínda nuáacoo nuíiwa nunáawau nuéenajinairru.
LUK.9.62	Jesús éeba'ee lichuáni:
LUK.9.62	—Liá'a caníinai cába éerri shínanaa, chái jicá'a liá'a tráawajeerricta liácuwani, ya licába liwójunalau, jócai éewa lipíqueda cáinabi, cháwa limédacoo chóniwerri jírra jócai'inaa sírbia Dios wánacaalactalaca.
LUK.10.1	Liáwinaami liáni, Wawácalica, liwína lécchoo áabi setenta y dos éewidenaicoo, ya libánua nayá libéechau chámatanaa, quinínama chacáalee ya júbini arrúnactala'inaa liácoo.
LUK.10.2	Limá'ee nalí: “Chái cábacanaa liá'a Dios wánacaalactaca léjta áabai finca, íchabacta banácali náawaquedani'inaa, ne náa'a tráawajadorbinica áulabani, tándawa isáta liúcha liá'a banácali wácalica, libánuaque'e íchaba tráawajadorbini náawaquedacani. 
LUK.10.3	Yáau iyá, icábateni, nubánua iyá léjta oveja béewami cháawirru. 
LUK.10.4	U'itée chácala ya warrúwa yáarrui, jiní zapatos; ya jócu ibárroo itáa déecu ijúntacta báqueerri iníjbaa lícu. 
LUK.10.5	Jáicta iwárroo áabai cuíta lícui, itáa ibéechau quéechanacu ya ta imácai: ‘sáica iyáca quinínama lirrícu liáni cuítaca’. 
LUK.10.6	Ne áicta néeni chóniwenai sáicani wítee já'a, liá'a nawítee sáicaica licúmpliaminau liyá náajcha; ne jócta sáica nawítee, jócuminaa licúmpliau nalí. 
LUK.10.7	Imáacau néeni já'a lirrícu liá'a cuítaca, ya íya ya írrau liá'a nawáaliani néeni, níwata liá'a tráawajeerrica íiwerri Dios chuáni, rúni jínerri liwéniu. U'ijínaniu cuíta jútainchu. 
LUK.10.8	Jáicta íinu áabai chacáalee rículai narríshibiacta iyá sáica, íyau tánashia náani íyai; 
LUK.10.9	ichúni náa'a bálinenaicoo néeni, ya imá nalí: ‘Liá'a Dios wánacaalactaca jái ya urrúni irrúi.’ 
LUK.10.10	Ne íinucta áabai chacáalee rícula ya jócu narríshibia iyá, ijiáyu imáidada cáaye rícula chá'a: 
LUK.10.11	‘¡Áawita liá'a pucúpucubee yáairri ishínaa chacáalee rícu, liá'a cháneerricoo wáiiba nácu, watútuda ináneewani! Yáaque'e léenaa linácu liéni, Dios wánacaalactaca jái ya urrúni irrúi.’ 
LUK.10.12	Numá irrú liyáali éerriminaa liá'a carrúnatabeeca lirrú liéni chacáaleeca mawí'inaa cacháninaca, náucha náa'a chóniwenaibini yáainai Sodoma rícu.
LUK.10.13	“¡Áchunu carrúni jináata jiyámi Corazín! ¡Áachunu carrúni jináata jiyámi Betsaida! Jiníwata á'a Tiro néeni ya Sidón néeni Dios médactata liá'a jócai nacába cáji médanicta íibini, báinacuminaata néejueda nayáwai Diosru, ya nasúwa náabalau jarrájarrai ya nawáacoo báali íibi quéewique'e náayada néejueda nayáu Diosru. 
LUK.10.14	Ne éerri amáarrau'u cáinabi liá'a carrúnatabeeca mawí'inaa cachánina irrú, náucha náa'a chóniwenai yáainai Tiro rícu ya Sidón. 
LUK.10.15	Ya jiyá, chacáalee Capernaúm, ¿jirrúminaata jéenaa jinácudacoo áacairra? ¡Jiúrrucuaminau mawí cáinacula wérri dujíwala jiúcacoo!
LUK.10.16	“Liá'a éemerri ichuáni, léemiminaa nulí, ne liá'a cháaneerri iyá, licháani nuyá; ne liá'a cháaneerri nuyá, licháaniminaa liá'a bánuerri nuyá.”
LUK.10.17	Náa'a setenta y dosca néejua'inaamiu sáicta wérri'e nawówa, namá'ee:
LUK.10.17	—¡Wawácali, áawita náa'a demonioca médenai wawánacaala najiácoo jijí'inaa nácu!
LUK.10.18	Jesús má'ee nalí:
LUK.10.18	—Jajá, yáawaiyi, ne nuyá cábeerri Wawásimi cácoo áaqueji léjta éenu íimi únia shínaaca. 
LUK.10.19	Nuyá yáirri irrú wíteeshi cadánani quéewique'e ijínanicoo áai íibi ya aquétu íibi, ya éenaque'e igáanaa quinínama danáanshi lishínaa liá'a wajínaica Wawásimica, jócubeecha liméda irrú máashii. 
LUK.10.20	Usáicta iwówa namédacala iwánacala irrú náa'a espírituca, sáicta iméda iwówau mawí jáicala ijí'inaa tánau áacairrai.
LUK.10.21	Ne liyáalimi éerri, Jesús sáictai wérri liwówa Espíritu Santoyu, limá'ee: “Nuá jirrú sáicai nusálijinaa, Wácalishi wánacaleerri áacai ya áani cáinabi íta'aa, jíyadacala nalí náa'a imíyanica liá'a báyeerrimicoo náucha náa'a yáine léenaa ya néemica. Jajá, Nusálijinaa, léewa jiwówau jáni.
LUK.10.22	“Nusálijinaa éejueda nulí quinínama. Jiní yáirri léenaa tánashia Licúulee nácu, Lisálijinaa rímii; jiní yáirri léenaa tánashia Lisálijinaa, bácai rími Licúulee yáa léenaa jáni, ne tánashia Licúulee wówaini líyadarru jíni licúnusiaque'ini.”
LUK.10.23	Lináawa'eewoo lishínaa éewidenaicoo náculau, limá'ee nalí báawachala: “Sáicta nawówa náa'a cábenai liá'a icábani iyáca; 
LUK.10.24	níwata nuíiwa irrú íchaba cáiiwadedacanimi Dios chuáni báinacu ya náa'a reybinica wówenaimi nacába liáni icábani iyáca, ne jócu nacába jíni; nawówai néemi liá'a éemini iyáca, ne jócu néemi jíni.”
LUK.10.25	Báqueerri quéewidacai ley nácu yáau litáania Jesús yáajcha, ya léenedaque'e licábau limá'ee:
LUK.10.25	—Quéewidacai, ¿tána nuéewa numédacai nuwáaliaque'e nucáwicau jócai amáarra?
LUK.10.26	Jesús má'ee lirrú:
LUK.10.26	—¿Tána jiliá'a tánerricoo ley rícu? ¿Tána léji liá'a jiliénica?
LUK.10.27	Liá'a quéewidacai ley nácu léeba'ee:
LUK.10.27	—Caníinaaminaa jicába jiwácali Dios quinínama jiwówa yáajchau, quinínama jicáwica yáajchau, quinínama jidánani yáajchau ya quinínama jiwítee yáajchau; ya arrúnaa caníinaa jicába jiyácachuni chóniwenai léjta caníinau jicába jiyá jájiu.
LUK.10.28	Jesús ma lirrú:
LUK.10.28	—Jéebani sáica liáni. Jimédacta liáni, jiwáaliaminaa jicáwicau mamáarraca.
LUK.10.29	Ne liá'a quéewidacai ley shínaaca, liwówai limáacacoo sáica, lisáta'ee léemiu Jesús limá'ee
LUK.10.29	—¿Ya tána arrúnaa nuyúdacai?
LUK.10.30	Néenee Jesús éeba'ee lirrú:
LUK.10.30	—Báqueerri washiálicuerri yáairriu Jerusalén yáajba náalicu Jericó néerra'inaa, jáiwa áabi canédibini jiáu lirrú, jáiwa nanédu jíni néedacta liá'a líibalaca; náiinueda jíni, jáiwa náawai atéwai náiinuaca. 
LUK.10.31	Chítashiawa wánaca jíni báqueerri sacerdote bésunau néenee jíni lirrícu liá'a iníjbaaca, jáiwa licába jíni, jáiwa líshiirriu liúcha liáawai. 
LUK.10.32	Cha lécchoo báqueerri néenaa náa'a levítaca libésunau néeni, ne licába'inaamini líshiirriu liúcha, jáiwa liáawai. 
LUK.10.33	Ne báqueerri washiálicuerri Samaria néenee sái yáairriu lirrícuba léja liá'a iníjbaaca, licába'inaamini, carrúni jináata licábaqui jíni. 
LUK.10.34	Lirrúniu lirrú, jáiwa liméda lídabee acéiteyu ya vino, jáiwa lidájida litúcai. Jáiwa lírda jíni lishínaa éema ítalau, litée jíni áabai cuíta rícula litúya jíni. 
LUK.10.35	Cajójchanaami, liá'a samaritánoca lijéda léjta chámai éerricta lishínaa tráawaju wéni, jáiwa liá lirrú jíni liá'a cuíta wácalica ya limá'ee lirrú: ‘Jitúya liáni washiálicuerrica, ne jigáastacta áabata mawí, nupáidaminaa jirrújoni jáicta nuéejojoo.’ 
LUK.10.36	Sáicai wérri, ¿tána néenaa náani matálitaica caníinai cába liá'a washiálicuerri canédi íinuedanimica?
LUK.10.37	Liá'a quéewidacai ley shínaaca léeba'ee:
LUK.10.37	—Liá'a carrúni jináatai cába liyá.
LUK.10.37	Jesús má'ee lirrú:
LUK.10.37	—Ya jiáu jiméda chacábacanaa.
LUK.10.38	Jesús síguia lishínaa iníjbau (náajcha náa'a lishínaa éewidenaicoo) jáiwa liwárroo áabai chacáalee rími, báquetoo íinetoo yácta jí'ineechoo Marta rurríshibia liyá rúbana rícula. 
LUK.10.39	Marta wáalia báquetoo ruéenajetoo jí'ineechoo María, wáaichoo ruyáca Jesús íiba néeni ruéemique'e liá'a limáni liyáca. 
LUK.10.40	Ne Marta urrúniu wówa linácu liá'a íchaba arrúnai'inaa rumédaca, tándawa rurrúniu Jesúsru rumá'ee lirrú:
LUK.10.40	—Nuwácali, ¿jiní wéni jirrú nuéenajetooca rumáacau'u nuyá bácai quinínama liájcha liáni tráawajuca? Jíiwa rulíni, ruyúda'aa nuyá.
LUK.10.41	Ne Jesús éeba'ee rulí:
LUK.10.41	—Marta, Marta, urrúni jiwówa ya máashii jiwówa íchaba jishínaa nácueji. 
LUK.10.42	Ne ái áabai mawíyii chúnsaica já'a. Maríaca ruwína mawíyii sáictaca, ya jiní'inaa éenaa léeda rúcha.
LUK.11.1	Báitate Jesús órau liyá áabai yáarruishimi, ne quéecha'inaami linísa li'óracuwai, báqueerri néeenaa náa'a lishínaa éewidenaicoo má'ee lirrú:
LUK.11.1	—Wawácali, jéewida wa'óracoo, léjta Juan éewidau'u lishínaa éewidenaicoo.
LUK.11.2	Jesús má'ee nalí:
LUK.11.2	—Jáicta i'órawai imá chá'a:
LUK.11.2	‘Wasálijinaa yáairri áacairra, chóniwenai cáarru nacába jijí'inaa.
LUK.11.2	Jíinu chérra liá'a jiwánacaalactaca.
LUK.11.3	Jiá walí íyacaishi warrúnaani éerri jútainchu.
LUK.11.4	Jimíya máecha wajíconaa níwata wayá lécchoo wamíya máecha najíconaa quinínama náa'a médenai walí máashii.
LUK.11.4	Jáicta máashii íinu wáatalai ujínda wacácoo jíconaashi rícula.’
LUK.11.5	Jesús má'ee lécchoo nalí:
LUK.11.5	—Wamáacate báqueerri éenaa wáalierri báqueerri lijúnicaiu, yá'ee béewami táayebee'inaa liá'eewoo jíibana néerra ya limá'ee jirrú: ‘Nujúnicai, jiprésta nulí matálii páani, 
LUK.11.6	níwata báqueerri nujúnicai chóca rímii nísa líinu déecucheji núbana néerra, ya jiní nuwáaliani nuáni'inaa lirrú.’ 
LUK.11.7	Ne yáawaiyi jócta léeba jichuáni cuíta lícucha limáminaa jirrú: ‘Ujijódia nuyá, cuíta núma báyeerriu, ya nuéenibi ya nuyájani rúwacuwai; jócu nuéewa nubárruacoo nuá jirrúni.’ 
LUK.11.8	Ne numá irrú áawita jócu libárroo liá irrúni liá'a jirrúnaanica áawita jijúnicaicani, liáminaani jimésudacta liwówa, ya liáminaa jirrú quinínama liá'a jirrúnaanica. 
LUK.11.9	Tándawa numá irrú: Isátau, ya Dios yáaminaa irrúni; imúrru, ya íinuminaa linácu; imáida cuíta náanibala, ya liméecuminau irrú. 
LUK.11.10	Jiníwata liá'a sáterrica, lirríshibiaminaani; ya liá'a múrruerricani, líinuminaa linácu; ya liá'a máiderri cuíta núma lícu, liméecuminau lirrú.
LUK.11.11	“¿Áiminaa báqueerri éenaa já'a cacúulectani, ya licúulee sátacta liúcha áabai cubái, léenaaminaa liá lirrú bácua áai? 
LUK.11.12	¿O lisátawee jiúcha bátui éewishi, éenaaminaa jiá lirrú áabai aquétu? 
LUK.11.13	Ne iyá máashiicani séewirri, yáaine léenaa yáa éenibirru sáicabeeca, ¡chítashia ta mawí jíni Isálijinaa yáairri áacai liáminaa irrú Espíritu Santo isátacta liúchani!”
LUK.11.14	Jesús jéderrite liyáca áabai demonio báqueerri washiálicuerri wáneerrite limáacacoo manúma; ne quéecha'inaami lijiácoo liá'a demonioca, jáiwa léewa litáaniacai. Náa'a chóniwenai nacáarrudau nacábacani. 
LUK.11.15	Ne áabi má'ee: “Beelzebú, demonio wácalica, léwa cha yáa lirrú liwíteu liáni washiálicuerrica léewaque'e lijéda demonio.”
LUK.11.16	Ne áabibi, namédaquini'e lirrú áabai trampa, nasáta'ee liúcha áabai jócai nacába cáji áaqueji. 
LUK.11.17	Ne Jesús, liáca'e léenaa liá'a nédacanicoo nayá nácu, limá'ee nalí:
LUK.11.17	“Quinínama país nashírrictau nayá wáacoo, ya máashii nacába yáacacoo, jócani éewa nayá jájiu, ya náa'a chóniwenai jócuminaa nayá sáica nayá wáacoo, cháiminaa cábacanaa nalí, léjta áabai néenajinai náiinua yáacaminau nayá wáacoo. 
LUK.11.18	Cháminaa cábacanaa, Wawásimi máashiiquicta licába yáacacoo liyá jájiu, ¿chíta quéewau'u cadánani liwítee cábacoo jíni? Numá irrú liáni, imácala jáica nujéda demonio Beelzebú wítee dánaniyu. 
LUK.11.19	Ne cháctacalani, ¿tána yáa ishínaa chóniwenai irrúi wíteeshi danáanshi najédaque'e demonio? Tándawa, nayá jájiu náayada liá'a yáawaiyica, ne iyácala yúquenaeu iyáca. 
LUK.11.20	Jiníwata nuyácta jéda demonio numédani nuyáca Dios wíteeyu, liáni wówerri limáca Dios wánacaalactaca jái íinu irrúi.
LUK.11.21	“Áicta báqueerri washiálicuerri cadánani já'a ya liwáalia íchaba arma ya litúya líibanau, liá'a liwáaliani líibana lícuu jiní éenaa linédu liúcha. 
LUK.11.22	Ne áicta báqueerri íinuerri liyáctalaca mawí cadánani liúcha ya ligáanani, léeda liúcha lishínaa ármami liwínani liwówau nácula, ya quinínama línda litée liá'a liwáalianimica limédaque'e léjta liwówau'u.
LUK.11.23	“Liá'a yáa nuájcha áabenaa, léewa nujínai liérra, ne liá'a jócaicta yáawaqueda nuájcha, léewa cacáarraliacai liérra.
LUK.11.24	“Jáicta áabai espíritu máashii jiáu báqueerri washiálicuerri yúchai, jínaneerriu yáarruishi máacarractaca limúrru liwówa íyabacta'inaacoo; ne jinícta líinuctani, lédacanictau lirrúwoo: ‘Nuéejoctawai núbana rículau nujiáctejimicoo.’ 
LUK.11.25	Jáicta léejuawai, líinu linácu liá'a washiálicuerrica léjta áabai cuíta máisai jíchuderriu ya nachúndadanini sáica. 
LUK.11.26	Néenee liáu liáwaqueda siete espíritu lítalau mawíni máashiicaca liúcha, ya quinínama nawárruau nayá liwówa lícu liá'a washiálicuerrica, mawíque'e nawána máashii wérri liyá quéecha yúcha.”
LUK.11.27	Nácula Jesús táania liyáca linácueji quinínama liáni, báquetoo íinetoo chóniwenai íibicha rumáidada'ee rumáca:
LUK.11.27	—¡Sáicta ruá'a íinetooca cúlicuechoo jiyá ya rudáwinaa jiyá!
LUK.11.28	Jesús éeba'ee:
LUK.11.28	—¡Sáicta mawí tánashia liá'a éemerri Dios chuáni, ya liméda liwánacaala!
LUK.11.29	Náa'a chóniwenai máanabacanaamica náawaca'eewoo Jesús téeji, jáiwa lichánau léewida nayái limá'ee: “Náani chóniwenai chóque'e sánaca bájialani máashiicaca; nasáta'ee ya nawówai nacába jócai nacába cáji, ne Dios jócai éejoo liméda nalí léjta limédau Jonás yáajcha. 
LUK.11.30	Ne léjta Jonás liyá señal nalí náa'a chóniwenai yáainemi Nínive, chacábacanaa lécchoo nuyá Washiálicuerri Dios Cúuleeca, núyadaminaa nuyáu léjta áabai señal nalí sána'inaa náa'a chóniwenai chóque'e sánaca'a. 
LUK.11.31	Jáicta amáarra cáinabijoo limáidacta'inaa quinínama náani chóniwenai chóque'e sánaca, rubárruaminau ruá'a reinaca íinuechoomi déecucheji rumáminaa jóca sáica nayáca; jiníwata ruyá íinuechoo déecucheji wérri bájirra cáinabi íteeji, quéewique'e ruéemi Salomón wíteeca, ne nuyá yáairri yáajcha chóca rími áani, mawíyii cawéni Salomón yúcha. 
LUK.11.32	Chacábacanaa lécchoo jáicta amáarra cáinabijoo, nabárruaminaujoo náa'a Nínive sánaca quéewique'e namá náani chóniwenai jócani sáicayaca; níwata náa'a Nínive sánaca, néemi'inaami Jonás chuáni, jáiwa néejoo Diosrui, ne nuyá yáairri chóca rími áani, mawíyii cawéni Jonás yúcha.
LUK.11.33	“Jiní túculierri áabai lámpara ya ta libáyaqui jíni, jiní limáacalani áabai cajón yáajabani, limáacaminaani áacai, quéewique'e náa'a wárruenaicoo nawáalia jucámarrabee. 
LUK.11.34	Jituí chái cábacanaa léjta áabai lámpara jináanairru; sáicaquicta jituí, quinínama jináanai liwáaliaminaa jucámarrabee; ne máashictani, quinínama jináanai yáairri catáwacacta. 
LUK.11.35	Jicáwaa jiúchaujoo quéewique'e liá'a jucámarrabee yáairri jinácu, jócu lináwau catáwacabeeyu, quéewique'e quinínama liá'a jimédanica lijiáque'iu jirrú sáica. 
LUK.11.36	Ne quinínama jináanai liwáaliacta jucámarrabee sáicaica, jiní éewo'u jiyá catáwacacta, jicábaminaa quinínama jucámarranaa liá'a jimédanica, léjta áabai lámpara jáicta liquénai quinínama cábani cámarraa.”
LUK.11.37	Quéecha'inaami Jesús nísa litáaniacai, báqueerri fariseo cúmida líya líibana néerra, jáiwa Jesús wárruau liwáacoo mesa nácula. 
LUK.11.38	Liá'a fariséoca, licáarrudau licába jóca liméda liwánacaala liá'a nawítee nabádeda nacáajiu jóctanaa náayaa. 
LUK.11.39	Ne Jesús má'ee lirrú:
LUK.11.39	—Iyá fariséobinica méetuedenai líteeji liá'a básoca ya mitájia, ne iwówa lícu cashiámui yáca liyú liá'a shínaashica inédunica ya liá'a iwítee máashiica. 
LUK.11.40	¡Chóniwenai jócani éewa nédacanicoo sáica! ¿Jócu yáa léenaa liá'a méderri bináawe sái ya liméda liá'a yáairri lirrícu lécchoo? 
LUK.11.41	Yáa ishínau limósnau liá'a yáairri iwówa lícu, cháminaa limáacacoo masácula.
LUK.11.42	“¡Ái éenaa já'a carrúni jináatani'inaa iyá fariséobinica! shírrenai Diosru diésnaa méenaami éenaa áabata méenaami éenaa liá'a ibánacalaca píituinamai jí'ineerri menta, ya ruda ya quinínama méenaami banácali júbinica, ne jócani méda machácanica ya caníinaabeeca Diosru. Léewa éewani iméda liárra, ya jócu imáaca iméda lécchu liá'a áabataca.
LUK.11.43	“¡Ái éenaa já'a carrúni jináatani'inaa iyá, fariséobinica! wówenai iwáalia yáarrubaiu mawí cawéninamaica sinagoga rícu, ya iwówai chóniwenai natáa irrú sáicai wérri cáaye rícuba.
LUK.11.44	“¡Ái éenaa já'a carrúni jináatani'inaa iyá cháni cábacanaa léjta útawi máanalini yáarrui, jócai íyadau chóniwenai tuírricu, náa'a chóniwenai báawedani jócta náa léenaa jíni!
LUK.11.45	Néenee báqueerri quéewidacai ley shínaa éeba'ee, limá'ee:
LUK.11.45	—Quéewidacai, liéni jimáni jiyá nalí náani, jócai sáica cáacoo walí lécchoo.
LUK.11.46	Ne Jesús má'ee:
