ACT.9.14	Chóque'e íinuerri áani, nawánacaala nácu náa'a sacerdótebini wácanaica, natéeque'e preso quinínama náa'a mánulicuenai jijí'inaa.”
ACT.9.15	Ne liwácali ma lirrú: “Jiá namówai, léca liérra washiálicuerrica nuníwani litáaniaque'e nují'inaa áabi chóniwenairru bájirra cáinabi ítala, ya nashínaa reybinirru, léquichu israelítabinirru. 
ACT.9.16	Nuyá núyadaminaa lirrú máanui carrúni jináatau'inaa liyá nunácu.”
ACT.9.17	Ananías yáu chalée cuíta néerra Saulo yáctaca. Liwárrua'inaami liácoo limáaca licáajiu linácu, ya limá lirrú:
ACT.9.17	—Nuéenajirri Saulo, liá'a nuwácali Jesús, liá'a jicábanimi iníjbaa lícu jíinuctani, jiácoo nuyá libánuani jéewaque'e jicába báaniu, quéewaque'e cashiámu jimáacacoo Espíritu Santoyu.
ACT.9.18	Néenimichu licáu Saulo tuí rícueji jicá'a chíchubeshi, jáiwa léewa licábacai. Jáiwa libárruawai libáutisawai. 
ACT.9.19	Jáiwa líyai, jáiwa cadánani jíni, jáiwa limáacau píitui éerri rími náajcha náa'a éebidenai Dios chuáni nácu Damasco rícu.
ACT.9.20	Liáwinaami Saulo lichána íiwa Dios náawa sinagoga lícu, Jesús liá'a Dios Cúuleeca. 
ACT.9.21	Quinínama náa'a éemenaicani nacáarruda'eewoo néemicani, ya namá'ee:
ACT.9.21	—¿Jócai liyá léji liéni cánaquedeerri Jerusalén rícu liáni náa'a táanianai Jesús chuáni nácu? ¿Jócai liyá báaniu léji liéni chái íinu áani liwína preso náa'a éebidenai Jesús nácu, litée léejuedaque'e nayá sacerdótebini wácanairru?
ACT.9.22	Ne liá'a Saulo táanierri ne jócai cáarrunaa, limáaca nayá mawítee náa'a judíobini yéenai Damasco rícu, íiyaderri yáawaa lé'e liá'a Jesús léewa'ee Mesías liárra.
ACT.9.23	Jái'inaami íchaba éerri bésunawai, náa'a judíobini natáania nayá wáacoo náiinuaque'e Saulo. 
ACT.9.24	Jáiwa liá léenaa jíni. Éerrinacu ya táayee nanénda liyá linúma lícu liá'a chacáaleeca náiinuaque'ini. 
ACT.9.25	Ne náa'a éebidenai Jesús nácu namáaca liyá áabai canasto máanui rícu, ne áabai táayee náurrucueda liyá bádanicaishi máanui ríjcuederri chacáalee. Cháwa limánicoo jírra.
ACT.9.26	Jái'inaami líinu Saulo Jerusalén néerra, liwówai liáawacacoo náajcha náa'a éebidenai Jesús nácu; ne nayá quinínama cáarru nacába liyá, jiníwata jócai néebida Pablo yáawaiyi máacaca liwówau Jesús nácu lécchoo. 
ACT.9.27	Ne jáiwa Bernabé tée jíni, líyada apóstolubinirru jíni Saulo cába'ee Jesús iníjbaa lícu, jáiwa'ee liwácali Jesús táania lirrú, né'e Damasco rícu Saulo íiwa'ee Jesús nácu jócai cáarrunaa. 
ACT.9.28	Jáiwa Saulo máacawai Jerusalén rícu, ya jínaneerriu náajcha. Táanierri liwácali Jesús nácu cadánani liwówa. 
ACT.9.29	Táanierri náajcha ya méda yáaquerri náajcha judíobini náa'a táanianai Griego; ne náani nawówaini náiinuaca. 
ACT.9.30	Náa'a áabi éebidenai Dios chuáni, náa'a náa léenaa nawówai náiinuacani, natée Saulo lirrícula liá'a chacáalee jí'ineerri Cesarea, néenee nabánua liyá chacáalee jí'ineerri Tarso.
ACT.9.31	Néenee liá'a iglésiaca, quinínama liá'a cáinabica Judea shínaaca, Galilea shínaaca ya Samaria chaiwíteemi yácajaa, ya mamáarracai dáwinacoo Dios wíteeshi nácu. Yáainai carrúicai yáajaba nawácali Jesús nácuu, ya liyúda liyá liá'a wíteeshi Espíritu Santoyu, mawí dáwinacoo liácoo namáanabacoo náa'a éebidenai Jesús nácu.
ACT.9.32	Pé'eru, jínaneerriu íchaba cáinabi ítaba, licábaque'e liácoo náa'a éebidenaica wawácali Jesús nácu. Áji éerri léquichoo liáu licába náa'a éebidenai Jesús chuáni nácu yéenai chacáalee rícu jí'ineerri Lida. 
ACT.9.33	Néeni líinu báqueerri washiálicuerri jí'ineerri Eneas, jái'e liwáalia ocho camuí liyá yáarrubaishi íta'aa, macáwai. 
ACT.9.34	Pé'eru ma lirrú:
ACT.9.34	—Eneas, Jesucristo chúneerri'inaa jiyá. Jibárroo ya jichúni jiárrubaimiu.
ACT.9.34	Eneas bárroowai cawíquinta. 
ACT.9.35	Ya náa'a yéenai quinínama Lida néeni ya Sarón rícu nacábani bárroo quinínama, jáiwa néejueda nayáu Nawácali Jesúsru.
ACT.9.36	Liyáali éerri liyáte lirrícu liá'a chacáaleeca jí'ineerri Jope, báquetoo éebidechoo Jesús chuáni jí'ineechoo Tabita, griego liwówayu limáca Dorcas. Ruáni íinetooca ruméda séewirri sáicai ya ruyúdaca náa'a carrúni jináatanica. 
ACT.9.37	Liyáali éerrica, ruá'a Dorcas rubálinawai néenee máanali ruyái. Rumáshicaimi nanísa'inaa nabádedaqui jíni, namáaca ruyá áabai cuarto rícu áacai piso rícu. 
ACT.9.38	Jope yéerri urrúni Lida, Pé'eru yáctaca; ne náa'a náa léenaa náa'a éebidenai Jesús chuáni, Pé'eru néeni yáca, nabánua chámata washiálicuenai náiiwa lirrú: “Jíinu chérra Jope néerra madéjcanaa.”
ACT.9.39	Ya Pé'eru yáairriu náajcha. Líinu'inaami néerra natée liyá cuarto licúla ruyácta ruá'a mashíquishimi. Ne nayá quinínama náa'a íinaca máanirrinica yáainai Pé'eru téji náichaca, náyada náabalau ya natúnicue Dorcas médanimi'e quéecha'inaa'ee cáwi ruyá. 
ACT.9.40	Pé'eru wána najiácoo quinínama, jáiwa litúyawai ya lisáta Dios; néenee licába ruá'a máanaliuca, limá:
ACT.9.40	—¡Tabita, jibárroo!
ACT.9.40	Ruyá ruméecoo rutuíu, rucába'inaa Pé'eru jáiwa ruwáawai. 
ACT.9.41	Jáiwa liwína rucáaji nácu libárrueda ruyá; jáiwa limáida náa'a éebidenai Jesús chuáni ya náa'a máanirrinica, líyada ruyá cáwiu. 
ACT.9.42	Liéni quinínama náa léenaa chacáalee Jope shínaaca ya íchaba éebida wawácali Jesús. 
ACT.9.43	Pé'eru máacau néeni íchaba éerri lirrícu liá'a chacáaleeca, áabai cuíta báqueerri íibana cachúnicai íimanaashi jí'ineerri'e Simón.
ACT.10.1	Liyáte chacáalee jí'ineerri Cesarea, báqueerri washiálicuerri jí'ineerri Cornelio, wánacaleerri áabi soldado jí'ineenai Italiano. 
ACT.10.2	Báqueerri washiálicuerri sáicai wérri, quinínama léenajinai yáajcha liá sáicai Diosru. Yáirri manuába warrúwa lécchoo liyúdaque'e náa'a judíobini carrúni jináatanica, ya séewirri lisáta Dios lécchoo. 
ACT.10.3	Áabai éerri táicalate las trésmi, licábate lituírricu sáiu:
ACT.10.3	Licába jucámarranaa báqueerri ángel Dios shínaa, liwárroo liyáctala limá lirrú: “¡Cornelio!” 
ACT.10.4	Jáiwa Cornelio cába lítalai liá'a ángel, licáarruni íibejiu lisáta léemiu liyá: “¿Tána jiwówai, nuwácali?” Ángel ma lirrú: “Dios éemi jichuáni ya licába lécchoo liá'a jimédani náajcha náa'a jiyúdacala carrúni jináatani. 
ACT.10.5	Jibánua báqueerri liá'a chacáalee jí'ineerri Jope jiwánaque'e líinu liá'a Simónca, ya áabai lijí'inaa lécchoo Pé'eru. 
ACT.10.6	Ái yéerri áabai cuíta rícu báqueerri jí'ineerri Simón, báqueerri cachúnicai íimanaashi yéerri manuá tácoowa.”
ACT.10.7	Jái'inaa ángelmi yáawai liá'a táania rími lirrú, Cornelio máida chámata cashírruedacani ya báqueerri soldado bájialai éebidaca ya liá'a líisainica. 
ACT.10.8	Liáwinaami'inaa líiwa nalí jíni libánua nayá chacáalee jí'ineerri Jope.
ACT.10.9	Cajójchanaami, léjtaminaa wíyaicumi, nácula náawa iníjbaa urrúni Joperru, Pé'eru íirrau lisáta Dios cuíta juátaba lícu. 
ACT.10.10	Sámui wówa ne liwówai'e líyaca, nácula naméda nayá líya, licába'ee lituírricu sáiu: 
ACT.10.11	licába'ee éerri méecucoo lirrú, yá'ee liúrrucocoo lirrú cáinabi ítala, áabai újni sábanaca máanui bájerriu quinínama náa'a cuatro lijuátaca. 
ACT.10.12	Líibi liá'a sábanaca nayá'ee quinínama cuéshinai cábacanaa náa'a wáalianai cuatro náibau, ya lécchoo náa'a cuéshinai yáarrudenaicoo ya lécchoo náa'a míshiiduca. 
ACT.10.13	Pé'eru éemi áabai chuánshi máirri lirrú: “Jibárroo Pé'eru, jíinuani ya jíyani.”
ACT.10.14	Pé'eru éeba'ee lichuáni: “Jócai, nuwácali, nuyá jócai íyacaji íyacaishi casáculai, jócaimi línda wáaya liá'a ley Moisés shínaaca.” 
ACT.10.15	Léemi lichuáni wítama báaniu, limá lirrú: “Liá'a Dios yáni jí'inaa sáicai, ujimá máashiicalani.”
ACT.10.16	Jái matálichu libésunacuwai, jáiwa sábana íirrau báaniu áacairra. 
ACT.10.17	Pé'eru urrúni wérri wówa, limá'ee lirrúwoo chítashia liwówau limá jiliérra liá'a licábaniu lituírricu, náiinu'inaami néerra náa'a Cornelio shínaa washiálicuenai cuíta núma néeni, sátenai'e náacoo néemiu Simón íibana nácu. 
ACT.10.18	Náiinu'inaa néerra, nasáta néemiu cadánani, jáicta'ee néeni liérra jí'ineerri Simón, chái namájirru lécchoo lijí'inaa Pé'eru.
ACT.10.19	Ne nácula Pé'eru újnibi édacanirriu liyáca linácu liá'a licábani lituírricuu, liá'a Espíritu Santoca limá lirrú: “Jicábateni, matálitai washiálicuenai namúrru jiyá. 
ACT.10.20	Jibárroo, jiúrrucoo jiáu náajcha ujiásacala, jiníwata nuyáwa bánua nayá.”
ACT.10.21	Pé'eru yúrrucoo limá nalí náa'a washiálicuenaica:
ACT.10.21	—Nuyáwajani liá'a chái imúrruca. ¿Tána íinu imédacai?
ACT.10.22	Nayá néeba chá'a:
ACT.10.22	—Wayá íinuenai liwánacaala nácu liá'a Cornélioca, báqueerri washiálicuerri majíconai, yá'ee sáicai wérri Diosru. Quinínama náa'a judíobini cawáuntani ya nawówaini. Báqueerri ángel Dios shínaa limá'ee lirrú, quéewiquini'e limáida jiyá jiáqueni'eewoo líibana néerra, léemiquini'e jirrú tánashia jimáni'inaa lirrú.
ACT.10.23	Néenee Pé'eru wána nawárruacoo, jáiwa namáa néeni liyáali táayee. Cajójchanaami, jáiwa Pé'erumi yáu náajcha, ya áabi mawí éebidenai Dios chuáni Jope néenee sána, yáau liájcha.
ACT.10.24	Néenee cajójchanaami náiinu Cesarea néerra, chalée Cornelio néndactala liyá nayá, náajcha náa'a áabi chóniwenai léenaaja, ya lijúnicai urrúni rími, nayá'ee náa'a Cornelio máidani'inaica. 
ACT.10.25	Quéecha'inaami Pé'eru íinu líibana néerra, jáiwa Cornelio jiáu lijúntedacani, jáiwa litúyawai lináneewa liá lirrú sáicai. 
ACT.10.26	Pé'eru nácuda liyá limá lirrú:
ACT.10.26	—Jibárroo jíibayu, nuyá chái washiálicuerri lécchoo jicá'a jiyá.
ACT.10.27	Nácula litáania liácoo liájcha, liwárroo'inau liácoo líinu íchaba chóniwenai yáainai macábaita. 
ACT.10.28	Pé'eru ma nalí:
ACT.10.28	—Iyá yáine léenaa liá'a judíobini wítee jócai línda liyá litáania áabi chóniwenai yáajcha ya nawárroo'inau áabi íibana licúla. Ne liá'a Dios éewiderri nuyá jócubeecha nují'inaa máashiicai nuyá ya jócubeecha casácula nuyá quiní chóniwenairru. 
ACT.10.29	Tándawa, náiiwa'inaa nulí jíni, nuíinu'inaa jócaita nuíinuque'e numéda nuyá máashiica. Nuwówai nuá léenaa tándashia namáida nuyá.
ACT.10.30	Cornelio éeba jíni:
ACT.10.30	—Jái cuatro éerri néenee, léeminaa hóraa léja liáni, nuyá yáairri núbana rícuu yúnerri nuyáca ya méderri oración liyáali táicala, jáiwa báqueerri washiálicuerri íyadau nulí balíbali íibala. 
ACT.10.31	Limá nulí: ‘Cornelio, Dios éemi jishínaa jisátaucoo, lédacani'eewoo linácu liá'a jiyúdayu náa'a carrúni jináatanica. 
ACT.10.32	Jiwána líinu jiliá'a chacáalee jí'ineerri Jope, jiwána líinu néenee liá'a Simónca, liyá chái jí'inaa lécchoo Pé'eru. Ái ya Simón íibana rícu lécchoo, báqueerri cachúnicai íimanaashi yáairri manuá tácoowa.’ 
ACT.10.33	Tánda nuwána nácu namúrru jiyá madéjcanaa, ne jiyá nuáni léenaa méda jiliérra. Wayá náani ya áani quinínama Dios náneewa, ne wawówai wéemi jirrú liá'a wawácali bánuani jíiwa walí.
ACT.10.34	Jáiwa Pé'eru lichána táania liyácai, limá cháa:
ACT.10.34	—Ta nuá léenaa yáawaiyi Dios jócai cába báawacha áabi chóniwenai yúcha, 
ACT.10.35	jócta matuínaami cáinabi ítabaa liwínani nanácucha náa'a éebidenaicani náa'a cawáuntai liyá ya naméda sáicai. 
ACT.10.36	Dios táania nalí náa'a Israel táqueenairru, íiwenai chuánshi sáitacta nawówa Jesucristo chuániyu, léwa'ee quinínama Wácali. 
ACT.10.37	Iyá yáinai léenaa sáica linácu liá'a bésuneerricoo quinínama liá'a cáinabica nashínaa náa'a judíobinica, lichána á'a Galilea néerra, liáwinaami liá'a Juan íiwanaa liá'a narrúnaa nabáutisacoo. 
ACT.10.38	Yáa léenate liá Dios cashiámui liwíteeyu, ya Espíritu Santoyu liá'a Jesús Nazaret néenee sái, ya liá'a Jesús jínaneerriu liméda sáicai, ya lichúnica náa'a quinínama náa'a carrúni jináatanica lirrú liá'a lidánaniyu liá'a Wawásimica. Léewa liméda liáni jiníwata Dios yáani yáajcha. 
ACT.10.39	Wayá lécchoo wacábani quinínama liá'a limédanica liá'a Jesúsca á'a líta'aa liá'a Judeaca ya á'a Jerusalén rícu. Liáwinaami liá'a náiinua jíni, nacuájidani áabai cruz nácu. 
ACT.10.40	Né'e Dios cáweda jíni matáli éerri rícula, jáiwa liméda líyadawai walí. 
ACT.10.41	Jócai íyadau quinínama chóniwenairru, walí rímija, náa'a Dios níwanica quéecha náa'a quéewique'e wáiiwa quinínama wáyu léenaa linácu. Wayá íyenai ya wáirra liájcha liáwinaami liá'a licáwia'inau. 
ACT.10.42	Liyá bánua wayá wáiiwaque'e chóniwenairru, lé'e liá'a Dios máacanica nawácali náa'a chóniwenaica, cáberri liá'a máashiica ya liá'a sáicaica cáberri'inaa cáwinica ya náa'a máanalinica. 
ACT.10.43	Quinínama náa'a íiwadedenai Dios chuáni báinacu náa'a táanianaica Jesús nácu, ya namá lécchoo tánashia náa'a éebidenai linácu, narríshibia'ee linácu méetuerri'inaa najíconaa —Pé'eru má'ee nalí.
ACT.10.44	Újnibi Pé'eru táanierri liyáca, liyáali éerri Espíritu Santo íinu náta'aa náa'a éemenai nayáca liá'a Dios chuáni líiwani liyá nácu. 
ACT.10.45	Ya náa'a éebidenaica Dios chuáni nácu natáqueenaibiminaa israelítabini, íinuenai Pé'eru yáajcha, nacáarruda'eewoo nacábacani Espíritu Santo wínaca nayá lécchoo náa'a jócani judíobini, 
ACT.10.46	néemi'e natáania áabi chuánshi báawataiyu, ya naméda sáicai Diosru. 
ACT.10.47	Néenee Pé'eru má'ee:
ACT.10.47	—¿Ya nayá jócani'eewoo lécchoo nabáutisacuwai, náani chóniwenaica cháni ríshibia Espíritu Santo léjta wayá?
ACT.10.48	Jáiwa libánua nayái nabáutisaque'iu lijí'inaa nácu liá'a Jesucristoca. Liáwinaami náa'a chóniwenaica namá lirrú quéewique'ini'e limáacacoo náajcha áabi éerri rími mawí.
ACT.11.1	Náa'a apóstolubinica ya náa'a néenajinai yáainai Judea rícu néemi'e chuánshi lécchoo náa'a jócai judíobini nawína'ee Dios chuáni lécchoo. 
ACT.11.2	Ne Pé'eru éejoo'inau Jerusalén néerra, natáania máashii linácu náa'a éebidenai Dios chuáni natáqueenaibimi náa'a israelítabini. 
ACT.11.3	Nasáta léemiu liyá:
ACT.11.3	—¿Tánda jiwárroo náiibirra náa'a jócani judíobini, jáiwa jimáacoo náajchai, ne tánda jíya náajcha?
ACT.11.4	Pé'eru íiwa nalí lidáni néenee quinínama liá'a libésunaucoo. Limá nalí:
ACT.11.5	—Nuyá yáairri chacáalee jí'ineerri Jope, nácula nutáania Dios yáajcha, nuwáalia áabai nutuírricu sái: Nucába jicá'a áabai sábana máanui nabájerriu náa'a cuatro lijuátaca, íinuerri éerri néenee chalée nuyáctalaca. 
ACT.11.6	Jáiwa nucába sáica jíni tánashia yáa lirrícui, jáiwa nucába líibi cuéshinai cuatroni íiba, ya cuéshinai cawálani, ya náa'a yáarrudenaicoo cáinabi íta'aa ya náa'a míshiiduca. 
ACT.11.7	Jáiwa nuéemi lichuáni wítama mérri nulí: ‘Jibárroo, Pé'eru, jíinuani ya jíyani.’ 
ACT.11.8	Nuyá éeberri: ‘Jócai, Nuwácali, quiní wárruerriu nunúma lícu máashiica ya casáculai.’ 
ACT.11.9	Néenee lichuáni wítama éerri néeneeji léejoo litáania nulí: ‘Liá'a Dios yáni jí'inaa sáicai, ujimá máashiicalani.’ 
ACT.11.10	Liáni jái bésunacuwai matálichu, jáiwa quinínama léejoo líirracuwai áacairra. 
ACT.11.11	Liyáalimi, matálitai washiálicuenai nabánuani Cesarea néenee sána namúrru nuyá, náiinu cuíta néerra á'a nuyáctalaca. 
ACT.11.12	Liá'a Espíritu Santoca libánua nuyá, jócubeecha né'e nuásacala, nuáaquene'eewoo náajcha. Ya náani seis nuéenajinaica yáaineu nuájcha lécchoo. Quinínama wawárruacoo áabai cuíta rícu báqueerri washiálicuerri shínaa, 
ACT.11.13	líiwa walí licába'ee báqueerri ángel líibana rícu, licába báqueerri ángel bárruacoo, limá lirrú: Jibánua áabibi chalée chacáalee rícula jí'ineerri Jope, jiwánaque'e líinu néenee liá'a jí'ineerri Simónca, ya áabai lijí'inaa lécchoo Pé'eru. 
ACT.11.14	Limáminaa jirrújoo chítashia'eewoo wáseda jiyá ya quinínama yáainai jíbanaa lícu. 
ACT.11.15	Quéecha'inaami nutáania nalí, Espíritu Santo íinu'inaami náta'aa, léjta líinu'inaami wáta'a quéecha. 
ACT.11.16	Jáiwa nuédacani linácu liáni wawácali mánimica: ‘Yáawaiyi Juan báutisa shiátaiyu, ne iyáminaa báutiseene'inau Espíritu Santoyu.’ 
ACT.11.17	Wée sáicai, Dios yácta nalí lécchoo, léjta liá'a Dios yáni walí, wayá éebidenaica wawácali Jesucristo nácu, ¿tána nuyái nuyáque'e Dios júnta?
ACT.11.18	Quéecha'inaami náa'a néenajinai yáainai Jerusalén néeni néemi'inaa liáni chuánshica, jáiwa manúma nayái, jáiwa naméda sáicai Diosrui namá'ee:
ACT.11.18	—¡Namá'ee léquichoo náa'a jócani judíobini liá'e nalí néejooque'iu wawácali Diosru, nénaque'e liá'a cáwicashi jócai amáarra!
ACT.11.19	Liáwinaami liá'a Esteban máanalicamica, jáiwa nacánaquedenai náji náa'a éebidenaica Dios chuáni, néewau nacánacacuwai cáinabi jí'ineerri Fenicia, Chipre ya Antioquía. Néerra náiiwa nalí náa'a judíobinica chuánshi sáicai, jócaita áabirru. 
ACT.11.20	Ne máayabaca, áabi éebidenai Dios chuáni Chipre néenee sána ya Cirene néenee sána, náiinu chacáalee jí'ineerri Antioquía néerra, jáiwa natáania nalí léquichoo náa'a jócani judíobini, náiiwa nalí sáicai chuánshi nácu linácu liá'a Jesús, wawácalica. 
ACT.11.21	Liá'a Dios wítee cadánani yéerri náajcha, tánda íchaba máaca nawíteemiu ajuítemi, jáiwa néebida Jesús nácuwai.
ACT.11.22	Náa'a iglesia Jerusalén néenee sána, néemi'inaami liáni chuánshica, nabánua Bernabé Antioquía néerra. 
ACT.11.23	Quéecha'inaami Bernabé íinu néerra, licába Dios túya nayáu, sáicta wérri liwówa. Liá nawítee quinínama namáaca nawówau cadánani linácu liá'a éebidani Jesús nácu. 
ACT.11.24	Jiníwata liá'a Bernabé washiálicuerri sáicai, cashiámui Espíritu Santoyu ya éebiderri. Tánda íchaba chóniwenai máaca nawówau Wawácali nácu.
ACT.11.25	Liáwinaami liáni, Bernabé yáairriu áabai chacáalee jí'ineerri Tarso néerra, limúrru Saulo. 
ACT.11.26	Líinu'inaami linácu, jáiwa litée jíni Antioquía. Néenee nayá yáajcha náa'a iglesia ísanaca áabai camuí quinínama, néewida íchaba chóniwenai. Antioquía néeniwa náa'a éewidenaicoo nácta nají'inaa náa'a quéechanacu sánaca cristiánobinica.
ACT.11.27	Liyáali éerri, áabi quéewidacai Dios chuáni yáaineu Jerusalén néenee Antioquía néerra. 
ACT.11.28	Báqueerri néenaa náa'a jí'ineerri Agabo, jáiwa libárruawai Espíritu ma lirrú, líiwa'ee áabai ínaaishi wérri íinuerri'inaa'ee quinínama cáinabi ítala, jáiwa libésunawai yáawaa, léerdimi liá'a wánacaleerri jí'ineerri Claudio. 
ACT.11.29	Jáiwa náa'a éebidenai Dios chuáni nácu Antioquía néenee sánaca, jáiwa nawówai nabánua nayúda nayájoo náa'a néenajinai yéenai Judea néeni, bácainaa tánashia néenaani náacai. 
ACT.11.30	Jáiwa naméda cha jíni, nawánaca liá'a Bernabé ya Saulo, natée nalí nayúdau'naa nayá náa'a salínaica yéenai Judea néeni.
ACT.12.1	Liyáali éerrimi, liá'a rey Heródesmi, jáiwa lichánau licánaquedani nayá náa'a áabi iglesia ísana. 
ACT.12.2	Libánua líinua espada númayu Santiagomi, liá'a Juan éenajirrimica. 
ACT.12.3	Licábaca'ee sáica licáacoo judíobinirru, jáiwa nawína preso Pé'erumi. Liáni bésunawai liyáali éerri fiesta'inaami, náaya'inaami páani jócai múrracau. 
ACT.12.4	Liáwinaamite nawína liyá preso, Herodes wána naníqui liyá Pé'eruca cuíta manúmai ricúla, éedenai nayáca natuínaa cuatro grupo soldado, ne cuatro soldado grupo namáni máanubaca. Liwówaini líyadaca chóniwenai náneewa quinínama, liáwinaami liá'a fiesta jí'ineerri pascua. 
ACT.12.5	Liyáali Pé'eru yéerri cuíta manúmai rícula, natúyani wérri, ne náa'a iglesia ísanaca mamáarracani sáta linácu Dios yúcha cadánani wérri.
ACT.12.6	Áabai táayee libéecha liyáali éerri Herodes íyadacta'inaamini chóniwenairruni, Pé'eru máairri liyáca chámata soldado éemanacu, bájerriu chámai cadénayu, nácula áabi soldado yéenai túyenai linúma liá'a cuíta manúmaica. 
ACT.12.7	Cawíquinta báqueerri ángel íyadacoo Wawácali shínaa, jáiwa cashiámu cámarrashiyu liá'a cuíta manúmaica. Liá'a ángel lidúnu Pé'eru bárrai nácu, jáiwa licáweda jíni, limá lirrú: “¡Jibárroo cálicu!” Liyáalimi cadena licáwai Pé'eru cáaji nácucha, 
ACT.12.8	jáiwa ángel ma lirrúi: “Jisúwa jíibalau, jisúwa jishínaa sandalias.” Cháwa Pé'eru médacani, ángel ma lirrú báaniu: “Jisúwa jishínaa capau wayúwai.”
ACT.12.9	Pé'eru yáau líshiirricu liá'a ángel, jócai liá léenaa yáawashia liá'a ángel médanica. Cájbami lirrúta'ee lituírricu sái chái licábaca. 
ACT.12.10	Ne nabésuneda quéechanacu sána catúyacanica, néenee néejoo nabésuneda áabi catúyacani báaniu, ne náiinu'inaami néerra linánibala jiárrui néerra yáairri bináawe, jáiwa liméecu liá'a linánibala bácai. Najiá'inaamiwai, nanísa'inaami najínacuwai áabai cáaye, ángel máaca liyá bácai.
ACT.12.11	Jáiwa cawítee Pé'erumi, limá'ee: “Chóque'e nucába yáawaiyi, liá'a Wawácali, bánuerri nulí ángel litúyaque'e nuyá Herodes yúcha, náucha lécchoo náa'a quinínama judíobini wówaini naméda nuájcha.” 
ACT.12.12	Liáni léenaa jíni, Pé'eru yáau cuíta María íibana néerra, ruá'a Juan túwaca, jí'ineerri lécchoo Marcos, íchabacta náawacacoo natáania Dios yáajcha. 
ACT.12.13	Limáida liá'a cuíta núma yéerri cáaye rícueji, báquetoo miyácau jí'ineechoo Rode rujiáu rucába tánashia jíni. 
ACT.12.14	Rucúnusia'inaa ruéemi Pé'eru wawítama, jáiwa sáicta ruwówai jócuwa ruméecu lirrúi, jáiwa rucánacawai cuíta licúla ruíiwa nalíni, Pé'eru yáairri cuíta núma lícu. 
ACT.12.15	Nayá namá rulí:
ACT.12.15	—¡Jiyá mawítee!
ACT.12.15	Ruyá rumá yáawaiyii. Nayá namá'ee:
ACT.12.15	—Jócai liyá, léwa jishínaa ángel liérra.
ACT.12.16	Nácula, liyá Pé'eru mamáarracai limáida nalí cuíta núma licué. Naméecu'inaamini, ya nacába liyá, jáiwa nacáarrudawai. 
ACT.12.17	Ne liyá liméda nalí licáajiu, manúmataque'e nayá, jáiwa líiwa nalí jíni chítashia liwácali jédau liyá cuíta manúmai rícueji. Jáiwa limá:
ACT.12.17	—Jíiwa liáni Santiagorru ya léenajinairru.
ACT.12.17	Jáiwa lijiáwai liáu báawachalai.
ACT.12.18	Quéecha'inaami jucámarracai, jáiwa natáania matuínaami nayá wáacoo náa'a soldado, jiníwata jócta náa léenaa chítashia nabésunau'u jíni Pé'eru yáajcha. 
ACT.12.19	Jáiwa Herodes bánua namúrruqui jíni, ne jóca néenaa náiinuqui jíni, liáni náata náa'a guárdiaca, jáiwa liwána náiinua nayái. Liáwinaami liáni, Herodes jiáu Judea yúcha, jáiwa liáu liyácai Cesarea néerra.
ACT.12.20	Herodes íiwirri wówa náajcha náa'a chóniwenai yéenaica chacáalee jí'ineerri Tiro ya Sidón. Tánda néenaa náa'a chóniwenaica náacoo natáania Herodes yáajcha, jáiwa'ee néenaa naméda najúnicai liá'a Blástoca, báqueerri chóniwerri cawéni wérri liájabasai liá'a rey Heródesca. Tánda nabánua nachuániu Blasto yáajcha Heródesru: Wayá jócai wówai wáiinua yáacacoo jiájcha, jiníwata wayá cúnsiguenai íyacaishi jishínaa cáinabi. Néenee lécchoo Blasto táania liájcha liá'a Heródesca, quéewique'e lirríshibia nayá. 
ACT.12.21	Liyáali éerri lirríshibia'inaa jíni liá'a Heródesca lisúwa'ee líibalau rey shínanaa, jáiwa'ee liwárruawai lishínaa liárrubai íta'aa. Néenee'e máanui cábacoo litáania nalí. 
ACT.12.22	Néenee'e chóniwenai nachána namáidada'ee: “¡Jócaiwa washiálicuerri liéni chái jitáania, wamá báqueerri Dios!” 
ACT.12.23	Liyáalimi'e, báqueerri ángel Dios shínaa liwána Herodes bálinacoo, jiníwata liá'a Herodes jócai méda Dios carrúninaa, cáberriu jicá'a dios. Néenee libéechalawoo máanali jíni éenishi íyani.
ACT.12.24	Nácula'ee liá'a Dios chuánica cáarralerriu mamáarraca náiiwa quinínama cáinabi íta'aa.
ACT.12.25	Bernabé ya Saulo nanísa'inaa'ee nashínaa tráawaju Jerusalén rícu, néejoo'eewoo Antioquía néerra. Náajcha'eewoo natée Juan lijí'inaa léquichoo Marcos.
ACT.13.1	Liá'a iglésiaca yéerri Antioquía ái íiwadedeerri Dios chuáni já'a ya éewiderri. Nayá Bernabé, Simón (yá'ee liá'a jí'ineerri léquichoo cachájulai), yá'ee Lucio Cirene néenee sái, Manaén (liá'a dáwinerricoo Herodes yáajcha, liá'a wánacaleerri Galilea rícu) ya Saulo. 
ACT.13.2	Áabai éerri, nácula'ee nayá'ee nayá culto rícu lirrú'e Wawácalica liyáali nayá jócai íya, yúnenai, liá'a Espíritu Santo má'ee nalí: “Ishírri nulí liá'a Bernabé ya Saulo lirrú liá'a tráawajuca numáidani nayá nácu.” 
ACT.13.3	Néenee, liáwinaami na'óra'inaa ya nayúnaa léquichoo, namáaca'ee nacáajiu nanácu ya tá'ee náiiwa nanáwau nalí.
ACT.13.4	Espíritu Santo bánua nayá, náa'a Bernabé ya Saulo ná'eewau áabai chacáalee jí'ineerri Seleucia, néenee'e ná'eewau náurrucoo lancha ricúla náaque'iu áabai liwówai néerra jí'ineerri Chipre. 
ACT.13.5	Náiinu'inaa'ee liá'a lancha chánactacoo néeni jí'ineerri Salamina, liwówata néeni jí'ineerri Chipre. Jáiwa nachána'ee náiiwa Dios chuáni lirrícula liá'a sinagoga judíobini shínaa, Juan yáairriu náajcha léquichoo jicá'a liá'a tálidedeerri nayá.
