MRK.2.7	¿Chíta quéewoo litáaniaca cháji liéni? Lichuáni táanierri máashii Dios nácula. Bácairrimi Dios éewerri liméetua jíconaashi. 
MRK.2.8	Ne Jesús liyáalimi liá léenaa liá'a napénsani nayáca, néenee lisáta léemiu nayá:
MRK.2.8	—¿Tánda ipénsa chárra? 
MRK.2.9	¿Tána mawí jócai tráawajui, numá macáwai: “Jijíconaa máaquerriu liméetuacoo”, o numá lirrú: “Jibárroo, jiwína jiárrubaiu jijínau”? 
MRK.2.10	Ne núyadaminaa irrúni nuyá, Washiálicuerri Dios Cúuleeca, wáalierri wánacaalashi cáinabi íta'aa liméetua'inaa jíconaashi.
MRK.2.10	Néenee limá macáwairru:
MRK.2.11	—Numá jirrú, jibárruau, jiwína jiárrubaiu ya jiáu jíibana néerrau.
MRK.2.12	Liá'a bálinerricoo libárroo cawíquinta, ya liwína liárrubaiu lijiáu néenee, natuími rícula quinínama. Linácue jiliéni, nacáarrudau quinínama, jáiwa náa sáicai Diosrui, namá'ee:
MRK.2.12	—Jócai wacába cáji chái bésunacoo.
MRK.2.13	Liáwinaami Jesús yáu báaniu manuá tácoowala; náa'a chóniwenai yáawacau lirrú, ya liyá léewida nayá. 
MRK.2.14	Libésuna'inaamiu licába Leví, licúulee liá'a Alfeo, wáairriu liyáca náarrui náa'a cóbrenai impuesto Romarru. Jesús ma lirrú:
MRK.2.14	—Jíinu nuájcha.
MRK.2.14	Leví bárroowai liáu liájchai.
MRK.2.15	Jáiwa'ee Jesús íyeerri liyáca Leví íibana néeni, ya íchaba cóbrenai impuesto Romarru, ya áabi chóniwenai máashiini íiwanaa, wáaine'eewoo mésa nácu lécchoo, Jesús yáajcha ya lishínaa éewidenaicoo, jiníwata íchabani náa'a yáainecoo liájcha. 
MRK.2.16	Áabi éewidenai ley shínaa, náa'a fariséoca, nacába'inaami Jesúsca íyeerri liyáca náajcha quinínama náa'a, nasáta néemi náa'a éewidenaicoo:
MRK.2.16	—¿Tánda ishínaa qéewidacai íya náajcha náa'a cóbrenai impuesto ya náa'a cajíconaanica?
MRK.2.17	Jesús éemi'e jíni, yá'ee limá nalí:
MRK.2.17	—Náa'a sáicanica jócani rúnaa médico, náwa rúnaani náa'a bálinenaicoo. Chacábacanaa, nuyá jócai íinu numáida náa'a máinai sáicaca nayá, náwa nuíinu numáida náa'a cajíconaanica.
MRK.2.18	Báitate yúnenai nayáca náa'a éewidenaicoo Juan Bautista ya náa'a fariséoca, néenee áabi chóniwenai náa'a'eewoo Jesús néerra nasáta néemiu wáni:
MRK.2.18	—Náa'a Juan shínaa éewidenaicoo ya náa'a fariséoca yúnenai: ¿Tánda jóca jishínaa éewidenaica nayúna?
MRK.2.19	Jesús éeba'ee nachuáni:
MRK.2.19	—¿Ya néewa nayúnaa náa'a nabítani áabai boda, nácula nashínaa novio yáa náajcha? Nácula liyá náajcha nashínaa novioca jócani éewa nayúnaaca. 
MRK.2.20	Ne líinuminaa liá'a éerrica natécta'inaa nuyá léjta nashínaa novio; jáicta líinu liá'a éerrica, néenee liyáali éerriminaa nayúnaa.
MRK.2.21	Jesús íyada chuánshi mawí litáania linácu liá'a wáalii léewidani jinácu ya liá'a ajuítaimi nawáalianica quéecha. Jiní chúneerri áabai íibalashi dánumimi áabai wáarruma wáalii yáajcha, jiníwata liá'a wáarruma wáaliica liáwaqueda liá'a íibalashi dánumimica jái lisúbirria jíni, ya liá'a shírricuerriu mawí máanuique'e jíni. 
MRK.2.22	Jiní lécchoo yáa vino wáalii íimanaashi lidánumimi rícu, jiníwata liá'a vino wáaliica wáneerri lisúbirriacoo liá'a íimanaashica, ta lipérdiacoo liá'a vinoca ya íimanaashica. Tándawa arrúnaa yáa vino wáalii íimanaashi wáalii rícu.
MRK.2.23	Áabai sábado
MRK.2.24	Jáiwa náa'a fariseo nacába'inaami liáni, nasáta néemiu:
MRK.2.24	—Jicábate, ¿Tánda naméda náa'a jishínaa éewidenaicoo jócai wéewa waméda sábado rícu?
MRK.2.25	Ne limá nalí:
MRK.2.25	—¿Jócai cáji iliá icábau Dios chuáni nácu, liá'a David médanimica áabai éerrite quéecha'inaamite liyá ya lijúnicaibinica jáiwate nawáalia jiní rúnijinaa ya nasíntia ínaaishi? 
MRK.2.26	Quéecha'inaami Abiatar yáairri sacerdote wácaliyu, David wárroo Dios íibana rícula, jáiwa líiya liá'a páanica Diosru sáica; bácai sacerdótebini éewa náayacani, jáiwa liá náaya lécchoo náa'a chóniwenai yáainecoo liájcha.
MRK.2.27	Jesús túculeda mawí:
MRK.2.27	—Dios limáaca liá'a sábadoca chóniwenairru, ne jócai chóniwenai sábadorru. Náa'a chóniwenai jócai arrúnaa néndaca táanashia namédani sábado rícuii, jiníwata wawácali nísani limáacai. 
MRK.2.28	Linácueji liéni, nuyá Washiálicuerri Dios Cúuleeca, wáalierri wánacaalishi lécchoo éerri nawówa íyabactacoo.
MRK.3.1	Jesús wárroo báaniu sinagoga rícu; lirrícu báqueerri washiálicuerri wáalierri áabai licáaji íshiderriu. 
MRK.3.2	Náa'a fariseo néda lituínaa Jesúsca lichúnicta nacába sábado rícu, quéewique'e néewa náa lijíconaa. 
MRK.3.3	Jesús ma lirrú liá'a washiálicuerri cáaji íshiderricoo:
MRK.3.3	—Jibárroo jimédau béewami.
MRK.3.4	Jáiwa lisáta léemiu náa'a áabica:
MRK.3.4	—¿Tána wéewa waméda sáica mawí éerri wawówa íyabactacoo: Liá'a sáicaica o léewee jiliá'a máashiica? ¿Wawáseda áabai cáwicashi o wamárdacani?
MRK.3.4	Ne jáiwa manúma nayái. 
MRK.3.5	Néenee Jesús cába nalí íiwirri liwówa náa'a yáaine litéeji, máashii liwówa cabálinica nawówa, limá lirrú liá'a washiálicuerrica:
MRK.3.5	—Jidáquinia jicáajiu.
MRK.3.5	Liá'a washiálicuerri dáquinia jíni, ya licáaji chúniwai. 
MRK.3.6	Quéecha'inaami najiácoo fariséoca, nachánau naméda natáaniaca náajcha náa'a heródesbinica quéewique'e náiinua Jesús.
MRK.3.7	Jesús, náaniu íshiirricu íchaba chóniwenai Galilea sánaca, ya liáu lishínaa éewidenaicoo manuá tácoowala. 
MRK.3.8	Quéecha'inaami náa léenaa máanui limédanica, jáiwa íchaba lécchoo náau nacábacani náa'a Judea sánaca, ya Jerusalén, ya Idumea, cáiwia jiáctejcoo Jordánca ya náa'a cáinabi Tiro ya Sidón. 
MRK.3.9	Tádawa linácu jiliéni, Jesús bánua jishínaa éewidenaicoorru nawáaliaque'e libéecha madánainaa áabai lancha, quéewique'e jóca chóniwenai bádadani. 
MRK.3.10	Jiníwata íchaba lichúni, quinínama náa'a bálinenaicoo náiinu linácula nadúnuque'ini.
MRK.3.11	Quéecha'inaami espíritu máashiini cábacani, nacáu náurruimiyu lináneewa namáidada'ee:
MRK.3.11	—¡Jiyáwa Dios Cúulee!
MRK.3.12	Ne Jesús liwána jócu natáania linácu quinínama chóniwenai náneewa.
MRK.3.13	Liáwinaami Jesús írrerriu dúuli ítala, jáiwa limáida léjta liwówau. Báitate náawacau, 
MRK.3.14	liníwa náiibicha doce, quéewique'e natálidedacani ya quéewique'e libánua náiiwa sáicai chuánshica. Náani liá nají'inaa apóstolubinica. 
MRK.3.15	Ya liá nalí wánacaalashi najédau'inaa demonio chóniwenai yúcha. 
MRK.3.16	Náawa liníwani doce náani: Simón, liáni jí'inaa Pé'eru; 
MRK.3.17	Santiago ya léenajirri Juan, Zebedeo éenibi, limáni jí'inaa Boanerges (liwówa limáca “túrrunerriu éenibi”); 
MRK.3.18	Andrés, Felipe, Bartolomé, Mateo, Tomás, ya Santiago, Alfeo cúulee; Tadeo, Simón cananeo sái, 
MRK.3.19	ya Judas Iscariote, liáwinaami wáneerri'inaa náiinua Jesús.
MRK.3.20	Liáwinaami Jesús wárroo áabai cuíta rícu, éejoo náawacacoo íchaba chóniwenai, jócai éewa líiyaca ya lishínaa éewidenaicoo. 
MRK.3.21	Náa'inaami léenaani náa'a Jesús éenajinaica, náau natéecani, namá'ee lócucala éewani.
MRK.3.22	Lécchoo quéewidacani ley shínaaca íinuenai Jerusalén néenee namá'ee: “Beelzebú, chúnsai demonio wácalica, léewa yáairri lirrú liéni washiálicuerrica wánacaalashi léewau'inaa lijédacani chóniwenai yúcha”.
MRK.3.23	Jesús máida nayá, jáiwa liá nalí áabai licábacanaa limá'ee nalí: “Wawásimi jócai jéda chúnsai Wawásimica. 
MRK.3.24	Áabai país shírrerriu yáaineu grupoyu máashiini cába yáacacoo, jócani éewa nayá machúnuca; 
MRK.3.25	ya áabai éenajinai shírreneu, jócai éewa nayáca. 
MRK.3.26	Cháwa lécchoo ya Wawásimi lishírrictau ya libárroo lináculawoo, jóca éewa liyáca; líinuminaa amáarractala liyá.
MRK.3.27	“Litáania chítashia wéewau'inaa wagáanaqui jíni Wawásimica, liá'a cadánani wérrica, Jesús má'ee: Jiní éewerri liwárruacoo líibana rícula washiálicuerri cadánanirru ya linédu lishínaa, jóctaca libájidaque'e cháani; bácai cha já'a léewa linéducani.
MRK.3.28	“Nuíiwa irrú Dios éewerri liméetua quinínama washiálicuenai jíconaa ya quinínama liá'a máashii namánica: 
MRK.3.29	Ne liá'a táanierri máashii Espíritu Santo nácu, jócuminaa lédacaniu linácu liá'a limédanica, máaquerriminau cajíconaiyu mamáarraca.”
MRK.3.30	Liéni Jesús máni'e, jiníwata namácala'ee liwáaliacala espíritu máashii.
MRK.3.31	Néenimichu ruíinu ruá'a litúwaca ya Jesús éenajinai, jáiwa namáacau bináaweji nabánua namáidacani. 
MRK.3.32	Náa'a chóniwenai wáainecoo Jesús téeji namá lirrú'e:
MRK.3.32	—Jitúwa, ya jéenajinai ya jéenajetoo yáaine bináawa, namúrru jiyá.
MRK.3.33	Jesús éeba nachuáni:
MRK.3.33	—¿Tána nutúwai ya nuéenajinai?
MRK.3.34	Jáiwa, licába náa'a wáainecoo litéeji, lidúcueda'ee:
MRK.3.34	—Náawa nutúwa ya nuéenajinai náani. 
MRK.3.35	Quinínama náa'a médenai Dios wánacaala, léewa nuéenajirri liérra, ya nuéenajetoo ya nutúwa.
MRK.4.1	Báaniu lichána léewidaca calísa tácoowa liá'a Jesúsca. Jáiwa náawacau lirrú íchaba wérri chóniwenai, néenee Jesús írrau áabai lancha rícula liérra calísa yáacu, jáiwa liwáawai, nácula chóniwenai máacau litácoowa. 
MRK.4.2	Néenee léewida nayá íchaba nácu chá'a licábacanaayu. Liyú liá'a léewidau'u limá nalí: 
MRK.4.3	“Éemi liáni: báqueerri cáabanacai liáu licása banácali íimi. 
MRK.4.4	Liáabana'inaa liyáca áabata líimi cáu liúcha iníjbaa lícu, náiinu náa'a míshiiduca jáiwa náaya jíni. 
MRK.4.5	Áabata cáu líibi íibaca, jinícta sáica cáinabi, liérra banácalica, jáiwa lipáquiau madéjcata, jócala sáica cáinabi, dujíwalanaa liá'a cáinabica; 
MRK.4.6	Néenee cáiwia éema jíni lipáquia'inaamiu jiníwata lijíchui, máacarra jíni. 
MRK.4.7	Áabata léenaa liá'a banácalica cáirriu túwirri íibi, jáiwa túwirri dáwinawai líinua jíni jócu liá lítawai. 
MRK.4.8	Ne áabata liá'a banácalica cáirriu sáiquitacta cáinabi, lidáwinawai liá lítau sáica; áabata yáa lítau léjta treinta bátuinaa, áabata sesenta lítau ya áabata cien.” 
MRK.4.9	Ne Jesús túculedani mawí: “Náa'a wáalianai nawíbau, néemi'a.”
MRK.4.10	Néenee liáwinaami, Jesús máaca'inaamiu bácai, náa'a yéenai urrúni lirrú náajcha náa'a doce léewidanicoo, nasáta néemiu Jesús tánashia liwówai limá léji liéni licábacanaaca. 
MRK.4.11	Jesús éeba'ee limá'ee nalí: “Iyá Dios wána yáa léenaa jócai náa léenaa liwánacaalactaca shínaaca; ne náa'a jócani éebida Dios nácu numá nalí quinínama licábacanaayu, 
MRK.4.12	quéewique'e nacába mawí, ne jócai nacába, ne mawícta éemica jócai éemi, quéewique'e jócai éejoo Diosru, ya tándawa jócai Dios pérdonaa nayá.”
MRK.4.13	Jáiwa limá nalí: “¿Iyá jócani yáa léenaa éemi licábacanaa liéni? ¿Chíta quéewoo yáa léenaa éemi quinínama áabata?” 
MRK.4.14	Liá'a yáabaneerri líimi chaléjta liá'a íiwadedeerri Dios shínaa chuánshi. 
MRK.4.15	Ái áabi chaléjta líimi cáirricoo iníjbaa lícu: Néemini liá'a Dios shínaa chuánshi, ne liáwinaami néemicani líinu liá'a Wawásimi ya lijéda liá'a Dios chuáni yáairri nawówa lícu, léjta míshiidu íyau'u banácali íimi cáirricoo iníjbaa lícu. 
MRK.4.16	Ái áabi já'a léjta líimi liá'a náabanani íiba íibi: Éemenai Dios chuáni narríshibia nawówa yáajchau ya néejoo Diosrui, 
MRK.4.17	ne jócala liwáalia lijíchu sáica, léjta banácali íimi cáirricoo íiba íibi, jócu léewa machácani liyáca; táda linácueji, Dios chuáni nácueji naméda máashii nalí, jócai namáaca nawówa Dios nácu, tánda néewa nacáacoo Dios chuáni yúcha. 
MRK.4.18	Áabi chaléjta náa'a líimi náabanani túwirri íibi: Éemenai Dios chuáni, 
MRK.4.19	ne náa'a shínaashica yéenai áani cáinabi íta'aa, nawána urrúni liwówa bájiala, lináinaa liá'a rícucai lichálujueda nayá, nawówaicta nawáalia quinínama cábacanaa. Quinínama liáni liwárroo nanácu, ya jócu línda nadáwinacoo Dios chuáni nácu, léjta banácali jócai éewa liá lítau. 
MRK.4.20	Ne ái áabi éemenai Dios chuáni ya narríshibiani, nayá médenai sáicai, chaléjta líimi náabanani sáicacta cáinabi. Áabi néenaa náani chái léjta lítau yáainai treinta lítau bátui líimi nácu, naméda píituica, áabi chaléjta yáirriu lítau sesenta, naméda íchaba mawí, ya áabi chaléjta yáairri cien lítau, naméda bájialanaa.
MRK.4.21	Ne limá'ee nalí lécchoo: “¿Ne léquichoo naínda áabai lámpara namáacani cajón yáajaba ya cama yáajaba? Jócai, áabai lámpara namáacani áacai, liquénique'e. 
MRK.4.22	Chacábacanaa, jiní éenaa libáyacoo liúcha quinínama liá'a léenaajoo, jiní cabáyaintai máacacoo. 
MRK.4.23	Náa'a nawáalianai nawíbau, néemique'e.” 
MRK.4.24	Ne limá'ee nalí lécchoo: “Yáa liwówanaa linácu sáica liá'a éemini lécchoo. Ne liá'a néenee dáuca liyú Dios éeneda iyá lécchoo; ya liáminaa irrú mawíjoo. 
MRK.4.25	Liá'a éemerri sáica, yáirri'inaa léenaa mawí, ne liá'a jócai éemi sáica, áawita liyá liá léenaa mawí, liyá pérderri'inaa liá'a píitui rími liáni léenaa nácu.”
MRK.4.26	Jesús má'ee lécchoo: “Dios wánacaala chacábacanaa jicá'a báqueerri washiálicuerri yáabaneerri liáabanacaalau cáinabi íta'aa: 
MRK.4.27	Chacábacanaa újni jimácta, chacábacanaa újni cábichu liyá, chacábacanaa léjta táayee, léjta éerrinacu, liá'a líimi páquerriu dáwinerriu jócai liá léenaa dáwinau'iu. 
MRK.4.28	Liyá jájiu liá'a cáinabica liwána: Quéechanacu lipáquiau áabai máashiibeeca, néenee lidáwinau liwínaca, néenee liáwinaami líta cámushederri'inaa lináanaa. 
MRK.4.29	Jáicta salírrii lítai, liwína jíni, jiníwata jái yácai léerdi rícuwai.” Cháwa jáicta amáarra liáni éerrica, Dios yúcaminaa wayájoo, o lirríshibiaminaa wayájoo áacairra.
MRK.4.30	Jesús má'ee lécchoo: “¿Chíta licábacanaa irrú jíni Dios wánacaala? ¿Tánayu ta wéewa wacómparaqui jíni? 
MRK.4.31	Chaléjta mostaza íimi náabanane cáinabi íta'aa. Léwa áabai banácali íimi mawí píituica yáairri quinínama cáinabi íta'aa. 
MRK.4.32	Ne liáwinaami náabana'inaa jíni, jáiwa lidáwinawai mawí máanui quinínama banácali yúcha, léjta áabai áicuba, linácai máanui namái míshiidu éenaa naméda nábanau, libáinaa yáajba. Cha lécchoo, liá'a Dios chuánica náiiwani ya lichána píitui rímiyu, néenee lidáwinawai máanui limédacuwai.”
MRK.4.33	Chacábacanaa Jesús éewida nayá linácu liá'a lichuánica, léewida nayá chacábacanaa léjta licábacanaa, limáyu liáni táshia náctala néemiqui jíni. 
MRK.4.34	Ne jócai limá jiní licábacanaa, báawita éewidenaicoo íiwa quinínama báawachala.
MRK.4.35	Liyáali éerri táayeemi, Jesús má'ee lishínaa éewidenaicoorru:
MRK.4.35	—Wáau bajiála manuá, —limá'ee nalí.
MRK.4.36	Néenee namáaca náa'a chóniwenaica ya natée Jesús lirrícu liá'a lancha liániu liácoo rícu; ya áabi lancha natálideda náacoo liyá. 
MRK.4.37	Cawíquinta íinuerri cáuli wérri, áabai cáuli cadánani wérri marrádaca íserriu lancha rícula, jái wáuwai cashiámu shiátaiyui. 
MRK.4.38	Ne Jesús máairri liáju néenee, ruwáirriu liwíta yáarrubai íta'au. Jái nacáweda jíni, namá'ee lirrú:
MRK.4.38	—¡Quéewidacai! ¿Tánda jiní jiwéni jicába wayá báawita jicába waquétacoo wayáca?
MRK.4.39	Jesús bárruawai limá'ee cáulirru, ya limá'ee manuárru:
MRK.4.39	—¡Jibórroo! ¡machúnuca!
MRK.4.39	Néenee libárroo cáuli, ya quinínama machúnucai. 
MRK.4.40	Liáwinaami Jesús má'ee lishínaa éewidenaicoorru:
MRK.4.40	—¿Tánda bájiala cáarru iyá? ¿Ái újnibii jócu éebida nunácu já'a?
MRK.4.41	Ne nayá bájialani wérri cáarruca, ya nasáta néemiu nayá wáacoo:
MRK.4.41	—¿Tánashia léji liéni, cáuli ya manuá éewidani lirrú?
MRK.5.1	Jesús bésunau bajiála manuá náajcha náa'a lishínaa éewidenaicoo, áabai cáinabi ítala, urrúni áabai chacáaleerru jí'ineerri Gerasa. 
MRK.5.2	Jáyaali Jesús jiáu lancha rícucha, néenee báqueerri washiálicuerri rúniu lirrú, wáalierri espíritu máashii, íinu lijúnta lirrícucha náa'a útawi yéenai máanali íibi. 
MRK.5.3	Ne liyá yéerri narrícu náa'a útawica liáni washiálicuerrica, jiní éewa libájica, báawita cadénayu. 
MRK.5.4	Nabájidanimi íchabachu cadénayu licáaji nácu ya jiárruyu líiba nácu, jiníwata carrúnatai, ne liwíchua náucha liá'a cadénaca ya liá'a jiárruca liwíchua liúchau lécchoo, jiní éenaa libárruedaca. 
MRK.5.5	Limáu séewirrinaa éerrinacu ya táayee limáidada narrícula náa'a útawica ya náiibi náa'a dúulica, ya íinuederriu íibayu. 
MRK.5.6	Licába'inaa Jesús déecucheji, néenee licánacau litúyau Jesúsru. 
MRK.5.7	Néenee liá'a espíritu máashii máidada cadánani limá'ee: ¿Táda jiwárruau nuájcha, Jesús, licúulee liá'a Diosca yéerri áacairra quinínama íta'aa? ¡Nusáta Dios yúcha jócubeecha carrúni jináata nuyá bájiala!
MRK.5.8	Limáni liáni Jesúsca ma liyá lirrú:
MRK.5.8	—¡Espíritu máashii, jijiáu liúcha liárra washiálicuerrica!
MRK.5.9	Néenee Jesús ma lirrú:
MRK.5.9	—¿Tána jijí'inaa?
MRK.5.9	Ne liyá ma Jesúsru:
MRK.5.9	—Nují'inaa íchabani, jiníwata wayáca íchabani.
MRK.5.10	Néenee liá'a espíritu máashiica lisáta'ee bájiala Jesús yúcha, jócu lijéda nayá báawachala liúcha liá'a cáinabica nayáctaca. 
MRK.5.11	Ái íchaba puíti urrúni nalí íyenai dúuli íta'aa. 
MRK.5.12	Táda nasáta Jesús yúcha namá'ee:
MRK.5.12	—Jibánua wayá nanácula puíti náa'a wawárruaque'iu nawówa rícula.
MRK.5.13	Néenee línda náacoo nawárruacoo. Néenee náa'a espíritu máashiinica najiáu liúcha liá'a washiálicuerrica nawárruaque'iu narrícula náa'a puítica, újni dos mil namánabaca, néenee nacánacau danáanshiyu carrátalia íteeji, náa'a puítica nacáacoo manuá yáacula nasácumactala'inau.
MRK.5.14	Néenee náa'a natúyenai puíti nacánacawai náiiwaque'e chacáalee rículani ya nalí náa'a yéenai bacháida lícu. Néenee náa'a chóniwenai éemenai liáni íinuenai nacába liá'a bésuneerricoo. 
MRK.5.15	Náiinu'inaa Jesús néerra, néenee nacába liá'a washiálicuerrica wáalierrimi náa'a espíritu máashiica, náa'a espíritu máashiini íchabanica. Nacába liyá wáairriu, líibala rícu, jái sáica wítee, cáarru nacábaqui jíni. 
MRK.5.16	Néenee náa'a cábeneemi liá'a bésuneerricoo, náiiwadeda nalí chítashia libésunau'u jiliá'a washiálicuerri wáalierrimi náa'a espíritu máashiinica, ya nanácu lécchoo náa'a puítica. 
MRK.5.17	Táda linácueji nasáta Jesús yúcha nawówa yáajchau, quéewique'e liácoo nashínaa cáinabi ítacha, jiníwata cáarrui nacábaca linácu liá'a Jesús médanica.
MRK.5.18	Jesús wárrua'inau liyáca lancha rícula liáque'iu, néenee liá'a wáalierrimi náa'a espíritu máashiini lisáta liúcha liwówa yáajchau liáque'iu liájcha. 
MRK.5.19	Ne Jesús jócai índa liácoo liájcha, limá lirrú:
MRK.5.19	—Jiáu jíibana néerrau jéenajinai íibirrau, jíiwadeda quinínama liáni jiwácali médani jirrú ya chítashia carrúni jináatau'u licába jiyá jíni.
MRK.5.20	Néenee liá'a washiálicuerrica liáwai, íineda lichánacoo líiwadedaca narrícuba náa'a chacáaleeca Decápolis shínaaca, liá'a Jesús médanica lirrú, ya quinínama namáacau nacáarrudacoo.
MRK.5.21	Quéecha'inaa Jesús éejuacoo lichuácoo bajiála manuá, náawacau lirrú íchaba chóniwenai, liyá yáairri manuá tácoowa. 
MRK.5.22	Liyáalimi líinu liá'a liwácali liá'a báqueerrica nawácanai náa'a sinagogaca, jí'ineerri Jairo, licába'inaa Jesús litúyau líiba néeni. 
MRK.5.23	Liyá sáteerri wérri, liwówa limá lirrú:
MRK.5.23	—Numíyacaula máanaliuyaca; jíinu jicháanaa jicáajiu runácu sáicaque'e ya cáwique'e ruyá.
MRK.5.24	Jesús yáau liájcha, ya íchaba chóniwenai yáau liájcha bádada yáaquenaiu litéeji. 
MRK.5.25	Náiibi náa'a chóniwenaica báquetoo íinetoo bálinechoo doce camuí, íirrai éechani. 
MRK.5.26	Carrúni jináatau bájialanaa íchaba médico cáaji rícueji, rugástaa quinínama liá'a ruwáalianimica, jiní wéni rulí, mawíu rubálinacuwai. 
MRK.5.27	Ruéemi'inaami cáiwanaa Jesús chúnica, jáiwa ruáni íinetooca rurrúniu liwójuna íteeji, chóniwenai íibi, jáiwa rudúnu Jesús íibala nácu. 
MRK.5.28	Jiníwata rumá'ee rulíwoo: “Nudúnucta líibala nácu, sáicaminaa nuyájoo”. 
MRK.5.29	Liyáalimi, liá'a íirraica libárroo rúcha, ya rusíntia rutácai rushínaa bálinacaalashi sáica ruyái. 
MRK.5.30	Jesús, yá'inaa léenaa lijiácoo liá'a lidánanica lináwau licába chóniwenairru, ya lisáta léemiu nayá:
MRK.5.30	—¿Tána dúnu núbala nácui?
MRK.5.31	Lishínaa éewidenaicoo ma lirrú:
MRK.5.31	—Jicába chóniwenai bádada yáaquenaiu, ya jisáta jéemiu “¿Tána dúnu nuyái?”
MRK.5.32	Ne Jesús licábadeda litéejiu, tánashia licába dúnu liyái. 
MRK.5.33	Néenee ruá'a íinetooca, cáarru wérri chéchinecho ruáca léenaa liá'a rubésunaucoo, jáiwa ruáwai rutúyacoo lináneewai, ruíiwa lirrú quinínama yáawaiyi. 
MRK.5.34	Jesús ma rulí:
MRK.5.34	—Numíyacaula, jéebidaca nunácu jisánawai. Jiá namówai chajiwíteemija'a ya sáica jiyái.
MRK.5.35	Újnibii Jesús táaneerri liyáca, náiinu lirrú áabi líibana néenee liá'a sinagoga wácanaica, namá'ee lirrú liá'a samáshta sálijinaacarru:
MRK.5.35	—Jimíyacaula máanaliuyi. ¿Táda jijódia liá'a quéewidacaica?
MRK.5.36	Ne Jesús, jiní limédaca nawánacaala, limá sinagoga wácalirru:
MRK.5.36	—Ocáarru jiyá, jéebida nunácu cháji'i.
MRK.5.37	Ya nayárrimi já'a tálideda liyá Pé'eru, Santiago ya Juan, Santiago éenajirri. 
MRK.5.38	Líinu'inaa liácoo líibana néerra liá'a sinagoga wácalica, Jesús éemi nawítama ya licába chóniwenai íchaca ya namáidadaca. 
MRK.5.39	Liwárroo ya limá nalí:
MRK.5.39	—¿Táda bájiala iméda iwítamau ya ícha chárra? Ruá'a samáshta jócau máanali, máichoo ruyáca.
MRK.5.40	Náa'a chóniwenai nacáida Jesús nácu, ne liyá liwána najiácoo bináawala quinínama, ya liwína rusálijinaa ya rutúwa ya náa'a liájcha sánaca, liwárroo ruyáctala ruá'a samáshtaca máanaliuca. 
MRK.5.41	Liwína rucáaji nácu ya limá rulí:
MRK.5.41	—Talita, cumi (liwówau'i limáca: “miyácau, numá jirrú jibárroo.”)
MRK.5.42	Liyáalimi, ruá'a miyácau, wáalechoo doce camuí, rubárroowai ya rujínawai. Ya chóniwenai nacáarrudau nacábacani. 
MRK.5.43	Ne Jesús bánua wérri nayá jiní éecharru náiiwani, ya jáiwa libánua náaque'e rúya ruá'a samáshtaca.
MRK.6.1	Jesús jiérriu lítacha cáinabi néenee liáwai lishínaa cáinabi néerrau, ya lishínaa éewidenaicoo yáaineu liájcha. 
MRK.6.2	Líinu'inaa liá'a éerri nawówa íyabactacoo, lichána léewidacai sinagoga rícu. Manuábani chóniwenaica, néemi ná'ee Jesús éewidaca, nasáta néemiu nacáarrudau néemicani:
MRK.6.2	—¿Tanácucha léewidau léji liéni bájiala liá'a léenaa? ¿Tanácucha lijéda léji liéni liwíteeshica ya léji liéni jócai wacába cáji limédanica? 
MRK.6.3	Léwa carpintero liáni, María cúuleeca, Santiago, José ya Judas ya Simón léenajirri, léenajinai íina yáainai wáiibi áani.
MRK.6.3	Tánda jóca néewa naméda liwánacaala. 
MRK.6.4	Ne Jesús má'ee nalí:
MRK.6.4	—Quinínama cáinabi naméda liwánaca liá'a íiwadedeerri Dios chuáni báinacu, ne jócaita lishínaa cáinabi íta'au, jócaita léenajinai íibi ya líibana rícu.
MRK.6.5	Jóca léewa liméda jócai wacába cáji, bácai rími licháanaa licáajiu nanácu áabi nabálineneecoo ya lichúnique'e nayá, jiníwita jócala quinínama néebida linácu. 
MRK.6.6	Licáarrudau licába nayá jócala chóniwenai éebida linácu.
MRK.6.6	Jesús jínaniu chacáalee júbini rími urrúni léewida limácoo. 
MRK.6.7	Limáida nayá náa'a doce éewidenaicoo Jesús yáajcha, jáiwa libánua jíni chámatanaa, liá nadánani najédau'inaa espíritu máashiini. 
MRK.6.8	Jáiwa limá nalí jiní béecha natéeni iníjbaa lícu, báajui rími licháque'e. Jóca néewa natée chácala ya páani ya warrúwa. 
MRK.6.9	Néewa nasúwa cotiza, ne jóca natée íibalashi áabai rími. 
MRK.6.10	Limá'ee nalí:
MRK.6.10	—Jáicta iwárroo áabai chacáalee rículai, imáacau áabai cuíta lícu já'a cáashia yáacoo néenee. 
MRK.6.11	Táshia jócta nawówai narríshibia iyá jíni, jócta nawówa néemirru, ijiáu liúcha icúsudau íiba tábiu, quéewique'e jái náiiwa nalí bésuneerri'inaacoo.
MRK.6.12	Néenee najiáwai náa'a éewidenaicoo namá'ee chóniwenairru néejuedaque'e nayáu Diosru. 
MRK.6.13	Íchaba espíritu máashii najéda lécchoo, ya íchaba nachúni bálineneu nachánaa nanácu aceite.
MRK.6.14	Rey Herodes léemi natáania Jesús nácu, líiwanaa cáarralia'eewoo quinínama. Ya limá'ee Heródesca: “Juan Bautista jái cáwiacuwai báaniu, tánda liwáalia lidánaniu, limédau jócai wacába cáji.”
MRK.6.15	Áabi má'ee: “Léewa liá'a íiwadedeerri Dios chuáni báinacu Elías ya áabi: Chaléjta íiwadedeerri Dios chuáni báinacu sánamica.”
MRK.6.16	Ne Herodes, léemi'inaa lé'ilieni, limá'ee:
MRK.6.16	—Juan waliérra, nuyá wána nawíchua liwíta, ne léejoo licáwiacuwai.
MRK.6.17	Ruwánaca ruá'a Herodíasca, Herodes wána nawína Juan ya nawána nabájicani cadénayu ya nawárrueda cuíta manúmai rícula, Herodías líinu liá'a Felipeca, éenajirri liá'a Herodes, ne Herodes cáaserriu ruájcha. 
