LUK.7.13	Zumbe akimwona azabulwa ni utungu naye, azamuti: Ushelile! 
LUK.7.14	Azahita, azadowa ija nkingo, ne waja wainuzi wahoγoloka. 
LUK.7.15	Azalonga: Mubwanga, nakuti: Inuka! Yuja muntu afileye ne ahoikala, azaandiila kulonga, azamwinkila kwa nine. 
LUK.7.16	Woγa uzawaingila waja woshe, wazamtogola Mulungu wakiγamba: Mteγanyi mkulu azalawila kwetu, Mulungu azaolela mbali yakwe. 
LUK.7.17	Inu mbuli yakwe izahita, izagisa shi ngima ya Yudeya na shi zoshe zehampikana nayo.
LUK.7.18	Yohana azaukwilwa ivi vyoshe ni wahina wakwe. 
LUK.7.19	Azaitanga wahina wakwe waili, azawatuma kwa Zumbe angwe: Iwe u yuja mweiza, hambu tiafize mtuhu? 
LUK.7.20	Waja wantu wakibula kwakwe wazamuti: Yohana Mubatizi azatituma kwako angwe: Iwe u yuja mweiza, hambu tiafize mtuhu? 
LUK.7.21	Ija minga azahonya wangi mahisho yawe na vilema na mpepo mbada, hata matuntu mangi azayafila mbazi, yaone. 
LUK.7.22	Azawalandula angwe: Hitai, mumwukwile Yohana muvyoona na muvyoiva: Matuntu yaona, washiwodaha kuγenda waγenda, wakoma waushiγwa ukoma, washiwoiva waiva, wafilewo wafufulwa, wakiwa wabilikilwa nyemi. 
LUK.7.23	Mwe nyemi ni ndiye asheihilwe ni miyo! 
LUK.7.24	Waja walau wa Yohana wakibinda kuhita, azaandiila kuuzanya na wantu mbuli ya Yohana kuγamba: Kumbe aho mkizahita mwe nyika muhitile kwa olelai? Ni lasi jevuviγwa ni mpeho? Hambu muhitile kwa olelai? 
LUK.7.25	Ni muntu azwikileye shuke zedeeleka? Olelai! Wezwika shuke ntana na weja kizumbe wa mwe vitala. 
LUK.7.26	Miya lushe muhitilei? Kwa olela mteγanyingwa? Kweli namiti: Ni mkulu kuzinka mteγanyi. 
LUK.7.27	Uyu ne mwegondelwa kuγamba: Olela! Nezenitume mlau ywangu akakulongwele, na kukutulila sila yako, ndiyo ugwile. 
LUK.7.28	Nainiti: Woshe wavyelwewo ni wavyele nkakuna mkulu kumzinka Yohana Mubatizi; miya mweγaluka mdodo mwe uzumbe wa Mulungu ni mkulu kumzinka. 
LUK.7.29	Wantu woshe wamwivilewo, hata wangelu wazaitikila utanda wa Mulungu, wazabatizwa na ubatizi wa Yohana. 
LUK.7.30	Miya Mafaliseyo na watamulomongwa wazabela viya, Mulungu avyokunda, nkawabatizwe ndiye. 
LUK.7.31	Zumbe azawati: Wantu wa inu mbali niwafanyanye na mbwai, wavyofanana navyo? 
LUK.7.32	Wafanana na wana wadodo weikala lwazoi, welongana angwe: Tizamitowela inywi miluli, miya nkamvinile, tizamitumbwila ndilo, miya nkamulizite. 
LUK.7.33	Hambu Yohana Mubatizi azaiza, nkajile nkande, nkanywele mvinyo, lushe mwaγamba: Ana mpepo. Ṅwanangwa 
LUK.7.34	ywa muntu azaiza, aaja, aanywa, lushe mwaγamba: Shuyu muntu mwejilisha na kunywelesha mvinyo! Wangelu na wahuza ni ṅwiyae ywawe! 
LUK.7.35	Kweli viyuγo vikanilwa ni viya vyoshe viγosholwevyo ndivyo.
LUK.7.36	Kuna Faliseyo, azamlalika, aje nkande naye. Akiingila mwe nyumba ya yuja Faliseyo azaikala haja ha jiila nkande. 
LUK.7.37	Kangi kuna mvyele mhuza mwe uja muzi; yuja akitaila, kuti aja nkande mwa yuja Faliseyo, azahita, azaγuwa kakomba ka mafutilo ya mluziluzi; 
LUK.7.38	azaγoloka nyuma hadodo he milundi yakwe akilila, ne ahoandiila kugisa milundi yakwe meshozi na kuyahonola na swili za mutwi wakwe, kangi azafyosa milundi yakwe na milomo yakwe, akibinda azaishisha yaja mafutilo. 
LUK.7.39	Yuja Faliseyo amlalikeye akiviona azafanyanya mwe moyo wakwe kuγamba: Ati uyu ni mteγanyingwa, anga azataila, uyu mvyele mwemdowa alivyo, kuti ni mhuza ṅwenye. 
LUK.7.40	Yesu azamlandula angwe: Simoni, nina vya longa na iwe. Angwe: Mfuzi, longa! 
LUK.7.41	Angwe: Ne kwina muntu akopiγweye ni wadeni waili, muṅwe akopile shilingi magana mashano, ṅwiyae milongo mishano. 
LUK.7.42	Wakishowa vya liha, woshe waili azawafila mbazi washelihe; lushe ndiye amkundishe kumzinka ṅwiyae, ni yuhi? 
LUK.7.43	Simoni azahitula angwe: Naγamba: Ni yuja afilweye mbazi kuzinka ṅwiyae. Azamuti: Uzaliγanyanya vyedi. 
LUK.7.44	Azamhitukila yuja mvyelengwa, azamlonga Simoni: Wamwona uyu mvyelengwa? Nizaingila nyumbai mwako, nkuninkile mazi ya kuhaka milundi, miya uyu azagisa milundi yangu meshozi, akibinda azayahonola na swili zakwe. 
LUK.7.45	Iwe nkufyosane na imi milomo; miya uyu, ivyo aingilevyo, nkadizile kufyosa milundi yangu. 
LUK.7.46	Mutwi wangu nkuushishize mavuta, miya uyu azashisha milundi yangu mafutilo ya mluziluzi. 
LUK.7.47	Nakuti: Kwa ivyoho mahuza yakwe mangi yazaushiγwa, hambu mikundishize yakwe ni mingi; miya mweushiliziγwa viγeke, mikundishize yakwe ni miγeke. 
LUK.7.48	Azamuti yuja mvyele: Mahuza yako yazaushiγwa. 
LUK.7.49	Waja weja nkande haṅwe naye wazaandiila kufanyanya mwe myoyo yawe kuγamba: Uyu ni ndai, akiushiliza wantu mahuza? 
LUK.7.50	Azamγamba yuja mvyele: Mitozesheze yako izakuvunila; hita mpeho!
LUK.8.1	Vikibinda azaanga ṅwenye mwe mizi, hata mwe mizi tanga yoshe akihilikila uja ubilikizi wedi wa uzumbe wa Mulungu; 
LUK.8.2	hata waja kumi na waili ana nawo, hata kabumba ka wavyele wahonyiγwewo mpepo mbada na manyonge, wakina Maliya mweitangwa Magadalene aingatilwaye mpepo mfungate, 
LUK.8.3	na Yohane, mkaza Kuza, mshaka mali ywa Helode, na Susana na wangi watuhu, ne wawashuγilewo na viya, wavyona navyo.
LUK.8.4	Wantu wangi waunganana, wakilawa mwe mizi, wamtimile. 
LUK.8.5	Azawalonga kilushimo angwe: Kuna mhasi, azalawa kwa myaγa mbeyu zakwe; akimyaγa mbeyu, kuṅwe zizagwa silai, zizajatwajatwa, kangi videγe vyeanga ulanga vizazija. 
LUK.8.6	Kuṅwe zizagwa he mawe; zikilawa zizanyuluka, kwa kuti nkazina shanga ye mneho. 
LUK.8.7	Kuṅwe zizagwa he miwa gati, ija miwa izalawa yohena, izazifuwa. 
LUK.8.8	Kuṅwe zizagwa mwe shanga ntana, zizalawa, zizavukila kagana. Akilonga ivyoho azaγamba: Mwena mashikilo yeiva neaive! 
LUK.8.9	Wahina wakwe wazamwuza, ati bontokelo ja ulu lushimo ni mbwai. 
LUK.8.10	Azawati: Inywi mzafiiwa mbazi, mtaile vihili vya uzumbe wa Mulungu, miya watuhu wavilongwa kishimo, kangwe wakiviolela washeone bontokelo, wakiviiva washevitaile. 
LUK.8.11	Shiji bontokelo ja ulu lushimo: Ija mbevu ni mbulingwa ya Mulungu. 
LUK.8.12	Ziya zigwelezo silai ni waja weiva, miya vikibinda yuja ṅwenye leba aiza, ausha mbulingwa mwe myoyo yawe, kangwe washezatozesha wakivunilwa. 
LUK.8.13	Ziya zigwelezo he mawe ni waja wehokela mbulingwa na nyemi wakiiiva, kangi awa nkawana sindo, watozesha mishi miγeke, miya mishi ya kuγezwa wabahuka. 
LUK.8.14	Ziya zigwelezo he miwa ni waja weiva, miya sungu na mali na nyemi za kiinushi zaγenda zikifuwa, bindilizo nkawana kuwo. 
LUK.8.15	Miya ziya zigwelezo mwe shanga ntana ni waja weiva mbulingwa na kuitozesha mwe myoyo yeziha vitana, ne wevukiza na kuzizimiza.
LUK.8.16	Nkakuna mwekoleza taa akiifunikila ngahu ao akiiika mzunguwi kwe lusazi, miya aiika he kiikilo chakwe, kangwe wemwingila waone langaila. 
LUK.8.17	Hambu nkakuna mbuli ifishiγweyo, ndiyo ishebunkuke, nkakuna vye njamanjama, ndivyo vishelawile na weluwi. 
LUK.8.18	Olelai miivile yenyu! Hambu mwena kitende atainkwa vivyoho, kangi ashinaye atahokwa hata viya, avyofanyanya, kuti ni vyakwe.
LUK.8.19	Nine na wanduγuze wazaiza kwakwe, miya kwa mbuli ya wantu wangi nkawadahile kumubulila. 
LUK.8.20	Azaukwilwa kuti: Nyokwe na wanduγuzo waiγoloke uko se, wakunda kukuona. 
LUK.8.21	Azawalandula waja angwe: Mlala ywangu na wenetu ni waja weiva mbuli ya Mulungu na kuiγoshola.
LUK.8.22	Mushi muṅwe ṅwenye azaingila na wahina wakwe mwe chombo, azawati: Netiomboke bahali na sheja jiya! Wazahita. Wakiγendanachombo azasisila. 
LUK.8.23	Kuzaikila mpeho nkulu yekuntisha na nguvu na mwe bahali, chombo chawe chizaγubikwa ni maimbi, wazaona nkondo nkulu. 
LUK.8.24	Wazamwizila, wazamwinula angwe: Mγolokezi! Mγolokezi! Taaγa! Yujaazainuka, azavailaija mpeho na maimbi ya mazi, ne vihotongomala na kuhombwela. 
LUK.8.25	Miya azawati: Kutozesha kwenyu ku kuhi? Wazaingilwa ni woγa, wazamaka, wazaγambilana: Ni muntu ani uyu mwelaγiliza mpeho na mazi zikimwitika!
LUK.8.26	Wazaiγala chombo chawe na kwe shi ya Gadala, ni sheja jiya ja Galileya. 
LUK.8.27	Akilawa kuja kwe chombo azakintana na muntu ywa muja kaya mwehuma mpepo, mishi mingi nkazwikile shuke, nkaikale kaya, aikala kwe mbila. 
LUK.8.28	Akimwona Yesu azakema na kanwa kikulu haṅwe na kumkinila angwe: Nina mbwai imi na iwe Yesu, ṅwana Mulungu mwe uko ulanga? Nakuhembeleza, ushenilumize! 
LUK.8.29	Hambu ailaγilize ija mpepo ye usaba, ilawe mwe yuja muntu. Hambu mishi mingi ne ikimgwila na kumγulusha, azashungwa na mpingu na magogolo, kangi azaγojiγwa, miya aakadwisha viya, akantiγwevyo navyo, azaγulushiγwa ni ija mpepo na mwe nyika. 
LUK.8.30	Yesu azamwuza: Zina jako ni weyo ndai? Angwe: Makulija, kwa kuti mpepo nyingi zizamwingila. 
LUK.8.31	Zizamhembeleza, ashezilaγilize kuhita na kuzimu. 
LUK.8.32	Kuja ne kwina ifyo kulu ja nguluwe zelishiγwa mwe mulima; ziya mpepo zizamhembeleza, azikundize kuingila mwe ziya nguluwe; azazikundiza. 
LUK.8.33	Ne ziya mpepo ziholawa mwe yuja muntu, zizaingila mwe ziya nguluwe, ne jiya ifyo jiholumbila kunguwi na mwe bahali, zizanywilimila, zizafa. 
LUK.8.34	Walishi wakiviona viya viγosholekevyo wazanyilika, wazabilikila inu mbuli kuja kaya, hata kwe mizi tanga. 
LUK.8.35	Wantu wazalawa, waolele viya vitendekevyo; wakiiza kwa Yesu wazamwona yuja muntu aukilweye ni ziya mpepo, aiikale he milundi ya Yesu, aikiγubike shuke, ni mtana lushe, ne wahoingilwa ni woγa. 
LUK.8.36	Waja wavienewo, wazawaukwila, yuja ahumileye mpepo ahonyiγwevyo. 
LUK.8.37	Wantu woshe wa ziya shi ze hehi na shi ya Gadala wazamhembeleza, auke kuja kwawe, hambu wazagwilwa ni woγa ukulu; 
LUK.8.38	ne ahoingila mwe chombo, azaγotoka. Yuja muntu aukilweye ni mpepo azamhembeleza, ahite naye; miya azamshungula akimuti: 
LUK.8.39	Uya na kaya kwako, ukabilikile vyoshe, Mulungu akuγoshwelevyo! Azahita, azaanga mwe mizi yoshe akibilikila vyoshe, Yesu amγoshwelevyo.
LUK.8.40	Yesu akiuya, wantu wangi wazamsingila, hambu woshe ne wakimwafiza. 
LUK.8.41	Kuzaiza mγoshi mweitangwa Yailo, uyu ni mfuṅwa ywa vikilo. Azamkinila Yesu he milundi, azamhembeleza, 
LUK.8.42	ahite naye nyumbai mwakwe, kwa kuti ana ṅwana ywa kindele muṅwe du, abindileye mavuli kuminamaili, uyu azabuza kufa. Wakihita, wantu wangi wazamshushumila. 
LUK.8.43	Kuna mvyele alawileye mpome mavuli kumi na maili, azabinda mali yakwe yoshe kwa waγanga, kangi nkawadahilekumhonya; 
LUK.8.44	uyu azamwizila nyuma, azadowa lusiniko lwa nkazu yakwe, viya du lushe mpome izaleka kulawa. 
LUK.8.45	Yesu azauza: Anidowaye ni ndai? Woshe wakikela nkani, Petelo azalonga: Mγolokezi! Wantu wangi wakufinta na kukushushumila, 
LUK.8.46	nini ukiγamba: Anidowaye ni ndai? Angwe ni Yesu: Kuna anidowaye, hambu nizaiva, nguvu ikilawa mwe ṅwili wangu. 
LUK.8.47	Yuja mvyele akiona, kuti nkadaha kukifisha, azaiza na kudidima, azamkinila, azamwukwila, wantu woshe waiivile, vilekilevyo akimdowa, kangi ahonilevyo viya du lushe. 
LUK.8.48	Yuja azamuti: Ṅwanangu! Mitozesheze yako izakuhonya; hita mpeho! 
LUK.8.49	Akelonga naye, kuzaiza muntu ywa yuja mfuṅwa ywa vikilo, azamuti: 
LUK.8.50	Ṅwanawo azabinda kufa, ushemwonye mfuzi luiali! Yesu akiviiva azaγamba: Usheogohe! Tozesha du! Neahone! 
LUK.8.51	Akibula he ija nyumba nkakundize muntu, akiingila naye, kushima Petelo na Yohana na Yakobo na ishe ja ṅwana na nine. 
LUK.8.52	Woshe we muja nyumbai wazamlilila na kukitowa vifuwa. 
LUK.8.53	Yesu azawati: Mshelile! Nkafile, miya atesisila du. Wazamsheka, hambu waitaile, kuti azafa. 
LUK.8.54	Azatoza mkono wakwe, azamlonga angwe: Ṅwanangu, inuka! 
LUK.8.55	Azauya moyo, azainuka viya du lushe; azalaγiliza, ainkwe vya ja. 
LUK.8.56	Wavyazi wakwe wazashentuka; miya azawalongesha, washezavimγambila muntu viya viγosholekevyo.
LUK.9.1	Azaitanga waja kumi na waili, waunganane, azawainka nguvu na ufuṅwa wa kuingata mpepo zoshe na wa kuhonya mahisho. 
LUK.9.2	Azawatuma, wabilikile uzumbe wa Mulungu, wakahonye wanyonge. 
LUK.9.3	Azawati: Mshetoze vya silai, ati ni ngoda, ati ni bene, ati ni funge ya nkande, ati ni feza! Hata nkazu mbili muntu ashezwike! 
LUK.9.4	Ndimo mwingile mwe nyumba ya muntu, ikalai mumo, mpaka mkizalawa mwe uwo muzi! 
LUK.9.5	Ndiwo washemihokele, lawai mwe uwo muzi, mkiwahuγutila vumbi jitozizejo milundi yenyu, jiwaγalukile uwona! 
LUK.9.6	Waja wazalawa, wazaanga mwe ija mizi wakibilikila mbulingwa, kangi koshe koshe wazahonya watamu.
LUK.9.7	Zumbe Helode akiiva viya vyoshe azaaγilwa, hambu wantu kuṅwe wazalonga kuti: Yohana atefufuka kwa wafilewo; 
LUK.9.8	miya kuṅwe wazalonga kuti: Eliya atelawila, kuṅwe wazalonga kuti: 
LUK.9.9	Wateγanyingwa wa kale ṅwiyae ywawe muṅwe atefufuka. Miya Helode azafanyanya kuγamba: Yohana imi nizamkoma na kumshenga mutwi, lushe uyu, niyemwiva mbuli zakwe, ni ndai? Azalonda, ndivyo amwone.
LUK.9.10	Ziya ntuṅwa zikiuya wazamshimwela vyoshe, waγosholevyo. Azawaγuwa, azahita nawo, wai wenye du he muzi weitangwa Betisayida. 
LUK.9.11	Wantu wakivitaila wazamtongela; azawahokela, azawaγambila mbuli za uzumbe wa Mulungu, kangi waja wehuma azawahonya. 
LUK.9.12	Mushi ukiunga kushwa, waja kumi na waili wazamwizila angwe: Shungula wantungwa, wazunguluke kwe mizi na kwe mbuwa, walonde mafikilo, kangwe waone vya ja! Hambu kunu ti mwe nyika. 
LUK.9.13	Azawaiandula angwe: Wainkei inywi, waje! Angwe ndiwo: Nkatina nkande kushima migate mishano na fi mbili; hambu tihite ishwi, tiwaγulile awa wantu woshe nkande? 
LUK.9.14	Hambu waγoshi viya ni makulija mashano. Miya azawati wahina wakwe: Waikazei ndala ndala, kila ndala milongo mishano! 
LUK.9.15	Wazaγoshola ivyoho, woshe wazaikala shi. 
LUK.9.16	Azaγuwa ija migate mishano na ziya fi mbili, azaolela na kwe lwingu, akilavya ntogolo, azaibendulabendula, azaiinkila kwa wahina wakwe, waiiγale kwa waja wantu. 
LUK.9.17	Woshe wazaja, wazaiγula, kangi mpuγutishi zishiγalezo zizadodolwa ngahu kumi na mbili.
LUK.9.18	Mushi akivika ike ṅwenye, wahina wakwe wazamwizila, azawauza angwe: Wantu waγamba, kuti imi ni miyo ndai? 
LUK.9.19	Wazamhitwila angwe: Kuṅwe waγamba: U Yohana Mubatizi, kuṅwe waγamba: U Eliya, kuṅwe waγamba: Wabilikizi wa kale ṅwiyae ywawe muṅwe atefufuka. 
LUK.9.20	Azawati: He inywi muγamba, kuti ni miyo ndai? Petelo azalonga angwe: U Kilisito ywa Mulungu. 
LUK.9.21	Miya azawashunda, washezamγambila muntu mu mbuli.
LUK.9.22	Azawati: Ṅwanangwa ywa muntu vyamtala, alumiziγwe vikulu, abentwe ni waγolokezi na wavikizi wakulu na watabaluwangwa, mpaka akoṅwe, afufuke mushi wa ntatu.
LUK.9.23	Azawaγamba woshe: Ati muntu akunda kunitongela, shuti anekilemeza ṅwenye, ainule kila mushi muti wakwe wa kukomelwa, ne ndivyo adahe kunitongela. 
LUK.9.24	Hambu mwekunda kuhonya moyo wakwe atazakihosa; miya mwehosa moyo wakwe kwa mbuli ya imi atazakihonya. 
LUK.9.25	Hambu muntu nezeaonele mbwai, hata akimota ngulu ngima, akikiaza ṅwenye na kuhosiγwa ndivyo? 
LUK.9.26	Hambu ndiye atendwe ni shoni na imi ao du na mbuli zangu, uyu ṅwanangwa ywa muntu atazatendwa ni shoni naye akizaiza na utana wakwe na wa ishe na wa walau waṅazi. 
LUK.9.27	Kweli namiti: Awa weγoloka aha weyae wawe kuṅwe nkewaone kifa, shuti waneona uzumbe wa Mulungu.
LUK.9.28	Akibinda kulonga izi mbuli, hakizinka, ati ni mishi mnane, azamγuwa Petelo na Yakobo na Yohana, azakwela nawo mwe ntuli kwa vika. 
LUK.9.29	Aho akivika, shula ya cheni chakwe izaγalamuka; hata shuke yakwe izanamanikisha, viya ni lumuli. 
LUK.9.30	Kangi kuna waγoshi waili naye, ni Mose na Eliya; 
LUK.9.31	awa wazalawila na utana, wazalonga, mbuli yakwe ndivyo ihite kwa bontokela Yelusalemu. 
LUK.9.32	Petelo na weyae wazaizilwa ni usisiza ungi. Wakiviluka wazaona utana wakwe na waja waγoshi waili weγoloka haṅwe naye. 
LUK.9.33	Waja wakiuka kwakwe, Petelo azamuti Yesu: Mγolokezi, vyatama, tikiikala kunu, tizenge makumbi matatu, iṅwe jako, iṅwe ja Mose, iṅwe ja Eliya! Nkataile avyolonga. 
LUK.9.34	Akilonga ivyoho, kuzaiza zunde kulu jizawagwishiliza mpungo; miya aho wakiγubikwa ni jiya zunde wazabulwa ni woγa. 
LUK.9.35	Muja mwe zunde muzalawa kanwa angwe: Uyu ni ṅwanangu nimshaγuleye, mwivei! 
LUK.9.36	Ichi kanwa chikiiviγwa, Yesu azaoniγwa, kuti a ike. Miya waja nkawavilongile, nkakuna wamγambileye mishi ija viya, waenevyo, hata mbuli ṅwenga du.
LUK.9.37	Mhitu wakwe wakisheela mwe ija ntuli wazakintana na wantu wangi; 
LUK.9.38	mwe jiya bumba ja wantu muna mγoshi mweitanga na kanwa kikulu angwe: Mfuzi, nakuhembeleza, umkaule ṅwanangu! Hambu ni ṅwanangu mwe ike. 
LUK.9.39	Olela: Mpepo ikimgwila, viya du lushe atakema, yamshindikashindika, mpaka akilawa tefu; ikibinda kumtiγintisha nkaikunda vyedi kumwukila. 
LUK.9.40	Nizahembeleza wahina wako, waiingate, miya nkawaidahile. 
LUK.9.41	Yesu azawalonga angwe: Mbali inu nkaitozesha, izabinda kuaγilwa. Niange na inywi mpaka lini? Nimizizimizize mpaka hii? 
LUK.9.42	Mulete ṅwanawo na kunu! Aho akiiza, ija mpepo izamhuna na kumshindika; miya Yesu azaivaila ija mpepo ye usaba, azamhonya yuja ṅwana, azarowinkila kwa ishe. 
LUK.9.43	Woshe wazamaka ukulu wa Mulungu.
LUK.9.43	Woshe wakimaka viya vyoshe, aγosholevyo, azalonga kwa wahina wakwe angwe: 
LUK.9.44	Gelai izi mbuli mwe mashikilo yenyu! Hambu ṅwanangwa ywa muntu aunga kuinkilwa mwe mikono ya wantu. 
LUK.9.45	Miya waja nkawataile inu mbuli, viya itefishiγwa, isheingile mwe mashikilo yawe, washeiive, kangi wazaogoha kumwuza inu mbuli.
LUK.9.46	Kuzaoneka nkanani kwawe, ati mkulu ywawe ni ndai. 
LUK.9.47	Yesu akitaila nkanani za myoyo yawe azaγuwa kazana, azakaγolosha haja, aliho, azawati: 
LUK.9.48	Ndiye ahokele aka kazana kwa mbuli ya zina jangu, anihokela imi; kangi ndiye anihokele imi, amhokela yuja anitumileye. Hambu mweγaluka mdodo ṅwenye kwenyu uyu ni mkulu. 
LUK.9.49	Yohana azamlonga angwe: Mγolokezi, tizamwona muntu mweingata mpepo kwa nguvu ya zina jako, tizamfingiza, kwa kuti nkaanga na ishwi. 
LUK.9.50	Yesu azamuti: Mshemfingize! Hambu ashiyetiikila nkani, ne mweivana na ishwi.
LUK.9.51	Mishi ikitimiza, aushiγwe kunu shi, ṅwenye azaoleza cheni chakwe na Yelusalemu, ahite na γuko. 
LUK.9.52	Azalongoza ntuṅwa; wazahita, wazaingila mwe muzi wa Samaliya, kangwe wamliγanyize fikilo. 
LUK.9.53	Miya nkawamhokele, kwa kuti aioleze cheni na Yelusalemu, ahite na γuko. 
LUK.9.54	Waja wahina Yakobo na Yohana wakiviona wazamuti: Zumbe, wakunda, tilonge, moto ulawe mwe lwingu, ukawabinde? 
LUK.9.55	Miya azahituka, azawavaila, azawati: Nkamtaila, ati inywi mu wana mpeho ani? 
LUK.9.56	Ṅwanangwa ywa muntu nkaizile kwa hosa myoyo ya wantu, miya kwa ihonya. Wazahita kwe muzi mtuhu.
LUK.9.57	Kuja silai, wakihita, kuna amlongileye: Nikutongele, ndiko uhite nako! 
LUK.9.58	Yesu azamuti: Mpelele zina maleme, madeγe yeanga ulanga yana masasa, miya ṅwanangwa ywa muntu nkana ha ikila mutwi. 
LUK.9.59	Mtuhu azamlonga ṅwenye: Nitongela! Miya azamlandula: Nikundiza, ninehita kwa mzika tate! 
LUK.9.60	Angwe: Leka, wafilewo wazike weyae wawe wefa! Miya hita, ukabilikile uzumbe wa Mulungu! 
LUK.9.61	Mtuhu azalonga: Nenikutongele, Zumbe; miya azanikundiza, nihite kwa laga waja, ndiwo nikiikala nawo! 
LUK.9.62	Yesu azawati: Mwetoza γembe na mkono na kuolela na nyuma, nkakombaγanya uzumbe wa Mulungu.
LUK.10.1	Vikibinda Zumbe azagimbika watuhu milongo mfungate, azawatuma wailiili, wamlongwele na mwe mizi yoshe na hantu hoshe, ṅwenye akundileho kuhita naho. 
LUK.10.2	Azawati: Uluki ni ukulu, miya wandima ni waγeke. Mhembelezei ṅwenye uluki, atume wandima kwe uluki wakwe! 
LUK.10.3	Hitai! Olelai: Imi namituma, viya mu ngoto, na kwe mashuwi gati. 
LUK.10.4	Msheinule misipi na mabene na vilatu! Msheluγushane na muntu silai! 
LUK.10.5	Nyumba, ndiyo mwingile, munelonga: Mpeho na inu nyumba! 
LUK.10.6	Ati mwe iyo nyumba muna mweagiziγwa ni mpeho, mpeho yenyu itamwikaila; ati nkamna, itamiuyiya. 
LUK.10.7	Mwe ija nyumba ikalai, muje, munywe muvyoinkwa ni waja wenye! Hambu mndima aagiziγwa ni upokezi wakwe. Msheshindelawa mwe nyumba, mkiingila ntuhu! 
LUK.10.8	Muzi, ndiwo mwingile, wakimihokela, jai muvyoletelwa! 
LUK.10.9	Kangi honyai wanyonge we muja! Vikibinda waγambilei kuti: Uzumbe wa Mulungu uzamibulila hehi! 
LUK.10.10	Muzi, ndiwo mwingile, wakishemihokela, mulawile na lwazoi, muwaγambe: 
LUK.10.11	Hata vumbi jitozizejo milundi yetu umu kaya mwenyu tajimihuγutila, komo tailai kuti: Uzumbe wa Mulungu uzamibulila hehi! 
LUK.10.12	Namiti: Masa ya Sodoma, ndiyo yagwe uja mushi, nezeyahuhe kuzinka ayo ya uwo muzi. 
LUK.10.13	Ukatabanika, Kolazini! Ukatabanika, Betisayida! Hambu ati kuja Tilo na Sidoni kwaaγoshwelwa viya vilozo viγosholwevyo kwenyu, anga wavoteka kale na kukanta maguniya na kukigela zelu. 
LUK.10.14	Kweli mlaho wa Tilo na wa Sidoni, ndiwo ugwe uja mushi wa masa nezeuhuhe kuzinka wenyu. 
LUK.10.15	Hata iwe Kapelinaumu, nkukweziγwe mpaka kwe lwingu? Nezeushindikwe na uko ishi kuzimu! 
LUK.10.16	Mwemiiva inywi aniiva imi, mwemibela inywi anibela imi; miya mwenibela imi amubela yuja anitumileye.
LUK.10.17	Waja milongo mfungate wazauya na nyemi angwe: Zumbe, hata mpepo zizatiitika kwa nguvu ya zina jako! 
LUK.10.18	Azawati: Nizamwona Satani, akishindikwa mwe lwingu, akikina sa lumuli. 
LUK.10.19	Olelai! Nizaminka ufuṅwa wa kujata mwe nyoka na visuse, muvote nguvu zoshe za yuja munkulu, nkakuna ndivyo vimiifye. 
LUK.10.20	Miya mshetamilwe, kuti mpepo zamiitika! Tamilwai, kuti mazina yenyu vaigondiγwe mwe lwingu!
LUK.10.21	Haja ne Yesu atowileho zumo akimema mpeho mṅazi akilonga: Nakulaviliza ntogolo, iwe Tate, Zumbe ywa lwingu na ywa shi, kuti izi mbuli watalizi na waviyuγo uzaziwafisha, miya uzazifumbwila wankebe. Kweli, Tate, ne vikutamilevyo. 
LUK.10.22	Vyoshe nizaviinkwa ni Tate, nkakuna mwemtaila ṅwanangwa, kushima Tate, kangi nkakuna mwemtaila Tate, kushima ṅwanangwa na yuja, ṅwanangwa ndiye akunde kumlaviliza.
LUK.10.23	Azahituka kwa wahina wakwe, azawaγamba wawo du: 
LUK.10.24	Mesho yeona viya, muvyoona, yana nyemi. Hambu namiti: Wateγanyi na wazumbe wangi wazaheheleziγwa ni kuona viya, inywi muvyoona, miya nkawaviene; hata kuiva viya, muvyoiva, miya nkawaviivile.
LUK.10.25	Kuna mtamulomongwa, azainuka, amγeze, azamuti: Mfuzi, nitende vivihi, kangwe nezenipale nkalamo ya kale na kale? 
LUK.10.26	Yuja azamuti: Mwe mulomongwa mugondiγwe mbwai? Ufyomile zeze? 
LUK.10.27	Angwe ndiye: Umkundishe Zumbe, Mulungu ywako, kwa moyo wako woshe na kwa mpeho zako zoshe na kwa nguvu zako zoshe na kwa ntongonyezi zako zoshe! Vikibinda umkundishe ṅwiyawo, sa uvyokikundisha ṅwenye! 
LUK.10.28	Azamuti: Uzaitikila vitana, viγoshole, neukalame! 
LUK.10.29	Yuja azakunda kukikanila ṅwenye, azamγamba Yesu: Lushe ṅwiyangu ni yuhi? 
LUK.10.30	Yesu azaγuwa ija mbuli, azalonga: Kuna muntu alawaye Yelusalemu, asheele na Yeliko, azaγomelwa ni wampoko; awa wazamzula shuke zakwe, wazamtowesha; wakihita wazamwasha, aibuzize kufa. 
LUK.10.31	Vizateγana, mvikizi azasheela mwe ija sila, akimwolela azaomboka. 
LUK.10.32	Vivyoho mulevi yohe azabula haja hantu, akimwona azaomboka. 
LUK.10.33	Msamaliya azatongela ija sila, azabula haja; 
LUK.10.34	akimwona azabulwa ni utungu naye, azahila, azakanta vilonda vyakwe haṅwe na kuvigela mavuta na mvinyo; akibinda azamkweza mwe mpunda yakwe ṅwenye, azamdemeza na kwe fikilo, hata γuko azamupikila. 
LUK.10.35	Mhitu wakwe azalavya shilingi mbili, azazimimka yuja ṅwenye fikilo angwe: Mupikile! Ati wabinda mali kuzinka inu, nezenikulihe nikizauya. 
LUK.10.36	Lushe uγambai: Waja watatu, yuja aγomelweye ni wampoko ṅwiyae ni yuhi? Angwe: Ni yuja amfileye mbazi. 
LUK.10.37	Angwe ni Yesu: Hita, ukaγoshole sa viyaho!
LUK.10.38	Wakihita, ṅwenye azaingila mwe muzi: kuna mvyele mweitangwa Malita azamhokela mwe nyumba yakwe. 
LUK.10.39	Yuja ana nduγuye mweitangwa Maliya; uyu azaikala he milundi ya Zumbe akiteγeleza mbuli yakwe. 
LUK.10.40	Miya Malita azapikapika kwa ndima nyingi, azomγoshwela; azabula angwe: Zumbe, nkuihilwa, ṅwenetu akiniashiliza ndima ike? Mulonge, aniambizeambize! 
LUK.10.41	Zumbe azalandula azamuti: Malita! Malita! Waona lulali na lupisho na ndima nyingi; 
LUK.10.42	miya mbuli yeagiza ni ṅwenga du. Maliya azashaγula fungu tana, nkezeajihokwe.
LUK.11.1	Mushi azaikala hantu akivika; akiheza, mhina ywakwe muṅwe azamuti: Zumbe, tihinye kuvika, sa Yohana ahinyizevyo wahina wakwe! 
LUK.11.2	Azawati: Mkivika mγambe: Tate yweshu we uko mwe lwingu! Zina jako jigimbikwe! Uzumbe wako uize! Uvyokunda vibontoke kunu shi sa uko mwe lwingu! 
LUK.11.3	Utinke mishi yoshe nkande yetu yetiagiza! 
LUK.11.4	Utiushilize masa yetu! Hambu hata ishwi tamwushiliza kila muntu atibanilevyo. Ushetiingize mwe miγezo! Miya utivunile mwe vibada! 
LUK.11.5	Azawati: kuna muntu, ana mbuyae, yuja akiiza na kilo kikulu azamuti: Mbuyangu, ninka migate mitatu! 
LUK.11.6	Kwa kuti mbuyangu ashwelweye silai azafikila mwangu, kangi sina nkande za kumunka. 
LUK.11.7	Lushe yuja mwe nyumbai atamlandula kuti: Ushenipishe! Luvi lwizuγalwe, kangi wanangu nina nawo kunu sasai, sikombaγanya kuinuka nikikunka? 
LUK.11.8	Namiti: Ati asheinuka, akimunka, kwa kuti ni mbuyae, miya kwa kuti yuja nkana shoni, atainuka, amunke vyemwagiza.
LUK.11.9	Nami namiti: Lombezal! Nemwinkwe. Londai! Nemwone. Goṅondai! Nemzuγwilwe. 
LUK.11.10	Hambu kila mwelombeza ainkwa, mweionda aona, mwegoṅonda azuγwilwa. 
LUK.11.11	Kwenyu kuna ṅwana, akilombeza ishe nkande, ishe amunke iwe? Ao du akimlombeza kapala, aleke kumunka kapala, amunke nyoka? 
LUK.11.12	Ao akimlombeza tagi, amunke kisuse? 
LUK.11.13	Lushe ati inywi wabada mwadaha kuinka wana wenyu vintu vitana, ishe ywenyu ywa kilwingu asheinke mpeho ṅazi waja wemlombeza?
LUK.11.14	Azaingata mpepo, inu ne ishilonga. Miya ija mpepo ikilawa, 
LUK.11.15	yuja muntu ashilongaye azalonga, wantu wazavimaka. Miya weyae wawe kuṅwe wazalonga; 
LUK.11.16	Aingata mpepo na nguvu ya mzuka, zumbe ywa mpepo. Watuhu wazamγeza wakilonda lwitangilo lweanduka mwe lwingu. 
LUK.11.17	Miya ṅwenye azataila ntongonyezi zawe, azawati: Kila uzumbe ukipangana ṅwenye wachakuka, hata ni nyumba zitakinilana. 
LUK.11.18	Ati Satani akipanga ṅwenye, uzumbe wakwe utoγa zeze? Kwa kuti mwalonga, kuti niingata mpepo kwa nguvu ya mzuka. 
LUK.11.19	Ati imi niingata mpepo kwa nguvu ya Mzuka, wana wenyu waziingata kwa nguvu ya ndai? Kwa ivyoho waja watazamilaha. 
