ACT.10.9	Mhitu wakwe wakiγenda silai, wakibula hehi na kaya, Petelo azakwela talai kwa vika, ni saa mtandatu. 
ACT.10.10	Akibulwa ni sala azakunda kuja. 
ACT.10.11	Wakemuliγanyiza nkande, azashentukisha, hambu azaona, lwingu lwizuγuke, kuzasheela bwesuna jefanana, viya ni shuke nkulu muno ikantiγweyo miswa mine, ikisheleziγwa na shi. 
ACT.10.12	Umo ndai muna nyama nyingi za kunu shi zena milundi na mikono na zetambala na madeγe yeanga ulanga. 
ACT.10.13	Kanwa chizamwizila angwe: Petelo, inuka, ukome, uje! 
ACT.10.14	Petelo azalandula: Zumbe, kale hoshe sajile chena kisitama ao chena ṅwiko. 
ACT.10.15	Vituhu kanwa chizamwizila ka mbili angwe: Viya, Mulungu aushizevyo ṅwiko, iwe ushevizile! 
ACT.10.16	Ivi vizaγosholwa katatu; vikibontoka, viya du lushe jiya bwesuna jizainulwa na mwe lwingu. 
ACT.10.17	Petelo akeganyaganya, ati ijambuli, aeneyo, ina bontokelo ani, ne waja waγoshi watumiγwewo ni Kolineliyo wahouza nyumba ya Simoni, wazaγoloka he kifiγwe, 
ACT.10.18	wazaitanga, wazauza, ati Simoni mweitangwa Petelo afikile mumo. 
ACT.10.19	Petelo akelongonyeza ija mbuli, aeneyo, mpehongwa izamγamba: Shawa waγoshi watatu wekulonda! 
ACT.10.20	Miya inuka, usheele, uhite nawo, ushezakalakasha! Hambu imi nizawatuma.
ACT.10.21	Petelo azasheela, azawati waja waγoshi: Shimi, muyelonda! Ni mbuli ani yeleka, mkiiza? 
ACT.10.22	Wazamγamba: Kolineliyo, mkulu ywa ntimizi, muntu mtanda mwemwogoha Mulungu, mwena kilango kitana kwe mbali ngima ya Wayuda, azalaγiliziγwa ni mlau mṅazi, akutumize, uhite mwe nyumba yakwe, akuteγeleze mbuli, ndizo ulonge. 
ACT.10.23	Azawaitanga na nyumbai, azawafikiza. Mhitu wakwe azainuka, azalawa haṅwe nawo, hata wanduγu kuṅwe we uko Yope wazahita naye.
ACT.10.24	Keloi jakwe azaingila Kesaliya; Kolineliyo ne akiwaafiza, aiunganyanye wanduγu wakwe na wambuyae watana. 
ACT.10.25	Petelo akiingila, Kolineliyo azamsingila, azamkinila he milundi, azamluγusha. 
ACT.10.26	Miya Petelo azamwinula, azamuti: Inuka! Hambu imi nami ni muntu. 
ACT.10.27	Azaingila na nyumbai akitamwilana naye, azaona wangi waungananewo mumo, 
ACT.10.28	azawati: Inywi mwataila kuti: Muntu ywa Kiyuda ana ṅwiko wa kuangilana na kuingila mwa muntu ywa mbali ntuhu, miya imi Mulungu azanionyesha, nishezaγamba: Muntu ana kisitama ao ṅwiko! 
ACT.10.29	Ne vilekilevyo, nikiiza kishi nkani aho nikitumiziγwa. Lushe namiuza: Munitumizize mbuli ani? 
ACT.10.30	Kolineliyo azaitikila angwe: Nizaikala mishi mine, niifungile mpaka ivi lushe aha, saa kenda nizavika mwe nyumba yangu, nizaona mγoshi, aiγoloke he mesho yangu, aizwikile shuke yenamanika, 
ACT.10.31	anili: Kolineliyo, mihembelezeze yako na mbazi zako zizaiviγwa, zizafukilwa ni Mulungu. 
ACT.10.32	Tuma na Yope, umwitange Simoni mweitangwa Petelo! Uyu afikile mwe nyumba ya mnyukula mababu mweitangwa Simoni, he bahali. Ne nihokutumiza viya du lushe, miya iwe uzazifya ukifikaiza. 
ACT.10.33	Lushe ishwi toshe tiiunganane he mesho ya Mulungu, tileγeleze vyoshe, ulaγiliziγwevyo ni Zumbe.
ACT.10.34	Petelo azazuγula kanwa chakwe, azaγamba: Natailisha lushe kuti: Mulungu nkaolela cheni cha muntu; 
ACT.10.35	miya mwe mbali zoshe mwemwogoha na mweγoshola utanda amtamila. 
ACT.10.36	Mbuli yakwe azaituma kwa wana Isilayeli, akiwabilikila mpolele ionekeyo mwe Yesu Kilisito, uyu ni Zumbe ywa vyoshe. 
ACT.10.37	Inywi mwataila, iyo mbuli igisizeyo shi ngima ya Yudeya izaandiila Galileya, izatongela uja ubatizi, Yohana abilikilewo, 
ACT.10.38	ni ija ya Yesu ywa Nazaleti; uyu Mulungu azamwambwila mpeho ṅazi na nguvu, azaanga na kufila wantu mbazi, azahonya woshe wavotiγwewo ni yuja ṅwenye leba, hambu Mulungu azaanga naye. 
ACT.10.39	Kangi ishwi ti waona wa viya vyoshe, aγosholevyo mwe shi ya Yudeya na Yelusalemu. Uyu wazamkoma wakimholeza mwe muti, 
ACT.10.40	miya Mulungu azamfufula mushi wa ntatu, azaleka, alawile, 
ACT.10.41	miya so wantu woshe, ni waja waona du washaγulwewo aho kale ni Mulungu, ni shwiyo tijilewo naye, kangi tinywelewo naye, akibinda kufufuka kwa wafilewo. 
ACT.10.42	Azatilaγiliza ishwi, tibilikile wantu na kuwalongela uwona, kuti uyu ne aikiγweye ni Mulungu, kangwe nezealahe we moyo na wafilewo. 
ACT.10.43	Uyu wateγanyi woshe wamlongela uwona kuti: Kila ndiye nezeamtozeshe, ataushiliziγwa uhuza kwa mbuli ya zina jakwe.
ACT.10.44	Petelo akelonga izi mbuli, Mpeho mṅazi azagwa mwe waja woshe waivilewo mbulingwa. 
ACT.10.45	Washengiγwewo wetozesha, waizilewo haṅwe na. Petelo, wazamakisha, kuti wamzimu wohena wafilwa mbazi na kuinkwa mpeho mṅazi. 
ACT.10.46	Hambu wazawaiva, wakilonga na milongele miγeni na kunitogola Mulungu. Ne Petelo aholonga: 
ACT.10.47	Kuna mwedaha kulemela na mazi, awa washebatizwe? Kangi wazainkwa mpeho mṅazi sa ishwi! 
ACT.10.48	Azalaγiliza, wabatizwe mwe zina ja Yesu Kilisito; wazamhembeleza, aikale kwawe mishi kuṅwe.
ACT.11.1	Ntuṅwa na wanduγu wa Yudeya wazaiva, kuti wamzimu wohena wazahokela mbuli ya Mulungu. 
ACT.11.2	Petelo akikwela Yelusalemu, waja washengiγwewo wazakanana naye angwe: 
ACT.11.3	Uzaingila kwa wantu washishengiγwewo, kangi uzaja nawo. 
ACT.11.4	Petelo azaandiila kuwaonyesha, ija mbuli iγendilevyo, angwe: 
ACT.11.5	Imi ne nikivika mwe muzi wa Yope, nizashentukisha, hambu nizaona, nii mesho, bwesuna jikisheela jefanana, viya ni shuke nkulu muno ikantiγweyo miswa mine, jelawa mwe lwingu; jikisheleziγwa, jizabula haja, niliho. 
ACT.11.6	Nikishungila na muja ndai, nikiolela, nizaona nyama za kunu shi zena milundi mine na makaka na zetambala shi na madeγe yeanga ulanga. 
ACT.11.7	Vikibinda nizaiva kanwa, chikiniti: Inuka, Petelo, ukome, uje! 
ACT.11.8	Miya nizaγamba: Zumbe! Kale hoshe chena kisitama ao ṅwiko nkachaingile mwe kanwa changu. 
ACT.11.9	Kanwa chizalawa mwe lwingu, chizalandula ka mbili angwe: Mulungu aushizevyo ṅwiko, ushezavizila! 
ACT.11.10	Ivi vizaγosholwa katatu, vikibinda vyoshe vizakweziγwa na mwe lwingu. 
ACT.11.11	Viya du lushe waγoshi watatu wazaγoloka he ija nyumba, nilimo, watumiγwe uko Kesaliya. 
ACT.11.12	Miya mpehongwa izaniγamba, nihite nawo, nishezakalakasha. Awa wanduγu mtandatu wazahita haṅwe na imi, tizangila mwe nyumba ya yuja mγoshingwa. 
ACT.11.13	Azatiukwila, aenevyo mlau, aiγoloke mwe nyumba yakwe, akimuti: Tuma na Yope, umtumize Simoni mweitangwa Petelo! 
ACT.11.14	Ne ndiye akuγambile mbuli, ndizo uhonyiγwe nazo ṅwenye na chengo chako kigima. 
ACT.11.15	Nikiandiila kulonga, mpeho mṅazi izagwa mwe waja, sa viyaho igwelevyo kwa ishwi haja kuandiila. 
ACT.11.16	Nizafukila mbuli ya Zumbe, akiγamba: Yohana azabatiza na mazi, miya inywi nezemubatizwe na mpeho ṅazi. 
ACT.11.17	Ati Mulungu azawafila iyo mbazi ṅwenga, atifileyo ishwi, wakimtozesha Yesu Kilisito, lushe imi nina nguvu ani za kumfingiza Mulungu? 
ACT.11.18	Wakiiva ivyoho wazaleka nkani, wazamtogola Mulungu angwe: Kumbe wamzimu wohena Mulungu awakundiza kuhitula ntongonyezi zawe, watende nkalamo!
ACT.11.19	Waja waasakanewo kwa mbuli ya uja ukiwa wa kukoṅwa kwa Sitefano, wazaangisha, wazabula Fonike na Kipulo na Antiyokiya, miya nkawaγambile muntu mtuhu mbulingwa kushima Wayuda. 
ACT.11.20	Miya weyae wawe kuṅwe, ni wa Kipulo na Wakilene, wazaiza Antiyokiya, wazailonga hata kwa Wagiliki, wazabilikila mbuli ya Zumbe Yesu. 
ACT.11.21	Mkono wa Zumbe uzaanga nawo; watozeshewo na kuhituka na kwa Zumbe wazaγelemuka talo kulu. 
ACT.11.22	Inu mbuli yawe izaivika mwe mashikilo ya bumbangwa je nko Yelusalemu, wazamtuma Balinaba, ahite Antiyokiya. 
ACT.11.23	Akibula, akiona ija mbazi ya Mulungu azatamimilwa, azawahimila woshe, waike inu mbuli mwe myoyo yawe, waandakane na Zumbe. 
ACT.11.24	Hambu ni muntu mtana agisizeye mpeho ṅazi, mwetozesha vyedi. Bumba kulu muno jizaiγalwa kwa Zumbe. 
ACT.11.25	Vikibinda azakulawa, azahita Taliso, amlonde Sauli. 
ACT.11.26	Akimwona azamwiγala Antiyokiya. Vuli gima wazaangilana na jiya bumbangwa, wazafuza wantu wangi, kwa ivyoho uko Antiyokiya wantu wazaandiila kuitanga wahina: Wakilisito.
ACT.11.27	Mishi ija wateγanyi walawilewo Yelusalemu wazahita Antiyokiya. 
ACT.11.28	Ṅwiyae ywawe muṅwe mweitangwa Agabo azainuka, azateγanya kwa mpehongwa kuti: Nezekuoneke sala nkulu mwe shi zoshe za ngulu ngima. Igwele mishi ya Kalaudiyo. 
ACT.11.29	Waja wahina wazaivana kuγamba: Kila muntu sa avyoγenyeza, ashanguze kwa mbazi, viiγailwe waja wanduγu weikala Yudeya! 
ACT.11.30	Wazaγoshola ivyoho, wazavituma kwa waγolokezi, vizaiγalwa ni Balinaba na Sauli.
ACT.12.1	Mishi ija zumbe Helode azagwila wantu kuṅwe wa bumbangwa, kangwe awaγoshwele vibada. 
ACT.12.2	Yakobo, mkuluwe ja Yohana, azamkoma na shime. 
ACT.12.3	Akiona, kuti vizatamila Wayuda, azatongela iyo mbuli vivyoho, azamgwila Petelo yohena, ni mishi ya migate ishigelwayo shimbi. 
ACT.12.4	Akimgwila azamgela mwe chumba, azamwinkila kwe mabumba mane, kila bumba jina washilikali wane wemγoja; hambu mishi ya Pasa ikizinka, azakunda kumlaviliza kwa wantu. 
ACT.12.5	Petelo azaγojiγwa muja mwe chumba; miya Mulungu azahembeleziγwa ni bumbangwa na kushedila kwa mbuli yakwe.
ACT.12.6	Helode akiunga kumlavya, kilo chiya Petelo azasisila ailele gatigati kwa washilikali waili, aishungiγwe na mazolo maili, kangi kuja kwe nyuvi waluγojo waiγojize. 
ACT.12.7	Ne kuholawila mlau ywa Zumbe, muja nyumbai mzagwa langaila kulu, azamtowa Petelo he lubazu, azamwinula angwe: Inuka nguzu! Mazolo ya mikono yazagwa. 
ACT.12.8	Yuja mlau azamuti: Kanta shuke na vilatu vyako! Azaγoshola ivyoho. Azamγamba vituhu: Kiγubike na guni jako, unitongele! 
ACT.12.9	Azamlawa, azamtongela, miya nkataile, kuti viya vyeγosholwa ni yuja mlau ni vya kweli, azaγamba, ateona sozi. 
ACT.12.10	Wazaomboka he luγojo lwa bosi na lwa mbili, wazabula he nkili ya kilama, ni ya kulawila na kaya; inu izawazuγukila ṅwenye, wazalawa, wazahita sila du, ne yuja mlau ahomwasha. 
ACT.12.11	Petelo akiviluka vyedi azaγamba: Lushe nataila kweli, kuti Zumbe azamtuma mlau ywakwe, azanivunila mwe mikono ya Helode na kwe ziya ngojo zoshe za Wayuda. 
ACT.12.12	Akitongonyeza ivyoho azahita kwe nyumba ya Maliya, nine ja Yohana mweitangwa Maliko, ne mwungananemo kabumba kedi kwa vika. 
ACT.12.13	Akigoṅonda luvi lwa nkili, kuzaiza mndele kwa teγeleza, aitangwa Lode. 
ACT.12.14	Akitaila, kuti ni kanwa cha Petelo, nkazuγule nkili kwa nyemi, azaγuluka na nyumbai, azawaukwila kuti: Petelo aiγoloke he nkili. 
ACT.12.15	Waja wazamuti: Walaluka! Miya yuja azalongesha kuti: Ni vivyo. Waja wazaγamba: Ni mlau ywakwe. 
ACT.12.16	Petelo azagoṅonda vivyoho; wakizuγula, wazamwona, wazashentuka, 
ACT.12.17	azawakonyeza na mkono, waleke lwashu; azawatamwila, Zumbe amlavizevyo mwe chumba, azawati: Vimwukwilei Yakobo na wanduγu woshe! Vikibinda azalawa, azahita na hatuhu.
ACT.12.18	Kukicha washilikali wazaingilwa ni woγa ukulu wa kuγamba: Mbuli ya Petelo iγendile vivihi? 
ACT.12.19	Helode akimlonda, akishemwona, waja waluγojo azawauza, azalaγiliza, washungwe; ṅwenye azalawa Yudeya, azahita Kesaliya, azanaikala γuko. 
ACT.12.20	Azagomba kuomanya Watilo na Wasidoni; miya woshe haṅwe wazamwizila, wazamsibila Bulasito, ni mγolokezi ywa kitala cha zumbe, wazasemba, kwa kuti nkande za shi yawe zianduka mwe shi ya zumbe. 
ACT.12.21	Mushi waivanilanewo nawo, Helode azazwika shuke za kizumbe, azaikala mwe kiti cha lahila masa, azawaγambila mbuli. 
ACT.12.22	Wantu wazaitikila angwe: Kanwa ichi ni cha Mulungu, so cha muntu. 
ACT.12.23	Viya du lushe mlau ywa Zumbe azamtowa, kwa kuti nkamgimbike Mulungu, azajiγwa ni funyo, azafa. 
ACT.12.24	Miya mbuli ya Zumbe izaγenda, izagisa kosheni.
ACT.12.25	Balinaba na Sauli wazalawa Yelusalemu, wazaγotoka, hambu wazabinda ija ndimangwa ya mbazi, wazamγuwa Yohana mweitangwa Maliko, wazahita naye.
ACT.13.1	Kuja Antiyokiya mwe bumbangwa muna wateγanyi na wafuzi, ni Balinaba na Simeyoni mweitangwa Nigeli na Lukiyo ywa Kilene na Manaye akuziγweye haṅwe na Helode, na Sauli. 
ACT.13.2	Awa wakimvika Zumbe haṅwe na kufunga, Mpeho mṅazi azawati: Niahwilai Balinaba na Sauli kwa ija ndima, niwaitangileyo. 
ACT.13.3	Ne wahofunga haṅwe na kuvika, wazawabadikila mikono, wazawashungula. 
ACT.13.4	Awa wakituṅwa ni Mpeho mṅazi wazasheela Seloikiya, uko wazahita na chombo na Kipulo, 
ACT.13.5	wakibula Salami wazabilikila mbuli ya Mulungu mwe mavikilo ya Wayuda; yuja Yohana wana naye, awaγoshwela ndima.
ACT.13.6	Wazadwisha chiya kisiwa choshe mpaka Pafo; kuja wazaona mγanga ywa Kiyuda, ni mubilikizi ywa ulongo, zina jakwe ndiye Ṅwayesu. 
ACT.13.7	Azaanga na mtoza shi Seligiyo Paulo, ni mγoshi mwena viyuγo. Uyu azamwitanga Balinaba na Sauli, azakundisha kuiva mbuli ya Mulungu. 
ACT.13.8	Mγanga Elima — ne zina jakwe jivyohitulwa — azawakeleza nkani, azaγeza kumfingiza mtoza shi, ashetozeshe. 
ACT.13.9	Miya Sauli, mweitangwa Paulo, azagisa mpeho ṅazi, azamdulila angwe: 
ACT.13.10	Iwe uigisize minyanyi yoshe na uhambanyi woshe, u ṅwana Satani, utanda woshe wakuihila, nkudila kuhotola sila za Mulungu zeγolokela. 
ACT.13.11	Lushe shivyo: Mkono wa Zumbe wakuizila, neufe mesho, nkouone zuwa mishi inu! Viya du lushe mesho yakwe yazatenda zundezunde na lwiza, azaangaanga akilonda hiuntu mwemtoza mkono. 
ACT.13.12	Yuja mtoza shi akiona viya viγosholekevyo, azatozesha, hambu azashentuka mifuzize ya Zumbe.
ACT.13.13	Paulo na weyae wazaingila mwe chombo kuja Pafo, wazahita Pelige mwe shi ya Pamufiliya; miya Yohana azawaasha, azaγotoka na Yelusalemu. 
ACT.13.14	Waja wazalawa Pelige, wazabula Antiyokiya mwe shi ya Pisidiya, wazaingila vikiloi mushi wa sabato, wazaikala. 
ACT.13.15	Mbuli za muiomongwa na za wateγanyi zikibinda kufyomiγwa, waja wakulu wa vikilo wazawatumila angwe: Wanduγu, ati muna mbuli ya kushangalaza wantu, longai! 
ACT.13.16	Paulo azainuka, azawakonyeza na mkono, azawati: Inywi waγoshi wa Kiisilayeli, mwemwogoha Mulungu, teγelezai! 
ACT.13.17	Mulungu ywa inu mbali ya Isilayeli azashaγula watate zeshu, kangi azainula mbali yetu, ikiikala uγeni mwe shi ya Egiputa, azailavya muja na mkono wakwe ukusukewo. 
ACT.13.18	Azawashuγa mavuli milongo mine mwe nyika. 
ACT.13.19	Azabinda mbali mfungate mwe shi ya Kanaani, azawainka shi yawe, waiγuwe. 
ACT.13.20	Vikibinda azawainka walamuzi mavuli magana mane na milongo mishano mpaka kwe ija mishi ya mteγanyi Samweli. 
ACT.13.21	Haja wazalombeza zumbe, ne Mulungu ahowainka Sauli, ṅwana Kisi, muntu ywa mbali ya Benyamini, mavuli milongo mine. 
ACT.13.22	Akimwusha uyu azawagimbikila zumbe Dawidi, uyu azamlongela uwona kuγamba: Nizamwona Dawidi, ṅwana Yese, ni mγoshi mwetamila moyo wangu, ne ndiye aγoshole vyoshe, nivyokunda. 
ACT.13.23	Mwe mbeleko ya uyu Mulungu azawalaviliza Waisilayeli mhonya, ndiye Yesu, sa ainkilevyo kilaγa. 
ACT.13.24	Ashizati alawile, Yohana azabilikila mbali ngima ya Isilayeli ubatizi wa kuhitula ntongonyezi zawe. 
ACT.13.25	Yohana akibontola iyo ndimangwa, ahinileyo, azaγamba: Yuja, muyefanyanya, kuti ni miyo, si miyo; yuja anitongela nyuma, kangi nkaviniagiza kumzaγawila vilatu vya milundi yakwe. 
ACT.13.26	Waγoshi, wanduγu, mu wanangwa wa chengo cha Abulahamu, kangi wemwogoha Mulungu muna nawo, lushe inywi mzatumilwa mbuli ya uja uvunizi. 
ACT.13.27	Hambu waja weikala Yelusalemu na wazumbe wawe nkawamtaila yuja, kangi mbuli za wateγanyi zefyomiγwa kila sikunkulu wazazibontola na ija milahile yawe. 
ACT.13.28	Hambu hata wakisheona mbuli ya kumkoma, wazamhembeleza Pilato vivyoho, akoṅwe. 
ACT.13.29	Wakibinda mbuli ziya zoshe zigondiγwezo za uyu wazamsheleza mwe muti, wazamwika mwe mbila. 
ACT.13.30	Miya Mulungu azamfufula kwa wafilewo. 
ACT.13.31	Lushe azakalawila waja wakwezilewo haṅwe naye Yelusalemu, wakilawa Galileya, awa ni waona wakwe mwe mbali yetu. 
ACT.13.32	Hata ishwi tamibilikila chiya kilaγa, watate zeshu wainkiγwecho, kuti: 
ACT.13.33	Mulungu azachibontwela wana wenyu aho akimfufula Yesu, sa vigondiγwevyo mwe zumo ja mbili kuγamba: Iwe u ṅwanangu, imi nizakuvyala lelo. 
ACT.13.34	Iyo mbuli ya kumfufula kwa wafilewo, kangwe ashezahita kwa banika, aailonga kuγamba: Nezeniminke viya viṅazi vya Dawidi vye kweli. 
ACT.13.35	Kangi hantu hatuhu haγangwa: Nkouleke, mṅazi ywako akibanika. 
ACT.13.36	Miya Dawidi akibinda kutumikila weyae na kuγoshola viya, Mulungu akundilevyo, azasisila, azaikwa haja ha wababa zakwe, azabanika. 
ACT.13.37	Miya yuja, Mulungu amfufuleye, nkabanike. 
ACT.13.38	Lushe wanduγu, inu mbuli mwitailishe kuti: Ni kwa mbuli ya uyu, mkibilikilwa kuti: Mahuza yazaushiγwa; hata viya vyoshe vishidahilevyo kuushiγwa ni mulomo wa Mose, 
ACT.13.39	kila mwetozesha aviushiliziγwa kwa mbuli ya uyu na kuinkwa utanda. 
ACT.13.40	Lushe olelai, viya vilongiγwevyo ni mteγanyi vishezamiizila, 
ACT.13.41	vikiγangwa: Inywi wahezi, violelei, vimakei, mkaaγe! Hambu mwe inu mishi yenyu naγoshola ndima, inu ndima, ati muntu aimishimwela du, anga nkamtozesha.
ACT.13.42	Wakilawa mwe vikilo ja Wayuda, wamzimu wazawahembeleza, wawaγambile wohe izi mbuli sikunkulu, ndiyo iize. 
ACT.13.43	Bumba jiizilejo vikiloi jikichakuka, Wayuda na wahina wemwogoha Mulungu wangi wazamtongela Paulo na Balinaba; awa wazawalonga na kuwahimila, watozeshe mbazi ya Mulungu. 
ACT.13.44	Ija sikunkulu ntuhu muzi woshe uzaunganana, kwa teγeleza mbulingwa. 
ACT.13.45	Wayuda wakiona haja mabumba makulu wazaingilwa ni wizu ungi, wazakeleza nkani viya vyelongwa ni Paulo haṅwe na kukanka. 
ACT.13.46	Miya Paulo na Balinaba wazabilikila na nyemi, wakiγamba: Bosi vizaagiza inywi, mkibilikilwa mbuli ya Mulungu; miya kwa viya muvyoibenta na kukifanyanyiza wenye, kuti nkamwagiziγwa ni nkalamo ya kale na kale, kwa ivyoho tahituka na kwa wamzimu. 
ACT.13.47	Hambu ivyoho Zumbe azatilaγiliza angwe: Nizakuika, nγaluke langaila ja wamzimu, uγaluke mhonya mpaka kwe mihelo ya shi. 
ACT.13.48	Wamzimu wakiviiva, wazatamilwa, wazatogola mbuli ya Zumbe; kuzatozesha woshe waikilwewo nkalamo ya kale na kale. 
ACT.13.49	Mbuli ya Zumbe izagisa ija shi ngima. 
ACT.13.50	Miya Wayuda wazatunya wavyele waγoh watozeshewo mivikile yawe na wakulu wa uja muzi, wazamwinwila Paulo na Balinaba nkondo, wazawaγulusha mwe shi yawe. 
ACT.13.51	Waja wazawahuγutila vumbi ja milundi yawe, wazahita Ikoniyo. Kangi waja wahina wazagisa nyemi na mpeho 
ACT.13.52	ṅazi.
ACT.14.1	Kuja Ikoniyo wantu wakiunganana mwe vikilo ja Wayuda, wazawahilikila sa viyaho, humba kulu ja Wayuda na ja Wagiliki jizatozesha. 
ACT.14.2	Miya Wayuda waja walemelewo kutozesha wazatunya na kushongeleza myoyo ya wamzimu, waomane na wanduγu wawe. 
ACT.14.3	Wazahumula γuko mishi mingi na kuhilikila mbuli ya Zumbe, kangi Zumbe azalongela mbuli ya mbazi yakwe uwona akileka, ntangilo na vimaka viγosholwe ni mikono yawe. 
ACT.14.4	Wantu wa uja muzi wazapangana, kuṅwe wazauya na kwa Wayuda, kuṅwe wazauya na kwa ntuṅwa. 
ACT.14.5	Kuzainuka nkondo nkulu ya wamzimu na ya Wayuda haṅwe na wazumbe wawe, wawasilimize na kuwahomela mawe. 
ACT.14.6	Wakivitaila wazanyilika na mwe mizi ya Likaoniya, Lisitila na Delibe na mizi yawe ye tanga. 
ACT.14.7	Kuja wazaikala na kubilikila mbulingwa.
ACT.14.8	Kuja Lisitila kuna mγoshi, ni mnyonge ywa milundi, vivyo avyelwevyo nkadahile kuγenda hata. 
ACT.14.9	Uyu azamteγeleza Paulo, akibilikila; uyu akimwolela azamwona, kuti atozesha, kangwe ahonyiγwe. 
ACT.14.10	Ne aholonga na kanwa kikulu angwe: Inuka, uγoloke na milundi yako! Ne ahoinuka akilumbila na kujatajata. 
ACT.14.11	Wantu wakiona, Paulo aγosholevyo, wazainula vyanwa vyawe, wazalonga Kilikaoniya angwe: Milungu izaγaluka sa ishwi wantu, izasheela kwetu! 
ACT.14.12	Balinaba wazamwitanga Zeu, Paulo wazamwitanga Helime, kwa kuti ne mwelonga mbuli. 
ACT.14.13	Mvikizi ywa vikilo ja Zeu je he nkili ya muzi azaiγala mpalala na malinga na kwe nkili, azakunda kubinda fika haṅwe na wantu. 
ACT.14.14	Ntuṅwa Balinaba na Paulo wakiviiva wazatatula shuke zawe, wazafikaγulukila waja wantu, wazalonga na vyanwa vikulu angwe: Waγoshi! Muγosholai aha? 
ACT.14.15	Hata ishwi ti wantu wanyonge sa inywi, kangi tamibilikila, lekai izi mbuli za bule, mhituke na kwa Mulungu mwe moyo aγosholaye lwingu na shi na bahali na vyoshe vye mumo! 
ACT.14.16	Mishi izinkileyo azaleka, wamzimu woshe watongele sila zawe. 
ACT.14.17	Kangi nkalekile ashetailikike kwenyu, hambu azamifila mbazi, aakaminka fula yeanduka mwe lwingu na mishi ya ulozo, myoyo yenyu azaiiγusha nkande na nyemi. 
ACT.14.18	Wakilonga ivyoho wazaona ntoγo nyingi kabisa kufingiza wantu, washewakomele ṅombe za mviko.
ACT.14.19	Miya kuzaiza Wayuda walawilewo Antiyokiya na Ikoniyo, wazatunya waja wantu, vikibinda wazamhomela Paulo mawe, wazamlavya mwe muzi na kumhuna, wazafanyanya kuti: Azafa. 
ACT.14.20	Miya wahina wakimdenganila, azainuka, azaingila na muja kaya; keloi jakwe azamlawa haṅwe na Balinaba, wazahita Delibe. 
ACT.14.21	Wakibilikila uja ulau wedi, wazaγalusha wangi wahina, wakibinda wazauya Lisitila na ikoniyo na Antiyokiya 
ACT.14.22	wakigela myoyo ya wahina nguvu na kuwahimila, waikale na kutozesha vivyoho, kangi wazawaonyesha kuti: Vyatitala kuona ukiwa ungi, tikiingila mwe uzumbe wa Mulungu. 
ACT.14.23	Miya mwe mabumba yoshe wazawagimbikila waγolokezi, wazawamwiγaila Zumbe, wamtozesheye, wazawahembelezeza na kufunga. 
ACT.14.24	Wakidwisha Pisidiya wazabula Pamufiliya. 
ACT.14.25	Wakibinda kubilikila mbulingwa kuja Pelige, wazasheela na Ataliya; 
ACT.14.26	uko wazaingila mwe chombo, wazahita Antiyokiya, washungwilweko kwa mbazi ya Mulungu, watimile iyo ndima, wabontoleyo. 
ACT.14.27	Wakibula kuja wazaunganyanya bumbangwa, wazawaukwila vyoshe, Mulungu aγosholevyo nawo, avyozuγwila wamzimu luvi, wohe wadahetozesha. 
ACT.14.28	Mishi wahumuleyo γuko haṅwe na wahina, so miγeke.
ACT.15.1	Kuṅwe wazalawa Yudeya, wazasheela na uko, wazafuza waja wanduγu kuγamba: Mkisheshengwa kwa msimo wa Mose nkemdshe kuvunilwa. 
ACT.15.2	Kuzaoneka nkumbizi na nkanani nyingi kwa waja na Paulo na Balinaba, ne wahomlaγiliza Paulo na Balinaba na weyae wawe watuhu kuṅwe, wakwele Yelusalemu kwa ntuṅwa na kwa watawa kwa mbuli ya unu mkanano. 
ACT.15.3	Waja watumiγwewo ni jiya bumbangwa wazadwisha Fonike na Samaliya, wazagwishiliza wanduγu woshe nyemi wakiwashimwela, wamzimu wavyohituka. 
ACT.15.4	Wakibula Yelusalemu wazahokelwa ni bumbangwa na ntuṅwa na waγolokezi, wazawashimwela vyoshe, Mulungu aγosholevyo nawo. 
ACT.15.5	Miya kuṅwe wa bumba ja Mafaliseyo wahitukewo watakutozesha wazainuka angwe: Shuti washengwe! Shuti walaγiliziγwe kutoza mulomongwa wa Mose!
ACT.15.6	Ntuṅwa na waγolokezi wazaunganana, wafanyanye inu mbuli. 
ACT.15.7	Wakiisiiza kukanana, Petelo azainuka azawati: Waγoshi, wanduγu, mwataila, kuti mishi ya kale kunu kwenyu Mulungu azashaγula kanwa changu, wamzimuwaive nacho mbuli ya ulaungwa wedi, waitozeshe. 
ACT.15.8	Kangi Mulungu mwetaila myoyoyawantu azawalongela uwona na kuwainka Mpeho mṅazi, sa amtinkilevyo ishwi, 
ACT.15.9	kangi nkakundile, tikizinkana nawo kwa viya, aṅazizevyo myoyo yawe kwa mbuliya kutozesha kwawe. 
ACT.15.10	Lushe nini mkikunda kumγeza Mulungu na kuwainuza waja wahina mziγo, watate zeshu, hata ishwi tishidahilewo kuinula? 
ACT.15.11	Miya tatozesha, kuti tihonyiγwa ni mbazi ya Yesu vivyoho, sa waja wohena. 
ACT.15.12	Ne bumba gima jiholeka lwashu, wazamteγeleza Balinaba na Paulo, wakishimwela ntangilo zoshe na vimaka vyoshe, Mulungu aγosholevyo nawo kwa wamzimu.
ACT.15.13	Wakileka lwashu, Yakobo azaγuwa mbuli angwe: 
ACT.15.14	Waγoshi wanduγu, niteγelezai! Simoni azashimwela, Mulungu aandiilevyo kuolela wamzimu, aonele zina jakwe mbali yakwe mumo. 
ACT.15.15	Hata mbuli za wateγanyi zaivana na aho, hakigondwa kuγainba: 
ACT.15.16	Vikibinda nezeniuye, nizenge nyumba ya Dawidi ichakukeyo, kuja kubanikeko nezenikuzenge vituhu, 
ACT.15.17	nikuuze uhya, kangwe wantu washiγalewo wamlonde Zumbe haṅwe na wamzimu woshe weitangilwa zina jangu. 
ACT.15.18	Ne avyolonga Zumbe alekileye, ivi vikitailikana aho kale hoshe. 
ACT.15.19	Kwa ivyoho naγamba: Waja welawa kwa wamzimu, wakihituka na kwa Mulungu, tishewainuze miziγo, 
ACT.15.20	miya tiwalaγilize du, kuti wazile fika, kwa kuti zagela muntu kisitama, na kilanga na kibudu na mpome. 
ACT.15.21	Hambu aho kale mpaka ivi lushe mwe mizi yoshe Mose ana webilikila mbuli yakwe, kangi kila sikunkulu yafyomiγwa mwe mavikilo.
ACT.15.22	Ne ntuṅwa na waγolokezi wahoivana na bumba joshe kushaγula weyae wawe kuṅwe na kuwatuma Antiyokiya haṅwe na Paulo na Balinaba, ni Yuda mweitangwa Balisaba na Sila, ni waγoshi wena kilango kitana kwa wanduγu. Wazagonda baluwa, 
ACT.15.23	waiiγale; shinu: Ishwi ntuṅwa na waγolokezi tamiluγusha inywi wanduγu mulawilewo kwa wamzimu uko Antiyokiya na Siliya na Kilikiya. 
ACT.15.24	Tizaiva, kuti weshu kuṅwe wazamiazaγanya na kugela myoyo yenyu futofuto, miya nkatiwalaγilize ivyoho. 
ACT.15.25	Ne vilekilevyo, toshe tikiivana kushaγula waγoshi na kuwatuma na kwenyu haṅwe na weshu wa Balinaba na Paulo, tiwokundisha; 
ACT.15.26	hambu awa ni wantu wakiinkilewo wenye kwa mbuli ya zina ja Zumbe ywetu Yesu Kilisito. 
ACT.15.27	Tizamtuma Yuda na Sila; awa newamiγambile viya, tivyogonda. 
ACT.15.28	Hambu Mpeho mṅazi na ishwi tizaivana, tishemiinuze mziγo mtuhu kushima izi mbuli zeagiza, 
ACT.15.29	mzile nyama za fika na mpome na kibudu na kilanga. Wenye mkikilemeza izi mbuli mtazifyal.
ACT.15.30	Awa wakibinda kushungulwa wazasheela Antiyokiya; wantu woshe wakiunganana, wazainkila ija baluwa. 
ACT.15.31	Wakiifyoma, wazatamilwa wakishangalaziγwa ivyoho. 
ACT.15.32	Yuda na Sila wenye ni wahilikizi, wazawashangalaza waja wanduγu na mbuli nyingi, wazawagela nguvu. 
ACT.15.33	Wakiikalaikala wazashungulwa na waja wanduγu, wahite mpeho kwa waja wawatumilewo. 
ACT.15.34	Miya Sila azatamilwa ni kuhumula γuko. 
ACT.15.35	Paulo na Balinaba wazaikala Antiyokiya wakifuza, kangi wakihilikila haṅwe na weyae wawe wangi mbuli ya Zumbe.
ACT.15.36	Mishi ikizinka, Paulo azamuti Balinaba: Netihite vituhu, tikaule wanduγu mwe mizi yoshe, tibilikilemo mbuli ya Zumbe, ati wa zeze! 
ACT.15.37	Balinaba azakunda kumγuwa Yohana mweitangwa Maliko, wahite naye. 
