GAL.4.6	Kwa kuti mu wanangwa, Mulungu azaingiza mpeho ya ṅwanae mwe myoyo yenyu, ne yetibembeleza kuti: Tate ene! 
GAL.4.7	Kwa inu mbuli nku mtuṅwa, miya u ṅwana, ati u ṅwana, kangi u mupazi ywa Mulungu kwa mbuli ya Kilisito.
GAL.4.8	Miya aho kale mushizati mumtaile Mulungu, mzatumikila milungu ishiyo milungu. 
GAL.4.9	Ivi lushe muhomtaila Mulungu, kangi muhotailwa ni Mulungu, muhituka zeze vituliu na kwe ija miko yeshowa nguvu, yeγenyeza ukiwa? Mukunda zeze kuitumikila vingi? 
GAL.4.10	Mwateγanya mishi na myezi na mizanya na mavuh. 
GAL.4.11	Naogoha kwa mbuli ya inywi kuγamba: Hangi kwenyu nifile muku wa bule.
GAL.4.12	Γalukai, sa imi nilivyo! Hambu imi ni sa inywi; wanduγu, namihembeleza. 
GAL.4.13	Nkamuniγoshwele mbuli mbada. Mwataila kuti: Kuja kuvoka nizamibilikila na unyonge wa ṅwili, kangi ne nikiγezwa ni viya vya ṅwili wangu, 
GAL.4.14	miya nkamunibentile, miya mzanihokela, viya ni mlau ywa Mulungu, viya ni Kilisito Yesu. 
GAL.4.15	Lushe ija nyemi yenyu i kuhi? Hambu namilongela uwona, ati mzadaha, anga mzafokola mesho yenyu, kangwe muninke. 
GAL.4.16	Miya mzaγaluka munkulu ywenyu aho nikimiγambila mbuli ya kweli? 
GAL.4.17	Waja wavyomihimila, nkavitama, miya wakunda kumiusha, kangwe mkihime kwa mbuli yawe. 
GAL.4.18	Kukihima kwa mbuli ntana kwatama, miya so haja du, nii kwenyu. 
GAL.4.19	Wanangu, nalumila viya nitemivyala ka mbili, mpaka Kilisito atende nguvu kwenyu. 
GAL.4.20	Nakunda, anga ni kwenyu ivi lushe, nikaγeza milongele mituhu, hambu nizaaγilwa kwa mbuli ya inywi.
GAL.4.21	Niγambilai, inywi mwekunda kuitika mulomongwa: Kumbe mwaiva mulomongwa? 
GAL.4.22	Hambu kuigondiγwe kuti: Abulahamu ne ainawana waili, muṅwe azamvyala na mndele ywa kituṅwa, muṅwe azamvyala na muke ṅwenye. 
GAL.4.23	Miya yuja ywa mndele ywa kituṅwa avyelwe kwa mbuli ya kihelehele, yuja ywa muke ṅwenye avyelwe kwa mbuli ya uja msuhi. 
GAL.4.24	Ivi vifanana, viya ni lushimo, bontokelo shiji: Vilaγa ni vili; kiṅwe ni chiya chilawilecho he mulima wa Sinai, chivyala watuṅwa du, ichi ni Hagali. 
GAL.4.25	Hambu uko Alahiya mulima wa Sinai uitangwa Hagali. Kangi yuja Hagali ni Yelusalemu wa ivi lushe, hambu uikala utuṅwa haṅwe na wanae; 
GAL.4.26	miya uja Yelusalemu we mwe lwingu ni ṅwana vyale, ne mine ja ishwi; 
GAL.4.27	hambu kuigondiγwe: Tamilwa, iwe mγumba ushiwovyala! Kishekeze! Towa zumo, ushiwotenda nda! Hambu yuja rawe ike aua wana waugi kuzinka yuja mwena mγoshi. 
GAL.4.28	Miya inywi, wanduγu, mu wana wa msuhi sa Isaka. 
GAL.4.29	Sa aho kale yuja avyelweye kwa kihelehele avyomshongeleza ṅwiyae avyelweye kimpeho, ne vilivyo hata ivi lushe. 
GAL.4.30	Miya ugondengwa uγamba ze? Mwingate yuja mndele haṅwe na ṅwanae! Hambu ṅwana mtuṅwa nkezeapale na ṅwana vyale. 
GAL.4.31	Kwa inu mbuli, wanduγu, nkati wana mtuṅwa, miya ti wana vyale.
GAL.5.1	Kilisito azatikombola, tilawe mwe utuṅwa. Lushe toγai, mshozakundilwa vituhu uwo utuṅwa welumiza! 
GAL.5.2	Shivyo, imi Paulo nivyomiγambila: Mkikunda kushengwa, Kilisito nkana ndivyo nezeamionele. 
GAL.5.3	Vituhu kila mwekunda kushengwa namlonga uwona kuti: Mpaka aγoshole mulomongwa woshe! 
GAL.5.4	Nyoshe mwekunda kuinkwa utanda na kuγoshola mulomongwa mzabinda kuushiγwa ha Kilisito, mzalekela mbazu ngwa. 
GAL.5.5	Miya ishwi kwa nguvu ya mpehongwa taafiza na kutozesha uwo utanda, tiwoalila. 
GAL.5.6	Hambu tikianga na Kilisito, vyetinka nguvu so kushengwa, so kusheshengwa, miya ni mitozesheze yebontoka na kukundishana. 
GAL.5.7	Ne mkianga vitana; ni ndai amifingizizeye, msheitike vye kweli? 
GAL.5.8	Inu mikengelezeze nkaianduka kwayuja amiitangeye. 
GAL.5.9	Vishimbi vidashi vyakoleza kiγa kigima cha holwe. 
GAL.5.10	Viya muvyoanga na Zumbe, namialila kuti: Nkezemγuwe ntongonyezi ntuhu, miya yuja mwemiazaγanya atazakola masa, ati ni muntu ani! 
GAL.5.11	Miya imi, wanduγu, ati nikebilikila kushengwa, anga niifiziγwai? 
GAL.5.12	Anga kiihizize cha mutingwa chizauka. Wakataushiγwa wemiazaγanya!
GAL.5.13	Hambu inywi, wanduγu, mwaitangilwa, mγaluke wanavyale, komo kuja kuγaluka wana vyale mshekugwize na kwe kihelehele cha mili yenyu, miya mtumikilane na kukundishana! 
GAL.5.14	Hambu mulomongwa woshe wabontoka na inu mbuli ya kuγamba: Shuti umkundishe ṅwiyawo, sa uvyokikundisha ṅwenye! 
GAL.5.15	Miya mkilumana, mkijana, oleleshai, kangwe mshezabindana!
GAL.5.16	Naγamba: Angai kimpeho! Ne ndivyo mshedahe kubontola kihelehele cha mili yenyu; 
GAL.5.17	hambu ṅwili una kihelehele na viya vyeihila mpehongwa, kangi mpehongwa ina kihelehele na viya vyeihila ṅwili, ivyobo awa waili waomana, kangwe wenye mshedahe kuγoshola muvyokunda. 
GAL.5.18	Miya mkihimilwa ni mpehongwa, lushe nkamu watuṅwa wa mulomongwa.
GAL.5.19	Miγoshwele ya kiṅwili iibunkuke, kuti ni kilanga, usaba, mulako, uvika mizimu, 
GAL.5.20	ushai, nkulu, nkumbizi, wizu, maya, mbifya, mizinkano, misopano, kushukizanya, kukomana, 
GAL.5.21	kunywelesha, kujilisha na vituhu vyefanana na Ivi; nizamiγambila kale, kangi nitauγiza kulonga kuti: Weviγoshola viya nkezewapale uzumbe wa Mulungu. 
GAL.5.22	Kuwo ja mpehongwa shiji: Kukundishana, kutamilana, kuivana, kuzizimiza, kulonga na ukuwi, kufilana mbazi, kutozesha, 
GAL.5.23	ubozu, kukitoza. Ivi vyoshe nkavilemelwa ni mulomongwa. 
GAL.5.24	Wantu wa Kilisito Yesu wakoma mili haṅwe na luzisho na kihelehele. 
GAL.5.25	Ati ti wa kimpeho, netiange kimpeho! 
GAL.5.26	Tisheγaluke welonda ntogolo ya bule, tikihimilana vibada, tikitendelana wizu!
GAL.6.1	Wanduγu, ati muntu azavotwa ni kilema, ishwi wa kimpeho timshunde kimpeho na uhozu! Ukioleleshe ṅwenye, nawe ushezaγezwa ni iyo mbuli! 
GAL.6.2	Inwilanai miziγo! Ne ndivyo mubontole mulomo wa Kilisito; 
GAL.6.3	hambu mwekifanyanyiza ṅwenye kuti: Ni mnguvu, kangi siye, akiufya ṅwenye; 
GAL.6.4	miya kila muntu aoleleshe miγoshwele yakwe ṅwenye! Ne ndivyo akitogole mwe moyo wakwe ṅwenye na kushevilaviliza kwa mtuhu. 
GAL.6.5	Hambu kila muntu ainule mziγo wakwe ṅwenye. 
GAL.6.6	Yuja mwefuziγwa mbulingwa amupangile mfuzi vitana vyoshe, avyona navyo!
GAL.6.7	Msheufiγwe! Mulimgu nkabelwa, hambu muntu avyohanda, ne ndivyo aonele; 
GAL.6.8	mwehanda mwe ṅwili wakwe atazaonela mwe uwo ṅwili kubanika; mwehanda mwe mpehongwa atazaonela mwe iyo mpehongwa nkalamo ya kale na kale. 
GAL.6.9	Tishetibuke kuγoshola viya vyetama! Hambu hakizabula, titazavionela, ati nkatihelele gati. 
GAL.6.10	Kwa kuti tike kunu, netikihime kuγoshwela wantu woshe vitana, tiisiize waja wetozesha haṅwe na ishwi!
GAL.6.11	Olelai migondele, nimigondeleyo na mkono wangu! 
GAL.6.12	Wekunda, mtamilwe ndiwo kiinushi, ue wemikundila kushengwa, so kwa mbuli ntuhu, ni kwa kuγamba: Washezalumila kwa mbuli ya mutingwa wa Kilisito! 
GAL.6.13	Kangi awa wenye weshengwa nkawatozesha mulomongwa, watakunda du, inywi mshengwe, kangwe wakitogole na mili yenyu. 
GAL.6.14	Imi sikunda kukitogola kushima na mutingwa wa Zumbe ywetu Yesu Kilisito, hambu inu shi izanikomelwa nawo; nami nizaikomelwa inu shi. 
GAL.6.15	Wina Kilisito Yesu, kushengwa siko, hata kusheshengwa siko, miya kiumbo kihya ndicho. 
GAL.6.16	Woshe weanga na unu mulomo, waikale mpeho, wafilwe mbazi haṅwe na Waisilayeli wa Mulungu!
GAL.6.17	Vikibinda kusheoneke mwenionya lulali! Hambu mwe ṅwili wangu nina nkozu za Yesu.
GAL.6.18	Mbazi ya Zumbe ywetu Yesu Kilisito iγolokele mpeho zenyu, wanduγu! Amini.
EPH.1.1	Imi Paulo ni ntuṅwa ya Kilisito Yesu kwa viya, Mulungu akundilevyo; namiluγusha inywi waṅazi uko Efeso na waja wemtozesha Kilisito Yesu. 
EPH.1.2	Mbazi imiikaile na mpeho yeanduka kwa Mulungu, Tate yweshu, na kwa Zumbe Yesu Kilisito!
EPH.1.3	Atogolwe Mulungu, ishe ja Zumbe ywetu Yesu Kilisito, kuti azatifa mbazi na vitana vyoshe vya kimpeho vyeanduka mwe lwingu kwa Kilisito! 
EPH.1.4	Hambu ngulu ngima ishizati itulwe, azatishaγula, tiγaluke wakwe, kangwe tiγaluke waṅazi weanga kishimasa, akiwaolela; 
EPH.1.5	kwa lukundisho lwakwe aatiteγanya uko kale, tiγaluke wanae wenye kwa mbuli ya Yesu Kilisito, ne vimtamilevyo, ne akundilevyo, 
EPH.1.6	kangwe nezetitongele mbazi zakwe ntana, atifilezo kwa uyu ṅwanae, ayemkundisha. 
EPH.1.7	Hambu mwe mpome yakwe ne timoonela ukombozi, tidsheushiliziγwa tibanilevyo. 
EPH.1.8	Izi mbazi zakwe zizatilawila hata ishwi nyingi, zizatinka viyuγo vyoshe na lutwi lwoshe, 
EPH.1.9	akitifumbwila viya avyokunda, vyemtamila, vishivyotailikana kale hoshe; hambu aviteγanya kale mwe moyo wakwe, 
EPH.1.10	vihontokele, mishi aikileyo ndiho nezeitimize, Kilisito aγaluke mutwi wa viya vyoshe vye mwe lwingu na vye kunu shi. 
EPH.1.11	Kwa mbuli ya uyu tapangilwa kifu hata ishwi chifanyanyiγwecho kale kwa viya, aikilevyo uko kale, hambu vyoshe avihontoleza, sa avyokunda ṅwenye. 
EPH.1.12	Kwa izi mbuli ishwi temwalila Kilisito mishi inu titazatogola uko utana wakwe. 
EPH.1.13	Hata inywi mzaiva mbulingwa ye kweli, ni uja ulau wa uvunizi wenyu; aho mkitozesha mzainkwa ndiye lwitangilo, ni Mpeho mṅazi mwebontola kilaγa; 
EPH.1.14	uyu ni mulimbulo wa chiya kifu, titaile kuti: Tiikombolwe, ti wakwe, kangwe nezetitogole utana wakwe.
EPH.1.15	Lushe ivyo niivilevyo, muvyomtozesha Zumbe Yesu, muvyokundisha waṅazi woshe, 
EPH.1.16	sidila kulavya ntogolo nihokamifukila nikivika. 
EPH.1.17	Namihembelezeza kwa Mulungu ywa Zumbe ywetu Yesu Kilisito, Tate mwe utana, aminke mpeho ya viyuγo na ya ufumbuzi, mtaile alivyo. 
EPH.1.18	Kangi aṅaze mesho ya myoyo yenyu, kangwe mtaile, mwitango wakwe tiwoalila ulivyo, utana wa kifu uvyokula, aikilacho waṅazi, mtaile, 
EPH.1.19	nguvu yakwe ivyokula, avyotinka ishwi tetozesha kwa viya, tivyohimilwa ni nguvu ya ufuṅwa wakwe. 
EPH.1.20	Inu azailaviliza mwe Kilisito akimfufula kwa wafilewo, akimwikaza mwe lwingu kulume kwakwe, 
EPH.1.21	akimgimbika kuzinka ufuṅwa na ukulu na unguvu na uzumbe woshe na kuzinka mazina yoshe yelangwa mishi inu na mishi yoshe, ndiyo itongele. 
EPH.1.22	Vyoshe azaviika shi he milundi yakwe, ṅwenye azamγalusha mutwi wa bumbangwa kushima viya vyoshe, 
EPH.1.23	hambu jiya ne ṅwili wakwe, ne hontokelo ja yuja mwebontoleza mbuli zoshe koshe koshe.
EPH.2.1	Hata inywi ne mwifile kwa mbuli ya uhambanyi na uhuza wenyu, 
EPH.2.2	mwangilewo nawo kwa misimo ya inu shi na kwa nguvu ya yuja mwena ufuṅwa kunu shi, ni ija mpeho yehimila nguvu yakwe mpaka inu mishi kwa wanangwa wepapalika. 
EPH.2.3	Hata ishwi toshe ne tikiangilana nawo tikitongela kihelehele choshe cha mili yelu, tikiγoshola vyoshe tivyokundilwa ni mili yetu na ntongonyezi zetu; kwa viya, ndivyo tilivyo, ne tii wana wemkweza maya sa waja watuhu. 
EPH.2.4	Miya Mulungu uzuli wakwe ni utungu, ne vyeleka, lukundisho lwakwe alotikundisha nalo ni lungi, 
EPH.2.5	ne vilekilevyo, akitiuza moyo haṅwe na Kilisito ishwi tifilewo kwa mbuli ya mabano yetu; mzavunilwa kwa mbazi du. 
EPH.2.6	Akibinda kutiinula haṅwe naye azatiikaza mwe lwingu haṅwe na Kilisito Yesu 
EPH.2.7	kangwe aonyeshe mishi, ndiyo ibule, uzuli wa mbazi zakwe uvyoisa kukula, akitiγendela na uhozu kwa mbuli ya Kilisito Yesu. 
EPH.2.8	Hambu ni mbazi, kuti mwivunilwe aho mkitozesha, kangi nkavianduka kwenyu, mteviinkwa ni Mulungu vivyoho; 
EPH.2.9	so ndima zenyu, bangwe muntu ashezahikuka. 
EPH.2.10	Hambu ishwi ti ndima yakwe; Kilisito Yesu azaleka, tikiumbiγwa, kangwe tizifye ndima, Mulungu atifanyanyizezo, tiange nazo.
EPH.2.11	Kwa ivyoho kumbukai kuti: Kale mbali yenyu muwamzimu, ne mkiitangwa mankombwe ni waja wekitogola, kuti wazashengwa mih ni mkonowa muntu! 
EPH.2.12	Kumbukai: Mishi ija ne mwishina Kilisito, ne mkilemeziγwa kuγaluka wenyezi kwa Waisilayeli, ne mwi waγeni na vilaγa wainkiγwevyo, ne mwishina kialilo, ne mwishina Mulungu mwe inu shi! 
EPH.2.13	Miya ivi lushe kwa mbuli ya Kilisito Yesu hata inywi, ndiwo mkiikala hale, mzaletiγwa na hehi ni mpome ya Kilisito. 
EPH.2.14	Uyu ni mwivano wetu, hambu yaja mabumba maili azayaγalusha iṅwe akichakula luja lukindo, ndilo lwiwatanyize akiusha nkulu yawe, 
EPH.2.15	hambu na ṅwili wakwe azausha nguvu ya ija milomo yeγenyeza vitigo na miko, kangwe waja waili awaγalushe muntu muṅwe muhya akiwaivanya. 
EPH.2.16	Na uja ṅwili wakwe muṅwe azawatemekela woshe waili kwa Mulungu aho akikoṅwa, ne ahokoma ṅwenye nkulu yawe. 
EPH.2.17	Kangi akilawila azamibilikila mwivano wedi inywi, ndiwo mwi hale, sa amibilikilevyo mwivano wedi waja, ndiwo wai hehi. 
EPH.2.18	Ne tivyoonela mwakwe toshe waili luhitile kwa Tate na mpeho ṅwenga.
EPH.2.19	Kwa ivyoho nkamu waγeni weikala nkandai, mu wenyezi haṅwe na waṅazi, mu wakaya wa Mulungu, 
EPH.2.20	hambu mzazengwa mwe jiya shikizi ja ntuṅwa na ja wateγanyi, Kilisito aliho iwe ja heta. 
EPH.2.21	Hambu mwe uyu ne zengo joshe gima jimokisanyiγwa, jikule, jiγaluke vikilo ṅazi ja Zumbe. 
EPH.2.22	Ne mzengiγwemo hata inywi, mγaluke ikailo ja Mulungu ja kimpeho.
EPH.3.1	Ne vilekilevyo, nikishungwa imi Paulo kwa mbuli ya Kilisito Yesu, kangi kwa mbuli ya inywi wamzimu. 
EPH.3.2	Minga mzaiva mbuli ya uja ufuṅwa wa mbazi ya Mulungu niinkiγwewo, niiiγale kwenyu, 
EPH.3.3	kuti imi nizafumbwilwa kutaila viya vishivyotailikana kale hoshe, sa nigondilevyo hadodo aho ṅwande. 
EPH.3.4	Mkivifyoma mwadaha kuona nitailevyo vihili vya Kilisito. 
EPH.3.5	Mishi mituhu nkavitailikane kwa wanawantu, sa vifumbwilwevyo ivi lushe ni mpehongwa ntuṅwa na wateγanyi wakwe waṅazi kuti: 
EPH.3.6	Wamzimu wohe niwapazi, kuti: Wohe wa mumo mwe ṅwiliwakwe, kuti: Wohe niwantuwa kilaγa, Kilisito Yesu atinkilecho na uja ulau wedi. 
EPH.3.7	Ne niwotumikila kwa ludahile lwa nguvu yakwe, ne mbazi Mulungu anifileyo. 
EPH.3.8	Imi ni mdodo ṅwenye kuzinka waṅazi woshe, kangi nizafilwa mbazi, nibilikile wamzimu uzuli wa Kilisito ushiwodosekana, 
EPH.3.9	niukule utanda wa iyo mbuli ifishiγweyo aho kale hoshe ni Mulungu aumbileye vintu vyoshe, 
EPH.3.10	kangwe mishi inu wazumbe na wafuṅwa woshe we uko ulanga waonyeshiγwe ni bumbangwa, viyuγo vya Mulungu vivyoγenela. 
EPH.3.11	Ṅwenye ne avifanyanyeye aho kale, vibontokele mwe Zumbe ywetu Kilisito Yesu. 
EPH.3.12	Mwe uyu taonela milongele yena nyemi na luhitile, kwa kuti tamwalila na kutozesha. 
EPH.3.13	Kwa ivyoho namihembeleza, msheleγele kwa mbuli ya nkondo zangu, hambu ni ntogolo yenyu.
EPH.3.14	Ne nihomgintila mazwi, uyu Tate, mweleka kila mwe wana, ati ni mwe lwingu, 
EPH.3.15	ati ni kunu shi, akiitangwa late, 
EPH.3.16	amife mbazi kwa uzuli wa ulana wakwe, kangwe muntu ywenyu ywa ndai atende nguvu, atintimazwe ni mpeho yakwe, 
EPH.3.17	kangwe Kilisito aikale mwe myoyo yenyu kwa viya muvyotozesha, kwa kuti mzakundishiγwa, msheleze mazindo, mshikiziγwe ndiyo, 
EPH.3.18	kangwe mdahefanyanya haṅwe na waṅazi woshe uhanawa uzangalamu na wa ukuluna waule; 
EPH.3.19	kangi mtaile kuti: Lukundisho lwa Kilisito ni lukulu muno kuzinka utalizi woshe, kangwe mgisiγwe viya vyoshe, Mulungu avyogisa. 
EPH.3.20	Miya yuja kwa viya, nguvu yakwe ivyotendesha kwetu, atadaha kuγoshola kuzinka vyoshe, tivyohembeleza ao tivyotaila. 
EPH.3.21	Atogolwe mwe bumba jakwe kwa mbuli ya Kilisito Yesu mishi yoshe, ndiyo itongele kale na kale! Amini.
EPH.4.1	Imi nishungiγweye kwa mbuli ya Zumbe namihimila, mtende myangile yeivana na uja mwitango, mwitangwewo nawo, 
EPH.4.2	mγenyeze ukuwi na uhozu na uzizimizi, mzizimizizanye na kukundishana, mkihime kutozesha, 
EPH.4.3	kuti mpehongwa ni ṅwenga, mwivane viya mteshunganyiγwa haṅwe. 
EPH.4.4	Nwilingwa ni muṅwe, mpehongwa id ṅwenga, kangi kialilo muchoitangilwa ni chicho kiṅwe. 
EPH.4.5	Zumbe ni muṅwe, mtozesho ni muṅwe, ubatizi ni uṅwe, 
EPH.4.6	Mulungu ni muṅwe, ni ishe ja woshe, ne mweγoshola woshe, ne mwetenda nguvu kwa woshe, ne mweikala mwe woshe. 
EPH.4.7	Miya ishwi tiigisiγwe mbazi, kila muntu yakwe, sa avyoliγanyiγwa ni Kilisito. 
EPH.4.8	Ne viholongwa: Yuja akwezileye na mwe lwingu azataha nkolengwa, azainka wantu vya mbazi. 
EPH.4.9	Lushe vikiγangwa; Azakwela, so kuγamba kuti: Azanasheela na mwe shi za kuzimu? 
EPH.4.10	Yuja asheeleye ni yuyu akwezileye na ulanga kuzinka nyingu zoshe, kangwe akugise uko koshe. 
EPH.4.11	Ṅwenye azagimbika kuṅwe ntuṅwa, kuṅwe wateγanyi, kuṅwe wabilikizi, 
EPH.4.12	kuṅwe walishi nawafuzi, kangwe waṅazi waliγanyiγwe, wadaheγoshola ndima ya kutumikila, kangwe ṅwili wa Kilisito uzengwe mpaka toshe 
EPH.4.13	nezetibule na kuivana mitozesheze na mitailileya ṅwanangwa ywa Mulungu, tiγaluke wantu wagima, tibule ha ukuluwa uzuliwa Kilisito. 
EPH.4.14	Tishezaikala tumala kinkebe tikivuviγwavuviγwa, tikizungulushiγwa ni mbuli, wantu wazohinya, zikihitukila sa mpeho yekunta, hambu ni za lwufyo na za mihembo ya wantu, kangwe watiazaγanye na minyanyi. 
EPH.4.15	Miya ishwi netiγambilane vye kweli kwaviya tivyokundishana, mwe mbuli zoshe timkulile yuja Kilisito, kwa kuti ni mutwi wetu! 
EPH.4.16	Hambu uyu ne mweleka, ṅwili woshe ukigombekeziγwa, ukitoγeshiγwa ni vinko vyoshe vyeugela nguvu, sa kila fungu iṅwe jivyoliγanyiziγwa ndima yakwe; ne ṅwili uvyokula, uvyozifiγwa kwa kukundishana.
EPH.4.17	Inu mbuli lushe niilonga na kumlanga Zumbe, aγaluke mwona, mshezaanga, sa wamzimu wavyoanga na kufanyanya vishinavyo bontokelo; 
EPH.4.18	hambu ntongonyezi zawe ni za lwiza, wenye ni waγeni na nkalamo ya Mulungu kwa mbuli ya tumala, wayoikala nayo, na kwa mbuli ya kuti watoγesha myoyo yawe. 
EPH.4.19	Kwa kuti shoni nkawana, wazaγoshola vyoshe vyewaheheleza, hata usaba woshe wazauγoshola, kangwe waγenyeze mah. 
EPH.4.20	Miya inywi nkamhinile mbuli ya Kilisito, kuti ni ivyoho. 
EPH.4.21	Hambu mzaiva, mzafuziγwa mbuli yakwe kuti: Kweli ṅwenye ioneke mwe Yesu. 
EPH.4.22	Kwa viya mwangilevyo kale, mwashei muntu ywa, kale mwekihosa na kutongela tamaa za lwufyo! 
EPH.4.23	Kangi lekai, ntongonyezi za myoyo yenyu ziuziγwe uhya, 
EPH.4.24	mzwike muntu muhya aumbiγweye Kimulungu, mtende utanda na uṅazi we kweli!
EPH.4.25	Kwa ivyoho towai mbuli za ulongo hulu, mlonge vya kweli kila muntu na ṅwiyae! Hambu toshe ti madango kila na ṅwiyae. Mwina maya mshebane, 
EPH.4.26	msheleke, uwa jikishwa mwina maya vivyoho, 
EPH.4.27	kangi mshemhakanye yuja muleba! 
EPH.4.28	Ndiye akibawa ashezabawa vingi, miya aγoshole ndima, aone na mikono yakwe ṅwenye vyetama, kangwe adahe kumupangila muntu mwekosa! 
EPH.4.29	Kila mbuli mbada ishelawe mwe vyanwa vyenyu, miya ati kuna mbuli ntanayedaha kuzifya habanikeho, shuti ilongwe kangwe weiva watamilwe! 
EPH.4.30	Mpeho mṅazi ywa Mulungu mshemwonye ukiwa! Hambu ne mwinkiγweye, amiγalukile lwitangilo mushiwa ukombozi. 
EPH.4.31	Miya mbifya na nkunguka na maya na vuzo na lukanko na mbuli mbada zoshe ziuke kwenyu! 
EPH.4.32	Mγendelane na uhozu na utungu na mbazi, sa Mulungu amifilevyo mbazi na Kilisito!
EPH.5.1	Mwiγei Mulungu, sa wana wekundishiγwa ndiye! 
EPH.5.2	Angai na kukundishana! Hambu hata Kilisito azamikundisha, 
EPH.5.3	azakiinkila ṅwenye kwa mbuli ya ishwi, aγaluke ṅombe ya mviko, akakoṅwe, Mulungu aive mzingo mtana. 
EPH.5.4	Miya mbuli za kilanga na za usaba woshe na za ubuγe zishezalangwa kwenyu, sa vivyoagiza waṅazi, hata mbuli za lukanko na za mhembo na za ufyosi ubada nkaziagiza, zeagiza ni za ntogolo du. 
EPH.5.5	Hambu tailai vyedi kuti: Mtesi na mhuza na mubuγe nkana kifu mwe uzumbe wa Kilisito na Mulungu! Hambu mwe ivyoho ni mvika mizimu. 
EPH.5.6	Kusheoneke mwemiazaγanya na mbuli za bule du! Hambu ne vyeleka, maya ya Mulungu yakiizila wanangwa we upapala. Kwa ivyoho msheangilane nawo! 
EPH.5.7	Hambu ne mwi lwiza, miya lushe mu langaila, kuti muna Zumbe. 
EPH.5.8	Angai vivyoagiza wana wa langaila!
EPH.5.9	Hambu kitende cha langaila ni utana na utanda na ukweli woshe. 
EPH.5.10	Fanyanyai, ati ni mbwai vyemtamila Zumbe! 
EPH.5.11	Miya mshekigele mwe ndima za lwiza zishinazo kuwo, shuti mzibunkule. 
EPH.5.12	Hambu vyeγosholwa ndiwo na kufishafisha, hata kuvilonga vina shoni. 
EPH.5.13	Miya vyoshe vyamanyika vikibunkulwa ni langaila; hambu vyoshe vyemanyika ni langaila. 
EPH.5.14	Ne viholongwa: Viluka, iwe wesisila! Inuka kwa wafilewo! Ne ndivyo Kilisito akumulikile. Oleleshai, ndivyo mwange! 
EPH.5.15	Mshetende udashi, tendai viyuγo! Manyai mishi mwinkiγweyo! 
EPH.5.16	Hambu mishi inu ni mibada. 
EPH.5.17	Kwa ivyoho msheγaluke wababashi, miya tailai, Zumbe avyokunda! 
EPH.5.18	Mshetengele mkinywa mpombe! Hambu yaγenyeza uhuza, miya gisai mpehongwa! 
EPH.5.19	Mtamwilane mazumo na maimbo na mawila ya kimpeho, 
EPH.5.20	mkimwimbila Zumbe, mkimtowela mazumo mwe myoyo yenyu, mkimlaviliza Mulungu Tate ntogolo mwe zina ja Zumbe ywetu Yesu Kilisito mishi yoshe kwa mbuli zoshe! 
EPH.5.21	Kwa viya muvyomwogoha Kilisito itikanai!
EPH.5.22	Wavyele waitike walume wawe viya watamwitika Zumbe! 
EPH.5.23	Hambu mγoshi ni mutwi wa mvyele, sa Kilisito avyo mutwi wa bumbangwa, hambu ne mhonya ywa ṅwili. 
EPH.5.24	Sa bumbangwa jivyomwitika Kilisito, vivyoho hata wavyele waitike waγoshi wawe mwe mbuli zoshe! 
EPH.5.25	Inywi waγoshi, kundishai wavyele wenyu, sa Kilisito akundishevyo bumbangwa akikiinkila ṅwenye kwa mbuli yakwe, 
EPH.5.26	kangwe ajihoze na mbulingwa akijiṅaza na kujihaka mazi! 
EPH.5.27	Ne akundilevyo kukiliγanyiza ṅwenye bumba jetogolwa kuti: Nkajina danko ao nkunyankunya ao vyefanana na ivi, kuti: Ni bumba ṅazi kishimasa. 
EPH.5.28	Vivyoho vyaagiza, hatawaγoshi, wakundishe wavyele wawe, viya ni mili yawe. Hambu mwemkundisha muke akikundisha ṅwenye. 
EPH.5.29	Hambu kale hoshe nkakuna ashukileye ṅwili wakwe ṅwenye, miya aushuγa, aulela, sa Kilisito aγoshwelevyo bumbangwa. 
EPH.5.30	Hambu ti madango ya ṅwili wakwe. 
EPH.5.31	Ne ndivyo vileke, mγoshi akiasha ishe na nine, aandakane na muke, awa waili waγaluke ṅwili muṅwe. 
EPH.5.32	Ichi kihili ni kikulu, miya imi nilonga viya vya Kilisito na vya bumbangwa. Lushe vivyoho hata 
EPH.5.33	inywi kila muntu amkundishe muke, sa avyokikundisha ṅwenye, miya mvyele amwogohe mγoshi!
EPH.6.1	Inywi wana, itikai wavyazi wenyu, kwa kuti mu wa Zumbe! 
EPH.6.2	Hambu unu ni utanda. Gimbika isho na nyokwe! Unu ni mulomo wa bosi ugezilwewo msuhi wa kuγamba: 
EPH.6.3	Uikale mpeho, uγenyeze mishi kunu shi! 
EPH.6.4	Inywi waishe, mshekweze wana wenyu maya, miya wakuzei na kuwashunda, wamwitike Zumbe! 
EPH.6.5	Inywi watuṅwa sa muvyomwitika Kilisito, itikai wazumbe wenyu wa kiinushi na kuwaogoha na kudidima, msheγenyeze mbuli mwe myoyo yenyu! 
EPH.6.6	Mshezifye ndima mwiolelwe du, viya mtakunda kutamila wantu, miya kwa kuti mu watuṅwa wa Kilisito, γosholai kwa moyo, Mulungu avyokunda! 
EPH.6.7	Tumikai na kutamilwa, viya so wantu muwotumikila, miya viya mtamtumikila Zumbe! Tailai kuti: 
EPH.6.8	Kila muntu ati aγoshola ndima ntana, atazaipokela kwa Zumbe, ati ni mutuṅwa, ati ni ṅwana vyale. 
EPH.6.9	Hata inywi wazumbe, muwaγoshwele sa viyaho, mleke kushindawavaila mkitaila kuti: Zumbe ywawe na ywenyu a mwe lwingu, nkaolela cheni cha muntu.
EPH.6.10	Kushilikiza wanduγu, kwa kuti mu wa Zumbe, tendai nguvu kwa iyo ntoγo ya ufuṅwa wakwe! 
EPH.6.11	Tozai mata yoshe ya Kimulungu, mdahe kuikila lwufyo lwoshe lwa Satani nkani! 
EPH.6.12	Hanibu nkondo, tiyona nayo, so ya vye mpome na nyama, miya ni nkondo ya wazumbe na wafuṅwa na wanguvu wetoza inu shi, iikale na lwiza, na ziya mpehompeho mbada zoshe ze ulanga. 
EPH.6.13	Kwa ivyobo tozai mata yoshe ya Kimulungu, kangwe mdaheomana, mushi mubada ukibula, mdahevota viya vibada vyoshe mwiγoloke! 
EPH.6.14	Γolokai, mwikikantile na ukweli, mwizwikile utanda, viya ni demu ja nkondo, milundi yenyu iikantiγwe vilatu! 
EPH.6.15	Ne kukiteγa kubilikila nyemi ya mpolele. 
EPH.6.16	Kushima ivi vyoshe γuwai ngawo ya kutozesha! Ne ndiyo mdahe kuzimya nayo mivi yoshe yena molo yetambikwa ni yuja muhada! Zwikai nkofiya ya uvunizi! 
EPH.6.17	Tozal shime ya kimpeho, ni mbulingwa ya Mulungu! 
EPH.6.18	Kwa mbuli zoshe vikai na kulombeza na kuhembeleza mishi yoshe kwa nguvu ya mpehongwa! Kangi gonai mesho mkikihima kuhembelezeza waṅazi woshe, 
EPH.6.19	hata imi, nifilwe mbazi, nishungulwe kanwa changu kwa bilikila mbulingwa, niukule na nyemi ulau ushiwotailikana kale hoshe, niwotumikila hata niishungiγwe, 
EPH.6.20	niγoshole iyo ndima yangu na nyemi vivyoho, nilonge sa vivyoniagiza!
EPH.6.21	Miya kangwe hata inywi mtaile, mbuli zangu ziγendilevyo, nilivyo aha, vyoshe atamiukwila mnduγu Tikiko, niyemkundisha, kwa kuti ni muluγojo mkoolezi ywa Zumbe. 
EPH.6.22	Uyu nizamtuma na kwenyu kwa iyo mbuli, kangwe mtaile, mbuli zetu zilivyo, kangwe ashangaiaze myoyo yenyu.
EPH.6.23	Mpeho na wanduγu, watende lukundishano na mitozesheze yeanduka kwa Mulungu Tate na kwa Zumbe Yesu Kilisito! 
EPH.6.24	Mbazi iikaile woshe wemkundisha Zumbe ywetu Yesu Kilisito na kusheleγela! Amini.
PHP.1.1	Imi Paulo na Timoteyo, te watuṅwa wa Kilisito Yesu, tawagondela waṅazi woshe baluwa wena Kilisito Yesu, weikala Filipi, haṅwe na waolezi na watumikizi. 
PHP.1.2	Mbazi imiikaile, na mpeho yeanduka kwa Mulungu, Tate yweshu, na kwa Zumbe Yesu Kilisito!
PHP.1.3	Namtogola Mulungu ywangu hoshe nihokamikumbukila, 
PHP.1.4	hambu mishi yoshe nihokamihembelezeza inywi nyosheni nivika na nyemi, 
PHP.1.5	kwa kuti mwaangilana na ulaungwa wedi aho mwandiileho mpaka ivi lushe. 
PHP.1.6	Ne vyeleka, nikialila aha kuti: Yuja avokileye kwenyu ndima ntana nezeaibontoleze mpaka kwa mushi wa Kilisito Yesu. 
PHP.1.7	Ne vyeniagiza kumitongonyeza nyosheni ivyoho, hambu inywi nkamuniuka mwe moyo, ati nashungwa, ati nakanila ulaungwa wedi nikiuukula na nguvu kuti: Inywi nyoshe na imi toshe tipangilwe mbazi ṅwenga. Mwona ywangu ni Mulungu, 
PHP.1.8	nivyobulwa ni luzwi na inywi nyosheni kwa mbazi za Kilisito Yesu. 
PHP.1.9	Nahembeleza inu mbuli ṅwenga, kukundishana kwenyu kuisiize kuγenela vivyoho vivyoho haṅwe na utalizi kwa viya, muvyotenda viyuγo na shoni zoshe, 
PHP.1.10	mdahebunkula vishiivanavyo, kangwe nezemlawile mushingwa wa Kilisito mwiṅaziγwe uhambanyi woshe, 
PHP.1.11	mwiγenyeze kuwo ja utana mwinkiγwewo ni Kilisito Yesu, kangwe Mulungu agimbikwe, atogolwe.
PHP.1.12	Miya nakunda, mtaile inywi kuti: Masa yangu yazaleka, ulaungwa wedi uγende, 
PHP.1.13	kwa kuti mazolo yangu yamanyika lushe kunu bomani koshe, hata kosheni kutuhu kuti: Nishungwa kwa mbuli ya Kilisito Yesu. 
