PSA.1.1+PSA.1.2	Gwyn ei fyd y sawl na ddilyn
PSA.1.1+PSA.1.2	Gyngor drwg, na loetran chwaith
PSA.1.1+PSA.1.2	Ar y ffordd lle y tramwya
PSA.1.1+PSA.1.2	Pechaduriaid ar eu taith,
PSA.1.1+PSA.1.2	Na chydeistedd â gwatwarwyr,
PSA.1.1+PSA.1.2	Ond sy’n cadw cyfraith Duw,
PSA.1.1+PSA.1.2	Ac yn dwfn fyfyrio arni
PSA.1.1+PSA.1.2	Beunydd beunos tra bo byw.
PSA.1.3+PSA.1.4	Bydd fel coeden wedi’i phlannu
PSA.1.3+PSA.1.4	Ar lan dŵr, yn dwyn ffrwyth da
PSA.1.3+PSA.1.4	Yn ei phryd, a’i dail heb wywo.
PSA.1.3+PSA.1.4	Llwydda ym mhob peth a wna.
PSA.1.3+PSA.1.4	Nid fel hynny y drygionus,
PSA.1.3+PSA.1.4	Ond fel us a yrr y gwynt,
PSA.1.3+PSA.1.4	Yn ymdroelli yn yr awyr
PSA.1.3+PSA.1.4	Cyn diflannu ar ei hynt.
PSA.1.5+PSA.1.6	Felly, ni saif y drygionus
PSA.1.5+PSA.1.6	Yn y farn a ddaw ryw ddydd,
PSA.1.5+PSA.1.6	Ac yng nghynulleidfa’r cyfiawn
PSA.1.5+PSA.1.6	Pechaduriaid byth ni bydd.
PSA.1.5+PSA.1.6	Y mae’r Arglwydd da yn gwylio
PSA.1.5+PSA.1.6	Ffordd y cyfiawn ar bob llaw,
PSA.1.5+PSA.1.6	Ond mae ffordd y rhai drygionus
PSA.1.5+PSA.1.6	Yn diflannu a darfod draw.
PSA.2.1+PSA.2.2	Paham y mae’r cenhedloedd
PSA.2.1+PSA.2.2	Yn derfysg oll i gyd,
PSA.2.1+PSA.2.2	A’r bobloedd yn cynllwynio
PSA.2.1+PSA.2.2	Yn ofer ledled byd?
PSA.2.1+PSA.2.2	Brenhinoedd, llywodraethwyr,
PSA.2.1+PSA.2.2	Yn trefnu byddin gref
PSA.2.1+PSA.2.2	Yn erbyn Duw, yr Arglwydd,
PSA.2.1+PSA.2.2	A’i fab eneiniog ef.
PSA.2.3+PSA.2.4+PSA.2.5+PSA.2.6	“Fe ddrylliwn ni eu rhwymau
PSA.2.3+PSA.2.4+PSA.2.5+PSA.2.6	A’u rhaffau,” yw eu cri;
PSA.2.3+PSA.2.4+PSA.2.5+PSA.2.6	Ond chwerthin y mae’r Arglwydd,
PSA.2.3+PSA.2.4+PSA.2.5+PSA.2.6	A’u gwatwar yn eu bri.
PSA.2.3+PSA.2.4+PSA.2.5+PSA.2.6	Llefara yn ei ddicter,
PSA.2.3+PSA.2.4+PSA.2.5+PSA.2.6	A’u llenwi oll â braw:
PSA.2.3+PSA.2.4+PSA.2.5+PSA.2.6	“Gosodais i fy mrenin
PSA.2.3+PSA.2.4+PSA.2.5+PSA.2.6	Ar fynydd Seion draw.”
PSA.2.7+PSA.2.8+PSA.2.9	“Adroddaf,” meddai’r brenin,
PSA.2.7+PSA.2.8+PSA.2.9	“Ddatganiad Duw i mi:
PSA.2.7+PSA.2.8+PSA.2.9	‘Fi a’th genhedlodd heddiw.
PSA.2.7+PSA.2.8+PSA.2.9	Yn wir, fy mab wyt ti,
PSA.2.7+PSA.2.8+PSA.2.9	Rhof iti’n etifeddiaeth
PSA.2.7+PSA.2.8+PSA.2.9	Y gwledydd yn ddi-lai.
PSA.2.7+PSA.2.8+PSA.2.9	Fe’u drylli â gwialen haearn,
PSA.2.7+PSA.2.8+PSA.2.9	A’u malu fel llestr clai.’”
PSA.2.10+PSA.2.11+PSA.2.12	Yn awr, frenhinoedd, pwyllwch,
PSA.2.10+PSA.2.11+PSA.2.12	A rhowch, heb dywallt gwaed,
PSA.2.10+PSA.2.11+PSA.2.12	Wasanaeth gwiw i’r Arglwydd;
PSA.2.10+PSA.2.11+PSA.2.12	Cusanwch oll ei draed.
PSA.2.10+PSA.2.11+PSA.2.12	Rhag iddo ffromi a’ch difa,
PSA.2.10+PSA.2.11+PSA.2.12	Cans chwim yw llid Duw’r nef.
PSA.2.10+PSA.2.11+PSA.2.12	Gwyn fyd y rhai sy’n gwneuthur
PSA.2.10+PSA.2.11+PSA.2.12	Eu lloches ynddo ef.
PSA.3.1+PSA.3.2	Mae fy ngelynion lu,
PSA.3.1+PSA.3.2	Yn uchel iawn eu llef,
PSA.3.1+PSA.3.2	Yn holi’n goeglyd, “Pam na ddaw
PSA.3.1+PSA.3.2	Ei Dduw i’w achub ef?”
PSA.3.3+PSA.3.4	Ond yr wyt ti, fy Nuw,
PSA.3.3+PSA.3.4	Yn darian gref i mi.
PSA.3.3+PSA.3.4	Gwaeddaf yn uchel arno ef;
PSA.3.3+PSA.3.4	Fe etyb yntau ’nghri.
PSA.3.5+PSA.3.6	Mi gysgaf, a deffrôf,
PSA.3.5+PSA.3.6	Am fod fy Nuw o’m tu.
PSA.3.5+PSA.3.6	Nid ofnwn fyrddiwn o rai drwg.
PSA.3.5+PSA.3.6	Nac ymosodiad llu.
PSA.3.7+PSA.3.8	Fe drewi di’r rhai drwg,
PSA.3.7+PSA.3.8	A thorri’u dannedd llym.
PSA.3.7+PSA.3.8	Ti biau’r waredigaeth fawr.
PSA.3.7+PSA.3.8	Bendithia ni â’th rym.
PSA.4.1+PSA.4.2+PSA.4.3+PSA.4.4	O Dduw, a’m gwaredaist i droeon
PSA.4.1+PSA.4.2+PSA.4.3+PSA.4.4	O’m blinder, clyw ’ngweddi yn awr.
PSA.4.1+PSA.4.2+PSA.4.3+PSA.4.4	Clywch chwithau, sy’n gwawdio f’anrhydedd
PSA.4.1+PSA.4.2+PSA.4.3+PSA.4.4	A charu celwyddau mor fawr:
PSA.4.1+PSA.4.2+PSA.4.3+PSA.4.4	Mae’r Arglwydd yn gwneud rhyfeddodau
PSA.4.1+PSA.4.2+PSA.4.3+PSA.4.4	I’r ffyddlon, a’i weddi a glyw.
PSA.4.1+PSA.4.2+PSA.4.3+PSA.4.4	Pa werth colli cwsg mewn dicllonedd?
PSA.4.1+PSA.4.2+PSA.4.3+PSA.4.4	Na phechwch, distewch gerbron Duw.
PSA.4.5+PSA.4.6+PSA.4.7+PSA.4.8	O rhowch eich holl ffydd yn yr Arglwydd,
PSA.4.5+PSA.4.6+PSA.4.7+PSA.4.8	Offrymwch aberthau sydd iawn.
PSA.4.5+PSA.4.6+PSA.4.7+PSA.4.8	Llewyrched yr Arglwydd oleuni
PSA.4.5+PSA.4.6+PSA.4.7+PSA.4.8	Ei wyneb ef arnom yn llawn.
PSA.4.5+PSA.4.6+PSA.4.7+PSA.4.8	Rwy’n llonnach na chwi, er digonedd
PSA.4.5+PSA.4.6+PSA.4.7+PSA.4.8	Cynhaeaf eich grawnwin a’ch ŷd.
PSA.4.5+PSA.4.6+PSA.4.7+PSA.4.8	Gorweddaf mewn heddwch, a chysgu:
PSA.4.5+PSA.4.6+PSA.4.7+PSA.4.8	Yr Arglwydd a’m cynnal o hyd.
PSA.5.1+PSA.5.2+PSA.5.3	O gwrando ’ngeiriau, Arglwydd da,
PSA.5.1+PSA.5.2+PSA.5.3	Ystyria ’nghwyn, a chlyw
PSA.5.1+PSA.5.2+PSA.5.3	Fy nghri am gymorth gennyt ti,
PSA.5.1+PSA.5.2+PSA.5.3	Fy Mrenin i a’m Duw.
PSA.5.4+PSA.5.5	Disgwyliaf am y bore bach,
PSA.5.4+PSA.5.5	Pan glywi di fy llais.
PSA.5.4+PSA.5.5	Ni saif y drwg yn d’wyddfod byth,
PSA.5.4+PSA.5.5	Ni hoffi neb trahaus.
PSA.5.5+PSA.5.6	Difethi di’r celwyddgwn oll,
PSA.5.5+PSA.5.6	Casei bob drwg a wnaed.
PSA.5.5+PSA.5.6	Ffieiddia Duw’r twyllodrus rai,
PSA.5.5+PSA.5.6	A’r sawl sy’n tywallt gwaed.
PSA.5.7+PSA.5.8	Ond gan mor fawr dy gariad, dof
PSA.5.7+PSA.5.8	I’th deml i gadw’r oed;
PSA.5.7+PSA.5.8	Yn dy gyfiawnder arwain fi,
PSA.5.7+PSA.5.8	Gwna union ffordd i’m troed.
PSA.5.9+PSA.5.10	Nid oes ar eiriau’r drwg ddim coel,
PSA.5.9+PSA.5.10	Mae’u llwnc fel beddrod du;
PSA.5.9+PSA.5.10	Boed aflwydd iddynt, cosba hwy
PSA.5.9+PSA.5.10	Am eu pechodau lu.
PSA.5.11+PSA.5.12	Ond llawenhaed a chaned pawb
PSA.5.11+PSA.5.12	Sy’n caru d’enw drud.
PSA.5.11+PSA.5.12	Bydd tarian ffafr dy fendith dros
PSA.5.11+PSA.5.12	Y cyfiawn yn y byd.
PSA.6.1+PSA.6.2+PSA.6.3	O Arglwydd, yn dy ddig,
PSA.6.1+PSA.6.2+PSA.6.3	Paid â’m ceryddu,
PSA.6.1+PSA.6.2+PSA.6.3	Ond trugarha, fy Nuw,
PSA.6.1+PSA.6.2+PSA.6.3	Cans rwy’n clafychu.
PSA.6.1+PSA.6.2+PSA.6.3	O tyred i’m hiacháu;
PSA.6.1+PSA.6.2+PSA.6.3	Brawychwyd f’esgyrn brau;
PSA.6.1+PSA.6.2+PSA.6.3	Arswydaf a thristáu.
PSA.6.1+PSA.6.2+PSA.6.3	Pa hyd y pery?
PSA.6.4+PSA.6.5+PSA.6.6+PSA.6.7	O Arglwydd, gwared fi,
PSA.6.4+PSA.6.5+PSA.6.6+PSA.6.7	Yn d’ofal ffyddlon,
PSA.6.4+PSA.6.5+PSA.6.6+PSA.6.7	Cans pwy all yn y bedd
PSA.6.4+PSA.6.5+PSA.6.6+PSA.6.7	Dy foli o galon?
PSA.6.4+PSA.6.5+PSA.6.6+PSA.6.7	Fy ngwely’n foddfa sydd
PSA.6.4+PSA.6.5+PSA.6.6+PSA.6.7	Gan ddagrau nos a dydd,
PSA.6.4+PSA.6.5+PSA.6.6+PSA.6.7	A phŵl fy llygaid prudd
PSA.6.4+PSA.6.5+PSA.6.6+PSA.6.7	Gan fy ngelynion.
PSA.6.8+PSA.6.9+PSA.6.10	Ewch ymaith, chwi rai drwg,
PSA.6.8+PSA.6.9+PSA.6.10	Sy’n fy mhoenydio,
PSA.6.8+PSA.6.9+PSA.6.10	Oherwydd clywodd Duw
PSA.6.8+PSA.6.9+PSA.6.10	Fi’n beichio wylo.
PSA.6.8+PSA.6.9+PSA.6.10	Gwrandawodd arnaf fi,
PSA.6.8+PSA.6.9+PSA.6.10	Derbyniodd ing fy nghri.
PSA.6.8+PSA.6.9+PSA.6.10	Fe ddrysa’ch cynllwyn chwi,
PSA.6.8+PSA.6.9+PSA.6.10	A’ch cywilyddio.
PSA.7.1+PSA.7.2+PSA.7.3+PSA.7.4+PSA.7.5	Fy Nuw, ynot ti y llochesaf,
PSA.7.1+PSA.7.2+PSA.7.3+PSA.7.4+PSA.7.5	Boed iti f’amddiffyn yn lew
PSA.7.1+PSA.7.2+PSA.7.3+PSA.7.4+PSA.7.5	Rhag dyfod fy holl wrthwynebwyr
PSA.7.1+PSA.7.2+PSA.7.3+PSA.7.4+PSA.7.5	I’m darnio a’m llarpio fel llew.
PSA.7.1+PSA.7.2+PSA.7.3+PSA.7.4+PSA.7.5	O Arglwydd, os bûm yn dwyllodrus,
PSA.7.1+PSA.7.2+PSA.7.3+PSA.7.4+PSA.7.5	Os brifais fy ngelyn heb raid,
PSA.7.1+PSA.7.2+PSA.7.3+PSA.7.4+PSA.7.5	Boed iddo ddifetha fy einioes,
PSA.7.1+PSA.7.2+PSA.7.3+PSA.7.4+PSA.7.5	A sathru f’anrhydedd i’r llaid.
PSA.7.6+PSA.7.7+PSA.7.8+PSA.7.9+PSA.7.10+PSA.7.11	Tyrd, Arglwydd, i farnu ’ngelynion,
PSA.7.6+PSA.7.7+PSA.7.8+PSA.7.9+PSA.7.10+PSA.7.11	A saf yn eu herbyn mewn llid.
PSA.7.6+PSA.7.7+PSA.7.8+PSA.7.9+PSA.7.10+PSA.7.11	Ymgasgled y bobl o’th amgylch,
PSA.7.6+PSA.7.7+PSA.7.8+PSA.7.9+PSA.7.10+PSA.7.11	A thi uwch eu pennau i gyd.
PSA.7.6+PSA.7.7+PSA.7.8+PSA.7.9+PSA.7.10+PSA.7.11	Ond barna fi’n ôl fy nghyfiawnder,
PSA.7.6+PSA.7.7+PSA.7.8+PSA.7.9+PSA.7.10+PSA.7.11	Difetha ddrygioni o’r tir.
PSA.7.6+PSA.7.7+PSA.7.8+PSA.7.9+PSA.7.10+PSA.7.11	Dduw cyfiawn, sy’n profi calonnau,
PSA.7.6+PSA.7.7+PSA.7.8+PSA.7.9+PSA.7.10+PSA.7.11	Dyrchafa y cyfiawn a’r gwir.
PSA.7.12+PSA.7.13+PSA.7.14+PSA.7.15	Fe hoga’r drygionus ei gleddyf,
PSA.7.12+PSA.7.13+PSA.7.14+PSA.7.15	Mae’n plygu ei fwa yn dynn.
PSA.7.12+PSA.7.13+PSA.7.14+PSA.7.15	Darpara ei arfau angheuol,
PSA.7.12+PSA.7.13+PSA.7.14+PSA.7.15	A’r tân ar ei saethau ynghyn.
PSA.7.12+PSA.7.13+PSA.7.14+PSA.7.15	Cenhedlodd ddrygioni a niwed,
PSA.7.12+PSA.7.13+PSA.7.14+PSA.7.15	Yn awr mae yn esgor ar dwyll.
PSA.7.12+PSA.7.13+PSA.7.14+PSA.7.15	Bu’n cloddio ei bydew a’i geibio,
PSA.7.12+PSA.7.13+PSA.7.14+PSA.7.15	Yn awr mae yn syrthio drwy’r rhwyll.
PSA.7.16+PSA.7.17	Daw’n ôl ar ei ben ef ei hunan
PSA.7.16+PSA.7.17	Y trais a gynlluniodd er gwaeth,
PSA.7.16+PSA.7.17	Ac arno’i hun hefyd y disgyn
PSA.7.16+PSA.7.17	Y cyfan o’r niwed a wnaeth.
PSA.7.16+PSA.7.17	A minnau, diolchaf i’r Arglwydd
PSA.7.16+PSA.7.17	Am ei holl gyfiawnder i gyd,
PSA.7.16+PSA.7.17	A chanaf i enw’r Goruchaf
PSA.7.16+PSA.7.17	Fy alaw o foliant o hyd.
PSA.8.1+PSA.8.2	O Arglwydd, mor ardderchog
PSA.8.1+PSA.8.2	Dy enw drwy’r holl fyd.
PSA.8.1+PSA.8.2	Gosodaist dy ogoniant
PSA.8.1+PSA.8.2	Goruwch y nef i gyd.
PSA.8.1+PSA.8.2	Ond codaist fawl babanod,
PSA.8.1+PSA.8.2	Plant sugno bychain, gwan,
PSA.8.1+PSA.8.2	I’th warchod rhag d’elynion
PSA.8.1+PSA.8.2	A’u trechu yn y man.
PSA.8.3+PSA.8.4	Pan welaf waith dy fysedd
PSA.8.3+PSA.8.4	Wrth edrych tua’r ne’:
PSA.8.3+PSA.8.4	Yr haul a’r sêr a’r lleuad,
PSA.8.3+PSA.8.4	A roddaist yn eu lle,
PSA.8.3+PSA.8.4	“Pwy ydwyf fi,” gofynnaf,
PSA.8.3+PSA.8.4	“A phwy yw dynol ryw,
PSA.8.3+PSA.8.4	I ti ofalu amdanom,
PSA.8.3+PSA.8.4	A’n cofio, f’Arglwydd Dduw?”
PSA.8.5+PSA.8.6	Ac eto, ti a’n gwnaethost
PSA.8.5+PSA.8.6	Ychydig bach islaw
PSA.8.5+PSA.8.6	Y duwiau; rhoist awdurdod
PSA.8.5+PSA.8.6	I ni dros waith dy law.
PSA.8.5+PSA.8.6	Coronaist ni â mawredd,
PSA.8.5+PSA.8.6	A gosod dan ein traed,
PSA.8.5+PSA.8.6	Er ein mwynhad a’n defnydd
PSA.8.5+PSA.8.6	Y cyfan oll a wnaed:
PSA.8.7+PSA.8.8+PSA.8.9	Yr ychen yn y meysydd,
PSA.8.7+PSA.8.8+PSA.8.9	Y defaid oll a’r myllt,
PSA.8.7+PSA.8.8+PSA.8.9	A’r anifeiliaid rheibus,
PSA.8.7+PSA.8.8+PSA.8.9	Y pysg a’r adar gwyllt,
PSA.8.7+PSA.8.8+PSA.8.9	A phopeth sy’n tramwyo
PSA.8.7+PSA.8.8+PSA.8.9	Trwy’r dyfroedd oll i gyd,
PSA.8.7+PSA.8.8+PSA.8.9	O Arglwydd, mor ardderchog
PSA.8.7+PSA.8.8+PSA.8.9	Dy enw drwy’r holl fyd.
PSA.9.1+PSA.9.2+PSA.9.3	Diolchaf, Arglwydd, am dy holl
PSA.9.1+PSA.9.2+PSA.9.3	Ryfeddodau.
PSA.9.1+PSA.9.2+PSA.9.3	Try fy ngwrthwynebwyr oll
PSA.9.1+PSA.9.2+PSA.9.3	Yn eu holau;
PSA.9.1+PSA.9.2+PSA.9.3	Ond â mi fe fuost ti’n
PSA.9.1+PSA.9.2+PSA.9.3	Gwbl uniawn.
PSA.9.1+PSA.9.2+PSA.9.3	Eistedd ar dy orsedd fry’n
PSA.9.1+PSA.9.2+PSA.9.3	Farnwr cyfiawn.
PSA.9.4+PSA.9.5+PSA.9.6+PSA.9.7+PSA.9.8	Cosbaist y drygionus rai,
PSA.9.4+PSA.9.5+PSA.9.6+PSA.9.7+PSA.9.8	A’r cenhedloedd;
PSA.9.4+PSA.9.5+PSA.9.6+PSA.9.7+PSA.9.8	Difa’u henw a dileu
PSA.9.4+PSA.9.5+PSA.9.6+PSA.9.7+PSA.9.8	Eu dinasoedd.
PSA.9.4+PSA.9.5+PSA.9.6+PSA.9.7+PSA.9.8	A hyd byth, ar orsedd fawr
PSA.9.4+PSA.9.5+PSA.9.6+PSA.9.7+PSA.9.8	Dy uchelder,
PSA.9.4+PSA.9.5+PSA.9.6+PSA.9.7+PSA.9.8	Berni bobloedd daear lawr
PSA.9.4+PSA.9.5+PSA.9.6+PSA.9.7+PSA.9.8	Mewn cyfiawnder.
PSA.9.9+PSA.9.10+PSA.9.11+PSA.9.12	Bydded Duw yn noddfa i’r
PSA.9.9+PSA.9.10+PSA.9.11+PSA.9.12	Gorthrymedig.
PSA.9.9+PSA.9.10+PSA.9.11+PSA.9.12	Bydd y sawl a’i cais yn wir
PSA.9.9+PSA.9.10+PSA.9.11+PSA.9.12	Yn gadwedig.
PSA.9.9+PSA.9.10+PSA.9.11+PSA.9.12	Canwch fawl i’r Arglwydd Dduw.
PSA.9.9+PSA.9.10+PSA.9.11+PSA.9.12	Ef, Duw Seion,
PSA.9.9+PSA.9.10+PSA.9.11+PSA.9.12	Yw’r dialydd gwaed a glyw
PSA.9.9+PSA.9.10+PSA.9.11+PSA.9.12	Waedd ei weision.
PSA.9.13+PSA.9.14+PSA.9.15+PSA.9.16	Cod fi, Dduw, o byrth y bedd,
PSA.9.13+PSA.9.14+PSA.9.15+PSA.9.16	O’m helbulon,
PSA.9.13+PSA.9.14+PSA.9.15+PSA.9.16	Fel y molaf di mewn hedd
PSA.9.13+PSA.9.14+PSA.9.15+PSA.9.16	Ym mhyrth Seion.
PSA.9.13+PSA.9.14+PSA.9.15+PSA.9.16	Maglwyd y rhai drwg yn nwyd
PSA.9.13+PSA.9.14+PSA.9.15+PSA.9.16	Eu dichellion;
PSA.9.13+PSA.9.14+PSA.9.15+PSA.9.16	Daliodd Duw hwy’n sownd yn rhwyd
PSA.9.13+PSA.9.14+PSA.9.15+PSA.9.16	Eu cynllwynion.
PSA.9.17+PSA.9.18+PSA.9.19+PSA.9.20	Nid am byth y troir yn ôl
PSA.9.17+PSA.9.18+PSA.9.19+PSA.9.20	Gri’r anghenus,
PSA.9.17+PSA.9.18+PSA.9.19+PSA.9.20	Ond dychweled i Sheol
PSA.9.17+PSA.9.18+PSA.9.19+PSA.9.20	Y drygionus.
PSA.9.17+PSA.9.18+PSA.9.19+PSA.9.20	Dyro d’arswyd, Dduw, yn chwim
PSA.9.17+PSA.9.18+PSA.9.19+PSA.9.20	Yn eu calon,
PSA.9.17+PSA.9.18+PSA.9.19+PSA.9.20	Fel y gwelont nad ŷnt ddim
PSA.9.17+PSA.9.18+PSA.9.19+PSA.9.20	Ond meidrolion.
PSA.10.1+PSA.10.2+PSA.10.3+PSA.10.4	Pam, O Dduw, y sefi draw
PSA.10.1+PSA.10.2+PSA.10.3+PSA.10.4	Mewn cyfyngder
PSA.10.1+PSA.10.2+PSA.10.3+PSA.10.4	Pan fo’r drwg yn peri braw
PSA.10.1+PSA.10.2+PSA.10.3+PSA.10.4	Yn ei falchder?
PSA.10.1+PSA.10.2+PSA.10.3+PSA.10.4	Barus ac ymffrostgar yw
PSA.10.1+PSA.10.2+PSA.10.3+PSA.10.4	Yn ei chwantau.
PSA.10.1+PSA.10.2+PSA.10.3+PSA.10.4	Gwawdia’r Arglwydd, caeodd Dduw
PSA.10.1+PSA.10.2+PSA.10.3+PSA.10.4	O’i gynlluniau.
PSA.10.5+PSA.10.6+PSA.10.7+PSA.10.8	Mae dy farnau di’r tu hwnt
PSA.10.5+PSA.10.6+PSA.10.7+PSA.10.8	I’w amgyffred.
PSA.10.5+PSA.10.6+PSA.10.7+PSA.10.8	Dywed yn ei feddwl brwnt,
PSA.10.5+PSA.10.6+PSA.10.7+PSA.10.8	“Ni chaf niwed.”
PSA.10.5+PSA.10.6+PSA.10.7+PSA.10.8	Mae’n llawn melltith, trais a gwawd
PSA.10.5+PSA.10.6+PSA.10.7+PSA.10.8	A drygioni.
PSA.10.5+PSA.10.6+PSA.10.7+PSA.10.8	Llecha’n gudd i ladd y tlawd
PSA.10.5+PSA.10.6+PSA.10.7+PSA.10.8	Mewn pentrefi.
PSA.10.9+PSA.10.10+PSA.10.11+PSA.10.12	Gwylia, megis llew o’i ffau,
PSA.10.9+PSA.10.10+PSA.10.11+PSA.10.12	Am y truan,
PSA.10.9+PSA.10.10+PSA.10.11+PSA.10.12	Ac fe’i dena i’r dychrynfâu
PSA.10.9+PSA.10.10+PSA.10.11+PSA.10.12	Sy’n ei guddfan.
PSA.10.9+PSA.10.10+PSA.10.11+PSA.10.12	Dywed, “Trodd yr Arglwydd draw,
PSA.10.9+PSA.10.10+PSA.10.11+PSA.10.12	Ac ni falia.”
PSA.10.9+PSA.10.10+PSA.10.11+PSA.10.12	Cyfod, Arglwydd, cod dy law.
PSA.10.9+PSA.10.10+PSA.10.11+PSA.10.12	Nac anghofia.
PSA.10.13+PSA.10.14+PSA.10.15	Pam y mae’r rhai drwg, O Dduw,
PSA.10.13+PSA.10.14+PSA.10.15	Yn dy wawdio,
PSA.10.13+PSA.10.14+PSA.10.15	Ac yn dweud o hyd, “Nid yw
PSA.10.13+PSA.10.14+PSA.10.15	Ef yn malio”?
PSA.10.13+PSA.10.14+PSA.10.15	Ond rwyt ti yn sylwi ar boen
PSA.10.13+PSA.10.14+PSA.10.15	Yr anffodus.
PSA.10.13+PSA.10.14+PSA.10.15	Cod a dryllia nerth a hoen
PSA.10.13+PSA.10.14+PSA.10.15	Y drygionus.
PSA.10.16+PSA.10.17+PSA.10.18	Duw sydd frenin; blin fydd ffawd
PSA.10.16+PSA.10.17+PSA.10.18	Y cenhedloedd.
PSA.10.16+PSA.10.17+PSA.10.18	Arglwydd, clywaist gwyn y tlawd
PSA.10.16+PSA.10.17+PSA.10.18	Yn eu hingoedd.
PSA.10.16+PSA.10.17+PSA.10.18	Gwnei gyfiawnder iddynt hwy,
PSA.10.16+PSA.10.17+PSA.10.18	A’u hamddiffyn,
PSA.10.16+PSA.10.17+PSA.10.18	Ac ni chaiff meidrolion mwy
PSA.10.16+PSA.10.17+PSA.10.18	Beri dychryn.
PSA.11.1+PSA.11.2+PSA.11.3	Yn yr Arglwydd cefais loches.
PSA.11.1+PSA.11.2+PSA.11.3	Beth yw diben dweud mor ffôl:
PSA.11.1+PSA.11.2+PSA.11.3	“Ffo i’r mynydd fel aderyn”,
PSA.11.1+PSA.11.2+PSA.11.3	A’r drygionus ar fy ôl?
PSA.11.1+PSA.11.2+PSA.11.3	Plyg ei fwa, yna saethu
PSA.11.1+PSA.11.2+PSA.11.3	Yn y caddug at y da.
PSA.11.1+PSA.11.2+PSA.11.3	Os dinistrir y sylfeini,
PSA.11.1+PSA.11.2+PSA.11.3	Yr un cyfiawn – beth a wna?
PSA.11.4+PSA.11.5+PSA.11.6+PSA.11.7	Gwêl yr Arglwydd ar ei orsedd
PSA.11.4+PSA.11.5+PSA.11.6+PSA.11.7	Yn ei deml yn y nef
PSA.11.4+PSA.11.5+PSA.11.6+PSA.11.7	Ni feidrolion, ac fe’n profir
PSA.11.4+PSA.11.5+PSA.11.6+PSA.11.7	Gan ei lygaid tanbaid ef.
PSA.11.4+PSA.11.5+PSA.11.6+PSA.11.7	Glawia farwor tân a brwmstan
PSA.11.4+PSA.11.5+PSA.11.6+PSA.11.7	Ar y drwg, a gwynt di-hedd.
PSA.11.4+PSA.11.5+PSA.11.6+PSA.11.7	Cyfiawn yw, a châr gyfiawnder.
PSA.11.4+PSA.11.5+PSA.11.6+PSA.11.7	Caiff yr uniawn weld ei wedd.
PSA.12.1+PSA.12.2+PSA.12.3+PSA.12.4	O Arglwydd, arbed bellach;
PSA.12.1+PSA.12.2+PSA.12.3+PSA.12.4	Nid oes neb teyrngar mwy.
PSA.12.1+PSA.12.2+PSA.12.3+PSA.12.4	Mae gweniaith ffals a chelwydd
PSA.12.1+PSA.12.2+PSA.12.3+PSA.12.4	Ar eu tafodau hwy.
PSA.12.1+PSA.12.2+PSA.12.3+PSA.12.4	Dinistria di’r ymffrostgar,
PSA.12.1+PSA.12.2+PSA.12.3+PSA.12.4	Sy’n dweud mewn brol a bri,
PSA.12.1+PSA.12.2+PSA.12.3+PSA.12.4	“Ein nerth sydd yn ein tafod.
PSA.12.1+PSA.12.2+PSA.12.3+PSA.12.4	Pwy a’n disgybla ni?”
PSA.12.5+PSA.12.6+PSA.12.7+PSA.12.8	“Oherwydd cri’r anghenus,
PSA.12.5+PSA.12.6+PSA.12.7+PSA.12.8	Achubaf ef o’i gur,”
PSA.12.5+PSA.12.6+PSA.12.7+PSA.12.8	Yw geiriau Duw, a’r rheini
PSA.12.5+PSA.12.6+PSA.12.7+PSA.12.8	Fel aur neu arian pur.
PSA.12.5+PSA.12.6+PSA.12.7+PSA.12.8	O gwared ni, O Arglwydd,
PSA.12.5+PSA.12.6+PSA.12.7+PSA.12.8	Rhag y genhedlaeth hon,
PSA.12.5+PSA.12.6+PSA.12.7+PSA.12.8	Am fod drygioni a llygredd
PSA.12.5+PSA.12.6+PSA.12.7+PSA.12.8	Yn prowla’r ddaear gron.
PSA.13.1	Am ba hyd, O Arglwydd
PSA.13.1	Yr anghofi fi,
PSA.13.1	Ac y troi dy wyneb
PSA.13.1	Oddi wrth fy nghri?
PSA.13.2	Am ba hyd y dygaf
PSA.13.2	Loes a gofid prudd,
PSA.13.2	Ac y’m trecha’r gelyn
PSA.13.2	Fel y gwawria dydd?
PSA.13.3	Edrych arnaf, Arglwydd.
PSA.13.3	Gwared fi, fy Nuw.
PSA.13.3	Dyro, rhag fy marw,
PSA.13.3	Olau i’m llygaid gwyw.
PSA.13.4	Rhag i’m gelyn frolio,
PSA.13.4	Wrth i’m llygaid gau,
PSA.13.4	“Fe’i gorchfygais i ef,”
PSA.13.4	Ac ymlawenhau.
PSA.13.5	Ond yn dy achubiaeth
PSA.13.5	Ffyddlon a di-ffael
PSA.13.5	Rhof fy ffydd, a chanaf
PSA.13.5	Am dy fod mor hael.
PSA.14.1	Fe ddywedodd y rhai ynfyd,
PSA.14.1	“Nid oes Duw”.
PSA.14.1	Ffiaidd yw
PSA.14.1	Eu gweithredoedd bawlyd.
PSA.14.2	Gwyrodd Duw o’i nef i chwilio
PSA.14.2	A oedd un
PSA.14.2	Ar ddi-hun
PSA.14.2	A oedd yn ei geisio.
PSA.14.3	Ond mae pawb yn cyfeiliorni.
PSA.14.3	Nid oes neb,
PSA.14.3	Nac oes, neb,
PSA.14.3	Sydd yn gwneud daioni.
PSA.14.4	Gwnânt bryd bwyd o’m pobl anghenus.
PSA.14.4	Oni bydd
PSA.14.4	Cosb ryw ddydd
PSA.14.4	Ar y rhai drygionus?
PSA.14.5	A’r pryd hynny fe fydd gyflawn
PSA.14.5	Maint eu braw,
PSA.14.5	Cans fe ddaw’r
PSA.14.5	Arglwydd at y cyfiawn.
PSA.14.6	Er i chwi ddirmygu cyngor
PSA.14.6	Y rhai gwael,
PSA.14.6	Y Duw hael
PSA.14.6	Yw eu noddfa a’u hangor.
PSA.14.7	Pan adferir i’r iselwael,
PSA.14.7	Lwydd a budd,
PSA.14.7	Mawr iawn fydd
PSA.14.7	Gorfoleddu Israel.
PSA.15.1	Pwy gaiff ganiatâd i aros
PSA.15.1	Yn dy babell di, fy Nuw?
PSA.15.1	Yn dy fynydd sanctaidd, Arglwydd,
PSA.15.1	Pwy gaiff ganiatâd i fyw?
PSA.15.2+PSA.15.3	Un sy’n byw yn gywir, onest,
PSA.15.2+PSA.15.3	Gwneud cyfiawnder ar ei daith,
PSA.15.2+PSA.15.3	Nad oes malais ar ei dafod,
PSA.15.2+PSA.15.3	Na wna ddrwg i’w gyfaill chwaith.
PSA.15.3+PSA.15.4	Un nad ydyw’n goddef enllib
PSA.15.3+PSA.15.4	Am gymydog, ac sy’n byw
PSA.15.3+PSA.15.4	I ddirmygu yr ysgymun,
PSA.15.3+PSA.15.4	Parchu’r rhai sy’n ofni Duw.
PSA.15.4+PSA.15.5	Un sy’n cadw’r llw a dyngodd,
PSA.15.4+PSA.15.5	Llog ar arian byth ni fyn,
PSA.15.4+PSA.15.5	Nad yw’n twyllo y diniwed,
PSA.15.4+PSA.15.5	Ni symudir a wna hyn.
PSA.16.1+PSA.16.2+PSA.16.3+PSA.16.4	O Dduw, cadw fi, cans llochesaf
PSA.16.1+PSA.16.2+PSA.16.3+PSA.16.4	Yn dawel am byth ynot ti.
PSA.16.1+PSA.16.2+PSA.16.3+PSA.16.4	Ti ydyw fy Arglwydd, a hebot
PSA.16.1+PSA.16.2+PSA.16.3+PSA.16.4	Nid oes dim daioni i mi.
PSA.16.1+PSA.16.2+PSA.16.3+PSA.16.4	Boed melltith ar bawb sy’n gwirioni
PSA.16.1+PSA.16.2+PSA.16.3+PSA.16.4	Ar dduwiau paganaidd y wlad;
PSA.16.1+PSA.16.2+PSA.16.3+PSA.16.4	Dim ond amlhau ei ofidiau
PSA.16.1+PSA.16.2+PSA.16.3+PSA.16.4	Y mae’r un a’u blysia mewn brad.
PSA.16.4+PSA.16.5+PSA.16.6+PSA.16.7	Ni roddaf waed-offrwm i’r rheini,
PSA.16.4+PSA.16.5+PSA.16.6+PSA.16.7	Na’u galw am help pan wyf wan.
PSA.16.4+PSA.16.5+PSA.16.6+PSA.16.7	Ti, Arglwydd, yw ’nghyfran a’m cwpan;
PSA.16.4+PSA.16.5+PSA.16.6+PSA.16.7	Ti sy’n diogelu fy rhan.
PSA.16.4+PSA.16.5+PSA.16.6+PSA.16.7	Fe syrthiodd i mi y llinynnau
PSA.16.4+PSA.16.5+PSA.16.6+PSA.16.7	Mewn mannau dymunol drwy f’oes.
PSA.16.4+PSA.16.5+PSA.16.6+PSA.16.7	Mae im etifeddiaeth ragorol;
PSA.16.4+PSA.16.5+PSA.16.6+PSA.16.7	Bendithiaf yr Arglwydd a’i rhoes.
PSA.16.7+PSA.16.8+PSA.16.9+PSA.16.10+PSA.16.11	Y mae fy meddyliau’n fy nysgu.
PSA.16.7+PSA.16.8+PSA.16.9+PSA.16.10+PSA.16.11	Yr Arglwydd yw nerth fy llaw dde.
PSA.16.7+PSA.16.8+PSA.16.9+PSA.16.10+PSA.16.11	Fe’i dodais o’m blaen i yn wastad:
PSA.16.7+PSA.16.8+PSA.16.9+PSA.16.10+PSA.16.11	Am hyn, ni’m symudir o’m lle.
PSA.16.7+PSA.16.8+PSA.16.9+PSA.16.10+PSA.16.11	Rwy’n llawen. Caf fyw yn ddiogel,
PSA.16.7+PSA.16.8+PSA.16.9+PSA.16.10+PSA.16.11	Ac ni ddaw un distryw i mi.
PSA.16.7+PSA.16.8+PSA.16.9+PSA.16.10+PSA.16.11	Dangosi imi lwybr pob gwynfyd.
PSA.16.7+PSA.16.8+PSA.16.9+PSA.16.10+PSA.16.11	Mae mwyniant am byth ynot ti.
PSA.17.1+PSA.17.2+PSA.17.3+PSA.17.4	Rwyf yn llefain am gyfiawnder;
PSA.17.1+PSA.17.2+PSA.17.3+PSA.17.4	Dyro sylw i’m llef, a chlyw.
PSA.17.1+PSA.17.2+PSA.17.3+PSA.17.4	Gwrando gri gwefusau didwyll.
PSA.17.1+PSA.17.2+PSA.17.3+PSA.17.4	Doed fy marn oddi wrth fy Nuw.
PSA.17.1+PSA.17.2+PSA.17.3+PSA.17.4	Gwyliaist fi drwy’r nos heb ganfod
PSA.17.1+PSA.17.2+PSA.17.3+PSA.17.4	Dim drygioni ynof fi.
PSA.17.1+PSA.17.2+PSA.17.3+PSA.17.4	Ni throseddais gyda’m genau,
PSA.17.1+PSA.17.2+PSA.17.3+PSA.17.4	Ond fe gedwais d’eiriau di.
PSA.17.5+PSA.17.6+PSA.17.7	Ar hyd llwybrau yr anufudd
PSA.17.5+PSA.17.6+PSA.17.7	Byddai ’nghamau’n pallu’n syth,
PSA.17.5+PSA.17.6+PSA.17.7	Ar dy lwybrau di, fodd bynnag,
PSA.17.5+PSA.17.6+PSA.17.7	Nid yw ’nhraed yn methu byth.
PSA.17.5+PSA.17.6+PSA.17.7	Gwaeddaf am dy fod yn f’ateb.
PSA.17.5+PSA.17.6+PSA.17.7	Dangos dy ffyddlondeb triw,
PSA.17.5+PSA.17.6+PSA.17.7	Ti sy’n achub â’th ddeheulaw
PSA.17.5+PSA.17.6+PSA.17.7	Bawb a’th geisia’n lloches wiw.
PSA.17.8+PSA.17.9+PSA.17.10+PSA.17.11+PSA.17.12	Megis cannwyll loyw dy lygad
PSA.17.8+PSA.17.9+PSA.17.10+PSA.17.11+PSA.17.12	Cadw fi, a’m cuddio dan
PSA.17.8+PSA.17.9+PSA.17.10+PSA.17.11+PSA.17.12	Dy adenydd rhag gelynion
PSA.17.8+PSA.17.9+PSA.17.10+PSA.17.11+PSA.17.12	Sydd o’m cwmpas ym mhob man.
PSA.17.8+PSA.17.9+PSA.17.10+PSA.17.11+PSA.17.12	Bras eu calon, balch eu tafod,
PSA.17.8+PSA.17.9+PSA.17.10+PSA.17.11+PSA.17.12	Maent amdanaf wedi cau,
PSA.17.8+PSA.17.9+PSA.17.10+PSA.17.11+PSA.17.12	Bron â’m bwrw i’r llawr a’m llarpio,
PSA.17.8+PSA.17.9+PSA.17.10+PSA.17.11+PSA.17.12	Megis llew yn llamu o’i ffau.
PSA.17.13+PSA.17.14+PSA.17.15	Cyfod, Arglwydd, yn eu herbyn;
PSA.17.13+PSA.17.14+PSA.17.15	Bwrw hwy i lawr i’r baw.
PSA.17.13+PSA.17.14+PSA.17.15	Gwared fi rhag y drygionus,
PSA.17.13+PSA.17.14+PSA.17.15	A dinistria hwy â’th law.
PSA.17.13+PSA.17.14+PSA.17.15	Cosba hwy, a chadw weddill
PSA.17.13+PSA.17.14+PSA.17.15	I’w babanod, wŷr di-hedd.
PSA.17.13+PSA.17.14+PSA.17.15	Ond caf fi, pan gyfiawnheir fi,
PSA.17.13+PSA.17.14+PSA.17.15	Fy nigoni o weld dy wedd.
PSA.18.1+PSA.18.2+PSA.18.3	Caraf di, Arglwydd, fy nghryfder, fy nghraig a’m gwaredydd,
PSA.18.1+PSA.18.2+PSA.18.3	Duw yw fy nghraig lle llochesaf, fy nghaer, fy achubydd.
PSA.18.1+PSA.18.2+PSA.18.3	Gwaeddaf ar Dduw,
PSA.18.1+PSA.18.2+PSA.18.3	Cans fy ngwaredwr i yw
PSA.18.1+PSA.18.2+PSA.18.3	Rhag fy ngelynion aflonydd.
PSA.18.4+PSA.18.5+PSA.18.6	Pan oedd marwolaeth a distryw yn clymu amdanaf,
PSA.18.4+PSA.18.5+PSA.18.6	Gwaeddais yn daer yn fy ngofid ar Dduw y Goruchaf.
PSA.18.4+PSA.18.5+PSA.18.6	Clywodd fy llef
PSA.18.4+PSA.18.5+PSA.18.6	O’i deml lân yn y nef.
PSA.18.4+PSA.18.5+PSA.18.6	Clywodd fy ngwaedd a daeth ataf.
PSA.18.7+PSA.18.8+PSA.18.9+PSA.18.10	Crynodd y ddaear a gwegian; ysgydwodd y bryniau.
PSA.18.7+PSA.18.8+PSA.18.9+PSA.18.10	Daeth mwg o’i ffroenau; o’i gylch yr oedd marwor yn cynnau.
PSA.18.7+PSA.18.8+PSA.18.9+PSA.18.10	A daeth i lawr
PSA.18.7+PSA.18.8+PSA.18.9+PSA.18.10	Drwy’r nen fel tymestl fawr:
PSA.18.7+PSA.18.8+PSA.18.9+PSA.18.10	Marchog y gwynt a’r cymylau.
PSA.18.11+PSA.18.12+PSA.18.13+PSA.18.14	Taenodd gymylau yn orchudd a chaddug yn guddfan;
PSA.18.11+PSA.18.12+PSA.18.13+PSA.18.14	Cenllysg a thân o’r disgleirdeb o’i flaen a ddaeth allan.
PSA.18.11+PSA.18.12+PSA.18.13+PSA.18.14	Daeth ei lais ef
PSA.18.11+PSA.18.12+PSA.18.13+PSA.18.14	Megis taranau o’r nef,
PSA.18.11+PSA.18.12+PSA.18.13+PSA.18.14	A’i fellt fel saethau yn hedfan.
PSA.18.15+PSA.18.16+PSA.18.17	Gwelwyd gwaelodion y môr, a dinoethwyd holl seiliau’r
PSA.18.15+PSA.18.16+PSA.18.17	Byd gan dy gerydd di, Arglwydd, a chwythiad dy ffroenau.
PSA.18.15+PSA.18.16+PSA.18.17	Tynnodd ef fi
PSA.18.15+PSA.18.16+PSA.18.17	O ddyfroedd cryfion eu lli.
PSA.18.15+PSA.18.16+PSA.18.17	Gwaredodd fi o’m holl frwydrau.
PSA.18.18+PSA.18.19	Daethant i’m herbyn yn lluoedd yn nydd fy nghaledi,
PSA.18.18+PSA.18.19	Ond fe fu’r Arglwydd fy Nuw yn gynhaliaeth driw imi.
PSA.18.18+PSA.18.19	Dug fi o’r tân
PSA.18.18+PSA.18.19	I le agored a glân,
PSA.18.18+PSA.18.19	Am ei fod ef yn fy hoffi.
PSA.18.20+PSA.18.21+PSA.18.22+PSA.18.23+PSA.18.24	Talodd yr Arglwydd i mi yn ôl glendid fy nwylo,
PSA.18.20+PSA.18.21+PSA.18.22+PSA.18.23+PSA.18.24	Am imi gadw ei lwybrau, heb droi oddi wrtho.
PSA.18.20+PSA.18.21+PSA.18.22+PSA.18.23+PSA.18.24	Cedwais o hyd
PSA.18.20+PSA.18.21+PSA.18.22+PSA.18.23+PSA.18.24	Ei holl gyfreithiau i gyd:
PSA.18.20+PSA.18.21+PSA.18.22+PSA.18.23+PSA.18.24	Cedwais fy hun rhag tramgwyddo.
PSA.18.25+PSA.18.26+PSA.18.27	Rwyt ti’n ddi-fai i’r di-fai, ac yn ffyddlon i’r ffyddlon,
PSA.18.25+PSA.18.26+PSA.18.27	Pur i’r rhai pur, ond yn wyrgam i bawb sy’n elynion.
PSA.18.25+PSA.18.26+PSA.18.27	Yr wyt yn hael
PSA.18.25+PSA.18.26+PSA.18.27	At y rhai gwylaidd a gwael,
PSA.18.25+PSA.18.26+PSA.18.27	Ac yn darostwng y beilchion.
PSA.18.28+PSA.18.29+PSA.18.30	Ti sy’n goleuo fy llusern, yn troi nos yn nefoedd.
PSA.18.28+PSA.18.29+PSA.18.30	Trwot ti neidiaf dros fur a goresgyn byddinoedd.
PSA.18.28+PSA.18.29+PSA.18.30	Tarian o ddur,
PSA.18.28+PSA.18.29+PSA.18.30	Profwyd ei air ef yn bur.
PSA.18.28+PSA.18.29+PSA.18.30	Perffaith yw Duw’n ei weithredoedd.
