PSA.105.37+PSA.105.38+PSA.105.39+PSA.105.40	A’r Eifftiaid, yn eu harswyd,
PSA.105.37+PSA.105.38+PSA.105.39+PSA.105.40	Yn llawenhau i gyd.
PSA.105.37+PSA.105.38+PSA.105.39+PSA.105.40	Rhoes gwmwl i’w gorchuddio,
PSA.105.37+PSA.105.38+PSA.105.39+PSA.105.40	Goleuo’r nos â thân;
PSA.105.37+PSA.105.38+PSA.105.39+PSA.105.40	Anfonodd iddynt soflieir
PSA.105.37+PSA.105.38+PSA.105.39+PSA.105.40	A bara’r nefoedd lân.
PSA.105.41+PSA.105.42+PSA.105.43+PSA.105.44+PSA.105.45	Fe holltodd graig nes tarddodd
PSA.105.41+PSA.105.42+PSA.105.43+PSA.105.44+PSA.105.45	Y dŵr drwy’r anial cras,
PSA.105.41+PSA.105.42+PSA.105.43+PSA.105.44+PSA.105.45	Cans cofiodd ei addewid
PSA.105.41+PSA.105.42+PSA.105.43+PSA.105.44+PSA.105.45	I Abraham, ei was.
PSA.105.41+PSA.105.42+PSA.105.43+PSA.105.44+PSA.105.45	Rhoes diroedd y cenhedloedd
PSA.105.41+PSA.105.42+PSA.105.43+PSA.105.44+PSA.105.45	I’w bobl yn lle i fyw,
PSA.105.41+PSA.105.42+PSA.105.43+PSA.105.44+PSA.105.45	I gadw ei gyfreithiau
PSA.105.41+PSA.105.42+PSA.105.43+PSA.105.44+PSA.105.45	A’i ddeddfau. Molwch Dduw.
PSA.106.1+PSA.106.2+PSA.106.3	Molwch yr Arglwydd, cans da yw; ei gariad a bery.
PSA.106.1+PSA.106.2+PSA.106.3	Diolchwch iddo; ei wyrthiau ni all neb eu traethu.
PSA.106.1+PSA.106.2+PSA.106.3	Mor wyn eu byd
PSA.106.1+PSA.106.2+PSA.106.3	Y rhai sy’n uniawn o hyd
PSA.106.1+PSA.106.2+PSA.106.3	Ac sydd yn gyfiawn wrth farnu.
PSA.106.4+PSA.106.5	Cofia fi, Arglwydd, pan ddoi at dy bobl â’th ffafriaeth.
PSA.106.4+PSA.106.5	Ymwêl â mi pan estynni dy fawr waredigaeth,
PSA.106.4+PSA.106.5	A gweld a gaf
PSA.106.4+PSA.106.5	Lwyddiant dy bobl; llawenhaf
PSA.106.4+PSA.106.5	Pan lawenha d’etifeddiaeth.
PSA.106.6+PSA.106.7+PSA.106.8	Yr ydym ni, fel ein tadau gynt, wedi troseddu.
PSA.106.6+PSA.106.7+PSA.106.8	Yn yr Aifft, gwadent dy wyrthiau a’th gariad a’th allu.
PSA.106.6+PSA.106.7+PSA.106.8	Wrth y Môr Coch,
PSA.106.6+PSA.106.7+PSA.106.8	Gwrthryfelasant yn groch;
PSA.106.6+PSA.106.7+PSA.106.8	Ond mynnodd Duw eu gwaredu.
PSA.106.9+PSA.106.10+PSA.106.11+PSA.106.12	Sychodd y môr, ac arweiniodd hwy trwy ei ddyfnderau.
PSA.106.9+PSA.106.10+PSA.106.11+PSA.106.12	Gwaredodd hwy o law’r gelyn a’u harbed rhag angau.
PSA.106.9+PSA.106.10+PSA.106.11+PSA.106.12	Llyncodd y dŵr
PSA.106.9+PSA.106.10+PSA.106.11+PSA.106.12	Eu gwrthwynebwyr, bob gŵr.
PSA.106.9+PSA.106.10+PSA.106.11+PSA.106.12	Yna credasant ei eiriau.
PSA.106.13+PSA.106.14+PSA.106.15	Buan yr aeth ei weithredoedd yn angof llwyr ganddynt.
PSA.106.13+PSA.106.14+PSA.106.15	Profasant Dduw yn yr anial, pan ddaeth eu blys drostynt.
PSA.106.13+PSA.106.14+PSA.106.15	Rhoes iddynt hwy
PSA.106.13+PSA.106.14+PSA.106.15	Bopeth a geisient, a mwy,
PSA.106.13+PSA.106.14+PSA.106.15	Ond gyrrodd nychdod amdanynt.
PSA.106.16+PSA.106.17+PSA.106.18	Roedd eu cenfigen at Foses ac Aaron yn wenfflam.
PSA.106.16+PSA.106.17+PSA.106.18	Caeodd y ddaear am Dathan a chwmni Abiram.
PSA.106.16+PSA.106.17+PSA.106.18	Cyneuodd tân:
PSA.106.16+PSA.106.17+PSA.106.18	Llosgodd ei fflamau yn lân
PSA.106.16+PSA.106.17+PSA.106.18	Y rhai drygionus a gwyrgam.
PSA.106.19+PSA.106.20+PSA.106.21+PSA.106.22	Yn Horeb, delw a wnaethant o lo, a’i haddoli:
PSA.106.19+PSA.106.20+PSA.106.21+PSA.106.22	Newid gogoniant eu Duw am lun eidion yn pori;
PSA.106.19+PSA.106.20+PSA.106.21+PSA.106.22	Anghofio Duw,
PSA.106.19+PSA.106.20+PSA.106.21+PSA.106.22	A’u dygodd o’r Aifft yn fyw,
PSA.106.19+PSA.106.20+PSA.106.21+PSA.106.22	A gwyrthiau mawr ei ddaioni.
PSA.106.23+PSA.106.24+PSA.106.25	Felly, dywedodd y byddai’n eu difa yn ebrwydd
PSA.106.23+PSA.106.24+PSA.106.25	Oni ddôi Moses i’r bwlch i droi’n ôl ei ddicllonrwydd.
PSA.106.23+PSA.106.24+PSA.106.25	Mawr oedd eu brad;
PSA.106.23+PSA.106.24+PSA.106.25	Cablent hyfrydwch y wlad,
PSA.106.23+PSA.106.24+PSA.106.25	Heb wrando ar lais yr Arglwydd.
PSA.106.26+PSA.106.27	Fe gododd yntau ei law yn eu herbyn, a thyngu
PSA.106.26+PSA.106.27	Y byddai’n peri eu cwymp yn yr anial, a chwalu
PSA.106.26+PSA.106.27	Eu plant i gyd
PSA.106.26+PSA.106.27	I blith cenhedloedd y byd –
PSA.106.26+PSA.106.27	Trwy’r gwledydd oll eu gwasgaru.
PSA.106.28+PSA.106.29+PSA.106.30+PSA.106.31	Yna fe aethant dan iau’r duw Baal Peor, a bwyta
PSA.106.28+PSA.106.29+PSA.106.30+PSA.106.31	Ebyrth y meirw, a digio yr Arglwydd â’u hyfdra.
PSA.106.28+PSA.106.29+PSA.106.30+PSA.106.31	Daeth arnynt bla,
PSA.106.28+PSA.106.29+PSA.106.30+PSA.106.31	Nes barnodd Phinees hwy’n dda;
PSA.106.28+PSA.106.29+PSA.106.30+PSA.106.31	Cofir am byth ei uniondra.
PSA.106.32+PSA.106.33	Wrth ddyfroedd Meriba hefyd, digiasant yr Arglwydd,
PSA.106.32+PSA.106.33	Ac fe aeth Moses ei hun i drybini o’u herwydd,
PSA.106.32+PSA.106.33	Canys fe aeth
PSA.106.32+PSA.106.33	Chwerwder i’w enaid, a gwnaeth
PSA.106.32+PSA.106.33	Bethau a fu iddo’n dramgwydd.
PSA.106.34+PSA.106.35+PSA.106.36+PSA.106.37	Nid ufuddhasant ychwaith a dinistrio’r paganiaid,
PSA.106.34+PSA.106.35+PSA.106.36+PSA.106.37	Ond ymgymysgu â hwy, dysgu ffyrdd yr anwariaid:
PSA.106.34+PSA.106.35+PSA.106.36+PSA.106.37	Plygu o flaen
PSA.106.34+PSA.106.35+PSA.106.36+PSA.106.37	Delwau o goed ac o faen,
PSA.106.34+PSA.106.35+PSA.106.36+PSA.106.37	Aberthu’u plant i’r demoniaid.
PSA.106.38+PSA.106.39	I dduwiau Canaan aberthent eu meibion a’u merched,
PSA.106.38+PSA.106.39	Ac fe halogwyd y ddaear â gwaed y diniwed.
PSA.106.38+PSA.106.39	Trwy hyn i gyd
PSA.106.38+PSA.106.39	Aethant yn aflan eu bryd
PSA.106.38+PSA.106.39	Ac yn buteiniaid gwargaled.
PSA.106.40+PSA.106.41+PSA.106.42+PSA.106.43	Yna cythruddodd yr Arglwydd eu Duw yn eu herbyn,
PSA.106.40+PSA.106.41+PSA.106.42+PSA.106.43	A darostyngodd ei bobl dan lywodraeth eu gelyn.
PSA.106.40+PSA.106.41+PSA.106.42+PSA.106.43	Droeon bu’n gefn
PSA.106.40+PSA.106.41+PSA.106.42+PSA.106.43	Iddynt, ond pechent drachefn,
PSA.106.40+PSA.106.41+PSA.106.42+PSA.106.43	A darostyngai hwy wedyn.
PSA.106.44+PSA.106.45+PSA.106.46	Ond, wrth eu clywed yn llefain am gymorth, fe gofiodd
PSA.106.44+PSA.106.45+PSA.106.46	Ei hen gyfamod â hwy, ac fe edifarhaodd.
PSA.106.44+PSA.106.45+PSA.106.46	O’i gariad hael
PSA.106.44+PSA.106.45+PSA.106.46	Rhoes ei drugaredd ddi-ffael
PSA.106.44+PSA.106.45+PSA.106.46	Yng nghalon pawb a’u caethiwodd.
PSA.106.47+PSA.106.48	Gwared ni, Arglwydd, a’n cynnull ni o blith y gwledydd,
PSA.106.47+PSA.106.48	Inni gael diolch i’th enw, a’th foli di beunydd.
PSA.106.47+PSA.106.48	Byth y bo’n ben
PSA.106.47+PSA.106.48	Arglwydd Dduw Israel. Amen.
PSA.106.47+PSA.106.48	Molwch yr Arglwydd tragywydd.
PSA.107.1+PSA.107.2+PSA.107.3	“Diolched pawb i’r Arglwydd,
PSA.107.1+PSA.107.2+PSA.107.3	Cans da a ffyddlon yw,”
PSA.107.1+PSA.107.2+PSA.107.3	Yw cân pawb a waredwyd
PSA.107.1+PSA.107.2+PSA.107.3	Trwy law yr Arglwydd Dduw.
PSA.107.1+PSA.107.2+PSA.107.3	Fe’u cipiodd o law’r gelyn,
PSA.107.1+PSA.107.2+PSA.107.3	A’u cynnull i un lle
PSA.107.1+PSA.107.2+PSA.107.3	O’r dwyrain a’r gorllewin,
PSA.107.1+PSA.107.2+PSA.107.3	O’r gogledd ac o’r de.
PSA.107.8	Bydded iddynt ddiolch
PSA.107.8	Am holl ffyddlondeb Duw,
PSA.107.8	Ac am a wnaeth i’w bobl gaeth,
PSA.107.8	Cans cariad yw.
PSA.107.4+PSA.107.5+PSA.107.6+PSA.107.7	Aeth rhai ar goll mewn drysi,
PSA.107.4+PSA.107.5+PSA.107.6+PSA.107.7	Heb ffordd at le i fyw.
PSA.107.4+PSA.107.5+PSA.107.6+PSA.107.7	Yr oeddent yn newynog,
PSA.107.4+PSA.107.5+PSA.107.6+PSA.107.7	Ac yn sychedig, wyw.
PSA.107.4+PSA.107.5+PSA.107.6+PSA.107.7	Gwaeddasant ar yr Arglwydd,
PSA.107.4+PSA.107.5+PSA.107.6+PSA.107.7	A’u gwared a wnaeth ef,
PSA.107.4+PSA.107.5+PSA.107.6+PSA.107.7	A’u harwain hyd ffordd union
PSA.107.4+PSA.107.5+PSA.107.6+PSA.107.7	I ddiogelwch tref.
PSA.107.8+PSA.107.9	Bydded iddynt ddiolch
PSA.107.8+PSA.107.9	Am holl ffyddlondeb Duw;
PSA.107.8+PSA.107.9	Eu porthi a wnaeth â mêl a llaeth,
PSA.107.8+PSA.107.9	Cans cariad yw.
PSA.107.10+PSA.107.11+PSA.107.12+PSA.107.13+PSA.107.14	Roedd rhai mewn carchar tywyll
PSA.107.10+PSA.107.11+PSA.107.12+PSA.107.13+PSA.107.14	Am wrthod ufuddhau
PSA.107.10+PSA.107.11+PSA.107.12+PSA.107.13+PSA.107.14	I eiriau Duw, yn gaethion
PSA.107.10+PSA.107.11+PSA.107.12+PSA.107.13+PSA.107.14	Heb undyn i’w rhyddhau.
PSA.107.10+PSA.107.11+PSA.107.12+PSA.107.13+PSA.107.14	Gwaeddasant ar yr Arglwydd,
PSA.107.10+PSA.107.11+PSA.107.12+PSA.107.13+PSA.107.14	A’u gwared a wnaeth ef,
PSA.107.10+PSA.107.11+PSA.107.12+PSA.107.13+PSA.107.14	A’u dwyn hwy o’r tywyllwch,
PSA.107.10+PSA.107.11+PSA.107.12+PSA.107.13+PSA.107.14	A dryllio’r gadwyn gref.
PSA.107.15+PSA.107.16	Bydded iddynt ddiolch
PSA.107.15+PSA.107.16	Am holl ffyddlondeb Duw
PSA.107.15+PSA.107.16	Yn dryllio’r pyrth a’r heyrn drwy wyrth,
PSA.107.15+PSA.107.16	Cans cariad yw.
PSA.107.17+PSA.107.18+PSA.107.19+PSA.107.20	Roedd rhai, yn sgîl eu pechod,
PSA.107.17+PSA.107.18+PSA.107.19+PSA.107.20	Yn ynfyd a di-hedd;
PSA.107.17+PSA.107.18+PSA.107.19+PSA.107.20	Casaent fwyd, a daethant
PSA.107.17+PSA.107.18+PSA.107.19+PSA.107.20	Yn agos at y bedd.
PSA.107.17+PSA.107.18+PSA.107.19+PSA.107.20	Gwaeddasant ar yr Arglwydd,
PSA.107.17+PSA.107.18+PSA.107.19+PSA.107.20	A’u gwared a wnaeth ef.
PSA.107.17+PSA.107.18+PSA.107.19+PSA.107.20	Iachaodd hwy, a’u hachub,
PSA.107.17+PSA.107.18+PSA.107.19+PSA.107.20	Drwy nerthol air y nef.
PSA.107.21+PSA.107.22	Bydded iddynt ddiolch
PSA.107.21+PSA.107.22	Am holl ffyddlondeb Duw:
PSA.107.21+PSA.107.22	Mynegi i’r byd ei wyrthiau i gyd,
PSA.107.21+PSA.107.22	Cans cariad yw.
PSA.107.23+PSA.107.24+PSA.107.25+PSA.107.26+PSA.107.27+PSA.107.28+PSA.107.29+PSA.107.30	Aeth rhai i’r môr mewn llongau,
PSA.107.23+PSA.107.24+PSA.107.25+PSA.107.26+PSA.107.27+PSA.107.28+PSA.107.29+PSA.107.30	A gwelsant Dduw y gwynt
PSA.107.23+PSA.107.24+PSA.107.25+PSA.107.26+PSA.107.27+PSA.107.28+PSA.107.29+PSA.107.30	Yn corddi’r don nes troellent
PSA.107.23+PSA.107.24+PSA.107.25+PSA.107.26+PSA.107.27+PSA.107.28+PSA.107.29+PSA.107.30	Fel meddwon ar eu hynt.
PSA.107.23+PSA.107.24+PSA.107.25+PSA.107.26+PSA.107.27+PSA.107.28+PSA.107.29+PSA.107.30	Gwaeddasant ar yr Arglwydd,
PSA.107.23+PSA.107.24+PSA.107.25+PSA.107.26+PSA.107.27+PSA.107.28+PSA.107.29+PSA.107.30	A’u gwared a wnaeth ef.
PSA.107.23+PSA.107.24+PSA.107.25+PSA.107.26+PSA.107.27+PSA.107.28+PSA.107.29+PSA.107.30	Fe wnaeth i’r storm dawelu,
PSA.107.23+PSA.107.24+PSA.107.25+PSA.107.26+PSA.107.27+PSA.107.28+PSA.107.29+PSA.107.30	A dug hwy tua thref.
PSA.107.31+PSA.107.32	Bydded iddynt ddiolch
PSA.107.31+PSA.107.32	Am holl ffyddlondeb Duw,
PSA.107.31+PSA.107.32	A’i foli ymhlith ei bobl byth,
PSA.107.31+PSA.107.32	Cans cariad yw.
PSA.107.33+PSA.107.34+PSA.107.35+PSA.107.36	Mae’n troi ffynhonnau’n sychdir
PSA.107.33+PSA.107.34+PSA.107.35+PSA.107.36	I gosbi pobl ddrwg.
PSA.107.33+PSA.107.34+PSA.107.35+PSA.107.36	Mae’n troi tir sych yn ffrwythlon
PSA.107.33+PSA.107.34+PSA.107.35+PSA.107.36	I rai newynog. Dwg
PSA.107.33+PSA.107.34+PSA.107.35+PSA.107.36	Hwy yno i godi dinas;
PSA.107.33+PSA.107.34+PSA.107.35+PSA.107.36	Cânt blannu a chânt hau.
PSA.107.33+PSA.107.34+PSA.107.35+PSA.107.36	Bydd ef yn eu bendithio
PSA.107.33+PSA.107.34+PSA.107.35+PSA.107.36	Ac yn eu hamlhau.
PSA.107.8	Bydded iddynt ddiolch
PSA.107.8	Am holl ffyddlondeb Duw,
PSA.107.8	Am gnydau’r haf, am wartheg braf,
PSA.107.8	Cans cariad yw.
PSA.107.37+PSA.107.38+PSA.107.39+PSA.107.40+PSA.107.41+PSA.107.42	Pan fyddant hwy dan orthrwm,
PSA.107.37+PSA.107.38+PSA.107.39+PSA.107.40+PSA.107.41+PSA.107.42	Fe ddaw a thywallt gwarth
PSA.107.37+PSA.107.38+PSA.107.39+PSA.107.40+PSA.107.41+PSA.107.42	Ar eu gormeswyr creulon,
PSA.107.37+PSA.107.38+PSA.107.39+PSA.107.40+PSA.107.41+PSA.107.42	A’u gyrru i anial barth;
PSA.107.37+PSA.107.38+PSA.107.39+PSA.107.40+PSA.107.41+PSA.107.42	Ond cwyd y tlawd o’i ofid,
PSA.107.37+PSA.107.38+PSA.107.39+PSA.107.40+PSA.107.41+PSA.107.42	Cynydda’i deulu i gyd.
PSA.107.37+PSA.107.38+PSA.107.39+PSA.107.40+PSA.107.41+PSA.107.42	Fe lawenha yr uniawn,
PSA.107.37+PSA.107.38+PSA.107.39+PSA.107.40+PSA.107.41+PSA.107.42	Ond bydd y drwg yn fud.
PSA.107.37+PSA.107.38+PSA.107.39+PSA.107.40+PSA.107.41+PSA.107.42	Am holl ffyddlondeb Duw;
PSA.107.43	Os doeth wyt, myn roi sylw i hyn,
PSA.107.43	Cans cariad yw.
PSA.108.1+PSA.108.2+PSA.108.3	Cadarn wyf, O Dduw, a theyrngar.
PSA.108.1+PSA.108.2+PSA.108.3	Mi ddeffrôf yn awr,
PSA.108.1+PSA.108.2+PSA.108.3	Ac â’m crwth a’m telyn lafar,
PSA.108.1+PSA.108.2+PSA.108.3	Fel y tyrr y wawr,
PSA.108.1+PSA.108.2+PSA.108.3	Rhoddaf ddiolch iti’n rhwydd,
PSA.108.1+PSA.108.2+PSA.108.3	O Arglwydd, gyda phobloedd byd.
PSA.108.4+PSA.108.5+PSA.108.6	Cans ymestyn mae dy gariad
PSA.108.4+PSA.108.5+PSA.108.6	Hyd y nefoedd fry.
PSA.108.4+PSA.108.5+PSA.108.6	Cyfod, Dduw, a thros y cread
PSA.108.4+PSA.108.5+PSA.108.6	Boed d’ogoniant di.
PSA.108.4+PSA.108.5+PSA.108.6	Er mwyn gwared d’annwyl rai,
PSA.108.4+PSA.108.5+PSA.108.6	O maddau’n bai, ac ateb ni.
PSA.108.7+PSA.108.8	Fe lefarodd y Goruchaf:
PSA.108.7+PSA.108.8	“Af i fyny’n awr;
PSA.108.7+PSA.108.8	Dyffryn Succoth a fesuraf,
PSA.108.7+PSA.108.8	Rhannaf Sichem fawr.
PSA.108.7+PSA.108.8	Mae Gilead, led a hyd,
PSA.108.7+PSA.108.8	Manasse i gyd yn eiddo i mi.
PSA.108.8+PSA.108.9	Effraim yw fy helm, a Jwda
PSA.108.8+PSA.108.9	Fy nheyrnwialen wir.
PSA.108.8+PSA.108.9	Moab ydyw fy ymolchfa,
PSA.108.8+PSA.108.9	A thros Edom dir
PSA.108.8+PSA.108.9	Taflaf f’esgid. Caf foddhad
PSA.108.8+PSA.108.9	Yn erbyn gwlad Philistia i gyd”.
PSA.108.10+PSA.108.11+PSA.108.12+PSA.108.13	Pwy a’m dwg i’r ddinas gaerog?
PSA.108.10+PSA.108.11+PSA.108.12+PSA.108.13	Pwy, O Dduw, ond ti?
PSA.108.10+PSA.108.11+PSA.108.12+PSA.108.13	Er it wrthod ein llu arfog,
PSA.108.10+PSA.108.11+PSA.108.12+PSA.108.13	Rho dy help i ni.
PSA.108.10+PSA.108.11+PSA.108.12+PSA.108.13	Gwnawn wrhydri gyda Duw,
PSA.108.10+PSA.108.11+PSA.108.12+PSA.108.13	Cans ofer yw ymwared dyn.
PSA.109.1+PSA.109.2+PSA.109.3	Paid â thewi, Dduw fy moliant.
PSA.109.1+PSA.109.2+PSA.109.3	Pobl ddrwg a ddywedasant
PSA.109.1+PSA.109.2+PSA.109.3	Eu celwyddau cas amdanaf,
PSA.109.1+PSA.109.2+PSA.109.3	A, heb sail, ymosod arnaf.
PSA.109.4+PSA.109.5	Cwynant am fy ngharedigrwydd;
PSA.109.4+PSA.109.5	Rwy’n gweddïo drostynt, Arglwydd.
PSA.109.4+PSA.109.5	Drwg am dda i mi a dalant,
PSA.109.4+PSA.109.5	Cas am gariad, a dywedant:
PSA.109.6+PSA.109.7	“Rhowch ar ei ddeheulaw elyn;
PSA.109.6+PSA.109.7	Euog fydd, a’i weddi’n wrthun.
PSA.109.6+PSA.109.7	Boed ei ddyddiau’n brin, a rhodder
PSA.109.6+PSA.109.7	Arall yn ei swydd ar fyrder.
PSA.109.8+PSA.109.9+PSA.109.10+PSA.109.11	Boed ei blant ef yn amddifaid,
PSA.109.8+PSA.109.9+PSA.109.10+PSA.109.11	Yn gardotwyr ac yn grwydriaid.
PSA.109.8+PSA.109.9+PSA.109.10+PSA.109.11	Aed ei eiddo i’r beilïaid,
PSA.109.8+PSA.109.9+PSA.109.10+PSA.109.11	A’i enillion i estroniaid.
PSA.109.12+PSA.109.13	Na wnaed neb ag ef drugaredd,
PSA.109.12+PSA.109.13	Na gwneud ffafr â’i blant, na’u coledd.
PSA.109.12+PSA.109.13	Torrer ymaith ei hiliogaeth,
PSA.109.12+PSA.109.13	Dileu’i enw o fewn cenhedlaeth.
PSA.109.14+PSA.109.15	Na ddilëer holl ddrygioni
PSA.109.14+PSA.109.15	Ei gyn-dadau na’i rieni;
PSA.109.14+PSA.109.15	Cofied Duw mor anwir oeddynt,
PSA.109.14+PSA.109.15	A dileu pob cof amdanynt.
PSA.109.16+PSA.109.17	Ni fu hwn erioed yn ffyddlon,
PSA.109.16+PSA.109.17	Ond melltithiodd y rhai tlodion
PSA.109.16+PSA.109.17	A’r drylliedig hyd at angau.
PSA.109.16+PSA.109.17	Deued melltith arno yntau.
PSA.109.17+PSA.109.18+PSA.109.19	Gan na hoffai ef fendithio,
PSA.109.17+PSA.109.18+PSA.109.19	Pell fo bendith oddi wrtho.
PSA.109.17+PSA.109.18+PSA.109.19	Gwisgodd felltith megis dillad;
PSA.109.17+PSA.109.18+PSA.109.19	Bydded hon amdano’n wastad.”
PSA.109.20+PSA.109.21	Hyn a fo dy dâl, O Arglwydd,
PSA.109.20+PSA.109.21	I’m cyhuddwyr; tyrd yn ebrwydd,
PSA.109.20+PSA.109.21	Er mwyn d’enw, i weithredu
PSA.109.20+PSA.109.21	Drosof fi, ac i’m gwaredu.
PSA.109.22+PSA.109.23+PSA.109.24	Tlawd a thruan wyf; fe dderfydd
PSA.109.22+PSA.109.23+PSA.109.24	F’egni megis cysgod hwyrddydd.
PSA.109.22+PSA.109.23+PSA.109.24	Mae fy ngliniau’n wan gan ympryd;
PSA.109.22+PSA.109.23+PSA.109.24	Tenau ydwyf a newynllyd.
PSA.109.25+PSA.109.26	Rwy’n gyff gwawd i bawb; pan welant
PSA.109.25+PSA.109.26	Fi, eu pennau a ysgydwant.
PSA.109.25+PSA.109.26	Arglwydd, cymorth fi mewn llesgedd,
PSA.109.25+PSA.109.26	Achub fi yn dy drugaredd.
PSA.109.27+PSA.109.28+PSA.109.29	Dangos iddynt dy lareidd-dra;
PSA.109.27+PSA.109.28+PSA.109.29	Pan felltithiant hwy, bendithia.
PSA.109.27+PSA.109.28+PSA.109.29	Deued mawr gywilydd arnynt,
PSA.109.27+PSA.109.28+PSA.109.29	Boed eu gwarth fel gwisg amdanynt.
PSA.109.30+PSA.109.31	Yng ngwydd tyrfa fawr moliannaf
PSA.109.30+PSA.109.31	Fi yr Arglwydd; fe’i clodforaf.
PSA.109.30+PSA.109.31	Ar ddeheulaw’r tlawd, digysur,
PSA.109.30+PSA.109.31	Saif i’w achub rhag cyhuddwyr.
PSA.110.1	Oracl Duw i’m brenin: “Eistedd
PSA.110.1	Di ar fy neheulaw i,
PSA.110.1	Nes im osod dy elynion
PSA.110.1	Megis troedfainc danat ti”.
PSA.110.2	Fe rydd Duw o Seion wialen
PSA.110.2	Ei awdurdod yn dy law;
PSA.110.2	Llywodraetha dithau’n nerthol
PSA.110.2	Dros dy holl elynion draw.
PSA.110.3	Mae dy bobl yn deyrngar iti
PSA.110.3	Ar ddydd d’eni o groth y wawr
PSA.110.3	Mewn gogoniant glân; cenhedlais
PSA.110.3	Di, fel gwlith, yn frenin mawr.
PSA.110.4+PSA.110.5	Tyngodd Duw, “Yr wyt offeiriad,
PSA.110.4+PSA.110.5	Fel Melchisedec, am byth”.
PSA.110.4+PSA.110.5	Bydd yr Arglwydd yn amddiffyn
PSA.110.4+PSA.110.5	Dy ddeheulaw yn ddi-lyth.
PSA.110.5+PSA.110.6	Pan ddaw dydd ei ddig, dinistria
PSA.110.5+PSA.110.6	Holl frenhinoedd balch y byd.
PSA.110.5+PSA.110.6	Barna ymysg yr holl genhedloedd,
PSA.110.5+PSA.110.6	Ac fe’u lleinw â meirwon mud.
PSA.110.6+PSA.110.7	Fe ddinistria Duw benaethiaid
PSA.110.6+PSA.110.7	Gwledydd daear yn eu chwant;
PSA.110.6+PSA.110.7	Ond fe rydd i frenin Israel
PSA.110.6+PSA.110.7	Rym pan yf o ddŵr y nant.
PSA.111.1+PSA.111.2	Diolch a wnaf i’r Arglwydd â’m holl fod;
PSA.111.1+PSA.111.2	Gyda’r gynulleidfa uniawn seiniaf glod.
PSA.111.1+PSA.111.2	Mawr yw ei weithredoedd, fe’u harchwilir mwy
PSA.111.1+PSA.111.2	Gan y rhai sy’n ymhyfrydu ynddynt hwy.
PSA.111.1	Molwch yr Arglwydd. Alelwia.
PSA.111.1	Molwch yr Arglwydd. Alelwia.
PSA.111.3+PSA.111.4	Llawn mawredd ac anrhydedd yw ei waith;
PSA.111.3+PSA.111.4	Pery ei ddaioni i dragwyddoldeb maith.
PSA.111.3+PSA.111.4	Fe wnaeth inni gofio’i ryfeddodau i gyd;
PSA.111.3+PSA.111.4	Graslon a thrugarog ydyw Duw o hyd.
PSA.111.1	Molwch yr Arglwydd. Alelwia.
PSA.111.1	Molwch yr Arglwydd. Alelwia.
PSA.111.5+PSA.111.6	I bawb a’i hofna rhydd gynhaliaeth gref;
PSA.111.5+PSA.111.6	Ac am byth fe gofia ei gyfamod ef.
PSA.111.5+PSA.111.6	Profi a wnaeth ei rym pan roes i’w bobl holl
PSA.111.5+PSA.111.6	Dir ac etifeddiaeth y cenhedloedd oll.
PSA.111.1	Molwch yr Arglwydd. Alelwia.
PSA.111.1	Molwch yr Arglwydd. Alelwia.
PSA.111.7+PSA.111.8	Mae gwaith ei ddwylo’n gyfiawn a di-ail,
PSA.111.7+PSA.111.8	Ac mae ei ofynion oll yn gryf eu sail;
PSA.111.7+PSA.111.8	Fe’u sefydlwyd hwy’n dragwyddol yn y tir,
PSA.111.7+PSA.111.8	Ac maent oll yn uniawn, y maent oll yn wir.
PSA.111.1	Molwch yr Arglwydd. Alelwia.
PSA.111.1	Molwch yr Arglwydd. Alelwia.
PSA.111.9+PSA.111.10	Prynodd ei bobl, a mynnu eu bod hwy’n
PSA.111.9+PSA.111.10	Cadw ei gyfamod sanctaidd ef byth mwy.
PSA.111.9+PSA.111.10	Dechrau pob doethineb ydyw ofni Duw;
PSA.111.9+PSA.111.10	Pawb sy’n ufudd iddo, un deallus yw.
PSA.111.1	Molwch yr Arglwydd. Alelwia.
PSA.111.1	Molwch yr Arglwydd. Alelwia.
PSA.112.1+PSA.112.2	Molwch Dduw; fe ddaw bodlonrwydd
PSA.112.1+PSA.112.2	I bob un sy’n ofni’r Arglwydd
PSA.112.1+PSA.112.2	Ac yn hoffi ei orchmynion;
PSA.112.1+PSA.112.2	Cedyrn fydd ei ddisgynyddion.
PSA.112.2+PSA.112.3	Fe fendithir teulu’r uniawn.
PSA.112.2+PSA.112.3	Bydd ei gartref ef yn orlawn
PSA.112.2+PSA.112.3	O oludoedd, a’i gyfiawnder
PSA.112.2+PSA.112.3	Yn parhau tra pery amser.
PSA.112.4+PSA.112.5	Mewn tywyllwch caiff oleuni;
PSA.112.4+PSA.112.5	Llawn yw’r cyfiawn o dosturi.
PSA.112.4+PSA.112.5	Da yw trugarhau yn raslon
PSA.112.4+PSA.112.5	A rhoi benthyg i’r rhai tlodion.
PSA.112.5+PSA.112.6	Da yw trefnu pob rhyw fater
PSA.112.5+PSA.112.6	Mewn gonestrwydd a chyfiawnder.
PSA.112.5+PSA.112.6	Yr un cyfiawn, nis symudir,
PSA.112.5+PSA.112.6	Ac am byth ei waith a gofir.
PSA.112.7+PSA.112.8	Nid yw’n ofni drwg newyddion,
PSA.112.7+PSA.112.8	Ond diysgog yw ei galon,
PSA.112.7+PSA.112.8	Ac nid ofna nes gweld diwedd
PSA.112.7+PSA.112.8	Ei elynion a’u hanwiredd.
PSA.112.9	Rhoes i’r tlawd haelioni lawer;
PSA.112.9	Byth fe bery ei gyfiawnder;
PSA.112.9	Ac fe gaiff gan Dduw o’r diwedd
PSA.112.9	Ei ddyrchafu mewn anrhydedd.
PSA.112.10	Mae’r drygionus yn cynhyrfu
PSA.112.10	O weld hyn, gan ysgyrnygu;
PSA.112.10	Ond diflannu yn adfydus
PSA.112.10	A wna gobaith y drygionus.
PSA.113.1+PSA.113.2+PSA.113.3	Molwch yr Arglwydd, weision yr Arglwydd;
PSA.113.1+PSA.113.2+PSA.113.3	Molwch ef tra byddoch byw.
PSA.113.1+PSA.113.2+PSA.113.3	O gyfodiad haul hyd wawl
PSA.113.1+PSA.113.2+PSA.113.3	Ola’r machlud, traethwch fawl
PSA.113.1+PSA.113.2+PSA.113.3	A bendigwch yr Arglwydd ein Duw.
PSA.113.4+PSA.113.5+PSA.113.6	Uchel yw’r Arglwydd, uwch y cenhedloedd,
PSA.113.4+PSA.113.5+PSA.113.6	Uwch ei ogoniant na’r nef.
PSA.113.4+PSA.113.5+PSA.113.6	Uchel yw ei orsedd fawr,
PSA.113.4+PSA.113.5+PSA.113.6	Eto i gyd, mae’n gwyro i lawr
PSA.113.4+PSA.113.5+PSA.113.6	At yr isel. Pwy’n wir sydd fel ef?
PSA.113.7+PSA.113.8+PSA.113.9	Cwyd rai mewn angen o lwch y domen
PSA.113.7+PSA.113.8+PSA.113.9	At dywysogion i fyw.
PSA.113.7+PSA.113.8+PSA.113.9	Teulu i’r wraig ddi-blant a rydd,
PSA.113.7+PSA.113.8+PSA.113.9	A mam falch i feibion fydd.
PSA.113.7+PSA.113.8+PSA.113.9	Molwch, molwch yr Arglwydd ein Duw.
PSA.114.1+PSA.114.2	Pan ddaeth Israel allan
PSA.114.1+PSA.114.2	Gynt o wlad yr Aifft,
PSA.114.1+PSA.114.2	O blith pobl estron,
PSA.114.1+PSA.114.2	Rhai â dieithr iaith,
PSA.114.1+PSA.114.2	Rhoes yr Arglwydd Jwda’n
PSA.114.1+PSA.114.2	Gysegr iddynt hwy,
PSA.114.1+PSA.114.2	A thir Israel ydoedd
PSA.114.1+PSA.114.2	Eu harglwyddiaeth mwy.
PSA.114.3+PSA.114.4	O weld hyn, fe giliodd
PSA.114.3+PSA.114.4	Tonnau’r môr, a throdd
PSA.114.3+PSA.114.4	Yr Iorddonen hithau
PSA.114.3+PSA.114.4	Yn ei hôl o’i bodd.
PSA.114.3+PSA.114.4	Neidiodd y mynyddoedd
PSA.114.3+PSA.114.4	Megis hyrddod ffôl;
PSA.114.3+PSA.114.4	Pranciodd yr holl fryniau
PSA.114.3+PSA.114.4	Megis ŵyn ar ddôl.
PSA.114.5+PSA.114.6	Beth sydd arnoch, donnau’r
PSA.114.5+PSA.114.6	Môr, eich bod yn ffoi?
PSA.114.5+PSA.114.6	Tithau, li’r Iorddonen,
PSA.114.5+PSA.114.6	Pam dy fod yn troi?
PSA.114.5+PSA.114.6	Pam yr ydych, fryniau,
PSA.114.5+PSA.114.6	A’r mynyddoedd mwy’n
PSA.114.5+PSA.114.6	Neidio megis hyrddod,
PSA.114.5+PSA.114.6	Prancio megis ŵyn?
PSA.114.7+PSA.114.8	Cryna di, O ddaear,
PSA.114.7+PSA.114.8	Rhag yr Arglwydd Dduw;
PSA.114.7+PSA.114.8	Cryna rhag Duw Jacob,
PSA.114.7+PSA.114.8	Cans ofnadwy yw.
PSA.114.7+PSA.114.8	Ef yw’r Un sy’n gallu
PSA.114.7+PSA.114.8	Troi y graig yn llyn,
PSA.114.7+PSA.114.8	Ac o’r gallestr galed
PSA.114.7+PSA.114.8	Ddwyn ffynhonnau gwyn.
PSA.115.1+PSA.115.2+PSA.115.3	Dyro di ogoniant,
PSA.115.1+PSA.115.2+PSA.115.3	Arglwydd, nid i ni,
PSA.115.1+PSA.115.2+PSA.115.3	Ond i’th enw, canys
PSA.115.1+PSA.115.2+PSA.115.3	Cariad ydwyt ti.
PSA.115.1+PSA.115.2+PSA.115.3	Pam yr hola’r gwledydd,
PSA.115.1+PSA.115.2+PSA.115.3	“Ple y mae eu Duw?”
PSA.115.1+PSA.115.2+PSA.115.3	Mae’n Duw ni’n y nefoedd;
PSA.115.1+PSA.115.2+PSA.115.3	Crëwr popeth yw.
PSA.115.9	Israel, ymddirieda
PSA.115.9	Yn yr Arglwydd Dduw,
PSA.115.9	Cans dy gymorth parod
PSA.115.9	Di, a’th darian yw.
PSA.115.4+PSA.115.5+PSA.115.6	Duwiau y cenhedloedd,
PSA.115.4+PSA.115.5+PSA.115.6	Delwau ŷnt bob un,
PSA.115.4+PSA.115.5+PSA.115.6	Delwau aur ac arian
PSA.115.4+PSA.115.5+PSA.115.6	O waith dwylo dyn.
PSA.115.4+PSA.115.5+PSA.115.6	Y mae ganddynt enau,
PSA.115.4+PSA.115.5+PSA.115.6	Ond y maent yn fud;
PSA.115.4+PSA.115.5+PSA.115.6	Dall eu llygaid; byddar
PSA.115.4+PSA.115.5+PSA.115.6	Yw eu clustiau i gyd.
PSA.115.10	O dŷ Aaron, credwch
PSA.115.10	Yn yr Arglwydd Dduw,
PSA.115.10	Cans eich cymorth parod
PSA.115.10	Chwi, a’ch tarian yw.
PSA.115.6+PSA.115.7+PSA.115.8	Ffroenau nad aroglant,
PSA.115.6+PSA.115.7+PSA.115.8	Dwylo na wnânt waith
PSA.115.6+PSA.115.7+PSA.115.8	Sydd i’r delwau mudion:
PSA.115.6+PSA.115.7+PSA.115.8	Traed na cherddant chwaith.
PSA.115.6+PSA.115.7+PSA.115.8	Y mae eu gwneuthurwyr
PSA.115.6+PSA.115.7+PSA.115.8	Yr un mor ddi-werth,
PSA.115.6+PSA.115.7+PSA.115.8	A phawb sy’n ymddiried
PSA.115.6+PSA.115.7+PSA.115.8	Yn eu grym a’u nerth.
PSA.115.11	Chwi sy’n ofni’r Arglwydd,
PSA.115.11	Rhowch eich cred yn Nuw,
PSA.115.11	Cans eich cymorth parod
PSA.115.11	Chwi, a’ch tarian yw.
PSA.115.12+PSA.115.13+PSA.115.14	Y mae Duw’n ein cofio,
PSA.115.12+PSA.115.13+PSA.115.14	A’n bendithio a wna.
PSA.115.12+PSA.115.13+PSA.115.14	Fe fendithia Israel
PSA.115.12+PSA.115.13+PSA.115.14	A thy Aaron dda,
PSA.115.12+PSA.115.13+PSA.115.14	A phawb sy’n ei ofni,
PSA.115.12+PSA.115.13+PSA.115.14	Boed yn fach neu’n fawr.
PSA.115.12+PSA.115.13+PSA.115.14	Amlhaed Duw chwi
PSA.115.12+PSA.115.13+PSA.115.14	Oll, a’ch plant yn awr.
PSA.115.15	Boed i chwi gael bendith
PSA.115.15	Gan yr Arglwydd Dduw;
PSA.115.15	Crëwr mawr y nefoedd
PSA.115.15	A’r holl ddaear yw.
PSA.115.16+PSA.115.17+PSA.115.18	Am y nefoedd uchod,
PSA.115.16+PSA.115.17+PSA.115.18	Eiddo’r Arglwydd yw;
PSA.115.16+PSA.115.17+PSA.115.18	Ond fe roes y ddaear
PSA.115.16+PSA.115.17+PSA.115.18	I blant dynolryw.
PSA.115.16+PSA.115.17+PSA.115.18	Ni all neb o’r meirw
PSA.115.16+PSA.115.17+PSA.115.18	Foli Duw o’u tref,
PSA.115.16+PSA.115.17+PSA.115.18	Ond nyni’n oes oesoedd
PSA.115.16+PSA.115.17+PSA.115.18	A’i moliannwn ef.
PSA.115.16+PSA.115.17+PSA.115.18	Molwch bawb yr Arglwydd,
PSA.115.16+PSA.115.17+PSA.115.18	A bendithiwch Dduw,
PSA.115.16+PSA.115.17+PSA.115.18	Cans eich cymorth parod
PSA.115.16+PSA.115.17+PSA.115.18	Chwi, a’ch tarian yw.
PSA.116.1+PSA.116.2+PSA.116.3	Rwy’n caru Duw am iddo ef,
