PSA.80.8+PSA.80.9+PSA.80.10+PSA.80.11+PSA.80.12+PSA.80.13	Cuddiai ei chysgod fryniau’r haf,
PSA.80.8+PSA.80.9+PSA.80.10+PSA.80.11+PSA.80.12+PSA.80.13	A thyfai’i changau’n hir.
PSA.80.8+PSA.80.9+PSA.80.10+PSA.80.11+PSA.80.12+PSA.80.13	Pam rhwygo’i chloddiau, nes bod pawb
PSA.80.8+PSA.80.9+PSA.80.10+PSA.80.11+PSA.80.12+PSA.80.13	Yn tynnu’i ffrwythau ir,
PSA.80.8+PSA.80.9+PSA.80.10+PSA.80.11+PSA.80.12+PSA.80.13	A bod baedd y coed yn tyrchu’r pridd?
PSA.80.14+PSA.80.15+PSA.80.16+PSA.80.17+PSA.80.18+PSA.80.19	O Dduw y Lluoedd, cadw di
PSA.80.14+PSA.80.15+PSA.80.16+PSA.80.17+PSA.80.18+PSA.80.19	Dy winllan rhag pob clwy;
PSA.80.14+PSA.80.15+PSA.80.16+PSA.80.17+PSA.80.18+PSA.80.19	Am y rhai sy’n ei llosgi hi,
PSA.80.14+PSA.80.15+PSA.80.16+PSA.80.17+PSA.80.18+PSA.80.19	Cerydda a difa hwy.
PSA.80.14+PSA.80.15+PSA.80.16+PSA.80.17+PSA.80.18+PSA.80.19	Arglwydd y Lluoedd, adfer ni.
PSA.80.14+PSA.80.15+PSA.80.16+PSA.80.17+PSA.80.18+PSA.80.19	Ni thrown oddi wrthyt mwy.
PSA.80.14+PSA.80.15+PSA.80.16+PSA.80.17+PSA.80.18+PSA.80.19	Tro dy wyneb atom; gwared ni.
PSA.81.1+PSA.81.2+PSA.81.3+PSA.81.4+PSA.81.5	Canwch hyd eitha’ch dawn,
PSA.81.1+PSA.81.2+PSA.81.3+PSA.81.4+PSA.81.5	A’ch telyn fwyn mewn hwyl,
PSA.81.1+PSA.81.2+PSA.81.3+PSA.81.4+PSA.81.5	I Dduw eich nerth; mae’r lloer yn llawn,
PSA.81.1+PSA.81.2+PSA.81.3+PSA.81.4+PSA.81.5	A ninnau’n cadw gŵyl;
PSA.81.1+PSA.81.2+PSA.81.3+PSA.81.4+PSA.81.5	A seiniwch utgorn llon,
PSA.81.1+PSA.81.2+PSA.81.3+PSA.81.4+PSA.81.5	Cans dyma ddeddf ein Duw,
PSA.81.1+PSA.81.2+PSA.81.3+PSA.81.4+PSA.81.5	A roes pan ddaeth â’r genedl hon
PSA.81.1+PSA.81.2+PSA.81.3+PSA.81.4+PSA.81.5	O wlad yr Aifft yn fyw.
PSA.81.5+PSA.81.6+PSA.81.7	Fe glywaf Dduw yn dweud,
PSA.81.5+PSA.81.6+PSA.81.7	“Mi ysgafnheais i
PSA.81.5+PSA.81.6+PSA.81.7	Y baich ar d’ysgwydd gynt, a gwneud
PSA.81.5+PSA.81.6+PSA.81.7	Yn rhydd dy ddwylo di.
PSA.81.5+PSA.81.6+PSA.81.7	Mi ddeuthum i’th fywhau
PSA.81.5+PSA.81.6+PSA.81.7	Mewn taran ac mewn gwynt,
PSA.81.5+PSA.81.6+PSA.81.7	A phrofais dy deyrngarwch brau
PSA.81.5+PSA.81.6+PSA.81.7	Wrth ddŵr Meriba gynt.
PSA.81.8+PSA.81.9+PSA.81.10+PSA.81.11+PSA.81.12	Felly, O Israel, clyw
PSA.81.8+PSA.81.9+PSA.81.10+PSA.81.11+PSA.81.12	Fi’n tystio yn d’erbyn di.
PSA.81.8+PSA.81.9+PSA.81.10+PSA.81.11+PSA.81.12	Na fydded gennyt estron dduw,
PSA.81.8+PSA.81.9+PSA.81.10+PSA.81.11+PSA.81.12	Ond gwrando arnaf fi.
PSA.81.8+PSA.81.9+PSA.81.10+PSA.81.11+PSA.81.12	Myfi yw’r Arglwydd Dduw,
PSA.81.8+PSA.81.9+PSA.81.10+PSA.81.11+PSA.81.12	A’th ddygodd di o’r Aifft.
PSA.81.8+PSA.81.9+PSA.81.10+PSA.81.11+PSA.81.12	Ond Israel, cenedl gyndyn yw,
PSA.81.8+PSA.81.9+PSA.81.10+PSA.81.11+PSA.81.12	A gyrrais hi i’w thaith.
PSA.81.13+PSA.81.14+PSA.81.15+PSA.81.16	O na bai Israel byth
PSA.81.13+PSA.81.14+PSA.81.15+PSA.81.16	Yn rhodio yn fy ffyrdd!
PSA.81.13+PSA.81.14+PSA.81.15+PSA.81.16	Mi ddarostyngwn i yn syth
PSA.81.13+PSA.81.14+PSA.81.15+PSA.81.16	Ei gwrthwynebwyr fyrdd.
PSA.81.13+PSA.81.14+PSA.81.15+PSA.81.16	Dôi’r gelyn yn un haig
PSA.81.13+PSA.81.14+PSA.81.15+PSA.81.16	I blygu o’m blaen yn fud,
PSA.81.13+PSA.81.14+PSA.81.15+PSA.81.16	Ond bwydwn di â mêl o’r graig.
PSA.81.13+PSA.81.14+PSA.81.15+PSA.81.16	A’r gorau oll o’r ŷd.”
PSA.82.1	Saif ein Duw yng nghanol
PSA.82.1	Y cynulliad dwyfol;
PSA.82.1	Barna ymhlith y duwiau.
PSA.82.1	Gwrandewch ar ei eiriau.
PSA.82.2+PSA.82.3	“Pa hyd y camfarnwch?
PSA.82.2+PSA.82.3	Pa hyd y dangoswch
PSA.82.2+PSA.82.3	Ffafr at y drygionus?
PSA.82.2+PSA.82.3	Trowch at y truenus.
PSA.82.3+PSA.82.4	Rhoddwch eich dyfarniad
PSA.82.3+PSA.82.4	O blaid yr amddifad,
PSA.82.3+PSA.82.4	A gwaredu’r bregus
PSA.82.3+PSA.82.4	O law’r rhai drygionus.
PSA.82.5	Ond am na ddeallwch,
PSA.82.5	Cerddwch mewn tywyllwch,
PSA.82.5	Ac am hyn, sylfeini’r
PSA.82.5	Ddaear a ysgydwir.
PSA.82.6+PSA.82.7	Duwiau ydych; eto
PSA.82.6+PSA.82.7	Byddwch oll yn syrthio
PSA.82.6+PSA.82.7	Megis tywysogion
PSA.82.6+PSA.82.7	Marw fel meidrolion.”
PSA.82.8	Barna di yn ebrwydd
PSA.82.8	Yr holl ddaear, Arglwydd,
PSA.82.8	Canys ti sy’n didol
PSA.82.8	Yr holl fyd a’i bobol.
PSA.83.1+PSA.83.2+PSA.83.3+PSA.83.4+PSA.83.5+PSA.83.6+PSA.83.7+PSA.83.8	O Dduw, paid â bod yn ddistaw;
PSA.83.1+PSA.83.2+PSA.83.3+PSA.83.4+PSA.83.5+PSA.83.6+PSA.83.7+PSA.83.8	Gwêl y rhai sy’n dy gasáu
PSA.83.1+PSA.83.2+PSA.83.3+PSA.83.4+PSA.83.5+PSA.83.6+PSA.83.7+PSA.83.8	Yn cynllwynio yn erbyn Israel
PSA.83.1+PSA.83.2+PSA.83.3+PSA.83.4+PSA.83.5+PSA.83.6+PSA.83.7+PSA.83.8	A chynghreirio i’w llesgáu:
PSA.83.1+PSA.83.2+PSA.83.3+PSA.83.4+PSA.83.5+PSA.83.6+PSA.83.7+PSA.83.8	Edom, Ismael, Moab, Hagar,
PSA.83.1+PSA.83.2+PSA.83.3+PSA.83.4+PSA.83.5+PSA.83.6+PSA.83.7+PSA.83.8	Gebal, Ammon, yn un llu,
PSA.83.1+PSA.83.2+PSA.83.3+PSA.83.4+PSA.83.5+PSA.83.6+PSA.83.7+PSA.83.8	Amalec, Philistia a Thyrus,
PSA.83.1+PSA.83.2+PSA.83.3+PSA.83.4+PSA.83.5+PSA.83.6+PSA.83.7+PSA.83.8	Ac Asyria fawr o’u tu.
PSA.83.9+PSA.83.10+PSA.83.11+PSA.83.12+PSA.83.13	Fel i Sisera, neu Jabin
PSA.83.9+PSA.83.10+PSA.83.11+PSA.83.12+PSA.83.13	Ar lan Cison dan ei glwy,
PSA.83.9+PSA.83.10+PSA.83.11+PSA.83.12+PSA.83.13	Neu i Fidian gynt yn Harod,
PSA.83.9+PSA.83.10+PSA.83.11+PSA.83.12+PSA.83.13	Gwna i’r rhain; gwna’u mawrion hwy
PSA.83.9+PSA.83.10+PSA.83.11+PSA.83.12+PSA.83.13	Megis Oreb, Seeb, Seba
PSA.83.9+PSA.83.10+PSA.83.11+PSA.83.12+PSA.83.13	A Salmuna. Mae pob un
PSA.83.9+PSA.83.10+PSA.83.11+PSA.83.12+PSA.83.13	Yn ymffrostio, “Fe feddiannwn
PSA.83.9+PSA.83.10+PSA.83.11+PSA.83.12+PSA.83.13	Diroedd Duw i ni ein hun”.
PSA.83.14+PSA.83.15+PSA.83.16+PSA.83.17+PSA.83.18	O fy Nuw, gwna hwy fel manus
PSA.83.14+PSA.83.15+PSA.83.16+PSA.83.17+PSA.83.18	O flaen gwynt. Ymlidia hwy
PSA.83.14+PSA.83.15+PSA.83.16+PSA.83.17+PSA.83.18	Megis tân yn llosgi coedwig,
PSA.83.14+PSA.83.15+PSA.83.16+PSA.83.17+PSA.83.18	A dwg arnynt warth byth mwy.
PSA.83.14+PSA.83.15+PSA.83.16+PSA.83.17+PSA.83.18	Gwna’u hwynebau’n llawn cywilydd,
PSA.83.14+PSA.83.15+PSA.83.16+PSA.83.17+PSA.83.18	Fel y ceisiant d’enw drud,
PSA.83.14+PSA.83.15+PSA.83.16+PSA.83.17+PSA.83.18	Ac y gwelant mai ti, Arglwydd,
PSA.83.14+PSA.83.15+PSA.83.16+PSA.83.17+PSA.83.18	Yw’r Goruchaf drwy’r holl fyd.
PSA.84.1+PSA.84.2	Dduw y Lluoedd, dy breswylfod,
PSA.84.1+PSA.84.2	O mor brydferth yw!
PSA.84.1+PSA.84.2	Rwy’n hiraethu hyd at ddarfod
PSA.84.1+PSA.84.2	Am gynteddau Duw.
PSA.84.1+PSA.84.2	Y mae’r cwbl ohonof fi
PSA.84.1+PSA.84.2	Yn gweiddi am yr Arglwydd byw.
PSA.84.3+PSA.84.4	Adar to, a’r wennol dirion
PSA.84.3+PSA.84.4	A gânt yno nyth;
PSA.84.3+PSA.84.4	Wrth d’allorau magant gywion.
PSA.84.3+PSA.84.4	Gwyn eu byd am byth
PSA.84.3+PSA.84.4	Bawb sy’n trigo yn dy dŷ,
PSA.84.3+PSA.84.4	Yn canu mawl i ti’n ddi-lyth.
PSA.84.5+PSA.84.6+PSA.84.7	Gwyn eu byd y pererinion;
PSA.84.5+PSA.84.6+PSA.84.7	Cedwi hwy rhag braw.
PSA.84.5+PSA.84.6+PSA.84.7	Fe gânt ddyffryn Baca’n ffynnon
PSA.84.5+PSA.84.6+PSA.84.7	Dan y cynnar law.
PSA.84.5+PSA.84.6+PSA.84.7	Ânt o nerth i nerth, nes dod
PSA.84.5+PSA.84.6+PSA.84.7	I wyddfod Duw yn Seion draw.
PSA.84.8+PSA.84.9+PSA.84.10	Arglwydd Dduw y Lluoedd, gwrando
PSA.84.8+PSA.84.9+PSA.84.10	Ar fy ngweddi i.
PSA.84.8+PSA.84.9+PSA.84.10	Edrych ar ein tarian; dyro
PSA.84.8+PSA.84.9+PSA.84.10	Ffafr i’n brenin ni.
PSA.84.8+PSA.84.9+PSA.84.10	Gwell na blwyddyn gartref fydd
PSA.84.8+PSA.84.9+PSA.84.10	Un dydd yn dy gynteddau di.
PSA.84.10+PSA.84.11+PSA.84.12	Gwell yw sefyll y tu allan
PSA.84.10+PSA.84.11+PSA.84.12	Yno na chael byw
PSA.84.10+PSA.84.11+PSA.84.12	Yn nhai’r drwg; cans haul a tharian
PSA.84.10+PSA.84.11+PSA.84.12	Yw yr Arglwydd Dduw.
PSA.84.10+PSA.84.11+PSA.84.12	Gwyn ei fyd y sawl y bo
PSA.84.10+PSA.84.11+PSA.84.12	Ei hyder ynddo; dedwydd yw.
PSA.85.1+PSA.85.2+PSA.85.3	O Arglwydd, buost wir
PSA.85.1+PSA.85.2+PSA.85.3	Drugarog wrth dy dir.
PSA.85.1+PSA.85.2+PSA.85.3	Adferaist ni, a maddau in ein camwedd,
PSA.85.1+PSA.85.2+PSA.85.3	Dileu’n pechodau i gyd,
PSA.85.1+PSA.85.2+PSA.85.3	A thynnu’n ôl dy lid,
PSA.85.1+PSA.85.2+PSA.85.3	A throi i ffwrdd oddi wrth dy fawr ddicllonedd.
PSA.85.4+PSA.85.5+PSA.85.6+PSA.85.7	Tyrd eto i’n hadfer ni.
PSA.85.4+PSA.85.5+PSA.85.6+PSA.85.7	Ai byth y byddi di
PSA.85.4+PSA.85.5+PSA.85.6+PSA.85.7	Yn ddicllon wrthym, Dduw ein hiachawdwriaeth?
PSA.85.4+PSA.85.5+PSA.85.6+PSA.85.7	Tyrd eto i’n bywhau,
PSA.85.4+PSA.85.5+PSA.85.6+PSA.85.7	Fel y cawn lawenhau
PSA.85.4+PSA.85.5+PSA.85.6+PSA.85.7	Yn dy ffyddlondeb mawr a’th waredigaeth.
PSA.85.8+PSA.85.9	Disgynned ar ein clyw
PSA.85.8+PSA.85.9	Yr hyn a ddywed Duw.
PSA.85.8+PSA.85.9	Cyhoedda hedd i’w bobl. Daw yn agos
PSA.85.8+PSA.85.9	Ei iachawdwriaeth gref
PSA.85.8+PSA.85.9	At bawb a’i hofna ef,
PSA.85.8+PSA.85.9	Fel bo’i ogoniant yn ein tir yn aros.
PSA.85.10+PSA.85.11+PSA.85.12+PSA.85.13	Fe fydd teyrngarwch Duw
PSA.85.10+PSA.85.11+PSA.85.12+PSA.85.13	A’i gariad yn cyd-fyw,
PSA.85.10+PSA.85.11+PSA.85.12+PSA.85.13	A’i heddwch a’i gyfiawnder yn cusanu;
PSA.85.10+PSA.85.11+PSA.85.12+PSA.85.13	Ffyddlondeb ym mhob tref,
PSA.85.10+PSA.85.11+PSA.85.12+PSA.85.13	Cyfiawnder lond y nef,
PSA.85.10+PSA.85.11+PSA.85.12+PSA.85.13	A Duw’n rhoi popeth da, a’n tir yn glasu.
PSA.86.1+PSA.86.2	Tro dy glust ataf, Arglwydd, dan fy ffawd,
PSA.86.1+PSA.86.2	Oherwydd rwy’n anghenus ac yn dlawd.
PSA.86.1+PSA.86.2	Arbed fy mywyd; teyrngar ydwyf fi,
PSA.86.1+PSA.86.2	Dy was, ac rwy’n ymddiried ynot ti.
PSA.86.3+PSA.86.4+PSA.86.5	Ti yw fy Nuw, O Arglwydd; trugarha,
PSA.86.3+PSA.86.4+PSA.86.5	Cans gwaeddaf arnat beunydd. Llawenha
PSA.86.3+PSA.86.4+PSA.86.5	Dy was, cans arnat y dibynnaf fi;
PSA.86.3+PSA.86.4+PSA.86.5	Da a maddeugar, Arglwydd, ydwyt ti.
PSA.86.6+PSA.86.7+PSA.86.8	Gwrando ar f’ymbil; fy ngweddïau clyw;
PSA.86.6+PSA.86.7+PSA.86.8	Yn nydd fy ing, atebi fi, O Dduw.
PSA.86.6+PSA.86.7+PSA.86.8	Does neb fel ti ymhlith y duwiau i gyd;
PSA.86.6+PSA.86.7+PSA.86.8	Unigryw dy weithredoedd drwy’r holl fyd.
PSA.86.9+PSA.86.10+PSA.86.11	Fe welir holl genhedloedd byd yn dod
PSA.86.9+PSA.86.10+PSA.86.11	I blygu o’th flaen, a rhoi i’th enw glod.
PSA.86.9+PSA.86.10+PSA.86.11	Cans rwyt ti’n fawr; gwnei ryfeddodau fyrdd.
PSA.86.9+PSA.86.10+PSA.86.11	Ti ydyw’r unig Dduw; dysg im dy ffyrdd.
PSA.86.11+PSA.86.12+PSA.86.13	Gad imi rodio yn dy wirionedd di;
PSA.86.11+PSA.86.12+PSA.86.13	I ofni d’enw tro fy nghalon i.
PSA.86.11+PSA.86.12+PSA.86.13	Clodforaf dy ffyddlondeb di-droi’n ôl.
PSA.86.11+PSA.86.12+PSA.86.13	Gwaredaist ti fy mywyd o Sheol.
PSA.86.14+PSA.86.15	Cododd, O Dduw, yn f’erbyn wŷr trahaus;
PSA.86.14+PSA.86.15	Bygythia criw didostur fi’n barhaus.
PSA.86.14+PSA.86.15	Ond d’anian di, gras a thrugaredd yw;
PSA.86.14+PSA.86.15	Llawn cariad a gwirionedd wyt, O Dduw.
PSA.86.16+PSA.86.17	Tro ataf, trugarha; rho nerth i’th was;
PSA.86.16+PSA.86.17	Rho imi arwydd o’th ddaioni a’th ras;
PSA.86.16+PSA.86.17	A chywilyddier pawb sy’n fy nghasáu
PSA.86.16+PSA.86.17	Am i ti, Dduw, fy helpu a’m hiacháu.
PSA.87.1+PSA.87.2+PSA.87.3	Ar fryniau sanctaidd y sylfaenodd hi,
PSA.87.1+PSA.87.2+PSA.87.3	Ac fe roes yr Arglwydd iddi fwy o fri
PSA.87.1+PSA.87.2+PSA.87.3	Na holl drefi Jacob. Gogoneddus yw
PSA.87.1+PSA.87.2+PSA.87.3	Pob rhyw sôn amdanat ti, O ddinas Duw.
PSA.87.1+PSA.87.2+PSA.87.3	Y Goruchaf Un sy’n ei sylfaenu hi.
PSA.87.4	Yr wyf yn enwi’r Aifft a Babilon
PSA.87.4	Ymhlith y cenhedloedd sy’n cydnabod hon;
PSA.87.4	Yn Philistia a Thyrus, Ethiopia i gyd,
PSA.87.4	Gwelir i blant Seion wasgar drwy’r holl fyd.
PSA.87.5	Yn Seion, dinas Duw, y’n ganwyd ni.
PSA.87.5	Y Goruchaf Un sy’n ei sylfaenu hi.
PSA.87.6+PSA.87.7	Wrth restru’r bobloedd, bydd yr Arglwydd Dduw
PSA.87.6+PSA.87.7	Yn cofnodi am lawer, “Un o Seion yw”.
PSA.87.6+PSA.87.7	Dawnswyr a chantorion, unant yn y gri:
PSA.87.6+PSA.87.7	“Mae ein holl darddiadau, Seion, ynot ti”.
PSA.87.6+PSA.87.7	Y Goruchaf Un sy’n ei sylfaenu hi.
PSA.88.1+PSA.88.2+PSA.88.3	Arglwydd, doed fy ngweddi brudd
PSA.88.1+PSA.88.2+PSA.88.3	Am dy gymorth nos a dydd
PSA.88.1+PSA.88.2+PSA.88.3	Atat ti. Yr wyf yn llawn
PSA.88.1+PSA.88.2+PSA.88.3	O helbulon dyrys iawn.
PSA.88.3+PSA.88.4+PSA.88.5	At Sheol yr wy’n nesáu;
PSA.88.3+PSA.88.4+PSA.88.5	Rwyf fel un sydd yn llesgáu,
PSA.88.3+PSA.88.4+PSA.88.5	Fel y meirw yn y bedd
PSA.88.3+PSA.88.4+PSA.88.5	Na chânt brofi dim o’th hedd.
PSA.88.6+PSA.88.7+PSA.88.8	Bwriaist fi i fannau llwm.
PSA.88.6+PSA.88.7+PSA.88.8	Daeth dy ddicter arna’ i’n drwm.
PSA.88.6+PSA.88.7+PSA.88.8	Gwnest i’m ffrindiau ymbellhau,
PSA.88.6+PSA.88.7+PSA.88.8	Fe’m caethiwaist a’m tristáu.
PSA.88.9+PSA.88.10	Pyla poen fy llygaid i.
PSA.88.9+PSA.88.10	Galwaf beunydd arnat ti.
PSA.88.9+PSA.88.10	A wnei di i’r meirwon mud
PSA.88.9+PSA.88.10	Rai o’th ryfeddodau drud?
PSA.88.11+PSA.88.12	A foliennir di, O Dduw,
PSA.88.11+PSA.88.12	Yn nhir Abadon? A yw
PSA.88.11+PSA.88.12	Yn wybyddus ddim o’th waith
PSA.88.11+PSA.88.12	Yn nhir ango’r caddug maith?
PSA.88.13+PSA.88.14+PSA.88.15	Llefaf am dy gymorth di;
PSA.88.13+PSA.88.14+PSA.88.15	Yn y bore clywi fi.
PSA.88.13+PSA.88.14+PSA.88.15	Pam fy ngwrthod i, O Dduw?
PSA.88.13+PSA.88.14+PSA.88.15	Rwyf ar drengi, a’m corff yn wyw.
PSA.88.15+PSA.88.16	Fe ddioddefais ddychrynfeydd
PSA.88.15+PSA.88.16	O’m hieuenctid; dy wasgfeydd
PSA.88.15+PSA.88.16	Sy’n fy nifa; drosof fi
PSA.88.15+PSA.88.16	Llifodd dy ddigofaint di.
PSA.88.17+PSA.88.18	Mae’n f’amgylchu megis lli,
PSA.88.17+PSA.88.18	Ac yn cau amdanaf fi;
PSA.88.17+PSA.88.18	Rwyf heb gyfaill yn y byd,
PSA.88.17+PSA.88.18	Cans dieithriaist hwy i gyd.
PSA.89.1+PSA.89.2	Datganaf byth dy gariad di,
PSA.89.1+PSA.89.2	A’n cynnal ni drwy’r oesoedd,
PSA.89.1+PSA.89.2	A’th faith ffyddlondeb, Arglwydd Dduw –
PSA.89.1+PSA.89.2	Mor sicr yw â’r nefoedd.
PSA.89.3+PSA.89.4	Dywedaist ti, “Cyfamod gras
PSA.89.3+PSA.89.4	A wneuthum â’m gwas Dafydd:
PSA.89.3+PSA.89.4	‘Mi sicrhaf dy had mewn hedd
PSA.89.3+PSA.89.4	A’th orsedd yn dragywydd’”.
PSA.89.5+PSA.89.6+PSA.89.7	Rhoed holl lu’r nef fawl iti’n awr
PSA.89.5+PSA.89.6+PSA.89.7	Am dy fawr ryfeddodau.
PSA.89.5+PSA.89.6+PSA.89.7	Pwy ond yr Arglwydd Dduw, yn wir,
PSA.89.5+PSA.89.6+PSA.89.7	A ofnir gan y duwiau?
PSA.89.8+PSA.89.9	O Arglwydd Dduw y lluoedd, pwy
PSA.89.8+PSA.89.9	Ohonynt hwy sydd cystal?
PSA.89.8+PSA.89.9	Ti sydd yn llywodraethu’r môr,
PSA.89.8+PSA.89.9	Yn chwyddo’r don a’i hatal.
PSA.89.10+PSA.89.11+PSA.89.12	Fe ddrylliaist dy elynion cas
PSA.89.10+PSA.89.11+PSA.89.12	A Rahab fras â’th fysedd.
PSA.89.10+PSA.89.11+PSA.89.12	Rhoist nef a daear yn eu lle,
PSA.89.10+PSA.89.11+PSA.89.12	A chreaist dde a gogledd.
PSA.89.12+PSA.89.13+PSA.89.14	O Dabor ac o Hermon daw
PSA.89.12+PSA.89.13+PSA.89.14	I’th nerthol law glodforedd.
PSA.89.12+PSA.89.13+PSA.89.14	Barn a chyfiawnder yw’r ddau faen
PSA.89.12+PSA.89.13+PSA.89.14	Sy’n ffurfio sylfaen d’orsedd.
PSA.89.14+PSA.89.15	Rhagflaenir di, O Arglwydd da,
PSA.89.14+PSA.89.15	Gan gariad a gwirionedd.
PSA.89.14+PSA.89.15	Gwyn fyd y rhai a ddaw mewn parch,
PSA.89.14+PSA.89.15	A’th gyfarch mewn gorfoledd.
PSA.89.15+PSA.89.16	Gwyn fyd y rhai sydd yn mwynhau
PSA.89.15+PSA.89.16	Dy ffafrau di bob amser,
PSA.89.15+PSA.89.16	Sy’n gorfoleddu yn d’enw di,
PSA.89.15+PSA.89.16	Yn ffoli ar dy gyfiawnder.
PSA.89.17+PSA.89.18	Cans ti yw ein gogoniant ni,
PSA.89.17+PSA.89.18	Fe beri i’n corn ddyrchafael.
PSA.89.17+PSA.89.18	Ein tarian ydyw’r Arglwydd Dduw,
PSA.89.17+PSA.89.18	Ein brenin yw Sanct Israel.
PSA.89.17+PSA.89.18	Hysbysaist dy ffyddloniaid gynt,
PSA.89.17+PSA.89.18	Rhoist iddynt weledigaeth:
PSA.89.19	“O blith y bobl coronais lanc,
PSA.89.19	Gŵr ifanc grymus odiaeth.
PSA.89.20+PSA.89.21+PSA.89.22	Eneiniais Ddafydd, fy ngwas glew,
PSA.89.20+PSA.89.21+PSA.89.22	Â’m holew sanctaidd. Iddo
PSA.89.20+PSA.89.21+PSA.89.22	Mi rof fy nerth a’m cryfder i,
PSA.89.20+PSA.89.21+PSA.89.22	Ac ni chaiff neb ei goncro.
PSA.89.23+PSA.89.24	Nis trecha’r gelyn yn y gad.
PSA.89.23+PSA.89.24	Fy nghariad a’m ffyddlondeb
PSA.89.23+PSA.89.24	Fydd gydag ef. Yn f’enw bydd
PSA.89.23+PSA.89.24	Ysblennydd ei ddisgleirdeb.
PSA.89.25+PSA.89.26	Dros yr afonydd oll a’r môr
PSA.89.25+PSA.89.26	Rhof iddo’r fuddugoliaeth;
PSA.89.25+PSA.89.26	A dywed ef, ‘Fy nhad, ti yw
PSA.89.25+PSA.89.26	Fy Nuw a’m hiachawdwriaeth’.
PSA.89.27+PSA.89.28	Yn brif etifedd mi a’i gwnaf,
PSA.89.27+PSA.89.28	Yr uchaf o’r brenhinoedd.
PSA.89.27+PSA.89.28	Deil fy nghyfamod yn ddi-wad
PSA.89.27+PSA.89.28	A’m cariad yn oes oesoedd.
PSA.89.29+PSA.89.30+PSA.89.31+PSA.89.32	Fe bery’i orsedd byth; ei blant,
PSA.89.29+PSA.89.30+PSA.89.31+PSA.89.32	Os llygrant f’ordeiniadau,
PSA.89.29+PSA.89.30+PSA.89.31+PSA.89.32	Neu dorri fy ngorchmynion da,
PSA.89.29+PSA.89.30+PSA.89.31+PSA.89.32	A gosbaf â fflangellau.
PSA.89.33+PSA.89.34	Ond deil fy nghariad, er pob gwall;
PSA.89.33+PSA.89.34	Di-ball fydd fy ffyddlondeb.
PSA.89.33+PSA.89.34	Ni wadaf ddim a draethais i,
PSA.89.33+PSA.89.34	Na thorri fy nghytundeb.
PSA.89.35+PSA.89.36+PSA.89.37	Mi dyngais i’m sancteiddrwydd lw
PSA.89.35+PSA.89.36+PSA.89.37	I’w gadw byth â Dafydd
PSA.89.35+PSA.89.36+PSA.89.37	Y pery ei had a’i orsedd ef
PSA.89.35+PSA.89.36+PSA.89.37	Cyhyd â’r nef dragywydd.”
PSA.89.38+PSA.89.39	Ond eto, fe droist heibio fri
PSA.89.38+PSA.89.39	D’eneiniog di, a’i wrthod,
PSA.89.38+PSA.89.39	A thaflu i’r llawr ei goron bur,
PSA.89.38+PSA.89.39	Diddymu’r hen gyfamod.
PSA.89.40+PSA.89.41	Mae’i furiau yn furddunod prudd,
PSA.89.40+PSA.89.41	A’i geyrydd yn adfeilion;
PSA.89.40+PSA.89.41	Ysbeilir ef gan bawb yn ffri;
PSA.89.40+PSA.89.41	Mae’n destun sbri cymdogion.
PSA.89.42+PSA.89.43	Ei wrthwynebwyr nawr sydd ben,
PSA.89.42+PSA.89.43	A llawen ei elynion.
PSA.89.42+PSA.89.43	Fe bylaist fin ac awch ei gledd
PSA.89.42+PSA.89.43	A gomedd dy gynghorion.
PSA.89.44+PSA.89.45	Fe fwriaist orsedd hwn i’r llawr,
PSA.89.44+PSA.89.45	A dryllio o’i law’r deyrnwialen,
PSA.89.44+PSA.89.45	Byrhau’i ieuenctid, a rhoi tost
PSA.89.44+PSA.89.45	Gywilydd drosto’n gaenen.
PSA.89.46+PSA.89.47+PSA.89.48	Ai byth, O Dduw, y cuddi di?
PSA.89.46+PSA.89.47+PSA.89.48	Ond cofia fi, sy’n feidrol.
PSA.89.46+PSA.89.47+PSA.89.48	Pa ddyn fydd byw heb weld ei dranc?
PSA.89.46+PSA.89.47+PSA.89.48	A ddianc neb rhag Sheol?
PSA.89.49+PSA.89.50	O Dduw, ple mae dy gariad di,
PSA.89.49+PSA.89.50	A dyngaist gynt i Ddafydd?
PSA.89.49+PSA.89.50	Gwêl fel yr wyf yn dwyn ar goedd
PSA.89.49+PSA.89.50	Sarhad y bobloedd beunydd.
PSA.89.51+PSA.89.52	Er bod d’eneiniog di a’i ffawd
PSA.89.51+PSA.89.52	Yn wrthrych gwawd a chrechwen,
PSA.89.51+PSA.89.52	Bendigaid fyddi, Dduw di-lyth,
PSA.89.51+PSA.89.52	Am byth. Amen ac Amen.
PSA.90.1+PSA.90.2	Arglwydd, buost noddfa inni
PSA.90.1+PSA.90.2	Drwy y cenedlaethau i gyd.
PSA.90.1+PSA.90.2	Ers cyn geni y mynyddoedd
PSA.90.1+PSA.90.2	A chyn esgor ar y byd,
PSA.90.1+PSA.90.2	Ti sydd Dduw o dragwyddoldeb
PSA.90.1+PSA.90.2	Hyd at dragwyddoldeb mud.
PSA.90.3+PSA.90.4+PSA.90.5+PSA.90.6	Fe wnei’n llwch yr holl ddynolryw.
PSA.90.3+PSA.90.4+PSA.90.5+PSA.90.6	Mil blynyddoedd, Arglwydd mawr,
PSA.90.3+PSA.90.4+PSA.90.5+PSA.90.6	Sydd i ti fel doe a ddarfu,
PSA.90.3+PSA.90.4+PSA.90.5+PSA.90.6	Ac fel cysgu tan y wawr.
PSA.90.3+PSA.90.4+PSA.90.5+PSA.90.6	Sgubi hwy i ffwrdd fel breuddwyd,
PSA.90.3+PSA.90.4+PSA.90.5+PSA.90.6	Neu fel crinwellt oddi ar lawr.
PSA.90.7+PSA.90.8+PSA.90.9	Fe ddarfyddwn gan dy ddicter,
PSA.90.7+PSA.90.8+PSA.90.9	A’n brawychu gan dy lid.
PSA.90.7+PSA.90.8+PSA.90.9	Dodaist yng ngoleuni d’wyneb
PSA.90.7+PSA.90.8+PSA.90.9	Ein pechodau cudd i gyd.
PSA.90.7+PSA.90.8+PSA.90.9	Derfydd fel ochenaid egwan
PSA.90.7+PSA.90.8+PSA.90.9	Ein blynyddoedd yn y byd.
PSA.90.10+PSA.90.11+PSA.90.12	Hyd ein hoes yw saith deng mlynedd –
PSA.90.10+PSA.90.11+PSA.90.12	Wyth deg, hwyrach – ond mae’u hyd
PSA.90.10+PSA.90.11+PSA.90.12	Yn llawn blinder, ac ânt heibio.
PSA.90.10+PSA.90.11+PSA.90.12	Pwy, fel ni, a ŵyr dy lid?
PSA.90.10+PSA.90.11+PSA.90.12	Dysg ni, felly, i gyfri’n dyddiau,
PSA.90.10+PSA.90.11+PSA.90.12	Inni fod yn ddoeth ein bryd.
PSA.90.13+PSA.90.14+PSA.90.15	Am ba hyd? O Arglwydd, dychwel
PSA.90.13+PSA.90.14+PSA.90.15	At dy bobl, a thrugarhau,
PSA.90.13+PSA.90.14+PSA.90.15	A’n digoni ni â’th gariad
PSA.90.13+PSA.90.14+PSA.90.15	Nes cawn eto lawenhau.
PSA.90.13+PSA.90.14+PSA.90.15	Rho in flwyddyn o lawenydd
PSA.90.13+PSA.90.14+PSA.90.15	Am bob blwyddyn o’n tristáu.
PSA.90.16+PSA.90.17	Boed yn amlwg iawn i’th weision
PSA.90.16+PSA.90.17	Dy weithredoedd mawr a’th fri.
PSA.90.16+PSA.90.17	Arglwydd Dduw, disgynned arnom
PSA.90.16+PSA.90.17	Dy raslonrwydd hyfryd di.
PSA.90.16+PSA.90.17	Llwydda waith ein dwylo inni,
PSA.90.16+PSA.90.17	Llwydda waith ein dwylo ni.
PSA.91.1+PSA.91.2+PSA.91.3	Mae’r sawl sy’n byw yn lloches
PSA.91.1+PSA.91.2+PSA.91.3	Yr Hollalluog Dduw
PSA.91.1+PSA.91.2+PSA.91.3	Yn dwedyd am yr Arglwydd,
PSA.91.1+PSA.91.2+PSA.91.3	“Fy nghaer a’m noddfa yw;
PSA.91.1+PSA.91.2+PSA.91.3	Mi ymddiriedaf ynddo”.
PSA.91.1+PSA.91.2+PSA.91.3	Cans dy waredu a wna
PSA.91.1+PSA.91.2+PSA.91.3	O fagl gudd yr heliwr,
PSA.91.1+PSA.91.2+PSA.91.3	Rhag dinistr a rhag pla.
PSA.91.4+PSA.91.5+PSA.91.6	Bydd cysgod ei adenydd
PSA.91.4+PSA.91.5+PSA.91.6	I ti yn nodded dlos.
PSA.91.4+PSA.91.5+PSA.91.6	Cei darian ei wirionedd.
PSA.91.4+PSA.91.5+PSA.91.6	Nid ofni ddychryn nos,
PSA.91.4+PSA.91.5+PSA.91.6	Na’r saeth sydd yn ehedeg
PSA.91.4+PSA.91.5+PSA.91.6	Liw dydd, na’r heintiau sydd
PSA.91.4+PSA.91.5+PSA.91.6	Yn cerdded drwy’r tywyllwch,
PSA.91.4+PSA.91.5+PSA.91.6	Na dinistr ganol dydd.
PSA.91.7+PSA.91.8+PSA.91.9+PSA.91.10	Pe syrthiai mil wrth d’ochor,
PSA.91.7+PSA.91.8+PSA.91.9+PSA.91.10	Deng mil ar dy law dde,
PSA.91.7+PSA.91.8+PSA.91.9+PSA.91.10	Diogel fyddi, a gweli
PSA.91.7+PSA.91.8+PSA.91.9+PSA.91.10	Roi’r anfad yn eu lle.
PSA.91.7+PSA.91.8+PSA.91.9+PSA.91.10	Bydd Duw i ti yn noddfa,
PSA.91.7+PSA.91.8+PSA.91.9+PSA.91.10	Yn amddiffynfa gref.
PSA.91.7+PSA.91.8+PSA.91.9+PSA.91.10	Ni ddigwydd niwed iti,
PSA.91.7+PSA.91.8+PSA.91.9+PSA.91.10	Ac ni ddaw pla i’th dref.
PSA.91.11+PSA.91.12+PSA.91.13	Gorchmynna i’w angylion
PSA.91.11+PSA.91.12+PSA.91.13	Dy gadw yn dy ffyrdd.
PSA.91.11+PSA.91.12+PSA.91.13	Rhag taro o’th droed wrth garreg,
PSA.91.11+PSA.91.12+PSA.91.13	A rhag trallodion fyrdd,
PSA.91.11+PSA.91.12+PSA.91.13	Fe’th godant ar eu dwylo;
PSA.91.11+PSA.91.12+PSA.91.13	A throedio a wnei yn lew
PSA.91.11+PSA.91.12+PSA.91.13	Ar lewod ac ar nadroedd,
PSA.91.11+PSA.91.12+PSA.91.13	Y sarff a chenau’r llew.
PSA.91.14+PSA.91.15+PSA.91.16	“Am iddo lynu wrthyf,
PSA.91.14+PSA.91.15+PSA.91.16	Gwaredaf ef,” medd Duw.
PSA.91.14+PSA.91.15+PSA.91.16	“Am iddo fy adnabod,
PSA.91.14+PSA.91.15+PSA.91.16	Fe’i cadwaf tra bo byw.
PSA.91.14+PSA.91.15+PSA.91.16	Dof ato mewn cyfyngder,
PSA.91.14+PSA.91.15+PSA.91.16	Ac fe’i digonaf ef
PSA.91.14+PSA.91.15+PSA.91.16	Ag einioes hir i flasu
PSA.91.14+PSA.91.15+PSA.91.16	Fy iachawdwriaeth gref.”
PSA.92.1+PSA.92.2	Da yw dy foli, Arglwydd Dduw,
PSA.92.1+PSA.92.2	A chanu i’th enw, gweddus yw:
PSA.92.1+PSA.92.2	Sôn am dy gariad gyda’r wawr,
PSA.92.1+PSA.92.2	A’r nos am dy ffyddlondeb mawr.
PSA.92.3+PSA.92.4+PSA.92.5	Â’r delyn fwyn a’i thannau mân,
PSA.92.3+PSA.92.4+PSA.92.5	Ar gordiau’r dectant, seiniwn gân.
PSA.92.3+PSA.92.4+PSA.92.5	Cans gwaith dy ddwylo a’m llonnodd i;
PSA.92.3+PSA.92.4+PSA.92.5	Mor ddwfn yw dy feddyliau di!
PSA.92.6+PSA.92.7+PSA.92.8	Un ynfyd yw y sawl na ŵyr
PSA.92.6+PSA.92.7+PSA.92.8	Y caiff y drwg eu difa’n llwyr;
PSA.92.6+PSA.92.7+PSA.92.8	Dinistrir hwy, er maint eu bri,
PSA.92.6+PSA.92.7+PSA.92.8	Ond dyrchafedig byth wyt ti.
PSA.92.9+PSA.92.10+PSA.92.11	Difethir dy elynion di,
PSA.92.9+PSA.92.10+PSA.92.11	Ac yn eu cwymp fe’m llonnir i.
PSA.92.9+PSA.92.10+PSA.92.11	Eneiniaist fi ag olew gwych
PSA.92.9+PSA.92.10+PSA.92.11	A chodi ’nghorn fel corn yr ych.
PSA.92.12+PSA.92.13	Blodeua’r da fel palmwydd ir,
PSA.92.12+PSA.92.13	Fel cedrwydd Lebanon, drwy’r tir.
PSA.92.12+PSA.92.13	Yn nhŷ yr Arglwydd maent yn byw;
PSA.92.12+PSA.92.13	Blodeuant yng nghynteddau’n Duw.
PSA.92.14+PSA.92.15	Parhant i ffrwytho hyd yn oed
PSA.92.14+PSA.92.15	Mewn henaint, wyrdd ac iraidd goed,
PSA.92.14+PSA.92.15	I ddweud nad oes camwri yn Nuw:
PSA.92.14+PSA.92.15	Ef yw fy nghraig, ac uniawn yw.
PSA.93.1+PSA.93.2	Y mae yr Arglwydd Dduw
PSA.93.1+PSA.93.2	Yn frenin; mawredd yw
PSA.93.1+PSA.93.2	Ei wisg, ac y mae cryfder iddo’n wregys.
PSA.93.1+PSA.93.2	Di-syfl, yn wir, yw’r byd,
PSA.93.1+PSA.93.2	A’th orsedd di o hyd;
PSA.93.1+PSA.93.2	Yr wyt er tragwyddoldeb yn Dduw grymus.
PSA.93.3+PSA.93.4+PSA.93.5	Fe gododd dyfroedd lu
PSA.93.3+PSA.93.4+PSA.93.5	A thonnau’r môr eu rhu,
PSA.93.3+PSA.93.4+PSA.93.5	Ond cryfach ydyw Duw na’u holl enbydrwydd.
PSA.93.3+PSA.93.4+PSA.93.5	Mi wn mai sicr yw
PSA.93.3+PSA.93.4+PSA.93.5	Holl dystiolaethau Duw;
PSA.93.3+PSA.93.4+PSA.93.5	Sancteiddrwydd byth sy’n gweddu i’th dŷ, O Arglwydd.
PSA.94.1+PSA.94.2+PSA.94.3+PSA.94.4	O dial, Arglwydd Dduw, ti farnwr byd,
PSA.94.1+PSA.94.2+PSA.94.3+PSA.94.4	Rho’u haeddiant i’r rhai beilchion. Am ba hyd
PSA.94.1+PSA.94.2+PSA.94.3+PSA.94.4	Y caiff y drwg, â’u parabl trahaus,
PSA.94.1+PSA.94.2+PSA.94.3+PSA.94.4	Barhau i ymfalchïo mor sarhaus?
PSA.94.5+PSA.94.6+PSA.94.7	Y maent yn sigo d’etifeddiaeth di,
PSA.94.5+PSA.94.6+PSA.94.7	Yn lladd ein gweddwon a’n hamddifaid ni.
PSA.94.5+PSA.94.6+PSA.94.7	Llofruddiant yr estroniaid yn ein plith,
PSA.94.5+PSA.94.6+PSA.94.7	Cans dweud y maent, “Ni sylwa’r Arglwydd byth”.
PSA.94.8+PSA.94.9+PSA.94.10+PSA.94.11	Deallwch hyn, chwi ffyliaid: Oni chlyw
PSA.94.8+PSA.94.9+PSA.94.10+PSA.94.11	Yr un a blannodd glust, ac onid yw
PSA.94.8+PSA.94.9+PSA.94.10+PSA.94.11	Lluniwr pob llygad yn gweld drosto’i hun?
PSA.94.8+PSA.94.9+PSA.94.10+PSA.94.11	Fe ŵyr yr Arglwydd holl feddyliau dyn.
PSA.94.12+PSA.94.13+PSA.94.14+PSA.94.15	Gwyn fyd y sawl y dysgi iddo, O Dduw,
PSA.94.12+PSA.94.13+PSA.94.14+PSA.94.15	Dy gyfraith, a’i ddisgyblu. Diogel yw
PSA.94.12+PSA.94.13+PSA.94.14+PSA.94.15	Rhag ing. Caiff eto d’etifeddiaeth di
