MAT.1.1	LLyver 
1PE.3.20	Gynt yn anvfydd hwynt, pan vnwaith y ðoeð hir ymynedd Dyw yn discwyl yn‐dyddiay Noe, pan ddarparheid yr arch, yn yr hon ychydig
1PE.3.21	Ir rrwn y may yr 
1PE.3.22	Rrwn sydd ar y llaw ddeau 
1PE.4.1	AM hynny can ddioddef o Christ trosomni yn y cnawd, chwithe hevyd arf
1PE.4.2	Ir mwyn hyn na bo iddo o hyn allan (tros yr hyn sy yngweddill or amser yn y cnawd) fyw ar ol trachwantay dynion, eithr ar ol wollys Dyw.
1PE.4.3	Cans digon ydyw y ni dreulio o honom yr amser aeth heibio or enioes, ar ol trachwāt y cenhedloeð, yn rrodio mewn drythyllwch, trachwantay, meddtod, glothineb, 
1PE.4.4	Achos pam may yn chwith canthunt, na byddech yn cydredec gidagwynt, ir vnrryw 
1PE.4.5	Rrain y bydd rraid vddynt roy cyfri ir neb, sy barawd y farnu y byw ar meirw.
1PE.4.6	Cans ir mwyn hynny y pregethwyd yr evengil ir meirw hevyd, mal y gellid y cyfyrgolli hwynt, ar rann dynion, yn y cnawd, eithyr y gellynt fyw ar rann Ddyw yn yr ysbryd.
1PE.4.6	Yr Epistol ar y sul gwedy yr Derchavael.
1PE.4.7	Diwedd pob peth sy yn agosau. Am hynny bydwch gymesurol, a deffroedic y weddiaw.
1PE.4.8	Ymlaen pob peth bid cariad twym
1PE.4.9	Lledteywch bawb y gilidd, yn ddi 
1PE.4.10	Pawb megis ac y cafas rodd, byddet iddo eu chyfrannu ay gilidd, mal dayonys stiwardiaid am ryw ras Dyw,
1PE.4.11	Os 
1PE.4.12	Caredigion, na fid chwith cenych y praw sy arnoch trwy dan, rrwn a wneid ir profedigaeth ywch, val pe digwydday ywch ryw beth dierth:
1PE.4.13	Eithr llawenhewch, can ych bod chwi yn gyfrannoc ar 
1PE.4.14	Os 
1PE.4.15	Eithr na fid i neb o honoch oddef 
1PE.4.16	Eithr 
1PE.4.17	Can ys yr amser a ddoeth, y bydd rraid ir farn ddechre 
1PE.4.18	Ac os prin
1PE.4.19	Ac am hynny gwnaed y rrai sy yn goddef ar ol wollys Dyw, ymroi 
1PE.5.1	IR 
1PE.5.2	Porthwch 
1PE.5.3	Nid fal rrai a fynnon vod yn arglwyði ar tretad 
1PE.5.4	A’ phan ir ymddangoso y pen bigael, cael a wnewch goron ddilwgr y gogoniant.
1PE.5.4	Yr Epistol y iij. Sul gwedy Trintot.
1PE.5.5	Yr vn ffunyt yr 
1PE.5.6	Ymostyngwch achos hyn tann al’uoc law Dyw, mal y gallo ych dyrchafu 
1PE.5.7	Cwbl och gofal bwriwch arno ef: can ys ef ’sy yn gofalu trosoch
1PE.5.8	Byddwch sobr a’ gwiliwch, can ys ych gwrthnebwr diawl megis llew rruadus sy yn rrodio o ddamgylch, yn ceisio neb a allo y lyncu:
1PE.5.9	Rrwn 
1PE.5.10	A Dyw 
1PE.5.11	Iðo efe y 
1PE.5.12	Cyd a Sylvanus brawd ffyddlon ywch, im tyb i, y ddysc crifenais ar ychydic, dan ych cynghori, a thystlauthu mayr gwir ras Dyw ydiw hwn, y ddych yn sevyll yntho,
1PE.5.13	Mae yr eglwys sy yn Babylon cydetholedi a chwi, yn 
1PE.5.14	Anherchwch bawb y gilidd a chusan cariad. Tengnhefeð ywch oll 
2PE.1.1	SYm
2PE.1.2	Gras ywch, a’ thengnheveð a amylhaer, trwy ednabyddiaeth Dyw ac Iesu eyn arglwydd,
2PE.1.3	Megis y rroddes y ddywiol allu ef i ni bob peth 
2PE.1.4	Gan hyn, 
2PE.1.5	Ac ar hyn dodwch gwbl och diwydrwydd: cysylltwch gidach ffydd rinwedd: a’ chida rrinwedd, gwybodaeth:
2PE.1.6	A chida gwybodaeth, cymhedrolder: a chyda chymhedrolder, 
2PE.1.7	A chida gwaredd, credigrwydd broduraidd: a chyda chredigrwydd broduraidd, cariad.
2PE.1.8	Can ys os byddwchwi ar pethau hyn cennwch, ac yn amyl hwynt, peri a wnant na boch na segur na diffrwyth yngwybodaeth eyn Arglwydd Iesu Christ.
2PE.1.9	O blegid neb ni bo rrain cantho, dall ydiw ac ni wyl ddim o bell, yn gollwng tros go eu 
2PE.1.10	Or achos hwn, 
2PE.1.11	Can ys yn y modd hwn digonawl 
2PE.1.12	Or achos hwn, nid esceuleusaf i ych coffhau chwi fyth am y pethau hyn, cyd bochi cyfarwydd, a’ siccir yn y cyndrychol wirionedd.
2PE.1.13	Can ys tybiaid y rwy fod yn iawn i mi, tra fwy yn y tabernacl hwn, ych cyffroi trwy ddwyn ar gof ywch.
2PE.1.14	Can y mod i yn gwybod fod yn gyfagos yr amser y dodaf heibio y tabernacl hwn, megis ac y dangoses eyn 
2PE.1.15	Diwid fydda hevyd ar vod ywch allu gwneuthr coffa am y pethau hyn, gwedi vy ymadawiad i
2PE.1.16	Can ys nid chwedlay dichellus a ganlynhasom ni pan oeddem yn manegi ywch rinwedd, a devodiad ein 
2PE.1.17	Can ys ef a 
2PE.1.18	A’r llef hon a glowsom ni pan ddoeth or nef, a ni gidac ef yn y mynydd santaidd.
2PE.1.19	Y ddym 
2PE.1.20	Os bydd i chwi ar wybod hyn yn gynta, na does vn proffedoliaeth yn yr scrythyr ac iddi 
2PE.1.21	Can ys nid trwy wollys dyn y doeth gynt proffedoliaeth: eithr dynion santaidd Dyw a ddoydasont megis y cynhyrchwyd hwynt can yr ysbryd glan.
2PE.2.1	EIthr 
2PE.2.2	A’ llawer a canlynant y 
2PE.2.3	A’ thrwy cybyddtra ac wrth airieu gwneuthyr y marsiandiant am danoch, barnedigaeth yr hain ir ystalm 
2PE.2.4	Can ys onid arbedodd Dyw yr angylion, abechasent, eithr y taflu i wared i vffern ay dodi mewn cadwynay towyllwc, yw cadw i cyfyrgolledigaeth:
2PE.2.5	Ac nid arbedodd yr hen fyd, eithr Noe yr wythfed 
2PE.2.6	Ac a droes dinasodd Sodoma a Gomorrha yn 
2PE.2.7	Ac a 
2PE.2.8	(Can ys 
2PE.2.9	Yr Arglwydd a wyr 
2PE.2.10	Ac yn bēnaf y rrai sy yn rrodio ar ol y cnawd, mewn trachwant 
2PE.2.11	Kyd byddynt yr angylion sy fwy mewn cadernid a’ gallu, heb ddodi 
2PE.2.12	Eithyr y rrain megis enifeiliaid anrrysymol, rrain a ymborthir hwynt drwy anianol ymgyrch a wnaythbwyd yw dala, ac yw difa, a ’oganant y pethau ni wyddont o iwrthynt, ac yw dihenydd y deuant trwy y llygredigaeth y hunain.
2PE.2.13	Rrain a 
2PE.2.14	A llygaid canthynt yn llawn godineb, nis gallont chwaith beidiaw a phechod, yn 
2PE.2.15	Rrain wedi ymadael ar ffordd 
2PE.2.16	Eithr ef a geryddwyd am y gamwedd, can ys yr assen 
2PE.2.17	Yr hain ffynnonnay ydynt heb ddyfr, 
2PE.2.18	Cans o ddoydet chwyddedic eiriau gorwageð, trwy trachwātay, a thrythyllwch y cnawd, abwydo, a wnant yr rai a ddianghesay yn ’lan oðiwrth y rrai a ymdroysynt mewn crwydr,
2PE.2.19	Gan addaw yddynt rrydit, ac wynt y hunain yn wasanaethwyr llwgr
2PE.2.20	O blegit os wedi eu diainc o iwrth hal ogredigrwyð y byd, trwy ednabyðiaeth ein 
2PE.2.21	Can ys gwell fiase vddynt, na wybesynt fforð y cyfiownder, na chwedi y gwybod, cilio o iwrth y gorchymyn santeidd a rodded vddynt.
2PE.2.22	Eithr vddyntwy y digwyddodd, 
2PE.3.1	YR ail epistol hon y ddwyf yn awr yn y escrivennu attoch, 
2PE.3.2	Mal y bo cofus cenych y geiriau, a racddoydasont y prophwydi santaidd, an gorchymyn ninau rrain ydym abostolion yr Arglwydd an 
2PE.3.3	Yn gynta dyellwch hyn, i deuant yn y dyddiau diwaytha, watwotwyr, 
2PE.3.4	Ac a ddoydant, Ple may addewid y ddefodiad ef? canys ir pen fu farw y taday, pob peth sy yn perhau yr vn ffunyt o ddechreuad y creaduriaeth.
2PE.3.5	Canys hyn 
2PE.3.6	Achos pam y byd rhwn ydoeð hynny o amser, a gyfyrgollwyd, trwy ddwfyr diliw.
2PE.3.7	Eithr y nefoedd ar ddayar, y sydd yr awr honn, trwyr vn gair y maynt wedi y rroi y gadw, i daan erbyn dydd y farn, a’ difa yr enwir ddynion.
2PE.3.8	Yr vn peth hynn, 
2PE.3.9	Nid ydiw yr Arglwydd yn 
2PE.3.10	Eithyr dydd yr Arglwydd, megis lleidyr y nos y daw, yn yr hwn y ra heibio y nefoedd mewn trwst, a’r 
2PE.3.11	A chan vot yn rraid y hynn 
2PE.3.12	Yn discwyl, ac yn brysio at ðefodiad dyð Dyw, yn yr hwn i llysc y nefoedd, ac ir ymollwng, ar 
2PE.3.13	Eithr y ddym 
2PE.3.14	Am hynny, 
2PE.3.15	Ac am hir ymynedd eyn 
2PE.3.16	Megis 
2PE.3.17	Chwichwi am hynny 
2PE.3.18	Eithr cynyddwch mewn gras, ac ednabyddieth eyn Arglwyð 
1JN.1.1	YR hyn oeð or dechre, yr hynn a glywsam, yr hyn a welsam a’n llygait, yr hyn a edrychasam arnaw, ac a a deimlodd ein dwylaw o ’air y bywyt,
1JN.1.2	(Can ys y bywyt a ymddangosodd, ac 
1JN.1.3	Yr hyn, 
1JN.1.4	Ar petheu hyn a scrivenwn atoch, val y bo eich llawenydd yn 
1JN.1.5	Hyn yw’r genadwri a glywsam canthaw 
1JN.1.6	A’s dywedwn vot y ni gymdeithas ac ef, a rrodio yn y tywyllw
1JN.1.7	Eithyr as rrodiwn yn y golunni, megis y mae ef yn y golauni, y mae y ni gymdeithas au gylydd, a’ gwaet Iesu Christ ys ydd in 
1JN.1.8	A’s dywedwn nad oes 
1JN.1.9	A’s 
1JN.1.10	A’s dywedwn na phechasam, ydd ym yn y wneuthur ef yn gelwyddoc, a’i ’air nyd yw ynom.
1JN.2.1	VY 
1JN.2.2	Ac efe yw’r 
1JN.2.3	Ac wrth hyn y gwyddam yr adwaenam ef, a’
1JN.2.4	Yr hwn a ddywait, 
1JN.2.5	Eithr hwn a gaidw y ’air ef, yn wir yn hwn
1JN.2.6	Yr hwn a ddywait y vot yn aros yntho 
1JN.2.7	Vrodyr, nyd wyf yn yscrivenu 
1JN.2.8	Trachefn, gorchymyn newydd ydd wyf yn eiscrivenu atoch, yr hyn ’sy yn wir yntho 
1JN.2.9	Yr hwn a ðywait y vot yn y golauni, ac yn casau eu vrawt, yn y tywyllwc
1JN.2.10	Yr hwn a gar ei vrawt, ys y yn aros yn y golauni, ac nyd oes 
1JN.2.11	Eithyr hwn a gasao ey vrawt, yn y tywyllwc
1JN.2.13	Scrivennu ydd wyf atoch, dadeu, can y chwi adnabot yr hwn ys ydd or dechreu
1JN.2.14	Scrivenny ydd wyf ato‐chwi, 
1JN.2.15	Na charwch y byt, na’r petheu ys ydd yn y byt. A char nep y byt, nyt yw cariat y Tat ynthaw.
1JN.2.16	Can ys pob peth ys ydd yn y byt (
1JN.2.17	A’r byt ys ydd yn mynet heibio, ay chwant 
1JN.2.19	O 
1JN.2.20	Eithr y mae 
1JN.2.21	Nyd escrivennais atoch’, o bleit na wyddoch y gwirionedd: eithyr am y chwi ei 
1JN.2.22	Pwy 
1JN.2.23	Pwy pynac a wad y Map, nyd yw y Tat gan hwnw chwaith.
1JN.2.25	A’ hwn yw’r 
1JN.2.26	Y petheu hyn a scrivenais atoch, erwydd yr ei ’sy ich twyllo.
1JN.2.27	Eithyr yr 
1JN.2.28	Ac yr owrhon blant‐bychain, aro
1JN.2.29	A’s gwyddoch y vot ef yn gyfiawn, gwybyddwch may pwy pynac a wna gyfiawnder y anet o honaw 
1JN.3.1	GWelwch, pa’r y gariat a 
1JN.3.3	A’ phop vn ’sy ganthaw y gobaith hyn yntho 
1JN.3.4	Pwy pynac a wna bechot, y mae ef hefyt y 
1JN.3.5	A’ gwyddoch may ymddangos a wnaeth ef er 
1JN.3.6	Pwy pynac ’sy ’n aros yntho 
1JN.3.7	Blant bechain, na thwyllet nep chwi: yr hwn a wna gyfiawnder, ys y gyfiawn, megis y mae 
1JN.3.8	Hwn a wna bechot, o dðiavol y mae: can ys diavol a becha or dechreu: 
1JN.3.9	Pop vn a anet o Ddew, ny phecha: can ys y had ef ys ydd yn aros ynthaw, ac ny all ef bechu, can y eni ef o Dduw.
1JN.3.11	Can ys hyn yw’r genadwri, a glywsoch or dechreu
1JN.3.12	Ny
1JN.3.12	Yr Epistol yr ij. Sul gwedy yr Trintot.
1JN.3.13	Na ryveddwch, vy‐broder, cyd casao y byt chwi.
1JN.3.15	Pwy pynac a gasao ei vrawt, 
1JN.3.16	Wrth hyn y 
1JN.3.17	A’phwy pynac ysy ganthaw 
1JN.3.18	Vy plant‐bychain, na charwn 
1JN.3.19	Ac wrth hyny y gwyddam ein bot or gwirionedd, ac y bydd y ni ger y vron ef 
1JN.3.20	Can ys a’s ein caloneu a’n 
1JN.3.21	Caredigion, a’s ein calon ni’n condemna, 
1JN.3.22	A’ pha beth bynac a 
1JN.3.23	Hwn gan hyny yw y ’orchymyn ef, vot y ni gredu yn Enw ei Vap Iesu Christ, a’ charu eu gylyð, mal y rroes ef ’orchymyn.
1JN.3.24	Can ys yr hwn a gaidw y ’orchymynion ef, a drig ynto 
1JN.4.1	CAredigion, na chredwch bop yspryt, eithr 
1JN.4.2	Wrth hyn yr adwaynwch Yspryt Dew: pop yspryt 
1JN.4.3	A’ phop yspryt ny choffessa ddyvot Iesu Christ yn‐cnawt, nyd yw 
1JN.4.4	Blant bychain, ydd y chwi o Ddyw, ac y gorvuoch 
1JN.4.5	Wy
1JN.4.6	Yr Epistol y Sul cyntaf gvedy Trintot
1JN.4.7	Garedigion, carwn eu gylydd: can ys cariat o Ddyw 
1JN.4.8	Yr hwn ny char, ny
1JN.4.10	Yn hyn y mae cariat, nyd am 
1JN.4.11	Caredigion, a’s velly in carawdd Duw 
1JN.4.12	Ny welawdd nep Dduw 
1JN.4.13	Wrth hyn y gwyddom ein bot yn trigio yntho 
1JN.4.14	A’ ni
1JN.4.15	Pwy pynac a goffeso bot Iesu yn Vap Duw, ynthaw 
1JN.4.16	A’ 
1JN.4.18	Nyd oes ofn yn‐cariat, eithr perffeith gariat a vwrw allan ofn: o bleit y mae 
1JN.4.19	Ydd ym ni yn y garu ef, can yddo ef ein caru 
1JN.4.20	A’s dywait nep, 
1JN.4.21	A’r gorchymyn hwu ys ydd y ni y cantho ef, bot y hwn a gar Dduw, garu ei vrawt hefyt.
1JN.5.1	PWy pynac ’sy yn credu mae Iesu yw’r Christ, o Ddeo y ganet, a’ phob vn ’sy yn y caru yr hwn a genedlodd, y car 
1JN.5.2	Yn hynn y gwyddom y carwn blant Dyw, pan ym yn caru Duw, ac yn cadw ei orchymynneu.
1JN.5.3	Can ys 
1JN.5.4	Cans 
1JN.5.4	Yr Epistol y Sul cyntaf gwedy ’r Pasc
1JN.5.4	byt, 
1JN.5.5	Pwy ’sy
1JN.5.6	Hwn yw’r Iesu Christ y ddaeth 
1JN.5.7	Can ys y mae tri, ys y yn testiolaethu yn y nef, y Tat, y Gair, a’r Yspryt glan: a’r tri hyn vn ynt.
1JN.5.8	Ac y mae tri, ysy yn testiolaethu 
1JN.5.9	A’s testiolaeth dynion a 
1JN.5.10	Yr hwn a gred ym‐Map Dyw, y may 
1JN.5.11	A’ hon yw’r testiolaeth, 
1JN.5.12	Hwn y mae y Map 
1JN.5.13	Y petheu hyn a scriuenais atoch, yr ei a gredwch yn Enw Map Dyw, mal y gwypoch vot ychwy vywyt tragyvythawl, ac mal y credoch yn Enw Map Dyw.
1JN.5.14	A’ hyn yw’r 
1JN.5.15	Ac a’s gwyddom y vot ef yn ein clywet, pa 
1JN.5.16	A’s gwyl nep ei vrawt yn pechu pechot, 
1JN.5.17	Pop 
1JN.5.18	Gwyddom mae pwy pynac a anet o Ddyw, na phecha: eithyr hwn a genetlwyt o Dduw, y caidw ehun, a’r 
1JN.5.19	Gwyddom ein bot o Ddyw, a’r oll vyt ys y yn gorwedd yn‐
1JN.5.20	A’ 
2JN.1.1	YR 
2JN.1.2	Er mwyn y gwirionedd ys y
2JN.1.3	Bit rrat, gyd a chwi, trugaredd, a’ thangneðyf 
2JN.1.4	Llawen iawn vu genyf, gahel o honaf dy blant yn rrodio yn‐gwirionedd, val y
2JN.1.5	Ac yr owrhon yr 
2JN.1.6	A’ hwn yw’r cariat, bot y ni rodio ar ol y ’orchymynion ef. Hwn yw’r gorchymyn, bot ychwy val y clywsoch or dechreu, rodio ynthaw.
2JN.1.7	Can ys llawer o twyllwyr a ddaethant 
2JN.1.8	Edrychwch arnoch ychunain, na chollom y petheu, y wnaetham, eithyr val y
2JN.1.9	Pwy pynac a 
2JN.1.10	A’
2JN.1.11	Can ys yr hwn a ðywet wrtho, Hynpych‐well, ys y cyfrannoc oy weithredoedd drwc ef.
2JN.1.12	Cyd bei cenyf lawer o betheu yw scrivennu atoch, er hyny ny
2JN.1.13	Y mae meibion dy 
3JN.1.1	YR Henaf
3JN.1.3	Canys llawenhau a wneuthum yn vawr pan ddaeth dy vrodyr, a’ thestiolaethu am y gwirionedd ys ydd ynot, mal ydd wyt yn rrodio yn‐gwirionedd.
3JN.1.4	Nyd oes can yf’ lawenydd mwy na hyn, 
3JN.1.6	Yr ei a destiolaythen am dy gariat gerbron yr Ecclesi. Yr ei a’s hebryngy 
3JN.1.7	Can ys er mwyn y Enw ef ydd aethant ymddaith, eb gymeryd dim gan y Cenedloedd.
3JN.1.9	Scrivenais at yr Eccles: eithr Diotrephes yr hwn a gar vot yn vlaenor yn y plith hwy, ny 
3JN.1.10	Erwyð paam a’s dauaf, 
3JN.1.12	Y mae y D
3JN.1.13	Y mae 
3JN.1.14	Gobeitho ydd wyf 
3JN.1.15	Tangneddyf yty. Y mae dy geraint ith anerch. Anerrch y cereint wrth 
JUD.1.1	IUdas gwas
JUD.1.2	Trugaredd ywch, a’ thangneddyf a’ chariat a liosocer.
JUD.1.4	Can ys y mae rryw ddynion wedy ymlusco y mewn yr ei oeddent gynt wedy rrac ordino ir varnedigeth hon: andywolion 
JUD.1.5	Wollysio gan hynny ydd wyf ych coffan, yn gymeint ac ychwy vnwaith wybot hyn, p’wedd y bu ir Arglwydd, gwedy darvot iddo waredu y bopul allan or Aipht, destruo 
JUD.1.6	Yr Angelon hefyt yr ei ny chatwasāt eu dechreuat 
JUD.1.7	Megis Sodoma a’ Gomorrha, a’r dinasoedd oi 
JUD.1.8	Yn gyffelip 
JUD.1.9	Eithyr Mi
JUD.1.10	Eithyr yr hein a gaplant y petheu ny wyddant: a ’pha betheu bynac a wyddant yn 
JUD.1.11	Gwae hwy
JUD.1.12	Yr‐ei‐hyn ynt vrycheu yn eich cariat
JUD.1.13	Tonneu 
JUD.1.14	Ac Enoch hefyt y saithfet o Adda, a prophwytawdd am y cyfryw 
JUD.1.15	I roi barn yn erbyn pawp, ac y argyweddu yr oll andewolion yn y plith hwy am eu 
JUD.1.16	Yr ei hyn ynt 
JUD.1.17	Eithyr, garedigion, cofiwch y gairieu y ragddywetpwyt y gan Apostolieit Iesu Christ,
JUD.1.18	Can yddynt
JUD.1.19	Yr hein ynt y sawl a ymohanant, 
JUD.1.20	Eithr, 
JUD.1.21	Ac ymgadwch yn‐cariat Dyw, gan 
JUD.1.22	A’ thrugar
JUD.1.23	A’ eraill cadwch ac ofn, gan eu tynnu allan o’r tan, a’ chasau ys y wisc 
JUD.1.24	Ac i hwn a ddygon eich cadw, yn 
REV.1.2	Yr hwn y dystolaethoedd 
REV.1.4	Ioan, 
REV.1.5	Ac o ddiwrth Iesu Christ, yr hwn ys ydd tust ffyddlawn, 
REV.1.6	Ac yn gwnaeth yn Vrēhinoeð ac yn 
REV.1.8	Mi wyf 
REV.1.9	Mi Ioan, ych brawd chwi, a 
REV.1.10	Yr oyddwn yn 
REV.1.11	Yn dywedyd, mi wyf 
REV.1.12	A mi ym
REV.1.13	Ac ynghanol y seith canwyllbren, vn yn debic y Vab y duyn, gwedy ymwysgo a gwisc hed y draed a’ chwedi 
REV.1.14	Ey ben, ay wallt oeddent wnion mal gwlan gwyn, 
REV.1.15	Ay draed 
REV.1.16	Ac yr oedd yn y law ðehe saith seren: ac o eney allan yrydoed yn myned cleddey llym doy vinioc: a discleiro a wnaeth y wyneb ef mal yr 
REV.1.17	A phan y gweles i ef, my a syrthies wrth y draed mal marw, ac ef a ddodoedd y law dehe arnaf, dan ddwedyd wrthyf, nac ofna: mi wyf y cyntaf a’r diwethaf,
REV.1.18	Ac yr wyf yn vyw, ac y vym varw, 
REV.1.19	Escryvenna y pethey y weleist, ar pethey ysydd, ar pethey a 
REV.1.20	Dirgelwch y seith seren y weleist yn vy llaw ðechre, 
REV.2.1	EScryvena at Angel Eglwys Ephesus, Hyn y may ef yn dywedyd y syð yn dal
REV.2.2	Mi adwen du weithredoedd, ath travael, ath 
REV.2.3	A thi oddefeist, ac 
REV.2.5	Meddylia, am hyn, o pa le y cwympeist, ac etiverha, a gwnar gweithredoedd cynta: ac 
REV.2.6	Ond hyn y sydd genyt, achos yt cashay gweythredoedd y Nicolaitait, y rrein yr wyf vi 
REV.2.7	Y sydd a chlyst gantho, gwrandawed, pa beth y ddwed yr ysbryd wrth yr Eglwysi, Ir 
REV.2.8	¶ Ac escrifena at Angel Eglwys y Smyrniaid, Hyn y ð
REV.2.9	Mi adwen dy weythredoedd, ath travael, ath tlodi (eithr yr wyd yn gyvoethoc) ac 
REV.2.10	Nac ofna ddim or pethey y orvydd yd y oddef: synna, e ddervydd y bwrw y cythrel rrei o hanoch chwi y garchar, mal y gellyr ych profi, a’ chwi a gewch travayl deng niwrnod: bydd ffyddlawn hed 
REV.2.11	Ysydd a chlyst gantho, gwrandawed pa beth y ddwed yr ysbryd wrth yr eglwysi, Ny chlwyfir y gortrechwr gan yr eil 
REV.2.12	Ac Escrifena at Angel Eglwys Pergamus, Hyn ymay ef yny Ddwedyd y sydd ar cleddey llym day vinioc.
REV.2.13	Mi adwen dy weithredoedd ath trig
REV.2.14	Eithr y may genyf ychydic
REV.2.15	Velly hefyd y may genyd rrei yn dala dusc y 
REV.2.16	Etifarha, ac onys 
REV.2.17	Ysydd a chlyst gantho, gwrandawed pa beth y ddwed yr ysbrud wrth yr Eglwysi, 
REV.2.18	¶ Ac escrivena at Angel Eglwys Thyateira, Hyn y may Mab Duw yny ddwedyd, ysydd ae lygeid mal fflam dan, ae draed mal 
REV.2.19	Mi adwen dy weythredoedd ath cariad, a
REV.2.20	Eithr ymae genyf ychydic 
REV.2.21	Ac mi a rroyssym amser yddy y etiferhay am y godinep, ac ny chymerth 
REV.2.23	Ac mi ladda y phlant a 
REV.2.24	Ac y chwi y dwedaf, y gweddillion Thyateira, 
REV.2.25	Ond y peth yssydd genywch 
REV.2.26	Can ys yr vn y orfyddo ac y gatwo vyngweithredoedd hed y diwedd, mi a rroddaf yddo ef gallu ar 
REV.2.27	ac ef a rriola hwynt a gwialen hayarn, ac hwynt a ddryllir mal llestri pridd. Ac yny modd y dderbynes i gan vyn had,
REV.2.28	velly y rroddaf i yddo ef y seren vorey.
REV.2.29	Sydd a chlyst gantho, gwrandawed pa beth y ddwed yr ysbryd wrth yr Eglwysi.
REV.3.1	AC escrivena at Angel Eglwys 
REV.3.3	Am hyny cofia, pa beth y dderbyneist, ac y glyweist, a dala yn 
REV.3.5	Yr vn y 
REV.3.6	Y sydd a chlyst gantho, gwrandawed, pa beth y ddwed yr ysbrud wrth yr Eglwysi.
REV.3.7	¶ Ac Escrifena at Angel 
REV.3.8	Mi adwen dy weithredoedd: 
REV.3.10	O achos 
REV.3.12	Mi wnaf yr vn y ’orfyddo yn 
REV.3.13	Y syð a chlyst gantho, gwranandawed pa beth y ddwed yr ysbryd wrth yr Eglwysi.
REV.3.14	Ac escrifena at Angel Eglwys y Laodiceit, Hyn y ddwad Amen, y tust ffyddlawn a’ chowir, dechreyad creadyrieid Dyw.
REV.3.15	Mi adwen dy weithredoedd, nyd ydwyd na 
REV.3.16	Ac am hyny can dy vod yn 
REV.3.17	Can ys yr wyd yn dwedyd, Yr wyf i yn gyvoethoc, a chenyf amlder o dda, ac ny does arnaf eisie dim, ac ny wddost dy vod yn druan ac yn resynol, ac yn dlawd, ac yn ddall, ac yn noeth.
REV.3.18	Mi gynghoraf ytti bryny genyfi aur 
REV.3.19	Yrwyf yn 
REV.3.20	Syna, yrwyf yn sefyll wrth y drws, ac 
REV.3.22	Y sydd a chlyst gantho, gwrandawed pa beth y ddwed yr ysbryd wrth yr eglwysi.
REV.4.1	GWedy hyn mi edrycheis, 
REV.4.2	Ac yn y man y royddwn yn yr ysbrud, a syna, ve ddodwyd 
REV.4.3	Ar vn y eisteddoedd, oedd yw edrych arno, yn debic 
REV.4.4	Ac ynghylch yr eisteddle 
REV.4.5	A’ 
REV.4.6	Ac yn golwc yr eisteddle 
REV.4.7	Ar enifel cyntaf cynhebic 
REV.4.8	Ac yroedd y bob vn or pedwar enifel chwech o adeinedd gylch ogylch yddynt, 
REV.4.9	A’ phan rroyssont y nefeylied hynny 
REV.4.10	Y pedwar ar rigein o henafied y syrthiasant gair bron yr vn oedd yn eist
REV.4.11	Teylwng wyd, Arglwydd, y 
REV.5.1	AC mi a weleis mewn llaw ddehe yr vn oedd yn eiste ar yr eisteddle, Llyfr escrivenedic or ty vewn, ac or tu allan, gwedy sely a seith sel.
REV.5.2	Ac mi a weleis Angel cadarn yn pregethy a lleis ychel, Pwy sy deilwng y agory
REV.5.3	Ac ny doedd neb 
REV.5.4	Ac 
REV.5.5	Ac vn or henafied y ddwad wrthyf i, Nac wyla: 
REV.5.6	Yno mi edrycheis, a synna, yn c
REV.5.7	Ac ef yddayth, ac y gymerth y Llyfr o law ddehe yr vn oedd yn eiste
REV.5.8	A phan cymerth ef y Llyfr, y pedwar enifel, ar pedwar ar igein henafied, y syrthiasont gair bron yr Oen, ac yr ydoeð gan bob vn 
REV.5.9	Ac y ganysont caniad newydd, dan ddwedyd. Teilwng yd gymryd y Llyfr, ac y ðattod y sele ef, can ys 
REV.5.10	Ac yn gwneythost yn Vrenhinoeð ac yn Effeiried yn Dyw 
REV.5.11	Yno mi edrycheis, ac y glyweis lleis llawer o Angylion ynghylch yr eisteddle ac 
REV.5.12	Yn dwdyd a llais ywchel, Teilwng yw yr Oen y las y dderbyn gallu a chyfoeth, a’ doethyneb, a’ chedernid, ac anrrydedd, a’ gogoniant, a’ moliant.
REV.5.13	Ac mi a glywes yr holl creadyried y rrein ydynt yny nef, ac ar y ddayar, a than y ddayar, ac yny mor, a’ phob peth y sydd yndynt hwy, yn dwedyd, Moliant, ac anrrydedd, a’ gogoniant, a gallu y 
REV.5.14	Ar pedwar enifel a ddywedasont, Amen, ar pedwar ar igein o henafied a sirthiasont y lawr, ac 
REV.6.1	YN ol hyn, mi edrycheis pan agoryssey’r oen vn or seley, ac mi y glyweis vn or pedwar enifel yn dwedyd, mal 
REV.6.2	Ac mi edrycheis, a’ syna, yr ydoedd march gwyn, ac yr ydoedd bwa gan yr vn oedd yn eiste
REV.6.3	A phan agoryssey yr eil sel, mi glyweis yr eil enifel yn dwedyd, 
REV.6.4	March arall aeth allan, ae 
REV.6.5	A’ phan agorysei ef y trydydd sel, mi glyweis y trydydd enifel yn dwedyd, Dabre ac edrych. A’ mi edrycheis, a 
REV.6.6	A’ mi glyweis 
REV.6.7	A’ phan agorasey ef y bedwaredd sel, my glyweis lleis y bedwrydd enifel yn dwedyd, Dabre ac edrych.
REV.6.8	Ac mi edrycheis, a syna, march 
REV.6.9	A’ phan agorasey 
REV.6.10	Ac hwy a lefasont a llef ywchel, dan ddwedyd, Pa hyd, Arglwydd, santeið a chowir? nad ydwyd yn barny a ’dial yn gwaed ni, ar y rrein ar ydynt yn trigo ar y ddayar.
REV.6.11	A’ gowney gwnion 
REV.6.12	Ac mi edrycheis pan agorasei 
REV.6.13	A’ ser o’r nef y syrthiasont yr ddayar, mal pren ffeigys yn bwrw ffeigys‐gleison pan scydwyr 
REV.6.14	Ar nef aeth heybio, mal 
REV.6.15	A’ brenhinoedd y ddayar, ar gwyr mawr, ar cyfoethogion, ar pen captenied, ar 
REV.6.16	Ac hwy y ddwedasont wrth y mynedde
REV.6.17	Can ys y may dydd mawr y ddigovent ef gwedy dyfod, a’ phwy y ddychyn sefyll?
REV.7.1	AC yn ol hyn, mi weleis pedwar Angel yn sefyl’ ar bedwar 
REV.7.2	Ac mi weleis Angel arall yn 
REV.7.3	Dan ddwedyd, Na ddrygwch y ðayar, na’r mor, nar 
REV.7.4	Ac mi glyweis rrif y rrei y selwyd, ac yroydent gwedy 
REV.7.5	O 
REV.7.6	O genedyl Aser ef y selwyd doyddengmil. O genedyl Nephtalei ef y selwyd doyddengmil. O genedyl Manasses ef y selwyd doyddengmil.
REV.7.7	O genedyl Simeon ef y selwyd doyddengmil. O genedyl Leui ef y selwyd doyddengmil. O genedyl Issachar, ef y selwyd doyddengmil. O genedyl Zabulon ef y selwyd doyddengmil.
REV.7.8	O genedyl Ioseph, ef y selwyd doyddengmil. O genedyl Ben‐iamyn ef y selwyd doyddengmil.
REV.7.9	Yn ol hyn mi edrycheis, a’ syna 
REV.7.10	Ac hwy y lefasont a lleis 
REV.7.11	Ar 
REV.7.12	Dan ðwedyd, 
REV.7.13	Ac vn or henafied a 
REV.7.14	Ac mi ddwedeis wrtho ef, Arglwydd ti wddost. Ac yntey y ddwad wrthyf i, Yrrein yddynt y rrei y ddaythont allan o 
REV.7.15	Am hyny y maent gair bron eisteddle Dyw, ac yny wasnaethy ef yn demel dydd a nos, ar vn ysyð yn eiste ar yr eisteddle, y dric yn y plith hwynt.
REV.7.16	Ny vyð arnynt newyn 
REV.7.17	Cans yr oen, yr hwn ysydd yn c
REV.8.1	APhan y agorassey ef y seythfed sel, yrydoedd gostec yny nef 
REV.8.2	Ac mi weleis y seith Angel, yr rein oyddent yn sefyll gair bron Dyw, a’ seith trwmpet yroedd yddynt.
REV.8.3	Yno Angel arall y ddoyth ac y safoedd gair bron yr allor, a senser aur gantho, a’ llawer o arogley y rroed yddo ef, y offrymy a gweðie yr oll Seint, ar yr allor aur, yr 
REV.8.4	A mwg yr erogley ynghyd a gweddie yr Saint, y 
REV.8.5	Ar angel y gymerth y senser, ac y llanwoedd hi a’ than or allor, ac y bwroedd yr ddayar, ac yroydd lleise, a thraney, a’ 
REV.8.6	Yno y seith Angel, y rrein oeðent ar seith trwmpet ganthynt, y 
REV.8.7	Ar Angel cynta y ganoedd y trwmpet, ac yr ydoedd 
REV.8.8	Ar eil Angel y ganoedd y trwmpet, a’ bwrw y y wneithpwyd yr mor, mal 
REV.8.9	A’ thrayan y creadiried, a’r oyddynt y vyw yny mor, y vyont veyrw a thrayan y llonge y ddinystrwyd.
REV.8.10	Ar trydeð Angel y ganoedd y trwmpet, a seren vawr y syrthioedd or nef, yn llosgi mal 
REV.8.11	Ac enw’r seren a elwir wermwd: am hyny trydedd ran y dyfredd aethant yn wermod, a llawer o 
REV.8.12	Ar pedwerydd Angel y ganoedd y trwmpet, a tharo y wneythpwyd trayan yr hayl, a’ thrayan y lleyad, a’ thrayan y ser, nes towylly y trayan hwynt: a’ 
REV.8.13	Ac mi edrycheis, ac y glyweis Angel yn 
REV.9.1	AR pymed Angel y ganoeð ar trwmped, ac mi welais seren yn cwympo or nef yr ddayar, ac yddo ef y rrowd 
REV.9.2	Ac ef agoroð y pwll heb waylod, a’ mwg y gyfodoedd or pwll, mal mwg ffwrneis vawr, ar haul, a’r 
REV.9.3	A’ 
REV.9.4	A’ gorchymyn y rroed yddynt, na waethent 
REV.9.5	A’ gorchymyn y rroed yddynt na ladden y rreini, ond yddynt 
REV.9.7	A’ 
REV.9.8	A’ gwallt oedd ganthynt, mal gwallt gwrageð, ae danedd oeddent mal damedd llewod.
REV.9.9	Ac yr oedd ganthynt 
REV.9.10	A’ 
REV.9.11	Ac y mae ganthynt vrenin arnynt, yr hwn ydiw Angel y pwll heb waylod, ae euw ef yn Ebryw 
REV.9.12	Vn gwae aeth heybio, a’ syna, y may doy wae 
REV.9.13	¶ 
REV.9.14	Yn dywedyd 
REV.9.15	Ar pedwar Angel y ellyngwyd, y rrein y ymbarattowdd yn erbyn awr, yn 
REV.9.16	A’ rrif gwyr meyrch y 
REV.9.17	Ac mal hyn y gweleis i y mairch mewn gweledigaeth, ac yr rydoedd gan rrei oeddent yn eiste arnyt, lurigae tāllyd, ac o 
REV.9.18	A’ thrayan y dynion y las gan y tri 
REV.9.19	Can ys y gallu hwynt ’sydd yn y geneyey, ac yny cynffoney: can ys y cynffoney hwynt oeddent debic y 
REV.9.20	A’ 
REV.9.21	Ac ny chymersont hevyd 
REV.10.1	AC mi welais Angel cadarn arall yn discyn or nef, gwedy 
