MAT.1.1	LLyver 
LUK.18.29	Ac ef a ddyuot wrthynt, Yn wir y dywedaf wrthych, Nid oes vn a’r a adawoð duy, neu rieni, neu vroder, neu wreic, neu blant, 
LUK.18.30	a’r ny
LUK.18.30	Yr Euangel ar Sul Quinquagesima.
LUK.18.31	Yno y cymerth yr Iesu ataw y deuddec, ac a ddyuot wrthynt, Nycha, ni yn mynet i vyny i Caerusalem, ae a gyfiawnir i vap y dyn bop peth, ys y yscrivenenedic 
LUK.18.32	Can ys ef a roddir ir Cenetloedd, ac a ef watworir, ac a geblir, ac a boerir arnaw. 
LUK.18.33	A’ gwedy yddynt y yscyrsiaw ef, wy ei lladdant: anid ef a gyvyt y trydydd dydd drachefyn. 
LUK.18.34	Ac wy ny ni ddyallesont ðim or pethae hyn, ac ydd oedd 
LUK.18.35	Ac e ddarvu, ac ef yn dynesay at Iericho, bot ryw ddyn dall yn eistedd ar emyl y ffordd, yn cardota. 
LUK.18.36	A’ phan glywodd ef y popul yn myned heibio, e ymovynodd beth oedd hynny. 
LUK.18.37	Ac wy a ddywedesont yddaw, mae’r Iesu o Nazaret oedd yn mynet heibio. 
LUK.18.38	Ac ef a lefawdd ac a dyuot, Iesu vap Dauid, trugarha wrthyf. 
LUK.18.39	A’r ei oedd yn mynet o’r blaen, y ceryddent ef, y dewi a son. Ac ef a levawdd vwyvwy, Map Dauid, trugarha wrthyf. 
LUK.18.40	A’r Iesu a savodd, ac a ’orchymynawdd ei ddwyn ef attaw. A gwedy y ddawot ef yn nes, e ovynnawdd ydd‐aw, 
LUK.18.41	can ddywedyt, Beth a vynny imi wneythy
LUK.18.42	A’r Iesu a ddyvot wrthaw, Cymer dy olwc: dy ffydd ath iachaawdd. 
LUK.18.43	Ac yn ebrwydd y cavas ei olwc, ac y 
LUK.19.1	A’ Gwedy dyuot yr Iesu y mywn a’ myned trwy Iericho, 
LUK.19.2	wely’wr a elwit 
LUK.19.3	Ac ef a geisiai weled yr Iesu, pwy vn ydoeð, ac ny’s gallai 
LUK.19.4	Yno y 
LUK.19.5	A’ phan ddaeth yr Iesu ir lle, 
LUK.19.6	Yno y descen
LUK.19.7	A’ phan ei gwelsant 
LUK.19.8	A’ Zacchaius a safawð 
LUK.19.9	A’r Iesu a ðyuot wrthaw, Heddyw y daeth 
LUK.19.10	Can ys‐daeth Map y dyn y gaisiaw, ac y gadw 
LUK.19.11	Ac a’n hwy yn clywet y pethae hyn, y paraodd yn dywedyt parabol o bleit ei vot yn 
LUK.19.12	Ef a ddyuot gan hyny, Ryw wr 
LUK.19.13	Ac ef a alwei 
LUK.19.14	Eithyr ei ddinaswyr y caseynt ef, ac a 
LUK.19.15	Ac e ddarvu, pan adchwelawdd, a’ 
LUK.19.16	Yno y daeth y cyntaf, gan ðywedyt, Arglwydd, dy 
LUK.19.17	Ac ef a ddyuot wrthaw, 
LUK.19.18	Ac e ddaeth yr ail, gan ddywedyt, Arglwydd, dy darn a 
LUK.19.19	Ac wrth hwnw y dyuot, A’byð di
LUK.19.20	Ac arall a ddaeth, gan ddywedyt, Arglwydd, 
LUK.19.21	Can ys‐ith ofnais, o bleit dy vot yn wr 
LUK.19.22	Yno y dywedawdd wrthaw, Oth enae 
LUK.19.23	Paam gan hyny na ro
LUK.19.24	Ac ef a ddyuot wrth yr ei a sefynt geyr‐llaw, Dugwch y ganto y ddarn, a’ rhowch i hwn’sy a’r dec darn ganthaw. 
LUK.19.25	(A’ 
LUK.19.26	, Can ys dywedaf wrthych, 
LUK.19.27	A’hefyt vy‐gelynion hyny, a’r ny 
LUK.19.28	A’ gwedy y‐ddaw ddywedyt val hyn, ef 
LUK.19.29	Ac e ddarvu gwedy nessau o hanaw 
LUK.19.30	gan ddywedyt, Ewch i’r 
LUK.19.31	Ac a’s gofyn neb y chwi, paam y gillwngwch 
LUK.19.32	Yno yr ei a 
LUK.19.33	Ac a’n hwy yn gellwng yr ebol, y dywedawdd ei berchenogion wrthynt, Paam y gel’yngwch ’yr ebal? 
LUK.19.34	Ac wy a ddywedesant, Y mae ar yr Arglwydd ey eisiae.
LUK.19.35	Yno y 
LUK.19.36	Ac a’n hwy yn myned, y tanent ei dillat ’rhyd y fford. 
LUK.19.37	A’ gwedy yddaw 
LUK.19.38	gan ðywedyt 
LUK.19.39	Yno ’r ei o’r Pharisaieit o’r dorf
LUK.19.40	Ac ef a atepawdd, ac a ddyuot wrthwynt, Dywedaf y‐chwy, pe’
LUK.19.40	Yr Euangel y x. Sul gwedy Trintot.
LUK.19.41	¶ Ac wedy iddo ddyuot yn agos, ef edrychawð ar y dinas, ac a wylawdd 
LUK.19.42	gan ddywedyt A’ phebysei i ti wybot, or lleiaf yn dy ðydd 
LUK.19.43	Can ys e ddaw ’r dyddiae arnat, ac y bwrw dy ’elynion glawdd yn dy ’ogylch, ac ith amgylchynant, ac ith ’oarchaeant o pop-parth, 
LUK.19.44	ac a’th wnāt yn 
LUK.19.45	Ac ef aeth y mewn ir Templ, ac a ddechreawdd, ddavly allan yr ei ’n oeddent yn yn gwerthy ynthei, a’ rei oedd yn pryny, 
LUK.19.46	can ddoedyt wrthwynt, Escrivenuwyt, Y tuy meu vi yw tuy gweddi, a’ chwi ei gwnethoch yn ’ogof llatron. 
LUK.19.47	Ac ydd oedd ef yn 
LUK.19.47	A’r Archoffeiriait, a’r Gwyr‐llen, a phenaethae ’r 
LUK.19.48	Ac ny chefynt beth a wnaent iddaw: can ys yr oll popul 
LUK.20.1	AC e ddarvu ar vn o’r dyddiae hyny, ac ef yn dyscu ’r popul yn y Templ, ac yn Euāgelu, yr Archoffeiriait, a’r Gwyr llen a ddaethant 
LUK.20.2	ac a lafaresont wrthaw, gan ddywedyt, Dyweit i ni wrth pa awturtot y gwnai 
LUK.20.3	Ac ef atepodd ac a ddyuot wrthwynt, A’ mi
LUK.20.4	Betyð Ioan ai o’r nef ydd oeð, ai o ddynion? 
LUK.20.5	A’ hwy a resym
LUK.20.6	Ac a’s dywedwn 
LUK.20.7	Am hyny yr atebesont, na wyddent o b’le ydd oeð. 
LUK.20.8	Yno y dyuot yr Iesu wrthynt, Ac ny
LUK.20.9	Yno y dechreawdd ef ddywedyt wrth y 
LUK.20.10	Ac ar ryw 
LUK.20.11	Ac eilwaith y
LUK.20.12	Trache e ddanvonawdd 
LUK.20.13	Yno y dyuot Arglwydd y winllan, Pa 
LUK.20.14	A’r tir‐ddiwilliawddwyr pan wel
LUK.20.15	A’ hwy y tavlesont ef allan o’r winllan, ac ei lladdesont. Pa 
LUK.20.16	Ef a ddaw ac a destryw y tir‐ddiwilliawdwyr 
LUK.20.17	Ac ef a edrychawdd arnynt, ac a ddyvot, Beth ynteu yw hyn a esceivenwyt, Y 
LUK.20.18	Pwy pynac a syrthio ar y maen hwnaw, a 
LUK.20.19	Yno yr Archoffeiriait a’r Gwyr‐llen yn yr awr hono a geysynt ddodi dwylo arnaw: (anyd bot arnyn ofn y popul) can ys gwybuont may yn y erbyn hwy y dywedesei ef y parabol hwn. 
LUK.20.20	A’ hwy 
LUK.20.21	Ac y a ’ofynesont y‐ddaw, gan ddywedyt, Athro, gwyddam y dywedy 
LUK.20.22	A
LUK.20.23	Ac ef a ddyallawdd y 
LUK.20.24	dangoswch i mi geiniawc. Pwy biae ’r ddelw ar 
LUK.20.25	Yno y dywedei ef wrthynt, Rowch am hyny yr eiddo Caisar, i Caisar, a ’r eiddaw Duw, y Dduw. 
LUK.20.26	Ac 
LUK.20.27	Yno y daeth ataw ’r ei o’r Zadduceit (yr ei a wadant vot cyuodedigaeth) ac a ’ovynent iðaw, 
LUK.20.28	gan ddywedyt, Athro, Moysen a yscrivennawdd i ni, A’s bydd marw brawd nep ac iddaw wreic, a’ marw o hanaw yn ddi‐blant, bot y’w vrawt gymeryd ei wreic, a’ chody had y’w vrawd. 
LUK.20.29	Ac yr oedd saith broder, a’r cyntaf a gymerth ’wraic ac a vu varw yn ddi blant. 
LUK.20.30	A’r ail a gymerth y wreic, ac 
LUK.20.31	Yno y trydydd y cymerth hi: a’r vn modd y bu veirw y saith eb adu plant. 
LUK.20.32	Ac yn ddywethaf oll marw o’r wreic hefyt. 
LUK.20.33	Can hyny yn y cyuodedigaeth, gwraic i bwy vn o hanynt vydd hi? can ys ir saith y bu hi yn wreic. 
LUK.20.34	Yno ydd atebawdd 
LUK.20.35	Any
LUK.20.36	Can na allant varw mwy
LUK.20.37	A’ bod ir meirw 
LUK.20.38	Can na
LUK.20.39	Yno ydd atepawdd ’r ei o’r Gwyr‐llen, ac a ddywedesont, Athro, da y dewedeist. 
LUK.20.40	Ac ar ol hyny, ny veiddiesont ymofyn ac ef ddim 
LUK.20.41	Yno y dyuot wrth‐wynt, 
LUK.20.42	Ac 
LUK.20.43	Y n y 
LUK.20.44	Can y Ddauid y alw ef yn Arglwydd, a’ pha weð y mae ef yn vap iddaw.
LUK.20.45	Yno 
LUK.20.46	Ymogelwch rac y Gwyr‐llen, yr ei a ewyllysiant 
LUK.20.47	yr ei a lwyr ysant dai y 
LUK.21.1	AC val 
LUK.21.2	Ac ef a welawð hefyt ryw 
LUK.21.3	ac ef a ddyuot, Yn ddiau y dywedaf ychwy, 
LUK.21.4	Canys wy oll o ei 
LUK.21.5	Ac a’r ei yn dywedyt am y templ, val yr aðurnesit a main pryderth, ac a 
LUK.21.6	 ’r pethae hyn ydd ych yn ei 
LUK.21.7	Yno y gofynnesont y‐ddaw, gan ðywedyt, Athro, and pa bryd y byð pethae y hyn? a ’pha ’r 
LUK.21.8	Ac ef a ddyuot, Mogelwch rac cael eich twyllaw: can ys daw llawer yn vy Enw 
LUK.21.9	A’ phan glywoch 
LUK.21.10	Yno y dywedei wrth‐wynt, E gyuyt 
LUK.21.11	a’ dayar‐grynfaë mowrion vyddant yn 
LUK.21.12	Eithyr cyn na hyn oll, y dodant ei dwylo arnoch, ac 
LUK.21.13	A’ hyn a dry i chwi, yn testoliaeth. 
LUK.21.14	Dodwch gan hyny yn eich calonae, na vefyrioch, beth a atepoch. 
LUK.21.15	Can ys my
LUK.21.16	Ys bradychir chwi y can eich 
LUK.21.17	A’ dygasoc vyddwch gan 
LUK.21.18	Eithyr 
LUK.21.19	Trwy eich 
LUK.21.20	A’ phan weloch Caerusalem wedy ’r amgylchynu gan 
LUK.21.21	Yno ciliet yr ei ’sy yn Iudaia, ir 
LUK.21.22	Can ys dyddiae dial yw 
LUK.21.23	A’ gwae yr ei beichiogion, a’r ei yn 
LUK.21.24	Ac wy a gwympant ar 
LUK.21.25	Yno y byð 
LUK.21.26	Di enait vydd dynion gan ofn, a’dysgwyl 
LUK.21.27	ac yno y gwelant Vap y dyn yn dyuot yn wybren, 
LUK.21.28	A’ phan ðechreuo y pethae hyn 
LUK.21.29	Ac ef a ðyvot wrthynt 
LUK.21.30	pan darddant ynawr gan ei gwel
LUK.21.31	Ac velly chwi
LUK.21.32	Yn wir y dywedaf y‐chwy, na bydd i’r 
LUK.21.33	Nef a’ daiar a ant 
LUK.21.34	Edrychwch arnoch eich hunain, rac bot vn amser trymhau eich calonhae gā 
LUK.21.35	Can ys val 
LUK.21.36	Gwiliwch gan hyny a’ gweddiwch yn ’oystat, ar gahel bot yn deilwng y ddianc rac y 
LUK.21.37	Ac yn hyd y dydd y dyscei ef 
LUK.21.38	A’r oll popul a ddeuent yn vorae ataw, y’w 
LUK.22.1	AC ydd oedd gwyl y bara 
LUK.22.2	A’r Archoffeiriait ar Gwyr‐llen oedd yn ceisiaw pa wedd y lleðynt ef: o bleit ydd oedd arnynt ofn y bobl. 
LUK.22.3	Yno ydd aeth Satan y mewn Iudas, yr hwn a elwit Iscariot, ac y oedd o rif y dauddec. 
LUK.22.4	Ac ef aeth ymaith, ac a ymðiddanawdd a’r Archoffeiriait, a’r llywodraethwyr 
LUK.22.5	Ac ydd oedd yn llawen ganthwynt, ac a gytunesont roddy arian iddaw. 
LUK.22.6	Ac ef a gytunoð, ac a gaisiawdd amser addas yw vradychy ef yddwynt, yn absen y popul. 
LUK.22.7	Yno y daeth y dydd y bara 
LUK.22.8	Ac ef a ddanvones Petr ac Ioan, can ddywedyt, Ewch, a pharatowch y ni y Pasc, val y gallom ei vwyta. 
LUK.22.9	Ac wy a ddywedesont wrthaw, P’le y myny di ei baratoi? 
LUK.22.10	Ac ef a ðyvot wrthwynt, 
LUK.22.11	a’ dywedwch wrth wr y tuy, Yr Athro a ddywait wrthyt, Pl’e mae’r ystauell lle bwytavwyf vy-Pasc y gyd a’m discipulon? 
LUK.22.12	Ac ef a ddengys ywch ’goruch ystavell vawr wedy’r drwsiaw: yno
LUK.22.13	Yno ydd aethant ac y cawsant mal y dywedesei ef wrthynt, ac wy a paratoesant y Pasc, 
LUK.22.14	A’ gwedy dyvot yr awr, ydd esteddawdd, a’r daudec Apostol gyd ac ef. 
LUK.22.15	Yno y dyvot ef wrthynt, Mi a gwbl ðesyfais vwyta’r Pasc hwn gyd a 
LUK.22.16	Can ys dywedaf wrthych, na vwytawyf o hano mwy o hyn allan, yd y ny chyflawner yn‐teyrnas Duw. 
LUK.22.17	Ac ef a gymerth y 
LUK.22.18	Can ys dywedaf wrthych, Nid yfaf o ffrwyth y winwydden, yd y ’n y ddel teyrnas D
LUK.22.19	Ac ef a gymerth vara, a ’gwedy iddo ddiol
LUK.22.20	Yr vn modd hefyt wedi iddo swpery 
LUK.22.21	Eithyr 
LUK.22.22	Ac yn wir Map y dyn a gerða megisy darparwyt: eithr gwae’r dyn hwnw trwy’r hwn y bradychir ef. 
LUK.22.23	Yno y dechraesont ymofyn yn ei plith ehun, pwy o hanwynt vyddei a wnei hyny.
LUK.22.23	Yr Euāgel ar ddydd S. Bartholomeus.
LUK.22.24	Ac e gyvodes ymryson yn eu plith, pwy o hanaðynt a debygit ei vot yn vwyaf. 
LUK.22.25	Ac ef a ddyvot wrthynt, Brenhinoedd y Cenedloedd a deyrnasant arnynt, ar ei ai h’arglwyddiaethant a elwir yn Bendevigion 
LUK.22.26	Eithyr na 
LUK.22.27	Canys pa‐vn vwyaf, ai hwn ys a’n eisteð ar‐y‐vort, ai ’r hwn ys y’n 
LUK.22.28	A’ chwychwi yw’r ei’n arosesoch gyd a mi yn vy‐provedigaethae. 
LUK.22.29	Am hyny y gosodeis y chwi deyrnas, megis y gosododd vy‐Tad i mi
LUK.22.30	mal y galloch vwyta, ac yfet ar vy‐bort yn vy‐teyrnas, ar eisteddvae, a’ barny dauddecllwyt yr Israel. 
LUK.22.31	Ar Arglwydd a ddyvot, Simon, Simon, nycha, Satan a’ch ðeisyfawdd, er eich nithiaw megis gwenith. 
LUK.22.32	An’d mi a weddiais trosot, na dðefficiai dy ffydd. Can hyny pan ith ymchweler 
LUK.22.33	Ac ef a ddyvot wrthaw, Arglwydd, ydd wyf yn parat y vynet gyd a thi y garchar ac angae. 
LUK.22.34	Eithyr ef a ddyvot, 
LUK.22.35	Ac ef a ddyvot wrthwynt, Pan eich anvoneis eb 
LUK.22.36	Yno y dyvot ef wrthynt, Eithr yr awrhon y neb ys y gantaw gwd, cymeret, a’r vn ffynyt yscrepan: a’r nep ny bo gāthaw yr vn, gwerthet ei 
LUK.22.37	Can ys dywedaf ychwi, pan yw eto hyn ys y escrivennedic, ys angenrait ei gyflawni yno vi, 
LUK.22.38	Ac wy a ddywedesont, Arglwydd, 
LUK.22.39	Ac ef a ddeuth allan, ac aeth (megis 
LUK.22.40	A’ gwedy y ddawot ef ir van, e ddyvot wrthwynt, Gweðiwch nad eloch ym‐provedigaeth. 
LUK.22.41	Ac ef a dynnawdd y wrthynt, yn‐cylch ergit carec, ac a 
LUK.22.42	can ddywedyt, Y Tad a’s ewyllysy, ys mut y 
LUK.22.43	Ac a ymddangoses yddaw Angel o’r nef, yn ei confforddiaw ef. 
LUK.22.44	Eithyr ac ef mewn 
LUK.22.45	Ac ef a gyfodes o weðiaw, ac a ðauth at 
LUK.22.46	Ac ef a ddyvot wrthwynt, Paam y cyscwch? Cyfodwch a’ gweddiwch nad eloch ym‐provedigaeth. 
LUK.22.47	A thra oeð ef etwa yn ymddiðan, 
LUK.22.48	A’r Iesu a ddyvot wrthaw, Iudas, a vradychy 
LUK.22.49	A’ phan welawdd yr ei oedd yn y gylch ef, beth a ddelei: wy ddywedesont wrthaw, Arglwydd, a drawom ni a chleddyf? 
LUK.22.50	Ac vn o hanwynt a drawodd was yr Archoffeiriat, ac a dores i glust ddehen ymaith. 
LUK.22.51	Yno ’r Iesu atepawdd, ac a ddyvot, Goddefwch 
LUK.22.52	Yno y dyvot yr Iesu wrth yr Archoffeiriat ac wrth 
LUK.22.53	Pan oeddwn paunydd gyd a chwi yn y templ, nyd estenesoch ddwylo ym erbyn: eithyr hon yw eich gwir awr, a’ gallu yr tywyllw
LUK.22.54	Yno y 
LUK.22.55	Ac wedy yddynt gynnae tan yn cenawl y llys, a’ chydeistedd i lawr, ydd eisteddawdd Petr hefyt yn ei plith. 
LUK.22.56	A’ rhyw vorwyn 
LUK.22.57	Ac ef y gwadawdd ef, can ddywedyt, 
LUK.22.58	Ac ychydic yn ol, y gwelawdd 
LUK.22.59	Ac yn cylch awr yn ol hynny, vn arall a gadarnhaodd, gan ddywedyt. Yn wir ac ydd oedd 
LUK.22.60	Ac Petr a ddyvot, 
LUK.22.61	Yno yr Arglwydd a ymchoelawdd, ac a edrychawdd ar Petr: ac a ddaeth yn‐cof Petr 
LUK.22.62	Ac Petr a aeth allan, ac a wylawdd yn 
LUK.22.63	A’r gwyr a ddaliesent yr Iesu, ei watwor a’ ei vaeddu a wnaethant. 
LUK.22.64	A’ gwedy yddwynt 
LUK.22.65	A’ llawer o gabl ’airie eraill a ddywetesont yn y erbyn ef. 
LUK.22.66	Ac 
LUK.22.67	Ai tu yw’r Christ? dywait i ni. Ac ef a ddyvot wrthwynt, P’es dywedwn y chwy, ny’s credech. 
LUK.22.68	A’ phe hefyt ydd 
LUK.22.69	Gwedy hynn yr eistedd Map y dyn ar ddeheulaw gallu Duw. 
LUK.22.70	Yno y dywedesont 
LUK.22.71	Yno y dywedesont wy, Pa reid i ni mwy wrth testoliaeth? canys clywsam ein hunain o ei enae ehun.
LUK.23.1	YNo y cyvodes yr oll lliaws o hanynt, ac y ducesont ef at Pilatus. 
LUK.23.2	Ac wy a a ddechraesont ei gyhuddaw, can ddywedyt. Hwn yma a gawsam yn troi’r bobyl, ac yn gohardd taly teyrnget i Caisar, can ddywedyt, 
LUK.23.3	Ac Pilatus a ’ovynnawdd iddaw, can ddywedyt, Ai ti‐yw’r Brenhin yr Iuddaeon? Ac ef atepawdd iddo, ac addyvot, Tu ys ydd yn 
LUK.23.4	Yno y dyvot Pilatus wrth yr Archoffeiriait, ac wrth y popl, Nyd wyf i yn cahel dim bai ar y dyn hwn. 
LUK.23.5	Ac wyntae 
LUK.23.6	Ac Pilatus pan glypu 
LUK.23.7	A’ phan wybu 
LUK.23.8	A’ phan weles Herod yr Iesu, ef a lawenechawdd yn vawr: can ys ydd oedd yn hir gantaw am ei weled ef er 
LUK.23.9	Yno ydd 
LUK.23.10	Yr Archoffeiriait ar Gwyr‐llen a safasant ac ei cyhuddesont yn 
LUK.23.11	Ac Herod ef a ei gywdawddwyr ny roesont vri arnaw, ac ei gwatworesant, ac ei gwiscesont ef o wynn, ac a ei danvonawð drachefyn at Pilatus. 
LUK.23.12	Ac ar y dydd hwnw ydd aeth Pilatus a’ Herod yn gymddeithion: canys cyn na hyny yð oeð yn ’elyniaeth rhyngtwynt. 
LUK.23.13	Yno Pilatus a ’alwoð yn cyt yr Archoffeiriait a’r llywyodwyr a’r popul, ac a ðyuot wrthwynt, 
LUK.23.14	Chwi ðucesoch y dyn hwn ataf, val vn a vai yn troi ’r popl, a’ nycha, mi ei holeis ef yn eich gwydd, ac ny chevais i vn bai ar y dyn hwn, o’r pethae ydd ywch y’w gahuddaw: 
LUK.23.15	na ddo, na Herod chwaith: can ys anvoneis chwi ataw: a’ nycha, dim teilwng o angae ny wnaed 
LUK.23.16	Erwydd paam, mi ei cospaf, ac ei gellyngaf yn rhydd. 
LUK.23.17	(Can ys angenrait oedd iddaw ellwng 
LUK.23.18	Yno yr oll lliaws a lefawdd ar vnwaith, can ddywedyt, Ymaith ac ef, a’ gellwng Barabbas yn rhyð i ni: 
LUK.23.19	yr hwn am 
LUK.23.20	Yno Pilatus a ddyvot wrthyn drachefyn, can ewyllysy rhyddhay ’r Iesu. 
LUK.23.21	An’d wy lefent can ddywedyt, 
LUK.23.22	Ac ef a ddyvot wrthynt y drydydd waith, An’d pa ddrwc a wnaeth ef: ny chefais ynthaw achos angae: am hyny mi ei cospaf, ac ei gellyngaf yn rhydd. 
LUK.23.23	Ac wyntwy oeddent daerach a llefeu vchel, can erchi y groci ef: a’ ei llefae hwy a’r Archoffeiriait a ’orvu. 
LUK.23.24	Velly Pilatus a varnawdd yddwynt gahel ei h’arch. 
LUK.23.25	Ac ef a ellyggawð yddwynt hwn‐am gyfodiat a’ llawryddiaeth a 
LUK.23.26	Ac val ydd oeddent yn ei arwein ef ymaith, wy ddaliesont vn Simon o Cyren, yn dyuot o’r maes, ac arnaw ef y 
LUK.23.27	Ac ydd oedd yn ei ganlyn ef turfa vawr o popul, ac o wragedd, a’r 
LUK.23.28	A’r Iesu a ymchwelawdd atwynt, can ddywedyt, Merchet Caerusalem, nac wylwch droso vi, ’n amyn wylwch trosoch eich hunain, a’ch plant. 
LUK.23.29	Can ys, 
LUK.23.30	Yno y dechreant dðywedyt wrth y monyddoedd, Syrthiwch arnam: ac wrth y 
LUK.23.31	Can ys a’s gwnant wy hynn ir prenn ijr, peth a wneir ir 
LUK.23.32	Ac Ac ydd oeddit yn arwein gyd ac ef dau ddrygddyn eraill y’w lladd. 
LUK.23.33	A’ gwedy y dyvot hwy i’r lle, a elwyt y Penglocva, yno y crogesont ef, a’r drygddynion: vn ar y ddeheu, a’r all ar y 
LUK.23.34	Yno y dyvot yr Iesu. Y Tad, maddae yddwynt, can na wyddon peth y maent yn ei wneythy
LUK.23.35	A’r popul oedd yn sefyll, ac yn edrych: a’r 
LUK.23.36	A’r milwyr hefyt y gwatworent ef, can ddawot a’ chynic vinegr ydd‐aw, 
LUK.23.37	a’ dywedyt. A’s tu yw’r Brenhin yr Iuddaeon, 
LUK.23.38	Ac ydd oedd 
LUK.23.39	Ac vn or drygddynion a grocesit, y 
LUK.23.40	A’r llall a atepawdd, ac y 
LUK.23.41	Ac ydd ym ni yn 
LUK.23.42	Ac ef a ddyvot wrth yr Iesu, Arglwydd, coffa vi pan ddelych ith teyrnas. 
LUK.23.43	A’r Iesu a ddyvot wrthaw, Yn wir y dywedaf y ti, heddyw y byddy gyd a mi ym‐paradwys. 
LUK.23.44	Ac yð oedd hi yn‐cylch y chwechet awr: ac a vu tywyllwc
LUK.23.45	A’r haul a dywyllwyt, a’llen y Templ a 
LUK.23.46	A’r Iesu a lefawdd a llef vchel, ac a ddyvot, Y Tad, ith ddwylaw y cymennaf vy yspryt. A’ gwedy yddaw ddywedyt hyn, ef 
LUK.23.47	A’ phan weles y Cannwriad yr hyn a wnaethpwyt, ef a roes ’ogoniant i Dduw, can ddywedyt, Yn sicur ydd oedd y 
LUK.23.48	A’r oll 
LUK.23.49	A’ ei oll gydnabot a savent o hir‐bell, a’r gwragedd y dylinesent ef or Galilaia, gan edrych ar y pethae hynn. 
LUK.23.50	A’ nycha, ydd oedd gwr aei enw Ioseph, cygcorwr, gwr da, a’ chyfiawn. 
LUK.23.51	Ef ny chytunesei a ei cygcor na’c a’ ei gweithret hwy, 
LUK.23.52	Hwn yma aeth at Pilatus, ac archawdd gorph yr Iesu, 
LUK.23.53	ac ei tynnawdd i lawr, ac ei 
LUK.23.54	A’r dydd hwnw oeð y Darpar, a’r Sabbath oedd yn nesay. 
LUK.23.55	A’r gwrageð hefyt yr ei oedd yn darddilyn, yr ei a ddaethent gyd ac ef o’r Galilea, a edrychesont ar y 
LUK.23.56	Ac wynt a a ymchwelesont, ac a paratoesont aroglae, ac 
LUK.24.1	YN awr yn y dydd cyntaf o’r wythnos 
LUK.24.2	Ac 
LUK.24.3	ac aethant y mywn, ac ny chawsant gorph yr Arglwydd Iesu. 
LUK.24.4	Ac e ddarvu, ac wynt mewn 
LUK.24.5	Ac val ydd oeddent yn ofni, ac yn 
LUK.24.6	Ni
LUK.24.7	gan ddywedyt, 
LUK.24.8	A’ hwy a gofiesont y ’airiae ef, 
LUK.24.9	ac a ymchwele
LUK.24.10	A’ Mair Magdalen, a’ Ioanna, a’ Mair 
LUK.24.11	Eithr ganthynt y gwelit y geiriae hwy, ve
LUK.24.12	Yno y cyuodes Petr, ac y rhedawdd i’r 
LUK.24.12	Yr Euāgel ar ddie Llun Pasc.
LUK.24.13	¶ A’ nycha ddau or discipulon oeð yn mynet y dref yr hon oedd o ywrth Gaerusalem triugain 
LUK.24.14	Ac wy a ymchwedleynt wrth ei gylyd am yr oll pethae a wneuthesit. 
LUK.24.15	Ac e ddarvu, ac wynt yn cyd ymddiddan, ac yn ymðadlae, bot i’r Iesu yntef nesay, a’ myned gyd 
LUK.24.16	ac wynt eithyr y l’ygait wy a atdaliwyt val nad adwaenēt ef. 
LUK.24.17	Ac ef a ddyvot wrthwynt, Paryw ymadroddion yw’r ei hyn ’sydd genwch wrth y gylydd 
LUK.24.18	Ac vn 
LUK.24.19	Ae ef a ddyvot wrthwynt, Pa pethae? Ac wy a dywedesant wrthaw, 
LUK.24.20	a’ pha vodd y darvu ir Archoffeiraiait a’n llywyawdwyr i roði ef i varn angae, a’ ei groci. 
LUK.24.21	Anid ydd oeddem ni yn gobeithiaw mae ef oedd hwnn a ddelei i bryuu ’r Israel, ac am yr oll pethae hynn, heddyw yw’r trydydd dydd er pan ddarvuant. 
LUK.24.22	A’ hefyt’r ei o’r gwragedd o’n plith a yrrodd vraw arnam, yr ei ddeuthant yn vorae 
LUK.24.23	A’ phryd na chawsāt y gorph ef, wy a ddaethant gan ddywedyt, welet o hanwynt wythae weledigaeth o Angelion, yr ei a ddywedynt y vot ef yn vyw. 
LUK.24.24	Can hyny yr aeth cyfran o’r ei oeddynt gyd 
LUK.24.25	Yno y dyvot ef wrthynt, 
LUK.24.26	a nyd oedd rait i Christ ddyoddef y pethae hynn, a’ myned y’w ’ogoniant? 
LUK.24.27	Ac ef a ddechreawdd o Voysen a’r oll Prophwyti, ac a 
LUK.24.28	Ac yð oeddent yn nesay at y dref, lle ydd oeddent yn myned, ac ef a gymerth arnaw vynet ym‐pellach. 
LUK.24.29	Eithyr wy a ei cympellesont ef, can ddywedyt, Aros gyd a ni: can ys y mae hi yn hwyrhay, a’r dydd 
LUK.24.30	Ac e ddarvu, val ydd oedd ef yn eistedd 
LUK.24.31	Yno ydd egorwyt ei llygait, ac ydd adnabuont ef: an’d ef a 
LUK.24.32	Ac wy a ddywedesont wrthyn ei gylydd, anyd oedd ein calonae yn llosci ynam, tra ytoedd ef yn ymddiddan a ni 
LUK.24.33	Ac wy a gyfodesōt yr awr hono, ac a ymchweleson i Gaerusalem, ac a gawsont yr vn ar ddec wedy ’r ymgynull yn‐cyt, a’r sawl oedd gyd ac wynt, 
LUK.24.34	yr ei a ddywedesant, E gyvodawdd yr Arglwydd yn wir, ac a ymddangosawdd y Simō. 
LUK.24.35	Yno y manegesont y pethae 
LUK.24.35	Yr Euangel die Mawrth Pasc.
LUK.24.36	¶ Ac val y dywedent y pethae hyn, y safoð 
LUK.24.37	A braw ac ofn a vu arnynt, gan ddybieit yddwynt weled yspryt. 
LUK.24.38	Yno y dyvot ef wrthwynt, Paam ich 
LUK.24.39	Welwch vy‐dwylo a’m traet, mae myvy yw 
LUK.24.40	Ac wedy iddaw ddywedyt 
LUK.24.41	Ac wyntwy eto eb gredy gan lawenydd, ac yn rhyveddy, ef a ddyvot wrthwynt, A oes genwch yma ddim or 
LUK.24.42	Ac wy a roesant ydd‐aw ddryll pysc
LUK.24.43	ac 
LUK.24.44	Ac ef a ddyvot wrthwynt, Ll’yma’r gairiae a ddywedais wrthych, tra oeddwn 
LUK.24.45	Yno ydd agores ef y 
LUK.24.46	ac a ddyvot wrthynt, Val hyn yð escrivenwyt, ac val hyn ydd oedd yn rait i Christ ddyoddef, a’ chyvody drachefyn o veirw y trydyð dyð, 
LUK.24.47	a’ bot precethy ediveirwch a’ maddeuant pechatae yn y Enw ef ymplith y Cenetloedd oll, can ddechrae yn‐Caerusalem. 
LUK.24.48	Ac ydd yw chwi yn testion 
LUK.24.49	A’ 
LUK.24.50	Yno ef y 
LUK.24.51	Ac e ddarvu, ac ef e yn y bendithiaw, ymadel o hanaw y wrthynt, a’ei ddwyn i vyny
LUK.24.52	A’ hwy y addolesont ef, ac a ymchwel
LUK.24.53	ac oeddent yn ’oystat yn y Templ, yn moli ac yn clodvori Duw, 
JHN.1.1	YN y dechrae ydd oeð y Gair, a’r Gair oeð y gyd a Duw, a’r Gair hwnw oeð Duw. 
JHN.1.2	Hwn oedd yn y dechrae gyd a Duw. 
JHN.1.3	Oll a wnaethpwyt trwy ’r 
JHN.1.4	Ynd
JHN.1.5	A’r goleuni a 
JHN.1.6	Ydd oedd gwr a 
JHN.1.7	Hwn a ddaeth yn testiolaeth, y destiolaethu 
JHN.1.8	Ny
JHN.1.9	 oeð y gwir ’oleuni y sy yn goleu
JHN.1.10	Yn y byd ydd oedd ef, a’r byd a wnaethpwyt trwyddaw 
JHN.1.11	At yr ei‐’ddaw y 
JHN.1.12	A’ chynniuer aei 
JHN.1.13	yr ei a anet ny
JHN.1.14	A’r Gair 
JHN.1.15	Ioan a testolaethei 
JHN.1.16	Ac oei 
JHN.1.17	Can ys y Ddeðyf a roet trwy Moysen, 
JHN.1.18	Ny welas nep Dduw er ioed: yr 
JHN.1.18	Yr Euangel y iiij. Sul yn yr Aduent.
JHN.1.19	¶ A’ hyn yw testiolaeth Ioan, pan 
JHN.1.20	Ac ef a gyffesawdd, ac ny wadawdd, ac a addefawdd 
JHN.1.21	Yno y gofynesont iddaw, Beth yntef? 
JHN.1.22	Yno y dywed
JHN.1.23	Eb yr 
JHN.1.24	A’r ei a 
JHN.1.25	Ac wy a ’ovynesont iddaw, ac a ddywed
JHN.1.26	Ioan ei hatebawdd, gan ddywedyt, Mi ’sy yn batyddio a dw
JHN.1.27	Ef
JHN.1.28	Y pethae hyn a wnaethpwyt ym‐Bethabara y tuhwnt i Iorddanen, lle batyddiei Ioan.
JHN.1.29	Tranoeth gwelet o Ioan yr Iesu yn dyuot ataw, a ’dywedyt, Wely yr Oen Duw yr hwn ’sy yn 
JHN.1.30	Hwn yw 
JHN.1.31	A’ mi ny
JHN.1.32	Sef y testolaethei Ioan, gan ddywedyt, 
JHN.1.33	A’ mi ny
JHN.1.34	A’ mi a 
JHN.1.35	Tranoeth y safawdd Ioan, a’ dau o ei ddiscipulon: 
JHN.1.36	ac a edrychoð ar yr Iesu yn 
JHN.1.37	Yno clybot o’r ðau ddiscipul ef yn ymadrodd, a’ 
JHN.1.38	A’r Iesu a droes, ac y gwelawdd hwy yn 
JHN.1.39	Dywedawð wrthynt, Dewch, a’ gwelwch. Daethant, a’ gwel
JHN.1.40	Andreas, brawt Simon Petr, oedd vn o’r ddau a glywsent y gan Ioan, ac y dilynesent ef. 
JHN.1.41	Hwn yma a gafas, y vrawt Simon yn gyntaf, ac a ddyuot wrthaw, 
JHN.1.42	Ac y duc ef at yr Iesu. A’r Iesu a edrychawdd arnaw, ac a ddyuot, 
JHN.1.44	A’ Philip oeð o Bethsaida, dinas Andreas ac Petr. 
JHN.1.45	Cahel o Philip Nathanael a’ dywedyt wrthaw, 
JHN.1.46	Yno y dyuot Nathanael wrthaw, ’All dim da 
JHN.1.47	Iesu a welas Nathanael yn dyvot ataw, ac a ddyuot, am dano, Wely, yn ddiau Israeliat, yn yr hwn ny 
JHN.1.48	Dywedei Nathanael wrtho, O b’le yr adnabuost vi? Yr Iesu atepawdd ac a ddyuot wrthaw, Cyn 
JHN.1.49	Nathanael atepawdd, ac eb yr ef wrthaw, Rabbi, ti yw 
JHN.1.50	Iesu atepawdd ac a ddyuot wrthaw, Can ddywedyt o hanof y‐ty, 
JHN.1.51	Ac ef a ddyuot wrthaw, Yn wir, yn wir dywedaf y‐chwy, 
JHN.2.2	A’ 
JHN.2.3	A’ phan 
JHN.2.4	Yr Iesu a ddyuot wrthei, Peth ys yð i mi a wnel a thi wreic? ny ddeuth vy awr eto. 
JHN.2.5	Y vam ef a ddyvot wrth y gwasanaethwyr, Peth bynac a ddyweto ef wrthych, gwnewch. 
JHN.2.6	Ac ydd oedd yno chwe
JHN.2.7	Yr Iesu a ddyuot wrthynt, Llanwch y dyfrlestri o ddwfr. Yno eu llanwasant wynt yd yr 
JHN.2.8	Yno y dyvot ef wrthynt, Gellyngwch yr awr hon a’ dygwch at lywodraethwr y wledd. Ac wy ei dygesont. 
JHN.2.9	A’ gwedy 
JHN.2.10	ac a ddyvot wrthaw, Pop dyn a ’osyt win da yn gyntaf, a gwedy yddyn 
JHN.2.11	Hyn o ddechrae 
JHN.2.12	Gwedy yddo 
JHN.2.13	Can ys 
JHN.2.14	Ac ef a gavas yn y Tem
JHN.2.15	Ac ef a wnaeth 
JHN.2.16	ac a ddyuot wrth yr ei a werthent colom
JHN.2.17	A’ ei ddiscipulon a gofiesont, val ydd oedd yn escriuenedic, 
JHN.2.18	Yno ydd atepynt yr Iuddaeon, ac y dywedynt wrthaw, Pa 
JHN.2.19	Atepawdd yr Iesu a’ dywedawdd wrthynt, 
JHN.2.20	Yno y dywedynt yr Iuddaeon, Chwe
JHN.2.21	Ac 
JHN.2.22	Am hyny cy gynted y cyuodes ef o veirw, y cofient ey ddiscipulon ddywedyt o hanaw hyn wrthynt: a’ hwy a credessont 
