EPH.2.14	Kusangwa iye ni buholo bwetu, oyo wayira babiri mo muguma kandi mwaterya oluhimbo lwobuyigu lwerigabana, 
EPH.2.15	amabilusya obuyigu omo mubiri wuwe yo Migambo yategekawa omo binywa byerihana, iniatoka erihangika omwisi wuwe oko babiri mundu muguma muhya muhya, neryo inialeta obuholo, 
EPH.2.16	kandi iniatoka erisangania ababiri oko Mungu omo mubiri muguma busana nomusalaba, iniabuga obuyigu atya. 
EPH.2.17	Neryo mwasa mwabakanirya obuholo inywe mwabya hali na kandi obuholo kwabo babya hakuhi; 
EPH.2.18	kusangwa busana naye itwe babiri tukabana erihika uku Tata omo Kirimu kiguma. 
EPH.2.19	Neryo simukiri ababunga na bagendi, nikwa muri bekitunga haguma nababuyirire nabenyumba yoMungu, 
EPH.2.20	Muhimbire oko kibanza kyaba kwenda na baminyereri, Kristo Yesu inibwe inene erikawataya enunga, 
EPH.2.21	omuryo enyumba yosi ikahindanibawa ndeke ikusula eribya ehekalu ibuyirire omwisi woMukama; 
EPH.2.22	omwisi wuwe tukahimbawa haguma eribya aheriikala ryoMungu omo Kirimu.
EPH.3.1	Busana nomwatsi oyu ingye, Paulo, mundu womuliki wa Kristo Yesu busana nenyu eBihanda— 
EPH.3.2	mwamabya imwabiriowa obuteya bwolukogo lwoMungu obo nahabawa busana nenyu, 
EPH.3.3	ngoko naminyisibawa ekibisamire omwibisulirwa, ngoko nabiribasakira hake emuliro. 
EPH.3.4	Omugulu mukasoma ebi imwatoka eriminya ebyo nyasi oko kibisamire kyaKristo, 
EPH.3.5	ekitaminyisibawa oko bagala babandu oko sindi syondego ngoko lino kyabiribisulirwa oko bakwenda buwe babuyirire na baminyereri omo Kirimu; 
EPH.3.6	kiti, ngoko eBihanda ni bari bomwandu haguma, nerisangira omubiri muguma, nerisangira omwelaga omwisi wa Kristo Yesu busana nengulu yowene. 
EPH.3.7	Ingye nayirawa omukwenda wengulu yowene eyi ngerihitya ryolukogo lwoMungu olo nahabawa busana neri kola ryakagala kuwe. 
EPH.3.8	Ingye, nomo nyiri mukemuke kwilaba ababuyirire bosi, nahabawa olukogo olu, erikanirya eBihanda obusoki bwa Kristo obutesondekanibawa, 
EPH.3.9	erileka abandu bosi ibalangira eritondekania ryekibisamire ekyabisawa oko migulu yosi omwisi woMungu oyu wahangika ebindu byosi; 
EPH.3.10	Neryo oko mugulu walino amenge manene goMungu aminyikalibawe nekanisa oko mami nebyamaka. 
EPH.3.11	Ebi byabya ngerisonda ryakera na kera eryo abereraya omwisi wa Kristo oMukama wetu, 
EPH.3.12	omwisi wuwe turi nobutubaha omwiyi ketera erimuhikako busana nerikirirya ryetu omwiye. 
EPH.3.13	Kika leka inabagonga-gonga nyiti simuluhe busana namalige wage ago ngagalawa mo busana nenyu, ayo ni lukengerwa lwenyu.
EPH.3.14	Busana neki ngakukamira Tata, 
EPH.3.15	busana naye oburi kitunga omo lubula namuna kihugo bikahulawa, 
EPH.3.16	abahe ngobusoki bwolukengerwa luwe eribana amaka busana ne Kirimu omo mundu womwisi, 
EPH.3.17	kandi Kristo ikale omo mitima yenyu omwikirirya; nenyu imwamabya nemirihi neri sika omo lwanzo, 
EPH.3.18	imwatoka eribya nobutoki eriminya haguma na babuyirire bosi obugali nobuli bwendata nobuli bweyikwa, 
EPH.3.19	neriminya olwanzo lwa Kristo olulengire eri minya, imwatoka erisulibwa neriusula ryosi ryoMungu.
EPH.3.20	Nikwa lino ukwoyo ukatoka erikola kwilaba byosi ebyo tukabulaya kutse eriganirya nga kagala akakakola omwisi syetu, 
EPH.3.21	olukengerwa lubye kwiye omo kanisa nomwisi wa Kristo Yesu erihika oko syondengo syosi, ekera na kera. Bibye bitya.
EPH.4.1	Neryo ingye, mundu womuliki busana noMukama, nga bago mulendere ngoko ritolere eribirikira eryo mwabirikirawamo, 
EPH.4.2	omwiyikehya yosi neriyibombeka, neri tindaluha, neriganyirana omo lwanzo, 
EPH.4.3	eribya nomuhwa erisikya obuguma bweKirimu omo muliki wobuholo. 
EPH.4.4	Hari mubiri muguma neKirimu kiguma, ngoko mwabirikirawa oko maha maguma owakabya okwibirikirwa ryenyu, 
EPH.4.5	oMukama muguma, erikirirya iguma, eribatisya iguma, 
EPH.4.6	oMungu muguma Tata witwe bosi, oyuri endata kobosi nomukati-kati ka bosi nomwisi wabosi. 
EPH.4.7	Nikwa oko buri mundu kwitwe olukogo molwahabwa ngolulengo lwerihitya rya Kristo. 
EPH.4.8	Neryo kyabiribuga kiti,
EPH.4.8	Omugulu ahetukira endata mwatwala endeko yabanyegwa,
EPH.4.8	Mwaha erihitya oko bandu,
EPH.4.9	(eribuga riti, Ahetukira, ni musindoki kwehi? eryo andagarira omo syongonde sye kihugo syeyikwa. 
EPH.4.10	Oyo wandagala yonoyo wahetukira endata kutsibu kwilaba elubula losi, iniatoka eri usulya emyatsi yosi.) 
EPH.4.11	Erihitya riwe ryabya riti abandi babye abakwenda, nabandi babye baminyereri, nabandi abatuli bengulu yowene, nabandi barisya nabakangirirya, 
EPH.4.12	busana nerihikana ryababuyirire, busana nomubiri werikolera, busana nerihimba omubiri wa Kristo, 
EPH.4.13	erihika aho twasyahikira omo buguma bwerikirirya neriminya ryoMugala woMungu, erihikana ryomundu erikula, erihika oko lulengo lwobukulu bwerihikana ryaKristo; 
EPH.4.14	itutaswabya abana, abakagusawa eyi neyi nerihekwa namahunga gosi werikangirirya, omo menge wabandu, omo bugobya bwabo omo menge weriteba. 
EPH.4.15	Nikwa tubuge ekwenene omo lwanzo, tukule omo byosi omwisi wuwe oyuri mutwe, ni Kristo, 
EPH.4.16	omwisi wuwe mubiri gosi, akatsu kikanibawa nerilukwa haguma busana neriwatikania ryoburi nungo, ngerikola ryoburi kitsuko, rikaleka omubiri iniakanya neriyihimba omwisi wolwanzo.
EPH.4.17	Nikwa ngabuga eki neritulago omwisi woMukama, nyiti, simwangalendera ngoko eBihanda bikalendera, omo busa bwo buringikania bwabo; 
EPH.4.18	amenge wabo abiribya mwirimya, babirigabulwa oko engebe yoMungu busana neritindaminya eriri omwisi wabo, busana nerikala ryabo ryomutima; 
EPH.4.19	ba biribasa kandi babiriyiha okwisingira, nerianguha okwikola oburi musindo we bitisirire. 
EPH.4.20	Inywe momutige Kristo yo mutya!— 
EPH.4.21	mwamabya mwabirimowa nerikangirirya omwisi wuwe ngoko ekwenene iri omwisi wa Yesu. 
EPH.4.22	Mwambule mundu wa kera owemibere yenyu yakera oyu kahonda busana nesyongumbu syeriteba, 
EPH.4.23	mubye bahyabahya omo kirimu kyobuganirya bwenyu, 
EPH.4.24	mwambale mundu muhyamuhya, oyu kahangikawa nga kisosekanio kyoMungu omo ritunganene neribuyirire byekwenene.
EPH.4.25	Neryo, muhige amabehi, oburi mundu abuge ekyekwenene na mulikyabo, kusangwa turi bitsuko oburi mundu ku muli kyabo. 
EPH.4.26	Mwamahitana isimwakola nabi; eryuba sirirenge munahitene, 
EPH.4.27	simuhe Satani omwanya. 
EPH.4.28	Omwibi siibe kandi, nikwa akole mibiri yowene omo byala biwe, iniatoka eriha abari nobwaga. 
EPH.4.29	Simuleke erikania ibi rikalwa omo muno wenyu, nikwa ebibuya busana nerihimba, ngoko ritolere eriha abakowa olukogo. 
EPH.4.30	Simwite eKirimu Kibuyirire kyo­Mungu kyobulige, omwisi wakyo momwahirwa kwekibohi oko kiro kyeritongolibwe. 
EPH.4.31	Erikariha ryosi nerihitana neriaga rirwa, nolukanda neritsuma, bihigirawe hali kwinywe, haguma na mutima mubi gosi, 
EPH.4.32	kandi mukolerane ndeke, eribuyirana, ngoko Mungu naYe omwisi wa Kristo ababuyira.
EPH.5.1	Neryo mubye abagerererya boMungu, nga bana banze. 
EPH.5.2	Mulendere omo lwanzo, ngoko Kristo atwanza kandi mwayiha busana netu, obuhere obukakumba ndeke obukahe rawa oko Mungu.
EPH.5.3	Nikwa obusingiri nebitisirire byosi kutse erirumwa sibyan ngahulwa omukati-kati kenyu, ngoko ritolere oko babuyirire. 
EPH.5.4	Sihabye ebikita esisoni, kutse eribuga ebyobukiru, kutse ebyerisekererya, ebitatolere; nikwa kumbe habye eriha ewasi ngya. 
EPH.5.5	Nikwa eki muminye ndeke, ko hate omusingiri kutse mundu mutyamutya, kutse oyu katsura (omusabi wesisumba) oyu wite omwandu omo bwami bwaKristo noMungu. 
EPH.5.6	Simu leke omundu akabateba nebinywa ebitemo, kusangwa busana nemyatsi eyi erihitana ryoMungu rikasira bagala abatiowa. 
EPH.5.7	Neryo simusangana nabo, 
EPH.5.8	kusangwa kera mwabya omwi rimya, nikwa lino muri ekyakakala omwisi woMukama; mulendere ngabana bekyakakala 
EPH.5.9	(kusangwa ebiguma bye kyakakala bikabanika omwisi webyosi ebiri bibuya ebitunganene nebyekwenene), 
EPH.5.10	kandi mulenge eriiga ebikatsemesaya oMukama. 
EPH.5.11	Simusakane nemibiri yomwirimya eyite nebi guma, nikwa kumbe mwamakungayo. 
EPH.5.12	Kusangwa ikita esisoni eriahula emyatsi eyo bakakola bubi-sobiso; 
EPH.5.13	nikwa omugulu emyatsi yosi ikakungawa ikaminyikalibawa nekyaka kala: kusangwa ebindu byosi ebikaminyikalibawa ni ekyakakala. 
EPH.5.14	Kikaleka ikyabuga kiti,
EPH.5.14	Ubuke, uwe omugotseri, uhangane oko baholi,
EPH.5.14	Kristo asyakolerya kuwe.
EPH.5.15	Muyitegaye ndeke ngoko mukalendera, butsira bandu bate na menge nikwa ngaba menge, 
EPH.5.16	mutongolaye endambi, kusangwa ebiro ni bibi. 
EPH.5.17	Neryo simubye bikiru, nikwa muminye erisonda ryoMukama nga ni ryahi. 
EPH.5.18	Kandi simu kunde nebinyu, kusangwa hari eritamira; nikwa musule ne Kirimu, 
EPH.5.19	eribwirana omo sauma nesyonyimbo nesyonyimbo syeKirimu, eriimba neribuyahirwa omo mutima wenyu gosi oko Mukama, 
EPH.5.20	eriha ewasingya oko Mungu Tata oko mugulu gosi busana nebyosi omo rina ryoMukama wetu Yesu Kristo. 
EPH.5.21	Mowane ogundi eriowa ogundi omwikenga Kristo.
EPH.5.22	Abakali, mowe abibanywe, ngoko oko Mukama. 
EPH.5.23	Ku­sangwa iba ni mutwe womukali ngoko Kristo ni mutwe wekanisa, omubiri wuwe, naye ni Mulamya wago. 
EPH.5.24	Ngoko ekanisa ikowa Kristo, ritya abakali bowe abibabo omo myatsi yosi. 
EPH.5.25	Abiba, mwanze abakali benyu, ngoko Kristo mwanza ekanisa mwayiha busana nayo, 
EPH.5.26	iniatoka erihigulayo, ini amabieryayo neriera ryamagetsi nekinywa, 
EPH.5.27	iniayiletera ekanisa eyolukengerwa, eyite nekitingu kutse mukunyo kutse ekindu kiringekyo; nikwa ibye ibuyirire butsira bulema. 
EPH.5.28	Ritya abiba kobanganza abakali babo batya ngemibiri yabo. Oyu kanza omukali wuwe akayanza. 
EPH.5.29	Kusangwa sihari mundu na kera oyu kakwa omubiri wuwe wekiniga, nikwa akahago nerisugago, ngoko Kristo akakolera ekanisa, 
EPH.5.30	ku sangwa turi bitsuko byomubiri wuwe. 
EPH.5.31	Busana nomwatsi oyu omundu asyasiga ise na nyinya neribegerania nomukali wuwe, nababiri basyabya omubiri muguma. 
EPH.5.32	Ekibisire eki ni kinene: nikwa ngahula Kristo nekanisa; 
EPH.5.33	nikwa, oburi mundu kwinywe anze omukali wuwe ngoko ayanzire, nomukali akenge iba wuwe.
EPH.6.1	Abana, mowe abakababuta omwisi woMukama, kusangwa eki kitunganene. 
EPH.6.2	Usikaye tata wawe na koyo wawe (eki ni kihano kyerimbere ekiwite erilaga), 
EPH.6.3	ubane omuyisa kandi ukote mona kihugo. 
EPH.6.4	Nenyu abise, simuhitanaye abana benyu, nikwa mukulayebo musuyirebo nerikangiriryabo omwisi wo Mukama.
EPH.6.5	Abakobe, mowe abakama benyu abari mona kihugo, haguma neriubaha nerititimana, nomutima muguma, ngoko mukowa Kristo; 
EPH.6.6	butsira erikola erilolwako, kutse ngeritsemesya abandu, nikwa ngabagombe baKristo, erikola erisonda ryo Mungu erikalwa omo mutima, 
EPH.6.7	erikola omubiri nomutima owene ngerikolera oMukama butsira ngabakakolera abandu, 
EPH.6.8	imunasi kwebyosi mundu akakola, asyatuhwa kandi no Mukama, nomwangabya omukobe kutse oyu kayigenderaya. 
EPH.6.9	Abakama, mukolebo mutya nenyu, muleke eriubahya, imunasi kwari Mukama wabo nowenyu elubula, kandi sihari ebitaga ewuwe.
EPH.6.10	Ekikisiya, mubye namaka omwisi woMukama nomo kagala kobutoki buwe. 
EPH.6.11	Mwambale ebindu byosi byamalwa ebyoMungu, imwatoka erihangana erilwa namenge gosi we Satani. 
EPH.6.12	Kusangwa siturilwa nomubiri nomusasi, nikwa tukalwa namami, nebyamaka, nabarongani be kihugo omo mwirimya wasesene, nemilondo yebirimu yebibi aho elubula, 
EPH.6.13	Neryo muhambe ebindu byosi byoMungu byamalwa, imwatoka erisika omo kiro kibi, kandi mwamabikola ebyosi, muhangane. 
EPH.6.14	Neryo muhangane, imwamabiboha esyombindi syenyu omo mwatsi wakwenene, imwamabiambala ebyuma byeritunganene omo kikuba, 
EPH.6.15	imwamabiambala esyonge ndero syengulu yowene yobuholo; 
EPH.6.16	kandi kwilaba ebyosi mwimaye engabo yerikirirya, imwatoka erilima emisoha yosi eyomundu mubi eyikaka. 
EPH.6.17	Kandi mwimaye akakira kerilama, nomuyari weKirimu, kye kinywa kyoMungu. 
EPH.6.18	Musabe emigulu yosi omo Kirimu, nerisaba ryosi nerigo. Kandi mutegaye neritindaluha, imukasabira ababuyirire bosi. 
EPH.6.19	Nage munyisabire, nyibane erihabwa eribuga nerikumbula obuno bwage neritindiubaha erikania ekibisire kyengulu yo wene, 
EPH.6.20	nage ndi mukwenda wayo omo mahulula; nyitulego neritindiubaha, ngoko ritolere inabuga.
EPH.6.21	Nikwa mutoke eriminya engulu yage nebyo ngakola, Tikiko mulikyetu mwanze nomukwenda oyu tesiganiraya omwisi woMukama akandisyabatulira ebyosi. 
EPH.6.22	Yo namatuma okwinywe busana nomwatsi oyu muminye emyatsi yetu, kandi iniatoka eribasikya emitima.
EPH.6.23	Obuholo bubye oko balikyetu, nolwanzo haguma neri kirirya, bikalwa ewoMungu Tata noko Mukama Yesu Kristo. 
EPH.6.24	Olukogo lubye nabosi abakanza oMukama wetu Yesu Kristo nolwanzo olutehola.
PHP.1.1	Paulo na Timoteo, abakobe baKristo Yesu, Oko babuyirire bosi omwisi wa Kristo Yesu abari eFilipi, haguma na abalangiri na bawatikya:
PHP.1.2	Olukogo lubye kwinywe nobuholo obukalwa oko Mungu Tata wetu noko Mukama Yesu Kristo.
PHP.1.3	Ngaha Mungu wage ewasingya omwibibuka ryage ryosi, 
PHP.1.4	emigulu yosi omwisaba ryage ryosi busana ninywe bosi ngasaba nobutseme, 
PHP.1.5	inyine newasingya busana nerisangira ryenyu omo ngulu yenyu eritsuka ekiro kyerimbere nerihika na lino. 
PHP.1.6	Nyinasi ndeke oyo watsuka omubiri owene omwisi wenyu akandisyahikaniago erihika oko kiro kyaYesu Kristo. 
PHP.1.7	Rinatolere inaganirya nyitya busana ninywe bosi, kusangwa muri oko mutima wage, kusangwa mukasangira nage oko lukogo, omo muliki wage nomwilwirirana engulu yowene neriimanirayo. 
PHP.1.8	Kusangwa Mungu ni mulangiri wage, ngoko ngabakwa olukando nolwanzo lwaKristo Yesu. 
PHP.1.9	Erisaba ryage ryeri nyiti, olwanzo lwenyu lukanye akandi na kandi, namenge neriminya ryosi, 
PHP.1.10	imwatoka erisima ebibuya, imwabya bagenge butsira ekyangakungirwa erihika oko kiro kyaKristo, 
PHP.1.11	imuswire nebiguma byeritunganene ebikabanika oko Yesu Kristo, oko lukengerwa neripipa ryoMungu.
PHP.1.12	Nyanzire muminye, balikyetu, ebyo byanyihikako mo byagendagendya engulu yowene, 
PHP.1.13	neryo emiliki yage busana na Kristo moyaminyikala oko basoda bosi nabandi bosi bayo; 
PHP.1.14	kandi hakuhi nabosi babalikyetu mobasika omwisi wo Mukama busana nemiliki yage, kandi mobabya nobulumelume kwilaba eribuga eKinywa kyoMungu nobutubaha.
PHP.1.15	Ega na bandi mobakangirirya Kristo neritsura nobwanise, nikwa abandi noburingikania bowene. 
PHP.1.16	Abenyuma aba bakakola omo lwanzo, ibanasi ko nahirawa hano busana neri lwira engulu yowene; 
PHP.1.17	aberimbere bakakangiriraya Kristo nobwanise, butsira mo kwenene, ibakaganiraya erinyagarya omo miliki yage. 
PHP.1.18	Neryo niki kwehi? Nikwa omo syonzira syosi, kutse omwiteba kutse omo kwenene, Kristo akumayire; umwekyo ngatsema, ega, kandi nganditsema.
PHP.1.19	Kusangwa nyinasi busana nerisaba ryenyu neriwatikya ryeKirimu kya Yesu Kristo byasyanyihindukira omulamu wage. 
PHP.1.20	Ni rinda ryage ryomuhwa namaha wage nyiti sindindisyakwa esisoni na hake, nikwa omo butubaha lino nga kera Kristo iniasikibwa omo mubiri wage, kutse busana nengebe kutse busana noluholo. 
PHP.1.21	Kusangwa busana nage eribyaho ni Kristo, nerihola ni ndundi. 
PHP.1.22	Nikwa ryamabya eribyaho omo mubiri, eryo ni mubiri webiguma busana nage. Nikwa sinyasi ekyo nangayisoga. 
PHP.1.23	Ngahatatanibawa omukati-kati kebibiri. Erisonda ryage ni genda eriyabya na Kristo, kusangwa ekyo kyowene kwilaba. 
PHP.1.24	Nikwa erisigala omo mubiri ryo ritolere kwilaba busana nenyu. 
PHP.1.25	Neriminya eki, nyasi nasyasigala neriikala ninywe bosi, busana neribalolya emuliro nobutseme bwenyu omwikirirya, 
PHP.1.26	neryo omwisi wage imwabana ekye riyipipiramo ndeke omwisi wa Kristo Yesu, busana neriswikala neribahikako kandi.
PHP.1.27	Nikwa emigendere yenyu yibye ngoko ritolere engulu yowene ya Kristo, neryo namasa eribalolako kutse ndeho, inabowa ko mukahangana erisika omo kirimu kiguma, nobu ringikania buguma erilwira haguma busana nerikirirya ryengulu yowene, 
PHP.1.28	neritindiubahibwa omo kindu nesyonzigu syenyu. Eki ni kiminyikalo ndeke kubo kyerihera ryabo, nikwa kwinywe ni kyerilama ryenyu rikalwa oko Mungu. 
PHP.1.29	Kusangwa mwabirihabwa busana na Kristo butsira erimwikirirya risa nikwa eriagalwa busana naye, 
PHP.1.30	imunemolwa amalwa ayo mwalangira ari mwisi wage na lino mukowa ari omwisi wage.
PHP.2.1	Neryo hamabya erisikya omwisi wa Kristo, kutse erisibikya ryolwanzo, kutse erisangira ryeKirimu, kutse eriganyira nolukogo, 
PHP.2.2	muhikanaye obutseme bwage eribya noburingi kania buguma, nolwanzo luguma, eribye nomutima muguma neriganirya iguma. 
PHP.2.3	Simukola kindu nekiguma busana neriyianza kutse eriyipipa, nikwa omwiyikehya muganze mo babuya abandi kwilaba inywe. 
PHP.2.4	Oburi mundu kwinywe sialangire ebindu biwe ibyobyene, nikwa ebindu byabandi. 
PHP.2.5	Mubye noburingikania obu omukati-kati kenyu, obwabya omwisi wa Kristo Yesu: 
PHP.2.6	oyo, nomwanabya nomubiri wo Mungu, mwataganza eriringirirana noMungu nga kindu kyerihamba kutsibu, 
PHP.2.7	nikwa mwayitutula, mwimya omubiri womukobe, neriyirwa omwisosa ryabandu; 
PHP.2.8	neribanika omo mubiri wabandu mwayikehya mwabya akowa erihika oko luholo, ega, oluholo lwomusalaba. 
PHP.2.9	Neryo oMungu mwa muhamya endata mwamuha erina eriri endata komena gosi, 
PHP.2.10	neryo oko rina ryaYesu oburi irwi rimukukamire, omo lubula nomo kihugo nomwisi we kihugo, 
PHP.2.11	noburi lulimi lukangaye ko Yesu Kristo ni Mukama, okwipipa ryoMungu Tata.
PHP.2.12	Neryo, abanze bage, ngoko mwabiriowa endambi yosi, ritya lino, butsira omugulu nyiriho igowene nikwa kwilaba omugulu ndeho, muberereraye erilama ryenyu omubaha neri titimana; 
PHP.2.13	kusangwa ni Mungu oyu kakola omwisi wenyu, erianza nerikola erisonda ribuya riwe. 
PHP.2.14	Mukole emyatsi yosi butsira eriyitonga kutse obuhaka, 
PHP.2.15	imwatoka eribya butsira ekyo mwangakungirwa kandi butsira olubanza, abana boMungu butsira bulema omukati-kati kolulengo luhengemire nolwobu haka, kandi omukati-kati kabo mukakoleraya ngesiseke omo kihugo, 
PHP.2.16	erisikirira eKinywa kyengebe, inatoka eribana ekyo ngayipipiramo oko kiro kyaKristo isinditibitira busa kutse isindiluhira busa. 
PHP.2.17	Nomonanguturirwa oko buhere bweriki rirya ryenyu, ngatsema neritsanga haguma ninywe bosi. 
PHP.2.18	Ritya nenyu mwangatsanga neritsema haguma nage.
PHP.2.19	Indi na maha omwisi woMukama Yesu eribatumako Timoteo luba, inatoka eritsemesibwa nengulu yenyu. 
PHP.2.20	Si ngwite mundu nga ye oyu wangaganirya emyatsi yenyu ndeke. 
PHP.2.21	Abosi bakaganiraya emyatsi yabo, butsira ebyaYesu Kristo. 
PHP.2.22	Nikwa munasi obubuya bwaTimoteo, ngoko mugala nise abirikola haguma nage erigendagendya engulu yowene. 
PHP.2.23	Ngayiketera erimutuma namabiminya ngomwatsi wage asyabya ati; 
PHP.2.24	kandi ngayiketera oMukama nage ko ngandi syasa luba. 
PHP.2.25	Nabiriganirya nga ritolere eribatumira Epafrodito omugala wetu omusangiri womubiri nomusangiri wobusoda, kandi ni mukwenda wenyu nomukoli wobwaga bwage, 
PHP.2.26	kusangwa akanabakandira, nerihahukya omutima kusangwa mwabiriowa kwalwere. 
PHP.2.27	Kwenene abya alwere, hakuhi nerihola. Nikwa oMungu mwamugenyera, nikwa siye iyowene nikwa nage abirinyigenyera, isinangabya nobulige endata oko bundi bulige. 
PHP.2.28	Kikaleka inabya nomuhwa weri mutuma imwatoka eritsema mwamulolako kandi, nage inabya butsira amaganiryo. 
PHP.2.29	Neryo mumukokaye omwise woMukam butsira amaganiryo. Neryo mumukokaye omwisi wo Mukama nobutseme bosi, musikaye abandu ngaba, 
PHP.2.30	ku sangwa mwabya hakuhi nerihola busana nomubiri waKristo, mwatalanda oko ngebe yiwe busana neribugirira omubiri wenyu busana nage.
PHP.3.1	Eribugirira balikyetu, mutseme omo Mukama. Eribasakira emyatsi eyi ngabya ngabasakira sirinyiluhaya, kandi nenyu inabatolere.
PHP.3.2	Muyilebaye busana nesyombwa, muyilebaye busana na bakola nabi, muyilebaye busana nabakayibandanga. 
PHP.3.3	Ku sangwa itwe turi beribana ryekwenene, abakakukamira Mungu omo Kirimu, itukayipipa omwisi wa Kristo Yesu, isituriyike tera omubiri. 
PHP.3.4	Nikwa ingye ngwite ekyeriyiketera omo mubiri. Omundu amaganirya awite ekyeriyiketera omo mubiri, ingye kwilaba: 
PHP.3.5	nabanibawa ekiro kyomunani, owekihanda kyeIsraeli, omo kitunga kyaBenyamina, muEbrania wabaEbrania; omuFarisayo omo bihano, 
PHP.3.6	busana nomuhwa omwendererya wekanisa, busana neritunganene oko bihano isingwite ekyanga kungwa. 
PHP.3.7	Nikwa ebyo byabya ngendundi busana nage, monaganzabyo mwitalya busana na Kristo. 
PHP.3.8	Ega, ngaganza ebindu byosi mwitalya busana nendundi ilabire yeriminya Kristo Yesu Mukama wage. Busana naye nabiritalya ebindu byosi, ngaganzabyo ngebiti, inatoka eribana Kristo mo ndundi 
PHP.3.9	inabanika omwisi wuwe, isingwite eritunganene ryage, eriri oko bihano, nikwa eryo riri omwisi wa Kristo omwikirirya, eritunganene erikalwa ewoMungu omwikirirya; 
PHP.3.10	inatoka erimuminya nobutoki bwerilubuka riwe, nerisangira amagali wuwe, eribya ngaye omo luholo luwe, 
PHP.3.11	inatoka erihika okwilubuka oko baholi.
PHP.3.12	Sinditabana eki kutse sindinahikana; nikwa ngasimbirira erihambakyo mo kyage, busana nekyo Kristo angwatirako. 
PHP.3.13	Balikyetu, sindiganza nga nabiriwata kukyo; nikwa ekiguma ngakola, eribirirwa ebiri nyuma ngasimbirira ebiri emuliro, 
PHP.3.14	ngayitsinga oko lugendo lwerihika oko nduli busana nolu hembo lweribirikira ryendata eryoMungu omwisi wa Kristo Yesu. 
PHP.3.15	Itwe ababirihikana tubye noburingikania obo; kandi omo yindi myatsi mwamabya nobundi buringikania, Mungu asyababisulirabo. 
PHP.3.16	Nikwa aho twabirihika tukwamirire tutya.
PHP.3.17	Balikyetu, munyigerereraye, musamarire abo abakalendera ngolulengo lwetu olo muwite. 
PHP.3.18	Kusangwa bangi, abo naba bwira engendo nyingi na lino ngababwira nemisonia, nyiti bakalendera nge nzigu syomusalaba wa Kristo. 
PHP.3.19	Enduli yabo ni heribwa, omungu wabo ni nda, kandi bakayihalamba omwi soni syabo, bakaganiraya emyatsi ye kihugo. 
PHP.3.20	Nikwa ewetu ni lubula, eyo tukalindirira oMulamya, oMukama Yesu Kristo, 
PHP.3.21	oyu wasyabindula omubiri oyu wetu wobolo eribya ngo mubiri wuwe wolukengerwa, busana nobutoki obo obukaleka iniakinda emyatsi yosi erimowa.
PHP.4.1	Neryo, balikyetu, abo nyanzire nabo ngwire olukando, obutseme bwage, nembita yage, musike mutya omwisi woMukama, abanze bage.
PHP.4.2	Ngagong-gonga Ewodia kandi ngagong-gonga Sintike babye boburingikania buguma omwisi woMukama. 
PHP.4.3	Nawe ngakugo, uwe tusangire nawe kwenene oko mubiri uwatikaye abakali aba, kusangwa babirikola haguma nage omo ngulu yowene haguma na Klementi nabandi abasangiri bomu biri haguma nage, amena wabo asakire omo kitabu kyengebe.
PHP.4.4	Mutseme omwisi woMukama omugulu gosi; kandi nyiti, Mutseme. 
PHP.4.5	Muleke abandu bosi baminye eriyibombeka ryenyu. OMukama ari hakuhi. 
PHP.4.6	Simubye namaganiryo busana nekindu nekiguma, nikwa omo byosi busana nerisaba nerihatikana haguma newasingya muminyisaye oMungu ebyo mukabulaya. 
PHP.4.7	Nobuholo bwoMungu, obulabire eriminya ryosi, bwasyateya emitima yenyu namaringikania wenyu omwisi wa Kristo Yesu.
PHP.4.8	Eribuga, balikyetu, ebyosi ebiri kwenene, ebyosi ebiri byeri sikibwa, nebyosi ebitunganene, nebyosi ebiri bibuya, nebyosi ebyanganzwa, nebyosi ebyerisimwa, hamabya hari ekibuya kilabire, kutse hamabya hari ekyangapipwa, muganiraye emyatsi eyi. 
PHP.4.9	Ebyo mwabiriiga kwingye nebyo mwabiriangi rira nebyo mwabiriowa nebyo mwabirilangira kwingye, muko lebyo, noMungu wobuholo asyabya haguma nenyu.
PHP.4.10	Ngatsema omwisi woMukama kutsibu, kusangwa mwa masala mwaswanyibuka; mwabya imukanyibuka, nikwa mo mwabula omwanya. 
PHP.4.11	Sindibuga nga ngarira eribula ebindu; kusangwa nabiriiga eritsema omo byosi. 
PHP.4.12	Nyinasi erikehibwa, kandi nyinasi erihamibwa; omo myatsi yosi nabiriiga ekibisa mire kyeriuguta neribya nenzala, eribana ebindu neribulabyo. 
PHP.4.13	Ngatoka erikola emyatsi yosi omwisi woyu akamba akagala.
PHP.4.14	Momwanyiyirire ndeke erisangira amalige wage. 
PHP.4.15	Ne nyu abaFilipi munasi okwitsuka ryengulu yowene, omugulu nalwa eMakedonia, sihabya ekanisa eyasangira haguma nage omo mwatsi werihitya nerihabwa nina nywe imwebene; 
PHP.4.16	kusangwa eTesalonika momwanyitumira engendo nguma neyakabiri busana nobwaga bwage. 
PHP.4.17	Butsira eribya nga ngasonda erihitya; nikwa ngasonda ebiguma ebyangakanya busana nendundi yenyu. 
PHP.4.18	Nikwa ngwite ebindu byosi, nokwilaba; nabiriuguta, inabiriangirira uku Epafrodito ebindu mwalebeka, obuhere bukakumba ndeke, obuhere obukahere rawa obukasimawa neritsemesya oMungu. 
PHP.4.19	Kandi Mungu wage asyahikania ebyosi ngo bwaga bwenyu bosi ngobusoki omo lukengerwa omwisi wa Kristo Yesu. 
PHP.4.20	Olukengerwa lubye oko Mungu wetu na Tata busana na kera na kera. Bibye bitya.
PHP.4.21	Mubukaye oburi mubuyirire omwisi wa Kristo Yesu. Abali kyetu abari haguma nage bakababukaya. 
PHP.4.22	Ababuyirire bosi bakababukaya, nabenyumba ya Kaisari kutsibu.
PHP.4.23	Olukogo lwoMukama Yesu Kristo lubye nekirimu kyenyu.
COL.1.1	Paulo, omukwenda wa Kristo Yesu okwisonda ryoMungu, na Timoteo mugala wetu,
COL.1.2	Oko babuyirire balikyetu abatesiganiraya omwisi wa Kristo eKolosai:
COL.1.2	Olukogo nobuholo bibye kwinywe erilwa oko Mungu Tata wetu.
COL.1.3	Tukaha wasingya emigulu yosi oko Mungu, Tata wo Mukama wetu Yesu Kristo, omugulu tukabasabira, 
COL.1.4	ku sangwa twabiriowa erikirirya ryenyu omwisi wa Kristo Yesu nolwanzo olo muri nalo busana nababuyirire bosi, 
COL.1.5	busana namaha ago mwabiribikirwa elubula. Mwabiriowa eki erimbere omo kinywa kyekwenene, engulu yowene 
COL.1.6	eyabiribahikako, ngomo kihugo kyosi ikabuta ebiguma kandi ikakula itya omukati-kati kenyu, eritsuka ekiro mowa neriminya olukogo loMungu omo kwenene, 
COL.1.7	ngoko mwigayo ku Epafra omu gombe mwanze wetu. Iye ni mukwenda wa Kristo oyu tesiganiraya busana netu, 
COL.1.8	abirituminyisya olwanzo lwenyu omwisi weKirimu.
COL.1.9	Neryo eritsuka ekiro towayo, sitwetumbya eribasabira, tuti musulibawe neriminya ryerisonda riwe omo menge gosi weki rimu neriminya, 
COL.1.10	mulendere ngoko ritolere oko Mukama, erimutsemesya ndeke, eributa ebiguma omo buri mubiri owene nerikanya omwiminya Mungu. 
COL.1.11	Mubane akagala omo butoki bosi, ngamaka wuwe wolukengerwa, busana nerisika ryosi neritindaluha haguma nobutseme, 
COL.1.12	eriha ewasingya oko Tata, oyo waleka itwasangira omwandu wababuyirire omo kyakakala. 
