LUK.6.8	Nikwa mwaminya oburingikania bwabo, mwabwira omundu owoku boko kumire ati, Wase uhangane hano. Naye mwahangana mwimanaho. 
LUK.6.9	Yesu mwabwirabo ati, Ngababulaya nyiti, Rinatolere omo bihano erikola bibuya omo sabato kutse erikola nabi, erilamya engebe kutse eriheryayo kwehi? 
LUK.6.10	Neryo mwatimbya ameso oko bosi, mwamubwira ati, Kakaya okuboko kwawe. Naye mwakola atya, nokuboko kuwe mokwasuba. 
LUK.6.11	Nikwa mobakarama mobakanirya haguma ekyo bangakola Yesu.
LUK.6.12	Noko biro ebyo mwaya oko kitwa erisaba; nomo kiro kyosi mobwakya inianemosaba oMungu. 
LUK.6.13	Bwabere bwakya mwabirikira abiga buwe mwayisoga kubo erikumi nababiri, mwahulabo mobakwenda; 
LUK.6.14	Simoni, oyo ahula mo Petero, na Anderea, mugala wabo, na Yakobo na Yoane, na Filipo, na Bartolomayo, 
LUK.6.15	na Matayo, na Tomasi, na Yakobo, mugala wa Alofayo, na Simoni oyo wahulawa mo Zelote, 
LUK.6.16	na Yuda, omugala wa Yakobo, na Yuda Iskariota, oyo wabya muhoteri. 
LUK.6.17	Neryo mwandagala haguma nabo mwahangana ahabondere, haguma nendeko nene yabiga buwe nendeko nene ya bandu abalwa eYudea hosi neYerusalema noko mukokoro weTiro neSidona, abasa nerimuhulikirira nerilamibwa kwesyondwala syabo; 
LUK.6.18	nabagalawa nebirimu bibi mobalamibwa. 
LUK.6.19	Ne­ndeko yosi moyasonda erimutulako, kusangwa akagala moka mulwako mokalamya bosi.
LUK.6.20	Neryo mwasumba ameso wuwe oko biga buwe, mwabuga ati: Omuyisa ari kwinywe abera, kusangwa obwami bwoMungu ni bwenyu.
LUK.6.21	Omuyisa ari kwinywe mukakwa enzala lino, kusangwa mukandisyugutibwa. Omuyisa ari kwinywe muka rira lino, kusangwa mukandisyaseka. 
LUK.6.22	Omuyisa ari kwinywe omugulu abandu bakabakwa obusu, nomugulu bakabagabula kubo neribatsuma, nerigusa erina ryenyu ngibi, busana no Mugala womundu! 
LUK.6.23	Mutseme ekiro ekyo, muyisumbe omo butseme, kusangwa lebaya, oluhembo lwenyu ni lungi omo lubula; kusangwa ritya abotata wabo bakola abaminyereri. 
LUK.6.24	Nikwa obulige kwinywe bebindu, kusangwa mwabiribana erisibikya ryenyu. 
LUK.6.25	Obulige kwinywe mwabiriuguta lino, kusangwa mwasyawira. Obulige kwinywe mukaseka lino, kusangwa mwasyasusumana neririra. 
LUK.6.26	Obulige kwinywe, omugulu abandu bosi basyabahula ndeke, kusangwa batya abotata wabo mobayira abaminyereri bamabihi.
LUK.6.27	Nikwa ngabuga nenyu mukowa nyiti, Mwanze esyonzigu syenyu, mukolere ndeke abakabakwa obusu, 
LUK.6.28	Mutsumule abakabatakira, musabire abakabakolera nabi nepono. 
LUK.6.29	Oyu kakuswiraya okwitema, umubindulire eryakabiri; noyu kaku sagula ekanzu yawe isiwamukaga nerikoti ryawe nibya. 
LUK.6.30	Uhe oko buri mundu oyu kakusaba; noyu kakusagula ebindu byawe, suswemubulayabyo kandi. 
LUK.6.31	Ngoko mwanzire bandu ibaba kolera nenyu mukolebo mutya. 
LUK.6.32	Mwamanza ababanzire, muri eriuwania ryahi kwehi? Kusangwa abakolanabi bakanza abanzirebo. 
LUK.6.33	Mwamakola ndeke abakabayira ndeke, muri eriuwania ryahi kwehi? Kusangwa abakolanabi nabo bakakola batya. 
LUK.6.34	Mwamabweka bandu imune namaha weriswatuhwa, imuri eriuwania ryahi kwehi? Abakolanabi nabo bakabweka oko bakola nabi, ibaswatuhwa ebiringene nabyo. 
LUK.6.35	Nikwa mwanze esyonzigu syenyu, muyire ebibuya, mubweke, simu sonde eribwekulwa; nebihembo byenyu byasyabya binene, nenyu mwasyabya abagala boyu wEndata Kutsibu; kusangwa ni mwenge oko batesima nabahemu. 
LUK.6.36	Mubye neriganyira ngoko Tata wenyu ari neriganyira. 
LUK.6.37	Simutswere, nenyu simwendisyatswerwa; Simutswere mutesasira, nenyu simwe ndisyatswerwa lubi; mubuyire, nenyu mwasyabuyirwa; 
LUK.6.38	mu hitaye, nenyu mwasyahabwa; olulengo luwene, olusokire, olutsingatsingirye, oluri kwomutswabo, wasyabagaliralo. Ku sangwa olulengo olo mukalenga mwasyalengerwalo.
LUK.6.39	Kandi mwabwirabo omusyo: ati, Endimatime yangatoka erisondola endimatime kwehi? Ababiri sibendisyatogera omo bohya kwehi? 
LUK.6.40	Omwiga sialengire omwigisya wuwe, nikwa oburi mundu
LUK.6.40	oyu kigisibawa ndeke asyabya ngo mwigisya wuwe. 
LUK.6.41	Busana nako ukalangira akati akari omo riso rya mugala wenyu, nikwa surihenga ekitika kiri omo riso ryawe kwehi? 
LUK.6.42	Kutse ukabuga na mugala wenyu uti, Mugala wetu taleka nyilole akati ako kari omo riso ryawe, nawe utetalebya ekitika ekiri omo riso ryawe kwehi? Uwe mutebya, tatsuka erilusya ekitika ekiri omo riso ryawe, neryo iwalangira ndeke erilola akati akari omo riso rya mugala wenyu. 
LUK.6.43	Kusangwa sihari muti uwene owakabuta ebiguma bibi, kutse kandi sihari omuti mubi owakabuta ebiguma byuwene; 
LUK.6.44	kusangwa oburi muti akaminyikala busana nebiguma byago. Kusangwa biguma byemitini sibiriohawa oko misakisaki, kutse ebiguma byebinyu sibiriohawa oko muti wamahwa. 
LUK.6.45	Omundu mubuya omo bindu bibuya bikalwa omo mutima wuwe akahulukaya ebibuya, nomundu mubi omo bindu bibi byomutima wuwe akahulukaya ebibi; kusangwa obuno bukabuga ebyoswire omo mutima.
LUK.6.46	Busana naki mukanyahula mo Mukama, Mukama, isi mwekola ebyo ngababwira kwehi? 
LUK.6.47	Oburi mundu ukasa kwingye akowa ebinywa byage akakolabyo, ngandikangya kwasosire: 
LUK.6.48	asosire ngo mundu oyu kahimba enyumba, oyo watakula omwisi hali, mwahira ekibanza okwibwe; nomugulu erigunga ryamagetse ryasa, olusi molwayiswirya oko nyumba eyo, molutasukasukanyayo, kusangwa ihimbire ndeke. 
LUK.6.49	Nikwa oyu kowa atekolabyo ari ngo mundu oyo wahimba enyumba oko kitaka butsira ekibanza; nolusi molwayiswirya kuyo, neryo-neryo moyatera, nerihera ryenyumba eyo mo ryabya inene.
LUK.7.1	Neryo abere abibuga ebinywa biwe byosi omo matwi wabo abamowa mwingire eKapernaumu. 
LUK.7.2	Nikwa habya omu­kulu wabasoda iniawite omukobe oyo abya anzire kutsibu, abya alwere hakuhi nerihola. 
LUK.7.3	Omugulu owa engulu ya Yesu, mwamutuma kwa bakulu babaYuda erimugonga-gonga ati ase alamaye omukobe wuwe. 
LUK.7.4	Nomugulu bahika uku Yesu, mobamugonga-gonga kutsibu, bati, Atolere iwamukolera eki, 
LUK.7.5	kusangwa anzire ekihanda kyetu, kandi abirituhimbira enyumba yetu yerihindana. 
LUK.7.6	Neryo Yesu mwagenda nabo. Abere ahika hakuhi nenyumba, omukulu wabasoda mwamu tumako abira buwe, ati, Mukama suyiluhaye, kusangwa sinyi tolere ukingira omo nyumba yage; 
LUK.7.7	kyaleka inaringikania ko nyitatolere erikuhikako. Nikwa ubuge eKinywa kisa, omukobe wage abane erilamibwa. 
LUK.7.8	Kusangwa nage ndi mundu weha muli, ngwite abasoda abo ngategeka: ngabuga nomuguma oyu nyiti Genda, iniagenda; noko gundi, Asa, iniasa; noko mukobe wage nyiti, Koleki, iniakolakyo. 
LUK.7.9	Omugulu Yesu owa ebi mwamuswekera, mwakeba mwabuga nendeko eyamukwama, ati, Ngababwira, nyiti sinditabana erikirirya eririgene neri kutse omo Israeli. 
LUK.7.10	Abatumawa babere basuba omo nyumba, mobeya omukobe oyo iniabirilama.
LUK.7.11	Enyuma waho akatambi kake mwaya oko muyi owaka hulawa mo Naina, nabiga buwe nabandu bangi mobagenda naye. 
LUK.7.12	Neryo omugulu ahika hakuhi neririmbo ryomuyi, lebaya, habya oyu holire iniahekirwe erihulukiribwa ekyaswa, ini mugala iyo nyinya anabutire iyowene, naye abya mukwakali; na bandu bangi abeka babya haguma naye. 
LUK.7.13	OMukama abere amulolako, Mwamuganyira mwabuga naye ati, Surire. 
LUK.7.14	Neryo mwasa mwatula okwisanduku eriri mwe kinda, nabamuhekire mobahangana. Neryo mwabuga ati, Mulwana, ngakubwira, nyiti, Hangana. 
LUK.7.15	Nomuholi mwikala, mwatsuka eribuga. Neryo mwamuha nyinya wuwe. 
LUK.7.16	Neriubaha moryahika kubo abosi; mobakenga Mungu mobabuga bati, oMuminyereri munene abiribanika omukati-kati ketu! Kandi Mungu amabisyabana abandu biwe! 
LUK.7.17	Nengulu eyi yiwe moyagendagenda omo Yudea hosi ne kihugo ekyo kihererenye naho.
LUK.7.18	Nabiga ba Yoane mobamubwira emyatsi eyi yosi. 
LUK.7.19	Na Yoane, mwabirikira abiga buwe babiri, mwatumabo oko Mukama ati, Nina we oyu kasa, kutse tulindirire ogundi kwehi? 
LUK.7.20	Nabandu abo babere babimuhikako, mobabuga bati, Yoane Mubatisa amatutuma ukuwe, ati, Ni we oyu kasa, kutse tulindirire ogundi kwehi? 
LUK.7.21	Noko ndambi eyo mwa lamya bangi bamakoni nesyondwala nyibi nebirimu bibi, nesyondimatime nyingi mwahasyo erilangira. 
LUK.7.22	Neryo mwa­subiryabo ati, Mugende mubwire Yoane ebyo mwamalolako nebyo mwamowa: esyondimatime sikabana erilangira ryasyo, ebilema birimugenda, abahaga bameribwa, abatsiha bakowa, abaholi barimulubukibwa, nabera barimutulirwa engulu yo wene. 
LUK.7.23	Nomuyisa ari kwoyu tindasyatwikala busana nage.
LUK.7.24	Nabakwenda ba Yoane babere bagenda, mwatsuka eribuga nesyondeko busana na Yoane, ati, Mwaya omo mbwarara erilola kuki kwehi? Olubingo olukatengatenganibawa neri hunga kwehi? 
LUK.7.25	Nikwa mwayayo erilola kuki kwehi? Omundu wambite esyongimba nyolo-nyolo kwehi? Lebaya, abambite esyongimba sikangabenie nabakarya ebibuya, bari omo bibuga byabami. 
LUK.7.26	Ko mwayayo erilola kuki kwehi? OMuminyereri kwehi? Ega, ngababwira, na kwilaba omu minyereri. 
LUK.7.27	Yoyu kisakire busana naye kiti, Lebaya, ngatuma omukwenda wage embere syobusu bwawe, Oyo wasyakokotya enzira yawe embere syawe. 
LUK.7.28	Ngababwira nyiti, Kwabo ababutawa na bakali sihari oyu lengire Yoane; nikwa omuke kutsibu omo bwami bwoMungu amulengire. 
LUK.7.29	(Omugulu bowa ebi abandu bosi nabasolesya mobaganza Mungu kwari weritunganene, kusangwa ibamabibatisibwa na Yoane; 
LUK.7.30	nikwa abaFarisayo nabimiri byebihano mobagana erisonda ryoMungu busana nabo, isibetabatisibwa naye.) 
LUK.7.31	Nikwa nasyaringirirania abandu bolulengo olu naki kwehi? Kandi basosireki kwehi? 
LUK.7.32	Baringene nga bana abikere omwiguriro abakabirikirana bati, Turiababuhira erirenga, momutetasata; Motwasusumana, nenyu momutetarira. 
LUK.7.33	Kusangwa Yoane Mubatisa mwasa isiarirya obundu neritendipula ebinyu; nenyu mukabuga muti, Ari kwembinga. 
LUK.7.34	OMugala wo mundu mwasa iniakarya neripulya; nenyu muti, Lebaya, omuri webingi nomukundirya, omwira wa basolesya nabakola nabi! 
LUK.7.35	Nikwa amenge akayirawa mo atunganene busana nabana bago bosi.
LUK.7.36	Omuguma mwamubirikirira erirya haguma naye, naye mwaya omo nyumba yomuFarisayo oyo, mwikala okwirya. 
LUK.7.37	Neryo lebaya omukali womuyi oyo, abya mukola nabi, abere aminya kwikere okwirya omo nyumba yomuFarisayo oyo, mwaleta eritambya ryowenenga ryamaguta owakakumba ndeke, 
LUK.7.38	mwimana enyuma kwiye hakuhi nebisandu biwe, akarira, mwatsuka eritsapya ebisandu biwe nemisonia yiwe, nerisangulabyo mo nzwire syomutwe wuwe, neriryatsirira ebisandu biwe, nerihakabyabyo na maguta ayo. 
LUK.7.39	Nikwa omugulu omuFarisayo oyo wamubirikira abere alangira ekyo, mwayibwira omwisi wuwe ati, Kumbe mundu oyu alwe mu minyereri, kumbe abiriminya omusindo womukali oyu kamu tulako, kusangwa ni mukola nabi. 
LUK.7.40	Yesu mwasubirya mwabuga naye ati, Simoni, ngwite ekyerikubwira. Naye ati, Mukangirirya, Buga, 
LUK.7.41	Omubweki muguma abya na babiri bari nomwinda; omuguma iniari momwinda wa syofaranka amagana atanu, nogundi amakumi atanu. 
LUK.7.42	Omugulu babula ebyerituha, mwabuyira ababiri bosi. Nikwa nindi wakubo wasyamwanza kwilaba kwehi? 
LUK.7.43	Simoni mwasubirya ati, Mbino oyo abuyira bingi. Neryo mwabuga naye ati, Wama tswera ndeke. 
LUK.7.44	Neryo mwakebera omukali mwabwira Simoni ati, Wamalangira omukali oyu kwehi? Mongingira omo nyumba yawe, mutetamba amagetse busana nebisandu byage, nikwa iye abiritsapya ebisandu byage omo misonia abirisangu labyo nesyonzwiri siwe. 
LUK.7.45	Suritamba eriryatsirira, nikwa eritsuka omugulu indingira siaritombya eriryatsirira ebisandu byage. 
LUK.7.46	Mutetahakabya omutwe wage amaguta, nikwa iye abirihakabya bisandu byage omo malasi. 
LUK.7.47	Kikaleka inaku bwira nyiti, ebibi biwe, ni bingi, byabiribuyirwa, kusangwa abirianza kutsibu; nikwa oyu kabuyirawa bike, akanza hake. 
LUK.7.48	Neryo mwabuga naye ati, Ebibi byawe byamabibuyirwa. 
LUK.7.49	Neryo ababya okwirya haguma naye mobatsuka eriyitonga omukati-kati kabo bati, Oyu ni ndi oyu kabuyira ebibi nibya kwehi? 
LUK.7.50	Neryo mwabwira omukali ati, Erikirirya ryawe ryamakulamya; Ugende nobuholo.
LUK.8.1	Enyuma kwaho hake mwalaba omo miyi nehiyi, eritulago nerileta engulu yowene yobwami bwoMungu. Nerikumi nababiri babya haguma naye, 
LUK.8.2	nibya abandi bakali abalamibawa kwe birimu bibi nesyondwala: ye Maria oyu kahulawa mo Magdalene, oyo walusibawa kwesyombinga sirinda, 
LUK.8.3	na Yoana, muka Kuza, mubiki webindu byeHerode, na Suzana, nabandi bangi ababya bakamuwatikya omo bindu byabo.
LUK.8.4	Omugulu endeko nene nabandu bakalwa oko buri muyi bahindana ahabya, mwatwirabo omusyo ati: 
LUK.8.5	Omubibimwaya biba embuto yiwe; nomugulu abiba, esindi mosyawa omo nzira, mosyalyatangirirwa, nesyonyoyu syomo kyanya mosyatolasyo. 
LUK.8.6	Nesindi mosyawa okwibwe; nomugulu syalasa, mosyoma, kusangwa syabula amagetsi. 
LUK.8.7	Nesindi mosyawa omo mahwa; namahwa mwalasa haguma nasyo mwanigasyo. 
LUK.8.8	Nesindi mosyawa omo kitaka kyowene mosya lasa, neributa esyombuto erigana. Abere akabuga ebi, mwa birikira ati, Oyu wite amatwi weriowa, owe.
LUK.8.9	Kandi abiga buwe mobamubulya ngo musyo oyo akahulaki, 
LUK.8.10	Naye mwabuga ati, Mwabirihabwa eriminya ebibisamire byobwami bwoMungu; nikwa busana nabandi biri mo misyo, erilangira sibalangire, neriowa sibaminye. 
LUK.8.11	Nikwa omusyo woyu: Embuto kye kinywa kyoMungu. 
LUK.8.12	Abo monzira ba babiriowa; neryo Satani ikasa nerilusya eKinywa omo mitima yabo, ibatatoka erikirirya nerilamibwa. 
LUK.8.13	Nabo okwibwe babo omugulu bakowa eKinywa, bakangirirakyo nobutseme; nikwa sibawite emirihi, bakikiriraya akatambi kake noko mugulu werilengwako bakatswa. 
LUK.8.14	Nesyawa omo mahwa, ba bakowa, nikwa babiyigendera ibanigwa omo maganiryo nebindu neriyitsemesya ryengebe eyi, nebiguma byabo ibitera. 
LUK.8.15	Neyo ko kitaka kyowene, babo abakowa eKinywa, bakahambakyo ndeke omo mutima owakwenene ogowene, ibabuta biguma neritindaluha.
LUK.8.16	Sihari oyu kakaya oluseke akakuningiralo omwirega kutse erihiralo omwisi wengingo, nikwa akahiralo oko butara, abakingira ibatoka erilangira ekyakakala. 
LUK.8.17	Kusangwa sihari ekibisamire ekitindasyaminyikalibwa, kutse sihari kindu ekibu rirene ekitindasyaminywa nerihika omokyakakala. 
LUK.8.18	Mulebaye ngoko mukowa; kusangwa oyu wite asyahabwa ebindi, noyu tawite asyasagulwa ebyo akaganiraya ati awite.
LUK.8.19	Neryo nyinya wuwe nabagala babo mobamunikako, nikwa mobatatoka busana nendeko. 
LUK.8.20	Neryo mwabwirwa bati, Koyo wawe nabagala benyu banahangene ahihya, bakasonda eriku lolako. 
LUK.8.21	Nikwa mwabuga nabo ati, Koyo wage na bagala betu banabo abakowa eKinywa kyoMungu nerikolakyo.
LUK.8.22	Neryo ekiro kiguma mwingira omo bwato haguma nabiga buwe, neryo mwabuga nabo ati, Tusokere eyisirya wengetsi. Neryo mobahongoka, 
LUK.8.23	Babere banemotarikya iye mwayato. Nekikomo mokyandagala omo ngetsi nabo mobasonda eriusula mwa magetse, ibakahwa. 
LUK.8.24	Neryo mobaya mubukya bati, Mukama, Mukama, tukahwa! Naye mwabuka mwakunga ekihunga nerikarama ryebisunda; nabyo mobyumbya, mohabya isyerere. 
LUK.8.25	Naye mwabuga nabo ati, Erikirirya ryenyu riri hahi kwehi? Nabo mobubaha, mobasweka, mobabwirana bati, Oyu ni mundundi oyu kategeka erihunga namagetsi, ibyamowa kwehi?
LUK.8.26	Neryo mobahika omo kihugo kyabaGerase, ekiri eyisiria weGalilaya. 
LUK.8.27	Neryo abere akalwa mubo ahika oko kitaka omundu mwahindana naye akalwa oko muyi iniari kwesyo mbinga; kusangwa oko mugulu muli isiariambala olukimba, isiaribya omo nyumba nikwa omukati-kati kesisinda. 
LUK.8.28	Abere alola uku Yesu, mwabirikira mwawa ahisi embere siwe, mwa buga nomulenge munene ati, Ukanyiyira uti, Yesu, Mugala woMungu wEndata Kutsibu kwehi? Ngakugo, sunyagalaye. 
LUK.8.29	Kusangwa iniamabitegeka ekirimu kibi ekyo ati kilwe omo mundu oyo. (Kusangwa engendo nyingi kika muhamba; iniakategibawa, neribohwa omo mahulula nemisege, nikwa mwatwa emisege eyo mwatsurumibwa nembinga eyo omo mbwarara.) 
LUK.8.30	Neryo Yesu mwamubulya ati, Erina ryawe uwendi kwehi? Naye mwabuga ati, Emilondo; kusangwa esyombinga nyingi isyamabimuhikako. 
LUK.8.31	Mosyamugonga gonga siti siategekesyo eriya omo kyuna. 
LUK.8.32	Nikwa ekihyo kinene kyesyongurube kyabya ikikarira oko kitwa; nasyo mobyamugo-ngagonga eriingira musyo. Naye mwahasyo eha muri erigenda. 
LUK.8.33	Neryo esyombinga mosyalwa oko mundu oyo mosingira omo syongurube, nekihyo mokyatibita aha senzegerere erihika omo ngetsi mosyasenda. 
LUK.8.34	Abalisya babere balangira ekyamabya, mobatibita, mobatulago eka nomo kihugo. 
LUK.8.35	Neryo abandu mobayalebya ekyamabya, mobahika aho Yesu abya, mobeya omundu oyo walwa kwesyombinga inianikere oko bisandu bya Yesu, inianambite iniabiriswabya namenge wuwe; mobubaha. 
LUK.8.36	Nabalola kukyo mobabwirabo ngoko oyu lwe kwesyombinga arialamibawa. 
LUK.8.37	Neryo abandu bosi abe kihugo kyebaGerase ekitimbireho mobamubulya bati, alwe kubo; kusangwa mobakwa obuba bungi; neryo mwingira omo bwato mwasubula. 
LUK.8.38	Nomundu oyu walwa kwesyombinga mwamugonga-gonga ati abye naye; nikwa mwalagana naye ati, 
LUK.8.39	Suba eka ewawe, utulego ebinene ebyo Mungu abirikukolera. Neryo mwagenda, eritulago omo muyi gosi ebinene ebyo Yesu abirimukolera.
LUK.8.40	Nikwa omugulu Yesu asubula, endeko moyamukokya, kusangwa abosi babya ibakamulindirira. 
LUK.8.41	Kandi lebaya mohasa omundu oyu kahulawa mo Yairo, oyo wabya omurongani wenyumba yerihindana; neriwa oko bisandu bya Yesu mwamugonga-gonga ati, aye omo nyumba yiwe, 
LUK.8.42	kusangwa abya awite mwali iyanabutire iyowene, erikula riwe inirya mituta ngikumi nibiri, abya iniakalekula. Nikwa omugulu agenda, abandu mobamuhatatania.
LUK.8.43	Nomukali oyo wabya akwire erisenda ryomusasi emituta ikumi nibiri oyo wabiribuyira ebindu biwe byosi oko basaki, mwatatoka erilamibwa nomundu, 
LUK.8.44	mwasa enyuma kwiye, mwatula oko ndambi yolukimbe luwe; neryo-neryo erisenda riwe ryomusasi moryumbya. 
LUK.8.45	Yesu mwabuga ati, Nindi wamanyitulako kwehi? Omugulu abosi bayigana, Petero mwa buga ati, Mukama, esyondeko sikakutimbako nerikuhatatania! 
LUK.8.46	Nikwa Yesu mwabuga ati, Omundu amanyitulako; kusangwa namaminya kwa kagala kamabinyilwako. 
LUK.8.47	Omukali abere alangira kwatabisamire, mwasa akatitimana, mwawa ahisi embere siwe mwatulago embere syabandu bosi ekirialeka iniamutulako, kandi ngoko ainalamibwa neryo-neryo. 
LUK.8.48	Neryo mwabuga naye, Mwali, erikirirya ryawe ryamabikulamya; ugende obuholo.
LUK.8.49	Nomugulu abya akabuga, mohasa omundu akalwa omo nyumba yomurongani wenyumba yerihindana ati, Mwali wawe aholire; suluhaye Mukangirirya kandi. 
LUK.8.50	Nikwa Yesu mowa ekyo mwamusubirya ati, Sigubahe; wikiriraye risa akandilama. 
LUK.8.51	Abere ahika oko nyumba, mwataliga mundu akingira haguma naye, nina Petero na Yoane na Yakobo, nise womwana na nyinya. 
LUK.8.52	Nabosi babya bakarira nerimususumanira; nikwa mwabuga ati, simurire; kusangwa siaholire nikwa agotsere. 
LUK.8.53	Nabo mobamusekererya, ibanasi kwaholire. 
LUK.8.54	Nikwa mwa muwata oko byala mwabirikira, ati, Mwana, hangana. 
LUK.8.55	Nekirimu kiwe mokyasubula, neryo-neryo mwahangana; neryo mwategekabo ati bamuhe ebyerirya. 
LUK.8.56	Neryo abamubuta mobasweka; nikwa mwategekabo ati sibabwire omundu ebya makolwa.
LUK.9.1	Kandi mwabirikira erikumi na babiri mwahindanyabo mwahabo amaka nehamuli oko syombinga syosi nerilamya amakoni, 
LUK.9.2	mwatumabo eritula omwatsi wobwamibwo Mungu nerilamya abakoni. 
LUK.9.3	Neryo mwabuga nabo ati, Simuheke kindu busana nolugendo lwenyu, kutse mutso, kutse engunza, kutse obundu, kutse esyofaranka; kandi simubye nesyokanzu ibiri. 
LUK.9.4	Nenyumba yahi mwasingiramo, mwikalemo, erihika aho mwasyalwirayo. 
LUK.9.5	Naho ehosi bakagana eribakokya, omugulu mukalwa omo muyi oyo mukungute olututu omo bisandu byenyu ngo mulangiri kubo. 
LUK.9.6	Neryo mobalwayo mobalaba omo hiyi, neritula engulu yowene nerilamya abehosi.
LUK.9.7	Nikwa oMwami Herode mowa ebyosi byakolawa, mwa hangahangya kusangwa mokyabugwa ambu Yoane abirilubu kibwa oko baholi, 
LUK.9.8	nabandi bati Elia abiriswahuluka, nabandi bati omuguma wokobaminyereri bakera yo walubukire. 
LUK.9.9	Herode mwabuga ati, Yoane monamutwa ko mutwe; nikwa oyo nindi oyo namowa kwemyatsi eyi kwehi? Nikwa mwa sonda erimulolako.
LUK.9.10	Neryo omugulu abakwenda basubula mobamubwira emyatsi eyo bakola. Naye mwatwalabo bobene oko muyi owakahulawa mo Betesaida. 
LUK.9.11	Nesyondeko syabere syaminya, mosyamukwama; naye mwakokyabo mwatulirabo ebyobwami bwoMungu, mwalamya ababya nobwaga bwerilamibwa. 
LUK.9.12	Nikwa bwabere bwasonda erihumbera; erikumi nababiri mobamuhikako bati, Ulagane nendeko, bagende omo hiyi nomo kihugo ekihererenie naho, erigotsera neribana akaryo; kusangwa turi mo kisuki. 
LUK.9.13	Nikwa mwabwirabo ati, Muhebo akerirya. Nabo mobabuga bati, Situwite ebindi wana mandu atanu namahere abiri—twamatindaya gula ebyalya busana nabandu aba bosi. 
LUK.9.14	Kusangwa habya abalume nga maelfu atanu. Naye mwabuga nabiga buwe ati, Mwikalayebo mondekondeko amakumi atanu-atanu. 
LUK.9.15	Nabo mobakola batya, mobikalya bosi. 
LUK.9.16	Neryo mwimya amandu atanu namahere abiri mwalalamira elubula, mwatsumulabyo mwata hangulabyo, mwahabyo oko biga bahirebyo emuliro wendeko. 
LUK.9.17	Nabosi mobarya mobuguta. Moba-songa-songya ebyasaka, ebitiri ikumi nebibiri byebitahangukira.
LUK.9.18	Nikwa omugulu abya akasaba iyowene abiga babya haguma naye; neryo mwabulyabo ati, Abandu bakabuga bati, Ingyendikwehi? 
LUK.9.19	Mobamusubirya bati, Yoane Mubatisa; nikwa abandi bati, Elia; nabandi, bati muguma woko bami nyereri bakera abirilubuka. 
LUK.9.20	Naye mwabuga nabo ati, Nikwa nenyu mukabuga muti ingye ndi kwehi? Petero mwasubirya ati, Kristo woMungu. 
LUK.9.21	Nikwa mwahanabo mwategekabo ati sibabwire mundu mwatsi oyu, 
LUK.9.22	ati, oMugala womundu atolere eriagalwa omo myatsi mingi, neriganwa na bakulu nabahereri bakulu nabasaki, initwa, nerilubukibwa ekiro kyebisatu.
LUK.9.23	Kandi mwabuga nabosi ati, Omundu amasonda eri ngwama, ayigane aheke omusalaba wuwe ebiro byosi angwame. 
LUK.9.24	Kusangwa oyu kasonda erilamya engebe yiwe asyatalyayo; noyu katalaya engebe yiwe busana nage, asyalamyayo. 
LUK.9.25	Ku sangwa ni ndundi yahi oko mundu amabana e kihugo kyosi akayitalya kwehi? 
LUK.9.26	Kusangwa oyu kakwa esisoni busana nage na busana nebinywa byage, oMugala womundu asyakwa esisoni busana naye omugulu asyasa omo lukengerwa luwe nolukengerwa lwise wuwe nolwa balaika babuyirire. 
LUK.9.27	Nikwa ngababwira kwenene, hari bandi oko bahangene hano aba tindisyagerya oluholo batebalangira obwami bwoMungu.
LUK.9.28	Kandi enyuma weribuga ebi ngebiro munani byamabikya mwatwala haguma naye Petero na Yoane na Yakobo, mwahe tukira oko kitwa erisaba. 
LUK.9.29	Abere anemosaba, erisosa ryobusu buwe moryahinduka, nesyongimba siwe mosyahenia nerika ngabania. 
LUK.9.30	Kandi lebaya, bandu babiri mobakania naye, babya ye Musa na Elia, 
LUK.9.31	ababutuka nolukengerwa ibakaka naya omwatsi woluholo luwe olo akandisyaberererya eYerusa lema. 
LUK.9.32	Nikwa Petero nababya naye mobayitsingirako notugotseri nikwa isibetayato, mobalangira olukengerwa luwe nabandu babiri ababya bahangene haguma naye. 
LUK.9.33	Nomugulu abandu abo basonda erigabana naye. Petero mwabuga na Yesu ati, Mukama, Ryowene itwe turi hano; tuhimbe ehinyumba hisatu, akaguma busana nawe, na kandi busana na Musa, na kandi busana na Elia—isiasi ekyo akabuga. 
LUK.9.34	Abere anemobuga ebi, ekitu mokyasa mokyasukulirabo; nabo mobubaha omugulu bingira omo kitu. 
LUK.9.35	Nomulenge mwalwa omo kitu, ati, Oyu ni Mugala wage, Musombolwa wage; momowe! 
LUK.9.36	Nomulenge abere abibuga, Yesu mwabanikaho iyowene. Nabo mobabya bukutu mobatabwira omundu emyatsi eyo balangira.
LUK.9.37	Nomungyakya, babere babiandagala oko kitwa, endeko nene moyahindana naye. 
LUK.9.38	Lebaya, omundu wokondeko mwabuga nomulenge munene ati, Mukangirirya, ngakugonga gonga ulebaye mugala wage, kusangwa yonambutire iyowene; 
LUK.9.39	kandi lebaya, ekirimu kikamuhamba, inialaka; kikamusala salaya iniabimbya erihulo, kikamuhunza, sikirimuleka luba. 
LUK.9.40	Monagonga-gonga abiga bawe nyiti baguse kyeyihya, mobataluka. 
LUK.9.41	Yesu mwasubirya ati, Inywe lulengo lweriti ndiikirirya nolwobuhaka, nasikala nenyu omugulu gungahi neribabegerya kwehi? Ulete omugala wawe yo hano. 
LUK.9.42	Neryo abere anemwasa embinga moyamusatya moyamusalasalya. Nikwa Yesu mwakunga ekirimu kibi ekyo, mwalamya omu lwana, mwamusubya kwise wuwe. 
LUK.9.43	Nabosi mobaswekera obukulu bwoMungu. Nikwa omugulu barimusweka busana nemyatsi yosi akola, mwabuga nabiga buwe ati, 
LUK.9.44	Muhire ebinywa ebi omu matwi wenyu; kusangwa Mugala womundu akandisyahotelwa omo byala byabandu. 
LUK.9.45	Nikwa mobata minya ekyo abuga mokyabiswa kubo, sibaminyekyo; kandi mobubaha erimubulya omwatsi oyo.
LUK.9.46	Neryo mobakuba obuhaka omukati-kati kabo nga nindi wakubo yo mukulu. 
LUK.9.47	Nikwa Yesu amabiminya oburingikania bwemitima yabo, mwimya omwana mwamuhanganya oko luhande luwe, 
LUK.9.48	mwabuga nabo ati, Oyu kakokaya omwana oyu omo rina ryage iniakanyikokaya, noyu kanyikokaya iniaka kokaya oyo wanyituma; kusangwa oyuri mukemuke omukati kati kenyu yo mukulu.
LUK.9.49	Yoane mwasubirya ati, Mukama twamalola oko mundu akahiga esyombinga omo rina ryawe, motwamukaga, kusangwa siarikwama haguma netu. 
LUK.9.50	Nikwa Yesu mwabuga naye ati, Simumukage; kusangwa oyute enzigu yenyu iniari oko luhande lwenyu.
LUK.9.51	Neryo ebiro biwe byeritwalwa endata byabere byabya hakuhi, mwabya namaha weriya eYerusalema. Mwatuma abakwenda emuliro wuwe, 
LUK.9.52	abagenda omo muyi weba Samariya, erikokotya ahangahikira; 
LUK.9.53	nikwa abandu moba tamukokya, kusangwa mwabya ngakalabira eYerusalema. 
LUK.9.54	Kandi omugulu abiga buwe Yakobo na Yoane babere babilangira ekyo, mobabuga bati, Mukama ukasonda uti tutegeke omuliro eriandagala erilwa elubula neribugabo kwehi? 
LUK.9.55	Nikwa mwakeberabo mwakungabo, mwabuga ati, Simwasi omusindo wekirimu muriko; kusangwa Mugala womundu siasa neriherya esyongebe syabandu nikwa erilamyasyo. 
LUK.9.56	Nikwa mobaya oko gundi muyi.
LUK.9.57	Neryo babere bakagenda omo nzira, omundu mwabuga naye ati, Ngandikukwama ehosi ukandiya. 
LUK.9.58	Yesu mwabuga naye ati, Esyoboha sinawite ebyuna, nesyonyonyu syomokyanya sinawite esyonyutu; nikwa Alugala womundu siawite aheri hira omutwe wuwe. 
