ACT.7.30	Nomugulu emituta makumi ani yabere yabihwa, omulaika mwamubutukira omu kirimi kyomuliro omo kisaka omo mbwarara yoko kitwa kyaSinai. 
ACT.7.31	Na Musa abere alebyago, mwasweka erilola kugo: nomugulu asegera eriyitegererya, omulenge woMukama mwasa, ati, 
ACT.7.32	Ingye ndi Mungu wabotata wawe, Mungu wa Abrahamu, na Isaka, na Yakobo. Musa mwatitimana, mubaha erilangira. 
ACT.7.33	NoMukama mwabuga naye, ati, Lusaya esyo ngendero oko bisandu byawe: kusangwa aho uhangene ni kitaka kibuyirire. 
ACT.7.34	Nabirilangira kwenene amalige wabandu bage abari Misiri, nabiriowa erisimba ryabo, kandi nabirikima eri tongolyabo: na lino wase, ngakutuma eMisiri. 
ACT.7.35	Musa oyo bagana bati, Nindi wamakuyira mo murongani no mutsweri kwehi? Mungu atuma eribya murongani nomutongolya omu byala byomulaika oyo wamubutukira omo kisaka. 
ACT.7.36	Omundu oyo mwasondolobo, iniamabikola ebyeriswekera nebiminyikalo omo kihugo kyeMisiri, omo ngetsi yengula, nomo mbwarara emituta makumi ani. 
ACT.7.37	Oyo ni Musa, oyo wabuga na bana baIsraeli, ati, Mungu asyabahanganirya omuminyereri akalwa omukati-kati ka balikenyu, oyu ringa ngye. 
ACT.7.38	Oyo ni ye oyo wabya omo kanisa omo mbwarara haguma nomulaika oyo wabuga naye oko kitwa kyaSinai, haguma nabotata wetu: oyo wangirira amahano wengebe nerituhago: 
ACT.7.39	yoyo abotata wetu bagana eriowa, yobakuna erilwa kubo mobasuba eMisiri omo mitima yabo, 
ACT.7.40	mobabwira Haroni, bati, Utukokoteraye emiungu eyasyatusondolera: kusangwa Musa oyu watusondo lera erilwa omo kihugo kyeMisiri, sitwasi kwabere. 
ACT.7.41	Moba kokotya enyana yende oko biro ebyo, mobaleta obuhere oko lusumba olo, mobatsema omo mubiri webyala byabo. 
ACT.7.42	Nikwa Mungu mwabinduka, mwahabo erikolera emilondo yomokya nya; ngoko kisakiri omu kitabu kya baminyereri, kiti,
ACT.7.42	Enyumba ya Israeli
ACT.7.42	Momwanyiherera esyonyama esikerire namahere
ACT.7.42	Emituta amakumi ani omo mbwarara kwehi?
ACT.7.43	Momwaheka ehema ya Moloki,
ACT.7.43	Nengununu yomungu Pafoni,
ACT.7.43	Nesisumba esyomwabumba erikukamira
ACT.7.43	Nage nasyabahumirya eyisirya yeBabeli hali.
ACT.7.44	Abotata wetu babya bawite ehema yeritulago omo mbwarara, ngoko ategeka oyo wabuga na Musa ati akokotayeyo, ngomu sindo alolako. 
ACT.7.45	Abotata wetu nabo mobaletayo haguma na Yosua bamabihiga eBihanda ebyo Mungu akuna eyihya embere wabotata wetu erihika oko mugulu wa Dawidi, 
ACT.7.46	oyu wabana erisimwa omo meso woMungu, neryo mwabulya eribanira Mungu wa Yakobo aheriikala. 
ACT.7.47	Nikwa Solomono mwabya iyo wahimba enyumba busana naye. 
ACT.7.48	Nikwa owendata kutsibu siarikala mu manyumba akahimbawa mo byala; ngoko muminyereri akabuga, ati,
ACT.7.49	Elubula ni kitumbi kyage kyobwami,
ACT.7.49	Ne kihugo ni kitumbi kyebisandu byage,
ACT.7.49	Enyumba yahi mwasyambimbira,
ACT.7.49	OMukama akabuga,
ACT.7.49	Kutse aheriluhukira hage ni hahi kwehi?
ACT.7.50	Ebyala byage byobitakola ebi byosi kwehi?
ACT.7.51	Inywe bandu bebikya bibasire, bomutima namatwi bita bwene, ebiro byosi mukalwa neKirimu Kibuyirire: ngoko abotata wenyu bakola, nenyu mukakola mutya. 
ACT.7.52	Nindi oko baminyereri oyo abotata wenyu batendireraya kwehi? Kandi mobita abatsuka eritulago oweriasa ryoyo Tunganene, oyo mwahotela neriita, 
ACT.7.53	inywe mwangirira amahano owaletawa nabalaika, nenyu momutateyago.
ACT.7.54	Nikwa omugulu bowa emyatsi eyi mobahitana, moba mukegetera ameno wabo. 
ACT.7.55	Nikwa iye iniuswire neKirimu Kibuyirire, mwasamarira omo lubula mwalangira olukengerwa lwoMungu, na Yesu inanimene oko byala byamali byo Mungu; 
ACT.7.56	mwabuga, ati, Lebaya, namalebya olubula ilunakingwire, noMugala womundu ahangene oko byala byamali byo Mungu. 
ACT.7.57	Nikwa mobabuya olukanda nerisumba mirenge mobaliba matwi mobamugulukira igumaguma. 
ACT.7.58	Neryo mobamugusa eyihya oko muyi mobamwita omo mabwe; nabalangiri mobahira esyongimba syabo oko bisandu byomulwana oyu kahulawa mo Saulo. 
ACT.7.59	Nomugulu bita Setefano omo mabwe, mwasaba, ati, Mukama Yesu, angirira ekirimu kyage. 
ACT.7.60	Neryo mwaku kama mwabuga nomulenge munene, ati, Mukama, suganzire kubo kwe kibi eki. Abere abibuga eki mwagotsera.
ACT.8.1	Na Saula abya akaliga oluholo luwe. Noko kiro ekyo mobatsuka eriendererya inene oko kanisa eYerusalema; nabosi mobapanzikanira omo bihugo byeYudea na Samaria, butsira bakwenda. 
ACT.8.2	Nabandu bagenge mobata Setefano, mobamurira kutsibu. 
ACT.8.3	Nikwa Saula mwaherya ekanisa kutsibu mwingira omo buri nyumba, akakura abalume nabakali akahi rabo omo nyumba yomuliki.
ACT.8.4	Neryo abapanzikana mobaya eyi neyi eritula engulu yowene yekinywa ekyo. 
ACT.8.5	Filipo mwandagalira oko muyi wa Samaria, mwatulirabo engulu ya Kristo. 
ACT.8.6	Nesyondeko mobowa ebyo Filipo abuga nomutima muguma, omugulu bamowa nerilangira ebiminyikalo akola. 
ACT.8.7	Kusangwa esyombinga mosyalwa oko bosi ababya bakwiresyo, isikabirikira nomulenge munene: nabangi ababya babasire nebilema mobalamibwa. 
ACT.8.8	Neryo mohabya obutseme bunene omo muyi oyo.
ACT.8.9	Nikwa habya omundu ukahulawa mo Simoni oyo wabya akakola obusaki omo muyi oyo iniakaswekaya ekihanda kya Samaria, iniakayahula mo mundu mukulu. 
ACT.8.10	Abosi ibaka mowa, abosi abakebake na bakulu bati, Omundu oyu ni maka ayo woMungu awakahulawa mo Manene. 
ACT.8.11	Nabo bosi moba mowa, kusangwa abya akaswekayabo nobusaki buwe oko biro binene. 
ACT.8.12	Nikwa omugulu bikiriraya Filipo kwa kakangiriraya engulu yowene busana nobwami bwoMungu nerina ryaYesu Kristo mobabatisibwa abalume na bakali. 
ACT.8.13	Na Simoni mwikirirya neryo abere abibatisibwa mwakwama eribya haguma na Filipo; nerilangira ebiminyikalo nebitikotiko byakolawa, mwasweka.
ACT.8.14	Nikwa omugulu abakwenda ababya eYerusalema bowa ambu abanyaSamaria bamangirira eKinywa kyo Mungu, moba tumayo Petero na Yoane, 
ACT.8.15	mobandagalirayo mobasaba busana nabo bati bangirire eKirimu Kibuyirire; 
ACT.8.16	kusangwa isikyekyatogerabo, ibamatabatisibwa buyira omo rina ryo Mukama Yesu. 
ACT.8.17	Neryo mobahira kubo kwebyala mobangi rira eKirimu Kibuyirire. 
ACT.8.18	Nikwa Simoni abere alangira kwabahirawa kwebyala byabakwenda bamahabwa eKirimu, mwahereryabo esyofranka, ati, 
ACT.8.19	Mumbe amaka aya, neryo kwoyo nasyahira kwebyala iniangirira eKirimu Kibuyirire. 
ACT.8.20	Nikwa Petero mwamubwira, ati, Esyofranka syawe sihere haguma nawe, kusangwa wamaringikania uti wangabana erihitya ryoMungu busana nesyofranka! 
ACT.8.21	Suwite ekihande kutse igabo omu mwatsi oyu, kusangwa omutima wawe siatunganene embere syoMungu. 
ACT.8.22	Binduka oko bubi bwawe obu, usabe Mukama uti kyamatokekana, erisonda ryomutima wawe lwa bugirwaryo. 
ACT.8.23	Kusangwa namalebya uri mo ndulu yerikariha nomo muliki webibi. 
ACT.8.24	Simoni mwasubirya ati, Munyisabire Mukama, ebyo mwamabuga, sihabye kindu nekiguma kika mbikako.
ACT.8.25	Nabo babere babitulago nerikangirirya eKinywa kyo Mukama, mobasuba eYerusalema, bakatula engulu yowene omo hiyi hingi ehyabaSamaria.
ACT.8.26	Nikwa omulaika woMukama mwabwira Filipo ati, Hangana, ugende oko luhande lwekitambi oko nzira eyikanda galira eGaza erilwa eYerusalema. Eyi ni nzira yembwarara. 
ACT.8.27	Neryo mwahangana mwayayo; neryo omunyaEtiopia, oyu bunire, omugombe mukulu wa Kandake, omwamikali wEtiopia, oyu kategaya ebindu biwe byosi, abya iniayire eYerusalema erisaba. 
ACT.8.28	Abere akasubula; inianikere oko gari yiwe, mwabya akasoma ekitabu kyomuminyereri Isaya. 
ACT.8.29	Ne Kirimu mokyabwira Filipo, kiti, Ugende hakuhi uyitomeke oko gari eyi. 
ACT.8.30	Na Filipo mwatibita eyari, mowa akasoma ekitabu kyaIsaya omuminyereri, neryo mwamubulya, ati, Ebyo ukasoma wasibyo kwehi? 
ACT.8.31	Naye mwabuga, Inabitoka nyiti ndetabana oyu kanyisondola mubyo kwehi? Neryo mwamulembalemba ahetuke ikale naye. 
ACT.8.32	Nikwa omulondo owamasako abya akasoma abya goyu:
ACT.8.32	Mwaletwa ngembuli bakaleta omwikerero,
ACT.8.32	Kutse ngekyana kye mbuli kikabya bukutu embere woyu katwa obweya,
ACT.8.32	Isiarikumbula obuno buwe.
ACT.8.33	Omwiyiyira mo muke muke mobamukaga erisingana.
ACT.8.33	Nindi wasyakania eryolulengo luwe kwehi?
ACT.8.33	Kusangwa engebe yiwe yamalusibwa muna kihugo.
ACT.8.34	Noyu bunire mwabuga na Filipo, ati, Ngakusaba unyibwire omumunyereri akahula ndi kwehi? busana naye iyowene kutse ogundi kwehi? 
ACT.8.35	Filipo mwakumbula obuno buwe, neritsuka omo masako ayo mwamutulira engulu yowene ya Yesu. 
ACT.8.36	Neryo babere banemugenda omo nzira mobahika oko magetsi, noyu bunire mwabuga, ati, Lebaya, amagetsi ari hano! Ekyangaleka inindabatisibwa niki kwehi? 
ACT.8.37	Filipo mwabuga, ati, Wamikirirya nomutima wawe gosi, wangatoka. Naye mwa subirya, ati, Namikirirya ko Yesu Kristo ni Mugala woMungu. 
ACT.8.38	Neryo mwategeka egari ihangane, mobandagalira ababiri omo magetsi, Filipo noyu bunire, neryo mwamubatisya. 
ACT.8.39	Babere balwa omo magetsi, eKirimu kioMukama mokyaba kula Filipo; noyo bunire mwataswamulolako kandi, mwagenda monzira yiwe akatsema. 
ACT.8.40	Nikwa Filipo mwayabanika eAzoto, neritwangana aho mwatula engulu yowene oko miyi yosi erihika eKaisaria.
ACT.9.1	Nikwa Saula, iniakinahumulikana eriubahya neriita biga boMukama, mwaya oko muhereri mukulu; 
ACT.9.2	mwamusaba esyobarua oko manyumba awerihindanamo aweDamasiki ati, amalangira abeNzira eyo, abalume kutse abakali, inialetabo eYerusalema ibanabohire. 
ACT.9.3	Neryo abere akagenda asonda erihika eDamasiki, neryo-neryo ekyakakala erilwa elubula mokyamukoleryako. 
ACT.9.4	Neryo mwagwa ahisi mowa omulenge akabuga naye, ati, Saula, Saula, busana naki ukanyendereraya kwehi? 
ACT.9.5	Naye ati, Kuwendi Mukama kwehi? Naye, ati, Indi Yesu, oyu kendereraya; 
ACT.9.6	nikwa hangana wingire omo muyi, wasyabwirwa ebyo utolere erikola. 
ACT.9.7	Nabalume abagendanaya naye mobahangana bukutu, ibakowa omulenge, nikwa sibeta langira mundu. 
ACT.9.8	Neryo Saula mwalwa oko kitaka; abere alibula meso, mwatalola kuki; mobamusondolya omo byala mobamutwala eDamasiki. 
ACT.9.9	Noko biro bisatu mwabya butsira erilangira, kutse erirya kutse eripulya.
ACT.9.10	Neryo habya omwiga eDamasiki oyu wahulawa mo Anania. OMukama mwabuga naye omunzoli, ati, Anania. Naye ati, Lebaya, Nandi hano Mukama. 
ACT.9.11	NoMukama mwa buga naye, ati, Hangana, ugende omu nzira ikahulawa mwi Tunganene, usondere omu nyumba ya Yuda omundu weTarso akahulawa mo Saula; kusangwa lebaya, anemosaba, 
ACT.9.12	iniabi rilola oko mundu oyu kahulawa mo Anania akingira nerimuhira kwe byala neribuga abane kandi erilangira.
ACT.9.13	Nikwa Anania mwasubirya, ati, Mukama, nabiriowa engulu yomundu oyu uku bangi, ngoko abirikola ababuyirire bo nabi nyingi eYerusalema; 
ACT.9.14	na hano awite ehamuli ikalwa oko bahereri bakulu eriboha abosi abakabirikira oko rina ryawe. 
ACT.9.15	Nikwa Mukama mwabuga naye ati, Genda, ku sangwa mundu oyu ni kindu kyeriyisoga kyage eriheka erina ryage embere weBihanda nabami nabana baIsraeli; 
ACT.9.16	ku sangwa nasyamukangya ngoko asyagalwa busana nerina ryage. 
ACT.9.17	Neryo Anania mwalwaho mwingira omo nyumba, mwa muhira kwebyala biwe, ati, Saula, muli kyetu, oMukama Yesu oyo wakubutukira omo nzira wasiramo, abirinyituma ati utoke kandi eribana erilangira ryawe nerisulibwa neKirimu Kibuyi rire. 
ACT.9.18	Neryo-neryo ebindu biringe syonguku mobyatoga oko meso neryo mwaswabana erilangira. Neryo mwahangana mwa batisibwa: 
ACT.9.19	neryo mwarya karyo mwabana maka.
ACT.9.19	Mwikala nabiga ebiro bike eDamasiki. 
ACT.9.20	Neryo-neryo omo manyumba werihindana mwatula engulu ya Yesu, ati, Oyu ni Mugala woMungu. 
ACT.9.21	Nabosi bamowa mobasweka, bati, Oyu si yo mundu waheraya abahula erina eri eYerusalema kwehi? abiriasa eno busana nomwatsi oyu eritwalabo ibanabohire embere syabahereri bakulu. 
ACT.9.22	Nikwa Saula mwalabyaho eribya namaka, mwasinga baYuda ababya bikere eDamasiki erikangyabo ko Yesu yona Kristo.
ACT.9.23	Habere hahwa biro bingi abaYuda mobaya mbita yeri mwita, 
ACT.9.24	nikwa embita yabo moyaminyikala uku Saula. Mobategerya oko malimbo omwitungi nomo kiro, busana nerimwita; 
ACT.9.25	nikwa abiga biwe mobamutwala omo kiro mobamwandagalya omo kitiri oko luhimbo.
ACT.9.26	Neryo abere ahika eYerusalema, mwalenga eriyihira oko biga; nabosi mubamubaha, mobatikirirya kwari mwiga. 
ACT.9.27	Nikwa Barunaba mwamwimya mwamuleta oko bakwenda, mwakaniryabo ngoko alola oko Mukama omo nzira, kandi kwabuga naye, kandi ngoko atula engulu omo rina rya Yesu butsira eriubaha oko Damasiki. 
ACT.9.28	Nibya mwabya nabo eYerusalema iniakasiba nabo eriingira nerihuluka, 
ACT.9.29	eritula engulu yowene omo rina rya Yesu butsira eriubaha; mwabuga nerikuba obuhaka nabaYuda ababya baGiriki; nikwa moba sonda erimwita. 
ACT.9.30	Nikwa balikyetu babere baminya, moba mutwala eKaisaria, mobamutuma eTarso.
ACT.9.31	Nekanisa eYudea ehosi neGalilaya ne Samaria moyabya nobuholo moyahimbwa; nerilendera omubaha ryoMukama nomwisibikya ryeKirimu Kibuyirire moyatomekerwako.
ACT.9.32	Nikwa Petero mwalendera ehosihosi omukati-kati kabo bosi, mwandagalira oko babuyirire ababya bikere eLuda. 
ACT.9.33	Neyo mweya mundu oyu kahulawa mo Ainea, oyo wabya inialwere omo ngingo yiwe emituta munane abya abasire. 
ACT.9.34	Petero mwabuga naye, ati, Ainea, Yesu Kristo akakulamaya; hangana usese engingo yawe. Nendambi eyo mwahangana. 
ACT.9.35	Nabosi babya bikere eLuda ne Saroni mobamulolako, mobabindukira oMukama.
ACT.9.36	Nikwa habya omwiga muguma eYopa, erina riwe Tabita, eribindula ambu Dorika, kutse Saswe: omukali oyo abya uswire nemibiri yowene yolwanzo. 
ACT.9.37	Oko biro ebyo mwalwala, mwahola; babere babimukosa, mobamuhira omwendata. 
ACT.9.38	Kusangwa Luda yabya hakuhi na Yopa, abiga mobowa ko Petero ariyo, mobamutumako abandu babiri erimugonga-gonga bati, Wase kwitwe, sulindirire. 
ACT.9.39	Neryo Petero mwahangana mwagenda nabo. Neryo abere ahikayo, mobamutwala omo nyumba mwendata. Nabakwakali bosi mobimana hakuhi naye ibanemurira nerimukangya esyokanzo nesyongimba esyo Dorika akakokotaya akine nabo. 
ACT.9.40	Nikwa mwahirabo bosi eyihya mwakukama mwasaba; neryo mwabindukira kinda ati, Tabita, hangana. Naye mwalibula meso, neryo abere alangira Petero mwayikukuma mwikala. 
ACT.9.41	Neryo mwamuha ebyala biwe mwamuhangania; abere abibirikira ababuyirire na bakwakali mwamukangyabo inianeho. 
ACT.9.42	Nekyo mokyaminyikala eYopa hosi, nabangi mobikirirya oMukama. 
ACT.9.43	Naye mwikala eYopa biro bingi omwa Simoni, mubambi.
ACT.10.1	Ekaisaria habya mundu oyu kahulawa mo Kornelio, omukulu wa basoda erigana wekihanda kyeItalia, 
ACT.10.2	omundu mugenge oyu kubaha Mungu iye nenyumba yiwe yosi, iniakahitaya ndeke oko bandu, nerisaba Mungu endambi yosi. 
ACT.10.3	Hakuhi nendambi yomwenda yeritungi mwalangira ndeke omonzoli omulaika woMungu akasa akabuga naye, ati Kornelio. 
ACT.10.4	Naye mwamusamarira neriubaha, mwamubulya, ati, Niki Mukama? Naye mwamubwira ati, Erisaba ryawe nerihitya ryawe byabirihetuka emuliro woMungu ngerimwi bukya. 
ACT.10.5	Na lino utume abandu eYopa, ulete Simoni oyu kahulawa mo Petero; 
ACT.10.6	ikere na Simoni, omubambi wesyongobi, enyumba yiwe ihererenie nengetsi. 
ACT.10.7	Omulaika oyo wabuga naye abere abigenda, mwabirikira abagombe biwe babiri nomusoda mugenge oko bakamukolera emigulu yosi, 
ACT.10.8	abere abibwirabo ebyosi mwatumabo eYopa.
ACT.10.9	Nengyakya, bakagenda basonda erihika hakuhi nomuyi, Petero mwaya omo nyumba yendata erisaba hakuhi neritungi. 
ACT.10.10	Neryo mwakwa enzala mwasonda erirya; nikwa omugulu bakokotaya akaryo mwabya ngakalota, 
ACT.10.11	mwalebya olubula ilukingukere, nekindu ikikandagala, ngolukimba lunene, luka ndagalibawa nesyongonde ini erihika oko kitaka. 
ACT.10.12	Mulo imuri esyonyama misindo yosi esyemigulu ini nesikakululuka nesyonyonyu syomukyanya. 
ACT.10.13	Nomulenge mwasa okwiye, ati, Hangana, Petero, usinze urye. 
ACT.10.14	Nikwa Petero mwabuga, ati, Eyihi Mukama; sindinatarya kindu buyira kutse kibi na kera. 
ACT.10.15	Nomulenge mwamubwira engendo ya kabiri, ati, Ebyo Mungu abirierya isiwahulebyo mo buyira. 
ACT.10.16	Omwatsi oyu mwakolwa engendo isatu, nekindu ekyo mokyasumbirwa elubula neryo-neryo.
ACT.10.17	Omugulu Petero atikatika mo mutima wuwe ngesyonzoli esyo amalolako nga ni musindoki, lebaya, abandu babiri aba tumawa na Kornelio bamabibulya enyumba ya Simoni, ibana hangene okwirimbo, 
ACT.10.18	mobabirikira eribulya nga Simoni oyo kahulawa mo Petero nganikeremo. 
ACT.10.19	Nomugulu Petero abya akaringikania esyonzoli, eKirimu mokyamubwira, kiti, Langira bandu basatu bakakusonda. 
ACT.10.20	Hangana wandagala, ugende nabo sutikatike; kusangwa ingye natumabo. 
ACT.10.21	Neryo Petero mwakima mweya abandu abo mwabwirabo ati, ni ingye oyo mukasonda; ekikabaleta niki kwehi? 
ACT.10.22	Nabo bati, Kornelio, omukulu werigana, mundu mubuya neriubaha Mungu, oyo kasimawa nekihanda kyosi kyabaYuda, abwirawa nomulaika oyu buyirire erikutumirako eriya ewuwe, owe ebinywa byawe. 
ACT.10.23	Neryo mwingiryabo mo bageni buwe.
ACT.10.23	Nengyakya mwahangana mwagenda nabo, nabandi balikyetu beYopa mobagenda naye, 
ACT.10.24	nengyakya mobingira Kaisaria. Na Kornelio inianalindirirebo, iniabirihindania ekitunga kyabo nabira biwe. 
ACT.10.25	Petero abere abiingira, Kornelio mwahindana naye mwagwa ahisi oko bisandu biwe, mwamukukamira. 
ACT.10.26	Nikwa Petero mwamuhangania, ati, Hangana; nage indi mundu. 
ACT.10.27	Nomugulu akanaya naye mwingira mweya ibahi ndeneho bangi; 
ACT.10.28	neryo mwabwirabo ati, Inywe munasi ko riganirwe omuYuda akaikala haguma kutse eriyabana abekindi kihanda; nikwa Mungu abirinyikangya ko nde nangahula mundu mo buyira kutse mo mubi. 
ACT.10.29	Neryo omugulu natu mawa ko monasa mondagana. Neryo ngabulaya ekyaleka imwanyitumirako.
ACT.10.30	Kornelio mwabuga, ati, Lino ni biro bini nabya ngateya endambi yomwenda erisaba omo nyumba yage; lebaya, omundu mwimana embere syage nolukimba luhenirye, 
ACT.10.31	ati, Kornelio, erisaba ryawe ryamogubwa nerihitya ryawe ryamibukwa embere syoMungu. 
ACT.10.32	Neryo utume eYopa utumire ku Simoni oyo kahulawa mo Petero; ikere omo nyumba ya Simoni mubambi wesyongobi, hakuhi nengetsi. 
ACT.10.33	Neryo-neryo monakutumi rako, nawe wamayira ndeke ukasa. Lino itwe bosi turi hano emuliro woMungu, eriowa ebyosi ebyo Mukama abirikutegeka.
ACT.10.34	Neryo Petero mwakumbula obuno buwe, ati, Kwenene ngalebaya Mungu siariyira butaga, 
ACT.10.35	nikwa omo buri kihanda oyu kamubaha, nerikola ekitunganene, akaligawa naye. 
ACT.10.36	Mu nasi eKinywa ekyo atuma oko baIsraeli, eritula engulu yowene yobuholo busana na Yesu Kristo (iye ni Mukama wabosi), 
ACT.10.37	eKinywa ekyo mokyatulwa eYudea hosi, eritsuka eGalilaya enyuma yolubatisimo eyo Yoane akangiriraya: 
ACT.10.38	ngokoMungu ahakabaya Yesu we Nazareti neKirimu Kibuyirire namaka; ngoko alendera akakola ebibuya nerilamya abosi bagalibawa neSatani, kusangwa Mungu abya naye. 
ACT.10.39	Netu turi balangiri bebyosi akola omo kihugo kyabaYuda neYeru salema; mobamwita erimubamba oko muti. 
ACT.10.40	Nikwa Mungu mwamulubukya ekiro kyebisatu mwamuminyikalya; 
ACT.10.41	butsira oko bandu bosi nikwa kwitwe abayisogawa noMungu eribya balangiri, itwe twarya neripulya haguma naye enyuma abilu buka omo baholi. 
ACT.10.42	Naye mwatutegeka eritulago oko bandu, neribuga kwariyo yo Mungu ategeka eribya mutsweri wabariho nabaholire. 
ACT.10.43	Abaminyereri bosi bakatulago busana naye bati oburi mundu oyu kamwikiriraya akabana eribuyirwa ryebibi oko rina riwe.
ACT.10.44	Nomugulu Petero abere akinabuga eki, eKirimu Kibu yirire mokyatogera oko bosi bowa eKinywa ekyo. 
ACT.10.45	Nabiki rirye omukati-kati kababwene abasa na Petero mobasweka, kusangwa erihitya ryeKirimu Kibuyirire kyutulirawa oko Bihanda nibya.
ACT.10.46	Kusangwa mobowabo bakabuga omo mibuge neripipa Mungu. Neryo Petero mwabulya, ati, 
ACT.10.47	Nindi wangatoka eritagana amagetsi eribatisya abandu aba ababiriangirira eKirimu Kibuyirire ngatwe kwehi? 
ACT.10.48	Neryo mwategekabo ati, babatisibawe omo rina rya Yesu Kristo. Neryo mobamu bulya bati ikale nabo ebindi biro.
ACT.11.1	Neryo abakwenda na balikietu ababya eYudea mobowa kweBihanda byabiriangirira eKinywa kyoMungu. 
ACT.11.2	Na Petero abere abihetukira eYerusalema, ababwene mobamuha yira, bati, 
ACT.11.3	Busana naki waya oko batabwene warira haguma nabo? 
ACT.11.4	Nikwa Petero mwatsuka erikaniryabo mwatondola kigumakiguma: ati, 
ACT.11.5	Nabya oko muyi wa Yopa ngasaba; monabya omo bulime monalangira omo syonzoli ekindu kika ndagala, ngolukimba lunene, ilulerembirye nesyongonde ini erilwa elubula; mokyambikako. 
ACT.11.6	Monasamalirakyo ndeke monalangira syonyama syemihimbi ini, esyahesi nesyomoli, nesikayikura ahisi, nesyonyonyu syomokyanya. 
ACT.11.7	Monowa omulenge akabuga nage, ati, Hangana, Petero; usinze urye. 
ACT.11.8	Nikwa nage nyiti, Eyihi, Mukama: kusangwa sihari kindu buyira kutse kindu kibi ekingira omo obuno bwage ne kera; nikwa omulenge mwanyisubirya engendo ya kabiri erilwa elubula, ati, 
ACT.11.9	Ebyo Mungu abirierya susololebyo eriahulabyo mo buyira. 
ACT.11.10	Omwatsi oyu mwabya atya ngendo isatu, nebyosi mobyasumbirwa omo lubula. 
ACT.11.11	Noko ndambi eyo abandu basatu mobahika oko nyumba eyo twabyamo, batumawa kwingye erilwa eKaisaria. 
ACT.11.12	NeKirimu mokyambwira kiti nyigende nabo butsira eritika-tika. Abalikyetu aba endatu moba genda nage, motwingira omo nyumba yomundu oyo. 
ACT.11.13	Naye mwatubwira ngoko alangira omulaika inianimene omo nyumba yiwe akabuga, ati, Utume eYopa utumire ku Simoni oyo kahulawa mo Petero; 
ACT.11.14	asyakutulira omwatsi ngoko wasya lamibwa, uwe nenyumba yawe yosi. 
ACT.11.15	Nage nabere natsuka eribuga, eKirimu Kibuyirire mokyandagalira kubo ngoko kyatwandagalirako embere. 
ACT.11.16	Monibuka eKinywa kyoMukama, ngoko abuga ati, Yoane abatisaya omo magetsi, nikwa inywe mwasyabatisibwa omo Kirimu Kibuyirire. 
ACT.11.17	Omungu ama habo erihitya eryo ngoko atuharyo omugulu twikiriraya oMukama Yesu Kristo, ingye nabya ndi nyiti nangatoka erilwa noMungu kwehi? 
ACT.11.18	Babere bowa ebyo mobabya bukutu mobapipa Mungu, bati, oMungu abiriha oko Bihanda nibya eribindukira oko engebe.
ACT.11.19	Neryo abapanzawa busana neriendererya eryatsuka busana na Setefano mobalendera erihika Foiniki neKipuro neAntiokia, ibakabwira abaYuda basa eKinywa. 
ACT.11.20	Nikwa habya abandi bakubo, abandu beKipuro nabeKurene babere babihika eAntiokia mobabuga na baGiriki, bakatula engulu yoMukama Yesu. 
ACT.11.21	Nebyala byoMukama byabya nabo, nabangi mobi kirirya mobabindukira oko Mukama. 
ACT.11.22	Nengulu eyi moyahika omo matwi wekanisa eYerusalema, nabo mobatuma Barunaba eAntiokia. 
ACT.11.23	Abere abihikayo alangira olukogo lwoMungu, mwatsema; mwahanabo bosi ati bakwamirire oMukama nomu tima asikire: 
ACT.11.24	kusangwa abya mundu mubuya, iniuswire neKirimu Kibuyirire nerikirirya: nendeko nene moyatome kerwa oko Mukama. 
ACT.11.25	Neryo, Barunaba mwaya Tarso akaya sonda-sonda Saulo; 
ACT.11.26	abere amubana mwamuleta eAntiokia. Noko mututa mugima mobahindana nekanisa, mobakangirirya endeko nene ya bandu; eAntiokia yabiga batsukira eriahulwa mobaKristiano.
ACT.11.27	Noko biro ebi abaminyereri mobalwa eYerusalema bakaya eAntiokia. 
ACT.11.28	Nomuguma wakubo oyo kahulawa mo Agabo mwahangana mwaminyerera iniabiribwirwa neKirimu, ati, Enzala nene yasyabya omu kihugo kyosi: neki mokyabererera omu biro byaKlaudio. 
ACT.11.29	Nabiga omo lulengo lweritoka ryo buri mundu, mobaringikania erituma oko balikyabo abikere eYudea ebyeriwatikyabo; 
ACT.11.30	mobakola batya, mobatumabyo oko bakulu omo byala bya Barunaba na Saulo.
ACT.12.1	Oko mugulu oyo omwami Herode mwahamba abandi bekanisa nekiniga erikolabo nabi. 
ACT.12.2	Mwita Yakobo mugala wabo Yoane omo muyari; 
ACT.12.3	abere alangira ko kyama tsemesya baYuda, mwaswayahamba Petero. Oyo abya mugulu wobundu bute mo kihamya. 
ACT.12.4	Abere abimuhamba, mwamuhira omo nyumba yomuliki, mwamuha oko basoda erikumi nendatu erimuteya banibani, iniakasonda erimuletera abandu Pasaka yahwa. 
ACT.12.5	Nikwa Petero mwateyibwa omo muliki; nikwa ekanisa moyamusabira oko Mungu nomuhwa.
ACT.12.6	Nomo kiro ekyo Herode asonda erimuhulukiryabo, Petero abya agotsere omukati-kati kabasoda babiri, inianabohire omo mahulula abiri, nabateya ibanimene embere syoluyi ibakategaye enyumba yomuliki; 
ACT.12.7	neryo lebaya, omulaika woMukama mwabutuka, nekyakakala mokyakolerya omo kakonde; naye mwabanda ku Petero oko lukanga mwamubukya, ati, Hangana luba. Namahulula mwalwa oko byala biwe. 
ACT.12.8	Nomulaika mwabuga naye, ati, Uyiswike, wambale esyongendero syawe. Naye mwakola atya. Uyiringire kwekanzo yawe unyikwame. 
ACT.12.9	Neryo mwaya eyihya mwamukwama; isiasi ebikakolawa nomulaika nga ni kwenene, nikwa mwaganirya ngakalola oko nzoli. 
ACT.12.10	Babere balaba oko muteya owerimbere noko wakabiri, mobahika okwirimbo ryekiuma erikalola oko muyi. Neryo moryayikingula iryo ryene, mobaya eyihya mobalaba omo nzira nguma; neryo-neryo mulaika mwamusiga. 
ACT.12.11	Neryo Petero amabibuka, mwabuga ati, Lino namaminya kwenene ko Mukama abirituma omulaika wuwe erinyitongolya omo byala byaHerode noko myatsi yosi abaYuda basonda erinyikola.
ACT.12.12	Amabiminya ekyo, mwaya ahari enyumba ya Maria nyinya wa Yoane, oyo waswalukawa erya Mariko, ahabya hahindene bangi bakasaba. 
ACT.12.13	Neryo abere ahumanga oko luyi lweri rimbo, mwanamuto oyu kahulawa mo Roda mwasa erihulikirira. 
ACT.12.14	Mwaminya omulenge wa Petero, nomo butseme buwe mwatakingula eririmbo nikwa mwatibita mwingira omo nyumba mwabwirabo ko Petero anahangene okwirimbo. 
ACT.12.15	Nabo moba mubwira bati, Uri kwisire, Nikwa iye mwayitsinga ko kuri kwenene. Nabo bati, Ni mulaika wuwe! 
ACT.12.16	Nikwa Petero mwayitsinga erihumanga; nomugulu bakingulaho, mobamu lolako mobasweka. 
ACT.12.17	Nikwa iye mwakoheryabo ati babye bukutu, mwakaniryabo ngoko Mukama amamulusya omo nyumba yomuliki ati, Mubwire Yakobo na balikietu. Neryo mwalwaho mwaya handi.
ACT.12.18	Bwabere bwakya, mohabya erigangaganga omukati-kati kabasoda Petero ngayirehi. 
ACT.12.19	Na Herode abere abimusonda sonda mwamubula, mwabulya bateya neryo mwategeka ati bitawe. Neryo mwandagalira eKaisaria akalwa Yudea, mwa byayo.
