MAT.1.1+MAT.1.2+MAT.1.3+MAT.1.4+MAT.1.5+MAT.1.6	От Авраама до царя Давида: Авраам, Исаак, Иаков, Иуда и его братья, Па́рец и его брат Зе́рах (их матерью была Тама́р), Хецро́н, Рам, Амминада́в, Нахшо́н, Салмо́н, Бо́аз (его матерью была Раа́в), Ове́д (его матерью была Руфь), Иессе́й, царь Давид.
MAT.1.12+MAT.1.13+MAT.1.14+MAT.1.15+MAT.1.16	После выселения в Вавилон и до рождения Иисуса: Иехо́ния, Шеалтиэ́л, Зороваве́ль, Авиу́д, Элиаки́м, Азо́р, Цадо́к, Ахи́м, Элиу́д, Элеаза́р, Матта́н, Иаков, Иосиф, муж Марии, матери Иисуса, называемого Христом, то есть Помазанником.
MAT.1.17	Всех поколений от Авраама до Давида было четырнадцать, от Давида до выселения в Вавилон — четырнадцать, и от выселения в Вавилон до рождения Помазанника — четырнадцать.
MAT.1.19	Иосиф, ее нареченный, как человек праведный, решил разорвать помолвку, но тайно, чтобы не выставлять ее на позор. 
MAT.1.20	Когда же он это задумал, явился ему во сне ангел от Господа. «Иосиф, сын Давида, не бойся взять Марию в жены, — сказал он. — Ребенок, которого она носит, зачат от Духа Святого. 
MAT.1.21	Она родит сына, и ты назовешь Его Иисусом, потому что Он спасет Свой народ от грехов». 
MAT.1.22	Все это произошло, чтобы исполнилось то, что сказал Господь через пророка:
MAT.1.23	Его назовут Эммануи́л»,
MAT.1.23	что значит «С нами Бог».
MAT.1.24	Иосиф, пробудившись ото сна, поступил так, как велел ему ангел Господень: взял Марию как жену к себе в дом. 
MAT.1.25	Но он не прикасался к ней до тех пор, пока она не родила Сына. Он назвал Его Иисусом.
MAT.2.2	«Где новорожденный царь иудеев? — спрашивали они. — Мы видели, как взошла Его звезда, и пришли воздать Ему почести». 
MAT.2.3	Царь Ирод, услышав об этом, пришел в смятение, а с ним и весь Иерусалим. 
MAT.2.4	Собрав всех старших священников и учителей Закона, он спросил у них, где надлежит родиться Помазаннику. 
MAT.2.5	«В иудейском городе Вифлееме, — ответили они. — Потому что так написано пророком:
MAT.2.6	не самый малый средь главных городов Иуды:
MAT.2.6	из тебя произойдет вождь,
MAT.2.6	пастырь народа Моего Израиля“».
MAT.2.7	Тогда Ирод, тайно призвав к себе звездочетов, выведал у них точное время появления звезды 
MAT.2.8	и направил их в Вифлеем, сказав им: «Ступайте и все в точности разузнайте о Ребенке. А когда найдете Его, дайте мне знать, я тоже приду воздать Ему почести». 
MAT.2.9	Выслушав царя, они отправились в путь. И вдруг звезда, восход которой они видели, стала двигаться перед ними, пока не остановилась над тем местом, где был Ребенок. 
MAT.2.10	Когда они увидели звезду, они очень сильно обрадовались. 
MAT.2.11	Войдя в дом, они увидели Ребенка и Марию, Его мать, и, встав на колени, склонились перед Ним ниц, а потом, достав ларцы с сокровищами, преподнесли Ему в дар золото, ладан и смирну. 
MAT.2.12	Получив во сне повеление не возвращаться к Ироду, они отправились в свои края другой дорогой.
MAT.2.13	После того как они ушли, ангел Господень является во сне Иосифу и говорит: «Встань, возьми Ребенка с матерью и беги в Египет. Оставайся там до тех пор, пока не скажу тебе, ведь Ирод собирается разыскать Ребенка и убить Его». 
MAT.2.14	Тот встал, взял Ребенка с матерью и ночью отправился в Египет. 
MAT.2.15	Там он оставался до смерти Ирода. Это произошло, чтобы исполнилось то, что сказал Господь через пророка: «Из Египта призвал Я Сына Моего».
MAT.2.16	Когда Ирод увидел, что звездочеты его провели, он пришел в ярость. Он приказал убить в Вифлееме и его окрестностях всех мальчиков в возрасте до двух лет, то есть рожденных в то время, о котором он узнал от звездочетов.
MAT.2.17	И так исполнилось сказанное через пророка Иереми́ю:
MAT.2.18	То Рахи́ль о детях своих рыдает
MAT.2.18	и не хочет утешиться,
MAT.2.18	потому что их больше нет».
MAT.2.19	После смерти Ирода Иосифу в Египте является во сне ангел Господень 
MAT.2.20	и говорит: «Встань, возьми Ребенка с матерью и возвращайся в израильскую землю. Тех, кто хотел погубить Ребенка, уже нет в живых». 
MAT.2.21	Иосиф встал, взял Ребенка с матерью и отправился в израильскую землю. 
MAT.2.22	Но когда он узнал, что вместо царя Ирода в Иудее правит его сын Архела́й, он побоялся идти туда. Получив во сне повеление, он отправился в Галилейскую область 
MAT.2.23	и, придя туда, поселился в городе под названием Назаре́т. Так исполнилось сказанное Господом через пророков, что Его назовут Назоре́ем. 
MAT.3.2	Он возвещает: «Покайтесь! Ведь Царство Небес уже близко!» 
MAT.3.3	Ведь он был тот, о котором сказал пророк Иса́йя:
MAT.3.3	«Голос глашатая в пустыне:
MAT.3.3	„Приготовьте дорогу Господу,
MAT.3.3	проложите для Него прямые пути“».
MAT.3.5	К нему приходили все жители Иерусалима, а также всей Иудеи и окрестностей Иорда́на. 
MAT.3.6	Они признавались в грехах, а он крестил приходивших в реке Иордане.
MAT.3.8	Покажите на деле, чего стоит ваше раскаяние! 
MAT.3.9	Только не вздумайте говорить в душе: „Наш отец — Авраам!“ Говорю вам, Бог из этих камней может сделать детей Аврааму. 
MAT.3.10	Уже лежит наготове топор у ствола деревьев: дерево, которое не приносит хороших плодов, срубают и бросают в огонь. 
MAT.3.11	Я крещу вас всего лишь водой в знак раскаяния, но Тот, кто идет за мной, сильнее меня, я недостоин даже сандалии Его нести. Он будет крестить вас Духом Святым и огнем. 
MAT.3.12	У Него в руках лопата, Он провеет зерно на току: пшеницу соберет в закрома, а мякину сожжет в огне неугасимом».
MAT.3.14	Иоанн сначала этому противился, говоря: «Это я нуждаюсь в том, чтобы Ты меня крестил, а Ты пришел ко мне!»
MAT.3.15	«Пусть теперь будет так, — возразил ему Иисус. — Этим мы исполним то, чего хочет от нас Бог». И тогда Иоанн согласился.
MAT.3.17	И голос с неба сказал: «Это Мой любимый Сын, в Нем Моя отрада».
MAT.4.2	Иисус провел сорок дней и сорок ночей в посте и сильно проголодался. 
MAT.4.3	Дьявол, испытывавший Его, подошел и сказал Ему: «Если Ты Сын Бога, скажи, пусть эти камни станут хлебом».
MAT.4.4	„Не одним лишь хлебом живет человек,
MAT.4.4	но всем тем, что исходит из уст Божьих“».
MAT.4.5	Тогда дьявол приводит Его в святой город, ставит Его на самый верх Храма 
MAT.4.6	и говорит Ему: «Если Ты Сын Бога, бросься вниз. Ведь в Писании сказано:
MAT.4.6	„Он ангелам Своим повелит оберегать Тебя —
MAT.4.6	они на руках понесут Тебя,
MAT.4.6	чтобы ты не споткнулся о камень“».
MAT.4.8	Снова берет Его дьявол на очень высокую гору, показывает Ему все царства мира во всем их блеске 
MAT.4.9	и говорит Ему: «Я все это отдам Тебе, если Ты, пав на землю, поклонишься мне».
MAT.4.10	„Господу, Богу твоему, поклоняйся,
MAT.4.10	и Его одного почитай“».
MAT.4.11	Тогда дьявол оставляет Его. Тут же пришли к Иисусу ангелы и прислуживали Ему.
MAT.4.13	Покинув Назарет, Он поселился в Капернау́ме, в городе у Галилейского моря, в земле Завуло́на и Неффали́ма. 
MAT.4.14	Это произошло потому, что должно было исполниться сказанное через пророка Исайю:
MAT.4.15	приморский путь!
MAT.4.15	Заиорданье и Галилея, страна язычников!
MAT.4.16	увидел великий свет.
MAT.4.16	Для тех, кто жил под сенью смертной,
MAT.4.16	свет воссиял».
MAT.4.19	«Идите за Мной! — говорит им Иисус. — Я сделаю вас ловцами людей!»
MAT.4.20	Сразу же оставив сети, они последовали за Ним. 
MAT.4.21	Пройдя немного дальше, Он увидел двух других братьев — Иакова, сына Зеведе́я, и его брата Иоанна — они в лодке со своим отцом Зеведеем чинили сети. Он позвал их. 
MAT.4.22	И они, сразу же оставив лодку и отца, последовали за Ним.
MAT.4.24	Слава о Нем прошла по всей Сирии. К Нему приносили всех, кто страдал от разных болезней и мучительных недугов, одержимых бесами, больных падучей и парализованных. Иисус всех исцелял. 
MAT.4.25	Толпы людей из Галилеи, Десятиградия, Иерусалима, Иудеи и Заиорданья ходили за Ним следом.
MAT.5.1	Увидев толпы народа, Иисус поднялся на гору. Он сел, и к Нему подошли ученики. 
MAT.5.2	Иисус начал их учить. Он сказал:
MAT.5.3	Царство Небес — для них.
MAT.5.4	Бог их утешит.
MAT.5.5	Бог им отдаст во владение землю.
MAT.5.6	Счастливы те, что жаждут
MAT.5.6	исполнения воли Господней!
MAT.5.6	Жажду их Бог утолит.
MAT.5.7	Счастливы милосердные!
MAT.5.7	И к ним будет Бог милосерд.
MAT.5.8	Они Бога увидят.
MAT.5.9	Счастливы те, что добиваются мира!
MAT.5.9	Бог назовет их Своими сынами.
MAT.5.10	за исполнение воли Господней!
MAT.5.10	Царство Небес — для них.
MAT.5.12	Радуйтесь и ликуйте! Велика ваша награда на небесах! Так гнали пророков, которые жили до вас.
MAT.5.15	Когда зажигают светильник, его не накрывают горшком, а ставят на подставку — и он светит всем в доме. 
MAT.5.16	Пусть так же светит свет ваш среди людей, чтобы они видели ваши добрые дела и прославляли вашего Небесного Отца.
MAT.5.18	Говорю вам: пока не исчезли земля и небо, даже мельчайшая буква, даже черточка не исчезнет в Законе. Все это сбудется! 
MAT.5.19	Того, кто нарушит хотя бы одну из самых малых заповедей и научит этому людей, Бог назовет самым малым в Царстве Небес, а кто исполнит и других научит исполнять, того назовет великим в Царстве Небес. 
MAT.5.20	Говорю вам: если вы не будете исполнять волю Бога лучше, чем фарисеи и учителя Закона, не войдете в Царство Небес.
MAT.5.22	А Я говорю вам: даже тот, кто гневается на брата, должен ответить за это перед судом; тот, кто скажет брату: «Дурак!» — должен ответить перед Советом; тот, кто скажет: «Отступник!» — должен ответить в огне геенны. 
MAT.5.23	Если несешь ты Богу свой дар и у жертвенника припомнишь, что у брата есть на тебя обида, 
MAT.5.24	оставь свой дар у жертвенника, сначала ступай примирись с братом и лишь потом вернись и принеси свой дар. 
MAT.5.25	Если кто-то ведет тебя в суд как ответчика, уладь ваш спор, пока есть время, по дороге. Иначе истец приведет тебя к судье, а судья отдаст тебя тюремщику и тебя бросят в тюрьму. 
MAT.5.26	Верно тебе говорю: оттуда не выйдешь, пока не уплатишь весь долг до последнего гроша. 
MAT.5.28	А Я говорю вам: даже тот, кто взглянул на женщину с похотью, согрешил, нарушив мысленно верность. 
MAT.5.29	Если твой правый глаз тебя вводит в грех, вырви его и отбрось! Для тебя будет лучше, если часть твоего тела погибнет, а не все твое тело бросят в геенну. 
MAT.5.30	И если правая рука твоя вводит тебя в грех, отруби ее и отбрось! Для тебя будет лучше, если часть твоего тела погибнет, а не все твое тело будет в геенне.
MAT.5.32	А Я говорю вам: всякий, кто разводится с женой, если только не по причине измены, толкает жену на грех неверности, и кто женится на разведенной, совершает тот же грех. 
MAT.5.34	А Я говорю вам: не клянись вовсе! Ни небом, ведь оно престол Бога; 
MAT.5.35	ни землей, ведь на ней покоятся ноги Его; ни Иерусалимом, ведь он город Великого Царя; 
MAT.5.36	ни головой своей не клянись — ведь не можешь ты даже волос один сделать белым или черным. 
MAT.5.37	Пусть слово твое будет «да», если да, и «нет», если нет. А все, что сверх этого, — от Злодея.
MAT.5.39	А Я говорю вам: не мсти тому, кто причинил тебе зло. Если ударят тебя по правой щеке, подставь и левую. 
MAT.5.40	Если кто-то рубашку хочет у тебя отсудить, пусть забирает и плащ. 
MAT.5.41	Если тебя принуждают сопровождать кого-то милю, пройди с ним две. 
MAT.5.42	Тому, кто просит, дай и от того, кто хочет занять у тебя, не отворачивайся.
MAT.5.44	А Я говорю вам: любите своих врагов, молитесь за тех, кто преследует вас. 
MAT.5.45	Только так станете вы сынами своего Небесного Отца, потому что Он велит всходить солнцу и над добрыми, и над злыми и посылает дождь и для праведных, и для грешных. 
MAT.5.46	Если будете любить только тех, кто любит вас, за что вас тогда награждать? Разве сборщики податей делают не то же самое? 
MAT.5.47	И если вы приветливы только с друзьями, что особенного вы делаете? Разве язычники поступают не так же? 
MAT.5.48	Так будьте совершенны, как совершенен ваш Небесный Отец.
MAT.6.2	Так вот, когда подаешь милостыню, не труби об этом во все трубы. Так делают в синагогах и на улицах святоши, для того чтобы люди осыпали их похвалами. Верно вам говорю, они сполна получают свою награду. 
MAT.6.3	А когда ты подаешь милостыню, пусть никто об этом не знает, 
MAT.6.4	чтобы помощь твоя совершалась втайне. И тогда твой Отец, видящий все, что совершается тайно, вознаградит тебя.
MAT.6.6	А ты, когда молишься, уйди в свою комнату, закрой за собой дверь и помолись своему Отцу, который здесь с тобой незримо. И тогда твой Отец, видящий все, что совершается тайно, вознаградит тебя.
MAT.6.7	Когда молитесь, не бубните, как язычники. Они думают, чем больше слов в молитве, тем вернее их услышит Бог. 
MAT.6.8	Не уподобляйтесь им! Ведь ваш Отец знает, что вам нужно, прежде чем вы Его попросите. 
MAT.6.9	А вы молитесь так:
MAT.6.9	Отец наш на Небесах!
MAT.6.9	Да прославится имя Твое, 
MAT.6.10	да исполнится воля Твоя на земле,
MAT.6.10	как на Небе.
MAT.6.11	Хлеб наш насущный дай нам сегодня.
MAT.6.12	как и мы прощаем должникам нашим.
MAT.6.13	но защити нас от Злодея. 
MAT.6.15	А если не будете прощать людям, и Отец ваш не простит вам ваши проступки.
MAT.6.17	А ты, когда постишься, причеши волосы и умой лицо, 
MAT.6.18	чтобы не знали люди, что ты постишься, а знал только Отец твой, который видит все, что совершается тайно. Тогда Отец твой, который видит все, что совершается тайно, вознаградит тебя. 
MAT.6.20	Но копи́те себе богатства на небе, где ни моль, ни ржавчина их не испортят и куда воры не заберутся и не украдут. 
MAT.6.21	Ведь там, где богатство твое, будет и сердце твое.
MAT.6.23	а если глаза больны, человек весь окутан тьмой. Но если свет, который в тебе, — тьма, то какова тогда тьма?!
MAT.6.26	Взгляните на птиц: не сеют они и не жнут, не ссыпают зерно в закрома, но их кормит ваш Небесный Отец. А разве вы не намного дороже, чем птицы? 
MAT.6.27	Кто из вас, как бы он ни старался, может продлить свою жизнь хоть на час? 
MAT.6.28	И об одежде что заботитесь? Посмотрите, как растут полевые лилии: не трудятся, не прядут. 
MAT.6.29	Но, говорю вам, сам Соломон, при всем своем блеске, не одевался, как любая из них. 
MAT.6.30	И если полевую траву, которая сегодня есть, а завтра будет брошена в печь, Бог так одевает, уж вас-то тем более, маловеры! 
MAT.6.31	Итак, не твердите озабоченно: «Что нам есть?», «Что нам пить?», «Во что одеться?» — 
MAT.6.32	это главная забота язычников. А ваш Небесный Отец знает, что вам все это нужно. 
MAT.6.33	Стремитесь прежде всего к Царству Бога и к исполнению того, что Он велит, а все остальное Он даст вам в придачу.
MAT.6.34	Так не заботьтесь о завтрашнем дне! Завтра само о себе позаботится. Каждому дню своих довольно тревог.
MAT.7.2	потому что каким судом судите, таким Он осудит и вас, и какой мерой мерите, такой Он отмерит и вам. 
MAT.7.3	Что же ты смотришь на соринку в глазу своего брата, а в собственном бревна не замечаешь? 
MAT.7.4	Как ты можешь говорить своему брату: «Дай я выну соринку из твоего глаза»? Посмотри, у тебя в глазу бревно! 
MAT.7.5	Лицемер, вынь прежде бревно из собственного глаза и тогда увидишь, как вынуть соринку из глаза брата.
MAT.7.6	Не давайте святыни собакам — они набросятся и разорвут вас. Не сыпьте жемчуга перед свиньями — они растопчут его ногами.
MAT.7.8	Всякий, кто просит, получает, кто ищет, находит, и тому, кто стучит, отворяют. 
MAT.7.9	Найдется ли среди вас человек, который, когда сын попросит хлеба, даст ему камень? 
MAT.7.10	А если попросит рыбы, даст ему змею? 
