GAL.6.10	Так вот, пока еще есть время, будем делать всем добро, особенно тем, кого вера сделала одной семьей.
GAL.6.11	Теперь я пишу вам собственной рукой — видите эти большие буквы? 
GAL.6.12	Те, которые хотят понравиться людям, вот они-то побуждают вас обрезаться: они не хотят, чтобы их преследовали за крест Христов. 
GAL.6.13	Они, хотя и обрезаны, сами не соблюдают Закон, а вас хотят обрезать, чтобы был повод похвастать этим. 
GAL.6.14	А я ничем не хочу хвастаться — одним лишь крестом Господа нашего Иисуса Христа, благодаря которому мир распят для меня, а я — для мира. 
GAL.6.15	Ведь неважно, обрезан ты или нет. Важно одно: стал ли ты новым творением Божьим? 
GAL.6.16	Мир и благодать тем, кто последует этому правилу, и им, и всему Израилю Божьему! 
GAL.6.17	Пусть впредь никто не подвергает меня новым огорчениям, ведь я ношу на своем теле знаки Иисуса. 
GAL.6.18	Благодать Господа нашего Иисуса Христа да будет с духом вашим, братья! Аминь.
EPH.1.2	Благодать вам и мир от Бога, Отца нашего, и Господа Иисуса Христа!
EPH.1.3	Да будет благословен Бог, Отец Господа нашего Иисуса Христа! Это Он одарил нас, в единении нашем с Христом, полнотой духовных даров в небесных мирах. 
EPH.1.4	Он нас избрал, в единении с Ним, еще до сотворения мира, чтобы мы были перед Ним святыми и непорочными и жили в любви. 
EPH.1.5	Он нас предназначил, через Иисуса Христа, стать Его сыновьями. Вот Его цель и добрая воля! 
EPH.1.6	Так восхвалим Его за величайшую Его доброту — за дар, которым Он нас одарил через любимого Сына, 
EPH.1.7	кровью которого мы обрели, в единении с Ним, свободу и прощение грехов. Так безмерна Его доброта, 
EPH.1.8	что излил Он щедро на нас в совершенстве ума и мудрости! 
EPH.1.9	Это Он дал нам знать Свою сокровенную цель, по воле Его изначально в Христе воплощенную. 
EPH.1.10	Этой цели достиг Он, когда исполнилось время; Он замыслил все, что есть на земле и на небе, соединить воедино в Христе, во главе с Ним.
EPH.1.11	Благодаря Ему нам выпало стать Его народом; нам изначально было предопределено, согласно замыслу Того, кто все вершит по Своей воле и намерению, 
EPH.1.12	стать хвалой Его славе, потому что мы первыми возложили надежды на Христа. 
EPH.1.13	Через Него и вы услышали слово истины — Радостную Весть о вашем спасении, благодаря Ему вы поверили и были отмечены печатью обещанного вам Святого Духа, 
EPH.1.14	который есть залог того, что мы получим наше наследие, когда Бог даст полную свободу тем, кто Ему принадлежит, и станем хвалой Его славе.
EPH.1.15	Вот почему и я, узнав о вашей вере в Господа Иисуса и о любви ко всему святому народу Божьему, 
EPH.1.16	не перестаю благодарить за вас Бога, вспоминая вас в своих молитвах. 
EPH.1.17	Пусть Бог Господа нашего Иисуса Христа, Отец в сиянии Славы, дарует вам дух мудрости и откровения, чтобы вы смогли познать Его. 
EPH.1.18	Пусть просветит Он очи вашего сердца, чтобы вы увидели, какова та надежда, к которой Он вас призвал, каково богатство и великолепие наследия, которое вы разделите с Его народом, 
EPH.1.19	и сколь неизмеримо велика Его сила, что действует в нас, верующих в Него. 
EPH.1.20	Это те же сила и могущество, которыми Бог воскресил из мертвых Христа и усадил Его по правую руку на небе — 
EPH.1.21	выше Начал и Властей, Сил и Господств; а имя Его сделал превыше имен всех не только в нынешнем веке, но и в будущем. 
EPH.1.22	И Он все покорил Ему под ноги и поставил Его, Владыку всего, главой Церкви. 
EPH.1.23	Она же есть Его тело, в ней вся полнота Того, кто наполняет Собой все творение.
EPH.2.2	из-за которых вы некогда шли злыми путями этого мира, покоряясь владыке поднебесного мира, духу, который и поныне действует в тех, кто противится Богу. 
EPH.2.3	Ведь мы все тоже из их числа, мы тоже жили по законам плотской природы, исполняя все вожделения нашего тела и ума, и из-за этого нашего естества подлежали наравне со всеми Суду Божьего гнева. 
EPH.2.4	Но Бог, богатый милостью, по великой Своей любви, которой Он полюбил нас, 
EPH.2.5	мертвых от грехов, оживил нас вместе с Христом. По доброте Его вы спасены! 
EPH.2.6	Вместе с Христом Иисусом Он воскресил нас и усадил в небесах рядом с Ним, 
EPH.2.7	чтобы через Христа Иисуса явить всем грядущим векам неизмеримое богатство Своей милости, Своей доброты к нам. 
EPH.2.8	Вы спасены — через веру — Его великой добротой! И не за ваши заслуги — это Божий дар! 
EPH.2.9	И не за дела, так что пусть никто этим не хвалится! 
EPH.2.10	Это Бог сделал нас теми, кто мы есть, создав нас, через единение с Христом Иисусом, для добрых дел, которые Он нам изначально предназначил совершить.
EPH.2.11	Поэтому помните, что вы, язычники по рождению, люди, которых называли «необрезанными» так называемые обрезанные с их телесным обрезанием, — 
EPH.2.12	помните, что в то время вы жили без Христа. Вы были чужестранцами, а не входили в число народа Божьего Изра́иля. Обещания, которые Бог дал Своему народу, к вам не относились. Вы жили в этом мире без надежды и без Бога! 
EPH.2.13	А теперь — в единении с Христом Иисусом — вы, некогда далекие, стали близкими благодаря крови Христа.
EPH.2.14	Ведь это Он — наш мир, Он, соединивший иудеев и язычников в один народ; Своим телом разрушивший стену вражды, которая разъединяла нас; 
EPH.2.15	отменивший Закон с его уставами и правилами, чтобы, установив мир, создать в единении с Собой из двух человек одного нового 
EPH.2.16	и обоих, в едином теле, примирить с Богом через смерть на кресте, уничтожив Собой вражду. 
EPH.2.17	И Он, придя, принес Радостную Весть о мире вам, жившим вдали от Бога, и тем, кто рядом с Ним. 
EPH.2.18	Так что благодаря Ему мы — и иудеи, и язычники — имеем доступ к Отцу, соединенные одним Духом.
EPH.2.19	Итак, вы больше не чужестранцы и не пришельцы, вы равноправные члены Божьего народа и Божьи домочадцы. 
EPH.2.20	Вы тоже воздвигнуты на фундаменте, заложенном апостолами и пророками, краеугольный камень которого — Христос Иисус. 
EPH.2.21	Он скрепляет собой все здание и воздвигает его, превращая в Храм, посвященный Господу. 
EPH.2.22	В единении с Ним и вы созидаетесь, чтобы стать благодаря Духу жилищем Бога.
EPH.3.1	Вот почему я, Павел, ради вас, язычников, узник Христа Иисуса [молюсь Богу]. 
EPH.3.2	Вы, конечно же, слышали о том, какой щедрый дар был мне доверен Богом для вас. 
EPH.3.3	Мне в откровении дано было узнать Его тайну, как я вкратце писал выше. 
EPH.3.4	Следовательно, прочитав, вы сможете представить, как я понимаю тайну Христа. 
EPH.3.5	В прежних поколениях человечеству не дано было знать этой тайны, но теперь Дух открыл ее святым Божьим апостолам и пророкам. 
EPH.3.6	Она в том, что и язычники получают то же наследие, и они — часть единого тела, и им тоже даны обещания Бога через Христа Иисуса в Радостной Вести, 
EPH.3.7	служителем которой я стал благодаря великой Божьей доброте ко мне, через действие Его силы. 
EPH.3.8	Мне, самому ничтожному из всего народа Божьего, был дан этот дар — возвестить язычникам Радостную Весть о непостижимом богатстве Христа, 
EPH.3.9	а также просветить всех, показав, какой Божественный замысел спасения заключен в этой тайне, от века сокрытой Богом, Творцом всего, 
EPH.3.10	чтобы только теперь всем Началам и Властям на небесах — через Церковь — стала ведома мудрость Бога во всем ее многообразии. 
EPH.3.11	Бог воплотил Свой извечный замысел в Христе Иисусе, нашем Господе. 
EPH.3.12	В единении с Ним, через веру в Него мы смело и уверенно приближаемся к Богу. 
EPH.3.13	Вот почему я прошу вас не падать духом из-за того, что я страдаю за вас. Эти страдания служат к вашей славе.
EPH.3.14	И потому я преклоняю колени перед Отцом, 
EPH.3.15	от имени которого ведет свое название всякий род на небе и на земле, 
EPH.3.16	и прошу Его наделить вас силой из сокровищ Своей Славы, даровав Духа, чтобы внутренний человек в вас становился крепче и 
EPH.3.17	чтобы благодаря вере Христос поселился в вашем сердце. Пусть любовь станет вашим корнем и фундаментом! 
EPH.3.18	И тогда вы будете достаточно сильны, чтобы вместе со всем святым народом Божьим постигнуть ширину и длину, высоту и глубину любви Христа 
EPH.3.19	и познать ее, хотя она и превосходит всякое познание. И тогда вы станете столь совершенны, что достигнете полноты совершенства Бога!
EPH.3.20	Слава Тому, чья сила, действуя в нас, способна совершить неизмеримо больше, чем все то, о чем мы можем попросить или даже помыслить! 
EPH.3.21	Слава Ему во всех поколениях через Церковь и Иисуса Христа во веки веков! Аминь.
EPH.4.1	Так вот, я, ставший узником ради Господа, умоляю вас: живите достойно того призвания, к которому вы призваны Богом. 
EPH.4.2	Будьте всегда скромны и кротки. Терпеливо, с любовью, переносите друг друга. 
EPH.4.3	Всеми силами старайтесь хранить единство духа, скрепляя его узами мира. 
EPH.4.4	Одно тело и один Дух, как и одна надежда, к которой вы призваны Богом! 
EPH.4.5	Один Господь, одна вера, одно крещение, 
EPH.4.6	один Бог и Отец всех, Он над всем, через все и во всем. 
EPH.4.7	Но всем нам, каждому в отдельности, был дан особый дар — его доля в щедром даре Христа. 
EPH.4.8	Поэтому Писание и говорит:
EPH.4.8	«Взойдя на вершину,
EPH.4.8	Он провел вереницу плененных;
EPH.4.8	Он людям дал дары».
EPH.4.9	Но что еще значит «взошел»? Не то ли, что прежде Он и нисходил в самые недра земли? 
EPH.4.10	Тот, кто нисходил, не есть ли Тот самый, кто взошел выше всех небес, чтобы наполнить собой всю вселенную? 
EPH.4.11	И это Он даровал, кому быть апостолами, кому пророками, кому евангелистами, кому пастырями и наставниками, 
EPH.4.12	чтобы приготовить святой народ Божий к делу служения, к делу созидания Тела Христа, 
EPH.4.13	пока мы все не достигнем наконец единства в вере и познании Сына Бога и встречи с Совершенным Человеком, с Христом, образцом совершенной зрелости. 
EPH.4.14	Мы больше не должны быть малыми детьми, которых любое учение уносит за собой, словно волна или порыв ветра, делая добычей ловких проходимцев, искушенных в науке обмана. 
EPH.4.15	И наоборот, если будем говорить правду с любовью, то будем расти, во всем приближаясь к Нему. Он же, Христос, есть Глава. 
EPH.4.16	Благодаря Ему сохраняет единство все Тело, части которого связаны тесными узами: каждый его орган исполняет свое предназначение, и все Тело растет и созидается любовью.
EPH.4.18	Их рассудок помрачен, они отчуждены от жизни Бога своим упорным нежеланием познать Его, ведь они совсем отупели. 
EPH.4.19	Став бесчувственными, они отдали себя во власть разнузданных страстей, не зная меры ни в какой мерзости.
EPH.4.20	А вы совсем не так познавали Христа, 
EPH.4.21	если, конечно, вы услышали о Нем, если вы были наставлены Им, ведь истина — в Иисусе. 
EPH.4.22	Вас научили, что нужно отказаться от того, что было свойственно вашему прежнему образу жизни, что нужно совлечь с себя ветхого человека, которого губят обманчивые страсти. 
EPH.4.23	Обновите свой ум и дух 
EPH.4.24	и облекитесь в Нового Человека, созданного по образу Бога, в истинной праведности и святости!
EPH.4.26	«Даже рассердившись, не допускайте себя до греха». Пусть гнев ваш остынет прежде, чем сядет солнце. 
EPH.4.27	Не оставляйте лазейки дьяволу! 
EPH.4.28	Кто воровал, пусть больше не ворует, а усердно работает собственными руками, чтобы было чем поделиться с тем, кто в нужде.
EPH.4.29	Пусть не будет у вас на языке ни одного дурного слова, лишь слова, полезные для назидания, благотворные для слушателей. 
EPH.4.30	И не печальте Святого Духа Божьего, печатью которого вы отмечены для Дня нашей полной свободы. 
EPH.4.31	Навсегда избавьтесь от раздражения, гнева, ярости, крика, проклятий вместе с прочими злыми чувствами. 
EPH.4.32	Будьте друг к другу добры, сострадательны, прощайте друг друга, как простил вас Бог через Христа.
EPH.5.1	Одним словом, старайтесь походить на Бога, ведь вы Его любимые дети. 
EPH.5.2	Живите в любви — точно так, как Христос полюбил нас и отдал за нас Свою жизнь как жертвенное приношение Богу, благоуханное и приятное.
EPH.5.3	Что же касается таких вещей, как разврат, похабство, жадность, то среди вас даже разговоров о них не должно быть. Не подобает это Божьему народу, 
EPH.5.4	так же, как всякая грязная, глупая, двусмысленная болтовня! Неуместно! Лучше благодарите Бога! 
EPH.5.5	Но в этом вы можете быть уверены: ни один развратник, похабник, хапуга (они ничем не отличаются от идолопоклонников) не имеет наследия в Царстве Христа и Бога.
EPH.5.6	Никому не дайте обмануть себя пустыми словами! Ведь это навлечет на непокорных Божий гнев. 
EPH.5.7	Пусть не будет у вас с ними ничего общего! 
EPH.5.8	Некогда вы были тьмой, а теперь, когда вы с Господом, вы — свет. Так живите, как подобает сынам света! 
EPH.5.9	А плод света — это доброта, справедливость и истина. 
EPH.5.10	Старайтесь дознаться, что приятно Господу. 
EPH.5.11	Не участвуйте в бесплодных делах тех, кто принадлежит тьме. Наоборот, своей жизнью обличайте их! 
EPH.5.12	О делах, которые творятся ими втайне, стыдно даже говорить. 
EPH.5.13	Только при свете становится видно все то, что обличается, 
EPH.5.14	а все, открытое свету, и само есть свет. Поэтому и говорится:
EPH.5.14	«Спящий, проснись!
EPH.5.14	Встань из мертвых —
EPH.5.14	и тебя осияет Христос!»
EPH.5.15	Так следите внимательно за своим поведением! Ведите себя не как люди, у которых нет ума, а как люди разумные. 
EPH.5.16	Старайтесь хорошо использовать свое время, потому что дни теперь окаянные. 
EPH.5.17	Поэтому не будьте бестолковыми, но умейте понимать, в чем воля Господа. 
EPH.5.18	И не напивайтесь вином — от него только распущенность, но наполняйтесь Духом! 
EPH.5.19	Беседуйте друг с другом словами псалмов, гимнов и духовных песнопений. Пойте и воспевайте Господа от всего сердца. 
EPH.5.20	Всегда и за все благодарите Бога Отца во имя Господа нашего Иисуса Христа.
EPH.5.21	Подчиняйтесь друг другу — из благоговения перед Христом. 
EPH.5.22	Жены — своим мужьям, как Господу, 
EPH.5.23	потому что муж — глава жены, точно так же, как Христос — Глава Церкви, Своего Тела, и Он его Спаситель. 
EPH.5.24	И как Церковь подчиняется Христу, точно так и жены должны во всем подчиняться мужьям.
EPH.5.26	чтобы посвятить ее Богу Своим словом; Он очистил ее, омыв водой в купальне, 
EPH.5.27	чтобы она предстала перед Ним во всей красе — ни пятна, ни морщины, ни другого изъяна, — то есть святой и непорочной. 
EPH.5.28	Так и мужья обязаны любить своих жен — как свое собственное тело. Кто любит жену, тот любит себя. 
EPH.5.29	Еще не было человека, который ненавидел бы свою плоть. Наоборот, он питает ее и лелеет, как Христос — Церковь, 
EPH.5.30	потому что мы — части Его тела. 
EPH.5.31	«Вот почему оставит человек отца и мать и соединится с женой, и станут двое единой плотью». 
EPH.5.32	Здесь есть великая тайна, но я так понимаю, что слова эти относятся к Христу и Церкви. 
EPH.5.33	И вы тоже, каждый из вас, должны любить своих жен, как самих себя. И жена пусть почитает мужа.
EPH.6.2	«Чти отца своего и мать» — вот первая заповедь, за которой следует обещание: 
EPH.6.3	«чтобы было тебе хорошо, и долгой будет твоя жизнь на земле».
EPH.6.6	И не напоказ, как это делают подхалимы, а как рабы Христа, исполняющие волю Бога, от всей души. 
