ACT.17.16	А в Афинах, дожидаясь их, Павел весь кипел от негодования, видя, что город полон статуй языческих богов. 
ACT.17.17	В синагоге он беседовал с иудеями и теми, кто почитал единого Бога, и, кроме того, каждый день разговаривал на площади с прохожими. 
ACT.17.18	С ним спорили и философы — эпикуре́йцы и сто́ики. «Что он хочет сказать, этот пустослов?» — говорили одни. «Он, кажется, говорит о каких-то странных божествах», — говорили другие. А проповедовал им Павел об Иисусе и Воскресении.
ACT.17.19	Они повели Павла в Ареопа́г. «Нельзя ли нам узнать, что это за новое учение, которому ты учишь? — спросили его в Ареопаге. — 
ACT.17.20	Кое-что в нем звучит для нас странно, и мы бы хотели знать, что ты имеешь в виду». 
ACT.17.21	Ведь для всех афи́нян и иностранцев, живущих в городе, нет большего развлечения, чем узнавать и обсуждать что-нибудь новое.
ACT.17.22	Павел, представ перед Ареопагом, заговорил: «Афиняне, я вижу по всему, что вы люди, в высшей степени почитающие богов. 
ACT.17.23	Когда я ходил и осматривал ваши святыни, я обнаружил алтарь, на котором написано: НЕИЗВЕСТНОМУ БОГУ. Именно этого Бога, которого вы, не зная, уже почитаете, я возвещаю вам. 
ACT.17.24	Бог, создавший мир и все, что в мире, Господин неба и земли, не живет в храмах, построенных для Него руками людей. 
ACT.17.25	Он не нуждается ни в чем из того, что могли бы предоставить Ему человеческие руки. Наоборот, это Он дал всем жизнь, и дыхание, и все остальное. 
ACT.17.26	От одного-единственного человека Он произвел все народы, чтобы они населили всю землю, заранее определив для них и точные времена, и границы их обитания. 
ACT.17.27	Он сделал это, чтобы люди искали Бога, чувствуя, что Он совсем недалеко от каждого из нас, и могли Его найти. 
ACT.17.28	Ведь в Нем мы живем, и движемся, и существуем. То же самое сказали и некоторые из ваших поэтов:
ACT.17.28	„Ибо мы все Его род“. 
ACT.17.29	И раз мы Божий род, не следует нам думать, что Бог таков, каким Его изображает — в золоте, в серебре или в камне — человеческое искусство по человеческим представлениям. 
ACT.17.30	Бог все это прощал в те времена, когда о Нем не знали. Но теперь Он повелевает всем людям везде, где бы они ни жили, раскаяться, 
ACT.17.31	потому что Он уже определил день, когда будет судить вселенную праведным судом, и уже назначил Человека, который будет судьей. Он дал всем людям доказательство этого, воскресив Его из мертвых».
ACT.17.32	Услышав о воскресении мертвых, одни расхохотались, другие же сказали: «Мы бы послушали тебя еще раз». 
ACT.17.33	Тогда Павел покинул их. 
ACT.17.34	И все же несколько человек уверовали и присоединились к нему, среди них член Ареопага Диони́сий, женщина по имени Дамари́да и другие.
ACT.18.1	После этого Павел, покинув Афины, пошел в Кори́нф. 
ACT.18.2	Там он повстречал одного иудея по имени А́квила, родом с Понта, и его жену Приски́ллу. Они недавно прибыли из Италии, потому что Клавдий приказал всем иудеям покинуть Рим. Павел пришел к ним. 
ACT.18.3	И поскольку у них было одно ремесло, он остановился у них и вместе с ними работал: они занимались изготовлением палаток.
ACT.18.4	Каждую субботу Павел беседовал в синагоге, стремясь убедить и иудеев, и язычников. 
ACT.18.5	После того как из Македонии прибыли Сила с Тимофеем, Павел посвятил все свое время проповеди Слова, свидетельствуя перед иудеями, что Иисус — Помазанник Божий. 
ACT.18.6	Но когда они стали ему резко возражать и осыпать бранью, он отряхнул плащ и сказал им: «Вы сами повинны в своей погибели. Отныне я с чистой совестью ухожу к язычникам».
ACT.18.7	И он покинул их и перешел в дом некоего Ти́тия Юста, почитавшего единого Бога; он жил по соседству с синагогой. 
ACT.18.8	Крисп, старейшина синагоги, тоже поверил в Господа, а с ним и все его домочадцы. Многие кори́нфяне, услышав Весть, тоже стали обращаться к вере и принимать крещение.
ACT.18.9	Однажды ночью Павлу было видение, в котором Господь сказал ему: «Не бойся, говори, не умолкай! 
ACT.18.10	Ведь Я с тобой, и никто не причинит тебе зла, потому что в этом городе много Моего народа». 
ACT.18.11	Павел провел там полтора года и учил, проповедуя Божью Весть.
ACT.18.12	Но когда проконсулом Аха́йи стал Галлио́н, иудеи, сговорившись, схватили Павла и привели его к нему на суд. 
ACT.18.13	«Этот человек убеждает людей почитать Бога не так, как велит наш Закон», — говорили они.
ACT.18.14	Павел не успел рта раскрыть, как Галлион заявил иудеям: «Если бы речь шла о преступлении или каком-нибудь злодеянии, я бы вас выслушал. 
ACT.18.15	Но раз все дело в словах, в именах и в вашем Законе, то разбирайтесь сами! Тут я не намерен быть судьей!»
ACT.18.16	И он прогнал их оттуда. 
ACT.18.17	Тогда все набросились на старейшину синагоги Сосфе́на и стали избивать его прямо перед судейским помостом. Но Галлиону не было до этого никакого дела.
ACT.18.19	В Эфе́се они сошли на берег. Павел оставил их, а сам пошел в синагогу и стал беседовать с иудеями. 
ACT.18.20	Его просили задержаться у них, но он не согласился. 
ACT.18.21	«Если будет на то Божья воля, я еще приду к вам», — сказал он на прощание.
ACT.18.21	Павел отплыл из Эфеса. 
ACT.18.22	Он прибыл в Кесарию, а оттуда направился в Иерусалим, навестил общину, а потом пошел в Антиохию. 
ACT.18.23	Он пробыл там некоторое время, а затем ушел и обошел всю Галатию и Фригию, укрепляя дух учеников.
ACT.18.24	В Эфесе появился один иудей по имени Аполло́с, родом из Александри́и, человек красноречивый и знаток Писания. 
ACT.18.25	Но он, хотя и был наставлен в Пути, проповедовал с большим жаром и очень верно учил всему, что касалось Иисуса, знал только крещение Иоанново. 
ACT.18.26	Он смело стал проповедовать в синагоге. Прискилла и Аквила, послушав его, пригласили его к себе и более точно изложили ему Путь Божий. 
ACT.18.27	Когда он решил отправиться в Ахайю, братья позаботились о нем и дали ему письмо к ученикам с просьбой принять его. Прибыв туда, он очень помог тем, кто благодаря милости Божьей обрел веру. 
ACT.18.28	В открытых спорах он убедительно опровергал доводы иудеев и доказывал на основании Писаний, что Иисус — Помазанник Божий.
ACT.19.1	В то время, когда Аполлос был в Коринфе, Павел пересек плоскогорье, пришел в Эфес и встретил там несколько учеников.
ACT.19.2	«Получили ли вы Святого Духа, когда поверили?» — спросил он. «Мы и не слыхали о Святом Духе». 
ACT.19.3	«Как же тогда вы крестились?» — «Нас крестил Иоанн». 
ACT.19.4	«Иоанн крестил в знак покаяния, — сказал Павел. — Но он говорил народу, что они должны поверить в Того, кто придет после него, то есть в Иисуса».
ACT.19.5	Услышав об этом, они приняли крещение во имя Господа Иисуса. 
ACT.19.6	Когда Павел возложил на них руки, на них сошел Святой Дух и они стали говорить на неведомых языках и пророчествовать. 
ACT.19.7	А было их человек двенадцать.
ACT.19.8	Потом Павел пошел в синагогу и бесстрашно проповедовал там в течение трех месяцев; он говорил о Царстве Бога и убеждал своих слушателей. 
ACT.19.9	Когда же некоторые, упорствуя в неверии, стали поносить перед всеми Путь Господень, Павел покинул их, забрав с собой учеников. Теперь он каждый день проводил беседы в школе Тира́нна. 
ACT.19.10	Это продолжалось два года, так что все жители провинции Азия, и иудеи и язычники, смогли услышать Весть о Господе.
ACT.19.11	Бог творил руками Павла удивительные чудеса. 
ACT.19.12	Достаточно было принести больным платки или фартуки, в которых он работал, как болезни оставляли их и злые духи выходили. 
ACT.19.13	И даже некоторые иудеи, бродячие заклинатели, изгоняя из одержимых злых духов, стали произносить имя Господа Иисуса. «Заклинаю вас Иисусом, которого проповедует Павел!» — говорили они. 
ACT.19.14	Сделали это и семь сыновей некоего Скевы́, иудейского первосвященника. 
ACT.19.15	Но злой дух сказал им в ответ: «Иисуса я знаю, Павел мне тоже известен. А вот вы кто такие?» 
ACT.19.16	И человек, в котором был злой дух, набросился на них с такой яростью, что одолел их всех, одного за другим, и они выскочили из того дома голые и израненные. 
ACT.19.17	Это стало известно всем иудеям и язычникам, жившим в Эфесе. На всех напал страх, и они стали относиться к имени Господа Иисуса с бо́льшим благоговением. 
ACT.19.18	Многие из поверивших пришли к Павлу и открыто сознались в том, что пользовались заклинаниями. 
ACT.19.19	И немало тех, кто занимался чародейством, принесли свои книги и при всем народе сожгли их. Когда подсчитали стоимость книг, оказалось, что стоили они пятьдесят тысяч драхм. 
ACT.19.20	Вот так мощно, широко и успешно распространялось Слово Господа.
ACT.19.21	Когда все было здесь завершено, Павел решил отправиться через Македонию и Ахайю в Иерусалим. «А после того, как я там побываю, мне надо повидать Рим», — говорил он. 
ACT.19.22	Он послал в Македонию двух своих помощников, Тимофея и Эра́ста, а сам еще на время задержался в провинции Азия.
ACT.19.23	А тем временем случилась немалая смута из-за Пути. 
ACT.19.24	Был некто, серебряных дел мастер, по имени Деме́трий, изготовлявший серебряные изображения храма Артеми́ды. Он обеспечивал работой многих мастеров. 
ACT.19.25	Собрав их и других собратьев по ремеслу, Деметрий сказал: «Друзья, вы знаете, что от этого ремесла зависит наше благосостояние. 
ACT.19.26	Но вы сами видите и слышите, что творит этот Павел. Он говорит, что боги, сделанные человеческими руками, вовсе не боги. И он сумел убедить в этом немало народа в Эфесе и почти по всей Азии. 
ACT.19.27	А это грозит не только тем, что наше ремесло приобретет дурную славу, но и тем, что само святилище великой богини Артемиды ничего не будет значить, и в конце концов будет обращено в ничто величие богини, которую чтит вся Азия и весь мир!» 
ACT.19.28	Услышав это, все пришли в ярость и закричали: «Да славится великая Артемида Эфесская!»
ACT.19.29	Волнение охватило весь город, все дружно устремились в театр, потащив туда спутников Павла, македонян Га́я и Ариста́рха. 
ACT.19.30	Павел хотел выйти к народу сам, но его не пустили ученики. 
ACT.19.31	Кроме того, кое-кто из влиятельных в этой провинции граждан, друзей Павла, передал ему просьбу не появляться в театре. 
ACT.19.32	В собрании тем временем царила полная неразбериха: одни кричали одно, другие другое, большинство даже не знало, зачем они здесь собрались. 
ACT.19.33	Кто-то из толпы потребовал от Александра — его вытолкнули вперед иудеи — объяснить народу, что здесь происходит. Александр, сделав знак рукой, хотел начать оправдываться, 
ACT.19.34	но, узнав, что он иудей, все в один голос закричали: «Да славится великая Артемида Эфесская!» — и целых два часа не умолкали.
ACT.19.35	В конце концов городской секретарь утихомирил толпу. «Граждане Эфеса! — сказал он. — Есть ли хоть один человек, которому не было бы известно, что город Эфес является хранителем храма великой богини Артемиды и ее священного изображения, упавшего с неба? 
ACT.19.36	Никто этого не оспаривает. Итак, вам надо успокоиться и не допускать опрометчивых поступков. 
ACT.19.37	Вы привели сюда этих людей, но ведь они не грабили храма и не хулили нашу богиню. 
ACT.19.38	Итак, если Деметрий с мастерами кого-то в чем-то обвиняют, для этого есть суды и власти, пусть обратятся с иском туда. 
ACT.19.39	А если вы требуете чего-то большего, тогда дело будет решено на законно созванном собрании граждан. 
ACT.19.40	Иначе мы рискуем, что за сегодняшние события нас обвинят в мятеже, потому что для этого сборища нет никаких оснований и мы ничего не сможем привести в свое оправдание».
ACT.19.40	И с этими словами он распустил собрание.
ACT.20.1	После того как смута прекратилась, Павел собрал учеников и, ободрив их, попрощался с ними и отправился в Македонию. 
ACT.20.2	Когда он проходил через те края, он много беседовал с братьями, вселяя в них бодрость. Наконец он прибыл в Грецию, 
ACT.20.3	где оставался три месяца. Он собирался плыть оттуда в Сирию, но, узнав, что иудеи готовят против него заговор, пошел в обратный путь через Македонию. 
ACT.20.4	Его сопровождали Сопа́тр, сын Пи́рра, из Береи, фессалоники́йцы Аристарх и Секу́нд, Гай из Дербы, Тимофей, а также Ти́хик и Трофим, оба родом из Азии. 
ACT.20.5	Они вышли раньше и дожидались нас в Троаде. 
ACT.20.6	А мы отплыли из Филипп после праздника Пресных Хлебов и через пять дней прибыли к ним в Троаду, где провели неделю.
ACT.20.7	В первый день недели мы собрались все вместе для преломления хлеба. На следующий день Павел должен был уходить, поэтому долго беседовал с учениками и проговорил до полуночи. 
ACT.20.8	В верхней комнате, где мы собрались, горело много светильников. 
ACT.20.9	Юноша по имени Е́втих сидел у открытого окна, и, так как беседа Павла затянулась, его сморил сон, и во сне он выпал из окна третьего этажа. Когда его подняли, он был мертв. 
ACT.20.10	Павел спустился вниз, прижался к нему и крепко обхватил его руками. «Не волнуйтесь, он жив», — сказал он. 
ACT.20.11	Вернувшись наверх, он преломил хлеб и, поев, продолжал беседу до рассвета, а потом ушел. 
ACT.20.12	А юношу, ко всеобщей радости, увели домой живого.
ACT.20.13	Мы же, не дожидаясь Павла, сели на корабль и приплыли в Асс, где должны были взять его к себе на борт. Так он распорядился, потому что сам решил идти до Асса пешком. 
ACT.20.14	В Ассе он нас встретил; мы взяли его к себе на корабль и поплыли в Митиле́ну. 
ACT.20.15	На другой день мы проплыли вдоль побережья Хи́оса, на следующий после этого день добрались до Са́моса, а назавтра прибыли в Миле́т. 
ACT.20.16	Павел решил плыть без остановки в Эфесе, чтобы не задерживаться в Азии. Он очень торопился, потому что хотел попасть в Иерусалим, если удастся, ко дню Пятидесятницы.
ACT.20.17	Из Милета он послал в Эфес за старейшинами эфесской церкви. 
ACT.20.18	Когда они пришли к нему, он сказал: «Вы сами знаете, как я прожил все это время, будучи с вами, с первого дня, когда я вступил на землю Азии, 
ACT.20.19	как служил Господу с великим смирением, в слезах, подвергаясь тяготам и испытаниям из-за иудеев и их заговоров. 
ACT.20.20	Я ничего не упустил из того, что считал для вас важным и полезным, когда проповедовал и учил вас — и при народе, и по домам. 
ACT.20.21	Я заклинал и иудеев, и язычников покаяться и поверить в Господа нашего Иисуса. 
ACT.20.22	А теперь я, покоряясь велению Духа, иду в Иерусалим и не знаю, что там меня ждет. 
ACT.20.23	Одно знаю: в какой бы город я ни пришел, Святой Дух всюду говорит мне, что мне грозит тюрьма и беды. 
ACT.20.24	Но я свою жизнь ни во что не ставлю. Лишь бы дал мне Бог завершить мой путь и служение, что я получил от Господа Иисуса, — возвестить Радостную Весть о великой Божьей доброте!
ACT.20.25	И вот теперь я знаю, что никто из вас, среди которых я возвещал Царство, не увидит больше моего лица! 
ACT.20.26	Поэтому сегодня я торжественно вам заявляю: моя совесть чиста, я не повинен ни в чьей гибели. 
ACT.20.27	Ведь я все сделал для того, чтобы воля Бога стала вам известна. 
ACT.20.28	Следите за собой и за всем стадом, смотреть за которым поставил вас Святой Дух. Пасите Церковь Божью — Он приобрел ее Себе ценой крови собственного Сына. 
ACT.20.29	Я знаю, что после моего ухода к вам придут волки лютые и не пощадят стада. 
