MAT.23.39	Inguc midaingte, dameng iwa ngenge hatacmac nganicnudaingte.”
MAT.24.1	Yesu ye Ibu-kuluckacni lobina wame mic-tengtengfocine yenge yela welelu Ibu-kuluc kwelina mac fawec, yogo edalibong 
MAT.24.2	yedi yanguc edocebawec, “Wiyac yogo yakumac nganiyackegaing, i lobewa yanguc fikedaicte, aling monic yengi foinacbenang kwesilu i sasawa hembalackebong hikeyackedaicte. Hikeyackeme posa monicti monicte feiwa mi hegilebong ngiyedaicte.”
MAT.24.3	Inguc milu
MAT.24.4	Inguc mibong Yesudi bafaliyelu yanguc miwec, “Ngic monicti kwesacngebadaickale ngenge ngani-motolu gadabiyeng. 
MAT.24.5	I yangucte, ngic homacne yengi kwesilu nale wac wackelu midaingte, ‘Na Mesia.’ Inguc milu ngic-ngigac homacne kwele basifuc aiyeledaingte.
MAT.24.6	Ailu yuwenacte siduc himong emewacni nga himong dalickacni yengele siducti kwesime ngenge yogo ngagelu mi kwatackedaing. Wiyac ingucne fikedaicte, iwahac dameng moto-motoine yogo mi motodaicte. 
MAT.24.7	Himong gocne yenge himong agofocngineng gocne yengeholec yuwenac aidaingte. Nga ngictau monicte alingti ngictau monicte aling yengeholec ngaba ainagudaingte. Ailu nosingte loloc himong gocna fikedaicte, nga himong gocna memeya sugucne badaicte. 
MAT.24.8	Wiyac i gbolicne molickelu fikenale ngigac gado hicebacaigac, ingucnehac aidaicte.
MAT.24.9	“Inguc fikeme ngic-ngigac yengi ngenge ngabafocngineng yengele molewa locngebadaingte. Locngebabong ngaba yengi wesipilic aingelelu wehomacngebadaingte. Aime himongne himongne ngic-ngigac sasawa yengi nale wacte ailu kweledi wicngebadaingte.
MAT.24.10	Nga ngic-ngigac homacne yenge ngage-sowac ailu hegilecnulu yengungtihac agofocngineng ngaba yengele molewa locebadaingte, ailu kweledi wicebadaingte. 
MAT.24.11	Nga siduc mimi kwesacine homacnedi fikelu ngic-ngigac homacne kwesacebadaingte.
MAT.24.12	Aibaba sowacne yogo suguledaicte, aime ngic-ngigac homacne yenge kwele-angacka agofocngineng yengele angac ngagelu gagale aibaba i miyac aidaicte. 
MAT.24.13	Nga ngic monic ye sanangnehac gacgume dameng motodaicte, ye wasecne aidaicte.
MAT.24.14	Aime ngic-ngigac yenge ngani-damongte Siduc Madicne yogo himong sasawa iwa hikelu edocebalu weduyelebong, yowa yogodi saweme ngic-ngigac yenge i ngageyackebong, dameng motodaicte.
MAT.24.15	“Siduc mimi Danieldi yowa monic esecnebenang miwec, yogo wiyac monic sowacnebenang aigac, idi ngiyelu mac-bala ingucne aidaicte. Wiyac sowacne yogodi Ibu-kuluc kweline gbagbacne iwa domalu Ibu-kuluc basowaleme ngenge nganidaingte. Ngic monic ye yowa yago wafelu ngage-motodaic.
MAT.24.16	Aibaba yogo fikeme ngic-ngigac Yudeya himongka gagaing, ngenge hikelu kupicka fedaing. 
MAT.24.17	Ailu monic ye mac feina domadaicte, ye wiyac monic banogale mac kwelina mi walu fedaic, ye moc hikedaic.
MAT.24.18	Nga monic ye nosing bolewa domadaicte, ye ngakpi dalicne banogale macka mi hefaliye hikedaic, ye moc hikedaic. 
MAT.24.19	Ngigac gobeholec gagaing nga nenggac kogoc amucka bacebalu gagaing, yenge dameng iwa umacnginengkolec aidaingte. 
MAT.24.20	Aime ngenge hikenogale dameng yogo tilo damengka me Sabat damengka mi fikenale milockedaing. 
MAT.24.21	Dameng iwa doic sugucnebenang fikedaicte. Doic ingucne himong molickelu fikeweckacni ofegacgu yanguctiyac monic mi fikewec, ailu lobewa inguchac hatacmac mi fikedaicte.
MAT.24.22	Aime entacka hadeng yogodi mi babangkaledaictewa, ngic monicti wasecne nalic mi aidaicte. Ngic-ngigac bawosaecebaicne, ngengele ailu dameng yogo bame bangkaledaicte.
MAT.24.23	“Dameng iwa yowa monic yanguc fikedaicte, ‘Nganining, Mesia yawa fikegac,’ me ‘Mesia ye edi fikegac.’ Inguc midaingtewa, ngenge yogo mi ngagesingkedaing.
MAT.24.24	I yangucte, mesia kwesacine nga siduc mimi kwesacine yenge fikelu ngic-ngigac kwele basifuc aiyeleningte kwesacebalu aibaba fulune nga pasi mi ngani-nganiine yogo sugucnehac badaingte. Ailu yenge yefe bafuwadaingtewa ingucne, ngic-ngigac bawosaecebaicne, yenge inguchac kwesacebadaingte.
MAT.24.25	Ngagegaing, na aibaba i fikenale biyachac edocngebabe ngageibong.
MAT.24.26	“Ngic-ngigac gocne yengi yanguc midaingte, ‘Nganining, ye himong kisiwa gagac.’ Inguc mibong ngenge iwa mi hikedaing. Me yanguc midaingte, ‘Ye mac kweline kpisicne yawa ngiyegac.’ Inguc mibong ngenge yogo mi ngagesingkedaing.
MAT.24.27	Pilatacti wenac ofe-ofeinacni pilatackeme wenac hau-hauina angolecaigac. Aime Ngicte Madec ye kwesidaicte, dameng iwa silicine ingucnehac fikedaicte.
MAT.24.28	Aoc-aoc nango yenge sic kpeleckeicne fagaing, yenge iwa tumanecaigaing. Ngicte Madec kwesidaictele dameng iwa wiyac ingucne hocne nganidaingte.
MAT.24.29	“Aime doic dameng motome,
MAT.24.29	‘Wenac-dongeine kundung kweme tamacne angocine mi angoledaicte. Aime asocmeng yenge sawawacni motolu wabong honocmengka wiyac tapiliholec yenge sasawadi dengdengebadaicte.’ 
MAT.24.30	“Dameng iwa Ngicte Madecte kwesi-kwesi-damengte sowi sawa hewacka fikeme himongne himongne ngic-ngigac sasawa yenge yogo nganilu hisonggong aidaingte. Inguc aibong Ngicte Madec ye honocmengte kaguwa kwelina tapili nga hibi-angoctowaineholecti kwesime nganidaingte.
MAT.24.31	Aime kpeng ucine sugucne hiyaemewa ye angelofocine salecebame yengi hikelu honocmeng nga himong mecine unggulucine neboc nga neboc fagac iwa hikelu Sugucne yeuctihac ngic-ngigac bawosaecebawec, yogo yenge kpaducebadaingte.
MAT.24.32	“Fik yocti fungine edocngebalu wedungeleme ngenge yogo ngagedaing. Ye mang geleng-gelengina hekengngine gbolicne siyeckelu foseme ngic-ngigac ngenge yanguc ngagecaigaing, dameng madicne aigac. 
MAT.24.33	Aime wiyac sasawa migabac, i fikeme ngenge yogo inguchac nganilu ngagedaing, Ngicte Madecte dameng i biyac bangkale welegac ailu nu lobina domagac.
MAT.24.34	“Foinac, aling yago ngenge mi homaebongkahac wiyac i fikedaicte.
MAT.24.35	Fikeme himong nga honocmeng yeke miyac aidabiyecte, nga nale yowa i mi miyac aidaicte.
MAT.24.36	“Aibaba i hocne ma hadengka ailu ma awawa fikedaicte, i monicti mi ngagedaicte. Honocmengte angelo yenge yogo mi ngagegaing, nga Madec ye inguchac mi ngagegac. Mamacti sugu dameng i ngagegac.
MAT.24.37	“Noale damengka aibabangineng fikewec, Ngicte Madec ye kwesime aibaba silicine ingucnehac fikedaicte.
MAT.24.38	Mac tunggbaung mi weleemewa ngic-ngigac yenge nosing misa noibong, ailu ngic yenge ngigac bacebaibong, nga mamac yenge yanguc miibong, ‘Na adune ngic lacnodacte.’ Inguc ailu gaebongka Noa ye wagewa fewec. 
MAT.24.39	Feme yenge mi ngagelu gaebongka mac kweme tunggbaungti kwesilu bacebayackewec. Ngicte Madecte kwesi-kwesi damengka aibaba ingucnehac fikedaicte.
MAT.24.40	Dameng iwa ngic yaeckang yeke nosing bolewa gaebocka, yekelacni monic balu monic hegileme bolewa gadaicte. 
MAT.24.41	Nga ngigac yaeckang yeke flawa macka domalu flawa lalicke gaebocka, yekelacni monic balu monic hegileme domadaicte. 
MAT.24.42	“Sugucnengineng ma hadengka kwesidaicte, ngenge yogo mi ngagegaingte ailu gung-gboli gadabiyeng.
MAT.24.43	Hise-baba ngic ye mac heuckelu fecaigac. Aime mac fileine monic ye hise ngic ma damengka kwesidaicte, yogo ngagedaictewa, ye gung-gboli nalic galu macine damongkelu hise ngic i aka holecnodaicte.
MAT.24.44	Ilec ngenge inguchac efeckelu gadabiyeng. Ngicte Madecte hadeng i ngenge mi ngageebongka kwesidaicte.
MAT.24.45	“Kwelec kwekwe monicti ngage-ngage-motockolec gadaicte. Aime sugucneinedi ye kwelec kwekwe ngic agofocine yengele damong ailu nosing damengka botoc balu yelenale micnodaicte. 
MAT.24.46	Ye bole i bayackeme sugucneine kwesilu nganime nalic aidaicte, sugucneine ye kweleine angackedaicte. 
MAT.24.47	Foinac, ye sugucneinedi wiyacine sasawa damongkenale micnodaicte. Ilec ailu ngenge silicine ilecsoc gadabiyeng.
MAT.24.48	“Nga kwelec kwekwe ngic sowacne, yebac yeuctihac yanguc ngagesidaicte, ‘Na sugucnene dameng dalicne gacguhac kwesidaicte.’ 
MAT.24.49	Inguc milu kwelec kwekwe ngic ye agofocine wecebalu ngic yengeholec misa sanangne nodaicte. 
MAT.24.50	Inguc ailu kwelec kwekwe ngic ye sugucneinele hadeng i mi ngageemewa sugucneine kwesidaicte. 
MAT.24.51	Kwesilu kwelec kwekwe ngic yogo weloc-kwalockelu ngic kwesacine yengeholec lodaicte. Aime yenge iwa hiyalu micngineng hisalangkelu gadaingte.”
MAT.25.1	“Honocmengte ngani-damong yogo adu neleweng 10 ingucne. Yenge hifangineng balu baba-tumangte ngic yeholec yefewa bafuwacnagunogale hikedaingte.
MAT.25.2	Yengelacni adu 5 yenge ngage-ngagengineng mi ileckeicne, nga 5 yenge ngage-ngagenginengkolec. 
MAT.25.3	Adu neleweng ngage-ngagengineng mikac yenge hifangineng balu kilung misaineholec monic mi badaingte. 
MAT.25.4	Nga ngage-ngagenginengkolec, yenge hifangineng balu misangineng kilungka kwebong haume badaingte. 
MAT.25.5	Aime baba-tumangte ngic yedi biyac mi kwesime, adu yenge sasawadi dongengineng gungte aime gung fadaingte.
MAT.25.6	“Faebongka deboc hewacina wawac monic yanguc fikedaicte, ‘Ngagegaing, baba-tumangte ngic yogo welegac, ngenge hikelu ye bafuwalu mengockelu kwesining.’
MAT.25.7	“Inguc fikeme adu 10 yenge gungkacni gboliye fangkelu hifangineng bamadickedaingte, 
MAT.25.8	ailu adu ngage-ngagengineng mikac yengi ngage-ngageholec yengele midaingte, ‘Hifanonggeng pisickenogale aigacte ngengi misa monic kwenolebong hauna.’
MAT.25.9	“Inguc mibong adu ngage-ngageholec, yengi bafaliyeyelelu yanguc edocebadaingte, ‘Misa yagodi nongilengsoc mi aidaicte. Ilec ngenge misa salecaigaing, yengela hikelu fuli baning.’
MAT.25.10	“Inguc mibong, yenge misa fuli banogale hikeebongka baba-tumangte ngic yogo kwesidaicte. Kwesime adu biyac efeckeicne, yengi yeholec baba-tumangte macka fedaingte. Felu nu wikebong holeme iwa noba-nosing no-angac ailu ngiyedaingte.
MAT.25.11	“Ngiyeebongka lobeina ngigac agofocngineng nebecine yenge kwesilu yanguc midaingte, ‘Sugucne, Sugucne, nu witiyenoleengka funang.’
MAT.25.12	“Inguc mibong, yedi yanguc edocebadaicte, ‘Foinac, na haic lulungngebagabac.’
MAT.25.13	“Ngenge nale kwesi-kwesi dameng nga hadeng mi ngagegaing, ilec ailu ngenge hikelu gung-gboli gadabiyeng.
MAT.25.14	“Aime Honocmengte ngani-damong yogo ngic monicti himong monicka hikedaicte, yogo ingucne. Ye hikenale kwelec kwekwefocine wacebalu moneng-mafaine yengele molewa lolu hikenale ngagedaicte. 
MAT.25.15	Ye moneng damongkedaingte, ilec tapili nga aibabanginengte silicka yanguc heuckelu yeledaicte. Ngic monic ye talant 5 nga monic ye talant yaeckang, nga monic ye talant moniyang,
MAT.25.16	Hikeme ngic talant 5 bawec, ye iwahac galu moneng bole balu talant 5 hatacmac taockelu bafuwadaicte. 
MAT.25.17	Aime ngic talant yaeckang badaicte, ye inguchac galu talant bole balu yaeckang hatacmac taockelu bafuwadaicte. 
MAT.25.18	Nga ngic talant moniyang badaicte, yedibac gacgu sugucneine moneng lacnodaicte, i balu himong falilu longka longkelu sangkedaicte.
MAT.25.19	“Aime sugucnengineng dameng dalicne gacgu hatacmac hefaliye kwesilu moneng yeledaicte, ilec ameine banogale wacebadaicte. 
MAT.25.20	Wacebame ngic talant 5 badaicte, ye talant 5 monic momoc taockelu bahikelu midaicte, ‘Sugucnene, ga talant 5 neleing aime na moneng bole balu 5 hatacmac taockelu bafuwaiba.’
MAT.25.20	“Inguc mime 
MAT.25.21	sugucnedi yanguc edodaicte, ‘Kwelec kwekwe ngic madicnebenang, ga aibabagone dondonne ailu yowa balaibeing. Aime ga yowa balaibelu wiyac kpisicnemac yogo madicne damongkeingte ailu wiyac homacnebenang damongkecte locgudacte. Weleengka naholec angacka gadabelecte.’
MAT.25.22	“Aime ngic talant yaeckang badaicte, ye inguchac kwesilu midaicte, ‘Sugucnene, ga talant yaeckang neleing, aime na moneng bole balu talant yaeckang hatacmac taockelu bafuwaiba.’
MAT.25.22	“Inguc mime 
MAT.25.23	sugucneinedi yanguc edodaicte, ‘Kwelec kwekwe ngic madicnebenang. Ga aibabagone dondonne ailu yowa ngage-ngagegone madicne. Aime ga yowa balaibelu wiyac kpisicnemac yogo madicne damongkeingte wiyac homacnebenang damongkecte locgudacte. Weleengka naholec angacka gadabelecte.’
MAT.25.24	“Aime ngic talant moniyang badaicte, ye inguchac kwesilu midaicte, ‘Sugucnene, ga ngic dacine, inguc ngagegabac. Ailu bolewa ngic gocne wiyac hole-duwec aibong ga noine kpaduckecaigic, ailu gocne wasecne wikebong ga sifu noine bacaigic. 
MAT.25.25	Ilec ailu gale hangocnume hikelu talantgone himongka longkebe fawec, i hatacmac bafaliyegabac.’
MAT.25.26	“Inguc mime sugucneinedi yowaine ameine yanguc bafaliyecnodaicte, ‘Ga kwelec kwekwe ngic sowacne ailu oyongngine. Na bolewa hole-duwec mi ailu noine kpaduckecaigabac, ailu wasecne mi wikelu sifu noine bacaigabac, ga yogo biyac ngagegic. 
MAT.25.27	Ga inguc ngagelu talantne bengka loengka ngiyedec. Ngiyeme na hefaliyelu talantne i nebocineholec badaba.
MAT.25.28	“‘Ilec ngenge talant yelacni ewalilu ngic talant 10 balu gagac, ye lacnoning. 
MAT.25.29	Ngic monic ye wiyac gocne balu gagacka, ye hatacmac lacnobong homacne aidaicte. Nga monic ye wiyac mi balu gagacka, yelacni wiyac balu gagac, yogo inguchac ewalidaicte.
MAT.25.30	Kwelec kwekwe ngic boleine sowacne yogo, ngenge ye balu lobeina kundungka wikebong haudaicte. Ye iwa haulu yengeholec iwa galu hiyalu micngineng hisalangkelu gadaingte.’
MAT.25.31	“Gacgu Ngicte Madec ye tapili nga hulili-kwelengngineholecti angelo sasawa yengeholec kwesidaingte, dameng iwa ye ngictau ngiye-ngiyewa wacine feicneholecti iwa felu ngiyedaicte.
MAT.25.32	Ailu ye himongne himongnele ngic-ngigac sasawa mime kwesilu yele dongewa kpaduckedaingte. Kpaduckebong damongti lama nga noning baucebacaigac, ye dameng iwa ingucnehac baucebadaicte,
MAT.25.33	lama yenge folewapec locebadaicte, nga noningtibac kanawapec locebadaicte.
MAT.25.34	“Inguc ailu ngictaudi ngic-ngigac folewapec yanguc edocebadaicte, ‘Ngic-ngigac Mamacnele yambungkolec, ngenge yawa welening. Ngenge yele mole-damoc nga mac-himongngineng baning, i biyachac himong molickelu fikeweckacni ofegac, iwa ngengele ngagelu loicne. 
MAT.25.35	Na nosingte homabe ngenge nosing neleibong, nga misale aineleme misa nelebong noiba. Ailu kwilic kwesilu gabe, ngengi ngani-damong aineleibong.
MAT.25.36	Na ngakpi-kpolucte basackelu kpungkelu gabe, ngengi ngakpi-kpoluc neleibong. Ailu huc fabe ngengi kwesilu damongnuibong. Ailu muc-macka ngiyebe ngengi yugucnulu nganicnuibong.’
MAT.25.37	“Inguc mime ngic-ngigac dondonne yengi yowa bafaliyelu yanguc edodaingte, ‘Sugucne, ga ma damengka nosingte homalu gaengka nganicgulu gumecguibeng, me ma damengka misale aigeleme gumecguibeng? 
MAT.25.38	Me ma damengka kwilic kwesilu gaengka ngani-damong aigeleibeng, me ngakpi-kpolucte basackelu kpungkeengka geleibeng? 
MAT.25.39	Me ma damengka hucka me muc-macka ngiyeengka yugucgulu nganicguibeng?’
MAT.25.40	“Inguc mibong ngictaudi yanguc edocebadaicte, ‘Foinac, ngenge gbafocne kpisicne yengelacni moniyang sugu kwele-madicka aicnoibong, i na hocne aineleibong. Yogo noinebenang edocngebagabac.’
MAT.25.41	“Inguc milu kanawapec domadaingte, yenge yowa yanguc edocebadaicte, ‘Ngic-ngigac ngenge Wapongte kwele-dacte bagewa gagaing, ngenge hegilecnulu dac-sanang moto-motoine mikac, iwa hikelu gadabiyeng. Yogo Aleng Sugucnengineng ye nga angelofocine, yengele ailu dac-sanang lowec i lobelu fagac.
MAT.25.42	Na nosingte homabe ngenge nosing monic mi neleibong, nga misale aineleme ngenge misa monic mi nelebong noiba. 
MAT.25.43	Ailu na kwilic kwesilu gabe ngenge ngani-damong monic mi aineleibong, ailu ngakpi-kpoluc mikac gabe monic mi neleibong. Na huc aineleme nga muc-macka ngiyebe ngenge mi yugucnulu nganicnuibong.’
MAT.25.44	“Inguc edocebame yengi yanguc midaingte, ‘Sugucne, ga ma damengka nosing misagone mikac me ngakpi-kpoluc mikac me kwilic kwesilu gaengka nonge nganicgulu kpaoma aiibeng? Me wenuwa huc-macka me muc-macka ngiyeengka nganicgulu kpaoma aigeleibeng?’
MAT.25.45	“Inguc mibong yedi yanguc edocebadaicte, ‘Foinac, ngenge gbafocne kpisicne yengelacni moniyang sugu kwele-madicka mi aicnoibong, i na aineleibong ingucne aigac, yogo noinebenang edocngebagabac.’
MAT.25.46	“Aime yenge bikicte ameine baningte doic dameng moto-motoine mikac iwa hikedaingte. Aime aling dondonne yenge gaga-sanangka fedaingte.”
MAT.26.1	Yesu ye yowa yogo sasawa miyackeme motome mic-tengtengfocine yanguc edocebawec, 
MAT.26.2	“Hadeng yaeckang faemewa ewalicebaicnele dameng ilec hombang aime, iwahac ngic yenge Ngicte Madec malicpongka wehomanogale mipangkelu saledaingte.”
MAT.26.3	Aime depec-baba ngic micne nga Yuda ngic yengele micnefocngineng, yengi Ibu-kulucte damong sugucne wacine Kaifas, yele macka felu 
MAT.26.4	Yesu akikic balu wehomanogale yowa milu hefelu 
MAT.26.5	yanguc miibong, “Ngic-ngigac yengele hewacka hudu-bigung fikedaickale ye hombang damengka mi badabeleng.”
MAT.26.6	Aime Yesu ye Betani macka galu ngic monic esecne waic-sanangkolec gawec, wacine Saimon, yele macka nosing nolu ngiyewec. 
MAT.26.7	Nolu ngiyeme ngigac monicti Yesula hikelu, kilung monic alabastros posadi baicne, ilec kwelina sanda hoine madicnedi yele hodocka sotiyeme lowacnowec.
MAT.26.8	Lowacnome mic-tengteng yenge yogo nganilu sanda fuline sugucnedi baicnele ailu, yowa heesicne milu yanguc miibong, “Ye omale wiyac fuline feicne yogo sotiyeme lowacnogac? 
MAT.26.9	I salelu moneng sugucne balu ngic waweweine yeledecka idibac madickedec.”
MAT.26.10	Inguc mibong Yesudi i ngagelu yanguc edocebawec, “Ngenge omale ngigac inguc milu kwele-umac bafuwacnogaing? Ye aibaba madicne nala aime madickegac. 
MAT.26.11	Ngic waweweine yenge damengsoc ngengeholec gadaingte, nga nani sugu ngengeholec damengsoc mi gadacte.
MAT.26.12	Na homabe longnudaingte, ilec ailu ye nalic nale soc biyac bamadickelu lowanelegac. 
MAT.26.13	Foinac, ngic yenge Siduc Madicne himongne himongne hikelu edocebalu weduyeledaingte, ilec ye inguc aiwec, ngigac yele siduc yogo momoc inguc milu ngagebong fadaicte.”
MAT.26.14	Aime mic-tengtengfocine 12 yengelacni monic Yudas Iskariot, yedi depec-baba ngic micne yengela hikelu 
MAT.26.15	yanguc uwayelewec, “Na Yesu molenginang lobe ngenge moneng edomeng nelenogale ngagegaing?” Inguc uwayeleme yengi siliwa moneng 30 wafelu lacnoibong.
MAT.26.16	Lacnobong, Yudas ye hikelu Yesu dameng monicka mudockelu banogale nganibiyelu gawec.
MAT.26.17	Gacgu bret yis mikacte hombang, ilec molickelu ngiyenogale mic-tengteng yenge Yesula hikelu yanguc uwacnoibong, “Nonge mac wenuwa hikelu Ewalicebaicnele hombangte lama madecineholec nosing bamockelu lobenangte ngagegic?”
MAT.26.18	Inguc mibong Yesudi yanguc miwec, “Ngenge taonka hikelu ngic monic biyac bawosaebac, ye nganilu yanguc edodabiyeng, ‘Wewedunonggengti gale yanguc migac, “Damengne bangkalegacte na nga mic-tengtengfocne nonge gaholec Ewalicebaicnele hombangte lama madecineholec nosing nonogale ngagegabac.” ’ ” 
MAT.26.19	Aime Yesu ye mic-tengtengfocine yowa edocebawec, i balaibelu Ewalicebaicnele hombangte lama madecineholec nosing lobelu bamockeibong.
MAT.26.20	Aime mac deboleme Yesu ye mic-tengtengfocine 12 yengeholec nosing nolu ngiyelu 
MAT.26.21	yanguc edocebawec, “Foinac, ngengelacni monicti ngaba yengele molewa locnudaicte.”
MAT.26.22	Inguc mime mic-tengteng yenge kwelengineng homacne sowaleme yengelacni moniyang moniyangti yanguc uwacnoibong, “Sugucne, i nani miyac, me?”
MAT.26.23	Uwacnobong yedi yanguc miwec, “Ngic naholec pelewa bret nogac, yedi hocne mudocnume bacnudaingte.
MAT.26.24	Ngic yedi Ngicte Madec mudockeme badaingte, ye nenggacinele gobe kwelinacni mi fikedec idibac madickedec. Mee, ye inguc aidaicte, ye ngagelu medeckedaic. Aime Ngicte Madec nale ngagelu Wapongte hibiwa yowa yanguc kwelengkeicne fagac, ye wehomadaingte hocne.”
MAT.26.25	Inguc mime Yudas ye Yesu mudockenale ngagewec, yedi inguchac yanguc uwacnowec, “Wewedu, i nani miyac, me?”
MAT.26.25	Inguc mime Yesudi yanguc edowec, “Ga geuc hocne mificnagugic.”
MAT.26.26	Aime yenge nosing nobong Yesudi bret monic balu Wapongte kwele-madic milu bauckelu mic-tengtengfocine yanguc milu yelewec, “Ngenge balu noning, yago soc-biucne.”
MAT.26.27	Inguc milu kap monic balu Wapongte kwele-madic micnolu milockelu yanguc milu yelewec, “Yago sacne, ngenge sasawadi balu noning. 
MAT.26.28	Sacne yago dodofic gbolicnele mimipang, yogo ngic-ngigac homacne yengele bikic miyac aime madickedaingte.
MAT.26.29	Na edocngebabe ngagening, waing noinele misaine hatacmac mi nolu gaebewa Mamacnele ngani-damongka nongileng momoc yefe gbolicnele alingka felu nodabelengte.”
MAT.26.30	Aime yenge kwele-madicka gee holelu mackacni walu Oliwa kupicka feibong.
MAT.26.31	Yefewa hikelu Yesudi yanguc edocebawec, “Deboc yagowa ngenge sasawadi na hegilecnudaingte. Aibaba ilec yanguc kwelengkeicne fagac,
MAT.26.31	‘Na damongngineng webe lama habu yenge singsalolong kwedaingte.’ 
MAT.26.32	Aime homackacni fangkelubac molickengelelu Galili prowinswa hikebe ngenge iwa kwesidaing.”
MAT.26.33	Inguc mime Pitadi yanguc edowec, “Gocne yenge sasawadi gale inguc milu hegilecgudaingte, nga nani sugubac nalic mi hegilecgudacte.”
MAT.26.34	Inguc mime yanguc edowec, “Na foinacbenang edocgube, deboc yagowa kokolec mi wackeemewa gagi bisocnung alecine habackang aidaicte.”
MAT.26.35	Inguc mime yedi miwec, “Ga wehomacgulu na ingucnehac wehomacnudaing, na nalic mi bisocgudacte.” Pita ye inguc mime mic-tengtengfocine yenge bafickelu yowa ihac miyackeibong.
MAT.26.36	Aime Yesu ye mic-tengtengfocine yengeholec hikecgu bole himong monic wacine Getsemane, iwa hike sulumelu mic-tengtengfocine yanguc edocebawec, “Ngenge yawa ngiyeebongka na edi lelu milockedacte.” 
MAT.26.37	Inguc milu Pita nga Sebedi madeckecine yaeckang bacebame leibong. Lelu Yesu ye kwele-umacbenang ngagelu dengdengkeme 
MAT.26.38	yanguc edocebawec, “Kwelene umale-benangkeme homanogale ainelegac, ilec ailu ngenge naholec yawa gung-gboli ganang.”
MAT.26.39	Inguc milu lelu haic mesuine himongka helulucke ngiyelu yanguc milockewec, “Mamacne, ngageengka nalic aidaictewa ga kap umacineholec yago baickenong. Ailu nale angac miyac, i ga geicne angac nga ngage-ngage yogodi sanangkedaic.”
MAT.26.40	Ye inguc milockelu mic-tengteng yengela hefaliye lelu nganicebame gung faibong. Gung fabong nganicebalu Pita yeuckelu yanguc edowec, “Ngenge omale dameng bangkacne yagowa naholec gung-gboli nalic mi gagaing? 
MAT.26.41	Ngenge lokwesacka fedaingkale gung-gboli galu milockening! Foinac, ilucnginengti efeckegac, nga himong socnginengtibac umalegac.”
MAT.26.42	Ailu ye hatacmac lelu yanguc milockewec, “Mamacne, yefe monic mi fagacte kap yago nobele miingte, nalic i nobe gale yowa sanangkedaic.”
MAT.26.43	Inguc milockelu hatac wele nganime mic-tengtengfocine yenge dongengineng gungte aime faibong. Faebongka nganicebalu 
MAT.26.44	hatacmac hegilecebalu lelu milockeme alecine habackang aime yowa molickelu miwec, ingucnehac milu milockewec.
MAT.26.45	Milockelu mic-tengteng yengela hefaliye welelu yanguc edocebawec, “Ngenge gunghac falu gagaing, me? Dameng bangkalegac, ngic yenge Ngicte Madec mudockelu bikic-baba ngic yengele molewa lodaingte. 
MAT.26.46	Mudoc ngic welegacte ailu ngenge fangkebong hikenang.”
MAT.26.47+MAT.26.48	Yudas, ye mudoc ngic, yedi molickelu aibaba ainogale depec-baba ngic micne nga Yuda ngic micnefocngineng mimiloc yowa milu yanguc biyac edocebawec, “Ngic balu muduckedacte, ngenge ngic yogo hocne hobalu badabiyeng.” Aime yengi ngic-habu i salecebabong hudu-babale fitec nga gbalucnginengkolec hikeibong.
MAT.26.47+MAT.26.48	Yesu ye inguc milu domaemewa mic-tengteng 12 yengelacni agongineng Yudas, ye ngic-habutowa sugucne mengocebalu molickeyeleme kwesiibong. 
MAT.26.49	Kwesilu ye iwahac Yesula lelu, “Ohec, wewedu.” Inguc milu balu munggungina muduckewec.
MAT.26.50	Inguc aicnome Yesudi yanguc edowec, “Agone, ga kwesilu bole banogale ngagegic, i banong.”
MAT.26.50	Mime yenge welelu Yesu moleine neboc nga neboc sanangnehac baibong. 
MAT.26.51	Aime ngic Yesuholec gaibong, yengelacni monicti hudu-babale fitec fuluckelu kwelec kwekwe ngic monic hedecine neboc wekwackewec. Ngic yogo ye depec-baba ngic yengele damong sugucne, yele kwelec kwekwe ngic.
MAT.26.52	Wekwackeme wame Yesudi yanguc edowec, “Ngic monic ye fitecti hudu badaicte, ye ameine homalu badaicte, gacgu i fikedaickale hudu-babale fitecgone macina hatacmac loengka hauna.
MAT.26.53	Nale babaficte yefe monic mi fagac, yogo ngagelu inguc aidabong. Aime na Mamacne yakumachac milockedaba ingucne, ye angelo habutowa, 72 taosen inguc, nalic salecebame walu baficnudabong. 
MAT.26.54	Aime baficnudaingtewa ingucne, Wapongte hibiwa aibaba yago fikenale kwelengkeicne fagac, i noine mi fikedaicte.”
MAT.26.55	Inguc milu ngic-habu yanguc edocebawec, “Ngenge kindololo ngic monic bacaigaing ingucne hudu-babale fitec nga gbalucnginengkolec kwesilu na bacnugaing. Aime na hadengsoc hadengsoc Wapongte Ibu-kulucka yowa edocngebalu wedungelelu gacaigabac, ngenge iwa hocne nalic bacnudabong.
MAT.26.56	Aime yabac siduc mimi yengi Wapongte hibiwa yowa kwelengkeibong fagac, ilec noine sasawa fikenale wiyac yogo fikeyackegac.”
MAT.26.56	Inguc mime mic-tengtengfocine sasawadi Yesu hegilelu hikeyackeibong.
MAT.26.57	Aime Mosesle yefe-yowale wewedu ngic nga Yuda ngic micnefocngineng yenge depec-baba ngic yengele damong sugucne Kaifas, yele macka biyac kpaduckelu ngiyeibong, iwa Yesu mengockelu hikeibong. 
MAT.26.58	Aime Pita ye lobenginang dadalisuchac Yesu balaibelu hikewec. Hike sulumelu, Yesule yowa mimoctodaingte, yogo ngagenale depec-baba ngic yengele damong sugucnele mac, ilec oda kwelina haulu mac-damong yengele hewacka ngiyewec.
MAT.26.59	Aime depec-baba ngic micne nga Yuda ngic yengele tutumangtowale memba yenge sasawadi ngiyelu Yesu homacka lonogale ailu micka lolo aicnolu yowa gocne kpolickeningte ngage-wosaec ailu mingagec aiibong. 
MAT.26.60	Inguc aibong ngic homacnedi kwesilu kwesackelu kpokpolic yowa gocne mibong, yogodi Yesu homacka lololesoc mi aime basackelu gabong gacgu ngic yaeckang yeki fikelu kpolickelu yanguc miiboc, 
MAT.26.61	“Yesudi yanguc miwec, ‘Na Wapongte Ibu-kuluc hembalackelu hadeng habackang aiyemewa hatacmac badacte, na tapiline ilecsoc fagac.’ ”
