LUK.19.11	Ye inguc milu hike Yerusalem taon bangkaleme, ilec yenge yanguc ngageibong, “Wapongte ngani-damong yogo dongenonggang benang biyac yegengkedaicte.”
LUK.19.11	Inguc ngageibongte ailu Yesudi yowa nangengngine monic holelu taockelu yanguc edocebawec, 
LUK.19.12	“Ngic monicti ngic sugucnele alingkacni fikelu, yedi yanguc ngagedaicte, ‘Na himong dalicka hikebe, yengi ngictau wac nelebong hefaliyelu himong yagolec ngictau aidacte.’ 
LUK.19.13	Aime ye hikenogale milu kwelec kwekwefocine 10 wacebalu moneng 10 wacine mina botoc balu filesoc filesoc yelelu midaicte, ‘Na hikeebewa ngenge moneng yagodi lanagulu moneng bole babong kwesilu noine nganidac.’
LUK.19.14	“Nga ngic yele mac moniyangfocine, yengibac ye kweledi wikeibong. Inguc aime ye hikelu ngic gocne yanguc milu edocebalu salecebame hikeibong, ‘Yedi nongele ngictau ganale angac mi ngagegabeleng.’
LUK.19.15	“Aime ye iwa game yengi ngictau wac lacnobong gacgu hatacmac hefaliyelu himongngina kwesiwec. Kwesilu kwelec kwekwefocine moneng yelewec, yogo noine wenuc basuguleibong, yogo ngagenale wacebawec.
LUK.19.16	“Wacebame kwelec kwekwe molic-molic yedi welelu miwec, ‘Sugucne, na moneng neleing, yogo basugulelu moneng 10 hatacmac bafuwaiba.’
LUK.19.17	“Inguc mime ngictaudi yanguc miwec, ‘Ga kwelec kwekwe madicne ailu bole madicne baing. Ga yowa miiba, balaibelu wiyac kpisicne madicne damongkeingte taon 10 damongebanogale bole-yowa nga kuc gelegabac.’
LUK.19.18	“Aime kwelec kwekwe lobe, yedi kwesilu miwec, ‘Sugucne, moneng neleing, yogolec moneng 5lesoc hatacmac basuguleiba.’
LUK.19.19	“Inguc mime ngictaudi miwec, ‘Ga taon 5 yogolec damong locgugabac.’
LUK.19.20	“Aime kwelec kwekwe monicti welelu miwec, ‘Sugucne, monenggone yago kpoluc kwelina sangkebe ngiyewec, yago nganic. 
LUK.19.21	Ga ngic dacine ailu gocne kpakpaduc bolele moneng lobong sifu yengelacni bacaigic. Nga gocne bolewa hole-duwec aibong sifu yengelacni noine kpaduckecaigic, ilec gale hangocnume inguc aiiba.’
LUK.19.22	“Inguc mime ngictaudi miwec, ‘Ga kwelec kwekwe sowacne benang, yowagone bafaliyebe yogodi hicgudaicte. Na ngic dacine ailu kpakpaduc bolele moneng mi lolu sifu bacaigabac. Nga bolewa hole-duwec mi ailu sifu noine kpaduckecaigabac, yogo biyac ngagegic. 
LUK.19.23	Aime ga omale monengne yago moneng bengka mi loing? Inguc aidengka hefaliyelu monengne yogo nebocineholec badaba.’
LUK.19.24	“Inguc milu ngic-ngigac gocne iwahac domaibong, yengele yanguc miwec, ‘Ngenge moneng yogo ewalilu kwelec kwekwe monengngine 10 facnogac, ye lacnoning.’
LUK.19.25	“Inguc mime yengi miibong, ‘Sugucne, ye monengngine 10 biyac fagac.’
LUK.19.26	“Inguc mibong yanguc bafaliyeyelewec, ‘Ngic monic wiyac gocne facnogac, ye wiyac hatacmac lacnodaingte nga monic ye wiyac monic mi facnogac, ye wiyac fagac, yogo ingucneyac ewalidaingte, yogo edocngebagabac.
LUK.19.27	Aime ngabafocne yago yenge nani ngictaungineng galu damongebanogale takicebawec, ngenge ngic yogo yawa baceba kwesilu dongena wehomacebaning.’”
LUK.19.28	Yesu yowa inguc mime motome ye molickelu Yerusalem fewec. 
LUK.19.29	Felu kupic wacine Oliwa, yogolec emewa kwesilu Betfage nga Betani mac-himong bangkalelu mic-tengteng yaeckang, yanguc milu salecepawec, 
LUK.19.30	“Ngeke dondonne hikelu mac-himong yefe molic-molicka ngiyegac, iwa felu donggi madecine monic ngicti witina mi ngiyeicne, yogo witickebong domagac. Domame ngeke i bafuwalu witic lukelu balu yawa welenic. 
LUK.19.31	Aime monicti midaicte, ‘Ngeke omale donggi madecine lukegabiyec?’ Inguc uwangeteme ngeke yanguc midabiyec, ‘Sugucne ye yogodi bole banale migac.’”
LUK.19.32	Yesudi inguc milu ngic salecepame hikelu ye miwec, yogo sasawa bafuwaiboc. 
LUK.19.33	Bafuwalu donggi madecine lukeboc filefocinedi uwayeteibong, “Ngeke omale donggi madecine lukegabiyec?”
LUK.19.34	Inguc mibong yeki miiboc, “Sugucne ye yogodi bole banale migac.”
LUK.19.35	Inguc milu yeke donggi madecine yogo Yesula balu hikeiboc. Ailu Yesudi felu ngiyenale yeke ngakpinginec dalicne hemoctolu donggi madecinele witina weasickelu Yesu fenale bafickeiboc. 
LUK.19.36	Bafickeboc ye felu ngiyeme hikeemewa, iwa ngic-ngigac yenge ngakpi dalengineng hemoctolu yefeina lumackeibong.
LUK.19.37	Aime Yerusalem emeina Oliwa kupicte yefe hau domagac, iwa yele mic-tengtengfocine habu sugucne yenge pasi nganilu gaibongte ailu kwele-madic ngagelu beliyelu uc sugucneholec Wapong mimadickelu yanguc miibong,
LUK.19.38	“Ngictau Sugucnele wacka welegac, ye yambungineholec. Honocmengka kwele-efec fame sawawa wilini wac feicne fadaic.”
LUK.19.39	Wackelu mitengkebong Farisaio gocne habu yengele kebangka domaibong, yengi Yesule miibong, “Wewedu, ga mic-tengtengfocgone miyeleengka waickening.”
LUK.19.40	Inguc mibong Yesudi yanguc bafaliyeyelewec, “Yenge waickebong posa yengi aukwedaingte, yogo edocngebagabac.”
LUK.19.41	Yesu Yerusalem bangkalelu taon yogo nganilu ngic-ngigac yengele hiyalu 
LUK.19.42	yanguc miwec, “Ngenge yangucteyac kwele-mogungkolec ganingte yefe ngani-motobong madickedaicka. Aime yefebac yakumac sangke-sangke fame dongenginang mi yegengkedaicte. 
LUK.19.43	Ngengele damengngineng monic weledaicte, iwa ngabafocngineng yenge neboc nga neboc wabungngebalu himong heuckelu habuwebong feme igocngebadaingte. 
LUK.19.44	Igocngebalu yengi basowalecngebadaingte, adu-madecfocngineng ngengele kebangka gagabiyeng, yenge wehomacebayackebong himongka fadaingte. Ailu ngengele kwelina posa monic hegilebong monicti monicte witiwa mi ngiyedaicte, i Wapongti weleyec, ngenge yogo mi ngani-motogaing.”
LUK.19.45	Ailu Yesudi Ibu-kulucte oda kwelina felu ngic-ngigac yengi wiyac salelu fuli balu gabong, yenge yebicebalu 
LUK.19.46	yanguc edocebawec, “Yowa yanguc kwelengkeicne fagac,
LUK.19.46	‘Na Ibu-kulucne yagodi mimilocte mac aidaic.’ 
LUK.19.46	Aime ngengibac mac yogo bafaliyebong,
LUK.19.46	‘Hise-baba yengele sangke-sangke mac aigac.’” 
LUK.19.47	Aime Yesudi hadengsoc Ibu-kulucka wewedu bole baemewa depec-baba ngic micne nga Wapongte yefe-yowale wewedu ngic ailu habu yengele micnefocngineng yenge Yesu wehomanogale aibibiyelu gaibong.
LUK.19.48	Aime ngic-ngigac yenge yele yowa ngagepangkelu gaibong nga yowaine monic hegileningte mi ngageibong. Yogolec ailu ngaba yenge ye baickeningte yefe monic mi bafuwaibong.
LUK.20.1	Yesu ye dameng monicka Ibu-kulucka ngic-ngigac edocebalu weduyelelu siduc madicne edocebame, depec-baba ngic micne nga Wapongte yefe-yowale wewedu ngic ailu Yuda-ngic micnefocngineng yenge yengileng bucnac wele haicina domalu 
LUK.20.2	uwacnolu miibong, “Edocnubac, ga ma kucka bole yogo bagamec, me madi bole-yowa yogo gelewec?”
LUK.20.3	Mibong yanguc milu bafaliyeyelewec, “Aime na inguchac uwangelebe edocnuning: 
LUK.20.4	Yohanedi misa-lowac bole balu gawec, bole yogo honocmengkacni me ngickacni?”
LUK.20.5	Mime yenge yengilangkac mingagec ailu yanguc miibong, “‘Yogo honocmengkacni,’ inguc midabelengtewa, aime ye yanguc uwanoledaicte, ‘Aime ngenge omale ye mi ngagesingkeibong?’ 
LUK.20.6	Me ‘ngickacni’ inguc midabelengtewa, ngic-ngigac yenge Yohane ye Wapongte sinaic mimi, inguc kwelenginengti ngagesingkegaingte ailu, posadi wickelu hole-homacnubadaingte.”
LUK.20.7	Inguc milu yanguc bafaliyecnoibong, “Nonge bole yogo wenuwacni welegac, i mi ngagegabeleng.”
LUK.20.8	Mibong Yesudi yanguc bafaliyewec, “Inguc migaingte, na inguchac ma kucka bole bacaigabac, yogo mi edocngebadacte.”
LUK.20.9	Inguc milu Yesudi yowa nangengngine ngic-ngigac yanguc edocebawec, “Ngic monicti waing boleina waing duwewec. Duweme motome ye waing bole damongkeningte ngic gocne bafuwacebalu yengeholec yowa hefeibong, ailu yeicnebac dameng dalicne himong monicka ganale hikewec.
LUK.20.10	“Hikegacgume waing noine babale dameng weleme kwelec kwekweine monic saleme waing bolele damong yengela hikeme yengi waing noine, nebocine ye lacnoningte hikewec. Hikeme waing bolele damong yengi kwelec kwekwe yogo welu moc benang salebong hikewec. 
LUK.20.11	Hikeme bole fileinedi inguc nganilu hatacmac monic salewec. Saleme hikeme waing bolele damong yengi ye inguchac welu aibaba sowacne benang aicnolu moc benang salebong hikewec. 
LUK.20.12	Aime hatacmac kwelec kwekweine monic saleme hikeme alecine habackang aime ye inguchac webong sacine wame yebiyebong hikewec.
LUK.20.13	“Inguc aime bole fileinedi miwec, ‘Na wenuc aidacte? O, madec benangne angac ngagecnocaigabac, ye salebe hikeme ye alang bacnodaingte mecne.’
LUK.20.14	“Milu saleme waing bolele damong yengi ye nganilu yengilangkac mingagec ailu miibong, ‘Yedi gacgu bole yago edeme feme yeicne aidaicte, nongileng ye wehomalu yele himong nga mole-damocine nongileng aidaic.’ 
LUK.20.15	Inguc milu madec yogo balu fuluckebong bole lobina haume wehomaibong.”
LUK.20.15	Milu Yesudi uwayelewec, “Bole fileine yogodi waing bolele damong yengele wenuc aiyeledaicte? 
LUK.20.16	Ye kwesilu waing bolele damong wehomacebame homayackebong, waing bole yogo bole damong gocne yengele molewa lodaicte.”
LUK.20.16	Mime yenge i ngagelu yanguc miibong, “Inguc benang mi fikedaic.”
LUK.20.17	Inguc mibong Yesudi nganicebalu yanguc miwec, “Fungine omale yanguc kwelengkeicne fagac, yogo ngagedaing,
LUK.20.17	‘Mac-baba ngic yenge posa yogo hegilelu wikeibong, posa idi mac unggulucinele posa-bosing sanangne aiwec domagac.’ 
LUK.20.18	Ngic-ngigac sasawa yenge posa idi witiwa wawecebadaicte, yenge socngineng lokeyackedaicte. Nga posa yogodi yengele feiwa wawecebadaicte, posa idi hepelecebame kapuc kwedaingte.”
LUK.20.19	Aime Wapongte yefe-yowale wewedu ngic, nga depec-baba ngic micne, yenge Yesudi yengele yowa nangengngine miwec, yogo biyac ngage-motoibongte ailu iwayac banogale aiibong, ailu ngic-ngigac yengele hangocebamebac hegileibong.
LUK.20.20	Ilec yenge Yesu nganibiyelu ngicfocngineng salecebaibong, yenge yowaine ngagegaing silic yela hikeibong. Hikelu oma yowa wenuc mime ngagelubac prowinsle ngic micne yele molewa loningte ngageibong.
LUK.20.21	Ailu ngic yogo yenge Yesule miibong, “Wewedu, yowa migic nga wiyac wedunolegic, yogo noine sasawa ailu Wapongte yefe, yogo sugu ngic-ngigac edocebalu weduyelelu yowa monic-mi monic-mi mi aicaigic, gale inguc ngagecaigabeleng. 
LUK.20.22	Ilec edocnubac: Nonge takes ngictau Sisa nalic lacnodabelengte me miyac?”
LUK.20.23	Inguc mibong Yesudi kwesacngineng ngani-motolu yanguc edocebawec, 
LUK.20.24	“Ngenge moneng yogo monic edalicnubong nganibe! Iluc nga hibi ya male?”
LUK.20.24	Mime miibong, “Yogo Sisale.”
LUK.20.25	Mibong Yesudi miwec, “Ilec ngenge Sisale wiyac yogo Sisa lacnodaing, nga Wapongte wiyac yogo Wapong lacnodaing!” 
LUK.20.26	Inguc mime yenge kwatackelu ngic-ngigac yengele dongewa micka lolo aicnolu ye banogale yogo aibibiyebong yowangineng ameine inguc bafaliyewec, ilec ngage-bibiyelu yowa monic mi miibong.
LUK.20.27	Aime Sadyusi
LUK.20.28	“Wewedu, Mosesdi yowa yanguc kwelengkenolewec,
LUK.20.28	‘Ngic monic ye ngigac balu gboliine mikac gacgu homame ngic yele gbainedi haeinele hosec balu gboliholec ailu haeinele wac bafangkelu gadaicte.’ 
LUK.20.29	Dameng monicka hae-gba 7 gaibong. Galu haengineng molic-molicti ngigac balu gboli mikac moc gacgu homadaicte. 
LUK.20.30	Homame gbainedi haeinele hosec balu 
LUK.20.31	moc gacgu homadaicte. Aime gbanginecti hosec, yogo balu inguchac gboliine mikac gacgu homame hae-gba 7 yenge ngigac yogoyac balu gbolifocngineng mikac gacgu homayackebong 
LUK.20.32	ngigac ye inguchac homadaicte. 
LUK.20.33	Ngigac ye ngic 7 yengele ngigacngineng ailu gacgu homackacni fangke-fangke damengka hae-gba 7 yengelacni male ngigac aidaicte?”
LUK.20.34	Inguc mibong Yesudi yanguc bafaliyeyelewec, “Himong yagolec gaga damengka ngicti ngigac bagaing, nga mamac yenge migaing ‘Na adune ngic lacnodacte.’ 
LUK.20.35	Aime ngic-ngigac yenge homackacni gboliyelu fangke-fangke, nga gaga-sanang banogale aidaingte, yenge iwa ngawe-ngigac mi aidaingte. 
LUK.20.36	Yenge homackacni fangke-fangke, yogolec fungine aigaing. Nga Wapongte adu-madecfocine ailu angelo ingucne galu hatacmac nalic mi homadaingte. 
LUK.20.37	Aime homackacni fangke-fangke fagac, yogo Mosesdi inguchac kwelengkelu mime yegengkeyelewec. I yanguc, yoc-kpisicka dac lobeme ye nganiemewa yowa yanguc fikewec,
LUK.20.37	‘Na Abraham nga Aisak nga Yakobo yengele Wapongyac gagabac.’ 
LUK.20.38	Gbolicne gagale Wapong, nga homaicne yengele Wapong miyac. Yele ngani-nganiwa sasawadi gaganginengkolec aigaing.”
LUK.20.39	Aime Wapongte yefe-yowale wewedu ngic gocne yenge yanguc miibong, “Wewedu, yowa madicne benang migic.” 
LUK.20.40	Aime ilec lobeina yenge hangocebame monicti uuwa hatacmac mi uwacnoibong.
LUK.20.41	Inguc aime Yesudi miwec, “Ngenge yowa yanguc ngagesidaing: Ailu yowa yanguc fagac, ‘Mesia ye Dawidile gboli.’ 
LUK.20.42	Nga Dawidi ye yeuctiyac Miti geewa yanguc miwec fagac,
LUK.20.42	‘Sugucnedi nale Sugucne edowec,
LUK.20.43	gacgu ngabafocgone locebabe higegone bageina muki ingucne aidaingte.” ’ 
LUK.20.44	Ilec Dawidi ye ‘nale Sugucne’ wackewecti wenucka yele gboli aigabac?”
LUK.20.45	Aime Yesu ye ngic-ngigac sasawa yengele dongewa mic-tengtengfocine yanguc edocebawec, 
LUK.20.46	“Ngenge Wapongte yefe-yowale wewedu ngic yengele ngani-motolu gadabiyeng! Yenge ngakpi dale madicne holelu mac-boneng ganogale angac ngagedaingte, nga maketka hikebong ngic-ngigac yengi yengele wenac madic miyeleningte angacngineng sugucne fagac. Ailu kpakpaduc macka nga nosing hodocine hole-holele damengngina ngiye-ngiye molic-molicka ngiyenogale angacebacaigac. 
LUK.20.47	Ailu yenge ngigac-hosec yengele mac ewalicebacaigaing. Ailu ngage-madickeyeleningte mimiloc dalicneyac milockecaigaing. Kwesac ingucne aicaigabiyengte yenge ameine umacneyac badaingte.”
LUK.21.1	Aime Yesu ye donge hilalu nganime moneng-mafaholec yenge ibungineng Ibu-kulucte katapawa lobong haume, 
LUK.21.2	ngigac-hosec waweweine monicti toya-hakic yaeckang, sugu lome haume nganilu 
LUK.21.3	yanguc miwec, “Ngigac-hosec waweweine yagodi moneng lome ngic sasawa ibu logabiyeng, yogo ewalicebalu logac, yogo noine benang edocngebagabac.
LUK.21.4	Yogo yanguc, yenge mafatowangineng wakelu fagac, iwacni nebocine ibungineng logabiyeng, nga ngigac yebac facnowec yogo sasawa loyackegac.”
LUK.21.5	Aime gocne yenge Ibu-kulucte hibine madicnedi baicne aime ibu nga wiyac haic fungine funginedi Ibu-kulucka Wapong kwele-madicka lacnolu gaibong, yogodi Ibu-kuluc hibineholec ainale lesoine lolu gaibong, yogo nganilu siduc mibong Yesudi yanguc edocebawec, 
LUK.21.6	“Mac yogo ngani-angac homacne aigaing. Dameng monic weleme, iwa sasawa hembalackedaingte. Ailu posa monicti monicte feiwa hegilebong mi ngiyedaicte.”
LUK.21.7	Inguc mime yenge uwacnoibong, “Wewedu, aibaba migic, yogo ma damengka fikedaicte, nga dameng iwa oma aibaba fikeme nganilubac dameng bangkalegac inguc ngagedabelengte, ilec edocnubac.”
LUK.21.8	Inguc mibong Yesudi miwec, “Monicti kwesacka mengocngebadaickale, ngage-homalu gadaing. Homacnedi welelu nale wac wackelu midaingte, ‘Na Mesia,’ ailu ‘Dameng biyac bangkalegac.’ Inguc mibong mi balaibecebadaing! 
LUK.21.9	Nga yuwenactowa ailu ube-kwekwe uctowaineholec fikeme ngagelu ilec medecngebame hangoc mi aidaing! Omale, wiyac ingucne molickelu fikedaicte, nga damengbac iwayac mi miyac aidaicte, miyac.”
LUK.21.10	Ailu hatacmac taockelu miwec, “Himong gocne yenge himong gocne yengeholec yuwenac ainagudaingte, nga ngictau monicte alingti ngictau monicte aling yengeholec ngaba ainagudaingte. 
LUK.21.11	Ailu memeyatowa sugucne badaicte, nga loloc-dameng fikeme huc sugucne himong monicka nga monicka inguchac fike-hikedaicte. Nga sawawa aibaba silicine fungine fungine, hangoc-hangocine fikeme nganidaingte.
LUK.21.12	“Aibaba ingucne mi fikeemewayac yenge nale wacte ailu weyebic aingelelu bacngebalu kpakpaduc macte damong yengele molewa locngebadaingte. Aime yenge muc-macka locngebabong ngictau nga gawana yengela bacngebalu hikedaingte. 
LUK.21.13	Nga ngenge dameng iwayac nale mimi-yegeng yowa edocebaningte yefe fikengelenale, 
LUK.21.14+LUK.21.15	nani ngage-ngage-motoc ngelelu yowa micnginang lodacte. Inguc aibe ngabafocngineng yengele hewackacni yowa ngeledacte, yogo monicti nalic mi bawadaicte, me wedaicte. Ilec ailu ngenge yengele dongewa yowa minang milu mibamoc mi aidaing.
LUK.21.16	Aime nenggac-mamac nga hae-gbafocngineng ailu sac-tofa nga agofocngineng yengi mudocngebalu ngaba yengele molewa locngebabong, ngengelacni gocne wehomacebadaingte.
LUK.21.17	Aime nale wacte ailu sasawadi kweledi wicngebabong 
LUK.21.18	ngengele hodocnginengte hodoc-docngineng monictibac nalic mi sifuwedaicte.
LUK.21.19	Ngenge sanangneyac domadaingtewa ngengileng gaganginengte gaga-sanang badaingte.
LUK.21.20	“Aime hudu-baba ngic habu yenge Yerusalem hewalingkedaingte, dameng iwa yanguc biyac ngagedaingte, taon sowalenale dameng biyac welegac. 
LUK.21.21+LUK.21.22	Dameng yogo ame badu-badu dameng, aime yowa sasawa kwelengkeicne fagac, ilec noine fikedaicte. Ilec ailu Yudeya himongka gagaing, yenge dameng iwa hikelu kupicka fedaing, nga Yerusalem kwelina gagaing, yenge hikelu lobina haudaing, ailu lobina gagaing, yenge Yerusalem kwelina mi fedaing!
LUK.21.23	Himong yagowa umac sugucne fikeme ngic-ngigac ngaba aiyeledaingte. Ilec ailu dameng iwa ngigac gobeholec gagaing, nga nenggac kogoc amuc gumecebacaigaing, yenge umacnginengkolec. 
LUK.21.24	Aime ngaba yenge hudule fitecti ngic gocne wehomacebalu gocne witicebalu himongne himongne baceba hikelu locebadaingte. Aime Israel yengele alingkacni miyac yengi kwesilu Yerusalem higenginengti edesockelu gaebongka damengngineng yogo motome hikedaingte.
LUK.21.25	“Dameng iwa wenac nga tamacne ailu asocmeng yengela sowi fikedaicte. Aime himongne himongne yenge kwele-umac balu dingongka domalu kiwec dibongte uc ngagelu ngageboc ailu kauc badaingte.
LUK.21.26	Ailu sawawa wiyac kucineholec sasawa yenge sulingkedaingte, ilec ngic-ngigac yenge umac yogodi himongka fikenale ngagelu ngageboc nga hangoc ailu homa-gbolic aidaingte. 
LUK.21.27	Aime ngagedaingte dameng iwa yenge Ngicte Madec ye kuc nga hulili-kwelengngineholecti kaguwa kwelina kwesime nganidaingte.
LUK.21.28	Aibaba yogo fikenale aiyemewa umackacni bamoctocngebabong feningte dameng bangkalegacte ailu fangkelu hodocngineng bafangkelu nganilu domadaing.”
LUK.21.29	Aime Yesu ye yowa nangengngine yanguc edocebawec, “Ngenge fik yoc nga yoc sasawa nganilu ngagedaing.
LUK.21.30	Yoc yenge hekengngineng fosedaingtewa, wenac dameng bangkalegac, inguc ngengung biyac ngagedaingte! 
LUK.21.31	Ngenge wiyac sasawa migabac yogo fikeme nganilu yanguc ngagedaing, Wapongte ngani-damong biyac bangkalecnubagac.
LUK.21.32	“Foinac, aling yago, yenge mi homaebongkahac wiyac yogo fikeyackedaicte. 
LUK.21.33	Aime himong nga honocmeng, yeke miyac aidabiyecte, nga nale yowa idibac nalic mi miyac aidaicte, yogo noine benang.
LUK.21.34	“Aime kwele-sifuc nga misa-nonole ailu himongte ngageboc yogodi baumalecngebadaickale, ngenge damongngineng banagudaing! Hadeng yogodi biyac fikengeledaic ilec. 
LUK.21.35	Yogo yangucte, hadeng yogodi himongne himongne subadi sic wecaigac, ingucnehac ngic-ngigac sasawa yengela fikedaicte, 
LUK.21.36	ilec ngenge damengsoc damongnagulu mimiloc bole bagadaing. Bagacgu wiyac sasawa yogo fikenoga aigac, yogo ewalilu kuc balu Ngicte Madec, yele dongewa sanangkelu domadaingte.”
LUK.21.37	Aime dameng iwayac Yesu ye hadengsoc Ibu-kulucka wewedu bole balu gawec. Balu gacgume mac aweleme kupic monic wacine Oliwa, iwa hikeme deboleme ngiyelu gawec. 
LUK.21.38	Game mac saeme ngic-ngigac sasawa yenge Ibu-kulucka yele yowa hatacmac ngageningte hikelu gaibong.
LUK.22.1	Hombang monic, bret yis mikac, wacine monic Ewalicebaicnele hombang micaigaing, hombang yogo bangkalewec.
LUK.22.2	Aime depec-baba ngic micne nga Wapongte yefe-yowale wewedu ngic yenge Yesu homacka lonogale yefe monic bafuwanogale ngagesilu ngic-ngigac yengele hangocebame aibibiyeibong. 
LUK.22.3	Mic-tengtengfocine 12 yengelacni monic Yudas wacine monic Iskariot, ye Aleng Sugucnenginengti yele kwele-ngage-ngageina haume,
LUK.22.4	yedi hikelu depec-baba ngic micne nga Ibu-kulucte lebe-ngic damongngine, yengeholec ngiyelu Yesule yefe wenuc balu yengele molewa lonale yowa mingagec aiibong. 
LUK.22.5	Aime yenge kwele-madic ngagelu moneng gocne lacnoningte milu yowa hefeibong. 
LUK.22.6	Yudasdi yengeholec kwele moniyang ailu yefe wenuc bafuwalu habu yenge yeholec mi gaebongka ye sangke-sangke galu Yesu yengele molewa lonale donge hilalu gawec.
LUK.22.7	Gaemewa bret yis mikac, ilec hombangka lama madecine wecaigaing, hadeng yogo weleme
LUK.22.8	Yesudi Pita nga Yohane yanguc milu salecepawec, “Ewalicebaicnele hombangte lama madecineholec nosing nonangte ngeke hikelu wiyac bamockenic!”
LUK.22.9	Inguc mime uwacnolu miiboc, “Wenuwa bamockenacte ngagesigic?”
LUK.22.10	Miboc bafaliyeyetelu yanguc miwec, “Ngeke hikelu taonka fedabiyecte, iwa ngic monic misa-hebecine kukuwelu weleme yeholec luwelu balaibe lelu ye mac monicka feme ngeke yeholec felu
LUK.22.11	mac fileine yanguc edodabiyec, ‘Wewedudi gale yanguc uwagac: Mac kweline weni iwa mic-tengtengfocne yengeholec Ewalicebaicnele hombangte nosing nodabelengte?’ 
LUK.22.12	Inguc miboc yedi mac sawawa kweline sugucne iwa wiyac biyac loicne ngiyeyackegac, yogo edalicngepame ngeke iwa nosing bamockedabiyec.”
LUK.22.13	Aime yeke hikelu Yesudi miyetewecsoc ngic yogo bafuwalu Ewalicebaicnele hombangte nosing bamockeiboc.
LUK.22.14	Aime nosing-nono dameng weleme Yesudi salecebaicne yengeholec nosing nonogale ngiyelu 
LUK.22.15+LUK.22.16	yanguc edocebawec, “Ewalicebaicnele hombangte nosing yago ngengeholec nonogale homacne ainelegac. Na nosing yago hatacmac mi nolu gaebewa Wapongte ngani-damong kwelina hombangte fungine fikedaicte yogo nolubac doicka fedacte. I noine edocngebagabac.”
LUK.22.17+LUK.22.18	Inguc milu kap monic balu Wapong kwele-madic micnolu miwec, “Na yanguc edocngebagabac, Na waing noinele misaine hatacmac mi nolu gaebewa Wapongte ngani-damong weledaicte, ilec ngenge wiyac yago balu ngengung lanagulu noning.”
LUK.22.19	Inguc milu bret monic balu Wapong kwele-madic edolu baucke yelelu yanguc miwec, “Yago soc-biucne, yago ngengele ailu loicne. Ngenge yogo nolu nale ngagesilu inguc nolu gadaing!”
LUK.22.20	Nosing nobong motome ye kap inguchac balu miwec, “Kap yago sacnele dodoficnonggeng gbolicne, yogo ngengele ailu sotingkeicne.
LUK.22.21+LUK.22.22	“Ailu Ngicte Madec ye Wapongti yefe micnowecka hikedaicte hocne nga ngic doicka locnudaicte ye nosing tebowa momoc ngiyegabeleng, aime ngic yogo yedibac basowalenowagac.”
LUK.22.23	Inguc mime mic-tengtengfocine yengungtiyac uwanaguibong, “Madibac nongileng hewackacni aibaba yogo aidaicte.”
LUK.22.24	Aime mic-tengteng yenge yengileng hewackacni madi feicne gagac, ilec yowangineng fec-wac aime
LUK.22.25	Yesudi edocebalu miwec, “Himongka ngictaufocngineng yenge ngic damongebalu mic-tengtengfocngineng bacebacaigaing. Bacebalu micaigaing, ‘Nonge babaficngineng gagabeleng.’
LUK.22.26	“Ngengibac inguc mi aidaing! Monic ye feicne aigac, ye waicne aidaic, nga micnengineng gagac, yedi tofafocngineng yengele bole-madec ingucne gadaic.
LUK.22.27	Madi feicne aigac? Nosing moc ngiyelu nodaicte me bole-madec nosing holelu gagac? Nosing moc ngiyelu nodaicte, yogodi ingucne. Aime nanibac ngengele hewacka bole-madec ingucne gagabac.
LUK.22.28	Nga na lokwesac kwelina gaebewa ngenge na mi hegilecnulu gaibong. 
LUK.22.29	Mamacnedi ngani-damongte kuc molena lowec, ingucneyac nani ngani-damongte kuc molenginang lodacte. 
LUK.22.30	Lobewa ngenge naholec galu ngani-damongte nosing nga misa nolu ngiyedaingte. Ngenge inguchac ngictaule bole balu Israel yengele fungfocngineng 12 fagac yengele aibabangineng wosaelu mimoctodaingte.
LUK.22.31	“Simon, Simon, ga ngagenong, Aleng Sugucnengineng ye ngic yenge wit yafoine webong wanale kpendaec-aigaing, yogo ingucne madicnacni bafaliyecngebame sowaleningte biyac alingkelu milockeneleyec. 
LUK.22.32	Aime Simon, gabac ngage-ngagesinggone wikeengka mi wanale, nani gale ailu inguc biyac mimiloc bole babac. Ailu ga kwelegone hefaliyeme nala hatacmac welelu mic-tengteng alingfocgone basanangebadamec!”
LUK.22.33	Aime Pitadi miwec, “Sugucne, gaholec muc-macka haunogale nga homanogale biyac efeckebac.”
LUK.22.34	Mime Yesudi edowec, “Pita, na yowa edocgube ngagec, yakumac deboc yagowahac kokolec ngicne mi hiaemewa ga bisocnung alecine habackang aidaicte.”
LUK.22.35	Aime Yesudi edocebalu miwec, “Molic-molic salecngebabe hikeibong, dameng iwa moneng-ebec me hiye me hige-ebec mi balu gaibong, ailu wiyac monicte waweibong me?”
LUK.22.35	Mime yengi miibong, “Miyac.”
LUK.22.36+LUK.22.37	Mibong Yesudi miwec, “Hibiwa yanguc kwelengkeicne fagac, yogo nala noine fikedaicte, ilec edocngebagabac. Yogo yanguc,
LUK.22.36+LUK.22.37	‘Yengi yele kindololo ngic miibong.’ 
LUK.22.36+LUK.22.37	Nale ngagelu yowa miibong fagac, i yakumac noine fikeyackegac. Ilec ailu yakumacbac yanguc migabac: Monic ye moneng-ebeckolec me hiyeineholec gagac, ye yogo badaic. Ailu hudule fitec mikac gagac, ye ngakpitowaine saleme moneng hilockeme yogodi hudule fitec fuli badaic.”
LUK.22.38	Mime mic-tengtengfocine yengi yanguc miibong, “Sugucne nganic, nonge hudule fitec yaeckang balu gagabeleng.”
LUK.22.38	Mibong miwec, “I andoine.”
LUK.22.39	Milu Yesu ye inguc ailu gawec, ailu mac hegilelu Oliwa kupicka hikeme mic-tengtengfocine balaibelu hikeibong. 
LUK.22.40	Hike sulumebong edocebalu miwec, “Ngenge lokwesacka feningte milockelu sanangkening!” 
LUK.22.41	Inguc milu ye mic-tengtengfocine hegilecebalu sawaine kpisicnemac loceba lelu ketadi holelu 
LUK.22.42	yanguc milu Wapong milockewec, “Mamac, ga ngageng nalic aime kap yago nalacni baickenong! Ailu nale angac miyac, geicne angac nga ngage-ngage idibac sanangkedaic.”
LUK.22.43	[Inguc milockeemewa angelo monicti honocmengkacni wa fikecnolu basanangkeme, 
LUK.22.44	Yesu ye ngageme umale-benangkeme sanangneyac milockeme sengilangnginedi sac ingucne ailu himongka wawec.]
