ACT.22.22	Ngic yenge hedec kweebongka, Pol ye Yuda-ngic hegilecebalu Israel yengele alingkacni miyac, yengela hikenale Wapongti molickelu yowa edowec, yogo edocebame yenge dacineholec aukweibong, “Ngic ingucne yogo gagaine miyac aidaic. Ye game nalic mi aidaicte.” 
ACT.22.23	Inguc milu aukwelu aalicebame ngakpingineng dalicne hemoctolu lube filabong feme balu wickeibong.
ACT.22.24	Aibong damong sugucnedi mime hudu-baba ngic yengi Pol bole-macnginang balu feibong. Ailu ngic yenge omale homacne aukwegaing, yogolec indingkelu hududi webong sowacneine mifickeme ngagenale mimoctoyelewec. 
ACT.22.25	Mimoctoyeleme yenge hududi wenogale mucti hige-moleine hefelickeibong. Aime Pol ye micnengineng yanguc milu uwacnowec, “Ngenge ngic monic Roma-ngic yengele alingka taockelu game, ye yowawa mi lolu nalic hududi wedaingte, me? Ngic ye yowawa lolubac nalic hududi wedaingte.”
ACT.22.26	Inguc mime damongnginengti damong sugucnela lelu edowec, “Wenuc ainoga? Ngic ye Roma-ngic yengele alingka taockewec gagac.”
ACT.22.27	Inguc mime damong sugucnedi Pol uwacnonale hikelu miwec, “Minong, ga foinac Roma-ngic yengele alingka taockeing gacaigic, me?”
ACT.22.27	Mime Poldi miwec, “Aime foinac, na Roma-ngic yengele alingkacni.”
ACT.22.28	Inguc mime yedi miwec, “Na moneng homacne lobe monengti hilocnume Roma-ngic aiiba.”
ACT.22.28	Inguc mime Poldi miwec, “Nabac Roma-ngic yengele alingka fikeiba.”
ACT.22.29	Inguc mime yenge iwahac Pol indingkelu wenogale miibong, yogo hegileibong. Hudu-baba ngic yengele damong sugucne yedibac yanguc ngagewec, “Pol ye Roma-ngic. Aime nani ngic miyelebe ye senti witickegaing i nalic mi aigac!” Ye inguc ngagelu hangockewec.
ACT.22.30	Mac saeme hudu-baba ngic yengele damong sugucnenginengti Yuda-ngic yenge Pol fungine omale yowawa lobiyeng, yogolec fungine benang ngagenale depec-baba ngic micne nga Yuda-ngic tutumangtowanginengte memba sasawa mime kpaduckeibong. Ailu Pol lukecnolu mengocke walu kpaduckeibong, yengele haicka lowec.
ACT.23.1	Poldi Yuda-ngic yengele tutumangtowanginengte memba yengela donge hilalu yowa sanangnehac yanguc edocebawec, “Alingfocne, mibe ngagening, Wapongte dongewa na ngagebe bikicne mikac gaofecgu yakumac gagabac.” 
ACT.23.2	Inguc mime depec-baba ngic yengele damong sugucne monic wacine Ananaias, yedi Polle emewa ngic domaibong, yenge yanguc milu edocebawec, “Ngenge mesuina wening.”
ACT.23.3	Inguc mime Poldi yanguc edowec, “Wapongti wecgudaicte, ga haicgone madicne, nga kwelegona aibaba sowacnedi wakeicne. Ga yefe-yowa balaibelu yowane wosaelu mimoctocnunogale bole bagic. Ailu yogo hegilelu wecnuningte sanangne migic, inguc ailu yefe-yowa fagac, yogo ewaligic.”
ACT.23.4	Inguc mime ngic domaibong, yengi yanguc edoibong, “Ga Wapongte depec-baba ngic yengele damong sugucne kucine bawalu yowa ingucne mi minong!”
ACT.23.5	Inguc mibong Poldi yanguc miwec, “Alingfocne, ye depec-baba ngic yengele damong sugucne gagac, yogo mi ngagelu yowa yefeina mi migabac. Wapongte hibiwa yanguc kwelengkeicne fagac,
ACT.23.5	‘Ga micnefocgone mi misowalecebadamec.’” 
ACT.23.6	Aime ngic micne gocne yenge Sadyusi alingkacni, nga gocne yenge Farisaio alingkacni ingucti gaibong. Gacgubong Poldi yogo ngagelu kweleine fangkeme tutumangtowa iwa yanguc edocebawec, “Alingfocne, na Farisaio ngic, ailu yengele alingkacni fikeiba. Aime homackacni fangke-fangke i fikenale yowa ngagesingkelu gabe, yogolec yowawa locnugabiyeng.”
ACT.23.7	Yowa inguc mime Farisaio ngic nga Sadyusi ngic yenge yengungtiyac siyeckelu tutumangnginang fulucnaguibong. 
ACT.23.8	Sadyusi ngic yengi yanguc micaigaing, “Homackacni fangke-fangke nga angelo ailu asu, yogo mi fagac.” Nga Farisaio ngic yengi yanguc micaigaing, “Yogo foinac fayackegac.”
ACT.23.9	Aime yogolec tutumangnginang hendolong aiibong. Aibong Farisaio yengele alingkacni Wapongte yefe-yowale wewedu ngic gocnedi fangkelu yowa dacineholec yanguc miibong, “Nonge ngic yagolec bikic basackegabeleng. Angelo me asu monicti yowa edowecka, nonge yogolec yowa monic mi midabelengte.” 
ACT.23.10	Milu yowanginengti fulucnagubong hudu-baba ngic yengele damong sugucnedi gacgu Pol fuluckelu socine balockedaingkale hangockewec, aime hudu-baba ngic miyeleme yengi haulu Pol ngic hewacnginangkocni fulucke walu bole-macnginang baleibong.
ACT.23.11	Balelu deboc iwahac Sugucnedi Pol fikecnolu yanguc edowec, “Ga ngageboc mikac sanangne domadamec, ga Yerusalem yawa nale pasile ailu fungine miyengka yegengkeyelewec, yogo ingucneyac Roma taonka miyengka yegengkeyeledaic.”
ACT.23.12	Mac saeme Yuda-ngic gocnedi yowa mingagec ailu yengungtiyac mimipang sanangne yanguc miibong, “Nongileng nosing misa mi nono gacgu Pol wehomalubac nosing misa nodabeleng.” 
ACT.23.13	Ngic yenge kwele moniyang ailu yowa hefeibong, yengele dzalengineng 40 ewaliwec. 
ACT.23.14	Ngaba yogo yenge hocne depec-baba ngic micne nga Yuda-ngic micnefocngineng yengela hikelu mifickeyelelu yanguc edocebaibong, “Nonge nosing misa mi nono gacgu Pol wehomalubac nosing misa nodabelengte, yowa yogo mipangkegabeleng. 
ACT.23.15	Yogolec ngengi tutumangtowale memba yengeholec hudu-baba ngic yengele damong sugucnela yowa yanguc lobong hikedaic, ‘Ga Pol nongele tutumangka saleengka kwesilu yowaine hatacmac mihomana.’ Aime yowangineng ngagelu inguc aime nonge yefewa sangkelu Pol balu webeng homadaicte.”
ACT.23.16	Inguc mibong Pol bengecinedi yowa yogo ngagelu hudu-baba ngic yengele bole-macka felu anicine edowec.
ACT.23.17	Edome Poldi hudu-baba ngic yengele micne yengelacni monic wackelu yanguc edowec, “Ga madec yago hudu-baba ngic yengele damong sugucnela mengocke lenong. Yedi yowa monic edodaicte.”
ACT.23.18	Inguc mime ngic yedi madec yogo hudu-baba ngic yengele damong sugucnela mengocke lelu yanguc edowec, “Muc-macka ngic Pol yedi wacnulu mineleme madec yago mengockelu welegabac, yedi yowa gocne edocgudaicte.”
ACT.23.19	Inguc milu edome damong sugucnedi madec moleina balu baicke lelu yekilackac domalu uwacnowec, “Ga oma yowa balu kwesigic, miyengka ngagebe.”
ACT.23.20	Uwacnome madec yogodi yanguc edowec, “Yuda-ngic yenge gala yowa lobong kwesinale mingagec aigaing. Kwesibong gagi Pol tutumangtowanginang mengockelu hikeengka yele fungngineine ninic ngageningte, uuwa lobong kwesidaicte. 
ACT.23.21	Kwesime mi ngagedamec. Ngic dzalengineng 40 ewaligac, yenge yefewa sangkelu Pol wehomanogale mimipang sanangne yanguc mibiyeng, ‘Nonge nosing misa mi nono gacgu Pol wehomalubac nosing nodabelengte.’ Aime yenge yowa inguc mipangkelu biyac efeckelu gale yowale wangec gagabiyeng.”
ACT.23.22	Madec ye yowa inguc mime damong sugucnedi yowa yanguc edolu mimackelu salewec, “Ga yowa-siduc yogo kwesilu mifickelu edocnugic, yogo ngic monic mi edodamec.”
ACT.23.23	Aime hudu-baba ngic yengele damong sugucnedi hudu-baba ngic yengele micne yaeckang wacepalu yanguc edocepawec, “Ngeke hikelu yanguc aidabiyec, hudu-baba ngic 200 ingucti yenge higedi yefe hikedaing, nga becosic witina ngiyecaigaing yenge 70 ailu sangala-baba 200, ingucti efeckelu debocka 9 kilok aiyemewa Sesarea bahikedaing. 
ACT.23.24	Ailu Polle becosic monic bafuwacnolu satel holecnodabiyeng. Ailu ngenge ye akikic damongkelu gawana Feliks, yela bahikedaing.”
ACT.23.25	Inguc milu gawanale hibi monic yanguc milu kwelengkewec,
ACT.23.26	Na Klodius Lisias, nani gawana Feliks ngic sugucne, gale hibi yago kwelengkegabac.
ACT.23.26	Wenac madic.
ACT.23.27	Hudu-baba ngic yengi ngic monic balu fugaing, Yuda-ngic yengi balu wehomanogale aigaing. Aime nani ye Roma-ngic yengele alingkacni, yele inguc ngagelu hudu-baba ngic yengeholec hikelu losi yengele molewacni baibeng.
ACT.23.28	Balu yowawa lobong, ilec fungine ngagebe milu micne tutumangtowanginang bahikeiba.
ACT.23.29	Bahikebe yefe-yowangineng balaibelu ganingte ailu yowawa loibong, yogo bafuwalu yanguc ngageiba, “Ye yowawa loibong, yogo wehomanogale me muc-macka lonogale silicine mi aigac.” 
ACT.23.30	Ngic gocne yenge wele yefewa sangkelu Pol balu wehomaningte yowa milu hefeibong. Aime ngagelu gala biyac salebe fugac. Ailu Pol yowawa logabiyeng, ngic yogo inguchac salecebabe gala fulu yowaine edocgudabiyeng.
ACT.23.31	Inguc kwelengkelu yeleme hudu-baba ngic yenge damongnginengte mic balaibelu Pol debockahac mengocke hikegacgu Antipatris taonka hikeibong. 
ACT.23.32	Mac saeme hudu-baba ngic gocne yenge macka hefaliyeibong. Aime becosicka ngiyeibong, yengi sugu Pol mengockelu Sesarea hikeibong. 
ACT.23.33	Hikelu gawana hibi lacnolu Pol inguchac yele molewa loibong. 
ACT.23.34	Lobong gawanadi hibi wafelu Pol uwacnowec, “Ga himonggone wenuwacni?”
ACT.23.34	Mime Poldi miwec, “Na Silisia himong sugucnacni.”
ACT.23.35	Inguc mime gawanadi yanguc edowec, “Ga yowawa locguibong, yengi kwesi fikenelebong gale yowa minoga.” Ye inguc milu Pol Herodele macka lolu damongkeningte edocebawec.
ACT.24.1	Hadeng 5 motome depec-baba ngic yengele damong sugucne Ananaias nga Yuda-ngic micnefocngineng gocne ailu Roma-ngic yengele yefe-yowale ngage-ngage ngic monic wacine Tetulus, yenge Sesarea macka haulu gawanala Polle yowa miningte fikecnoibong. 
ACT.24.2	Fikecnobong gawanadi Pol micnome weleme Tetulusdi yele yowa milu gawana yanguc edowec, “Gawananonggeng Feliks, ga madicne damongnubaengka kwele-mogungkolec gagabeleng. Ailu gale ngage-ngagele ailu gaganonggeng bafaliyeme madicne gabeng 
ACT.24.3	nongela macsoc nga woc-wiyac sasawa madickelu ofegac. Yogolec gale kwele-madic ngagecaigabeleng. 
ACT.24.4	Ailu yowa mibe bole-dameng wikedameckale bawosaelu ngage-ngagesingnele yowa bangkacnemac edocgube.
ACT.24.5	“Polle aibaba yanguc nganiibeng: Ye mife-miwa ainolecaigac, yogo Yuda-ngic himongsoc gagabiyeng, yenge sasawa ngaba kosa bafuwayelecaigac ailu Nasaret habu monic yengele micne hocne gagac.
ACT.24.6	Ye Ibu-kuluc yogo wonong holenogale aime baibeng. [Balu yefe-yowanonggeng iwa wiyac aicnonangte aibeng
ACT.24.7	hudu-baba ngic yengele damong Lisias, ye nga madecfocine yenge momoc kwesilu dacineholec nongileng molewacni ewalicnubaibong. 
ACT.24.8	Ailu yele fungine miibong, ngic yogo yenge gala kwesi fikeningte miyelewec.]
ACT.24.9	Yowa inguc mime Yuda-ngic yenge bafickelu yowaine basanangkeibong.
ACT.24.10	Aime gawana ye Poldi yowa minale molediyac aicnome yedi yowa yanguc bafaliyecnowec, “Ga himong yagowa ngic-ngigac yengele mimocto-mimocto ngic hifa homacne gacaigic, yogo ngagesilu kwele-madicka mibe. 
ACT.24.11	Na Yerusalem iwa Wapong afenogale milu felu gabe hadeng 12 sugu aiyec, ga yowa yogo ngage-homanogale milu ngic uwayeleengka edocguning. 
ACT.24.12	Na Ibu-kuluc kwelina ngic gocne yengeholec yowane fec-wac mi aiwec. Me kpakpaduc mac gocna me mac-sobengka aibaba gocne aibe kpaduckeningte, monic mi aiiba. Me aibaba gocne monic aibe mi nganiibong. 
ACT.24.13	Ngic yago yenge kpolicnulu fungine milu edocgugaing, yowa yogo noine monic nalic mi bafuwadaingte. 
ACT.24.14	Ailu monic mifuwagelebe ngagec: Yesule yefe yogo gocnedi habu monic micaigaing, yogo balaibecaigabac. Yefe iwa ngambofocnonggeng yengele Wapong micine balaibelu yefe-yowa fagac, yogo sasawa balaibegabac. Ailu Wapongte sinaic mimi yengi yowa milu kwelengkeibong, yogo ngagesingkecaigabac. 
ACT.24.15	Ailu ngic yago yakumac kpolicnugaing, yenge nga na nonge momoc Wapong yanguc ngagesingkelu gagabeleng, ngic sowacne nga dondonne homackacni fangke-fangkele dameng bangkalegac.
ACT.24.16	Inguc ngagesingkelu Wapongte dongewa nga ngic yengele dongewa bikicne mikac ganogale bole sanangne balu gacaigabac.
ACT.24.17	“Na hifa gocne himong dalicka gacgu ngic alingfocne gocne waweweine kwele-madicka wiyac gocne yelenogale, nga Wapongte ibu lonogale Yerusalem taonka kwesiiba. 
ACT.24.18	Ailu gbagbacne galu aibaba gbagbacne ailu Ibu-kulucka felu ibu nga wiyac gocne lolu gabe bafuwacnuibong. Iwa ngic habu sugucne me hendolongkolec mi gaiba.
ACT.24.19	Asia prowinswacni Yuda-ngic gocne, yengi sugu hendolong sugucne inguc aiibong. Yengi hocne bikickolec wiyac monic balu gagabac milu gala kwesilu nale yowa edocgudabongka. 
ACT.24.20	Me ngic yago domagaing, yengele memba tutumangtowawa domabe nale bikic monic bafuwaibongka, mifuwaning. 
ACT.24.21	Na hewacnginang domalu yowa moniyang sugu yanguc aukwelu miiba, ‘Homackacni fangke-fangke yogo fagac.’ Yowa yogolec yakumac gale dongewa bacnulu kwesi yowawa locnugabiyeng.”
ACT.24.22	Aime gawana Feliks ye Yesule yefele siduc ngageyackegacte welockelu yanguc sugu edocebawec, “Hudu-baba ngic yengele damong sugucne Lisiasdi Yerusalemkocni wame yowangineng mimoctodacte.” Inguc milu yowangineng fanale milu salecebawec.
ACT.24.23	Ailu ye hudu-baba ngic yengele damong yanguc edolu miwec, “Ngenge Pol damongkebong lolickedaic. Aime agofocine yenge nalic kwesilu ngani-bafic aicnodaing.”
ACT.24.24	Hadeng gocne gacgu Feliks yeicne nga ngigacine, wacine Drusila, ye Yuda-ngigac, yeke momocyac kwesilu Feliksdi Pol micnome ofelu Kristo Yesule ngage-ngagesingte fungine edocepame ngageiboc. 
ACT.24.25	Ngageebocka yanguc edocepawec, “Aibaba dondonne balaibenoga, ailu kwele nga soc madicne damongkenoga, ailu mimocto-mimoctole dameng welegac.”
ACT.24.25	Inguc mime Feliks hangockeme Pol yanguc edolu salewec, “Nalic ga hikec, gacgu dameng monicka sawaine monic fikeneleme hatacmac wacgube kwesidamec.” 
ACT.24.26	Gawana ye hikelu yanguc ngagewec, “Pol muc-mackacni hegilebe wayecte moneng gocne nelena.” Ye ngage-ungngine inguc fawecte damengsoc wackeme yeholec yowa mingagec ailu gaiboc.
ACT.24.27	Gaebocka hifa yaeckang motome, kiya monic wacine Pokius Festus, yedi kwesilu gawana Feliksle mac balu bole bawec. Aime Feliks ye Yuda-ngic kwele-madic ngagecnoningte Pol muc-macka ngiyeme hegilelu hikewec.
ACT.25.1	Festus ye Yudeya prowins iwa hike sulumelu gawana bole molickelu bawec. Balu hadeng habackang motome Sesarea hegilelu Yerusalem fewec. 
ACT.25.2	Feme depec-baba ngic micne nga Yuda-ngic sugucne yengi yela kwesilu Polle yowa mibong yegengkeme
ACT.25.3	hataecnolu yanguc miibong, “Ga nonge baficnubalu yowa loengka hikeme Pol ye Yerusalem iwa kwesidaic.” Yenge yefewa sangke domalu Pol wehomaningte ngagelu inguc miibong.
ACT.25.4	Edobong Festusdi yanguc edocebawec, “Pol ye Sesarea iwa muc-macka ngiyeme na yawa kpisicnemac ngiyelu hatacmac hefaliye hikedacte. 
ACT.25.5	Hikebe ngenge Pol yowawa lonogale milu ngengelacni ngic sugucne gocne yenge naholec haulu bikic monic bafuwawecka ingucne yengi yele yowa yogo mifickedaing.”
ACT.25.6	Inguc milu hadeng 8 me 10 ngama ingucne Yerusalem iwa gacgu Sesarea hikelu hauwec. Haulu mac saeme mimocto-mimocto macka fengiyelu miwec, “Ngenge Pol bawelening!” Mime balu feibong. 
ACT.25.7	Balu febong Yerusalemkocni Yuda-ngic yengi ye hewalingke domalu yowa gocne haic fungine fungine homacne kpolickelu sanangnehac milu domaibong. Ailu yenge yowa yogolec noine bafuwaningte kpungkeibong.
ACT.25.8	Aime Poldi yowangineng ameine bafaliyelu fungine yanguc miwec, “Na Yuda-ngic yengele yefe-yowangineng me Ibu-kuluc me ngictau Sisa, yenge monic mi basowalecebaiba.”
ACT.25.9	Inguc mime Festus ye Yuda-ngic yengi kwele-madic ngagecnoningte Pol uwacnowec, “Ga Yerusalem iwa nalic felu iwa yowagone mimoctodacte, me?”
ACT.25.10	Inguc mime Poldi yanguc bafaliyecnowec, “Mac yago domagabac, yago ngictau Sisa yele mimocto-mimoctole mac hocne, yogolec nale yowa yagowahac mimoctonoga. Na Yuda-ngic aibaba sowacne monic mi aiyeleiba, yogo gageuc ngagegic. 
ACT.25.11	Na bikictowa monic bafuwadaba ingucne midec, wehomacnunogale miyengka na socne nalic mi sebicnagudaba. Nga yenge kwesacka kpolicnulu fungine migaing, yogolec monicti yengele molewa nalic mi locnudaicte. Yogolec ailu Roma ngictau Sisadi yowane mimoctonale migabac.”
ACT.25.12	Inguc mime Festusdi babaficfocine yengeholec mingagec ailu Pol yanguc edowec, “Ga ngictau Sisala hikenogale migicte yela hikedamec.”
ACT.25.13	Hadeng gocne motome ngictau Agripa ye kwaine Benaisiholec Sesarea haulu Festus kwele-angacka nganiiboc. 
ACT.25.14	Ailu yeke hadeng gocne yeholec ngiye-fac aiboc, Festusdi Polle yowa-siduc ngictau Agripa yanguc edowec, “Feliksdi ngic monic muc-macka lome hauwec ngiyegac.
ACT.25.15	Aime Yerusalem iwa fesulumebe Yuda-ngic yengele depec-baba ngic micne nga micnefocngineng yenge kpaduckelu nala kwesilu ngic ye webong homanale edocnubiyeng. 
ACT.25.16	Edocnubong na yowa ameine yanguc bafaliyebac, ‘Ngic monic fungine mikacka weboting aicno-aicnole yefe, yogo Roma-ngic nongela monic mi fagac. Ngic yowaholec nga ngabaine yowawa lodaicte yeke momoc fangkelu domaebocka yowa noine minoga.’
ACT.25.17	“Tumaneibong iwa inguc bafaliyebe, iwahac mac saeme na mimocto-mimoctole macka fengiyelu Pol bakwesiningte miiba. 
ACT.25.18	Inguc milu Pol yowawa loibong yengi yele aibaba sowacne monic mifickebong ngagedacte mibe yenge mi miibong. 
ACT.25.19	Yengileng habunginengte yefe fagac, yogolec fungine sugu miibong. Milu ngic monic wacine Yesu, yele yanguc miibong, ‘Ye biyac homawec.’ Aime Poldi yanguc mime yegengkeyelewec, ‘Ye gbolicne gagac.’ Ye inguc sugu miwec. 
ACT.25.20	Aime na yowa yogo ngage-motonogale aibibiyelu yanguc uwacnoiba, ‘Nalic Yerusalem iwa felu gale yowa iwa mimoctonoga me?’
ACT.25.21	“Edobe Pol ye ngictau Sisadi yowaine mimoctonale miwec. Inguc mime, Pol ye muc-macka wangec ngiyeme gacgu yefe monic bafuwalubac Roma ngictau Sisala lobe hikenale mimoctoiba.”
ACT.25.22	Festusdi inguc milu edome Agripadi miwec, “Naneuc ngic yeicne mickacni yowaine ngagenogale ainelegac.”
ACT.25.22	Inguc mime Festusdi miwec, “Saeme nalic ngagedamecte.”
ACT.25.23	Mac saeme Agripa nga Benaisi yeke ngakpi hibine madicne holelu tutumang macka feiboc. Aime hudu-baba ngic yengele damong sugucne nga mac yogolec ngic micne yenge momoc balaibecebalu feibong. Aime Festusdi mime Pol momoc balu feibong. 
ACT.25.24	Balu febong Festusdi yanguc edocebawec, “Ngictau Agripa nga ngicfocne yakumac naholec ngiyegaing, edocngebabe ngagening: Ngic yago domagac, yele ailu Yuda-ngic sasawa yawa nga Yerusalem iwa wacnulu hataenelelu miibong, ‘Ye nalic mi gadaicte.’ 
ACT.25.25	Aime yeuctiyac Roma ngictau Sisadi yowaine mimoctonale miwecte yela salebe hikedaicte. Nga nanibac ye homanale bikic monic mi bafuwaiba. 
ACT.25.26	Ailu yowa noine basackelu ngictau Sisale hibi kwelengkenogale milu kwelengkedacte. Ilec ailu ngic yago ye ngengela nga ngictau Agripa gala lobe domame ngenge fungngineine ngagelu noine bafuwabong hibi kwelengkelu lobe hikedaic. 
ACT.25.27	Aime nani ngic monic muc-mackacni bikicinele hibi mi kwelengkelu Roma taonka moc salebe hike-hikele ngagebe nalic mi aigac.”
ACT.26.1	Agripadi Pol yanguc edowec, “Gageuc funginegone miyengka ngagenang.”
ACT.26.1	Inguc mime Pol ye moleine bafangkelu yeicne fungngineine yanguc edocebawec, 
ACT.26.2+ACT.26.3	“Ngictau Agripa, gagi Yuda-ngic nongele aibaba nga yowa miminonggeng fagac, yogo ngageyackegic, yogo noine. Ilec kwele-angacka Yuda-ngic yengi yowawa locnugabiyeng, ilec ameine gala midacte. Ilec ailu ngagenelelu uc mikac ngiyeengka yowane minogale uwagelegabac.
ACT.26.4	“Na madecnahac mac-himongnele ngic-ngigac yengeholec gaiba ailu Yerusalem iwa gaiba. Dameng iwa aibabane ailu gaofeiba, yogolec fungine Yuda-ngic yenge ngageyackegaing. 
ACT.26.5	Aime Farisaio yefengineng dondonne balaibecaigaing, yengelacni monic na hocne esecne gaiba. Ailu fungine ngani-ngagec aiiba, yogolec miyengka nalic edocgudaingte.
ACT.26.6	Wapongti yowa yogo ngambofocnonggeng biyachac mipangkeyelelu edocebawec, ‘Yowa yogo noine fikedaicte,’ yogo ngagesingkecaigabacte yakumac yowawa domagabac.
ACT.26.7	Israel habu 12 yenge damengsoc Wapongti wiyac mipangkeyelewec, yogo fikeyackenale ngagesingkelu deboc hadeng Wapong afeelu gaibong. Oc ngictau Agripa, i na momoc ngagesingkebe Yuda-ngic yengi yowawa locnugabiyeng. 
ACT.26.8	Aime ngenge omale Wapongti homaicne bagbolicebadaicte, yogo ngagebong mi fikedaicte ingucne aicaigac. Na homackacni gboliye fangke-fangke i ngagesingkegabac.
ACT.26.9	“Ailu na esecne Yesu Nasaret-hocni, yele wac-siducine yogo yefe fungine fungine basowalenogale milu inguc aiiba.
ACT.26.10	Aime depec-baba ngic micne yengi bole neleibong, yogo balu gabe Yesule aling gbagbacne homacne benang muc-macka locebabe yowawa domabong wehomacebanogale mibong, na yogo nalic ainingte ngagelu gaiba. Yogo Yerusalem iwa inguc ailu gaiba. 
ACT.26.11	Ailu na dameng homacne Yuda-ngic yengele kpakpaduc macnginangsoc felu kwele-hefaliyec weboting aiyelelu Yesu misulec aicnoningte weyebic aiyelelu gaiba. Ailu aalic sugucne benang ngageyeleiba, ailu yogo Israel kwelina yawa sugu mi aiiba. Na himong gocne yengele taonka inguchac hikelu weyebic aiyelelu gaiba.
ACT.26.12	“Inguc aibe depec-baba ngic micne yengi kuc nelelu mibong Damasko iwa bole inguchac banogale locnubong hikeiba. 
ACT.26.13	Oc ngictaune, na yefewa hikebe dameng 12 kilok aiyemewa honocmengkacni angoc sugucne monicti wenacte angoc ewaligac, ingucnedi walu na nga alingfocne kwenggalangnubawec. 
ACT.26.14	Kwenggalangnubame nonge himongka lodingke wawelu fabeng Hibru yowawa yefe-yowa monic yanguc fikeme ngageiba, ‘Sol Sol, ga omale weyebic ainelelu gacaigic? Ga kwele-sanang inguc aigacgu yasune micineholec yogo gageuc weengka hicgume doic ngagedamecte.’
ACT.26.15	“Inguc ngagelu yanguc miiba, ‘Sugucne, ga ma?’
ACT.26.15	“Mibe yanguc edocnuwec, ‘Weyebic ainelecaigic, na hocne Yesu. 
ACT.26.16	Ga fangkelu domac. Yakumac nale bole-madec aidamecte yogolec fikegelegabac. Yogolec wiyac yakumac nganigic nga lobewa edalicgube nganidamecte, yogolec siduc-mimine gadamecte. 
ACT.26.17	Na yakumac alingfocgone nga Israel yengele alingkacni miyac, yengele molewacni bamoctogudacte. Ailu nani yengela salecgube hikelu 
ACT.26.18	ngic-ngigac dongengineng balockeengka kundung lobeelu angocina gadaingte. Ailu Aleng sugucnenginengte kuc hegilelu yenge Wapongta hefaliye hikedaingte. Inguc aibong bikicngineng hegileme na Sugucne inguc ngagesingnubong gaga gbagbacne yeleicne, yengele habuwa locebadaicte.’
ACT.26.19	“Ngictau Agripa, na honocmengkacni gung-didicka ingucne nganiiba, yogo mi hegileiba. 
ACT.26.20	Na molickelu Damasko hikeiba. Iwacni hefaliyelu Yerusalem nga Yudeya himongka hikeiba. Iwacni Israel yengele alingkacni miyac, yengela hikelu inguc ailu gaiba. Dameng iwa yenge kwelengineng hefaliyelu Wapongta hikelu kwele-hefaliyecte aibaba madicne bafuwaningte edocebalu gaiba.
ACT.26.21	“Na inguc ailu gabe Yuda-ngic yengi Ibu-kuluckacni bacnulu wehomacnunogale aiibong. 
ACT.26.22	Aime Wapongti damongnulu game mic-yowaine milu gaiba, ailu yakumac migabac. Na ngic feicne waicne ngenge momoc ngiyeebongka yago domalu mifickengelegabac. Wapongte sinaic mimi nga Moses yengi wiyac fikenale milu kwelengkeibong, yogo hocne milu gagabac. 
ACT.26.23	Mesia ye doic sugucne ngagegacgu homadaicte. Ailu homaicne yengele micne balu fangkelu Yuda-ngic nga Israel yengele alingkacni miyac yenge momoc angocte yowa mime yegengkeyeledaicte. Yowa yogo hocne Moses nga Wapongte sinaic mimi yengi kwelengkeibong.”
ACT.26.24	Pol ye fungngineine inguc milu edocebame Festusdi aukwecnolu yanguc miwec, “Ga ngage-ngagetowagonedi kwele-sifuc bafuwageleme kapaine aigic.”
ACT.26.25	Inguc mime Poldi yowa yanguc bafaliyecnowec, “Gawana Festus, na kapaine mi aigabac. Na yowa noine nga dondonne migabac. 
ACT.26.26	Yowa migabac, yogolec fungine ngictau Agripa ye ngageyackegacte yela efecne migabac. Yowa migabac, yogo sangke-sangke mi fikewec. Ngictau, ga ngage-ngage monicte mi kpungkeing. 
ACT.26.27	Ngictau Agripa, ga Wapongte sinaic mimi yengele yowa ngagesingkegic, me? Na ngagegabac, ga ngagesingkegic.”
ACT.26.28	Inguc mime Agripadi yanguc edowec, “Uc mikac ngiyebe mi daliweme, Kristole aling aidactele minelegic, me? Yogo miyac.”
ACT.26.29	Inguc mime Poldi yanguc miyelewec, “Dameng dalicne me bangkacne, yogo mi midacte. Ga nga ngic gocne yakumac yowa yago mibe ngagegaing, ngenge nale ngage-ngagesing ingucnehac ainingte milockegabac. Ailu senti na ingucneyac mi witicngebaningte migabac.”
ACT.26.30	Inguc mime ngictau Agripa nga Festus ailu Benaisi nga gocne ngiyeibong yenge fangke 
ACT.26.31	lelu mingagec ailu yanguc miibong, “Ngic yogo yedi homadaicte me muc-macka ngiye-ngiyele yefe monic mi fikegac.”
ACT.26.32	Aime Agripadi Festus yanguc edowec, “Ngic yago ye ngictau Sisadi yowaine mimoctonale mi midec ingucne, ga nalic lukecnoengka hikelu gadec.”
ACT.27.1	Aime hudu-baba ngic yengele damong monic wacine Yulius, ye Sisale habu, yogowacni hudu-baba ngic 100 inguc damongebalu gawec. Aime Itali himongka hikenogale dameng bangkaleme ngictaudi mime Pol nga muc-macka ngic gocne Yulius yele molewa locebabong, yedi bacebame yenge momoc lac-wagewa feibong. 
ACT.27.2	Aime wage yogo Adamitium taonkacni, ailu Asia prowins mesuina balaibelu taon ngiye-legackasoc, iwa hikenogale aime, Tesalonaika taon Masedonia prowins, iwacni ngic monic wacine Aristakus, yeholec nonge momoc hikeibeng.
ACT.27.3	Mac saeme wage Saidon taonka hike sulumelu iwa domaibeng. Yuliusdi Pol ago aicnolu ngagecnome taonka hikelu agofocine nganicebame ngani-bafic aicnoibong. 
ACT.27.4	Aime wagewa hatacmac felu taon yogo hegilebeng gbelongti hikenogawa haic kwesime Saiparus nuc nga Asia prowins hewacnginac hikeibeng. 
ACT.27.5	Hikelu Silisia nga Pamfilia prowins falockelu hikegacgu Maira taon Lisia himongka hike sulumelu hauibeng. 
ACT.27.6	Aime iwa Aleksandia taonkacni lac-wage monic domalu Itali himongka hikenogale aiwec. Aime hudu-baba ngic yengele damongti lac-wage yogo nganilu iwa bacnubame feibeng. 
ACT.27.7	Felu hadeng gocne uneng-uneng doic-bole bahikecgu Nidus taon ngiyewecka-haic hikeibeng. Hikebeng gbelongti wecnubame Krit nucka-haic hikeibeng. Hikegacgu nuc yogolec mesuine monic wacine Salmone falockelu 
ACT.27.8	Lasea bangkalelu kiwec madecna monic fawec, wacine Wage Nalic Domadaingte, nonge doic-bole bagacgu iwa hauibeng.
ACT.27.9	Kiwecka dameng dalicne gaibong ailu mac-gbelong dameng bangkalelu gacgu basowalecnubadaickale Poldi sawang-yowa yanguc miwec, 
