PSA.106.4	which thou to thine dost bear;
PSA.106.4	With thy salvation, O my God,
PSA.106.4	to visit me draw near:
PSA.106.5	That I thy chosen's good may see,
PSA.106.5	and in their joy rejoice;
PSA.106.5	And may with thine inheritance
PSA.106.5	triumph with cheerful voice.
PSA.106.6	We with our fathers sinned have,
PSA.106.6	and of iniquity
PSA.106.6	Too long we have the workers been;
PSA.106.6	we have done wickedly.
PSA.106.7	The wonders great, which thou, O Lord,
PSA.106.7	didst work in Egypt land,
PSA.106.7	Our fathers, though they saw, yet them
PSA.106.7	they did not understand:
PSA.106.7	And they thy mercies' multitude
PSA.106.7	kept not in memory;
PSA.106.7	But at the sea, ev'n the Red sea,
PSA.106.7	provok'd him grievously.
PSA.106.8	Nevertheless he saved them,
PSA.106.8	ev'n for his own name's sake;
PSA.106.8	That so he might to be well known
PSA.106.8	his mighty power make.
PSA.106.9	When he the Red sea did rebuke,
PSA.106.9	then dried up it was:
PSA.106.9	Through depths, as through the wilderness,
PSA.106.9	he safely made them pass.
PSA.106.10	From hands of those that hated them
PSA.106.10	he did his people save;
PSA.106.10	And from the en'my's cruel hand
PSA.106.10	to them redemption gave.
PSA.106.11	The waters overwhelm'd their foes;
PSA.106.11	not one was left alive.
PSA.106.12	Then they believ'd his word,
PSA.106.12	and praise to him in songs did give.
PSA.106.13	But soon did they his mighty works
PSA.106.13	forget unthankfully,
PSA.106.13	And on his counsel and his will
PSA.106.13	did not wait patiently;
PSA.106.14	But much did lust in wilderness,
PSA.106.14	and God in desert tempt.
PSA.106.15	He gave them what they sought, but to
PSA.106.15	their soul he leanness sent.
PSA.106.16	And against Moses in the camp
PSA.106.16	their envy did appear;
PSA.106.16	At Aaron they, the saint of God,
PSA.106.16	envious also were.
PSA.106.17	Therefore the earth did open wide,
PSA.106.17	and Dathan did devour,
PSA.106.17	And all Abiram's company
PSA.106.17	did cover in that hour.
PSA.106.18	Likewise among their company
PSA.106.18	a fire was kindled then;
PSA.106.18	And so the hot consuming flame
PSA.106.18	burnt up these wicked men.
PSA.106.19	Upon the hill of Horeb they
PSA.106.19	an idol-calf did frame,
PSA.106.19	A molten image they did make,
PSA.106.19	and worshipped the same.
PSA.106.20	And thus their glory, and their God,
PSA.106.20	most vainly changed they
PSA.106.20	Into the likeness of an ox
PSA.106.20	that eateth grass or hay.
PSA.106.21	They did forget the mighty God,
PSA.106.21	that had their saviour been,
PSA.106.21	By whom such great things brought to pass
PSA.106.21	they had in Egypt seen.
PSA.106.22	In Ham's land he did wondrous works,
PSA.106.22	things terrible did he,
PSA.106.22	When he his mighty hand and arm
PSA.106.22	stretch'd out at the Red sea.
PSA.106.23	Then said he, He would them destroy,
PSA.106.23	had not, his wrath to stay,
PSA.106.23	His chosen Moses stood in breach,
PSA.106.23	that them he should not slay.
PSA.106.24	Yea, they despis'd the pleasant land,
PSA.106.24	believed not his word:
PSA.106.25	But in their tents they murmured,
PSA.106.25	not heark'ning to the Lord.
PSA.106.26	Therefore in desert them to slay
PSA.106.26	he lifted up his hand:
PSA.106.27	'Mong nations to o'erthrow their seed,
PSA.106.27	and scatter in each land.
PSA.106.28	They unto Baal-peor did
PSA.106.28	themselves associate;
PSA.106.28	The sacrifices of the dead
PSA.106.28	they did profanely eat.
PSA.106.29	Thus, by their lewd inventions,
PSA.106.29	they did provoke his ire;
PSA.106.29	And then upon them suddenly
PSA.106.29	the plague brake in as fire.
PSA.106.30	Then Phin'has rose, and justice did,
PSA.106.30	and so the plague did cease;
PSA.106.31	That to all ages counted was
PSA.106.31	to him for righteousness.
PSA.106.32	And at the waters, where they strove,
PSA.106.32	they did him angry make,
PSA.106.32	In such sort, that it fared ill
PSA.106.32	with Moses for their sake:
PSA.106.33	Because they there his spirit meek
PSA.106.33	provoked bitterly,
PSA.106.33	So that he utter'd with his lips
PSA.106.33	words unadvisedly.
PSA.106.34	Nor, as the Lord commanded them,
PSA.106.34	did they the nations slay:
PSA.106.35	But with the heathen mingled were,
PSA.106.35	and learn'd of them their way.
PSA.106.36	And they their idols serv'd, which did
PSA.106.36	a snare unto them turn.
PSA.106.37	Their sons and daughters they to dev'ls
PSA.106.37	in sacrifice did burn.
PSA.106.38	In their own children's guiltless blood
PSA.106.38	their hands they did imbrue,
PSA.106.38	Whom to Canaan's idols they
PSA.106.38	for sacrifices slew:
PSA.106.38	So was the land defil'd with blood.
PSA.106.39	They stain'd with their own way,
PSA.106.39	And with their own inventions
PSA.106.39	a whoring they did stray.
PSA.106.40	Against his people kindled was
PSA.106.40	the wrath of God therefore,
PSA.106.40	Insomuch that he did his own
PSA.106.40	inheritance abhor.
PSA.106.41	He gave them to the heathen's hand;
PSA.106.41	their foes did them command.
PSA.106.42	Their en'mies them oppress'd, they were
PSA.106.42	made subject to their hand.
PSA.106.43	He many times deliver'd them;
PSA.106.43	but with their counsel so
PSA.106.43	They him provok'd, that for their sin
PSA.106.43	they were brought very low.
PSA.106.44	Yet their affliction he beheld,
PSA.106.44	when he did hear their cry:
PSA.106.45	And he for them his covenant
PSA.106.45	did call to memory;
PSA.106.45	After his mercies' multitude
PSA.106.46	he did repent: And made
PSA.106.46	Them to be pity'd of all those
PSA.106.46	who did them captive lead.
PSA.106.47	O Lord our God, us save,
PSA.106.47	and gather the heathen from among,
PSA.106.47	That we thy holy name may praise
PSA.106.47	in a triumphant song.
PSA.106.48	Bless'd be 
PSA.106.48	to all eternity:
PSA.106.48	Let all the people say, Amen.
PSA.106.48	Praise to the Lord give ye.
PSA.107.1	Praise God, for he is good: for still
PSA.107.1	his mercies lasting be.
PSA.107.2	Let God's redeem'd say so, whom he
PSA.107.2	from th' en'my's hand did free;
PSA.107.3	And gather'd them out of the lands,
PSA.107.3	from north, south, east, nd west.
PSA.107.4	They stray'd in desert's pathless way,
PSA.107.4	no city found to rest.
PSA.107.5	For thirst and hunger in them faints
PSA.107.6	their soul. When straits them press,
PSA.107.6	They cry unto the Lord,
PSA.107.6	and he them frees from their distress.
PSA.107.7	Them also in a way to walk
PSA.107.7	that right is he did guide,
PSA.107.7	That they might to a city go,
PSA.107.7	wherein they might abide.
PSA.107.8	O that men to the Lord would give
PSA.107.8	praise for his goodness then,
PSA.107.8	And for his works of wonder done
PSA.107.8	unto the sons of men!
PSA.107.9	For he the soul that longing is
PSA.107.9	doth fully satisfy;
PSA.107.9	With goodness he the hungry soul
PSA.107.9	doth fill abundantly.
PSA.107.10	Such as shut up in darkness deep,
PSA.107.10	and in death's shade abide,
PSA.107.10	Whom strongly hath affliction bound,
PSA.107.10	and irons fast have ty'd:
PSA.107.11	Because against the words of God
PSA.107.11	they wrought rebelliously,
PSA.107.11	And they the counsel did contemn
PSA.107.11	of him that is most High:
PSA.107.12	Their heart he did bring down with grief,
PSA.107.12	they fell, no help could have.
PSA.107.13	In trouble then they cry'd to God,
PSA.107.13	he them from straits did save.
PSA.107.14	He out of darkness did them bring,
PSA.107.14	and from death's shade them take;
PSA.107.14	These bands, wherewith they had been bound,
PSA.107.14	asunder quite he brake.
PSA.107.15	O that men to the Lord would give
PSA.107.15	praise for his goodness then,
PSA.107.15	And for his works of wonder done
PSA.107.15	unto the sons of men!
PSA.107.16	Because the mighty gates of brass
PSA.107.16	in pieces he did tear,
PSA.107.16	By him in sunder also cut
PSA.107.16	the bars of iron were.
PSA.107.17	Fools, for their sin, and their offence,
PSA.107.17	do sore affliction bear;
PSA.107.18	All kind of meat their soul abhors;
PSA.107.18	they to death's gates draw near.
PSA.107.19	In grief they cry to God; he saves
PSA.107.19	them from their miseries.
PSA.107.20	He sends his word, them heals,
PSA.107.20	and them from their destructions frees.
PSA.107.21	O that men to the Lord would give
PSA.107.21	praise for his goodness then,
PSA.107.21	And for his works of wonder done
PSA.107.21	unto the sons of men!
PSA.107.22	And let them sacrifice to him
PSA.107.22	off 'rings of thankfulness;
PSA.107.22	And let them shew abroad his works
PSA.107.22	in songs of joyfulness.
PSA.107.23	Who go to sea in ships,
PSA.107.23	and in great waters trading be,
PSA.107.24	Within the deep these men God's works
PSA.107.24	and his great wonders see.
PSA.107.25	For he commands,
PSA.107.25	and forth in haste the stormy tempest flies,
PSA.107.25	Which makes the sea with rolling waves
PSA.107.25	aloft to swell and rise.
PSA.107.26	They mount to heav'n, then to the depths
PSA.107.26	they do go down again;
PSA.107.26	Their soul doth faint and melt away
PSA.107.26	with trouble and with pain.
PSA.107.27	They reel and stagger like one drunk,
PSA.107.27	at their wit's end they be:
PSA.107.28	Then they to God in trouble cry,
PSA.107.28	who them from straits doth free.
PSA.107.29	The storm is chang'd into a calm
PSA.107.29	at his command and will;
PSA.107.29	So that the waves, which rag'd before,
PSA.107.29	now quiet are and still.
PSA.107.30	Then are they glad, because at rest
PSA.107.30	and quiet now they be:
PSA.107.30	So to the haven he them brings,
PSA.107.30	which they desir'd to see.
PSA.107.31	O that men to the Lord would give
PSA.107.31	praise for his goodness then,
PSA.107.31	And for his works of wonder done
PSA.107.31	unto the sons of men!
PSA.107.32	Among the people gathered
PSA.107.32	let them exalt his name;
PSA.107.32	Among assembled elders spread
PSA.107.32	his most renowned fame.
PSA.107.33	He to dry land turns water-springs,
PSA.107.33	and floods to wilderness;
PSA.107.34	For sins of those that dwell therein,
PSA.107.34	fat land to barrenness.
PSA.107.35	The burnt and parched wilderness
PSA.107.35	to water-pools he brings;
PSA.107.35	The ground that was dry'd up before
PSA.107.35	he turns to water-springs:
PSA.107.36	And there, for dwelling, he a place
PSA.107.36	doth to the hungry give,
PSA.107.36	That they a city may prepare
PSA.107.36	commodiously to live.
PSA.107.37	There sow they fields, and vineyards plant,
PSA.107.37	to yield fruits of increase.
PSA.107.38	His blessing makes them multiply,
PSA.107.38	lets not their beasts decrease.
PSA.107.39	Again they are diminished,
PSA.107.39	and very low brought down,
PSA.107.39	Through sorrow and affliction,
PSA.107.39	and great oppression.
PSA.107.40	He upon princes pours contempt,
PSA.107.40	and causeth them to stray,
PSA.107.40	And wander in a wilderness,
PSA.107.40	wherein there is no way.
PSA.107.41	Yet setteth he the poor on high
PSA.107.41	from all his miseries,
PSA.107.41	And he, much like unto a flock,
PSA.107.41	doth make him families.
PSA.107.42	They that are righteous shall rejoice,
PSA.107.42	when they the same shall see;
PSA.107.42	And, as ashamed, stop her mouth
PSA.107.42	shall all iniquity.
PSA.107.43	Whoso is wise, and will these things
PSA.107.43	observe, and them record,
PSA.107.43	Ev'n they shall understand the love
PSA.107.43	and kindness of the Lord.
PSA.108.1	My heart is fix'd, Lord; I will sing,
PSA.108.1	and with my glory praise.
PSA.108.2	Awake up psaltery and harp;
PSA.108.2	myself I'll early raise.
PSA.108.3	I'll praise thee 'mong the people, Lord;
PSA.108.3	'mong nations sing will I:
PSA.108.4	For above heav'n thy mercy's great,
PSA.108.4	thy truth doth reach the sky.
PSA.108.5	Be thou above the heavens, Lord,
PSA.108.5	exalted gloriously;
PSA.108.5	Thy glory all the earth above
PSA.108.5	be lifted up on high.
PSA.108.6	That those who thy beloved are
PSA.108.6	delivered may be,
PSA.108.6	O do thou save with thy right hand,
PSA.108.6	and answer give to me.
PSA.108.7	God in his holiness hath said,
PSA.108.7	Herein I will take pleasure;
PSA.108.7	Shechem I will divide, and forth
PSA.108.7	will Succoth's valley measure.
PSA.108.8	Gilead I claim as mine by right;
PSA.108.8	Manasseh mine shall be;
PSA.108.8	Ephraim is of my head the strength;
PSA.108.8	Judah gives laws for me;
PSA.108.9	Moab's my washing-pot; my shoe
PSA.108.9	I'll over Edom throw;
PSA.108.9	Over the land of Palestine
PSA.108.9	I will in triumph go.
PSA.108.10	O who is he will bring me to
PSA.108.10	the city fortify'd?
PSA.108.10	O who is he that to the land
PSA.108.10	of Edom will me guide?
PSA.108.11	O God, thou who hadst cast us off,
PSA.108.11	this thing wilt thou not do?
PSA.108.11	And wilt not thou, ev'n thou, O God,
PSA.108.11	forth with our armies go?
PSA.108.12	Do thou from trouble give us help,
PSA.108.12	for helpless is man's aid.
PSA.108.13	Through God we shall do valiantly;
PSA.108.13	our foes he shall down tread.
PSA.109.1	O thou the God of all my praise,
PSA.109.1	do thou not hold thy peace;
PSA.109.2	For mouths of wicked men to speak
PSA.109.2	against me do not cease:
PSA.109.2	The mouths of vile deceitful men
PSA.109.2	against me open'd be;
PSA.109.2	And with a false and lying tongue
PSA.109.2	they have accused me.
PSA.109.3	They did beset me round about
PSA.109.3	with words of hateful spight:
PSA.109.3	And though to them no cause I gave,
PSA.109.3	against me they did fight.
PSA.109.4	They for my love became my foes,
PSA.109.4	but I me set to pray.
PSA.109.5	Evil for good, hatred for love,
PSA.109.5	to me they did repay.
PSA.109.6	Set thou the wicked over him;
PSA.109.6	and upon his right hand
PSA.109.6	Give thou his greatest enemy,
PSA.109.6	ev'n Satan, leave to stand.
PSA.109.7	And when by thee he shall be judg'd,
PSA.109.7	let him condemned be;
PSA.109.7	And let his pray'r be turn'd to sin,
PSA.109.7	when he shall call on thee.
PSA.109.8	Few be his days, and in his room
PSA.109.8	his charge another take.
PSA.109.9	His children let be fatherless,
PSA.109.9	his wife a widow make.
PSA.109.10	His children let be vagabonds,
PSA.109.10	and beg continually;
PSA.109.10	And from their places desolate
PSA.109.10	seek bread for their supply.
PSA.109.11	Let covetous extortioners
PSA.109.11	catch all he hath away:
PSA.109.11	Of all for which he labour'd hath
PSA.109.11	let strangers make a prey.
PSA.109.12	Let there be none to pity him,
PSA.109.12	let there be none at all
PSA.109.12	That on his children fatherless
PSA.109.12	will let his mercy fall.
PSA.109.13	Let his posterity from earth
PSA.109.13	cut off for ever be,
PSA.109.13	And in the foll'wing age their name
PSA.109.13	be blotted out by thee.
PSA.109.14	Let God his father's wickedness
PSA.109.14	still to remembrance call;
PSA.109.14	And never let his mother's sin
PSA.109.14	be blotted out at all.
PSA.109.15	But let them all before the Lord
PSA.109.15	appear continually,
PSA.109.15	That he may wholly from the earth
PSA.109.15	cut off their memory.
PSA.109.16	Because he mercy minded not,
PSA.109.16	but persecuted still
PSA.109.16	The poor and needy, that he might
PSA.109.16	the broken-hearted kill.
PSA.109.17	As he in cursing pleasure took,
PSA.109.17	so let it to him fall;
PSA.109.17	As he delighted not to bless,
PSA.109.17	so bless him not at all.
PSA.109.18	As cursing he like clothes put on,
PSA.109.18	into his bowels so,
PSA.109.18	Like water, and into his bones,
PSA.109.18	like oil, down let it go.
PSA.109.19	Like to the garment let it be
PSA.109.19	which doth himself array,
PSA.109.19	And for a girdle, wherewith he
PSA.109.19	is girt about alway.
PSA.109.20	From God let this be their reward
PSA.109.20	that en'mies are to me,
PSA.109.20	And their reward that speak against
PSA.109.20	my soul maliciously.
PSA.109.21	But do thou, for thine own name's sake,
PSA.109.21	O God the Lord, for me:
PSA.109.21	Sith good and sweet thy mercy is,
PSA.109.21	from trouble set me free.
PSA.109.22	For I am poor and indigent,
PSA.109.22	afflicted sore am I,
PSA.109.22	My heart within me also is
PSA.109.22	wounded exceedingly.
PSA.109.23	I pass like a declining shade,
PSA.109.23	am like the locust tost:
PSA.109.24	My knees through fasting weaken'd are,
PSA.109.24	my flesh hath fatness lost.
PSA.109.25	I also am a vile reproach
PSA.109.25	unto them made to be;
PSA.109.25	And they that did upon me look
PSA.109.25	did shake their heads at me.
PSA.109.26	O do thou help and succour me,
PSA.109.26	who art my God and Lord:
PSA.109.26	And, for thy tender mercy's sake,
PSA.109.26	safety to me afford:
PSA.109.27	That thereby they may know that this
PSA.109.27	is thy almighty hand;
PSA.109.27	And that thou, Lord, hast done the same,
PSA.109.27	they may well understand.
PSA.109.28	Although they curse with spite, yet, Lord,
PSA.109.28	bless thou with loving voice:
PSA.109.28	Let them asham'd be when they rise;
PSA.109.28	thy servant let rejoice.
PSA.109.29	Let thou mine adversaries all
PSA.109.29	with shame be clothed over;
PSA.109.29	And let their own confusion
PSA.109.29	them, as a mantle, cover.
PSA.109.30	But as for me, I with my mouth
PSA.109.30	will greatly praise the Lord;
PSA.109.30	And I among the multitude
PSA.109.30	his praises will record.
PSA.109.31	For he shall stand at his right hand
PSA.109.31	who is in poverty,
PSA.109.31	To save him from all those that would
PSA.109.31	condemn his soul to die.
PSA.110.1	The Lord did say unto my Lord,
PSA.110.1	Sit thou at my right hand,
PSA.110.1	Until I make thy foes a stool,
PSA.110.1	whereon thy feet may stand.
PSA.110.2	The Lord shall out of Sion send
PSA.110.2	the rod of thy great pow'r:
PSA.110.2	In midst of all thine enemies
PSA.110.2	be thou the governor.
PSA.110.3	A willing people in thy day
PSA.110.3	of pow'r shall come to thee,
PSA.110.3	In holy beauties from morn's womb;
PSA.110.3	thy youth like dew shall be.
PSA.110.4	The Lord himself hath made an oath,
PSA.110.4	and will repent him never,
PSA.110.4	Of th' order of Melchisedec
PSA.110.4	thou art a priest for ever.
PSA.110.5	The glorious and mighty Lord,
PSA.110.5	that sits at thy right hand,
PSA.110.5	Shall, in his day of wrath, strike through
PSA.110.5	kings that do him withstand.
PSA.110.6	He shall among the heathen judge,
PSA.110.6	he shall with bodies dead
PSA.110.6	The places fill: o'er many lands
PSA.110.6	he wound shall ev'ry head.
PSA.110.7	The brook that runneth in the way
PSA.110.7	with drink shall him supply;
PSA.110.7	And, for this cause, in triumph he
PSA.110.7	shall lift his head on high.
PSA.111.1	Praise ye the Lord: with my whole heart
PSA.111.1	I will God's praise declare,
PSA.111.1	Where the assemblies of the just
PSA.111.1	and congregations are.
PSA.111.2	The whole works of the Lord our God
PSA.111.2	are great above all measure,
PSA.111.2	Sought out they are of ev'ry one
PSA.111.2	that doth therein take pleasure.
PSA.111.3	His work most honourable is,
PSA.111.3	most glorious and pure,
PSA.111.3	And his untainted righteousness
PSA.111.3	for ever doth endure.
PSA.111.4	His works most wonderful he hath
PSA.111.4	made to be thought upon:
PSA.111.4	The Lord is gracious,
PSA.111.4	and he is full of compassion.
PSA.111.5	He giveth meat unto all those
PSA.111.5	that truly do him fear;
PSA.111.5	And evermore his covenant
PSA.111.5	he in his mind will bear.
PSA.111.6	He did the power of his works
PSA.111.6	unto his people show,
PSA.111.6	When he the heathen's heritage
PSA.111.6	upon them did bestow.
PSA.111.7	His handy-works are truth and right;
PSA.111.7	all his commands are sure:
PSA.111.8	And, done in truth and uprightness,
PSA.111.8	they evermore endure.
PSA.111.9	He sent redemption to his folk;
PSA.111.9	his covenant for aye
PSA.111.9	He did command: holy his name
PSA.111.9	and rev'rend is alway.
PSA.111.10	Wisdom's beginning is God's fear:
PSA.111.10	good understanding they
PSA.111.10	Have all that his commands fulfill:
PSA.111.10	his praise endures for aye.
PSA.112.1	Praise ye the Lord. The man is bless'd
PSA.112.1	that fears the Lord aright,
PSA.112.1	He who in his commandements
PSA.112.1	doth greatly take delight.
PSA.112.2	His seed and offspring powerful
PSA.112.2	shall be the earth upon:
PSA.112.2	Of upright men blessed shall be
PSA.112.2	the generation.
PSA.112.3	Riches and wealth shall ever be
PSA.112.3	within his house in store;
PSA.112.3	And his unspotted righteousness
PSA.112.3	endures for evermore.
PSA.112.4	Unto the upright light doth rise,
PSA.112.4	though he in darkness be:
PSA.112.4	Compassionate, and merciful,
PSA.112.4	and righteous, is he.
PSA.112.5	A good man doth his favour shew,
PSA.112.5	and doth to others lend:
PSA.112.5	He with discretion his affairs
PSA.112.5	will guide unto the end.
PSA.112.6	Surely there is not any thing
PSA.112.6	that ever shall him move:
PSA.112.6	The righteous man's memorial
PSA.112.6	shall everlasting prove.
PSA.112.7	When he shall evil tidings hear,
PSA.112.7	he shall not be afraid:
PSA.112.7	His heart is fix'd, his confidence
PSA.112.7	upon the Lord is stay'd.
PSA.112.8	His heart is firmly stablished,
PSA.112.8	afraid he shall not be,
PSA.112.8	Until upon his enemies
PSA.112.8	he his desire shall see.
PSA.112.9	He hath dispers'd, giv'n to the poor;
PSA.112.9	his righteousness shall be
PSA.112.9	To ages all; with honour shall
PSA.112.9	his horn be raised high.
PSA.112.10	The wicked shall it see, and fret,
PSA.112.10	his teeth gnash, melt away:
PSA.112.10	What wicked men do most desire
PSA.112.10	shall utterly decay.
PSA.113.1	Praise God: ye servants of the Lord,
PSA.113.1	O praise, the Lord's name praise.
PSA.113.2	Yea, blessed be the name of God
PSA.113.2	from this time forth always.
PSA.113.3	From rising sun to where it sets,
PSA.113.3	God's name is to be prais'd.
PSA.113.4	Above all nations God is high,
PSA.113.4	'bove heav'ns his glory rais'd.
PSA.113.5	Unto the Lord our God that dwells
PSA.113.5	on high, who can compare?
PSA.113.6	Himself that humbleth things to see
PSA.113.6	in heav'n and earth that are.
PSA.113.7	He from the dust doth raise the poor,
PSA.113.7	that very low doth lie;
PSA.113.7	And from the dunghill lifts the man
PSA.113.7	oppress'd with poverty;
PSA.113.8	That he may highly him advance,
PSA.113.8	and with the princes set;
PSA.113.8	With those that of his people are
PSA.113.8	the chief, ev'n princes great.
PSA.113.9	The barren woman house to keep
PSA.113.9	he maketh, and to be
PSA.113.9	Of sons a mother full of joy.
PSA.113.9	Praise to the Lord give ye.
PSA.114.1	When Isr'el out of Egypt went,
PSA.114.1	and did his dwelling change,
PSA.114.1	When Jacob's house went out from those
PSA.114.1	that were of language strange,
PSA.114.2	He Judah did his sanctuary,
PSA.114.2	his kingdom Isr'el make:
PSA.114.3	The sea it saw, and quickly fled,
PSA.114.3	Jordan was driven back.
PSA.114.4	Like rams the mountains, and like lambs
PSA.114.4	the hills skipp'd to and fro.
PSA.114.5	O sea, why fledd'st thou? Jordan, back
PSA.114.5	why wast thou driven so?
PSA.114.6	Ye mountains great, wherefore was it
PSA.114.6	that ye did skip like rams?
PSA.114.6	And wherefore was it, little hills,
PSA.114.6	that ye did leap like lambs?
PSA.114.7	O at the presence of the Lord,
PSA.114.7	earth, tremble thou for fear,
PSA.114.7	While as the presence of the God
PSA.114.7	of Jacob doth appear:
PSA.114.8	Who from the hard and stony rock
PSA.114.8	did standing water bring;
PSA.114.8	And by his pow'r did turn the flint
PSA.114.8	into a water-spring.
PSA.115.1	Not unto us, Lord, not to us,
PSA.115.1	but do thou glory take
PSA.115.1	Unto thy name, ev'n for thy truth,
PSA.115.1	and for thy mercy's sake.
PSA.115.2	O wherefore should the heathen say,
PSA.115.2	Where is their God now gone?
PSA.115.3	But our God in the heavens is,
PSA.115.3	what pleas'd him he hath done.
PSA.115.4	Their idols silver are and gold,
PSA.115.4	work of men's hands they be.
PSA.115.5	Mouths have they, but they do not speak;
PSA.115.5	and eyes, but do not see;
PSA.115.6	Ears have they, but they do not hear;
PSA.115.6	noses, but savour not;
PSA.115.7	Hands, feet, but handle not, nor walk;
PSA.115.7	nor speak they through their throat.
PSA.115.8	Like them their makers are, and all
PSA.115.8	on them their trust that build.
PSA.115.9	O Isr'el, trust thou in the Lord,
PSA.115.9	he is their help and shield.
PSA.115.10	O Aaron's house, trust in the Lord,
PSA.115.10	their help and shield is he.
PSA.115.11	Ye that fear God, trust in the Lord,
PSA.115.11	their help and shield he'll be.
PSA.115.12	The Lord of us hath mindful been,
PSA.115.12	and he will bless us still:
PSA.115.12	He will the house of Isr'el bless,
PSA.115.12	bless Aaron's house he will.
PSA.115.13	Both small and great, that fear the Lord,
PSA.115.13	he will them surely bless.
PSA.115.14	The Lord will you, you and your seed,
PSA.115.14	aye more and more increase.
PSA.115.15	O blessed are ye of the Lord,
PSA.115.15	who made the earth and heav'n.
PSA.115.16	The heav'n, ev'n heav'ns, are God's, but he
PSA.115.16	earth to men's sons hath giv'n.
PSA.115.17	The dead, nor who to silence go,
PSA.115.17	God's praise do not record.
PSA.115.18	But henceforth we for ever will
PSA.115.18	bless God. Praise ye the Lord.
PSA.116.1	I love the Lord, because my voice
PSA.116.1	and prayers he did hear.
PSA.116.2	I, while I live, will call on him,
PSA.116.2	who bow'd to me his ear.
PSA.116.3	Of death the cords and sorrows did
PSA.116.3	about me compass round;
PSA.116.3	The pains of hell took hold on me,
PSA.116.3	I grief and trouble found.
PSA.116.4	Upon the name of God the Lord
PSA.116.4	then did I call, and say,
PSA.116.4	Deliver thou my soul, O Lord,
PSA.116.4	I do thee humbly pray.
PSA.116.5	God merciful and righteous is,
PSA.116.5	yea, gracious is our Lord.
PSA.116.6	God saves the meek: I was brought low,
PSA.116.6	he did me help afford.
PSA.116.7	O thou my soul, do thou return
PSA.116.7	unto thy quiet rest;
PSA.116.7	For largely, lo, the Lord to thee
PSA.116.7	his bounty hath exprest.
PSA.116.8	For my distressed soul from death
PSA.116.8	deliver'd was by thee:
PSA.116.8	Thou didst my mourning eyes from tears,
PSA.116.8	my feet from falling, free.
