PSA.39.7	my hope is fix'd on thee.
PSA.39.8	Free me from all my trespasses,
PSA.39.8	the fool's scorn make not me.
PSA.39.9	Dumb was I, op'ning not my mouth,
PSA.39.9	because this work was thine.
PSA.39.10	Thy stroke take from me; by the blow
PSA.39.10	of thine hand I do pine.
PSA.39.11	When with rebukes thou dost correct
PSA.39.11	man for iniquity,
PSA.39.11	Thou wastes his beauty like a moth:
PSA.39.11	sure each man's vanity.
PSA.39.12	Attend my cry, Lord, at my tears
PSA.39.12	and pray'rs not silent be:
PSA.39.12	I sojourn as my fathers all,
PSA.39.12	and stranger am with thee.
PSA.39.13	O spare thou me, that I my strength
PSA.39.13	recover may again,
PSA.39.13	Before from hence I do depart,
PSA.39.13	and here no more remain.
PSA.40.1	I waited for the Lord my God,
PSA.40.1	and patiently did bear;
PSA.40.1	At length to me he did incline
PSA.40.1	my voice and cry to hear.
PSA.40.2	He took me from a fearful pit,
PSA.40.2	and from the miry clay,
PSA.40.2	And on a rock he set my feet,
PSA.40.2	establishing my way.
PSA.40.3	He put a new song in my mouth,
PSA.40.3	our God to magnify:
PSA.40.3	Many shall see it, and shall fear,
PSA.40.3	and on the Lord rely.
PSA.40.4	O blessed is the man whose trust
PSA.40.4	upon the Lord relies;
PSA.40.4	Respecting not the proud, nor such
PSA.40.4	as turn aside to lies.
PSA.40.5	O Lord my God, full many are
PSA.40.5	the wonders thou hast done;
PSA.40.5	Thy gracious thoughts to us-ward far
PSA.40.5	above all thoughts are gone:
PSA.40.5	In order none can reckon them
PSA.40.5	to thee: if them declare,
PSA.40.5	And speak of them I would, they more
PSA.40.5	than can be number'd are.
PSA.40.6	No sacrifice nor offering
PSA.40.6	didst thou at all desire;
PSA.40.6	Mine ears thou bor'd: sin-off 'ring thou
PSA.40.6	and burnt didst not require:
PSA.40.7	Then to the Lord these were my words,
PSA.40.7	I come, behold and see;
PSA.40.7	Within the volume of the book
PSA.40.7	it written is of me:
PSA.40.8	To do thy will I take delight,
PSA.40.8	O thou my God that art;
PSA.40.8	Yea, that most holy law of thine
PSA.40.8	I have within my heart.
PSA.40.9	Within the congregation great
PSA.40.9	I righteousness did preach:
PSA.40.9	Lo, thou dost know, O Lord, that I
PSA.40.9	refrained not my speech.
PSA.40.10	I never did within my heart
PSA.40.10	conceal thy righteousness;
PSA.40.10	I thy salvation have declar'd,
PSA.40.10	and shown thy faithfulness:
PSA.40.10	Thy kindness, which most loving is,
PSA.40.10	concealed have not I,
PSA.40.10	Nor from the congregation great
PSA.40.10	have hid thy verity.
PSA.40.11	Thy tender mercies, Lord, from me
PSA.40.11	O do thou not restrain;
PSA.40.11	Thy loving-kindness, and thy truth,
PSA.40.11	let them me still maintain.
PSA.40.12	For ills past reck'ning compass me,
PSA.40.12	and mine iniquities
PSA.40.12	Such hold upon me taken have,
PSA.40.12	I cannot lift mine eyes:
PSA.40.12	They more than hairs are on mine head,
PSA.40.12	thence is my heart dismay'd.
PSA.40.13	Be pleased, Lord, to rescue me;
PSA.40.13	Lord, hasten to mine aid.
PSA.40.14	Sham'd and confounded be they all
PSA.40.14	that seek my soul to kill;
PSA.40.14	Yea, let them backward driven be,
PSA.40.14	and sham'd, that wish me ill.
PSA.40.15	For a reward of this their shame
PSA.40.15	confounded let them be.
PSA.40.15	That in this manner scoffing say,
PSA.40.15	Aha, aha! to me.
PSA.40.16	In thee let all be glad, and joy,
PSA.40.16	who seeking thee abide;
PSA.40.16	Who thy salvation love, say still,
PSA.40.16	The Lord be magnify'd.
PSA.40.17	I'm poor and needy, yet the Lord
PSA.40.17	of me a care doth take:
PSA.40.17	Thou art my help and saviour,
PSA.40.17	my God, no tarrying make.
PSA.41.1	Blessed is he that wisely doth
PSA.41.1	the poor man's case consider;
PSA.41.1	For when the time of trouble is,
PSA.41.1	the Lord will him deliver.
PSA.41.2	God will him keep, yea, save alive;
PSA.41.2	on earth he bless'd shall live;
PSA.41.2	And to his enemies' desire
PSA.41.2	thou wilt him not up give.
PSA.41.3	God will give strength when he on bed
PSA.41.3	of languishing doth mourn;
PSA.41.3	And in his sickness sore, O Lord,
PSA.41.3	thou all his bed wilt turn.
PSA.41.4	I said, O Lord, do thou extend
PSA.41.4	thy mercy unto me;
PSA.41.4	O do thou heal my soul; for why?
PSA.41.4	I have offended thee.
PSA.41.5	Those that to me are enemies,
PSA.41.5	of me do evil say,
PSA.41.5	When shall he die, that so his name
PSA.41.5	may perish quite away?
PSA.41.6	To see me if he comes, he speaks
PSA.41.6	vain words: but then his heart
PSA.41.6	Heaps mischief to it, which he tells,
PSA.41.6	when forth he doth depart.
PSA.41.7	My haters jointly whispering,
PSA.41.7	'gainst me my hurt devise.
PSA.41.8	Mischief, say they, cleaves fast to him;
PSA.41.8	he li'th, and shall not rise.
PSA.41.9	Yea, ev'n mine own familiar friend,
PSA.41.9	on whom I did rely,
PSA.41.9	Who ate my bread, ev'n he his heel
PSA.41.9	against me lifted high.
PSA.41.10	But, Lord, be merciful to me,
PSA.41.10	and up again me raise,
PSA.41.10	That I may justly them requite
PSA.41.10	according to their ways.
PSA.41.11	By this I know that certainly
PSA.41.11	I favour'd am by thee;
PSA.41.11	Because my hateful enemy
PSA.41.11	triumphs not over me.
PSA.41.12	But as for me, thou me uphold'st
PSA.41.12	in mine integrity;
PSA.41.12	And me before thy countenance
PSA.41.12	thou sett'st continually.
PSA.41.13	The Lord, the God of Israel,
PSA.41.13	be bless'd for ever then,
PSA.41.13	From age to age eternally.
PSA.41.13	Amen, yea, and amen.
PSA.42.1	Like as the hart for water-brooks
PSA.42.1	in thirst doth pant and bray;
PSA.42.1	So pants my longing soul, O God,
PSA.42.1	that come to thee I may.
PSA.42.2	My soul for God, the living God,
PSA.42.2	doth thirst: when shall I near
PSA.42.2	Unto thy countenance approach,
PSA.42.2	and in God's sight appear?
PSA.42.3	My tears have unto me been meat,
PSA.42.3	both in the night and day,
PSA.42.3	While unto me continually,
PSA.42.3	Where is thy God? they say.
PSA.42.4	My soul is poured out in me,
PSA.42.4	when this I think upon;
PSA.42.4	Because that with the multitude
PSA.42.4	I heretofore had gone:
PSA.42.4	With them into God's house I went,
PSA.42.4	with voice of joy and praise;
PSA.42.4	Yea, with the multitude that kept
PSA.42.4	the solemn holy days.
PSA.42.5	O why art thou cast down, my soul?
PSA.42.5	why in me so dismay'd?
PSA.42.5	Trust God, for I shall praise him yet,
PSA.42.5	his count'nance is mine aid.
PSA.42.6	My God, my soul's cast down in me;
PSA.42.6	thee therefore mind I will
PSA.42.6	From Jordan's land, the Hermonites,
PSA.42.6	and ev'n from Mizar hill.
PSA.42.7	At the noise of thy water-spouts
PSA.42.7	deep unto deep doth call;
PSA.42.7	Thy breaking waves pass over me,
PSA.42.7	yea, and thy billows all.
PSA.42.8	His loving-kindness yet the Lord
PSA.42.8	command will in the day,
PSA.42.8	His song's with me by night; to God,
PSA.42.8	by whom I live, I'll pray:
PSA.42.9	And I will say to God my rock,
PSA.42.9	Why me forgett'st thou so?
PSA.42.9	Why, for my foes' oppression,
PSA.42.9	thus mourning do I go?
PSA.42.10	'Tis as a sword within my bones,
PSA.42.10	when my foes me upbraid;
PSA.42.10	Ev'n when by them, Where is thy God?
PSA.42.10	'tis daily to me said.
PSA.42.11	O why art thou cast down, my soul?
PSA.42.11	why, thus with grief opprest,
PSA.42.11	Art thou disquieted in me?
PSA.42.11	in God still hope and rest:
PSA.42.11	For yet I know I shall him praise,
PSA.42.11	who graciously to me
PSA.42.11	The health is of my countenance,
PSA.42.11	yea, mine own God is he.
PSA.43.1	Judge me, O God, and plead my cause
PSA.43.1	against th' ungodly nation;
PSA.43.1	From the unjust and crafty man,
PSA.43.1	O be thou my salvation.
PSA.43.2	For thou the God art of my strength;
PSA.43.2	why thrusts thou me thee fro'?
PSA.43.2	For th' enemy's oppression
PSA.43.2	why do I mourning go?
PSA.43.3	O send thy light forth and thy truth;
PSA.43.3	let them be guides to me,
PSA.43.3	And bring me to thine holy hill,
PSA.43.3	ev'n where thy dwellings be.
PSA.43.4	Then will I to God's altar go,
PSA.43.4	to God my chiefest joy:
PSA.43.4	Yea, God, my God, thy name to praise
PSA.43.4	my harp I will employ.
PSA.43.5	Why art thou then cast down, my soul?
PSA.43.5	what should discourage thee?
PSA.43.5	And why with vexing thoughts art thou
PSA.43.5	disquieted in me?
PSA.43.5	Still trust in God; for him to praise
PSA.43.5	good cause I yet shall have:
PSA.43.5	He of my count'nance is the health,
PSA.43.5	my God that doth me save.
PSA.44.1	O God, we with our ears have heard,
PSA.44.1	our fathers have us told,
PSA.44.1	What works thou in their days hadst done,
PSA.44.1	ev'n in the days of old.
PSA.44.2	Thy hand did drive the heathen out,
PSA.44.2	and plant them in their place;
PSA.44.2	Thou didst afflict the nations,
PSA.44.2	but them thou didst increase.
PSA.44.3	For neither got their sword the land,
PSA.44.3	nor did their arm them save;
PSA.44.3	But thy right hand, arm, countenance;
PSA.44.3	for thou them favour gave.
PSA.44.4	Thou art my King: for Jacob, Lord,
PSA.44.4	deliv'rances command.
PSA.44.5	Through thee we shall push down our foes,
PSA.44.5	that do against us stand:
PSA.44.5	We, through thy name, shall tread down those
PSA.44.5	that ris'n against us have.
PSA.44.6	For in my bow I shall not trust,
PSA.44.6	nor shall my sword me save.
PSA.44.7	But from our foes thou hast us sav'd,
PSA.44.7	our haters put to shame.
PSA.44.8	In God we all the day do boast,
PSA.44.8	and ever praise thy name.
PSA.44.9	But now we are cast off by thee,
PSA.44.9	and us thou putt'st to shame;
PSA.44.9	And when our armies do go forth,
PSA.44.9	thou go'st not with the same.
PSA.44.10	Thou mak'st us from the enemy,
PSA.44.10	faint-hearted, to turn back;
PSA.44.10	And they who hate us for themselves
PSA.44.10	our spoils away do take.
PSA.44.11	Like sheep for meat thou gavest us;
PSA.44.11	'mong heathen cast we be.
PSA.44.12	Thou didst for nought thy people sell;
PSA.44.12	their price enrich'd not thee.
PSA.44.13	Thou mak'st us a reproach to be
PSA.44.13	unto our neighbours near;
PSA.44.13	Derision and a scorn to them
PSA.44.13	that round about us are.
PSA.44.14	A by-word also thou dost us
PSA.44.14	among the heathen make;
PSA.44.14	The people, in contempt and spite,
PSA.44.14	at us their heads do shake.
PSA.44.15	Before me my confusion
PSA.44.15	continually abides;
PSA.44.15	And of my bashful countenance
PSA.44.15	the shame me ever hides:
PSA.44.16	For voice of him that doth reproach,
PSA.44.16	and speaketh blasphemy;
PSA.44.16	By reason of th' avenging foe,
PSA.44.16	and cruel enemy.
PSA.44.17	All this is come on us, yet we
PSA.44.17	have not forgotten thee;
PSA.44.17	Nor falsely in thy covenant
PSA.44.17	behav'd ourselves have we.
PSA.44.18	Back from thy way our heart not turn'd;
PSA.44.18	our steps no straying made;
PSA.44.19	Though us thou brak'st in dragons' place,
PSA.44.19	and cover'dst with death's shade.
PSA.44.20	If we God's name forgot, or stretch'd
PSA.44.20	to a strange god our hands,
PSA.44.21	Shall not God search this out? for he
PSA.44.21	heart's secrets understands.
PSA.44.22	Yea, for thy sake we're kill'd all day,
PSA.44.22	counted as slaughter-sheep.
PSA.44.23	Rise, Lord, cast us not ever off;
PSA.44.23	awake, why dost thou sleep?
PSA.44.24	O wherefore hidest thou thy face?
PSA.44.24	forgett'st our cause distress'd,
PSA.44.25	And our oppression? For our soul
PSA.44.25	is to the dust down press'd:
PSA.44.25	Our belly also on the earth
PSA.44.25	fast cleaving, hold doth take.
PSA.44.26	Rise for our help, and us redeem,
PSA.44.26	ev'n for thy mercies' sake.
PSA.45.1	My heart brings forth a goodly thing;
PSA.45.1	my words that I indite
PSA.45.1	Concern the King: my tongue's a pen
PSA.45.1	of one that swift doth write.
PSA.45.2	Thou fairer art than sons of men:
PSA.45.2	into thy lips is store
PSA.45.2	Of grace infus'd; God therefore thee
PSA.45.2	hath bless'd for evermore.
PSA.45.3	O thou that art the mighty One,
PSA.45.3	thy sword gird on thy thigh;
PSA.45.3	Ev'n with thy glory excellent,
PSA.45.3	and with thy majesty.
PSA.45.4	For meekness, truth, and righteousness,
PSA.45.4	in state ride prosp'rously;
PSA.45.4	And thy right hand shall thee instruct
PSA.45.4	in things that fearful be.
PSA.45.5	Thine arrows sharply pierce the heart
PSA.45.5	of th' en'mies of the King;
PSA.45.5	And under thy subjection
PSA.45.5	the people down do bring.
PSA.45.6	For ever and for ever is,
PSA.45.6	O God, thy throne of might;
PSA.45.6	The sceptre of thy kingdom is
PSA.45.6	a sceptre that is right.
PSA.45.7	Thou lovest right, and hatest ill;
PSA.45.7	for God, thy God, most high,
PSA.45.7	Above thy fellows hath with th' oil
PSA.45.7	of joy anointed thee.
PSA.45.8	Of aloes, myrrh,
PSA.45.8	and cassia, a smell thy garments had,
PSA.45.8	Out of the iv'ry palaces,
PSA.45.8	whereby they made thee glad.
PSA.45.9	Among thy women honourable
PSA.45.9	kings' daughters were at hand:
PSA.45.9	Upon thy right hand did the queen
PSA.45.9	in gold of Ophir stand.
PSA.45.10	O daughter, hearken and regard,
PSA.45.10	and do thine ear incline;
PSA.45.10	Likewise forget thy father's house,
PSA.45.10	and people that are thine.
PSA.45.11	Then of the King desir'd shall be
PSA.45.11	thy beauty veh'mently:
PSA.45.11	Because he is thy Lord, do thou
PSA.45.11	him worship rev'rently.
PSA.45.12	The daughter there of Tyre shall be
PSA.45.12	with gifts and off 'rings great:
PSA.45.12	Those of the people that are rich
PSA.45.12	thy favour shall entreat.
PSA.45.13	Behold, the daughter of the King
PSA.45.13	all glorious is within;
PSA.45.13	And with embroideries of gold
PSA.45.13	her garments wrought have been.
PSA.45.14	She shall be brought unto the King
PSA.45.14	in robes with needle wrought;
PSA.45.14	Her fellow-virgins following
PSA.45.14	shall unto thee be brought.
PSA.45.15	They shall be brought with gladness great,
PSA.45.15	and mirth on ev'ry side,
PSA.45.15	Into the palace of the King,
PSA.45.15	and there they shall abide.
PSA.45.16	Instead of those thy fathers dear,
PSA.45.16	thy children thou may'st take,
PSA.45.16	And in all places of the earth
PSA.45.16	them noble princes make.
PSA.45.17	Thy name remember'd I will make
PSA.45.17	through ages all to be:
PSA.45.17	The people therefore evermore
PSA.45.17	shall praises give to thee.
PSA.46.1	God is our refuge and our strength,
PSA.46.1	in straits a present aid;
PSA.46.2	Therefore, although the earth remove,
PSA.46.2	we will not be afraid:
PSA.46.2	Though hills amidst the seas be cast;
PSA.46.3	Though waters roaring make,
PSA.46.3	And troubled be; yea, though the hills,
PSA.46.3	by swelling seas do shake.
PSA.46.4	A river is, whose streams do glad
PSA.46.4	the city of our God;
PSA.46.4	The holy place, wherein the Lord
PSA.46.4	most high hath his abode.
PSA.46.5	God in the midst of her doth dwell;
PSA.46.5	nothing shall her remove:
PSA.46.5	The Lord to her an helper will,
PSA.46.5	and that right early, prove.
PSA.46.6	The heathen rag'd tumultuously,
PSA.46.6	the kingdoms moved were:
PSA.46.6	The Lord God uttered his voice,
PSA.46.6	the earth did melt for fear.
PSA.46.7	The Lord of hosts upon our side
PSA.46.7	doth constantly remain:
PSA.46.7	The God of Jacob's our refuge,
PSA.46.7	us safely to maintain.
PSA.46.8	Come, and behold what wondrous works
PSA.46.8	have by the Lord been wrought;
PSA.46.8	Come, see what desolations
PSA.46.8	he on the earth hath brought.
PSA.46.9	Unto the ends of all the earth
PSA.46.9	wars into peace he turns:
PSA.46.9	The bow he breaks, the spear he cuts,
PSA.46.9	in fire the chariot burns.
PSA.46.10	Be still, and know that I am God;
PSA.46.10	among the heathen I
PSA.46.10	Will be exalted; I on earth
PSA.46.10	will be exalted high.
PSA.46.11	Our God, who is the Lord of hosts,
PSA.46.11	is still upon our side;
PSA.46.11	The God of Jacob our refuge
PSA.46.11	for ever will abide.
PSA.47.1	All people, clap your hands; to God
PSA.47.1	with voice of triumph shout:
PSA.47.2	For dreadful is the Lord most high,
PSA.47.2	great King the earth throughout.
PSA.47.3	The heathen people under us
PSA.47.3	he surely shall subdue;
PSA.47.3	And he shall make the nations
PSA.47.3	under our feet to bow.
PSA.47.4	The lot of our inheritance
PSA.47.4	chuse out for us shall he,
PSA.47.4	Of Jacob, whom he loved well,
PSA.47.4	ev'n the excellency.
PSA.47.5	God is with shouts gone up, the Lord
PSA.47.5	with trumpets sounding high.
PSA.47.6	Sing praise to God, sing praise, sing praise,
PSA.47.6	praise to our King sing ye.
PSA.47.7	For God is King of all the earth;
PSA.47.7	with knowledge praise express.
PSA.47.8	God rules the nations: God sits on
PSA.47.8	his throne of holiness.
PSA.47.9	The princes of the people are
PSA.47.9	assembled willingly;
PSA.47.9	Ev'n of the God of Abraham
PSA.47.9	they who the people be.
PSA.47.9	For why? the shields that do defend
PSA.47.9	the earth are only his:
PSA.47.9	They to the Lord belong; yea, he
PSA.47.9	exalted greatly is.
PSA.48.1	Great is the Lord, and greatly he
PSA.48.1	is to be praised still,
PSA.48.1	Within the city of our God,
PSA.48.1	upon his holy hill.
PSA.48.2	Mount Sion stands most beautiful,
PSA.48.2	the joy of all the land;
PSA.48.2	The city of the mighty King
PSA.48.2	on her north side doth stand.
PSA.48.3	The Lord within her palaces
PSA.48.3	is for a refuge known.
PSA.48.4	For, lo, the kings that gather'd were
PSA.48.4	together, by have gone.
PSA.48.5	But when they did behold the same,
PSA.48.5	they, wond'ring, would not stay;
PSA.48.5	But, being troubled at the sight,
PSA.48.5	they thence did haste away.
PSA.48.6	Great terror there took hold on them;
PSA.48.6	they were possess'd with fear;
PSA.48.6	Their grief came like a woman's pain,
PSA.48.6	when she a child doth bear.
PSA.48.7	Thou Tarshish ships with east wind break'st:
PSA.48.8	As we have heard it told,
PSA.48.8	So, in the city of the Lord,
PSA.48.8	our eyes did it behold;
PSA.48.8	In our God's city, which his hand
PSA.48.8	for ever stablish will.
PSA.48.9	We of thy loving-kindness thought,
PSA.48.9	Lord, in thy temple still.
PSA.48.10	O Lord, according to thy name,
PSA.48.10	through all the earth's thy praise;
PSA.48.10	And thy right hand, O Lord, is full
PSA.48.10	of righteousness always.
PSA.48.11	Because thy judgments are made known,
PSA.48.11	let Sion mount rejoice;
PSA.48.11	Of Judah let the daughters all
PSA.48.11	send forth a cheerful voice.
PSA.48.12	Walk about Sion,
PSA.48.12	and go round; the high tow'rs thereof tell:
PSA.48.13	Consider ye her palaces,
PSA.48.13	and mark her bulwarks well;
PSA.48.13	That ye may tell posterity.
PSA.48.14	For this God doth abide
PSA.48.14	Our God for evermore; he will
PSA.48.14	ev'n unto death us guide.
PSA.49.1	Hear this, all people, and give ear,
PSA.49.1	all in the world that dwell;
PSA.49.2	Both low and high, both rich and poor.
PSA.49.3	My mouth shall wisdom tell:
PSA.49.3	My heart shall knowledge meditate.
PSA.49.4	I will incline mine ear
PSA.49.4	To parables, and on the harp
PSA.49.4	my sayings dark declare.
PSA.49.5	Amidst those days that evil be,
PSA.49.5	why should I, fearing, doubt?
PSA.49.5	When of my heels th' iniquity
PSA.49.5	shall compass me about.
PSA.49.6	Whoe'er they be that in their wealth
PSA.49.6	their confidence do pitch,
PSA.49.6	And boast themselves, because they are
PSA.49.6	become exceeding rich:
PSA.49.7	Yet none of these his brother can
PSA.49.7	redeem by any way;
PSA.49.7	Nor can he unto God for him
PSA.49.7	sufficient ransom pay,
PSA.49.8	(Their soul's redemption precious is,
PSA.49.8	and it can never be,)
PSA.49.9	That still he should for ever live,
PSA.49.9	and not corruption see.
PSA.49.10	For why? he seeth that wise men die,
PSA.49.10	and brutish fools also
PSA.49.10	Do perish; and their wealth, when dead,
PSA.49.10	to others they let go.
PSA.49.11	Their inward thought is, that their house
PSA.49.11	and dwelling-places shall
PSA.49.11	Stand through all ages; they their lands
PSA.49.11	by their own names do call.
PSA.49.12	But yet in honour shall not man
PSA.49.12	abide continually;
PSA.49.12	But passing hence, may be compar'd
PSA.49.12	unto the beasts that die.
PSA.49.13	Thus brutish folly plainly is
PSA.49.13	their wisdom and their way;
PSA.49.13	Yet their posterity approve
PSA.49.13	what they do fondly say.
PSA.49.14	Like sheep they in the grave are laid,
PSA.49.14	and death shall them devour;
PSA.49.14	And in the morning upright men
PSA.49.14	shall over them have pow'r:
PSA.49.14	Their beauty from their dwelling shall
PSA.49.14	consume within the grave.
PSA.49.15	But from hell's hand God will me free,
PSA.49.15	for he shall me receive.
PSA.49.16	Be thou not then afraid when one
PSA.49.16	enriched thou dost see,
PSA.49.16	Nor when the glory of his house
PSA.49.16	advanced is on high:
PSA.49.17	For he shall carry nothing hence
PSA.49.17	when death his days doth end;
PSA.49.17	Nor shall his glory after him
PSA.49.17	into the grave descend.
PSA.49.18	Although he his own soul did bless
PSA.49.18	whilst he on earth did live;
PSA.49.18	(And when thou to thyself dost well,
PSA.49.18	men will thee praises give;)
PSA.49.19	He to his fathers' race shall go,
PSA.49.19	they never shall see light.
PSA.49.20	Man honour'd wanting knowledge is
PSA.49.20	like beasts that perish quite.
PSA.50.1	The mighty God, the Lord,
PSA.50.1	hath spoken, and did call
PSA.50.1	The earth, from rising of the sun,
PSA.50.1	to where he hath his fall.
PSA.50.2	From out of Sion hill,
PSA.50.2	which of excellency
PSA.50.2	And beauty the perfection is,
PSA.50.2	God shined gloriously.
PSA.50.3	Our God shall surely come,
PSA.50.3	keep silence shall not he:
PSA.50.3	Before him fire shall waste, great storms
PSA.50.3	shall round about him be.
PSA.50.4	Unto the heavens clear
PSA.50.4	he from above shall call,
PSA.50.4	And to the earth likewise, that he
PSA.50.4	may judge his people all.
PSA.50.5	Together let my saints
PSA.50.5	unto me gather'd be,
PSA.50.5	Those that by sacrifice have made
PSA.50.5	a covenant with me.
PSA.50.6	And then the heavens shall
PSA.50.6	his righteousness declare:
PSA.50.6	Because the Lord himself is he
PSA.50.6	by whom men judged are.
PSA.50.7	My people Isr'el hear,
PSA.50.7	speak will I from on high,
PSA.50.7	Against thee I will testify;
PSA.50.7	God, ev'n thy God, am I.
PSA.50.8	I for thy sacrifice
PSA.50.8	no blame will on thee lay,
PSA.50.8	Nor for burnt-off 'rings, which to me
PSA.50.8	thou offer'dst ev'ry day.
PSA.50.9	I'll take no calf nor goats
PSA.50.9	from house or fold of thine:
PSA.50.10	For beasts of forests, cattle all
PSA.50.10	on thousand hills, are mine.
PSA.50.11	The fowls on mountains high
PSA.50.11	are all to me well known;
PSA.50.11	Wild beasts which in the fields do lie,
PSA.50.11	ev'n they are all mine own.
PSA.50.12	Then, if I hungry were,
PSA.50.12	I would not tell it thee;
PSA.50.12	Because the world, and fulness all
PSA.50.12	thereof, belongs to me.
PSA.50.13	Will I eat flesh of bulls?
PSA.50.13	or goats' blood drink will I?
PSA.50.14	Thanks offer thou to God, and pay
PSA.50.14	thy vows to the most High.
PSA.50.15	And call upon me when
PSA.50.15	in trouble thou shalt be;
PSA.50.15	I will deliver thee, and thou
PSA.50.15	my name shalt glorify.
PSA.50.16	But to the wicked man
PSA.50.16	God saith, My laws and truth
PSA.50.16	Should'st thou declare? how dar'st thou take
PSA.50.16	my cov'nant in thy mouth?
PSA.50.17	Sith thou instruction hat'st,
PSA.50.17	which should thy ways direct;
PSA.50.17	And sith my words behind thy back
PSA.50.17	thou cast'st, and dost reject.
PSA.50.18	When thou a thief didst see,
PSA.50.18	with him thou didst consent;
PSA.50.18	And with the vile adulterers
PSA.50.18	partaker on thou went.
PSA.50.19	Thou giv'st thy mouth to ill,
PSA.50.19	thy tongue deceit doth frame;
PSA.50.20	Thou sitt'st, and 'gainst thy brother speak'st,
PSA.50.20	thy mother's son dost shame.
PSA.50.21	Because I silence kept,
PSA.50.21	while thou these things hast wrought;
PSA.50.21	That I was altogether like
PSA.50.21	thyself, hath been thy thought;
PSA.50.21	Yet I will thee reprove,
PSA.50.21	and set before thine eyes,
PSA.50.21	In order ranked, thy misdeeds
PSA.50.21	and thine iniquities.
PSA.50.22	Now, ye that God forget,
PSA.50.22	this carefully consider;
PSA.50.22	Lest I in pieces tear you all,
PSA.50.22	and none can you deliver.
PSA.50.23	Whoso doth offer praise
PSA.50.23	me glorifies; and I
PSA.50.23	Will shew him God's salvation,
PSA.50.23	that orders right his way.
PSA.51.1	After thy loving-kindness, Lord,
PSA.51.1	have mercy upon me:
PSA.51.1	For thy compassions great, blot out
PSA.51.1	all mine iniquity.
PSA.51.2	Me cleanse from sin, and throughly wash
PSA.51.2	from mine iniquity:
PSA.51.3	For my transgressions I confess;
PSA.51.3	my sin I ever see.
PSA.51.4	'Gainst thee, thee only, have I sinn'd,
PSA.51.4	in thy sight done this ill;
PSA.51.4	That when thou speak'st thou may'st be just,
PSA.51.4	and clear in judging still.
PSA.51.5	Behold, I in iniquity
PSA.51.5	was form'd the womb within;
PSA.51.5	My mother also me conceiv'd
PSA.51.5	in guiltiness and sin.
PSA.51.6	Behold, thou in the inward parts
PSA.51.6	with truth delighted art;
PSA.51.6	And wisdom thou shalt make me know
PSA.51.6	within the hidden part.
PSA.51.7	Do thou with hyssop sprinkle me,
PSA.51.7	I shall be cleansed so;
PSA.51.7	Yea, wash thou me, and then I shall
PSA.51.7	be whiter than the snow.
PSA.51.8	Of gladness and of joyfulness
PSA.51.8	make me to hear the voice;
PSA.51.8	That so these very bones which thou
PSA.51.8	hast broken may rejoice.
PSA.51.9	All mine iniquities blot out,
PSA.51.9	thy face hide from my sin.
PSA.51.10	Create a clean heart, Lord, renew
PSA.51.10	a right sp'rit me within.
PSA.51.11	Cast me not from thy sight, nor take
PSA.51.11	thy Holy Sp'rit away.
PSA.51.12	Restore me thy salvation's joy;
PSA.51.12	with thy free Sp'rit me stay.
PSA.51.13	Then will I teach thy ways unto
PSA.51.13	those that transgressors be;
PSA.51.13	And those that sinners are shall then
PSA.51.13	be turned unto thee.
PSA.51.14	O God, of my salvation God,
PSA.51.14	me from blood-guiltiness
PSA.51.14	Set free; then shall my tongue aloud
PSA.51.14	sing of thy righteousness.
