ACT.13.33	Исады Забурдынъ экинши боьлиминде: „Сен Меним Улым, Мен Сени буьгуьн тувдырдым“, – деп язылганша, тирилтип, Алла сол антты бизге, олардынъ тувдыкларына, толтырды.
ACT.13.34	Шаркын ширитпес уьшин Оны оьлилерден тирилтип, тургыстканы акында Алла булай айткан: „Мен сизге Дауттынъ сыйлы эм ынанымлы ийгиликлерин берермен“. 
ACT.13.35	Сол себепли баска бир ерде: „Сен сыйлы аьдеминъе шируьвди сынатпассынъ“, – деп те айтады.
ACT.13.36	Ама Даут оьз несилинде, Алла ыхтыяры бойынша, куллык эткеннен сонъ оьлип, оьз аталарына косылды эм шируьвди сынады.
ACT.13.37	А Сол – Алла тирилткен шируьвди сынамады. 
ACT.13.38+ACT.13.39	Соьйтип, белгили болсын, кардашлар: Иса аркалы куьналардынъ кеширилееги сизге билдириледи. Иман этетаган аьр аьдем, сиз Мусага буйырылган Таурат пан акланалмаган аьр заттан Иса аркалы акланар. 
ACT.13.40	Соьйтип, сакланынъыз, пайхамбарлардынъ айткан соьзлери басынъызга келмесинлер: 
ACT.13.41	„Каранъыз, мыскыллавшылар, сейирсининъиз, йок болынъыз, неге десе Мен куьнинъизде сондай исти этемен, ким сизге айтса, сол иске сиз эш бир де ынанмассыз“».
ACT.13.42	Паул ман Барнаба синагогтан шыгаятырган вакытта, халк: «Келеек шабат куьн де бу соьзлерди бизге айтарсыз», – деп тиледи. 
ACT.13.43	Йыйылыс таркалганнан сонъ, ювытлардынъ эм, ювыт динине коьшип, Аллага табынган баска миллетлилердинъ коьплери Паул ман Барнабадынъ артыннан иердилер. Элшилер, хабарласа барып, оларга Алладынъ шапагатында турмага керегин туьсиндирип айттылар.
ACT.13.44	Артыннан келген шабат куьн, шахар яшавшыларынынъ баьриси демеге болаяк, Алла соьзин тынъламага йыйылдылар. 
ACT.13.45	Ама ювытлар йыйылган халкты коьргенде куьнледилер, Паул айтатаган затларды яманлап, карсы соьйледилер. 
ACT.13.46	Паул ман Барнаба йигерленип: «Сизге Алла соьзи баьрисиннен алдын билдирилмеге тийисли экен. Ама оны кери кагасыз эм оьзинъизди, оьмирлик яшавга тийислисиз деп, санамайсыз, сонынъ уьшин биз баска миллетлилерге каратып айтамыз. 
ACT.13.47	Неге десе Раббий бизге муны тапшырган: „Дуныядынъ шетине дейим аьдемлердинъ куткарылувына амал этер уьшин сени баска миллетлилерге ярыклыкка салдым“».
ACT.13.48	Баска миллетлилер муны эситип, куванып, Раббийдинъ соьзин данъклайтаган эдилер. Оьмирлик яшавга аьзир болганлардынъ баьриси иманга келдилер.
ACT.13.49	Буьтин кыралда Раббийдинъ соьзи яйылатаган эди. 
ACT.13.50	Ама ювытлар Аллага табынувшы белгили хатынларды, шахардынъ биринши аьдемлерин оларга карсы тургыстып, Паул ман Барнабады оьз ерлериннен кувалатып шыгардылар. 
ACT.13.51	Паул ман Барнаба оларга карсылыктынъ шаатлыгын этип, аякларынынъ табаныннан шанъды да кагып туьсирип, Иконияга кеттилер. 
ACT.13.52	Сокталар куваныш пан толып, Кие Рух пан савлай бийленген эдилер.
ACT.14.1	Иконияда аьдеттеги зат болды. Паул ман Барнаба ювыт синагогына кирип, айлак бек ынандырып соьйлегеннен сонъ, коьп ювытлар эм греклер иманга туьстилер. 
ACT.14.2	Ама иманга туьспеге унамаган ювытлар, баска миллетлилерди ашувландырып, оларды иманлыларга карсы коьтердилер. 
ACT.14.3	Сол ерде бир кесек заман калган Паул мен Барнаба Раббий акында йигерлик мен соьйледилер. Раббий, Оьз шапагаты акындагы соьзге шаатлык этип, элшилердинъ коллары ман аьлемет нышанлар эм аьжейиплер коьрсетти. 
ACT.14.4	Шахар яшавшылары экиге боьлиндилер. Бир кесеклери – ювытлар, баскалары элшилер як болдылар.
ACT.14.5	Ювытлар эм баска миллетлилер оьзлерининъ аькимлери мен оларды маскаралап, таслар ман тоьбелемеге ниетлендилер. 
ACT.14.6	Элшилер, бу затты эситип, Ликавониядынъ Листра ман Дербе шахарларына эм олардынъ тоьгерегиндеги ерлерге кашып кеттилер. 
ACT.14.7	Сонда Ийги Хабарды яйдылар.
ACT.14.8	Листрада аяклары ысламайтаган, тувганнан бери аксак болып, бир заманда да юрмеген аьдем бар эди. 
ACT.14.9	Бу аьдем Паулдынъ хабарын тынълады. Паул ога коьз тигип, савартылувына иманы болганын коьрип: 
ACT.14.10	«Аягынъды коркпай бас!» – деди. Аьдем, ушып турагалып, юрип баслады.
ACT.14.11	Халк Паулдынъ эткенин коьрип, Ликавония тилинде куьшли давыс пан: «Бизим янымызга инсан келбетинде таьнърилер келди!» – деди. 
ACT.14.12	Барнабады – Зевс
ACT.14.13	Зевс уьйи шахардынь алдында эди. Онынь куллыкшысы, капы алдына оьгизлер эм шешекей байламларын аькелип, халк пан бирге курман шалмага суьйди.
ACT.14.14	Ама элшилер – Барнаба эм Паул – бу зат акында эситип, кийимлерин йырттылар эм халк арасына атылып кирип, куьшли давыс пан: 
ACT.14.15	«Аьдемлер, не затлар этесинъиз? Биз де – сиздей аьдемлермиз, бу ялган затларды койып, коькти, ерди, денъизди эм олардынъ ишиндегин яраткан Аллага табынынъыз деп, сизге Ийги Хабарды аькелгенмиз. 
ACT.14.16	Озган шакларда Алла буьтин халкларга оьз йоллары ман юрмеге ызын берген. 
ACT.14.17	Ама Оьзи акында да шаатлык беруьвин токтатпады. Сизге ийгиликлер этеди: коьктен ямгыр явдырады, онъысларга заманында онъайлык берип, сизди тойдырып, юреклеринъизди суьйиниш пен толтырады», – деп айттылар. 
ACT.14.18	Бу соьзлерди айтып, оьзлерине курман шалмай, уьйлерине кайтпага керегин халкка кыйынлык пан туьсиндирдилер.
ACT.14.19	Антиохия ман Икониядан кайбир ювытлар келип халкты оьршиктирди. Паулды таслар ман сыбалаттылар эм, оьлди деп санап, шахардынъ тысына суьйреп шыгардылар. 
ACT.14.20	Ама сокталар янына йыйылганлай, Паул турды эм шахарга кайтып келди, а экинши куьн Барнаба ман бирге Дербеге кетти.
ACT.14.21	Сол шахарда Ийги Хабарды уьйретип эм коьп сокта йыйып, олар тагы Листрага, Иконияга эм Антиохияга кайтып келдилер. 
ACT.14.22	Сонда элшилер сокталарынынъ коьнъиллерине куват берип: «Алладынъ Патшалыгына коьп кыйналып киргенимиз керек», – деп, иманларында берк болар уьшин оларга йигерлилик бердилер. 
ACT.14.23	Паул эм Барнаба иманлылар уьшин аьр ямагатта тамада айырып, ораза тутып, дува этип, оларды оьзлери сыйынган Раббийге багысладылар.
ACT.14.24	Сонъ элшилер Писидияды оьтип Памфилияга келдилер. 
ACT.14.25	Пергеде Алла соьзин билдирип, Анталияга бардылар. 
ACT.14.26	Анталиядан кемеге олтырып, олар толтырган ислери уьшин Алладынъ шапагатына аманат этилген шахарга – Антиохияга – кеттилер. 
ACT.14.27	Онда келип иман ямагатын бир ерге йыйып, Алладынъ оьзлери уьстиннен не ислегенин эм баска миллетлерге кайтип иман эсигин ашканын – баьрисин де соьйледилер. 
ACT.14.28	Сокталар ман бирге онда узак заман калдылар.
ACT.15.1	Юдеядан келген кайбиревлер Антиохиядагы иманлыларды: «Муса буйырган аьдет пен суьннетли болмасанъыз, кутылалмаяксыз», – деп, уьйрететаган эдилер. 
ACT.15.2	Паул ман Барнабадынъ олар ман эрисуьвлери, коьп сорасувлары болды. Бу сорав уьстиннен Паул ман Барнаба эм араларыннан кайбиревлер Ерусалимге элшилер эм тамадалар янына бармага керекли деп токтастылар. 
ACT.15.3	Иман ямагаты оларды йолга шыгарганнан сонъ, Паул эм Барнаба баска миллетлилердинъ Аллага кайтип сыйынганлары акында анълата-анълата, Финикия ман Самария ерлериннен озып, буьтин кардашларга уьйкен суьйиниш бердилер. 
ACT.15.4	Ерусалимге келгенде, оларды иман ямагаты, элшилер эм тамадалар кабыл этип алдылар. Паул эм Барнаба Алладынъ олар аркалы не эткенин айтып бердилер.
ACT.15.5	Сол ерде парисей куьбиннен ынанганлардынъ кайбиревлери шыгып: «Баска миллетлилерди суьннетлемеге, Мусага буйырылган Тауратты тутпага насихатламага керек», – дедилер.
ACT.15.6	Элшилер эм тамадалар бу соравдынъ уьстиннен соьйлеспеге йыйылдылар. 
ACT.15.7	Петер узак кенъесуьвден сонъ, турып, булай айтты: «Кардашлар! Билесиз, баска миллетлилер меним авызымнан Ийги Хабардынъ соьзин эситсинлер эм иманга туьссинлер деп, коьп заманнан алдын сизинъ аранъыздан Алла мени сайлаган эди. 
ACT.15.8	Инсаннынъ юрегин билген Алла, Кие Рухты бизге бергендей, баска миллетлилерге берип, оларды да кабыл эткенин коьрсетти. 
ACT.15.9	Олар ман бизим арамызда эш бир баскалык этпеди, иманлары ман юреклерин тазалады. 
ACT.15.10	Соьйтип болганда, не биз, не аталарымыз коьтералмаган юкти сокталардынъ мойнына коьширмеге суьйип, не уьшин соьле Аллады сынайсыз? 
ACT.15.11	Биз Раббий Исадынъ шапагаты ман куткарылаягымызга ынанамыз, олар да соьйтип».
ACT.15.12	Сонъ буьтин йыйын тынды да Барнаба ман Паулды тынълап баслады. Барнаба ман Паул Алла олар аркалы баска миллетлерде аьлемет нышанлар эм аьжейиплер тувдырганы акында хабарладылар. 
ACT.15.13	Олар соьйлеп кутылганнан сонъ Якуп соьз алып: «Кардашлар, мени тынъланъыз. 
ACT.15.14	Шимон Алладынъ баска миллетлилерден, Оьзиндики болсын деп, бир халк этер уьшин оларга биринши кере калай якласканын анълатты. 
ACT.15.15	Пайхамбарлардынъ соьзлери де бу зат пан келиседи. Неге десе булай язылган: 
ACT.15.16	„Муннан сонъ Мен кери кайтып, Дауттынъ шашылган юртын янъыдан туьзетеекпен, опыраганларын янъыдан курап, кайтадан аяк уьстине салаякпан. 
ACT.15.17	Артта калган инсанлар, Мен Оьзимдики болмага шакырган буьтин миллетлер Раббийди излер уьшин солай этеекпен“, – дейди бу затлардынъ баьрисин де этетаган Раббий. 
ACT.15.18	Алла этеек ислерининъ баьрисин илгери заманнан биледи.
ACT.15.19	Соннан себеп, менимше, баска миллетлилерден Аллага ынанганларга кыйынлыклар тувдырмага керек тувылмыз. 
ACT.15.20	Тек оларга бу затты язып йибермеге керек: бутлар
ACT.15.21	Неге десе бурыннан бери Мусага буйырылган Таурат аьр шахарда, аьр шабат куьнинде синагогларда окылып, анълатылып келеди», – деди.
ACT.15.22	Сонда элшилер эм тамадалар буьтин иман ямагатынынъ разылыгы ман оьзлерининъ арасыннан айырган аьдемлерин Паул эм Барнаба ман бирге Антиохияга йибермеге токтастылар. Бу айырылган аьдемлер (иман) кардашларынынъ басшылары болган Барсаба деп аталган Юда ман Силас эдилер. 
ACT.15.23	Булар аркалы тоьменде язылган хат йиберилди: «Элшилер, тамадалар эм (иман) кардашларыннан Антиохия, Сирия эм Киликиядагы баска миллетли кардашларына салам! 
ACT.15.24	Бизден шыккан кайбиревлер, „Суьннетли болмага эм Тауратты тутпага тийисли“ деп, айткан соьзлери мен сизди тынышсызландырган эм янынъызды кыйнаганлар деп эситтик. Биз болсак оларга муны тапшырмаганмыз. 
ACT.15.25	Бу себептен ишимизден бир неше аьдемди сайлап, оларды, оьзимиз суьйген Барнаба эм Паул ман бирге, сизге йибермеге бир ойдан токтастык. 
ACT.15.26	Бу экиси Раббийимиз Иса Масихтинъ исине оьз янларын багыслаганлар. 
ACT.15.27	Соьйтип Юда ман Силасты, сизге биз язганларды соьз бен айтып туьсиндирсинлер деп, йиберемиз. 
ACT.15.28	Кие Рухка эм бизге уьстинъизге керекли болган сол ислерден баска бир юк те салынмавы ийги коьринеди: 
ACT.15.29	Бутларга багысланган курман этлериннен, каннан, бугындырылып оьлтирилген айванлардынъ этиннен эм зиналыктан сакланмага керексиз. Оьзинъизди бу затлардан тыйсанъыз тувра этерсиз. Сав-эсен калынъыз».
ACT.15.30	Соьйтип, йиберилгенлер Антиохияга келдилер. Ямагатты бир ерге йыйып, хатты оларга бердилер. 
ACT.15.31	Иманлылар, коьнъиллендируьвши соьзлери болган хатты окып, суьйиндилер. 
ACT.15.32	Оьзлери де пайхамбарлар болган Юда ман Силас коьп соьйлесип (иман) кардашларын коьнъиллендирип, беркиттилер. 
ACT.15.33	Бир кесек заман сол ерде калганнан сонъ, оьзлерин йибергенлердинъ янына кайтпага деп, кардашлары ман аманласып, йолга шыктылар.
ACT.15.33	[ 
ACT.15.34	Ама Силас онда калмага токтасты, Юда Ерусалимге кайтты.] 
ACT.15.35	Паул ман Барнаба десенъ коьплер мен бирге Раббий соьзин уьйретип, Ийги Хабарды яйып, Антиохияда яшап турдылар.
ACT.15.36	Бир неше куьннен сонъ Паул Барнабага: «Биз Раббийдинъ соьзин яйган аьр бир шахарга кайтып, (иман) кардашларымызга барып, олар кайтип яшайтаганларын коьреек», – деди. 
ACT.15.37	Барнаба Марк деп аталган Яхъяды да бирге алып бармага тиледи. 
ACT.15.38	Ама Паул Памфилияда олардан айырылып калган эм ортак иске бирге бармаган кисиди алып кетпеге яратпады. 
ACT.15.39	Сол ерде олардынъ арасында ашы келиспевлик тувды. Олар бир бириннен айырылдылар, Барнаба Маркты алып, Кипрга елкен ашып кетти. 
ACT.15.40	Паул болса оьзине Силасты сайлап, (иман) кардашлары Раббийдинъ шапагатына тапшырылган сонъ, йолга шыкты. 
ACT.15.41	Иман ямагатларынынъ коьнъиллерин коьтерип Сирия ман Киликияда кыдырды.
ACT.16.1	Паул Дербе мен Листрага келди. Листра шахарда анасы иманлы ювыт, атасы десенъ грек болган Тимотей атлы сокта яшаган. 
ACT.16.2	Листрадагы эм Икониядагы иман кардашлары онынъ акында уьйкен сый берип айттылар. 
ACT.16.3	Тимотейди оьзи мен бирге алмага суьйген Паул, сол ерлерде яшаган ювытларды ойлап, оны суьннетледи. Неге десе Тимотейдинъ атасы грек болганын баьриси де билетаган эди. 
ACT.16.4	Шахар шахардан оьте барып Ерусалимдеги элшилер мен тамадалардынъ карары ман алынган токтасларды иманлыларга насихат этип айттылар. 
ACT.16.5	Ямагатлардынъ иманы куьшейип, иманлылардынъ санлары куьннен куьнге артты.
ACT.16.6	Кие Рухтынъ тыювы ман Алла соьзин Асия элинде яймай, Паул ман йолдаслары Фрикия эм Галатия эллериннен оьтип кеттилер. 
ACT.16.7	Мисиядинъ шетлерине еткенде, Битиния элине бараяк болдылар. Тек Исадынъ Рухы оларга ызын бермеди. 
ACT.16.8	Олар, Мисияды оьтип, Троада шахарына кеттилер. 
ACT.16.9	Сол кеше Паулга бир коьринис энди. Алдында бир македонияшы киси туры эм ялбарып тилейди: «Македонияга оьтип бизге ярдам эт!» 
ACT.16.10	Паул сол коьринисти анълаткан сонъ, биз сол саьатлей Македонияга кетпеге токтастык. Неге десе Раббий бизди Ийги Хабарды сол ердегилерге билдирмеге шакырады деген ниетке келдик.
ACT.16.11	Соьйтип, биз Троададан кетип, туп-тувра Самотракия аралына, эртеси куьн Неапол шахарына келдик. 
ACT.16.12	Сонъ Пилип шахарына бардык: бу – Македониядынъ сол яктагы боьлигининъ бас шахары. Шахарды урымшылар курган эди. Бир неше куьн биз сонда калдык.
ACT.16.13	Шабат куьн шахардан шыгып йылга ягасына келдик. Сонда дува этилетаган ер бар деп билетаган эдик. Олтырдык, онда йыйылган хатынлар ман соьйлеп басладык. 
ACT.16.14	Бизди тынълаганлардынъ арасында Тиатира шахарыннан Лидия атлы бир хатын бар эди. Баалы карагошкыл-кызыл кумашлар саткан Лидия Аллага табынганлардынъ бири эди. Паулдынъ соьйлегенлерин эслетер уьшин, Раббий онынъ юрегин ашты. 
ACT.16.15	Лидия эм онынъ уьйиндегилер сувда шомылдырылып тазаланганнан сонъ, ол бизди уьйине шакырды. «Мени Раббийге сыйынганлардынъ бири этип кабыл этсенъиз, келинъиз, меним уьйимде калынъыз!» – деди эм бизди разы этти.
ACT.16.16	Бир куьн биз дува этилетаган ерге бараятырганымызда, бизге бал ашувшы йини болган эм балавлары ман оьзининъ иелерине коьп хайыр туьсиретаган таьвке кыз расты. 
ACT.16.17	Паул ман бизге иерип: «Бу аьдемлер – Аллаху-Тааладынъ куллары, бизге куткарылув йолын анълатадылар», – деп кышкырып айтып барды. 
ACT.16.18	Соьйтип ол бир неше куьн юрди. Паулдынъ ога ашувы келип, даяналмай йинге: «Иса Масихтинъ аты ман онынъ ишиннен шыкпага буйыраман!» – деди. Сол саьатлей йин кыздынъ ишиннен шыкты.
ACT.16.19	Кыздынъ иелери, хайыр табатаган уьмитлери йок болганын анълап, Паул ман Силасты ыслап, оьзлерининъ басшыларына, базар майданына, аькеттилер. 
ACT.16.20	Оларды аькимлердинъ алдына аькелип: «Бу ювыт кисилер шахарымызда тынышсызлык шыгармага себеп бередилер. 
