1CO.15.40	Ама коькте де эм ерде де туьрли кевделер бар. Коьктеги кевделердинъ оьз ярасыклыгы бар, ердеги кевделердинъ да оьз ярасыклыгы бар.
1CO.15.41	Куьннинъ ярасыклыгы бир баска. Ай ман юлдызлардынъ да ярасыклыклары бир баска. Юлдызлар да оьз араларында ярасыклыклары ман баскаланадылар.
1CO.15.42	Оьлилердинъ тирилуьви де солай болаяк: ерге салынган – ширеек зат, тирилеек – оьмири ширимеек зат;
1CO.15.43	ерге салынган – сыйсыз зат, тирилеек – мактавлы зат; ерге салынган – карувсыз зат, тирилеек – куватлы зат;
1CO.15.44	коьмилген – ян яшататаган кевде, тирилеек – Рух яшататаган кевде. Ян яшататаган кевде калай болса, солай Рух яшататаган кевде да бар.
1CO.15.45	Кие Язувда айтылгандай: «Биринши инсан Адам тири ян болды». Сонъгы Адам (Иса Масих) яшав беруьвши рух болды.
1CO.15.46	Бас деп Рух яшататаган кевде тувыл, а ян яшататаган келди, Рух яшататаган оннан сонъ келди.
1CO.15.47	Биринши инсан топырактан яратылды, ол – ерден. Экинши инсан (Масих) – коьктен.
1CO.15.48	Топырактан яратылган аьдем кайдай болса, топырактан болган аьдемлер де солай. Коьктен келген аьдем (Масих) кайдай болса, коьктегилер де сондай.
1CO.15.49	Биз топырактан яратылган инсаннынъ келбетин калай юргисткен болсак, коьктен келгеннинъ келбетин де солай юргистеекпиз.
1CO.15.50	Кардашлар, сизге айтканым бу: эт пен каннан яратылган шаркымыз Алла Патшалыгыннан уьлисли болалмас. Ширер зат та ширимеектен уьлисли болалмас.
1CO.15.51	Мен сизге бир сыр айтайым: баьримиз де оьлмеекпиз, тек баьримиз де туьрленеекпиз.
1CO.15.52	Бу бир такыйкадынъ ишинде, карап караганша, сонъгы карнай
1CO.15.53	Сосы ширийтаган зат – ширимеекке, сосы оьлимли зат – оьлмеекке оралмага керек.
1CO.15.54	Ширийтаган ширимеекке, оьлимли оьлмеекке оралса, сол заманда Кие Язувда айтылган соьз толаяк:
1CO.15.54	«Оьлим курытылды! Буьтинлей енъилди!
1CO.15.55	Оьлим, кайда ды енъуьвинъ?
1CO.15.55	Оьлим, кайда ды огынъ?»
1CO.15.56	Оьлимнинъ огы – куьна, а куьнадынъ куьш алган булагы – Таурат.
1CO.15.57	Аллага шуькир! Ол бизге Раббийимиз Иса Масих аркалы енъуьв береди.
1CO.15.58	Сога коьре, суьйикли кардашларым, берк турынъыз, шайкалмастай болынъыз. Аьр заманда да Раббий кызметине берилип исленъиз. Билесинъиз де: Раббийге багыслаган исинъиз босына кетпеек.
1CO.16.1	Энди имандасларынъызга йыйылатаган акша акында. Мен Галатиядагы ямагатларга не буйырган болсам, соны сиз де этинъиз.
1CO.16.2	Мен келген заманда акша йыюв ман каьр шекпес уьшин, аьр киминъиз юмадынъ биринши куьнинде
1CO.16.3	Келгенимде, аранъыздан оьзинъиз айырганларды ярдам акшанъызды аькетер уьшин хатлар ман Ерусалимге йиберермен.
1CO.16.4	Эгер меним де барганым келиссе, олар мени мен бирге барарлар.
1CO.16.5	Македониядан оьткеннен сонъ, сизге келермен. Соьле мен Македониядан оьтип турыман.
1CO.16.6	Сизде мен билким бир кесек заман каларман, эш те кысларман. Кетемен десем, сиз мени йолга аьзирлерсиз.
1CO.16.7	Неге десе мен сизге йол уьстиннен кирип кетеекпен деп ойламайман: Раббий буйырса, сиз бен узак турмага уьмит этемен.
1CO.16.8	Эфесте Эллинши куьн байрамына кадер каларман,
1CO.16.9	неге десе онда мага етимисли ислер уьшин эсиклер кенъ ашылганлар, ама карсылык этуьвшилер де коьп.
1CO.16.10	Тимотей келгенде, аранъыызда ол корккандай зат болмасын, сак болынъыз. Ол да, мендей, Раббийдинъ исин этеди.
1CO.16.11	Бирев де ога йогарыдан карамасын! Оны баьринъиз де йолга аьзирлеп, тынышлык пан озгарарсыз, ол мага кайтып келсин. Мен оны (иман) кардашларымыз бан бирге саклап тураман.
1CO.16.12	Аполлос кардаш акында. Мен ога коьп ялбарып тиледим, баска (иман) кардашларымыз бан бирге сизге барганын суьйген эдим, ама онынъ соьледен соьле сизге бармага коьнъили йок. Бир онъайлы вакыт тапканлай, ол келер.
1CO.16.13	Уяв турынъыз, иманынъызга берк болынъыз, йигит эм карувлы болынъыз!
1CO.16.14	Эткен баьри затынъыз суьюв мен этилсин!
1CO.16.15	Сизге бир тилегим бар, кардашлар: Степанастынъ уьйдегилерин билесинъиз. Олар Ахаяда биринши болып Масихке ынандылар эм оьзлерин имандасларына кызмет кылмага савлай бердилер.
1CO.16.16	Сондай аьдемлерге эм бизи мен бирге ислеп кызмет кылганлардынъ баьрисине де бойсынганынъызды суьемен.
1CO.16.17	Степанастынъ, Фортунаттынъ эм Ахайиктинъ мунда келгенлерине бек суьйинемен. Олар янымда болып, йоклыгынъызды муттырдылар.
1CO.16.18	Коьнъилинъизди коьтергендей, олар меним де коьнъилимди коьтередилер. Сондай аьдемлерди баалап билинъиз!
1CO.16.19	Асия элиндеги иман ямагатлары сизге салам йибередилер. Аквила ман (пишеси) Приска эм олардынъ уьйинде йыйылатаган ямагат та, Раббийге байыр болып, сизди исси саламлайдылар.
1CO.16.20	Мундагы баьри (иман) кардашларынъыз сизди саламлайдылар. Бир биринъизди, Аллага багысланганларга тийислише оьбип, саламланъыз.
1CO.16.21	Энди оьзимнинъ колым ман язаман: Паулдан салам!
1CO.16.22	Раббийди суьймегенлер язаларын алсынлар! Марана та (Раббийимиз, кел)!
1CO.16.23	Раббий Исадынъ шапагаты сиз бен болсын!
1CO.16.24	Масих Исага байыр болып, баьринъизге суьйимимди билдиремен!
2CO.1.1	Алладынъ буйырыгы ман Иса Масихтинъ элшиси болган Паулдан эм кардашымыз Тимотейден Алладынъ Коринттеги ямагатына эм Ахаядынъ аьр еринде Аллага багысланганлардынъ баьрисине де салам!
2CO.1.2	Сизге Атамыз Алладан эм Раббий Иса Масихтен шапагат эм тынышлык болсын.
2CO.1.3	Раббийимиз Иса Масихтинъ Атасы Аллага шуькир болсын! Ол рагимли Ата болып бизди аьр заманда да юбантады.
2CO.1.4	Алла бизди юбанткандай, биз де соьйтип кыйынлыкка туьскенлерди юбантармыз деп, Ол бизим оьзимизди туьрли азаплардан шыгарып коьнъиллендиреди.
2CO.1.5	Неге десе яшавымызда Масихтинъ азапларын калай коьп шегетаган болсак, Масих аркалы солай да юбанув табамыз.
2CO.1.6	Биз кыйынлык шексек, оны сиз юбанар эм куткарылар уьшин шегемиз. Юбанув тапсак, сиз де юбанув табар уьшин болады, неге десе биз шегетаган сол азапларга сиз де тоьзимлигинъизди коьрсетесиз.
2CO.1.7	Сизге сенуьвимиз берк, неге десе азапларымызга калай косылсанъыз, солай биз тапкан юбанувымызга да косылатаганынъызды билемиз.
2CO.1.8	Кардашларымыз, биз сизге Асия элинде шеккен кыйынлыкларымызды билдирмеге суьемиз. Олар сондай бир оьлшемсиз авыр эм тоьзип болмастай азапланув эдилер: биз сав калувдан да уьмит уьзген эдик.
2CO.1.9	Бизге оьлим оькимининъ шыгарылганын сезген эдик. Сол зат бизге оьзимизге сенмей, тек оьлилерден тирилтуьвши Аллага сенмеге кереги уьшин болган эди.
2CO.1.10	Алла бизди сондай бир ювык оьлим кавыфыннан куткарган эм куткараяк.
2CO.1.11	Сиз де дуваларынъыз бан бизге ярдам этсенъиз, бизди тагы да куткараяк деп, Аллага сенемиз. Соьйтип, Ол коьп аьдемлердинъ дувалары себепли бизге багыслаган савгаларына коьплер биз уьшин шуькир этееклер.
2CO.1.12	Мактанганымыз да бу: дуныяда, боьтен де сизде, инсан акыллылыгы ман болмай, Алладынъ шапагаты ман, Оннан келген дурыслык эм таза юрек пен яшаганмыз деп намысымыз бан шаатламага боламыз.
2CO.1.13	Сизге язганларымыздынъ баьрисинде сиз окып анълаган затлар болмаса, баска эш бир зат та йок. Сиз бизди бираз анълагандай, энди толысынша да анъларсыз деп уьмит этемен.
2CO.1.14	Раббийимиз Исадынъ кайтаяк куьнинде, биз сиз бен мактанаяктай, сиз де биз бен мактанмага боларсыз.
2CO.1.15	Мен ога бек сенемен, сол себепли бас деп сизге келмеге эм разылыгымды кайтарып билдирмеге токтастым.
2CO.1.16	Мен сизди Македонияга бараятырганда эм оннан кайтаятырганда йокларман, а оннан сонъ сиз мени ярастырып Юдеяга озгарарсыз деп ойлаган эдим.
2CO.1.17+2CO.1.18	Билким, бу сизге ойланмай алынган ниеттей коьриндиме экен? Яде болса да мен ниет этсем де, бирер аьдемлердей, бир ок заманда «аьше», яде «йок» деп айтаманма экен? Алла сенимли болгандай, биз де сизге алдын «аьше», сонъ «йок» демегенмиз деп айтсак, сенимли болармыз.
2CO.1.19	Силван эм Тимотей мен бирге биз сизге билдирген Алладынъ Улы Иса Масихте бирде «аьше», бирде «йок» болмаган, ама Онда тек «аьше» бар.
2CO.1.20	Неге десе Алладынъ ваьделерининъ баьриси Иса Масихте толтырыладылар. Сол себепли биз де, Аллады мактар уьшин Масих аркалы Аллага «амин» деп айтамыз.
2CO.1.21	Масих аркалы бизди де, сизди де беркиткен эм бизди куллыкка салган бир Алла.
2CO.1.22	Алла бизге (Иемиз болганын коьрсетер уьшин) мухырын баскан, савгалаяк яхшылыкларынынъ сенимлиги этип, юреклеримизге Рухын орынластырган.
2CO.1.23	Алла мага – шаат: мен сизди аяп соьлеге дейим Коринтке кайтпай турдым.
2CO.1.24	Биз сизге неге ынанмага керегинъиз уьшин буйырык беруьвши болмага суьймеймиз. Биз сизинъ иманда берк туратаганынъызды билемиз, тек сизди кувандырар уьшин сизи мен бирге шалысамыз.
2CO.2.1	Мен сизге тагы да кайтып келсем, янынъызды кыйнамаска токтасканман.
2CO.2.2	Эгер мен янынъызды кыйнасам, сизден баска мени кувандыраяк ким бар?
2CO.2.3	Сол хатты да, келгенимде сизден, мени кувандыраяк аьдемлерден, яным кыйналып олтырмасын деп, язган эдим. Куванышым баьринъизге де куваныш болаягына ынанып, сизинъ баьринъизге сенемен.
2CO.2.4	Мен коьп азапланып, юрегимди авыртып, коьзясымды тоьгип яздым. Оны сизди кыйнар уьшин айтпайман. Йок, оны сизди калай коьп суьйгенимди билинъиз деп айтаман.
2CO.2.5	Эгер биринъиз баска биревди кайгырткан болса, ол тек мени тувыл, коьп кайтарып айтпас уьшин, аз-маз баьринъизди кайгыртты.
2CO.2.6	Сондай аьдемге коьплеринъиздинъ берген язасы тамам болады.
2CO.2.7	А энди оны, кайгыга коьмилип юрместей этип, кеширинъиз эм юбантынъыз.
2CO.2.8	Сизден, ога оьзинъиздинъ суьйиминъизди коьрсетинъиз деп, тилеймен.
2CO.2.9	Неге десе меним сизге язганым сизинъ баьри яктан тынълавлы болганынъызды тергев уьшин болды.
2CO.2.10	А энди сиз кимди кешире болсанъыз, мен де соны кеширермен, неге десе мен неди кеширмеге керек болсам, соны Масихтинъ алдында сизинъ уьшин кеширгенмен.
2CO.2.11	Шайтан бизим басымызга иелик этпес уьшин солай эттим, а шайтаннынъ мырады бизге аьруьв белгили.
2CO.2.12	Мен, Масих акындагы Ийги Хабарды билдирермен деп, Троада шахарга келгенде, Раббийдинъ иси уьшин мага мырсат табылганын коьрдим.
2CO.2.13	Ама онда (иман) кардашым Титты табалмаганымда коьнъилим тынышлык таппады. Солай болганда, ондагылар ман аманласып, Македонияга кеттим.
2CO.2.14	Аллага шуькир болсын! Ол Масих аркалы баьрисин енъип, бизди, есирлердей, алдыга аькетеди эм биз аркалы, аьр ерге аьруьв ийис яйгандай, Масих акында билимди яяды.
2CO.2.15	Неге десе биз куткарылатаганларда да, йойылатаганларда да Аллага Масихтинъ ийги ийиси боламыз.
2CO.2.16	Биз йойылатаганларга оьлим аькелуьвши оьлимнинъ ийисимиз, а куткарылатаганларга яшав аькелуьвши яшавдынъ ийисимиз. Сондай иске ким етиспеге болады?
2CO.2.17	Биз, коьплердей, Алладынъ соьзин оьзимизге пайда болар деп юргистпеймиз, ама биз, Масихке байыр болып, Алла йиберген аьдемлердей, Онынъ алдында ак юректен айтамыз.
2CO.3.1	Биз оьзимизди янъыдан мактап баслагандай боламыз ба экен? Билким биз, бир кавымлардай, сизге оьзимизди мактавшы хат йибермеге яде сизден сондай хат алмага керекпиз бе экен?
2CO.3.2	Сиз оьзинъиз бизим хатымызсыз: бизим юрегимизде язылган, баьрисине белгили эм окылатаган.
2CO.3.3	Масихтинъ хаты болганынъыз ашык. Сол хат бизим куллыгымыз аркалы, сыя ман язылмай, дайым болып турувшы Алладынъ Рухы ман язылган, таска
2CO.3.4	Аллага Масих аркалы сондай бир берк сенуьвимиз бар.
2CO.3.5	Эш бир затты да оьз етимисимиз бен этемиз деп санамага акымыз йок; кайдай етимисимиз бар болса да тек Алладан.
2CO.3.6	Ол бизди янъы антласувдынъ куллыкшылары болмага тийисли этти. Сол антласув да язувларга тувыл, а Алла Рухына таянады. Неге десе язув оьлтиреди, ама Рух яшатады.
2CO.3.7	Алла, данъкы ман коьринип, Таураттынъ соьзлерин тасларга унъип язган. Мусадынъ юзи Таураттынъ данъкы ман яркыраган. Сол яркырав куьшин йойып бараятырган болса да, исраилшилер Мусадынъ юзине караялмай эдилер. Онынъ куллыгы ман берилген, оьлим аькелуьвши Таурат сондай данъклы болган болса,
2CO.3.8	Алладынъ Рухына коьре куллык этуьвимиз оннан да бек данъклы болмаспа?
2CO.3.9	Эгер аьдемге оьким шыгарган куллык данъклы болса, Алладынъ аьдемди аклавына амал болган куллык оннан да данъклы!
2CO.3.10	Уьшини мен, алдын данъклы болган Таурат, оннан сонъ келген янъы антласувдынъ артык данъкы ман тенълестирилсе, энди данъксыз коьринеди.
2CO.3.11	Куьшин йойып бараятырган Таурат данък пан келген болса, дайым турган янъы антласув оннан да данъклы!
2CO.3.12	Сондай уьмитимиз болганы уьшин уллы йигерлик пен айтамыз.
2CO.3.13	Биз Мусадай тувылмыз. Исраилшилер куьшин йойып бараятырган данъкка карамас уьшин Муса юзин буьркеншик пен яба эди.
2CO.3.14	Исраилшилердинъ акылы сезимсиз болган эди. Буьгуьн де эски антласувды окыганда олардынъ акылы сол буьркеншик пен ябылгандай болып турады. Неге десе сол буьркеншик тек Масих аркалы ашылар.
2CO.3.15	Буьгуьнге дейим Мусадынъ китабын окыганда олардынъ юреги буьркеншик пен ябылгандай.
2CO.3.16	Ама (Муса акында язылгандай) бирев Раббийге кайтса, сол буьркеншик коьтериледи.
2CO.3.17	Мунда Раббий деп айтылган – Рух болады, а Раббийдинъ Рухы кайда болса, сонда эркинлик бар.
2CO.3.18	Бизден буьркеншик алынып тасланганга коьре баьримиз Раббийдинъ данъкын бияладай коьрсетемиз. Биз барган сайын оьсетаган данък пан туьрленемиз, Раббийге коьптен коьбирек усаймыз. Бу зат Раббийдинъ Рухы аркалы болады.
2CO.4.1	Бу куллык Раббийдинъ рагимлиги мен бизге тапшырылганына коьре уьмитимизди уьзбеймиз.
2CO.4.2	Биз баьри ясыртын эм айыплы ислерден таямыз, аьйлелик пен аьрекет этпеймиз эм Алладынъ соьзин терисиннен анълатпаймыз. Биз акыйкатты ашык уьйретип, Алладынъ алдында кайдай аьдем болганымызды аьр аьдемнинъ намыс оькимине йигерлик коьрсетемиз.
2CO.4.3	Биз билдиретаган Ийги Хабардынъ маьнеси ябык болса, ол тек йойылатаган имансыз аьдемлерге ябык.
2CO.4.4	Бу оьмирдинъ иеси (шайтан) олардынъ акылын сокыр эткен. Соьйтип, олар коьринмеген Алладынъ келбети болган Масихтинъ данъкы акындагы Ийги Хабардынъ ярыгын коьрип болалмайдылар.
2CO.4.5	Биз оьзимизди тувыл, а Иса Масихтинъ Раббий болганын эм де сизге Иса йолында куллык этетаганымызды билдиремиз.
2CO.4.6	«Ярык каранъалыктан яркырасын», – деген Алла, Иса Масихтинъ юзиннен Оьзининъ данъкын билуьвимиз бен бизди нурландыраяк болып, юреклеримизде яркырайды.
2CO.4.7	Ама биз, бу карызнады алганлар, балшык савытларга усаймыз. Солай болганымыз баьриннен де уллы куьштинъ бизден тувыл, а Алладан келгенин коьрсетеди.
2CO.4.8	Бизди аьр яктан кыйынлыклар сынайдылар, ама биз енъилмеймиз, шыдаймыз, туьнъилеектей коьринсек те туьнъилмеймиз.
2CO.4.9	Бизди кувадылар, ама Алла бизди тасламайды. Ерге йыгылсак та йойылмаймыз.
2CO.4.10	Исадынъ яшавы шаркымызда ашык коьринер уьшин Онынъ калай оьлгенин аьр заманда оьзимизде юргистемиз.
2CO.4.11	Неге десе биз, яшайтаганлар, Иса уьшин аьр заманда оьлимге берилемиз. Соны ман, Исадынъ яшавы да оьлеек кевдемизде ашык коьринеди.
2CO.4.12	Соьйтип, бизде – оьлим, а сизде яшав куьшин коьрсетеди.
2CO.4.13	(Кие Китапта): «Иман эткеним уьшин айтаман», – деп язылгандай, бизде де сол иман рухы болганы уьшин, иман этип, айтамыз.
