LUK.8.37	Сонда Герасадынъ тоьгерегинде яшаган буьтин халк Исадан олардынъ ериннен кетпеге тиледилер, неге десе оларды уьйкен коркув бийлеген эди. Ол артына кайтпага кайыкка олтырды.
LUK.8.38	Йинлериннен айырылган аьдем: «Оьзинъ мен бирге мени де алып бар», – деп тилегенде, Иса оны: 
LUK.8.39	«Бар, уьйинъе кайт эм Алла сага не эткенин айт», – деп йиберди. Ол кетип, буьтин шахарда Иса ога не эткенин айтып айланды.
LUK.8.40	Иса артына кайтканда, Оны халк хош коьрип йолыкты, неге десе Оны баьриси де саклай эди. 
LUK.8.41	Сонда синагогтынъ басшысы Яир деген аьдем келди эм Исадынъ аягына йыгылып, Оннан уьйине келмеге тиледи. 
LUK.8.42	Неге десе он эки ясларындагы ялгыз кызы оьлим аьлде эди.
LUK.8.42	Иса онынъ уьйине бараятырганда, халк тоьгерегинде уьймелестилер. 
LUK.8.43+LUK.8.44	Он эки йылдан бери кан тасувдан кыйналган, буьтин байлыгын эмлевшилерге зыраф этип берген, ама сав болалмаган бир кыскаяклы да Исадынъ артыннан барып, Онынъ абасынынъ этегине колын тийгистти. Сол саьатлей онынъ кан тасувы токталды.
LUK.8.45	«Ким Мага тийип кетти?» – деп сорады Иса.
LUK.8.45	Баьриси де: «Тиймедик!» – дегенде, Петер эм оны ман бирге болганлар: «Насихатшы! Тоьгерегинънен халк уьймелеседи эм кыстырады, а Сен: „Мага ким тийди?“ – деп, айтасынъ!» – дедилер.
LUK.8.46	Ама Иса: «Ким ди бирев мага тийгенде, Мен Оьзимнен шыккан куьшти сездим», – деди.
LUK.8.47	Сонда хатын, энди билинмей калмаягын коьрип, касына ювыклады да, калтырап, Онынъ аягына йыгылды эм буьтин халк алдында не себептен Ога колын тийгисткенин эм сол саьатлей сав болганын ашык айтты. 
LUK.8.48	Сонда ога Иса: «Кызым
LUK.8.49	Иса соьйтип соьйлей турганнынъ арасында, синагог басшысынынъ уьйиннен бирев келип, басшыга: «Кызынъ оьлди, энди Устазды кыйнама», – деди.
LUK.8.50	Ама Иса, муны эситип, Яирге: «Коркпа, тек ынан, куткарылаяк», – деди.
LUK.8.51	Уьйге келгенде, Иса Оьзи мен тек Петерден, Яхъядан, Якуптан эм кыздынъ атасы ман анасыннан баска биревди де киргистпеге унамады. 
LUK.8.52	Баьриси де кыз уьшин йылап, сыйыт этетаган эдилер. Ама Иса: «Йыламанъыз, ол оьлмеген, тек уйклайды», – дегенде, 
LUK.8.53	аьдемлер, кыздынъ оьлгенин билген себепли, Ога куьлип койдылар. 
LUK.8.54	Ол, кыздынъ
LUK.8.55	Кыздынъ яны келди, ол сол саьатлей турды. Иса ога ашамага бир зат бермеге буйырды. 
LUK.8.56	Кыздынъ ата-анасы сейирсиндилер. Иса оларга, болган затты биревге де айтпанъыз деп, буйырды.
LUK.9.1	Иса он эки соктасын шакырып, оларга буьтин йинлерди енъмеге, авырувларды савартпага куьш эм куват берди. 
LUK.9.2	Сонъ оларды Алла Патшалыгын халкка билдирмеге эм маразлыларды сав этпеге йиберди. 
LUK.9.3	Оларга: «Йолга бир зат та алманъыз: не таяк, не артпак, не оьтпек, не акша. Коьйлегинъиз де эки кат болмасын. 
LUK.9.4	Кайдай уьйге кирсенъиз де, сонда калынъыз эм оннан йолга шыгынъыз. 
LUK.9.5	А эгер сизди кабыл этпеселер, сол шахардан кетинъиз, оларга карсы болганынъызды шаатлап, аякларынъыздынъ табаныннан шанъды да кагып калдырынъыз», – деп насихатлады. 
LUK.9.6	Сокталар элден элге юрип, аьр ерде де Ийги Хабарды билдирдилер эм авырганларды саварттылар.
LUK.9.7	Болганлардынъ хабары тетрарх Иродка да етти. Эм ол адасты-састы, неге десе кайбиревлер: «Бу Аьдем – оьлилерден тирилген Яхъя», – дедилер. 
LUK.9.8	Баска биревлери: «Ильяс келген», оьзгелери болса: «Бурынгы пайхамбарлардынъ биреви тирилген», – деп соьйлейтаган эдилер. 
LUK.9.9	Ирод: «Яхъядынъ басын кескен эдим. Бу ким экен? Эситетаган хабарларым не?» – деп, Исады коьрмеге амал излестирди.
LUK.9.10	Элшилери кайттылар, Исага оьзлерининъ не эткенлерин хабарладылар. Иса оларды Оьзи мен айырым бир авлак ерге, Бетсайда деген шахардынъ шетине, далага аькетти. 
LUK.9.11	Ама халк муны анълаганда Онынъ артыннан иерди. Иса олар ман Алла Патшалыгы акында соьйледи, маразларыннан эмленмеге кереги болганларды сав этти.
LUK.9.12	Куьн оьтип, кас караланып баслаганда, он эки соктасы Онынъ касына келди эм Ога: «Халкты йибер, тоьгеректеги эллерге барып, оьзлерине азык эм конакбай тапсынлар; неге десе биз мунда бос ердемиз», – деп айттылар.
LUK.9.13	Ама Иса: «Оларды сиз ашатынъыз», – деди.
LUK.9.13	Сокталары: «Бизим тек бес оьтпек пен эки балыктан баска эш бир затымыз да йок, яде биз, оьзимиз барып, сосы аьдемлердинъ баьриси уьшин ырызкы сатып алаякпа?» – дедилер. 
LUK.9.14	Онда бир бес мынъга ювык аьдем бар эди.
LUK.9.14	Иса Оьзининъ сокталарына: «Оларды ерге эллисерден олтыртынъыз», – деди. 
LUK.9.15	Сокталары солай эттилер де баьрисин олтырттылар. 
LUK.9.16	Иса болса бес оьтпек пен эки балыкты алып, коькке коьзлерин коьтерип, Аллага шуькир айтты да оларды сындырып халкка уьлестирер уьшин сокталарына берди. 
LUK.9.17	Баьриси де тойганынша ашады, олардан арткан увакларды он эки шетенге йыйдылар.
LUK.9.18	Бир вакыт Иса авлак ерде дува этип турганда, Оны ман сокталары да бар эдилер. Ол: «Халк Мени ким деп санайды?» – деп олардан сорады.
LUK.9.19	Олар Ога: «Шомылдырувшы Яхъя; оьзгелери болса Ильяс деп; а баскалары бурынгы пайхамбарлардынъ бири тирилген дейдилер», – дегенди айттылар.
LUK.9.20	Иса олардан: «А сиз Мени ким деп санайсыз?» – деди.
LUK.9.20	Петер Ога: «Алладынъ Масихи», – деп яваплады.
LUK.9.21	Ама Иса сокталарына, каты этип, муны эш биревге де билдирмеске буйырды.
LUK.9.22	Иса: «Аьдем Улы коьп азап шекпеге, аксакаллар, бас дин куллыкшылары эм дин аьлимлери мен шет кагылмага, оьлтирилмеге эм уьшинши куьн тирилмеге керек», – деди. 
LUK.9.23	Сонъ баьрине де карап: «Ким Меним артымнан келмеге суьйсе, сол оьзи оьзиннен кайталасын, онда оьлеек кашын аьр куьн коьтерип, Мага иерсин. 
LUK.9.24	Неге десе ким оьз яшавын сакламага суьйсе, сол оны йойтар; а ким яшавын Меним уьшин йойтса, сол оны саклар. 
LUK.9.25	Аьдем, буьтин дуныяды бийлеп, оьзи оьзин йойтса, не де оьзин зыян этсе, муннан ога не пайда? 
LUK.9.26	Ким Меннен эм Меним соьзимнен уялса, соннан Аьдем Улы да Оьзининъ, Атасынынъ эм де Ога багысланган маьлеклердинъ данъкы ман келгенде уялаяк. 
LUK.9.27	Сизге дурысын айтаман, булайда туратаганлардынъ кайбиревлери, Алла Патшалыгын коьрмей, оьлмееклер», – деди.
LUK.9.28	Сосы соьзлерден сонъ сегиз куьн кадер оьткенде, Иса Петерди, Яхъяды эм Якупты алып, тилек этпеге тавга коьтерилди. 
LUK.9.29	Онда дува этип турган вакытта, Онынъ шырайы туьрленди, кийими агарды, йылтырады. 
LUK.9.30	Эм мине сонда эки эр коьринди, Оны ман соьйлести. Олар Муса ман Ильяс эдилер. 
LUK.9.31	Олар саьвле мен ярыкландырылган эдилер, Исадынъ Ерусалимде оьлип бу дуныядан кешееги акында айттылар.
LUK.9.32	Петерди эм оны ман бирге болганлардынъ баьрисин уйкы басты, ама уянганларында, олар Исадынъ ярыкланып туьрленгенин эм Онынъ янында турган эки кисиди коьрдилер. 
LUK.9.33	Кисилер касыннан кетеятырган вакытта, Петер, оьзи не айтканын да билмей: «Насихатшы! Биз мунда турсак, калай аьруьв эди! Уьш кос салайык: бири Сага, бири Мусага эм бири Ильяска болар», – деди.
LUK.9.34	Петер соьзин кутармай, булыт коьринди де оларды каплап алды. Олар булыт ишине киргенде корктылар. 
LUK.9.35	Оларга булыт ишиннен: «Бу Меним сайлаган Улым; Онынъ соьзин тынъланъыз!» – деген давыс келди. 
LUK.9.36	Сол давыс эситилип тынганда, Иса ялгыз эди. Сокталары уьндемедилер эм сол куьнлерде коьргенлерин эш биревге де айтпадылар.
LUK.9.37	Экинши куьнинде олар тавдан туьсеятырганда, Исады коьп халк, алдына шыгып, йолыкты. 
LUK.9.38	Бирден халк арасыннан бирев: «Устаз! Тилеймен Сага, меним улыма ярдам эттага. Ол меним сынъар биревим. 
LUK.9.39	Ога йин ябыса турады, ол бирден кышкырыклап баслайды. Йин оны калтыратады, онынъ авызын коьпиртеди эм оны эзиетлеп, кыйынлыкка калдырады. 
LUK.9.40	Мен сокталарынънан йинди кувып шыгарыныз деп тилеген эдим, ама олар оны эталмадылар», – деп кышкырды.
LUK.9.41	Иса ога явап берип айтты: «Эй имансыз, йолдан шыккан несил! Мага не шаклы заман сиз бен болып, сизди тоьзбеге керек? Аькел мунда улынъды», – деди.
LUK.9.42	Яс келеятырган заманында, оны кара йин ерге йыкты, калтыратты, ама Иса йинди тыйды. Ясты сав этти, оны атасына берди.
LUK.9.43	Буьтин халк Алладынъ уллы куьдиретине сейирсинетаган эди. 
LUK.9.44	Баьриси де Исадынъ эткен ислерине аьжейипленип турганда, Ол сокталарына: «Бу соьзлерге кулакларынъызды салынъыз: Аьдем Улы аьдемлер колына тутылып берилеек», – деди. 
LUK.9.45	Ама олар бу соьзге туьсинмедилер, маьнеси олардан ясырылганыннан оны сезбедилер эм бу соьз акында Исадан сорамага корктылар.
LUK.9.46	Сокталар арасында, уьйкенимиз ким болар экен деген, эрисуьв шыкты. 
LUK.9.47	Иса, олардынъ коьнъиллериндегин билип, кишкей балады алды да оны Оьзининъ алдына салды. 
LUK.9.48	Эм оларга: «Мунадай бир балады Меним атымнан ким кабыл этсе, сол Мени кабыл этеди, а ким Мени кабыл этсе, сол Мени Йибергенди кабыл этеди. Сол себепли сизинъ баьринъизден де кишкей ким болса, сол уьйкенинъиз болар», – деди.
LUK.9.49	Сонда Яхъя айтты: «Насихатшы! Биз Сенинъ атынъ ман йинлерди кувып шыгарувшыды коьрдик; тек ол бизи мен юрмегеннен себеп, оны тыйдык».
LUK.9.50	«Тыйманъыз, неге десе ким сизге карсы тувыл, сол – сизинъ ягынъыз», – деди Иса ога.
LUK.9.51	Исадынъ бу дуныядан коькке алынаяк куьнлери ювыклаганда, Ол Ерусалимге бараяк болып, таьвекелленип, йолга шыкты. 
LUK.9.52	Ол Оьзининъ алдында хабаршыларын йиберди. Олар да барып, Исадынъ келеегине баьрисин аьзирлер уьшин Самариядынъ эллерининъ бирине кирдилер. 
LUK.9.53	Ама самарияшылар Исады Ерусалимге баратаганы уьшин киргистпедилер.
LUK.9.54	Муны коьрип, Онынъ сокталары Якуп пан Яхъя: «Раббий, суьйсенъ, Ильяс эткендей, биз коьктен от туьсиреек, оларды аьлеклесин деп, айтаяк», – дедилер.
LUK.9.55	Ама Иса, бурылып, оларды тыйды [эм: «Сиз оьзинъизде кайдай рух бар экенин билмейсиз. 
LUK.9.56	Аьдем Улы аьдемлердинъ янларын аьлек этпеге тувыл, а куткармага келген», – деди]. Оннан сонъ олар баска элге кеттилер.
LUK.9.57	Олар йолда бараятырган вакытта Исага бирев: «Сен кайда барсанъ да мен Сенинъ артынънан иереекпен», – деди.
LUK.9.58	Иса ога: «Туьлкилер инли боладылар, коьктинъ куслары – уялы, а Аьдем Улынынъ бас сугар ери йок», – деди.
LUK.9.59	А баскасына: «Меним артымнан иер», – дегенде, ол: «Бийим! Мага басында барып атамды коьммеге ызын бертагы», – деп тиледи.
LUK.9.60	Иса ога: «Оьлгенлерди коьммеге оьлилердинъ оьзлерине калдыр; а сен барып, Алла Патшалыгын билдирип юр», – деди.
LUK.9.61	Тагы да баскасы: «Мен Сенинъ артынънан бараякпан, Раббий! Тек алды ман аьелим мен аманласпага ызын бер», – деп тиледи.
LUK.9.62	Ама Иса: «Колын сабанга салган эм артына карап баратаган, Алла Патшалыгында кылынмага сенимли тувыл», – деп билдирди.
LUK.10.1	Оннан сонъ Иса, Оьзининъ сокталарыннан тагы да баска етписин
LUK.10.2	Оларга булай деди: «Аслык онъыслы, а исшилер аз. Сога коьре аслык Иесиннен онъысына исшилер йибермеге тиленъиз. 
LUK.10.3	Барынъыз! Мен сизди боьрилер арасына, козылардай этип, йиберемен. 
LUK.10.4	Биргенъизге не бокша, не артпак, не машпак алманъыз эм йолда эш бирев мен де саламласпанъыз. 
LUK.10.5	Кайдай уьйге кирсенъиз де, алды ман: „Бу уьйге тынышлык!“– дегенди айтынъыз. 
LUK.10.6	Онда тынышлыкты суьювши яшай болса, сиз тилеген тынышлык онда калар; эгер болмаса, оьзинъизге кери кайтар. 
LUK.10.7	Сол уьйде калынъыз эм не зат пан зияпетлеселер, соны ашанъыз-ишинъиз, неге десе исши оьз иси уьшин баргыга тийисли. Уьй уьйден коьшип юрменъиз.
LUK.10.8	Эгер сиз шахарга кирсенъиз, сизди онда хош коьрип йолыксалар, не берселер де соны ашанъыз. 
LUK.10.9	Онда болган маразлыларды сав этинъиз, оларга: „Алла Патшалыгы сизге ювыклаган“, – деп билдиринъиз. 
LUK.10.10	Ама сиз кирген кайсы бир шахарда да сизди ювытпасалар, сонда орамларга шыгып айтынъыз: 
LUK.10.11	„Шахарынъыздынъ аягымызга ябыскан топырагын да сизге кагып калдырамыз. Тек билинъиз, сизге Алла Патшалыгы ювыклаган“. 
LUK.10.12	Сизге айтаман: Кыямет куьн сол шахардан эсе Содом шахарына енъил болаяк.
LUK.10.13	Кайгы сага, Коразин! Кайгы сага, Бетсайда! Неге десе сизде болып озган куьдиретли ислер Тир ман Сидонда озган болсалар, олар коьптен бери эрегожа кийип, куьлде олтырып, тевбеге туьскен болар эдилер. 
LUK.10.14	Ама кыямет куьн сизден эсе де Тир мен Сидонга енъил болаяк. 
LUK.10.15	Эм сен, Капарнаум, коькке дейим коьтерилеексинъме? Йок, ахыретке дери тоьмен туьсирилеексинъ! 
LUK.10.16	Сизди тынълайтаган, Мени тынълайды; сизди кери кагатаган, Мени де кери кагады. Мени кери кагатаган, Мени Йиберуьвшиди де кери кагады».
LUK.10.17	Етпис соктасы артына куванышлы кайтты: «Раббий, Сенинъ атынъ ман бизге йинлер де бойсынадылар!» – дедилер.
LUK.10.18	Иса оларга: «Мен коьктен, ясыноктай атылып, туьскен шайтанды коьрдим. 
LUK.10.19	Каранъыз, Мен йыланларды, каракуртларды эм душпаннынъ баьри куьшлерин таптамага сизге куват беремен; сизге бир зат та заран этпеек. 
LUK.10.20	Ама йинлердинъ сизге бойсынатаганларына куванганнан эсе де, сизинъ атынъыз коькте язылганы уьшин шатланынъыз», – деди.
LUK.10.21	Сол вакытта Исадынъ коьнъили Кие Рух пан куванышка толды эм: «Рахметлеймен Сени, Атам, коьк пен ердинъ Иеси! Сен бу затларды акыллылардан эм билимлилерден ясырып, кишкей саьбийлерге аштынъ. Аьше, Атам! Сен солай этуьвди ийги коьрдинъ.
LUK.10.22	Атам Мага аьр не затты та тапшырды. Улынынъ ким экенин Атамнан баска бирев де билмейди, Атамнынъ ким экенин Улыннан эм Улы билдирмеге суьйгенлериннен баска эш бирев де билмейди», – деди.
LUK.10.23	Сонъ сокталарына, тек олар эситкендей этип, айтты: «Сиз коьрип турганларды коьргенлердинъ коьзлери наьсипли! 
LUK.10.24	Неге десе сизге айтаман, коьп пайхамбарлар ман патшалар сиз коьргенлерди коьрмеге суьетаган эдилер, тек коьралмадылар. Сол сиз эситкенлерди эситеек болатаган эдилер, ама эситалмадылар».
LUK.10.25	Мине сонда, Таурат аьлими турды, Исады сынап, сорав берди: «Устаз! Оьмирлик яшавдан уьлисли болар уьшин мага не зат этпеге керекти?»
LUK.10.26	Иса ога: «Тауратта не зат язылганды? Оны кайтип окыйсынъ?» – деди.
LUK.10.27	Сол бирев явап берип айтты: «Раббий Алланъды буьтин юрегинъ, янынъ, куьшинъ, акылынъ ман суьй; ювыгынъды да, оьзинъди суьйгендей суьй».
LUK.10.28	«Сен дурыс явапладынъ, солай этсенъ, (оьмирлик) яшав табарсынъ», – деди Иса ога.
LUK.10.29	Ама Таурат аьлими, оьзин акламага шалысып, Исадан сорады: «А меним ювыгым ким ди?»
LUK.10.30	Иса, ога яваплай, айтты: «Бир аьдем Ерусалимнен Ерихога бараятырганда, йолда ога йолбасарлар ябысадылар. Олар онынъ кийимлерин шештирип аладылар, оьлим аьлге еткерип тоьбелейдилер де кетедилер. 
LUK.10.31	Бираздан сол ок йол ман бир дин куллыкшысы оьтеятырган болган, оны коьреди, ама йолдынъ аргы яныннан озып кетеди. 
LUK.10.32	Солай ок сол ерден оьтеятырган бир левит
LUK.10.33	Самариядынъ бир яшавшысы сол йолдан озаятырганда, уьстине барып калады, оны коьргенде, языксынады. 
LUK.10.34	Онынъ касына келеди, яраларын зейтун майы ман, шагыр ман суьртип тазалайды, байлайды. Сонъ, оны оьзининъ эшегине мингистип, конагуьйге аькеледи де онынъ кайгысын шегеди. 
LUK.10.35	Эртеси куьн, кетеятырып, эки динар акшады шыгарып, конагуьйдинъ иесине узатады эм ога: „Оны карарсынъ; эгер коьп затты зыраф этсенъ, мен кайтканда, сага тоьлермен“, – деп тапшырады.
