MAT.14.17	Zɨ́ ꞌyị lódụ́ kacɨ́ga úkulúgu ledre kɨ́dí, “Mongụ́ ꞌyị, odụ éyị́ bɨ do sị́lị́ze ona ní lá dụụ́ ambata ịnyị (5) kɨ́ mɨnzéré kénzé e gbre.”
MAT.14.18	Zɨ́a úku ledre kɨ́dí, “Ógụsé aka kɨ́ ambata máa ga gére née yáa.” 
MAT.14.19	Yésụ ya ꞌyị e idínɨ́ ndị́sị do súwú ga gére née bi ore. Zɨ́a ꞌdíꞌbi ambata kɨ́ kénzé ga bɨ gbre née do sị́lị́ne, zɨ́a lúrú bi komo ere, zɨ́a íꞌbí mbófo éyị́ zɨ́ Lomo, zɨ́a ꞌdéweífi sɨmɨyé. Zɨ́a íꞌbí a do sị́lị́ ꞌyị lódụ́ kacɨ́ne ga gére née idínɨ́ ífi yée zɨ́ ꞌyị e ánu a. 
MAT.14.20	Zɨ́ tụ́ꞌdụ́ ꞌyị ga ba ánu éyị́ zɨ́ye léreyé mbá. Ngítí a ga bɨ idíaká ní, zɨ́ ꞌyị lódụ́ kacɨ́ga ga gére née ꞌdóꞌdụ́ ꞌdúcu gbété e kɨ́e sokó doa gbre (12). 
MAT.14.21	ꞌYị ga bɨ anunɨ́ éyị́ ní, yaꞌdá e nɨyí kóo álifu ịnyị (5,000). Olonɨ́ kará e kɨ́ owụ́ e wá.
MAT.14.22	Geré gɨ do kacɨ́ éyị́ mɨánu née, zɨ́ Yésụ úku ledre zɨ́ ꞌyị lódụ́ kacɨ́ne ga gére née idínɨ́ mu ꞌdógụ mɨkavu ndéréókpóye ꞌdáꞌdá. Zɨ́a aka ídíáká ꞌbɨ ené ꞌdáꞌba gɨ ro úku ledre zɨ́ ꞌyị ga gére née ndáꞌbayé ꞌbe. 
MAT.14.23	Sɨmɨ bɨ uku ledre go zɨ́ ꞌyị ga gére née kɨ́dí bayinɨ́ mu ní, zɨ́a ndéré ékị́ne do landa ngúcuné íni ini zɨ́ Lomo. Ndịsị íri gị kɨ́ tagá ngúcuné. 
MAT.14.24	Kuṛúngba bɨ gáa ꞌyị lódụ́ kacɨ́ga nɨyí sɨmɨ a ní nderé go sɨmɨ iní gbála gɨ do gbúṛóngó. Gɨ zɨ́ síli bɨ ndịsị ílí do iní kɨ́ rokoꞌbụné ní, zɨ́ iní nda ndị́sịné ụ́cụlóꞌbó kuṛúngba gbụ́ gbụ́ gbụ́, bi ndéré eme lolụ ngụ́.
MAT.14.25	Nda kɨ́ sị́ ndóndó, zɨ́ Yésụ ékị́ógụné gɨ do landa gɨrí ndị́sị ndéréne do iní zɨ́ ꞌyị ené ga bɨ sɨmɨ kuṛúngba née káa zɨ́ ndịsị ndéré do ngáká bi ní. 
MAT.14.26	Sɨmɨ bɨ ꞌyị lódụ́ kacɨ́ga ga gére née lurúnɨ́ wo do iní kɨ́ ndị́sị ógụꞌdị́yị roné mɨꞌdí zɨ́ye ní, zɨ́ ngịrị méngị yée. Zɨ́ye útúye ndị́sị mbụ́mbụ́dụ́ gɨ zɨ́a somụ́nɨ́ ꞌbɨ eyé kɨ́dí née go “ꞌYị lárá.”
MAT.14.27	Geré ꞌdiya zɨ́ Yésụ úku ledre zɨ́ye kɨ́dí, “Ndásé éré ngịrị wá, née máa.”
MAT.14.28	Zɨ́ Pétero úkulúgu ledre zɨ́a ya, “Mongụ́ ꞌyị togụ́ née tɨ́ yị́ị maꞌdíi, ídí mu ṇgúṇgu a zɨ́ma ndéréma gɨ do iní ógụmá zɨ́yị íri.”
MAT.14.29	Yésụ ya zɨ́a ní, “Ógụ mu.”
MAT.14.29	Zɨ́ Pétero ékị́ógụné gɨ sɨmɨ kuṛúngba ndị́sị ndéréne do iní mɨꞌdí zɨ́ Yésụ. 
MAT.14.30	Tɨ́ lá sɨmɨ bɨ Pétero lurú iní nɨ ndị́sị kị́zị kɨ́ rokoꞌbụné kɨ́ngaya gɨ zɨ́ mongụ́ síli ní, zɨ́ ngịrị méngị wo, geré zɨ́a tónóne ólụ́ne sɨmɨ iní. Zɨ́a ótrụ́ ledre kɨ́dí, “Ngére yómo máa mu.”
MAT.14.31	Geré zɨ́ Yésụ áꞌdané sáká wo, zɨ́a úku ledre kɨ́dí, “Pétero ṇgúṇgu aka eyị́ ledremá kɨ́ngaya fú wá, éré ngịrị gɨ ro ꞌdi?”
MAT.14.32	Sɨmɨ bɨ Pétero ekị́lugunɨ́ royé kɨ́ Yésụ sɨmɨ kuṛúngba ní, geré zɨ́ mongụ́ síli bɨ gáa ba tóroné. 
MAT.14.33	Zɨ́ ꞌyị ga bɨ sɨmɨ kuṛúngba née óto úndrua, zɨ́ye úku ledre kɨ́dí, “Yésụ, áyí Owụ́ ꞌbɨ Lomo maꞌdíi.”
MAT.14.34	Zɨ́ye ꞌdógụ bi do ndéréógụyé sɨmɨ owụ́ gara bɨ kɨ́ ịrịné Geneseréta ní. 
MAT.14.35	Sɨmɨ bɨ ꞌyị ga bɨ ꞌbɨ gara née owonɨ́ kɨ́dí Yésụ ogụ née ne ní, zɨ́ye kákasa sɨmɨ gara ore mbá kɨ́dí ꞌyị ga bɨ ꞌyị eyé e nɨyí kɨ́ ndíyá ní, idínɨ́ ógụ kéye zɨ́ Yésụ, nɨ go sɨmɨ gara ore. 
MAT.14.36	Zɨ́ ꞌyị ndíyá e ṇgúṇgú royé zɨ́a idí ṇgúṇgu a zɨ́ye óto sị́lị́ye lá gba ro tara bongó ené. Maꞌdíi yée ga bɨ otonɨ́ sị́lị́ye ro tara bongó ené ní, zɨ́ ndíyá eyé e tɨ́ ụ́kụ́ne gɨ royé.
MAT.15.1	Nda gɨ ore zɨ́ ngíti géyị Farụsáyo e kɨ́ ngíti géyị ꞌyị ga bɨ ndịsịnɨ́ ꞌdódo lorụ ní, ógụyé gɨ sɨmɨ Yerụsaléma ndúꞌyú Yésụ kɨ́dí, 
MAT.15.2	“Éyị́ bɨ ꞌyị lódụ́ kacɨ́yị ga ba ilinɨ́ méngị kéyị kacɨ́ ondụ́ ezé gɨ zɨ́a wá ní ꞌdi? Ndịsịnɨ́ ánu éyị́ geré mɨánu ilinɨ́ lúgu sị́lị́ye kí wá ní.”
MAT.15.3	Zɨ́ Yésụ ndúꞌyú lúgu yée kɨ́dí, “Sara ílisé méngị kéyị kacɨ́ lorụ ꞌbɨ Lomo wá gɨ ro ꞌdi, bɨ zɨ́se ndị́sịsé méngị dụụ́ ledre ga bɨ ondụ́ esé ili yée ní. 
MAT.15.4	Lomo iꞌbí lorụ kɨ́dí, ‘Ídí óto úndru ꞌbụyị́ e kɨ́ mbágáyị.’
MAT.15.5	Tɨ́ lá ndị́sịsé ꞌdódo ledre kɨ́dí, togụ́ ꞌyị uku ledre zɨ́ ꞌbụné e kɨ́ mbágáne kɨ́dí, ‘Éyị́ ga bɨ ílisé gɨ ro zɨ́ye sáká sée kɨ́e ní, máíꞌbí go káa do tákpásị́lị́ zɨ́ Lomo,’ 
MAT.15.6	ndaá gɨ ro zɨ́ye óto úndruyé kɨ́e wá. ꞌDéwesé née go lorụ ꞌbɨ Lomo gɨ ro ondụ́ esé ꞌbɨ Yụ́da e. 
MAT.15.7	Ndị́sịsé lóndo rosé kɨ́dí ásé ꞌyị méngị ledre ꞌbɨ Lomo, ábuwá ledre bɨ nébị Isáya uku gɨ rosé ní nɨ maꞌdíi kɨ́dí,
MAT.15.8	“ ‘ꞌYị ga ba ndịsịnɨ́ óto úndrumá lá dụụ́ do tarayé,
MAT.15.8	tɨ́ lá mɨmbéꞌdeyé nɨ yị́ ené gɨ romá gbála.
MAT.15.9	Ndịsịnɨ́ óto úndrumá lá gbékpị́ne,
MAT.15.9	ndị́sịnɨ́ tɨ́ ꞌdódo ledre ní, tɨ́ lá yị́ eyé lorụ eyé ꞌbɨ ꞌyịmaꞌdí e.’
MAT.15.10	Gɨ do kacɨ́ ledre née ní, zɨ́ Yésụ ndóloyóko tụ́ꞌdụ́ ꞌyị e zɨ́a úku ledre zɨ́ye kɨ́dí, “Ídísé úwú ledre ba zɨ́se ówoyéme a bɨlámáne. 
MAT.15.11	Ndaá ꞌbɨ ené éyị́ mɨánu bɨ ꞌyị ánu ní nɨ oto wo ne zɨ́a ídíne ꞌyị lúyú ledre wá, yị́ ené bɨsinyí ódro bɨ gɨ taraꞌyị ní.”
MAT.15.12	Zɨ́ ꞌyị lódụ́ kacɨ́ Yésụ ógụyé úku ledre zɨ́a kɨ́dí, “Mongụ́ ꞌyị, ówo go kɨ́dí ledre bɨ gáa úku ba sinyí yị́ ené ro Farụsáyo e go mɨsínyí?”
MAT.15.13	Zɨ́a úkulúgu ledre zɨ́ye kɨ́dí, “Éyị́ ga bɨ mbá ngárá Babá bɨ komo ere ꞌdịyị́ yée ne wá ní, nɨ lálaóyó yée mbá ꞌdáꞌba. 
MAT.15.14	Ndásé óto komosé ro ledre ꞌbɨ Farụsáyo ga gére née wá, nɨyí yị́ eyé manda ga bɨ komoyé ndaá ní. ꞌYị bɨ komoa ndaá ní togụ́ lala ezené bɨ komoa ndaá ní, yée gbrengárá nɨyí útú sɨmɨ gu.”
MAT.15.15	Zɨ́ Pétero úku ledre kɨ́dí, “Mongụ́ ꞌyị, úku ꞌdódo aka ini ledre gɨ sɨmɨ muruwayi bɨ úku née zɨ́ze.”
MAT.15.16	Yésụ ya zɨ́ye ní, “Áyí, ówosé esé kpá wá? 
MAT.15.17	Ówosé bɨ kɨ́dí éyị́ mɨánu ndịsị ólụ́ gɨ ku ꞌyị, zɨ́a ókpóne sɨmɨ ꞌyị, zɨ́a nda ólụ́ógụné gɨ sɨmɨ ꞌyị ꞌdáꞌba ní wá? 
MAT.15.18	Bɨsinyí ledre bɨ ndịsị ówụ́ gɨ taraꞌyị ní, ndịsị ólụ́ógụ gɨ yana mɨmbéꞌde ꞌyị. Gɨ zɨ́ kéyị née zɨ́ ꞌyị ídíne bɨsinyíne do komo Lomo. 
MAT.15.19	Bɨ kenée ní, bɨsinyí ledre ga bɨ káa zɨ́ úfu ꞌyị, sóꞌdo roꞌyị kɨ́ ꞌyị bɨ ófụ́sé rosé kéne wá ní, kɨ́ ledre ꞌbɨ gámá faa kacɨ́ kará e togụ́ yaꞌdá e, kɨ́ ugu, kɨ́ ṛanga, kpá úku tara sinyí zɨ́ ꞌyị e. Ledre ga gére née mbá olụ́ogụnɨ́ gɨ do mɨmbéꞌde ꞌyị. 
MAT.15.20	Éyị́ ga gére née ndịsịnɨ́ óto ꞌyị e ye zɨ́ye ídíye bɨsinyíye do komo Lomo. Ndaá ꞌbɨ ené ánu éyị́ mɨánu togụ́ mbú ꞌyị lúgu sị́lị́ne wá ní óto ꞌyị ne zɨ́a ídíne do komo Lomo bɨsinyíne ní wá.”
MAT.15.21	Zɨ́ Yésụ nda ị́nyịné gɨ ore ndéréne sɨmɨ gara ga bɨ Táyire kɨ́ Sidóna ní. 
MAT.15.22	Zɨ́ ngíti kára gɨ sɨmɨ kúfú bɨ Kanána e ndịsị ndị́sị do bi gbóo ore ógụné ṇgúṇgú roné zɨ́ Yésụ kɨ́dí, “Ngére, Bulúndu Dawídi, ówo aka ledre kɨ́ma. Nyị́ma dokéké e ndịsịnɨ́ méngị wo bɨsinyíne kɨ́ngaya.”
MAT.15.23	Tɨ́ lá Yésụ ukulugu ené ledre zɨ́a wá. Zɨ́ ꞌyị lódụ́ kacɨ́ Yésụ ógụyé úku ledre zɨ́ Yésụ kɨ́dí, “Ógóóyó kára née gɨ ore ꞌdáꞌba. Ndịsị fú lá gbúrógbó do kacɨ́ze kɨ́ ledre ené née.”
MAT.15.24	Zɨ́ Yésụ úkulúgu ledre zɨ́ kára née kɨ́dí, “Lomo kasaogụ máa lá dụụ́ gɨ ro sáká ꞌyị amá e Isɨréle e gɨ zɨ́a nɨyí káa zɨ́ kábịṛị́kị ga bɨ mị́ngị́ye ndaá ní.”
MAT.15.25	Zɨ́ kára née ndósoógụné gbóo útúne gbrị kóꞌdụ́ Yésụ. Zɨ́a úku ledre zɨ́ Yésụ kɨ́dí, “Ngére, sáká máa mu.”
MAT.15.26	Yésụ ya zɨ́a ní, “Ndaá ꞌbɨ ené bɨlámáne do ꞌdíꞌbi éyị́ mɨánu ꞌbɨ owụ́ e íꞌbí a zɨ́ ị́sị e wá.”
MAT.15.27	Zɨ́a úkulúgu ledre zɨ́ Yésụ kɨ́dí, “Ngére, nɨ tɨ́ kenée. Tɨ́ lá ị́sị e ꞌdoꞌdụ́nɨ́ nyụnyụ́ éyị́ mɨánu gɨ sị́ tarabíza ꞌbɨ mị́ngị́ye bú.”
MAT.15.28	Née ní, zɨ́ Yésụ úkulúgu ledre zɨ́ kára née kɨ́dí, “Kára ṇgúṇgu ledre eyị́ ofụ go. Éyị́ bɨ íli ní mááyí méngị a zɨ́yị.” Kpá tɨ́ geré sɨmɨ sịndị́ kadra née zɨ́ ro nyị́ kára née émené.
MAT.15.29	Zɨ́ Yésụ ị́nyịné gɨ ore ndáꞌbané kóꞌdụ́ mɨkavu Galiláya. Zɨ́a ndéré ékị́ne do landa ndị́sịné bi. 
MAT.15.30	Zɨ́ tụ́ꞌdụ́ ꞌyị e ndị́sị ógụyé zɨ́a kɨ́ ꞌyị eyé ga bɨ kɨ́ umbu sịndị́ye, ꞌyị komo mɨꞌdụ́tụ e, mɨgịgị́ṛị́ e, yée ga bɨ odronɨ́ wá ní, nda kpá kɨ́ yée ga bɨ kɨ́ toso ndíyá eyé e mɨngúngúcua ní. Do ógụ óto yée mbá cigí Yésụ bi kenée, zɨ́a óto sị́lị́ne royé zɨ́ye ómo yée mbá. 
MAT.15.31	Zɨ́ taraꞌyị e ị́drị́ne kɨ́ lúrú ꞌyị ga bɨ odronɨ́ wá ní kɨ́ ódro, mɨgịgị́ṛị́ e sịndị́ye ꞌdózo roné go, yée ga bɨ kɨ́ umbu sịndị́ye ní nɨyí go kɨ́ gámá, mɨkomo mɨꞌdụ́tụ nɨyí go lúrú bi. Zɨ́ye mbófo Lomo bɨ Isɨréle e ndịsịnɨ́ íni ini zɨ́a ní.
MAT.15.32	Zɨ́ Yésụ ndólo ꞌyị lódụ́ kacɨ́ne e zɨ́a úku ledre zɨ́ye kɨ́dí, “Lerị́ ꞌyị ga ba mengị máa go, mengịzé kéye go sị́lị́ ota éyị́ mɨánu ndaá zɨ́ye wá. Ndaá bɨlámáne zɨ́ma ótoómo yée zɨ́ye ndáꞌbayé kɨ́ ꞌbú wá káa bɨ komoyé nɨ ụ́lụ́ yana zɨ́ye útúye ke.”
MAT.15.33	Zɨ́ ꞌyị lódụ́ kacɨ́ga úkulúgu ledre zɨ́a kɨ́dí, “Azé ówo éyị́ mɨánu sɨmɨ súwú ona íꞌbí a zɨ́ tụ́ꞌdụ́ káa zɨ́ wo née gɨ ꞌda?”
MAT.15.34	Yésụ ya zɨ́ye ní, ambata nɨ zɨ́se kɨ́rɨ́ née ndu? Zɨ́ye úkulúgu ledre zɨ́a kɨ́dí, “Ambata e nɨyí ịnyị doa gbre (7) nda lá kɨ́ mɨnzéré kénzé e.”
MAT.15.35	Zɨ́a úku ledre zɨ́ tụ́ꞌdụ́ ꞌyị ga gére née ndị́sịyé bi do káṇgá. 
MAT.15.36	Zɨ́a ꞌdíꞌbi ambata ga bɨ ịnyị doa gbre (7) kɨ́ mɨnzéré kénzé ga gére née, sɨmɨ bɨ iꞌbí mbófo éyị́ go zɨ́ Lomo ní, zɨ́a ꞌdéweífi sɨmɨyé zɨ́a íꞌbí yée zɨ́ ꞌyị lódụ́ kacɨ́ne e, zɨ́ye nda íꞌbí a zɨ́ ꞌyị ga gére ní. 
MAT.15.37	Zɨ́ tụ́ꞌdụ́ ꞌyị ga gére née ánu éyị́, zɨ́ye léreyé mbá. Ngítí éyị́ mɨánu ga bɨ idíakánɨ́ ní, zɨ́ ꞌyị lódụ́ kacɨ́ga ꞌdóꞌdụ́ ꞌdúcu gbété e kɨ́e kpá ịnyị doa gbre (7). 
MAT.15.38	Gɨ sɨmɨ ꞌyị ga bɨ kóo anunɨ́ éyị́ ní, olonɨ́ lá dụụ́ yaꞌdá e álifu eso (4,000). Olonɨ́ kará e kɨ́ owụ́ e wá. 
MAT.15.39	Gɨ do kacɨ́ bɨ Yésụ bayi ꞌyị ga gére née go ní, zɨ́a nda ékị́ne sɨmɨ kuṛúngba zɨ́ye ndéréye sɨmɨ bi bɨ ndịsịnɨ́ ndólo a Magadána ní.
MAT.16.1	Sɨmɨ ngíti sị́lị́, zɨ́ Farụsáyo e kɨ́ Sadụkáyo e ógụyé úzu Yésụ idí méngị ledre bɨ kɨ́ rokoꞌbụné ní gɨ ro zɨ́ye ówo a kɨ́dí Lomo kasaogụ wo ne gɨ komo ere.
MAT.16.2	Zɨ́ Yésụ úkulúgu ledre zɨ́ye kɨ́dí, “Togụ́ go kɨ́ tagá yá, ndị́sịsé úku ledre kɨ́dí, ‘Kɨ́lóndó kadra nɨ súwu gɨ zɨ́a bi nɨ komo ere gbawu káa.’ 
MAT.16.3	Togụ́ kɨ́ phịyị́ yá, zɨ́se ndị́sịsé úku ledre kɨ́dí, ‘Mụ́kụ́ nɨ go kụụ née ní iní nɨ éꞌdị karaba.’ Ówosé tɨ́ lá kacɨ́ úku ledre gɨ ro éyị́ ga bɨ ndịsịnɨ́ méngị royé komo ere ní, togụ́ nda gɨ ro éyị́ ga bɨ ndị́sịnɨ́ méngị royé ca cakaba ní yá, ówosé esé e wá. 
MAT.16.4	Ílisé lúrú ledre ga bɨ kɨ́ rokoꞌbụyé ní té kí ásé fú ṇgúṇgu a. Gɨ zɨ́a bɨ ásé ꞌyị luyú ledre e ní, útúásásé esé ṇgúṇgu a wá. Ledre bɨ mááyí ꞌdódo a zɨ́se ní dụụ́ wo bɨ kóo mengị roné zɨ́ Yóna
MAT.16.5	Sɨmɨ bɨ Yésụ ꞌdogụnɨ́ bi sága ní, ꞌyị lódụ́ kacɨ́ga nɨyí lúrú bi ní, otoomo lịgịnɨ́ ambata go. 
MAT.16.6	Zɨ́ Yésụ úku ledre zɨ́ye kɨ́dí, “Komosé idí ídí rosé gɨ zɨ́ bɨsinyí ꞌdódo ledre ꞌbɨ Farụsáyo e kɨ́ Sadụkáyo e bɨ káa zɨ́ ꞌdeꞌdị́ bɨ ndịsịnɨ́ óto a sɨmɨ ambata eyé e ní.”
MAT.16.7	Zɨ́ye úkulóꞌbó ledre dongaráye kɨ́dí, “Uku ledre née kenée ba gɨ zɨ́a bɨ ledre lịgị zée kɨ́ ꞌdíꞌbiútú ambata ní.”
MAT.16.8	Yésụ owo sómụ́ ledre eyé née go bú. Zɨ́a úku ledre zɨ́ye kɨ́dí, “Éyị́ bɨ ndị́sịsé úku ledre ambata gɨ roa ní ꞌdi, ṇgúṇgusé aka esé ledremá fú wá ke? 
MAT.16.9	Sómụ́lị́gịsé ledre ambata bɨ kóo ịnyị máíꞌbí zɨ́ ꞌyị e álifu ịnyị ní go, sara ngítíye bɨ idíaká ní, ꞌdóꞌdụ́ ꞌdúcusé kóo gbété kɨ́e ndu? 
MAT.16.10	Togụ́ wo née wá ní, sara ambata bɨ kóo ịnyị doa gbre (7) máíꞌbí zɨ́ ꞌyị e álifu eso (4,000) ánu a ní, ꞌdóꞌdụ́ ꞌdúcusé kóo gbété kɨ́ ngítíye ndu? 
MAT.16.11	Éyị́ bɨ sómụ́sé ledre gɨ zɨ́a kɨ́dí máúku gáa née ledre ambata gɨ roa ní ꞌdi? Komosé idí ídí rosé gɨ zɨ́ bɨsinyí ꞌdódo ledre ꞌbɨ Farụsáyo e kɨ́ Sadụkáyo e.” 
MAT.16.12	Zɨ́ye nda ówoyéme a kɨ́dí uku ené gáa ba ledre gɨ ro ambata wá, uku yị́ ené ledre bɨsinyí ꞌdódo ledre ꞌbɨ Farụsáyo e kɨ́ Sadụkáyo e.
MAT.16.13	Sɨmɨ bɨ Yésụ nderéogụnɨ́ gbóo kɨ́ gara bɨ Kayisaríya Phị́lịpo ní, zɨ́a ndúꞌyú ꞌyị lódụ́ kacɨ́ne e kɨ́dí, “ꞌYị e ndịsịnɨ́ sómụ́ a kɨ́dí, Owụ́ ꞌbɨ ꞌYịmaꞌdí nɨ náambi?”
MAT.16.14	Zɨ́ye úkulúgu ledre zɨ́a kɨ́dí, “Ngíti géyị ꞌyị e ya nɨ Yiwáni ꞌyị Bábátị́zị́ ꞌyị e, ngíti géyị ya nɨ Ilíya, ngíti géyị ya nɨ Yeremáya, togụ́ wá, nɨ ngúru nébị e.”
MAT.16.15	Zɨ́a ndúꞌyúlúgu yée kɨ́dí, “Sara sómụ́sé ꞌbɨ esé kɨ́dí mááyí náambi?”
MAT.16.16	Simúna Pétero ya zɨ́a ní, “Áyí Kɨ́résịto, Owụ́ ꞌbɨ Lomo bɨ nɨ trịdrị ní.”
MAT.16.17	Yésụ ya zɨ́a ní, “Simúna wotị́ Yóna, Lomo iꞌbí úndru go zɨ́yị. ꞌYịmaꞌdí ukuiꞌbí ené ledre née zɨ́yị ne wá, Babá bɨ komo ere ní ukuiꞌbí ne. 
MAT.16.18	Máúku zɨ́yị, ịrịyị́ nɨ karaba go Pétero, ledre gɨ sɨmɨ a kɨ́dí, ‘Landa.’ Mááyí óto sị́ ꞌdị́cị́ amá doa. Umbu utúasá ndụ́rụ ꞌdị́cị́ máa née wá. 
MAT.16.19	Mááyí íꞌbí rokoꞌbụ bɨ gɨ ꞌbe ꞌbɨ Lomo komo ere ní zɨ́yị. Éyị́ bɨ ási go gɨ roa ní, Lomo nɨ kpá ási gɨ roa gɨ komo ere. Éyị́ bɨ ṇgúṇgu ledre a go ní, Lomo nɨ kpá ṇgúṇgu a.” 
MAT.16.20	Nda gɨ ore zɨ́a ésị sị́lị́ne komo ꞌyị lódụ́ kacɨ́ne e kɨ́dí ndanɨ́ aka úku ꞌdódo a bɨ ya née nɨ Kɨ́résịto ní zɨ́ ꞌyị e wá.
MAT.16.21	Gɨ do kacɨ́ ledre née ní, zɨ́ Yésụ ndị́sịné úku ledre zɨ́ ꞌyị lódụ́ kacɨ́ne e kɨ́dí, nɨ mɨútúásáne zɨ́ne ndéréne sɨmɨ Yerụsaléma. Gɨ ro zɨ́ mɨngburoko ꞌyị e, manda ga bɨ ꞌbɨ ꞌyị ꞌdáná éyị́ e ní kɨ́ ꞌyị ꞌdódo lorụ e ꞌdóꞌdo née, zɨ́ye úfu née, sɨmɨ sị́lị́ ota zɨ́ne úrúne.
MAT.16.22	Zɨ́ Pétero ndólo wo sogo éyị́ úku ledre zɨ́a kɨ́dí, “Ngére Lomo, ndá ótoómo ledre née zɨ́a méngị roné zɨ́yị wá.”
MAT.16.23	Zɨ́ Yésụ úkulúgu ledre zɨ́a kɨ́dí, “Ịnyị gɨ romá íri, áyí zɨ́ma go káa zɨ́ tutú bɨ toro ꞌdụtụ mɨsiꞌdi ní, sómụ́ ledre eyị́ ndaá ꞌbɨ Lomo wá, yị́ ené ꞌbɨ Satána.”
MAT.16.24	Nda gɨ ore zɨ́ Yésụ úku ledre zɨ́ye kɨ́dí, “Togụ́ ꞌyị ili ídí ꞌyị lódụ́ kacɨ́ma yá, ídí ótoómo kɨ́ méngị ꞌbɨ ené ledre bɨ ili ne ní, zɨ́a ị́mbị́ mɨngbúngbu kágá ené ꞌbɨ ꞌdoꞌdó lódụ́ máa. 
MAT.16.25	Togụ́ ꞌyị íli bándá trịdrịné kɨ́ roné, zɨ́a úyuné. Togụ́ iꞌbí roné zɨ́ umbu gɨ romá yá, zɨ́a ndíki trịdrị. 
MAT.16.26	Wo be ꞌdi emene, zɨ́ ꞌyị ídíne kɨ́ éyị́ ga bɨ do sogo káṇgá mbá zɨ́ne, zɨ́a úyuné mɨúyu? Sara togụ́ uyu go ní, éyị́ nɨ bo nɨ íꞌbí a zɨ́ Lomo gɨ ro íꞌbílúgu trịdrị zɨ́a? 
MAT.16.27	Owụ́ ꞌbɨ ꞌYịmaꞌdí nɨ ndáꞌbaógụ sɨmɨ rokoꞌbụ ꞌbɨ ꞌBụné gɨ komo ere kɨ́ maláyika e, zɨ́a íꞌbí tákpásị́lị́ zɨ́ ꞌyịmaꞌdí e kacɨ́ mɨméngị ledre eyé. 
MAT.16.28	Máúku zɨ́se, ngíti géyị ꞌyị e gɨ dongaráse ga bɨ ásé tóro née, utúasánɨ́ aka úyu wá, nɨyí lúrú Owụ́ ꞌbɨ ꞌYịmaꞌdí kɨ́ ndáꞌbaógụ ídíne Ngére kí.”
MAT.17.1	Sị́lị́ ịnyị doa kéṛị́ (6) gɨ do kacɨ́ ledre née ní, zɨ́ Yésụ ꞌdíꞌbi Pétero e kɨ́ Yakóbo nda Yiwáni owụ́ lúndu Yakóbo, yée ota zɨ́ye ndéré ékị́ ndị́sịyé do landa ngúcuyé. 
MAT.17.2	Zɨ́ toso Yésụ óyólóꞌbó roné zɨ́ye do landa íri. Zɨ́ sɨmɨ komoa ndị́sị ndícíne káa zɨ́ sụ́lụ́ kadra ní, zɨ́ bongó bɨ ro a ní ényị́ne kpɨ́lélé káa zɨ́ bimɨóṇgó ní. 
MAT.17.3	Tɨ́ do komoyé née, zɨ́ Ilíya e kɨ́ Mụ́sa ógụyé zɨ́ye ndị́sị ódroyé kɨ́ Yésụ.
MAT.17.4	Zɨ́ Pétero úku ledre zɨ́ Yésụ kɨ́dí, “Ngére, utúasá mɨútúásá zɨ́ze ndị́sịzé ona. Togụ́ ṇgúṇgu go yá, mááyí lágá kụ́tụ́ e ota (3) kɨ́ra, kị́éꞌdo zɨ́yị, kị́éꞌdo zɨ́ Mụ́sa ngíti a zɨ́ Ilíya.”
MAT.17.5	Sɨmɨ bɨ nɨ aka ngbụ́rụ́ ndị́sị úku ledre née ní, zɨ́ bɨkenyị́ bụṛụngụ́ ógụné kụụ káa zɨ́ cika ní sólụ yée yeré. Zɨ́ kúrú ꞌyị ówụ́ne kpụrụ́ gɨ sɨmɨ bụṛụngụ́ gɨrí kɨ́dí, “Ba Owụ́ ꞌbɨ amá, ꞌbúa ofụ domá go, mááyí kɨ́ rokinyi gɨ zɨ́a. Ídísé úwú ledre gɨ taraa.”
MAT.17.6	Sɨmɨ bɨ ꞌyị lódụ́ kacɨ́ga uwúnɨ́ ledre née kenée ní, zɨ́ ngịrị útúne sɨmɨyé zɨ́ye útú lóꞌbụ komoyé bi. 
MAT.17.7	Tɨ́ lá zɨ́ Yésụ ógụné óto sị́lị́ne royé úku ledre zɨ́ye kɨ́dí, “Ndásé éré ngịrị wá, ị́nyịógụsé mu ꞌdága.” 
MAT.17.8	Sɨmɨ bɨ sịkpịnɨ́ doyé ꞌdága ní, lurúndikinɨ́ ngíti ꞌyị wá lá dụụ́ Yésụ.
MAT.17.9	Kɨ́ ndítíógụyé gɨ do landa gɨrí, zɨ́ Yésụ úku ledre zɨ́ye kɨ́dí, “Ndásé aka úku ledre ga bɨ gáa lúrúsé née zɨ́ ngíti géyị ꞌyị e wá ꞌbúó togụ́ lúrúsé Owụ́ ꞌbɨ ꞌYịmaꞌdí urú go gɨ sɨmɨ umbu.”
MAT.17.10	Zɨ́ ꞌyị lódụ́ kacɨ́ga ga gére née úku ledre zɨ́a kɨ́dí, “Sara éyị́ bɨ ꞌyị ꞌdódo lorụ ukunɨ́ ledre gɨ zɨ́a kɨ́dí, Ilíya nɨ ndáꞌbaógụ ụ́tụ roné fị ne gɨ zɨ́a ní ꞌdi?”
MAT.17.11	Zɨ́ Yésụ úkulúgu ledre zɨ́ye kɨ́dí, “Maꞌdíi, Ilíya nɨ ógụụ́tụ roné ne zɨ́a ótoyéme éyị́ e za mbá do mɨsiꞌdiyé? 
MAT.17.12	Máúku zɨ́se Ilíya ogụ yị́ ené tɨ́ go, tɨ́ lá mɨngburoko ꞌyị e ilinɨ́ eyé ꞌdíꞌbi wo sɨmɨ sụmụ wá, mengịnɨ́ nda yị́ eyé wo bɨsinyíne. Nɨyí ógụ méngị lárá Owụ́ ꞌbɨ ꞌYịmaꞌdí kpá kenée.” 
MAT.17.13	Zɨ́ ꞌyị lódụ́ kacɨ́ga ówo a kɨ́dí uku née ledre Yiwáni Babatị́za.
MAT.17.14	Sɨmɨ bɨ ogụnɨ́ nda go dongará tụ́ꞌdụ́ ꞌyị e ní, zɨ́ ngíti oꞌdo ógụné útúne sị́ sịndị́ Yésụ úku ledre zɨ́a kɨ́dí, 
MAT.17.15	“Ngére ídí ówo ledre kɨ́ wotị́ma,” nɨ kɨ́ dokéké sɨmɨné, ndịsị nda ꞌdóꞌdó gɨ zɨ́a go kɨ́ngaya. Ndịsị kɨ́ lálaónzó wo ku phoꞌdụ kpá sɨmɨ iní. 
MAT.17.16	Máꞌdíꞌbiógụ gáa wo zɨ́ ꞌyị lódụ́ kacɨ́yị ga ba, tɨ́ lá utúasánɨ́ eyé sáká wo wá.
MAT.17.17	Zɨ́ Yésụ ị́nyịné úku ledre zɨ́ye kɨ́ ꞌyị ga bɨ ore ní mbá kɨ́dí, “Dosé orụ go kɨ́ngaya gɨ ro zɨ́se ṇgúṇgu ledremá. Máídí ndị́sị zɨ́se ona gị kɨ́ be ꞌdi? Máídí ụ́tụsɨmɨmá zɨ́ze ndị́sị kése kenée gị kɨ́ be ꞌdi? Ógụsé kɨ́ owụ́oꞌdo née gɨrí mu yána.” 
MAT.17.18	Sɨmɨ bɨ ogụnɨ́ kɨ́ owụ́oꞌdo née ní ní, zɨ́ Yésụ ódroné zɨ́ dokéké née kɨ́ rokoꞌbụné, geré zɨ́a ólụ́ógụné gɨ sɨmɨ owụ́oꞌdo née zɨ́ roa émené cịkị ore.
MAT.17.19	Zɨ́ ꞌyị lódụ́ kacɨ́ Yésụ ógụyé ndúꞌyú wo sɨmɨ bɨ nɨ ngúcuné ní kɨ́dí, “Éyị́ bɨ utúasázé lágaóyó dokéké née gɨ zɨ́a wá ní ꞌdi?”
MAT.17.20	Zɨ́ Yésụ úkulúgu ledre zɨ́ye kɨ́dí, “Yị́ ené gɨ zɨ́a bɨ ṇgúṇgu ledre esé nɨ cúkuꞌdée ní. Abú ṇgúṇgu ledre esé nɨ cúkuꞌdée káa zɨ́ kúfú musɨtáda, ásé úku ledre zɨ́ mongụ́ landa bɨ ꞌdáa kɨ́dí, ‘Ị́nyị mu ꞌdáꞌba,’ nɨ tɨ́ ị́nyị gɨ ore. Máúku zɨ́se, éyị́ bɨ nɨ órụ zɨ́se ní ndaá.”
MAT.17.21	Zɨ́a kpá úku ledre zɨ́ye kɨ́dí, “Dokéké e káa zɨ́ ga gére née ásé lágáóyó yée gɨ sɨmɨ ꞌyị ꞌbúó togụ́ ínisé ini kɨ́ órụ́ rosé zɨ́ Lomo kí.”
MAT.17.22	Sɨmɨ bɨ ꞌyị lódụ́ kacɨ́ Yésụ ogụnɨ́ go mbá ndro sɨmɨ Galiláya ní, zɨ́ Yésụ úku ledre zɨ́ye kɨ́dí, “Sịndị́ kadra nɨ go gbóo gɨ ro do íꞌbí ngbángá Owụ́ ꞌbɨ ꞌYịmaꞌdí zɨ́ ezeokóga. 
MAT.17.23	Zɨ́ye úfu wo, nda sɨmɨ sị́lị́ ota zɨ́a úrú ené.” Zɨ́ ledre née íꞌbí lerị́ ro ꞌyị lódụ́ kacɨ́ga mbá.
MAT.17.24	Gɨ kacɨ́ bɨ Yésụ kɨ́ ꞌyị lódụ́ kacɨ́ne e nderéogụnɨ́ sɨmɨ gara bɨ Kapáranawúma ní, zɨ́ ꞌyị ꞌdóꞌdụ́ ụsórụ ga bɨ ꞌbɨ ꞌDị́cị́ ꞌbɨ Lomo ní ógụyé ndúꞌyú Pétero kɨ́dí, “Mongụ́ ꞌyị esé íꞌbí ụsórụ ꞌbɨ ꞌDị́cị́ ꞌbɨ Lomo bú?”
MAT.17.25	Pétero ya zɨ́ye ní, “Ɨɨ iꞌbí bú.”
MAT.17.25	Sɨmɨ bɨ nderéogụnɨ́ nda go ꞌbe ní, zɨ́ Yésụ ndúꞌyú Pétero kɨ́dí, “Simúna, sɨmɨ sómụ́ ledre eyị́ ní, ngére ga bɨ do sogo káṇgá ba ndịsịnɨ́ ꞌdóꞌdụ́ ụsórụ akpa gɨ zɨ́ ꞌyị eyé e, togụ́ mbú gɨ zɨ́ ꞌyị lóṇgó e?”
MAT.17.26	Zɨ́ Pétero úkulúgu ledre kɨ́dí, “Ndịsịnɨ́ ꞌdóꞌdụ́ ụsórụ gɨ zɨ́ ꞌyị lóṇgó e.”
MAT.17.26	Zɨ́ Yésụ úku ledre zɨ́a kɨ́dí, “ꞌYị eyé e ndanɨ́ kɨ́ ledre wá. 
MAT.17.27	Tɨ́ lá ilizé ezé zɨ́ mɨmbéꞌdeyé ésị́ne rozé wá, ndéré mu ngbuṛu ị́kpị́ iní, mɨzefị kénzé bɨ áyí ị́kpị́ógụ a ní, ídí líkpí taraa, áyí ndíki késị́ ku a, zɨ́yị ꞌdíꞌbi a ndéré íꞌbí a káa do ụsórụ gɨ rozé kéyị.”
MAT.18.1	Sɨmɨ sịndị́ kadra máa née ní, zɨ́ ꞌyị lódụ́ kacɨ́ Yésụ ógụyé ndúꞌyú wo kɨ́dí, “Mongụ́ ꞌyị, ambí nɨ karanée ídí ne mongụ́ ꞌyị ꞌbe ꞌbɨ Lomo komo ere zɨ́ lafúne e mbá?”
MAT.18.2	Zɨ́ Yésụ ndóloógụ owụ́ tóroné dongará ꞌyị e kɨ́rɨ́ née. 
MAT.18.3	Zɨ́a úku ledre gɨ ro owụ́ née kɨ́dí, “Máúku zɨ́se maꞌdíi, togụ́ ótosé rosé ndoo káa zɨ́ mɨnzéré owụ́ e wá, útúásásé ógụ ꞌbe ꞌbɨ Lomo komo ere wá. 
MAT.18.4	Bɨ go kenée ní, ꞌyị bɨ ꞌboꞌbụ́ roné go káa zɨ́ owụ́ ba ní ní, nɨ go ne mongụ́ ꞌyị ꞌbe ꞌbɨ Lomo ꞌdáa.
MAT.18.5	“Kpá kenée, togụ́ ꞌyị ꞌdiꞌbi owụ́ bɨ cúkuꞌdée káa zɨ́ wo ba sɨmɨ sụmụ, kɨ́dí ꞌdíꞌbi née go kpá máa. 
MAT.18.6	ꞌYị bɨ ṇguṇgu ledremá abú nɨ aka lá cúkuꞌdée káa zɨ́ owụ́ ba, zɨ́ ngíti ꞌyị ógụné lóndo wo zɨ́a lúyú ledre yá, nɨ ídí bɨlámáne togụ́ odónɨ́ káꞌdá ro goa, do odóngeṛị wo kɨ́e ro tutú do ụ́cụ wo kɨ́e bu sɨmɨ mongụ́ kụ́lụ́.
