MAT.1.1	Ba ledre gɨ ro bulúndu bulúndu Kɨ́résịto
MAT.1.2	Abarayáma ndiki Isáka.
MAT.1.2	Zɨ́ Isáka ndíki Yakóbo.
MAT.1.2	Zɨ́ Yakóbo ndíki Zụ́da e kɨ́ lúnduné e.
MAT.1.3	Zɨ́ Zụ́da ndíki ꞌbɨ ené Peréze e kɨ́ Zéra. Mbágáye ꞌbɨ ené Tamára.
MAT.1.3	Zɨ́ Peréze ndíki ꞌbɨ ené Ézorono.
MAT.1.3	Zɨ́ Ézorono ndíki ꞌbɨ ené Ráma.
MAT.1.4	Zɨ́ Ráma ndíki ꞌbɨ ené Aminadába.
MAT.1.4	Zɨ́ Aminadába ndíki ꞌbɨ ené Nasóna.
MAT.1.4	Zɨ́ Nasóna ndíki ꞌbɨ ené Salamóna
MAT.1.5	Zɨ́ Salamóna ndíki ꞌbɨ ené Bowáza, ịrị mbágáa Rába.
MAT.1.5	Zɨ́ Bowáza ndíki ꞌbɨ ené Óbede, ịrị mbágáa Rúta.
MAT.1.5	Zɨ́ Óbede ndíki ꞌbɨ ené Zése.
MAT.1.6	Zɨ́ Zése ndíki ꞌbɨ ené Dawídi bɨ kóo nɨ mongụ́ ngére ní.
MAT.1.6	Dawídi ndiki ꞌbɨ ené Solomóna, mbágáa nɨ Beteseyị́da kára umbu kacɨ́ Ụrị́ya.
MAT.1.7	Zɨ́ Solomóna ndíki ꞌbɨ ené Rebóma.
MAT.1.7	Zɨ́ Rebóma ndíki ꞌbɨ ené Abiyáza.
MAT.1.7	Zɨ́ Abiyáza ndíki ꞌbɨ ené Ása.
MAT.1.8	Zɨ́ Ása ndíki ꞌbɨ ené Zesofáti.
MAT.1.8	Zɨ́ Zesofáti ndíki ꞌbɨ ené Zeróma.
MAT.1.8	Zɨ́ Zeróma ndíki ꞌbɨ ené Uzíya.
MAT.1.9	Zɨ́ Uzíya ndíki ꞌbɨ ené Zotáma.
MAT.1.9	Zɨ́ Zotáma ndíki ꞌbɨ ené Áza.
MAT.1.9	Zɨ́ Áza ndíki ꞌbɨ ené Izikíya.
MAT.1.10	Zɨ́ Izikíya ndíki ꞌbɨ ené Manási.
MAT.1.10	Zɨ́ Manási ndíki ꞌbɨ ené Amóna.
MAT.1.10	Zɨ́ Amóna ndíki ꞌbɨ ené Zosíya.
MAT.1.11	Zɨ́ Zosíya ndíki ꞌbɨ ené Zekíni, do ndíki ngíti géyị lúnduga sɨmɨ bɨ ezeokó Isɨréle e ꞌdiꞌbinɨ́ yée ndéré kɨ́ye sɨmɨ Babelónịya ní.
MAT.1.12	Gɨ do kacɨ́ a bɨ Yụ́da e ndaꞌbaogụnɨ́ ꞌbɨ eyé gɨ sɨmɨ Babelónịya ní,
MAT.1.12	zɨ́ Zekíni ndíki ꞌbɨ ené Seretiyéle.
MAT.1.12	Zɨ́ Seretiyéle ndíki ꞌbɨ ené Zerụbábele.
MAT.1.13	Zɨ́ Zerụbábele ndíki ꞌbɨ ené Abiyụ́da.
MAT.1.13	Zɨ́ Abiyụ́da ndíki ꞌbɨ ené Alikíma.
MAT.1.13	Zɨ́ Alikíma ndíki ꞌbɨ ené Azóra.
MAT.1.14	Zɨ́ Azóra ndíki ꞌbɨ ené Zadóka.
MAT.1.14	Zɨ́ Zadóka ndíki ꞌbɨ ené Akímu.
MAT.1.14	Zɨ́ Akímu ndíki ꞌbɨ ené Elụyụ́da.
MAT.1.15	Zɨ́ Elụyụ́da ndíki ꞌbɨ ené Eliyázara.
MAT.1.15	Zɨ́ Eliyázara ndíki ꞌbɨ ené Matána.
MAT.1.15	Zɨ́ Matána ndíki ꞌbɨ ené Yakóbo.
MAT.1.16	Zɨ́ Yakóbo ndíki ꞌbɨ ené Yoséfa oꞌdo ꞌbɨ Maríya. Née Maríya bɨ mbágá Kɨ́résịto Yésụ ní.
MAT.1.17	Bulúndu Yésụ nɨyí kóo mɨífiyé káa. Tonó gɨ ro Abarayáma ndéréógụné gị ro mongụ́ ngére Dawídi, ndiki andánɨ́ kóo ṛị́kị́ ꞌyị eyé e go kɨ́ꞌdí sokó doa eso (14). Do tónó ndíki ngíti géyị gɨ sɨmɨ sịndị́ kadra ꞌbɨ mongụ́ ngére Dawídi ndéréógụné gị sɨmɨ sịndị́ kadra bɨ ezeokó Isɨréle e ꞌdiꞌbinɨ́ yée ndéré kɨ́ye sɨmɨ Babelónịya ní, kpá sokó doa eso. Zɨ́ ngíti géyị tónóye gɨ ore ndéréógụné gị sɨmɨ sịndị́ kadra bɨ aránɨ́ Kɨ́résịto sɨmɨ a ní. Ndiki andánɨ́ ṛị́kị́ ꞌyị eyé e go kpá sokó doa eso.
MAT.1.18	Ledre gɨ ro mɨndíki Kɨ́résịto Yésụ tonó kóo káa. Korónɨ́
MAT.1.19	Gɨ zɨ́a bɨ Yoséfa ndịsị méngị ledre ga bɨ Lomo ili yée ní, kpá gɨ zɨ́a bɨ ili ené íꞌbí komokenyị́ ro do Maríya wá ní, zɨ́a kóo áyíne gɨ ro ótoómo wo lá wayí kenée ꞌyị e ndanɨ́ ówo a wá.
MAT.1.20	Sɨmɨ bɨ Yoséfa yeme roné go kenée ní, zɨ́ Ngére kása maláyika
MAT.1.21	Nɨ áráógụ owụ́ née owụ́oꞌdo, ídí ị́fị́ ịrị a Yésụ, gɨ zɨ́a nɨ yómo ꞌyị ené e gɨ sɨmɨ lúyú ledre eyé e.”
MAT.1.22	Ledre bɨ kóo Ngére ukuiꞌbí tara ngíti nébị ní, mengị roné née goó ne tɨ́ káa zɨ́ bɨ kóo uku ní kɨ́dí, 
MAT.1.23	“Karanée ngíti owụ́kára ku mbotụ
MAT.1.24	Sɨmɨ bɨ Yoséfa urú ní, zɨ́a tɨ́ ꞌdíꞌbi Maríya káa do meꞌbené káa zɨ́ bɨ maláyika ꞌbɨ Ngére ogụ úku a zɨ́a ní. 
MAT.1.25	Abú Yoséfa ꞌdiꞌbi tɨ́ Maríya go káa do meꞌbené yá, kotrụnɨ́ bi ꞌdúꞌdu kéne wá, zaá gị zɨ́ Maríya árá owụ́ bɨ sɨmɨné née té kí, zɨ́ Yoséfa ị́fị́ ịrị a Yésụ.
MAT.2.1	Gɨ do kacɨ́ a bɨ kóo aránɨ́ Yésụ sɨmɨ Beteléme ngíti gara sɨmɨ káṇgá bɨ Yụdáya sɨmɨ bɨ kóo Eróde nɨ ore ne ngére ní, zɨ́ ngíti géyị ꞌyị komokenzị e ógụyé gɨ gbére sɨmɨ Yerụsaléma ore, 
MAT.2.2	zɨ́ye ndúnduꞌyú kɨ́dí, “Owụ́ bɨ aránɨ́ wo káa do ngére ꞌbɨ Yụ́da e ona ba, nɨ ꞌdí ꞌda? Kele ené ꞌdodo ledre a go zɨ́ze gbére ꞌdáa, ógụzé ba óto úndrua.”
MAT.2.3	Sɨmɨ bɨ ngére Eróde uwú ledre née kenée ní, zɨ́ bi sínyíne roa kɨ́ ꞌyị ga bɨ ꞌbɨ Yerụsaléma ní mbá. 
MAT.2.4	Zɨ́a ndóloyóko manda ꞌbɨ ꞌyị ꞌdáná éyị́ e, kɨ́ ꞌyị ꞌdódo lorụ e, ndúꞌyú yée kɨ́dí, “Úwúsé kóo kɨ́dí nɨyí árá Kɨ́résịto maꞌdáa ꞌda?” 
MAT.2.5	Zɨ́ye úkulúgu ledre kɨ́dí, “Ukunɨ́ kóo kɨ́dí, nɨyí árá wo sɨmɨ Beteléme, káṇgá ꞌbɨ Yụdáya ona. Ngíti nébị uku kóo kɨ́dí Lomo uku yaá,
MAT.2.6	“ ‘Beteléme,
MAT.2.6	ndaá ꞌbɨ eyị́ lá dụụ́ owụ́ gara sɨmɨ káṇgá ꞌbɨ Yụ́da e wá.
MAT.2.6	Mongụ́ ngére nɨ karanée ólụ́ógụ gɨ sɨmɨyị́ gɨ ona
MAT.2.6	zɨ́a ídíne ꞌyị lúrú bi kacɨ́ ꞌyị amá e Isɨréle e za mbá.’
MAT.2.7	Née ní, zɨ́ Eróde ndólo ꞌyị komokenzị ga gére née sɨmɨ ugu gɨ ro ówo a gɨ zɨ́ye lurúnɨ́ kóo kele máa née kɨ́ be ꞌdi? 
MAT.2.8	Zɨ́a úku ledre zɨ́ye kɨ́dí, “Ndérésé mu sɨmɨ Beteléme gámásóꞌdo owụ́ máa née. Togụ́ ndíkisé wo goó, ídísé ndáꞌbaógụ ꞌdódo bia zɨ́ma gɨ ro zɨ́ma kpá ndéréma óto úndrua.”
MAT.2.9	Sɨmɨ bɨ ngére Eróde odro go zɨ́ye ní, zɨ́ye ólụ́ógụyé ndéréye. Kele bɨ ndịsị útú zɨ́ye ꞌdáꞌdá ní, nzara zɨ́a kpá ólụ́ógụné útúne zɨ́ye ꞌdáꞌdá. Zɨ́a ndéré tóroné té do ꞌbe bɨ owụ́ máa née nɨ sɨmɨ a ní. 
MAT.2.10	Nɨyí kóo kɨ́ mongụ́ rokinyi kɨ́ lúrú kele née kɨ́ útúne zɨ́ye kpá fú ꞌdáꞌdá. 
MAT.2.11	Zɨ́ye ndéréógụyé ndíki Yésụ kɨ́ mbágáne Maríya, zɨ́ye útúye do ngụ́ṛụ́ sịndị́ye óto úndru a. Zɨ́ye líkpí tara kombo eyé e, ꞌdíꞌbiógụ dábu kɨ́ abúṛengú kɨ́ bɨlámá sụꞌbụ́ mɨndonyo íꞌbí yée zɨ́ Yésụ. 
MAT.2.12	Nda go kɨ́ ndụlụ, zɨ́ Lomo ódroné zɨ́ye sɨmɨ ꞌduru kɨ́dí ndanɨ́ ndáꞌba gɨ ꞌdí zɨ́ Eróde wá, idínɨ́ ndéré gɨ do ngíti mɨsiꞌdi kpị́.
MAT.2.13	Sɨmɨ bɨ yaꞌdá ga gére née okpónɨ́ go ní, zɨ́ Ngére Lomo kása maláyika ógụ ódroné zɨ́ Yoséfa sɨmɨ ꞌduru kɨ́dí, “ꞌDiꞌdiya, ị́nyịsé mu kɨ́ meꞌbeyị́ zɨ́se ꞌdíꞌbi owụ́ ba ngásá ndị́sị kɨ́e sɨmɨ Ízibiti gɨ zɨ́a Eróde ayí go gámásóꞌdo wo gɨ ro úfu a. Ídísé ndị́sị íri ꞌbúó togụ́ mándólolúgu sée máa.” 
MAT.2.14	Kpá tɨ́ akpa kɨ́ ndụlụ née, zɨ́ Yoséfa e kɨ́ meꞌbené ꞌdíꞌbi owụ́ née, zɨ́ye ngásáye sɨmɨ Ízibiti, 
MAT.2.15	zɨ́ye ndị́sịyé íri zɨ́ Eróde úyuné té kí. Ledre née ꞌdodo ini ledre gɨ sɨmɨ ledre kóo Ngére Lomo ukuiꞌbí zɨ́ ngúru nébị úku a ní kɨ́dí, “Mándólolúgu owụ́ ꞌbɨ amá go gɨ sɨmɨ Ízibiti.”
MAT.2.16	Sɨmɨ bɨ Eróde owo kɨ́dí ꞌyị komokenzị ga gére née londonɨ́ née go ní, zɨ́ mɨmbéꞌdea ésị́ne zɨ́a kása asikíri ené e ndéré úfu owụ́ yaꞌdá ga bɨ sɨmɨ Beteléme ore kpá kɨ́ yée ga bɨ gbaá ore ní mbá ꞌdáꞌba. Tonónɨ́ úfu yée gɨ ro yée ga bɨ sɨmɨbi eyé nɨ gbre ní ndáꞌbaógụné nde. 
MAT.2.17	Zɨ́ mongụ́ lerị́ ídíne tɨ́ káa zɨ́ bɨ kóo nébị Yeremáya uku ní kɨ́dí, 
MAT.2.18	“Do kará Isɨréle e ndịsị ówụ́ kɨ́ íni ini kɨ́ mbụ́mbụ́dụ́ kɨ́ mongụ́ lerị́ sɨmɨ gara bɨ Ráma ní. Ndịsịnɨ́ íni ini gɨ ro owụ́ ꞌbɨ eyé e, gɨ zɨ́a ufuonzónɨ́ yée go mbá. Mbámɨowụ́ máa ga gére née ilinɨ́ do ụ́cụómo yée kɨ́ íni ini wá.”
MAT.2.19	Sɨmɨ bɨ Eróde uyu nda go ní, zɨ́ maláyika ꞌbɨ Ngére Lomo ógụné sɨmɨ ꞌduru zɨ́ Yoséfa sɨmɨ Ízibiti 
MAT.2.20	zɨ́a úku ledre kɨ́dí, “Ị́nyịsé mu kɨ́ meꞌbeyị́ zɨ́se ꞌdíꞌbi owụ́ zɨ́se ndáꞌbasé sɨmɨ káṇgá esé ꞌbɨ Isɨréle e. Eróde bɨ kóo ayí gɨ ro úfu wo ní uyu go.”
MAT.2.21	Zɨ́ Yoséfa ị́nyịyé kɨ́ meꞌbené ꞌdíꞌbi Yésụ, yóó do ndáꞌbayé sɨmɨ Káṇgá eyé ꞌbɨ Isɨréle e. 
MAT.2.22	Ábuwá Arakaláyo nɨ nda goó ne ngére do bi kacɨ́ ꞌbụné sɨmɨ káṇgá bɨ Yụdáya ní. Zɨ́ ngịrị méngị Yoséfa kɨ́ ndáꞌbané íri. Zɨ́ Lomo úku ledre zɨ́a sɨmɨ ꞌduru, zɨ́ye nda ndéréye sɨmɨ Galiláya. 
MAT.2.23	Ndịsịnɨ́ nda kóo sɨmɨ gara bɨ Nazeréta ní. Utúasá go kɨ́ ledre bɨ kóo ngíti nébị uku gɨ ro Kɨ́résịto maꞌdáa kɨ́dí, “Nɨyí ndị́sị ndólo wo ꞌyị ꞌbɨ Nazeréta.”
MAT.3.1	Sɨmɨ sịndị́ kadra máa bɨ kóo née ní, ngíti oꞌdo nɨ kóo bo kɨ́ ịrịné Yiwáni, nɨ ꞌyị Bábátị́zị́ ꞌyị e. Zɨ́a ndị́sịné úku ledre ꞌbɨ Lomo zɨ́ ꞌyị e sɨmɨ Yụdáya gbála sɨmɨ súwú 
MAT.3.2	kɨ́dí, “Ídísé mu óyólóꞌbó mɨmbéꞌdesé, gɨ zɨ́a sịndị́ kadra nɨ go gbóo gɨ ro zɨ́ Lomo bɨ komo ere ní ídíne Ngére esé.” 
MAT.3.3	Yiwáni nɨ oꞌdo bɨ kóo nébị Isáya uku ledre a kɨ́dí,
MAT.3.3	“ꞌYị nɨ karanée ndị́sị ótrụ́ ledre zɨ́ ꞌyị sɨmɨ súwú kɨ́dí,
MAT.3.3	yémeómosé mɨsiꞌdi mu nzíyiné zɨ́ Ngére,
MAT.3.3	ídísé ꞌdózo yéme mɨsiꞌdi zɨ́a ní.”
MAT.3.4	Yiwáni ésị kóo roné bongó bɨ uꞌyúnɨ́ gɨ sɨmɨ bị bangá bɨ Gémele ní, zɨ́a ódó roné káꞌdá bɨ yemenɨ́ gɨ sɨmɨ saná ní. Mongụ́ éyị́ mɨánu ené nɨ kóo mbíra kɨ́ tezị.
MAT.3.5	Tụ́ꞌdụ́ ꞌyị e ịnyịnɨ́ kóo gɨ sɨmɨ Yerụsaléma, kɨ́ yée ga bɨ gɨ sɨmɨ káṇgá bɨ Yụdáya ní, nda kpá kɨ́ ꞌyị máa yée ga bɨ gbóo gbóo kóꞌdụ́ ngbuṛu bɨ Yeredéne ore ní mbá ndéréye úwú ledre ꞌbɨ Lomo gɨ tara Yiwáni. 
MAT.3.6	Sɨmɨ bɨ ꞌyị ga gére née ukuogụnɨ́ lúyú ledre eyé e ní, zɨ́a bábátị́zị́ yée sɨmɨ ngbuṛu bɨ ndolonɨ́ Yeredéne ní.
MAT.3.7	Sɨmɨ bɨ lurú tụ́ꞌdụ́ Farụsáyo e,
MAT.3.8	Togụ́ kenée yá, ídísé méngị éyị́ bɨ nɨ ꞌdódo a kɨ́dí óyólóꞌbósé mɨméngị ledre esé go maꞌdíi ní. 
MAT.3.9	Éyị́ ndaá kpá lóndo sée zɨ́se sómụ́ ledre kɨ́dí Lomo nɨ ótoómo ledre zɨ́se gɨ zɨ́a bɨ ásé bulúndu Abarayáma ní wá. Máúku zɨ́se maꞌdíi tutú ga bɨ bi née, Lomo utúasá go óyólóꞌbó yée zɨ́ye ídíye káa do bulúndu Abarayáma. 
MAT.3.10	Lomo nɨ go nzíyiné gɨ ro lágáónzó kágá e bi. Maꞌdíi, kágá máa wo bɨ aná bɨlámáne wá ní, nɨ lágáónzó a do ụ́cụ a ku phoꞌdụ.
MAT.3.11	“Mándị́sị bábátị́zị́ sée kɨ́ iní gɨ ro zɨ́se óyólóꞌbó sómụ́ ledre esé. Tɨ́ lá gɨ do kacɨ́ma ngíti mongụ́ ꞌyị nɨ ógụ, bɨ romo domá ní. Máútúásá gbawá íꞌdíógụ wará ené gɨ sịndị́a. Nɨ bábátị́zị́ ꞌbɨ ené sée kɨ́ rokoꞌbụ ꞌbɨ ꞌDówụ́ Lomo kɨ́ phoꞌdụ. 
MAT.3.12	Nɨ ꞌbɨ ené yị́ ené káa zɨ́ ꞌyị ócó komo kére ní. Nɨ léfeóto kére ené sɨmɨ bɨlámá éyị́, cící a née zɨ́a kótrụ a trị́e do óngbóóyó a ꞌdáꞌba.”
MAT.3.13	Sɨmɨ ngíti sịndị́ kadra zɨ́ Yésụ ị́nyịné gɨ sɨmɨ káṇgá bɨ Galiláya ní ndéréne ngbuṛu bɨ Yeredéne ní gɨ ro zɨ́ Yiwáni bábátị́zị́ née. 
MAT.3.14	Zɨ́ Yiwáni úku ledre zɨ́a kɨ́dí, “Máíli ba zɨ́yị íꞌbí babatị́za zɨ́ma yị́ị, ógụ nda zɨ́ma ba lárá a káa be ꞌdi?”
MAT.3.15	Zɨ́ Yésụ úkulúgu ledre zɨ́ Yiwáni kɨ́dí, “Ba go bɨlámá sịndị́ kadra gɨ ro zɨ́yị bábátị́zị́ máa, gɨ zɨ́a ilizé mbá ndị́sị méngị ledre ga bɨ Lomo ili yée ní.” Zɨ́ Yiwáni ṇgúṇgu a.
MAT.3.16	Zɨ́ Yiwáni go bábátị́zị́ wo. Sɨmɨ bɨ olụ́ogụ gɨ sɨmɨ iní ní, geré zɨ́ ere líkpí roné. Zɨ́a lúrúndíki ꞌDówụ́ Lomo kɨ́ ógụné doné káa zɨ́ kị́ṛịkóꞌdo ní. 
MAT.3.17	Zɨ́ Lomo ódroné gɨ komo ere kɨ́dí, “Ba mbigí Owụ́ ꞌbɨ amá, ꞌbúa ofụ domá go, mááyí kɨ́ rokinyi gɨ zɨ́a.”
MAT.4.1	Gɨ ore zɨ́ ꞌDówụ́ Lomo ꞌdíꞌbi Yésụ ndéré kɨ́e sɨmɨ súwú gbála gɨ ro zɨ́ ngére ꞌbɨ bɨcayi lomo e úzu wo.
MAT.4.2	Zɨ́ Yésụ méngịné sɨmɨ súwú íri sị́lị́ cị́ gbre (40) anu éyị́
MAT.4.3	Zɨ́ Satána ógụné úku ledre zɨ́a kɨ́dí, “Togụ́ áyí tɨ́ mbigí Owụ́ ꞌbɨ Lomo yá, ídí úku ledre zɨ́ owụ́ tutú ga bɨ bi ba idínɨ́ óyólóꞌbó royé káa do ambata gɨ ro zɨ́yị ánu a gɨ zɨ́ ꞌbú.”
MAT.4.4	Zɨ́ Yésụ ị́nyịné úkulúgu ledre zɨ́ Satána kɨ́dí, “Nɨ mɨékéne sɨmɨ mɨéké kúrú Lomo kɨ́dí, ‘ꞌYịmaꞌdí utúasá ídí trịdrị lá dụụ́ gɨ zɨ́ éyị́ mɨánu wá. Kúrú Lomo nɨ óto ꞌyị e ne zɨ́ye ídíye trịdrị.’ ”
MAT.4.5	Gɨ do kacɨ́ ledre née, zɨ́ ngére ꞌbɨ bɨcayi lomo e ꞌdíꞌbi Yésụ ndéré ékị́ kɨ́e do mongụ́ ꞌDị́cị́ ꞌbɨ Lomo sɨmɨ Yerụsaléma
MAT.4.6	“Togụ́ áyí tɨ́ Owụ́ ꞌbɨ Lomo yá, ídí mu léꞌbéútú bi ꞌdáa. Gɨ zɨ́a nɨ mɨékéne sɨmɨ mɨéké kúrú Lomo kɨ́dí,
MAT.4.6	“ ‘Lomo nɨ kása maláyika ené e
MAT.4.6	zɨ́ye sáká yị́ị,
MAT.4.6	káa bɨ áyí útú útru sịndị́yị ro tutú e ke.’
MAT.4.7	Zɨ́ Yésụ úkulúgu ledre zɨ́ Satána kɨ́dí, “Nɨ mɨékéne kɨ́dí, ‘Ndá úzu Ngére Lomo eyị́ wá.’
MAT.4.8	Zɨ́ ngére ꞌbɨ bɨcayi lomo e kpá ꞌdiꞌbi wo ndéré ékị́ kɨ́e do mongụ́ ngbángbá landa ꞌdága, zɨ́a ꞌdódo káṇgá e kɨ́ manda eyé e kɨ́ rokoꞌbụ ga bɨ zɨ́ye ní mbá zɨ́ Yésụ. 
MAT.4.9	Zɨ́a úku ledre zɨ́ Yésụ kɨ́dí, “Togụ́ útú cakaba bi zɨ́yị óto úndrumá yá, éyị́ ga bɨ za mbá máꞌdódo yée zɨ́yị née, mááyí íꞌbí yée zɨ́yị.”
MAT.4.10	Zɨ́ Yésụ úku ledre zɨ́ Satána
MAT.4.11	Gɨ do kacɨ́ ledre née ní, zɨ́ ngére ꞌbɨ bɨcayi lomo e ndéréóyó roné, zɨ́ maláyika e nda ógụyé sáká wo.
MAT.4.12	Kacɨ́ ledre née luꞌbú wá, do ónzó Yiwáni ꞌyị Bábátị́zị́ ꞌyị e sɨmɨ sị́gịnị. Sɨmɨ bɨ Yésụ uwú kɨ́dí onzónɨ́ Yiwáni go sɨmɨ sị́gịnị ní, zɨ́a ị́nyịné ndáꞌbalúgu roné sɨmɨ káṇgá bɨ Galiláya ní. 
MAT.4.13	Ndịsị ené kóo sɨmɨ Nazeréta ore wá, okpó geré mɨókpó sɨmɨ gara bɨ Kapáranawúma ní. Gara máa née nɨ kóo do gbúṛóngó mɨkavu Galiláya mɨꞌdí sɨmɨ káṇgá ꞌbɨ kúfú ꞌyị ga bɨ Zebụlụ́na kɨ́ Nafatáli ní. 
MAT.4.14	Ledre née utúasá go kpịnị kɨ́ ledre bɨ nébị Isáya uku ní kɨ́dí, 
MAT.4.15	“ꞌYị ga bɨ Zebụlụ́na e kɨ́ Nafatáli e ní, ndịsịnɨ́ ndị́sị gbóo kóꞌdụ́ mɨkavu Galiláya, née Yụ́da e. ꞌYị ga bɨ ndịsịnɨ́ sága Yeredéne gɨ ꞌdí keṛị́ nda kɨ́ yée ga bɨ sɨmɨ Galiláya ní, nɨyí ꞌyị ga bɨ ngárá ndanɨ́ Yụ́da e wá ní. 
MAT.4.16	ꞌYị ga bɨ ndịsịnɨ́ kóo ndị́sị sɨmɨ mɨtụlụrụ ní, mongụ́ bimɨóṇgó ogụ go zɨ́ye. Yée máa ga bɨ kóo ndịsịnɨ́ ꞌbɨ eyé do bi bɨ umbu ndịsị íꞌbí ꞌdoꞌdó ro ꞌyị e sɨmɨ a ní, bimɨóṇgó oṇgó go zɨ́ye.”
MAT.4.17	Gɨ sɨmɨ sịndị́ kadra máa bɨ kóo née ní, zɨ́ Yésụ tónóne úku ledre ꞌbɨ Lomo zɨ́ ꞌyị e kɨ́dí, “Ídísé óyólóꞌbó mɨmbéꞌdesé zɨ́se ṇgúṇgu ledre ꞌbɨ Lomo. Gɨ zɨ́a sịndị́ kadra nɨ go gbóo gɨ ro zɨ́a ídíne káa do Ngére esé.”
MAT.4.18	Kadra kị́éꞌdo, Yésụ nɨ go ndị́sị ndéré do gbúṛóngó mɨkavu Galiláya, zɨ́a lúrúndíki Simúna Pétero kɨ́ lúnduné Andiríya. Nɨyí go ndị́sị ónzó mbírá kénzé eyé sɨmɨ iní. 
MAT.4.19	Zɨ́a ndólo yée kɨ́dí, “Ógụsé mu ndị́sị lódụ́ kacɨ́ma, gɨ ro zɨ́ma óto sée káa do ꞌyị ꞌdíꞌbiógụ ꞌyị e zɨ́ma.” 
MAT.4.20	Sɨmɨ bɨ uwúnɨ́ ledre née kenée ní, geré zɨ́ye ótoómo mbírá eyé ore zɨ́ye ógụ útúye do kacɨ́ Yésụ.
MAT.4.21	Zɨ́ye ókpóye gɨ ore ꞌdáꞌdá, zɨ́a ndíki Zebedị́ya kɨ́ wotị́ne e gbre, Yakóbo kɨ́ lúnduné Yiwáni. Nɨyí sɨmɨ kuṛúngba ndị́sị yéme komo mbírá eyé. Zɨ́ Yésụ ndólo phɨṛangá ga gére née gbrengárá kɨ́ lúnduné. 
MAT.4.22	Geré zɨ́ye ótoómo mbírá eyé kɨ́ ꞌbụyé ore, do útúye do kacɨ́ Yésụ.
MAT.4.23	Zɨ́ Yésụ gámáne sɨmɨ Galiláya mbá. Togụ́ ogụ ndiki ꞌyị e go sɨmɨ ꞌDị́cị́ Kótrụro e,
MAT.4.24	Zɨ́ phanda ledre bɨ Yésụ ndịsị méngị a née áṇgané sɨmɨ ị́rịgbére bɨ Sụ́rịya ní mbá. Zɨ́ tụ́ꞌdụ́ ꞌyị e ndị́sị ógụyé kɨ́ ṛị́kị́ ndíyá eyé e zɨ́ Yésụ ndị́sịné ꞌdíꞌbióyó a gɨ royé. ꞌYị máa yée ga bɨ nɨyí kɨ́ dokéké sɨmɨyé, kɨ́ yée ga bɨ sɨmɨ doyé sinyí go mɨsínyí ní, nda kɨ́ yée ga bɨ kɨ́ umbu sịndị́ye ní, zɨ́a yómo yée mbá. 
MAT.4.25	Sɨmɨ sịndị́ kadra máa bɨ kóo née ní, zɨ́ tụ́ꞌdụ́ ꞌyị e ndị́sị ógụyé zɨ́ Yésụ. ꞌYị ga bɨ gɨ sɨmɨ Galiláya, kɨ́ yée ga bɨ gɨ sɨmɨ gara bɨ Dikapolị́sị, kɨ́ Yerụsaléma, kɨ́ káṇgá bɨ Yụdáya, nda kɨ́ yée ga bɨ gɨ sága ngbuṛu Yeredéne ní mbá.
MAT.5.1	Sɨmɨ bɨ Yésụ lurú tụ́ꞌdụ́ ꞌyị e nɨyí go ndị́sị ógụ zɨ́ne kɨ́ngaya ní, zɨ́a ékị́ ndị́sịné gá do landa. Zɨ́ ꞌyị lódụ́ kacɨ́ga ógụ ndị́sịyé cigí a. 
MAT.5.2	Zɨ́a tónóne ꞌdódo ledre zɨ́ye kɨ́dí, 
MAT.5.3	“Úndru nɨ ídí zɨ́ ꞌyị ga bɨ ṇguṇgunɨ́ ledre ꞌbɨ Lomo go ní, bɨlámá bi bɨ ꞌbe Lomo komo ere ꞌdáa ní, nɨ ídí ꞌbɨ eyé. 
MAT.5.4	Úndru nɨ ídí zɨ́ ꞌyị ga bɨ ndịsịnɨ́ íni ini gɨ zɨ́a bɨ bi sínyí royé mɨsínyí ní, nɨyí karanée ídí kɨ́ rokinyi. 
MAT.5.5	Úndru nɨ ídí zɨ́ ꞌyị ga bɨ ndịsịnɨ́ ꞌbúóꞌbụ́ royé mɨꞌbúóꞌbụ́ ní, nɨyí ídí ye mị́ngị́ do sogo káṇgá ba. 
MAT.5.6	Úndru nɨ ídí zɨ́ ꞌyị ga bɨ ꞌbú kɨ́ kodró ꞌbɨ mɨméngị ledre ga bɨ Lomo ili yée ní doyé ní, nɨyí ídí ye mɨléreyé gɨ zɨ́ Lomo. 
MAT.5.7	Úndru nɨ ídí zɨ́ ꞌyị ga bɨ ndịsịnɨ́ méngị bɨlámá ledre zɨ́ lafúye ní, Lomo nɨ kpá méngị bɨlámá ledre zɨ́ye. 
MAT.5.8	Úndru nɨ ídí zɨ́ ꞌyị ga bɨ bɨsinyí ledre ndaá do mɨmbéꞌdeyé wá ní, nɨyí lúrú Lomo cụ́ kɨ́ komoyé. 
MAT.5.9	Úndru nɨ ídí zɨ́ ꞌyị ga bɨ ndịsịnɨ́ ꞌdíꞌbiógụ dụụ́ bɨlámá ledre dongará ꞌyị e ní, nɨyí ndị́sị ndólo yée Owụ́ ꞌbɨ Lomo. 
MAT.5.10	Úndru nɨ ídí zɨ́ ꞌyị ga bɨ ndịsịnɨ́ méngị yée bɨsinyíne gɨ zɨ́a bɨ ndịsịnɨ́ méngị ledre ga bɨ Lomo ili yée ní, nɨyí ídíye ꞌbe ꞌbɨ Lomo komo ere.
MAT.5.11	“Úndru nɨ ídí zɨ́se sɨmɨ bɨ ꞌyị e nɨyí ndị́sị úku sée, ꞌdóꞌdo sée kɨ́ ndị́sị trótro tụ́ꞌdụ́ bɨsinyí ledre e rosé kɨ́ ṛanga gɨ zɨ́a bɨ ṇgúṇgusé ledre amá ní. 
MAT.5.12	Bi nda sínyí rosé wá. Ídísé kúkugú kɨ́ rokinyi, gɨ zɨ́a tákpásị́lị́ esé nɨ ídí mongụ́ne komo ere. Ndịsịnɨ́ kóo méngị lárá nébị ga bɨ kóo gɨ zɨ́se ꞌdesị́ ꞌdáꞌdá ní kpá kenée.”
MAT.5.13	Zɨ́ Yésụ kpá fú ndị́sịné ꞌdódo ledre zɨ́ ꞌyị lódụ́ kacɨ́ne e kɨ́dí, “Ásé do sogo káṇgá ba káa zɨ́ toꞌdo ní. Tɨ́ lá togụ́ toꞌdo nzulú go ní, nɨ útúásá áyálúgu roné káa be ꞌdi? Odụ a dụụ́ do léfeóyó a ꞌdáꞌba zɨ́ ꞌyị e ndị́sị gámáye doa.
MAT.5.14	“Nda kpá lá dụụ́ toꞌdo wá, ásé do sogo káṇgá ba káa zɨ́ bimɨóṇgó ní, gɨ zɨ́a gara bɨ oꞌbónɨ́ wo có do landa ꞌdága ní, utúasá ené lóꞌbo wá. 
MAT.5.15	Kpá kenée ꞌyị e ụndụnɨ́ eyé phoꞌdụ lóꞌbụꞌdụ́tụ a sị́ pheṛé wá. Ndịsịnɨ́ yị́ eyé óto a do nyárá bi gɨ ro zɨ́a óṇgó bi zɨ́ ꞌyị e ꞌdị́cị́ ore mbá. 
MAT.5.16	Mɨméngị ledre esé idí ídí bimɨóṇgó zɨ́ ꞌyị e gɨ ro zɨ́ye lúrú bɨlámá mɨméngị ledre esé zɨ́ye ndị́sịyé mbófo ꞌBụsé bɨ komo ere ní.”
MAT.5.17	“Ndásé sómụ́ a bɨ kɨ́dí máógụ go ꞌdíꞌbióyó lorụ ga bɨ kóo ꞌbɨ nébị e ní wá, máógụ yị́ amá tɨ́ lá gɨ ro zɨ́ ꞌdódo ledre eyé ídíne maꞌdíi. 
MAT.5.18	Máúku zɨ́se maꞌdíi, tɨ́ káa zɨ́ bɨ do sogo káṇgá kɨ́ ere nɨ aka bo ba ní, utúasánɨ́ ꞌdíꞌbióyó ngíti owụ́ ledre cúkuꞌdée gɨ dongará ledre ga bɨ ekénɨ́ sɨmɨ lorụ ꞌbɨ Lomo ní wá, ꞌbúó togụ́ ledre ga bɨ ekénɨ́ yée sɨmɨ lorụ née mengịnɨ́ royé go mbá ní. 
MAT.5.19	ꞌYị bɨ asi go gɨ ro ledre kị́éꞌdo gɨ dongará ledre ga bɨ ekénɨ́ yée sɨmɨ lorụ ꞌbɨ Lomo, zɨ́a sínyi do ngíti ꞌyị idí kpá ási kenée ní, ꞌyị máa née utúasá ídí kɨ́ ledrené owóowó ꞌbe ꞌbɨ Lomo komo ere wá. ꞌYị máa wo bɨ nɨ ṇgúṇgu ledre lorụ ꞌbɨ Lomo zɨ́a ndị́sịné ꞌdódotátá a zɨ́ lafúne e ní, nɨ ídí kɨ́ ledrené owóowó ꞌbe ꞌbɨ Lomo komo ere. 
MAT.5.20	Gɨ zɨ́ kéyị née ní máúku zɨ́se, togụ́ méngịsé ledre ga bɨ Lomo ili yée ní rómo do Farụsáyo e kɨ́ ꞌyị ꞌdódo lorụ e wá, útúásásé ólụ́ ꞌbe ꞌbɨ Lomo komo ere wá.”
MAT.5.21	“Úwúsé ledre bɨ kóo ukunɨ́ zɨ́ bulúnduzé ga bɨ kóo ꞌdesị́ ní go kɨ́dí, ‘Ndá úfu ꞌyị wá.’
MAT.5.22	Tɨ́ lá máúku zɨ́se ꞌyị bɨ sɨmɨa ndịsị ésị́ bɨsinyíne ro lafúne e ní, nɨyí ꞌdécị ngbanga roa. Kpá kenée ꞌyị máa wo bɨ nɨ ndólo ezené yaá nɨ ꞌyị ṛifu ní, nɨyí ꞌdíꞌbi wo ndéré kɨ́e kóꞌdụ́ mɨngburoko ꞌyị ꞌdécị ngbanga e. Tɨ́ lá ꞌyị máa wo bɨ nɨ úku ledre yaá moko ndaá sɨmɨ ezené wá ní, nɨyí ụ́cụ wo ku phoꞌdụ bɨ ngárá ịlị́ wá ní.
MAT.5.23	“Bɨ kenée ní, togụ́ íli gáa go ndéré íꞌbí tákpásị́lị́ sị́ mbayi, zɨ́yị sómụ́ndíki a kɨ́dí ledre nɨ bo dongaráse kɨ́ ngíti ꞌyị yá, 
MAT.5.24	ídí ótoómo tákpásị́lị́ née dongá mbayi ore kí, zɨ́yị ndéréyị zɨ́se yéme dongaráse kɨ́ ꞌyị née, zɨ́yị nda ndáꞌbaógụyị́ íꞌbí tákpásị́lị́ eyị́.
MAT.5.25	“Togụ́ lúyú ledre go ro ngíti ꞌyị, ili go ndéré kɨ́yị do ngbanga yá, ídí ndéré zɨ́se yéme ledre née kéne ꞌdáꞌdá gɨ zɨ́a kɨ́ ndéréne kɨ́yị do ngbanga, káa bɨ ngére nɨyí íꞌbí yị́ị do ónzó yị́ị sɨmɨ sị́gịnị. 
MAT.5.26	Máúku zɨ́se maꞌdíi, áyí ídí sɨmɨ sị́gịnị íri ólụ́ógụ wá ꞌbúó togụ́ késị́ bɨ ilinɨ́ gɨ zɨ́yị ní íꞌbí go mbá.”
MAT.5.27	“Úwúsé ledre kóo ukunɨ́ zɨ́ ꞌyị ezé ga bɨ kóna ní go kɨ́dí, ‘Ndá méngị ꞌberị wá.’
MAT.5.28	Tɨ́ lá máúku zɨ́se maꞌdíi, ꞌyị bɨ lurú kára zɨ́ ꞌbú kára máa née méngị wo ní, ndịsị go kɨ́ kára née sɨmɨ sómụ́ ledre. 
MAT.5.29	Togụ́ komoyị́ bɨ do anú ayí óto yị́ị zɨ́yị lúyú ledre yá, ídí ꞌdíꞌbióyó komoyị́ máa née ꞌdáꞌba. Nɨ bɨlámáne zɨ́ kémbị́ éyị́ sínyíne gɨ royị́ gɨ zɨ́ wo bɨ do ụ́cụ kụṛụꞌbụyị́ nyé ku phoꞌdụ ní. 
MAT.5.30	Kpá kenée togụ́ sị́lị́yị ꞌbɨ anú ayí óto yị́ị zɨ́yị lúyú ledre yá, ídí ꞌdíꞌbióyó sị́lị́yị née ꞌdáꞌba. Nɨ bɨlámáne zɨ́ kémbị́ éyị́ sínyíne gɨ royị́ gɨ zɨ́ wo bɨ do ụ́cụ kụṛụꞌbụyị́ nyé ku phoꞌdụ ní.”
MAT.5.31	“Ngíti ꞌdódo ledre nɨ kpá káa, ‘oꞌdo bɨ otoomo meꞌbené go ní, idí íꞌbí wáraga ꞌbɨ ótoómo roꞌyị zɨ́ kára máa née.’
MAT.5.32	Tɨ́ lá máúku zɨ́se maꞌdíi, ꞌyị bɨ ótoómo meꞌbené lá gbékpị́ne ndaá gɨ zɨ́a bɨ mengị ꞌberị ní wá ní, oto kára née go ꞌyị méngị ꞌberị. ꞌYị bɨ nɨ ofụ́ kára bɨ oꞌdo otoomo wo née ní, mengị ꞌberị go.”
MAT.5.33	“Ngíti ꞌdódo ledre nɨ kóo kpá káa, zɨ́ bulúnduzé ga kóna ꞌdesị́ ní kɨ́dí, ‘Ledre bɨ lóbụ́ go kóꞌdụ́ Ngére Lomo ní, ndá óyólóꞌbó a wá idí ídí do biné.’ 
MAT.5.34	Tɨ́ lá máúku zɨ́se, ndásé lólóbụ́ kú wá, togụ́ mbú lóbụ́ ere, gɨ zɨ́a née bi ndị́sị ꞌbɨ Lomo. 
