MRK.14.28	Togụ́ máúrú go gɨ sɨmɨ umbu yá, mááyí ndéréókpó sóngó sée sɨmɨ káṇgá bɨ Galiláya ní.”
MRK.14.29	Pétero ya zɨ́a ní, “Mongụ́ ꞌyị, togụ́ lafúma ga ba nɨyí ngásáómo yị́ị ye yá, mángásáómo yị́ị kú wá.”
MRK.14.30	Yésụ ya zɨ́a ní, “Ɨɨ, ídí óto ledre ba sɨmɨ doyị́ bɨlámáne, karaba kɨ́ ndụlụ, sɨmɨ bɨ oꞌdo ngono ụcụ aka koko kɨ́ꞌdí gbre wá ní, áyí ási gɨ romá kɨ́ꞌdí ota (3), yá née owo ené máa wá.”
MRK.14.31	Zɨ́ Pétero ị́nyịné úku ledre cụ́ kɨ́ sɨmɨné zɨ́a kɨ́dí, “Mongụ́ ꞌyị, máútúásá úku ledre kɨ́dí ‘máówo yị́ị wá’ ní kú wá. Togụ́ umbu yá, umbu.” Zɨ́ lafúga ị́nyịyé úku ledre kpá mbá kenée.
MRK.14.32	Sɨmɨ bɨ ogụnɨ́ nda go do Landa Olíva ní, zɨ́ye ị́nyịyé ógụyé do bi bɨ kɨ́ ịrịné Getesemáni ní. Zɨ́ Yésụ úku ledre zɨ́ ꞌyị lódụ́ kacɨ́ne máa ga gére née kɨ́dí, “Ndị́sịsé aka kɨ́ra, mááyí aka ndéré íni ini zɨ́ Lomo.” 
MRK.14.33	Née ní, zɨ́a ị́nyịné ꞌdíꞌbi lá dụụ́ Simúna Pétero e, kɨ́ Yakóbo e, kɨ́ Yiwáni e, zɨ́ye ndéréye kéye. Zɨ́ Yésụ maꞌdáa ídíne kɨ́ mongụ́ sómụ́ ledre, do ndúwúne kpá mɨndúwú, 
MRK.14.34	zɨ́a úku ledre zɨ́ye kɨ́dí, “Sómụ́ ledre bɨ mááyí kɨ́e yáa ní ofụ go, másómụ́ sómụ́ ledre née nɨ úfu máa goó ne, ídísé aka ndị́sị ona kɨ́ komosé rosé.”
MRK.14.35	Zɨ́a ị́nyịné ndéréne gịe re cúkuꞌdée kenée, zɨ́a útúne gbrị do ngụ́ṛụ́ sịndị́ne, do lóꞌbụ komoné bi, tónóne íni ini kɨ́dí, “Babá Lomo, togụ́ sịndị́ kadra utúasá go ne gɨ zɨ́yị yá, ndá lolụ ótoómo máa zɨ́ma ndúwúma wá. 
MRK.14.36	Babá, rokoꞌbụyị́ romo do ledre e za mbá, ídí ꞌdíꞌbióyó nduwú ba gɨ romá ꞌdáꞌba. Máúku amá née kɨ́dí ídí méngị ledre maꞌdáa káa zɨ́ bɨ máíli ní wá. Ledre bɨ yéme go yị́ị ní, ídí méngị dụụ́ wo.”
MRK.14.37	Zɨ́a ị́nyịné gɨ ore ndáꞌbalúgu roné zɨ́ ꞌyị lódụ́ kacɨ́ne ga bɨ ota née. Nɨ ógụ íri ní, nɨyí yị́ eyé go mbá ꞌdúꞌdu eyé. Zɨ́a ị́nyịné úku ledre zɨ́ Pétero kɨ́dí, “Simúna, ásé yị́ esé go mbá ꞌdúꞌdu esé, útúásásé esé ndị́sị dilá gba kɨ́ sịndị́ kadra kị́éꞌdo wá? 
MRK.14.38	Komosé idí ídí rosé, zɨ́se kpá ndị́sịsé íni ini zɨ́ Lomo káa bɨ ásé lúyú ledre ke. Lomo rosé ili tɨ́ go ní, tɨ́ lá cóngó rosé ndaá.”
MRK.14.39	Zɨ́a ị́nyịné kpá ndáꞌbalúgu roné íni ini zɨ́ Lomo, zɨ́a úku kpá té bɨkéṛị́ ledre bɨ gáa uku ꞌdáꞌdá ní. 
MRK.14.40	Zɨ́a ị́nyịné ndáꞌbalúgu roné zɨ́ ꞌyị lódụ́ kacɨ́ne e, zɨ́a ógụndíki yée kpá kɨ́ ꞌdúꞌdu eyé, gɨ zɨ́a, saná komoyé owó nda go mɨówó kɨ́ngaya. Ledre ndaá lolụ kóo tarayé zɨ́ye úku a zɨ́a wá.
MRK.14.41	Nda sɨmɨ ota (3) mɨndáꞌbaógụa, zɨ́a úku ledre zɨ́ye kɨ́dí, “Ásé aka yị́ esé kpá fú ꞌdúꞌdu esé? Asá go. Kadra ledre ogụ go. Lúrúsé aka, iꞌbínɨ́ máa, wo bɨ ogụ káa do ꞌyịmaꞌdí ní, go do sị́lị́ ꞌyị mɨlúyú ledre e. 
MRK.14.42	Ị́nyịógụsé mu zɨ́ze ndéréze. Lúrúsé aka ꞌyị bɨ nɨ íꞌbí máa zɨ́ ꞌyị ga ba ní, nɨ gɨrí go née.”
MRK.14.43	Sɨmɨ bɨ ngárá Yésụ ukuonzó aka ledre gɨ tarané wá ní, geré zɨ́ Yụ́da maꞌdáa bɨ ngúru ꞌyị lódụ́ kacɨ́ Yésụ ní, ógụyé kɨ́ tụ́ꞌdụ́ ꞌyị e rụụ kɨ́ maku okó e, kɨ́ ngbóndó e do sị́lị́ye. Manda ga bɨ ꞌbɨ ꞌyị ꞌdáná éyị́ e, ꞌyị ꞌdódo lorụ e, kɨ́ mɨngburoko ngére e ní, kasanɨ́ kóo yée ye gɨ ro ꞌdíꞌbi Yésụ.
MRK.14.44	Yụ́da uku gáa ledre go zɨ́ye kɨ́dí, “Tɨ́ lá ꞌyị bɨ mááyí fáka wo ní, née ꞌyị máa bɨ ásé ꞌdíꞌbi wo ní. Ídísé geré ꞌdíꞌbingéṛị wo, zɨ́se ndéré kɨ́e.”
MRK.14.45	Sɨmɨ bɨ Yụ́da ogụnɨ́ ní, zɨ́a ndéréne geré zɨ́ Yésụ ya zɨ́a ní, “ꞌYị ꞌdódo ledre,” zɨ́a ị́nyịné fáka wo. 
MRK.14.46	Geré née ní, zɨ́ye ị́nyịyé ꞌdíꞌbingéṛị Yésụ. 
MRK.14.47	Zɨ́ ngúru ꞌyị gɨ dongará ꞌyị lódụ́ kacɨ́ Yésụ maꞌdáa lálaógụ maku okó gɨ sɨmɨ siṛíkpa, zɨ́a ị́nyịné lágáꞌdécị mbílí ꞌyị moko ꞌbɨ mongụ́ ꞌyị ꞌdáná éyị́ tụ.
MRK.14.48	Yésụ ya zɨ́ye ní, “Ógụsé kɨ́ maku okó e, kɨ́ ngbóndó e gɨ ro ꞌdíꞌbi máa ní. Mááyí ꞌyị méngị bɨsinyí ledre e? 
MRK.14.49	Mááyí kɨ́se kɨ́ra kacɨ́ kadra mbá kɨ́ ndị́sị ꞌdódo ledre e zɨ́se do ligá ꞌDị́cị́ ꞌbɨ Lomo, ꞌdíꞌbisé nda kóo máa wá gɨ zɨ́ ꞌdi? Nɨ go méngị roné káa zɨ́ bɨ mɨéké kúrú Lomo uku ní.” 
MRK.14.50	Née ní, zɨ́ ꞌyị lódụ́ kacɨ́ga ụ́dụyé mbá ngásáye, zɨ́ye ótoómo wo kɨ́ ngúcuné do sị́lị́ ꞌyị ga bɨ ogụnɨ́ ꞌdíꞌbi wo ní.
MRK.14.51	Ngíti owụ́phɨṛangá nɨ kóo ore, onzó roné lá bongó mɨónzó, zɨ́a ị́nyịné lódụ́ Yésụ. Sɨmɨ bɨ ilinɨ́ nda kóo kpá gɨ ro ꞌdíꞌbi wo ní, 
MRK.14.52	zɨ́ mɨónzó bongó née líkpíne gɨ roa, zɨ́a ótoómo a cịkị kɨ́rɨ́ née, do ngásáne ngíṛá.
MRK.14.53	Née ní, zɨ́ ꞌyị ga bɨ kóo ꞌdiꞌbinɨ́ Yésụ ní, ị́nyịyé ndéréye kɨ́ Yésụ maꞌdáa ꞌbe ꞌbɨ mongụ́ ꞌyị ꞌdáná éyị́. Zɨ́ manda ga bɨ ꞌbɨ ꞌyị ꞌdáná éyị́ e, kɨ́ mɨngburoko ngére e, kpá kɨ́ ꞌyị ꞌdódo lorụ e yóko royé mbá íri. 
MRK.14.54	Abú ledre née nɨ kóo oꞌbụóꞌbụ ndotó, zɨ́ Pétero kóo ódó mɨmbéꞌdené, zɨ́a ndị́sịné kpá fú lódụ́ kacɨ́ Yésụ ndo ndo ndo gɨ ꞌdáꞌba gɨ ro zɨ́ne lúrú ledre bɨ ilinɨ́ méngị a kɨ́ Yésụ maꞌdáa ní. Sɨmɨ bɨ olụ́okpónɨ́ go kɨ́ Yésụ ꞌbe ꞌbɨ mongụ́ ꞌyị ꞌdáná éyị́ íri ní, zɨ́ Pétero maꞌdáa ólụ́úgu roné do ligá íri do ndéré ndị́sịné gɨ zɨ́ drụ́ ro phoꞌdụ dongará ꞌyị ga bɨ ꞌbɨ moko ore ní.
MRK.14.55	Zɨ́ manda ga bɨ ꞌbɨ ꞌyị ꞌdáná éyị́ e nda kɨ́ ngíti géyị mɨngburoko ꞌyị ꞌdécị ngbanga e ndị́sịyé gámásóꞌdo ledre bɨ zɨ́ye úkuóto a ro Yésụ gɨ ro zɨ́ye ꞌdíꞌbi wo úfu a ní, tɨ́ lá ledre bɨ kị́éꞌdo káa zɨ́ye ówo a ní ndaá. 
MRK.14.56	Sɨmɨ ledre ga gére née mbá, abú tụ́ꞌdụ́ ngíti géyị ꞌyị e ukuotonɨ́ ledre ro Yésụ maꞌdáa ndotó yá, ledre ga bɨ ukuotonɨ́ yée ní, nderénɨ́ eyé mbá cee kị́éꞌdo wá.
MRK.14.57	Zɨ́ ngíti géyị ꞌyị e úkuóto ꞌbɨ eyé kɨ́dí, 
MRK.14.58	“Uwúzé gɨ taraa kɨ́dí, née nɨ ndụ́rụónzó mongụ́ ꞌDị́cị́ ꞌbɨ Lomo bɨ bulúnduzé e ụbụ́nɨ́ ye ba, zɨ́ne ụ́bụ́lúgu a do biné dụụ́ sɨmɨ sị́lị́ ota, ꞌyị e ụbụ́nɨ́ ye wá.” 
MRK.14.59	Abú ukunɨ́ kenée ndotó, kúrúye nɨ kóo kpá fú kpị́kpị́kpị́.
MRK.14.60	Zɨ́ mongụ́ ꞌyị ꞌdáná éyị́ ị́nyịógụ tóroné kóꞌdụ́ye mbá, zɨ́a ndúꞌyú Yésụ, kɨ́dí, “Ledre ndaá tarayị́ zɨ́yị úku a kacɨ́ ledre ga bɨ ꞌyị ga gére née ukunɨ́ née wá?” 
MRK.14.61	Tɨ́ lá Yésụ ịtị ené wá.
MRK.14.61	Zɨ́ mongụ́ ꞌyị ꞌdáná éyị́ kpá ndúꞌyú ándá Yésụ kɨ́dí, “Áyí ba Kɨ́résịto, wo bɨ Lomo geléogụ wo go káa do Mbigí Owụ́ ꞌbɨ ené ní?”
MRK.14.62	Yésụ ya zɨ́a ní, “Ɨɨ, mááyí tɨ́ wo maꞌdíi, ásé gú lúrú Owụ́ ꞌbɨ ꞌYịmaꞌdí kɨ́ ndị́sị zɨ́ Lomo bɨ rokoꞌbụa ofụ go ní do anú, kpá kɨ́ ógụ gɨ komo ere kpụrụ́ gɨ sɨmɨ bụṛụngụ́.”
MRK.14.63	Geré zɨ́ mongụ́ ꞌyị ꞌdáná éyị́ ị́nyịné lófo bongó gɨ roné kɨ́ sɨmɨkesị́, zɨ́a úku ledre zɨ́ ꞌyị e kɨ́dí, “Éyị́ bɨ ilizé kpá fú úwú ledre gɨ zɨ́ ngíti géyị ꞌyị e gɨ roa ní ꞌdi 
MRK.14.64	bɨ uku tara sinyí go ro Lomo cụ́ kɨ́ tarané ya née nɨ Ngére Lomo ní. Sómụ́ ledre esé nɨ káa be ꞌdi?”
MRK.14.64	Zɨ́ye ị́nyịyé mbá úku ledre kɨ́dí, “Née ndaá ledre bɨ nɨyí ótoómo kɨ́ úfu wo gɨ zɨ́a ní wá, idínɨ́ úfu wo ꞌdáꞌba.”
MRK.14.65	Zɨ́ ngíti géyị tónóye ndị́sị lúbu súrú komoa, do ị́nyịyé ódóꞌdụ́tụ komoa kɨ́ bongó, do ócó wo, zɨ́ye úku ledre kɨ́dí, “Ambí ocó yị́ị née ne? Ị́fị́ aka ịrịa.” Zɨ́ ꞌyị óndó bi ga bɨ ore née ị́nyịyé kpá ócó wo.
MRK.14.66	Sɨmɨ bɨ Pétero nɨ aka kpá fú ndị́sị do ligá ore ro phoꞌdụ ní, zɨ́ owụ́kára ꞌyị ꞌbɨ moko bɨ ꞌbe ꞌbɨ mongụ́ ꞌyị ꞌdáná éyị́ ore ní, ógụné. 
MRK.14.67	Sɨmɨ bɨ lurúndiki Pétero ní, zɨ́a lúrú wo gbóó.
MRK.14.67	Zɨ́a úku ledre zɨ́ Pétero kɨ́dí, “Áyi, áyí ba tɨ́ ngúru ꞌyị gɨ dongará ꞌyị ga bɨ ꞌbɨ Yésụ ꞌyị ꞌbɨ Nazeréta ba ke.”
MRK.14.68	Zɨ́ Pétero úkulúgu ledre zɨ́ kára née kɨ́dí, “Úku née kenée ledre ꞌdi? Máówo amá oꞌdo née wá. Máówoꞌdíꞌbi amá kpá ledre gɨ sɨmɨ ledre bɨ áyí ndị́sị úku a née wá.” Zɨ́ Pétero ị́nyịné ndéréne mɨꞌdí ku mbotụ bɨ olụ́ogụ sága ní.
MRK.14.69	Gɨ do kacɨ́ a née ní, zɨ́ owụ́kára née kpá ị́nyịné ndéréne tara mbotụ íri, zɨ́a lúrúndíki Pétero kɨ́ tóro, zɨ́a ị́nyịné úku ándá ledre zɨ́ ꞌyị ga bɨ kóo ndịsịnɨ́ tóro ore ní kɨ́dí, “Nɨ kpá tɨ́ ngúru ꞌyị gɨ dongará ꞌyị ga bɨ ꞌbɨ Yésụ ní maꞌdíi.” 
MRK.14.70	Zɨ́ Pétero kpá ị́nyịné ítí kangú.
MRK.14.70	Do kacɨ́ ledre máa wo née akpa kpá wá, geré zɨ́ ꞌyị ga bɨ kóo ndịsịnɨ́ tóro ore ní, ị́nyịyé kpá úku ledre zɨ́ Pétero kɨ́dí, “Utúasá zɨ́yị ítí kangú yá née ndaá ꞌyị ꞌbɨ Yésụ wá ní wá, gɨ zɨ́a, owozé kpá tɨ́ bú áyí ꞌyị ꞌbɨ Galiláya.”
MRK.14.71	Née ní, zɨ́ Pétero tónóne lólóbụ́ kɨ́dí, “Togụ́ ledre bɨ máúku ba ndaá maꞌdíi ledre wá, Lomo idí íꞌbí mongụ́ ꞌdoꞌdó zɨ́ma. ꞌYị bɨ ndị́sịsé úku ledre gɨ roa née, máówo amá wo kú wá.”
MRK.14.72	Geré née ní, zɨ́ oꞌdo ngono ụ́cụ koko zɨ́ Pétero sómụ́ndíki ledre bɨ Yésụ uku zɨ́a kɨ́dí, “Karaba kɨ́ ndụlụ kɨ́ꞌdí bɨ ngono ụcụ aka koko kɨ́ꞌdí gbre wá ní, áyí ítí kangúma kɨ́ꞌdí ota yá, née owo ené máa wá.” Zɨ́ mongụ́ sɨmɨkozo méngị Pétero, zɨ́a útúne geré ndị́sịné íni ini.
MRK.15.1	Akpa kɨ́ phịyị́, zɨ́ manda ga bɨ ꞌbɨ ꞌyị ꞌdáná éyị́ e ní, mɨngburoko ꞌyị e kpá kɨ́ ꞌyị ꞌdódo lorụ ga bɨ ꞌbɨ Mụ́sa ní, nda kɨ́ mɨngburoko ꞌyị ꞌdécị ngbanga e, yóko royé za mbá gɨ ro yéme ledre kị́éꞌdo. Zɨ́ye ị́nyịyé ódó Yésụ, zɨ́ye ꞌdíꞌbi wo ndéréye kɨ́e kóꞌdụ́ Piláto.
MRK.15.2	Sɨmɨ bɨ ogụnɨ́ kɨ́ Yésụ íri ní, zɨ́ Piláto ndúnduꞌyú kɨ́dí, “ꞌYị ga ba ukunɨ́ ya úku ledre yá née nɨ mongụ́ ngére ꞌbɨ Yụ́da e. Áyí tɨ́ mongụ́ ngére ꞌbɨ Yụ́da e maꞌdíi?”
MRK.15.2	Yésụ ya zɨ́a ní, “Kpá tí káa zɨ́ bɨ úku née.”
MRK.15.3	Zɨ́ manda ga bɨ ꞌbɨ ꞌyị ꞌdáná éyị́ e ní úkuóto tụ́ꞌdụ́ ledre e roa. 
MRK.15.4	Zɨ́ Piláto kpá ị́nyịné ndúꞌyú wo kɨ́dí, “Ledre ndaá tarayị́ zɨ́yị úku a kacɨ́ ledre ga bɨ ndịsịnɨ́ trótro yée ba wá? Lúrú aka tụ́ꞌdụ́ ledre ga bɨ ndịsịnɨ́ úku yée ba.”
MRK.15.5	Yésụ uku ené ledre kacɨ́ ledre ga gére née zɨ́a mbá wá, zɨ́ ledre née lụ́tụ́ne kacɨ́ komo Piláto gbála.
MRK.15.6	Sɨmɨ kadra Ayímbi Umbuokpó, Piláto ndịsị lengbe ótoómo ꞌyị bɨ ꞌyị e nduꞌyúnɨ́ wo gɨ roa gɨ sɨmɨ sị́gịnị ní. 
MRK.15.7	Sɨmɨ sịndị́ kadra máa née ní, ngíti oꞌdo nɨ kóo bo sɨmɨ sị́gịnị ore kɨ́ ịrịné Barába. Wo kɨ́ ngíti géyị lafúne ꞌdiꞌbi kóo yée gɨ zɨ́a ufunɨ́ ꞌyị e sɨmɨ bɨ tụ́ꞌdụ́ ꞌyị e yokonɨ́ royé ndị́sị gbúrógbóye kɨ́ ndị́sị méngị ledre bɨ utúasá wá ní. 
MRK.15.8	Zɨ́ tụ́ꞌdụ́ ꞌyị ga bɨ yokonɨ́ royé ní ógụyé ndúꞌyú Piláto gɨ ro zɨ́a íꞌdí sị́lị́ne gɨ ro kémbị́ ꞌyị gɨ sɨmɨ sị́gịnị káa zɨ́ bɨ lengbe ndịsị méngị a ní.
MRK.15.9	Zɨ́ Piláto ndúꞌyú yée kɨ́dí, “Ílisé zɨ́ma ótoómo zɨ́se ngére bɨ ꞌbɨ Yụ́da e ní?” 
MRK.15.10	Piláto owo bɨ kɨ́dí manda ga bɨ ꞌbɨ ꞌyị ꞌdáná éyị́ e ní, ogụnɨ́ kɨ́ Yésụ zɨ́ne gɨ zɨ́a bɨ otonɨ́ bɨsinyí mɨmbéꞌdeyé roa. 
MRK.15.11	Zɨ́ manda ga bɨ ꞌbɨ ꞌyị ꞌdáná éyị́ e ní úku ledre, ꞌyị e idínɨ́ úku ledre zɨ́ Piláto idí ótoómo Barába gɨ sɨmɨ sị́gịnị.
MRK.15.12	Zɨ́ Piláto kpá ị́nyịné ndúꞌyú yée kɨ́dí, “Máídí nda méngị kɨ́ Yésụ bɨ ndị́sịsé ndólo wo mongụ́ ngére ꞌbɨ Yụ́da e ní ꞌdi?”
MRK.15.13	Zɨ́ye ị́nyịyé ótrụ́lúgu ledre zɨ́ Piláto kɨ́dí, “Oꞌdo née idí úyu, idínɨ́ phéphé wo do mɨngbúngbu kágá, zɨ́a úyuné ꞌdáꞌba.”
MRK.15.14	Piláto ya zɨ́ye ní, “Bɨsinyí ledre bɨ mengị wo ní, nɨ ꞌdi?”
MRK.15.14	Tɨ́ lá otrụ́tatánɨ́ ledre nda ꞌdáꞌdá kɨ́dí, “Ídí phéphéónzo wo do mɨngbúngbu kágá.”
MRK.15.15	Piláto ili kóo méngị ꞌyị ga gére née gɨ ro zɨ́ bi émené royé, zɨ́a ị́nyịné ótoómo Barába zɨ́ye. Zɨ́a úku ledre zɨ́ asikíri ené e ócó Yésụ bɨsinyíne, do ꞌdíꞌbi wo ndéré phéphéónzó a.
MRK.15.16	Zɨ́ asikíri ga gére née nda ꞌdíꞌbi Yésụ gɨ ore ndéré kɨ́e ꞌbe ꞌbɨ ngére, zɨ́ye ị́nyịyé ndóloyóko royé mbá do ídíye tụ́ꞌdụ́ íri. 
MRK.15.17	Zɨ́ye ésị mɨgbagbawu bongó ro Yésụ, zɨ́ye kpá kụ́ṛókụ́ kị́nị zɨ́ye ésị a ro do Yésụ. 
MRK.15.18	Née ní, zɨ́ye tónóye ndị́sị lágá sị́lị́ye zɨ́a kɨ́ ledre kɨ́dí, “Sɨmɨbi idí ídí doyị́ tụ́ꞌdụ́, mongụ́ ngére ꞌbɨ Yụ́da e.” 
MRK.15.19	Zɨ́ye ndị́sịyé kɨ́ ócó doa kɨ́ ngbángbá, kpá kɨ́ lúbu súrú komoa, zɨ́ye útúye do ngụ́ṛụ́ sịndị́ye, ndị́sịyé fóló wo kɨ́dí, yée otonɨ́ née úndrua. 
MRK.15.20	Sɨmɨ bɨ folo asánɨ́ nda wo go ní, zɨ́ye ị́nyịyé íꞌdíógụ ngbángbá mɨgbagbawu bongó bɨ esịnɨ́ gáa roa ní, do ị́nyịyé ésịlúgu mbigí bongó ené roa. Zɨ́ye nda ị́nyịyé ólụ́ógụ kɨ́e gɨ ro ndéré kɨ́e kɨ́ꞌdí bi bɨ ilinɨ́ phéphé wo doa ní.
MRK.15.21	Sɨmɨ bɨ asikíri ga gére née nɨyí go mɨndéréye do mɨsiꞌdi kɨ́ Yésụ ní, zɨ́ye ndíkíye kɨ́ ngíti oꞌdo do mɨsiꞌdi ịrịa Simúna, oꞌdo máa née nɨ ꞌyị ꞌbɨ gara bɨ ꞌyị e ndịsịnɨ́ ndólo a Kuréne ní. Simúna maꞌdáa nɨ ꞌbụ Alakɨzánde e kɨ́ Rụ́fụ. Nɨ kóo go ólụ́ sɨmɨ Yerụsaléma. Zɨ́ asikíri ga gére née gága wo ị́mbị́ mɨngbúngbu kágá bɨ Yésụ ịmbị́ née. 
MRK.15.22	Zɨ́ye ógụyé kɨ́ Yésụ do bi bɨ ndịsịnɨ́ úfu ꞌyị e doa ní, ndolonɨ́ Gologóta, ledre gɨ sɨmɨ a kɨ́dí, cóngó doꞌyị. 
MRK.15.23	Nda íri, zɨ́ye ị́nyịyé íꞌbí leꞌyị́ kóṛó bɨ kotrụnɨ́ kɨ́ ngíti kágá ní zɨ́ Yésụ, gɨ ro zɨ́a éwé a gɨ ro zɨ́ okó éyị́ mɨówo ụ́kụ́ne gɨ roa, zɨ́a ási ené kɨ́ éwé a. 
MRK.15.24	Née ní, zɨ́ye íꞌdíógụ bongó ené, zɨ́ye ị́nyịyé phéphé wo do mɨngbúngbu kágá máa née, zɨ́ye sị́kpị wo kɨ́e ꞌdága, zɨ́ye ónzó gbégbé ífibáyi bongó ené e kɨ́e dongaráye.
MRK.15.25	Ledre máa née mengị kóo roné sɨmɨ sịndị́ kadra ịnyị doa eso kɨ́ phịyị́. 
MRK.15.26	Zɨ́ye ị́nyịyé éké ledre bɨ kóo ufunɨ́ wo gɨ roa ní, do phéphéóto a doa ꞌdága kɨ́dí, “Ba, mongụ́ ngére ꞌbɨ Yụ́da e.” 
MRK.15.27+MRK.15.28	Phephénɨ́ kóo yée kɨ́ ꞌyị ugu e gbre, ngíti a do sị́lị́a ꞌbɨ anú, ngíti a do ngelị.
MRK.15.29	ꞌYị ga bɨ kóo ndịsịnɨ́ ókpó kacɨ́ mɨsiꞌdi gɨ ore ní, zɨ́ye ndị́sịyé úku wo kpá kɨ́ úkucáyi ledre gɨ do bi a kɨ́dí, “Bɨ kóo úku yá áyí ndụ́rụ mongụ́ ꞌDị́cị́ ꞌbɨ Lomo, zɨ́yị ụ́bụ́lúgu a lá sɨmɨ sị́lị́ ota ní, 
MRK.15.30	ékị́ógụ nda lolụ gɨrí zɨ́yị yómo royị́ wá gɨ zɨ́ ꞌdi?”
MRK.15.31	Zɨ́ manda ga bɨ ꞌbɨ ꞌyị ꞌdáná éyị́ e, kɨ́ ꞌyị ꞌdódo lorụ e ndị́sịyé kpá fóló wo kɨ́dí, “Ndịsị kóo lá yómo ngíti géyị ꞌyị e ní, yomo nda lolụ roné wá? 
MRK.15.32	Káa zɨ́ bɨ nɨ wo bɨ Lomo geléogụ wo káa do Kɨ́résịto, mongụ́ ngére ꞌbɨ Isɨréle e ní, idízé aka lúrú a, togụ́ ekị́ogụ gɨ do kágá gɨrí go cakaba bi yáa yá, azé geré ṇgúṇgu wo.” ꞌYị ga bɨ kóo gbre phephénɨ́ yée kɨ́ Yésụ e ní, ndịsịnɨ́ kóo kpá úku wo.
MRK.15.33	Sɨmɨ bɨ kóo kadra nɨ nda go kpíkpíṛíkpí sɨmɨ do ní, zɨ́ mụtụlụrụ útúne do káṇgá mbá kɨ́ sịndị́ kadra ota. 
MRK.15.34	Sɨmɨ bɨ sịndị́ kadra ota ogụ nda go ní, zɨ́ Yésụ ị́nyịné íni ini ꞌdága kɨ́dí, “Ilóyi, Ilóyi, Lị́ma sabákatani?” Ledre gɨ sɨmɨ a kɨ́dí, “Lomo amá, Lomo amá, ótoómo máa gɨ zɨ́ ꞌdi?”
MRK.15.35	Zɨ́ ngíti géyị ꞌyị ga bɨ ore ní, ị́nyịyé úwú doa, zɨ́ye úku ledre kɨ́dí, “Úwúsé aka, nɨ go ndólo nébị Ilíya.”
MRK.15.36	Née ní, zɨ́ ngúru ꞌyị gɨ dongaráye ị́nyịné ngásáne ꞌdíꞌbi éyị́ káa zɨ́ katúu ní, zɨ́a ónzó a bu sɨmɨ mɨndógó leꞌyị́ kóṛó, zɨ́a ésị a do kágá, zɨ́a sị́kpị a, óto a tara Yésụ ꞌdága íri. Zɨ́a úku ledre zɨ́ lafúne e kɨ́dí, “Ndị́sịsé aka tí, zɨ́ze lúrú a togụ́ Ilíya nɨ gɨrí ógụ gɨ ro ị́mbị́óto wo bi yá.”
MRK.15.37	Zɨ́ Yésụ íni ini kɨ́ mongụ́ kúrúne ꞌdága, geré zɨ́a ótoómo ꞌdówụ́ne.
MRK.15.38	Née ní geré zɨ́ mongụ́ mbílí bongó bɨ ingí ꞌdecịnɨ́ sɨmɨ ꞌDị́cị́ ꞌbɨ Lomo kɨ́e ní, lófo ífi sɨmɨné gberé gbre kú gɨ ꞌdága gị bi. 
MRK.15.39	Sɨmɨ bɨ mongụ́ ꞌyị ꞌbɨ asikíri e
MRK.15.40	Ngíti géyị kará e nɨyí kóo kpá ore, ndị́sị lúrúkása bi gɨ gbála, Maríya Magɨdála kɨ́ Salóme kɨ́ Maríya mbágá Yoséfa kɨ́ Yakóbo owụ́, nɨyí kóo bo dongaráye. 
MRK.15.41	Utúnɨ́ kóo do kacɨ́ Yésụ kú gɨ sɨmɨ káṇgá bɨ Galiláya ní kóo kɨ́ ị́nyị kasa zɨ́a. Tụ́ꞌdụ́ ngíti géyị kará ga bɨ kóo ogụnɨ́ kɨ́ Yésụ sɨmɨ Yerụsaléma ní, nɨyí kóo kpá mbá ore.
MRK.15.42	Nda kóo go za kɨ́ tagá sɨmɨ sịndị́ kadra bɨ ꞌyị e ndịsịnɨ́ yéme royé gɨ ro Sị́lị́ ꞌbɨ ꞌDówụ́ro ní, 
MRK.15.43	zɨ́ ngíti oꞌdo kɨ́ ịrịné Yoséfa gɨ sɨmɨ gara bɨ Aramatáyo ódó mɨmbéꞌdené káa zɨ́ oꞌdo ꞌyị ní, zɨ́a ndéréne ndúꞌyú Piláto gɨ ro umbu Yésụ. Yoséfa nɨ ngúru ꞌyị gɨ dongará mɨngburoko ꞌyị ꞌbɨ Yụ́da e. Ndịsị kpá óto komoné gɨ ro mɨógụ Lomo káa do ngére do ꞌyịmaꞌdí e.
MRK.15.44	Sɨmɨ bɨ Piláto uwú kɨ́dí, Yésụ uyu go ní, zɨ́ tara a ị́drị́ne mɨị́drị́, zɨ́a úku ledre kɨ́dí, “Née kenée lárá ledre ꞌdi, bɨ zɨ́ oꞌdo née úyuné lá ꞌdiya kenée ní?” Zɨ́a ndóloógụ mongụ́ ꞌyị ꞌbɨ asikíri e gána ní ndúꞌyú wo togụ́ Yésụ uyu tɨ́ go maꞌdíi yá. 
MRK.15.45	Sɨmɨ bɨ Piláto uwú ya Yésụ uyu tɨ́ go maꞌdíi ní, zɨ́a ị́nyịné úku ledre zɨ́ Yoséfa kɨ́dí, “ꞌDíꞌbi umbu Yésụ maꞌdáa mu ndéré óto a.” 
MRK.15.46	Zɨ́ Yoséfa úgú bɨlámá bɨkenyị́ mbílí bongó, zɨ́ye ꞌdíꞌbiógụ umbu Yésụ, óto a sɨmɨ a, zɨ́ye ndéréye óto wo sɨmɨ bi bɨ kóo icinɨ́ kacɨ́ ondụ́ eyé sɨmɨ landa ní. Zɨ́ye gbụ́ṛụ́gbụóto mongụ́ tutú ngbụtụrụ́ tara bi maꞌdáa. 
MRK.15.47	Maríya Magɨdála, kɨ́ Maríya mbágá Yoséfa e ndịsịnɨ́ kóo lúrúkása bi bɨ otonɨ́ Yésụ maꞌdáa doa ní.
MRK.16.1	Gɨ do kacɨ́ Sị́lị́ ꞌbɨ ꞌDówụ́ro, zɨ́ Maríya Magɨdála, kɨ́ Salóme, kɨ́ Maríya mbágá Yakóbo e úgú sụꞌbụ́ mɨndonyo e gɨ ro ndéré sụ́sụ a ro umbu Yésụ.
MRK.16.2	Akpa kɨ́ phịyị́ sɨmɨ sị́lị́ gɨ do kacɨ́ Sị́lị́ ꞌbɨ ꞌDówụ́ro sɨmɨ bɨ sụ́lụ́ kadra nɨ go ꞌdága ní, zɨ́ye ị́nyịyé ndéréye sị́ bi. 
MRK.16.3	Kɨ́ ndéréye do mɨsiꞌdi, zɨ́ye ndúꞌyú royé dengbị́ye kɨ́dí, “Ambí nɨ laká gbụ́ṛụ́gbụóyó mongụ́ tutú karaba zɨ́ze gɨ tara bi ne?”
MRK.16.4	Tɨ́ lá sɨmɨ bɨ nɨyí lúrú bi káa ní, zɨ́ye ówo a kɨ́dí gbụṛụgbụ oyónɨ́ mongụ́ tutú née go ꞌdáꞌba. 
MRK.16.5	Sɨmɨ bɨ kará ga gére née olụ́nɨ́ sɨmɨ bi íri ní, zɨ́ye ónzó komoyé káa gbó ro owụ́phɨṛangá kɨ́ ndị́sị sɨmɨ bi íri do sị́lị́ ꞌbɨ anú, kɨ́ ngbángbá bɨkenyị́ bongó roné. Zɨ́ Lomo royé lị́yịné, zɨ́ tarayé ị́drị́ne mbá mɨị́drị́, gɨ zɨ́ lárá ledre káa zɨ́ wo née.
MRK.16.6	Geré zɨ́ owụ́phɨṛangá née úku ledre zɨ́ye kɨ́dí, “Ɨꞌɨ, ndásé lị́yị wá, máówo bú kɨ́dí, ógụsé ba lúrú bi gɨ ro Yésụ ꞌyị ꞌbɨ Nazeréta bɨ ufunɨ́ wo ní. Ndaá ꞌbɨ ené lolụ kɨ́ra wá, urú yị́ ené gɨ sɨmɨ umbu go. Lúrúsé aka lá, ba bi bɨ kóo otonɨ́ wo doa ní. 
MRK.16.7	Ndérésé mu cakaba úku a zɨ́ Pétero e, kɨ́ lafúne e ꞌyị lódụ́ kacɨ́ Yésụ kɨ́dí, ‘Yésụ maꞌdáa nɨ ndéréụ́tụ roné fị ne ꞌdáꞌdá zɨ́se sɨmɨ káṇgá bɨ Galiláya ní, ásé nda ógụndíki wo geré íri káa zɨ́ bɨ kóo uku zɨ́se ní.’ ”
MRK.16.8	Née ní, zɨ́ye ólụ́ógụyé gɨ sɨmɨ bi mɨlángbayé gɨ zɨ́ ngịrị, geré zɨ́ye tónóye ngásáye. Ukuꞌdodonɨ́ kóo ledre máa née zɨ́ ꞌyị e do mɨsiꞌdi mbá wá.
MRK.16.8	Odụ ledre bɨ Márɨko ekéne kɨ́ sị́lị́ne ní.
MRK.16.9	Sɨmɨ sị́lị́ gɨ do kacɨ́ Sị́lị́ ꞌbɨ ꞌDówụ́ro bɨ Yésụ urú gɨ sɨmɨ umbu sɨmɨ a akpa kɨ́ sị́ ndóndó ní, zɨ́a ꞌdódoụ́tụ roné zɨ́ Maríya Magɨdála, bɨ kóo Yésụ lagaogụ dokéké e ịnyị doa gbre (7) gɨ sɨmɨa ní. 
MRK.16.10	Zɨ́ Maríya maꞌdáa ị́nyịné ndéréne úku ꞌdódo a zɨ́ ezegámáne e, ꞌyị lódụ́ kacɨ́ Yésụ ga bɨ kóo nɨyí ꞌbɨ eyé ndị́sị íni Yésụ maꞌdáa ní. 
MRK.16.11	Sɨmɨ bɨ uwúnɨ́ gɨ taraa kɨ́dí Yésụ urú gɨ sɨmɨ umbu go, née lurú gáa wo go trịdrị cụ́ kɨ́ komoné ní, ṇguṇgunɨ́ eyé kóo ledre máa née wá.
MRK.16.12	Gɨ do kacɨ́ a née, zɨ́ Yésụ kpá ꞌdódo roné sɨmɨ ngíti tosoné kpị́ zɨ́ ꞌyị lódụ́ kacɨ́ne ga bɨ kóo gbre, sɨmɨ bɨ nɨyí mɨndéréye do mɨsiꞌdi gɨ sɨmɨ gara ní. 
MRK.16.13	Zɨ́ye ndáꞌbalúgu royé sɨmɨ Yerụsaléma, zɨ́ye úku ꞌdódo ledre née zɨ́ lafúye e, tɨ́ lá a ṇguṇgunɨ́ eyé kóo ledre máa née kpá wá.
MRK.16.14	Nda gɨrí, sɨmɨ bɨ ꞌyịmɨkása ga bɨ sokó doa kéṛị́ (11) née ndịsịnɨ́ ánu éyị́ ní, zɨ́ Yésụ ꞌdódo roné zɨ́ye, zɨ́a úku ledre zɨ́ye, gɨ zɨ́a do ngíti géyị lafúye e orụ yị́ ené kóo mɨórụ kɨ́ ṇgúṇgu ledre ꞌbɨ lafúye ga bɨ lurúnɨ́ trịdrịné go cụ́ kɨ́ komoyé ní.
MRK.16.15	Nda née ní, zɨ́ Yésụ maꞌdáa úku ledre zɨ́ye kɨ́dí, “Ndérésé mu kacɨ́ bi e za mbá kɨ́ úku bɨlámá ledremá zɨ́ ꞌyị e za mbá. 
MRK.16.16	ꞌYị bɨ ṇguṇgu ledremá go ní, zɨ́se bábátị́zị́ wo, nɨ gú ómo gɨ sɨmɨ ꞌdoꞌdó bɨ odụa nda ní. ꞌYị bɨ ṇguṇgu wá ní, nɨyí ꞌdóꞌdo wo. 
MRK.16.17	Zɨ́ ꞌyị ga bɨ ṇguṇgunɨ́ go ní, ídíye kɨ́ rokoꞌbụ káa zɨ́ bɨ nɨyí go ꞌyị amá e ní, zɨ́ye kɨ́ ódroyé sɨmɨ ṛị́kị́ tara e kɨ́ ndị́sị lágaóyó dokéké e gɨ sɨmɨ ꞌyị e kɨ́ ịrịmá. 
MRK.16.18	Abú ꞌdiꞌbinɨ́ kámá okó kɨ́ sị́lị́ye, abú ewénɨ́ ngónụ́ kémbị́ éyị́ mengị yée wá. Nɨyí óto sị́lị́ye ro ꞌyị ndíyá e, zɨ́ ndíyá eyé ụ́kụ́ne.”
MRK.16.19	Sɨmɨ bɨ Yésụ ukuonzó ledre go zɨ́ye ní, zɨ́ Lomo nda ꞌdíꞌbilúgu wo ꞌbe ꞌbɨ ené komo ere, zɨ́a ndị́sịné do sị́lị́ anú ꞌbɨ Lomo káa do mongụ́ ngére.
