MAT.1.1	ዳዉቴ ና፥ ኣብራሃሜ ና ጊዲዳ ዬሱስ ኪርስቶሳ ዬሌቴꬃ ዛርኬይ ሃይሳፌ ካሊዛይሳ፤
GAL.4.25	ሄሳ ጊሽ ኣጋራ ኣራቤ ቢታን ዲዛ ሲና ዙማ ጊሽ ጊዳዳ ሃዒ ዲዛ ዬሩሳላሜ ካታማዮ ሚሳታዉስ፤ ኢዛ ባ ናይታራ ኣይሌቴꬃን ዳዉስ። 
GAL.4.26	ፑዴ ቦላ ሳሎን ዲዛ ዬሩሳላሜይ ጊዲኮ ጎቃ ጊዳዳ ዳዉስ፤ ኢዛካ ኑ ኣዮ። 
GAL.4.27	“ኔኒ ዬሎንታ ማካራዬ ኡፋዬታ! ሃኔ ሚፃታ ኤሮንታሬ! ‘ኢሊሊ’ ጋ ዋሳ፤ ኣዚናይ ዲዛሪፔ ኣዚናይ ባይንዳሪ ናይቲ ዳሪዳ” ጌቴቲ ጌሻ ማፃፋን ፃፌቲዴስ። 
GAL.4.28	ሄሳ ጊሽ ታ ኢሻቶ! ኢንቴካ ዪሳቃ ማላ ኡፋይሳ ቃላ ናይታኮ። 
GAL.4.29	ኣሾ ሼኔ ማላ ዬሌቲዳይሲ ኣያና ዎልቃን ዬሌቲዳይሳ ጎዲዴስ፤ ሃዒካ ጎዴꬆን ዴስ። 
GAL.4.30	ጊዶ ኣቲን ጌሻ ማፃፋይ ቃሴ ኣይ ጊዜ? “ኣይሌዮ ኢዚ ናዛራ ዲጋ፤ ኣይሌ ናይ ጎቃይ ናራ ላቴና” ጌስ። 
GAL.4.31	ሄሳ ጊሽ ታ ኢሻቶ! ኑኒ ጎቃይ ናይታ ኣቲን ኣይሌ ናይታ ጊዶኮ።
GAL.5.1	ኑና ኪርስቶሲ ጌሺዳይ ኑኒ ጌሻቴꬃን ዳናሳ። ሄሳ ጊሽ ሚኒ ኤቂቴ፤ ናምዓንꬆ ኣይሌቴꬃ ቃምባራን ጌሎፒቴ። 
GAL.5.2	ታ ኢንቴስ ጊዛይሳ ዎዝናን ዎꬂቴ፤ ኢንቴ ቃፃሬታና ኮይኮ ኪርስቶሲ ኢንቴና ኣይኔ ጎዔና ጋዳ ታ ጳዉሎሲ ኢንቴስ ዮታይስ። 
GAL.5.3	ቃፃሬታና ኮዪዛይቲ ዉሪ ዎጋ ዉርሲ ፖላናይሲ ዶሳ ጊዶንታይሳ ታ ኢንቴስ ኢሳስ ኢሳስ ቆንጬን ዮታይስ። 
GAL.5.4	ኢንቴኖ! ዎጋ ናጎን ፂላና ዋይቲዛይቶ፤ ኢንቴ ኪርስቶሳፔ ሻኬቲዴታ፤ ኢዛ ኪያቴꬃፌካ ሃኪዴታ። 
GAL.5.5	ኑ ቃስ ኡፋይሳ ናጌቲዛ ፂሎቴꬃ ፆሳ ኣያና ባጋራ ኣማኖን ላሞቴꬃን ናጎን ዶስ። 
GAL.5.6	ኣሲ ዬሱስ ኪርስቶሳን ዲኮ ቃፃሬቲን ዎይኮ ቃፃሬቶንታ ኣጊን ኣይኔ ጎዔና፤ ጎዓይ ዲዛይ ሲቆን ቆንጪዛ ኣማኖን ፃላ።
GAL.5.7	ካሴ ሎዖ ዎꬅ ዎፄታ ሺን፤ ሃዒ ኢንቴስ ꬉጴ ጊዲዲ ቱማስ ኢንቴ ኣዛዜቶንታ ማላ ኢንቴና ዲጊዳይ ኦኔ? 
GAL.5.8	ሄሳ ማላ ባሌꬆይ ኢንቴና ፄይጊዳ ፆሳፌ ጊዴና። 
GAL.5.9	“ጉꬃ ኢርሾይ ሊፄ ዉርሲ ዴንꬄስ” ጌቴቲዛ ማላ። 
GAL.5.10	ኢንቴስ ሃራ ቆፋይ ዴና ጋዳ ታኒ ጎዳን ኣማኔታይስ፤ ኢንቴስ ቲኪ ጊዛዝ ኦꬂዛይ ኦና ጊዲኮኔ ኢዚ ባ ፒርዳ ኤካና።
GAL.5.11	ታ ኢሻቶ! ሃኖ ጋካናስ ታ ሳባኪዛይሲ ኣሲ ኣታናስ ቃፃሬታና ቤሴስ ጊዛዝ ጊዲዳኮ ሂስቲን ሃኖ ጋካናስ ኣዛስ ታና ጎዲዞ? ሄሳ ማላ ጊዲዳኮ ኪርስቶሳ ማስቃሌይ ኣሳስ ꬉጴ ጊዴናኮሺን። 
GAL.5.12	ኢንቴስ ቲኪ ጊዛዝ ኦꬂዛ ኣሳቲ ጮ ዎጋራ ቃፃሬቴꬅ ኣጊዲ ሙሌራ ቃንፂ ዬጌቶ። 
GAL.5.13	ታ ኢሻቶ! ኢንቴ ጌሻቴꬃስ ፄይጌቲዴታ፤ ኢንቴ ኢንቴ ጌሻቴꬃ ዛሪዲ ኢንቴስ ኣሾ ኣሞ ፖላናስ ጎዔቶፍቴ። ሄሳፌ ኢንቴ ኢንቴ ጋርሳን ሲቆን ኢሶይ ኢሳ ማዲቴ። 
GAL.5.14	ዎጋይ ዉሪ ሺቄቲዲ ኢሲ ቃላን ቃሼቴስ፤ ሄሲካ “ኔኒ ኣሴ ኔ ማላ ዶሳ!” ጊዛይሳ። 
GAL.5.15	ጊዶ ኣቲን ኢንቴ ኢሶይ ኢሳራ ሳፄቲዛይታ ጊዲኮ ኢንቴ ኢንቴ ጋርሳን ዉሮንታ ማላ ናጌቲቴ።
GAL.5.16	ሄሳ ጊሽ ታ ኢንቴና ኣያናን ሲሜሬቲቴ፤ ቃሴካ ኣሾ ኣሞካ ፖሎፒቴ ጋይስ። 
GAL.5.17	ኣሾይ ኣያናይ ኮዮንታዝ ኣሞቴስ። ኣያናይካ ኣሾይ ኮዮንታዝ ኣሞቴስ፤ ሃይቲ ኢሶይ ኢሳራ ባ ጋርሳን ኢፄቲዛ ጊሽ ኢንቴ ኢንቴ ኮይዳ ማላ ኦꬄኬታ። 
GAL.5.18	ኢንቴ ኣያናን ዲዛይታ ጊዲኮ ዎጋስ ሃሬቲዛይታ ጊዴኬታ።
GAL.5.19	ኣሾ ኦሶይ ቆንጬን ኤሬቴስ፤ ሄሲካ ላይማቴꬅ፥ ቱናቴꬅ፥ ላይማ ካስ፥ 
GAL.5.20	ኤቃስ ጎይኖ፥ ቢታ፥ ኢፄቴꬅ፥ ኦሽ፥ ቃናቴቴꬅ፥ ሃንቆ፥ ባና ፃላ ዶሶ፥ ሻኬቴꬅ፥ ዙፔቴꬅ፥ 
GAL.5.21	ቃናቴቴꬅ፥ ማꬆቴꬅ፥ ኣላሜ ዬꬅ ዬፄꬂኔ ሄይታንታ ሚሳቲዛይታ። ታኒ ኢንቴስ ካሴ ዮቲዳ ማላ ሃዒካ ኢንቴ ናጌታና ማላ ቆፊሳይስ። ሄሳ ማላ ዱስ ዲዛይቲ ዉሪካ ፆሳ ካዎቴꬅ ላቴቴና።
GAL.5.22	ኣያና ኣይፌይ ጊዲኮ ሲቆ፥ ኡፋይስ፥ ሳሮቴꬅ፥ ዳንዳያ፥ ኪያቴꬅ፥ ሎዔቴꬅ፥ ኣማኔቴꬅ፥ 
GAL.5.23	ኣሽኬቴꬅ፥ ባርካ ባና ሃሮ፤ ሃይታንታ ማላ ዲጊዛ ዎጋይ ባዋ። 
GAL.5.24	ዬሱስ ኪርስቶሳስ ጊዲዳይቲ ኣሾ ኢዛ ኢታ ቆፋራኔ ኢዛ ኢታ ኣሞቴꬃራ ኢሲፌ ካቂዳ። 
GAL.5.25	ኑ ኣያናን ዳና ኮይኮ ኣኔ ኣያናን ሲሜሬቶስ። 
GAL.5.26	ኑኒ ኢሶይ ኢሳ ኢታስ ዴንꬄꬂሼኔ ቃናቴቲሼ ጮ ሜላ ጬቄቲዛይሳ ኣኔ ኣጎስ።
GAL.6.1	ታ ኢሻቶ! ኢሲ ኣሲ ናጋራ ኦꬂ ቤቲኮ ኢንቴ ቃስ ኣያናን ሎዖ ዲዛይቲ ኢዛ ኣሺኬቴꬃራ ዛራናስ ቤሴስ፤ ጊዶ ኣቲን ኔካ ኢዛዴ ማላ ፓጬቶንታ ማላ ኔ ሁዔስ ናጌታ። 
GAL.6.2	ኢንቴ ኢሶይ ኢሳ ዴፆ ቶሆ ቶኪቴ፤ ሄሳ ማላ ኦሶን ኪርስቶሳ ዎጋ ፖሌታ። 
GAL.6.3	ኢሳዴይ ኣይኔ ሃኖንታ ዲሼ ባና ጊታሲዛ ሚሳቲኮ ሄሳዴይ ባርካ ባና ባሌꬄስ። 
GAL.6.4	ኢሲ ኢሲ ኣሲ ባ ኦሶ ባርካ ፓጪ ፄሎ። ሄሳፌ ጉዬ ሃራ ኣሳራ ባና ጊናሶንታ ዲሼ ኢዚ ባና ጬቂሲዛዚ ዴማና። 
GAL.6.5	ኢሲ ኢሲ ኣሲ ባርካ ባ ቶሆ ቶካናስ ቤሴስ።
GAL.6.6	ቃላ ታማሪዛይ ኦኒካ ባ ታማሪዳ ሎዖ ሚሻ ባ ኣስታማሬዛራ ጊሼቶ።
GAL.6.7	ባሌቶፍቴ ፆሲ ቂሊጫ ኤሬና። ኣሲ ባ ዜሪዳሮ ኢዞ ዛሪ ማፃና። 
GAL.6.8	ባ ኣሾ ኣሞ ኩንꬃናስ ዜሪዛዴይ ኣሾፔ ꬋይሲ ማፃና። ኣያና ኡፋይሳናስ ዜሪዳዴይ ጊዲኮ ኣያናፔ ሜርና ዴዖ ማፃና። 
GAL.6.9	ኣኔ ኑ ሎዖ ኦሶ ኦꬃናስ ኣዛሎኮ፤ ኑ ኡፋይሲ ቃንፆንታ ኣጊኮ ዎዴይ ጋኪሺን ጋኪዳ ካꬅ ኑ ማፃና። 
GAL.6.10	ሄሳ ጊሽ ኑስ ዳንዳዬቲኮ ኣሳ ኡባስ ሃራፔካ ኣማኒዛ ኣሳስ ኣኔ ሎዖ ኦꬆስ።
GAL.6.11	ታኒ ታ ኩሼራ ኢንቴስ ኣይ ማላ ጊታ ፒዳሌን ፃፊዳኮኔ ኣኔ ፄሊቴ። 
GAL.6.12	ጮ ካሬ ባጋራ ቤታና ኮዪዛ ኣሳቲ ኢንቴ ቃፃሬታና ማላ ዎልቃꬃና ኮዬቴስ። ኢስቲ ሄሳ ኦꬂዛይ ኪርስቶሳ ማስቃሌ ጊሽ ጊዲ ጎዴቶንታ ማላሳ። 
GAL.6.13	ኢስቲ ኢንቴ ቃፃሬታና ማላ ኮዪዛይ ኢንቴ ኣሾን ጬቄታናስ ኮዪዛ ጊሽ ኣቲን ቃፃሬቲዳይቲ ዎጋ ናጊዛይታ ጊዴቴና። 
GAL.6.14	ቃሴ ኣላሜይ ታስ፤ ታካ ኣላሜስ፤ ካቄቲዳ ጎዳ ዬሱስ ኪርስቶሳ ማስቃሌንፔ ኣቲን ሃራን ጬቆይ ታፔ ሃኮ። 
GAL.6.15	ቃፃሬቲን ዎይኮ ቃፃሬቶንታ ኣጊን ኢዛስ ጎዓይ ባዋ። ጎዓይ ኦራꬃ ሜꬌቴꬅ ጊዴꬃ። 
GAL.6.16	ሃይሳ ሃ ኣዛዞዛ ካሊዛ ኡባታሲኔ ፆሳ ዴሬ ጊዲዳ ኢስራዔሌ ኣሳታስ ሳሮቴꬂኔ ማሮቴꬅ ጊዶ።
GAL.6.17	ታኒ ዬሱሳ ማላታ ታ ኣሳቴꬃን ቶካዲስ፤ ሄሳ ጊሽ ሃዒ ታና ኦኒካ ዋይሴና።
GAL.6.18	ታ ኢሻቶ! ጎዳ ዬሱስ ኪርስቶሳ ኣꬎ ኪያቴꬂ ኢንቴናራ ጊዶ! ኣሚን።
EPH.1.1	ፆሳ ሼኔ ማላ ዬሱስ ኪርስቶሳ ሃዋሬ ጊዲዳ ጳዉሎሳፔ። ዬሱስ ኪርስቶሳን ዲዛ ኣማኔቲዛይታስ ኤፌሶኔን ኣማኒዛ ኣሳስ። 
EPH.1.2	ኑ ኣዋ ፆሳፌኔ ጎዳ ዬሱስ ኪርስቶሳፔ ኪያቴꬂኔ ሳሮቴꬂ ኢንቴስ ጊዶ።
EPH.1.3	ኑ ጎዳ ዬሱስ ኪርስቶሳ ባጋራ ሳሎን ኣያና ኣንጆ ኡባን ኑና ኣንጂዳ ጎዳ ዬሱስ ኪርስቶሳ ኣዋይ ፆሲ ኣንጄቶ። 
EPH.1.4	ኑ ኢዛ ሲንꬃን ጌሺኔ ዎሶይ ባይንዳይታ ጊዳና ማላ ቡሮ ኣላሜይ ሜꬌታናፔ ካሴ ባ ሲቆን ኪርስቶሳ ባጋራ ኑና ዶሪዴስ። 
EPH.1.5	ዬሱስ ኪርስቶሳ ባጋራ ኑ ኢዛ ና ጊዳና ማላ ባ ሎዖ ቆፋን ኮይሮ ዉርሲ ዎꬂዴስ። 
EPH.1.6	ሄሲካ ባ ዶሲዛዴ ባጋራ ጮ ሜላ ኑስ ኢሜቲዳ ቦንቾ ኪያቴꬃይ ጋላቴታና ማላ።
EPH.1.7	ፆሳ ኣꬎ ኪያቴꬃ ዱሬቴꬃፌ ዴንዶይሳን ዬሱሳ ሱꬃን ዎዜቲዲ ናጋራፔ ኑ ማሬቲዶስ። 
EPH.1.8	ኢዚ ባ ኪያቴꬃ፥ ሂላቴꬃኒኔ ኤራቴꬅ ኡባን ኑ ቦላ ኬሂ ዳርሲዴስ። 
EPH.1.9	ፆሲ ቆፒዳ ፁራ ባ ቆፋ ኪርስቶሳ ባጋራ ባ ሎዖ ቆፋ ማላ ኑና ኤሪሲዴስ። 
EPH.1.10	ቡሮፔ ዎዴ ዉርሴꬃን ሃናናስ ዲዛ ኢዛ ቆፋይ ሳሎ ቦላኔ ቢታ ቦላ ዲዛይታስ ኡባስ ሁዔ ጊዲዳ ዬሱስ ኪርስቶሳፔ ዉርሲ ጋርስ ኣꬃናሳ። 
EPH.1.11	ዉርሲካ ባ ሼኔ ማላ ኦꬂዛ ኢዛ ሼኔን ኮይሮካ ኢዚ ቆፒ ዎꬂዳይቲ ኑኒ ኢዛን ዶሬቲዶስ። 
EPH.1.12	ኑኒ ካሴቲዲ ኪርስቶሳ ባጋራ ኤካና ጊዲ ኡፋይሳን ናጊዛይቲ ፆሳ ቦንቾ ጋላታን ቆንጪሳናሳ።
EPH.1.13	ኢንቴካ ቃሴ ቱማ ቃላ ሄሲካ ኢንቴና ኣሺዛ ሚሺራቾ ቃላ ሲይዲ ኪርስቶሳን ኣማኒዴታ። ኢዛ ኣማኒዲ ካሴ ኢሜታና ጌቴቲዳ ፂሎ ኣያና ማታሜን ኣታሜቲዴታ። 
EPH.1.14	ሄ ኣያናዚካ ኢዛ ቦንቾ ጋላታን ቆንጪሳና ማላ ፆሲ ኤራይስ ጊዲዳይታ ኡባታ ዎዛና ጋካናስ ኑ ላታስ ኦይꬆ።
EPH.1.15+EPH.1.16	ሄሳ ጊሽ ኢንቴ ጎዳ ዬሱሳ ኣማኒዳ ጊሺኔ ኣማኒዛ ኣሳ ኢንቴ ሲቂዛይሳ ታ ሲዮሳፔ ሃ ሲሚን ኢንቴና ቆፓ ቆፓ ኤካዳ ታኒ ታ ዎሳን ኢንቴ ጊሽ ፆሳስ ጋላታ ሺሾ ኣጋቤይኬ። 
EPH.1.17	ቦንቾ ኣዋ ጊዲዳ ኑ ጎዳ ዬሱስ ኪርስቶሳ ኣዋ ፆሳ ኢንቴ ሎዔꬂ ኤራና ማላ ቆንጪሲዛ ኣያናይኔ ኤራቴꬃ ኣያናይ ኢንቴስ ኢሜታና ማላ ታ ኢንቴስ ፓጬይ ባይንዳ ዎሳይስ። 
EPH.1.18	ሄሳꬆካ ኢንቴ ኢዛን ፄይጌቲዳ ኡፋይሳይ ሄሲካ ኣማኒዛይታ ኣቻን ዲዛ ኢዛ ዱሬቴꬃይ ኣዛኮኔ ኢንቴ ኤራና ማላ ኢንቴ ዎዝና ኣይፌይ ፖዓና ማላ ዎሳይስ።
EPH.1.19+EPH.1.20	ኑስ ኣማኒዛይታስ ኡባፌ ቦላ ጊዲዳ ኢዛ ዎልቃ ꬎቃቴꬅ ኢንቴ ኤራና ማላ ታ ዎሳይስ። ሄ ዎልቃይካ ኢዛ ጊታቴꬃ ሚኖቴꬃ ኦሶን ቤሲዳይሲ ሃይቆፔ ኪርስቶሳ ዴንꬂዲ ሳሎን ባ ኡሻቻን ኡቲሲዳ ኪርስቶሳ ባጋራ። 
EPH.1.21	ኣይሲዛይታፔ፥ ጎዳቴꬃፔ፥ ዎልቃፌኔ ካዎቴꬃፌ ቃሴካ ሃዒ ፃላ ጊዶንታ ቡሮፔ ያና ዎዴካ ጊዲን ሱንꬅ ኡባፌ ኢዚ ቦላ። 
EPH.1.22	ፆሲ ሃራ ዉርሲ ኢዛ ቶሆፔ ጋርሳን ሃሪሲዴስ። ዎሳ ኬꬃንካ ኡባ ቦላ ሁዔ ኦꬂዴስ። 
EPH.1.23	ዎሳ ኬꬂያ ኪርስቶሳ ኣሳቴꬃ። ሄ ኢዛካ ኡባሶን ኡባ ሚሽ ኩንꬂዛ ሄ ኢዛ ኩሜꬃ።
EPH.2.1	ኢንቴ ኢንቴ ቆሂዳ ቆሆ ጊሺኔ ኢንቴ ናጋራ ጋሶን ሃይቂዴይታ ሺን፥ 
EPH.2.2	ሄሳ ኢንቴ ሃይሳ ኣላሜዛ ኢታ ኦጌ ካሊዴታ። ቦላ ጫርኮ ቦላ ዲዛ ዎልቃማ ሃሪዛይሳስ ሃዒካ ፆሳስ ኣዛዜቶንታ ኣሳ ቦላ ኦꬂዛ ኢታ ኣያናስ ኢንቴ ኣዛዜቲሼ ጋምዒዴታ። 
EPH.2.3	ሃይሳፌ ካሴ ኑኒ ኑ ኣሾ ኣሞቴꬅ ፖሊሼ ኣሾይ ኮዪዛ ኦጌ ካሊሼ ኢስታራ ዶስ። ኑኒካ ሃንኮ ኣሳ ማላ ኑ ሜꬌቴꬃፌ ፆሳ ሃንቆ ጊዶን ዴዖስ።
EPH.2.4+EPH.2.5	ጊዶ ኣቲን ፆሲ ኬሂ ሲቂዳ ጊሽ ባ ማሮቴꬃ ዳሮን ኑኒ ኑ ቆሆ ዳሬቴꬃን ሃይቂዳይታ ጊዲ ዲሺን ኪርስቶሳ ባጋራ ኑና ኣሺዴስ። ኢንቴ ፓፂዳይ ኢዛ ኪያቴꬃና። 
EPH.2.6	ፆሲ ኑና ኪርስቶሳራ ጋꬂ ዴንꬂዴስ። ዬሱስ ኪርስቶሳ ባጋራ ኑና ሳሎን ባናራ ኡቲሲዴስ። 
EPH.2.7	ሄሲካ ሃይሳፌ ጉዬ ያና ዎዴዛን ዬሱስ ኪርስቶሲ ኑስ ባ ኪያቴꬃን ቆንጪሲዳ ዛዋይ ባይንዳ ባ ኪያቴꬃ ዱሬቴꬃ ኑና ቤሳናሳ። 
EPH.2.8	ኢንቴ ፆሳ ኪያቴꬃን ኣማኖን ኣቲዴታ። ሄሲካ ፆሲ ኢንቴስ ሜላ ጮ ኢሚዳዛፔ ኣቲን ኢንቴ ኦሶፔ ጊዴና። 
EPH.2.9	ኦኒካ ጬቄቶንታ ማላ ኦሶፔ ጊዴና። 
EPH.2.10	ሄሲካ ፆሲ ካሴ ኮይሮ ጊጊሲ ዎꬂዳ ሎዖ ኦሶ ኑኒ ኦꬃና ማላ ዬሱስ ኪርስቶሳ ባጋራ ኑኒ ናምዓንꬆ ሜꬌቲዳይታኔ ፆሳ ሜꬌቴꬃታ።
EPH.2.11	ሄሳ ጊሽ ኢንቴ ካሴ ኢንቴ ዬሌቴꬃን ኣይዛቤቲ ኢንቴ ኣሳቴꬃ ቦላ ኣሳ ኩሼ ኦሶ ጌዶን “ኑኒ ቃፃሬቲዶስ” ጊዛ ኣሳቲ ኢንቴና “ቃፃሬቶንታይታ” ጊዛይቶ! ኢንቴ ሄሳ ኣኔ ዎዝናን ዎꬂቴ። 
EPH.2.12	ኢንቴ ሄ ዎዴ ኪርስቶሳፔ ሻኬቲዲ፥ ኢስራዔሌ ናይታፔ ሃኪዲ፥ ጫቆ ቃላሲካ ኣላጋ ጊዲዲ፥ ሃይሳ ኣላሜዛ ቦላ ሂዶታይኔ ፆሲ ባይንዳ ኢንቴ ካሴ ዲዛይሳ ዩሺ ቆፒቴ። 
EPH.2.13	ሃዒ ቃሴ ኢንቴ ካሴ ሃሆን ዲዛይቲ ዬሱስ ኪርስቶሳን ጊዲዲ ኢዛ ሱꬃ ባጋራ ሺቂዴታ።
EPH.2.14	ናምዓታ ኢሲ ቦላ ጋꬂዲ ጊዶን ሻኪ ኦሺዛ ሚሻ ላሊዳ ኑ ሳሮይ ኢዛ። 
EPH.2.15	ዎጋ፥ ዎጋ ኣዛዞራ ጋꬂ ኢሲፌ ባ ኣሾን ሻሪዴስ። ሄሳ ኢዚ ኦꬂዳ ጋሶይ ኢዛስ ዋና ቆፋይ ናምዓታፔ ኢሲ ኦራꬃ ኣስ ባ ባጋራ ሜꬊዲ ሳሮቴꬅ ኤሃናሳ። 
EPH.2.16	ኢዚ ማስቃሌ ቦላ ሃይቂዲ ሞርኬቴꬅ ዲጊዴስ። ናምዓታካ ኢሲ ኣሾ ሂስቲዲ ፆሳራ ማቃዪንꬂዴስ። 
EPH.2.17	ኢዚ ዪዲ ኢንቴና ሃኪ ዲዛይታሲኔ ማታን ዲዛይታስ ጋꬂ ሳሮቴꬅ ሳባኪዴስ። 
EPH.2.18	ኑ ዉሪካ ኢዛ ባጋራ ኢሲ ኣያናን ኣዋ ኣች ሺቃና።
EPH.2.19	ሄሳ ጊሽ ኢንቴ ኣማኒዛይታራ ኢሲፌ ኢሲ ዴሬ ኣሳኔ ፆሳስ ሶ ኣሳ ኣቲን ሃይሳፌ ጉዬ ቤቴታኔ ኢማꬃታ ጊዴኬታ። 
EPH.2.20	ኢንቴ ሃዋሬታኔ ናቤታ ባሳን ኬፄቲዴታ፤ ኬꬃስ ዉርሴꬃ ኩሻይ ዬሱስ ኪርስቶሳ። 
EPH.2.21	ኬꬃዚ ዉሪካ ኢሲፌ ኦይኬቲዲ ጎዳስ ዱማ ኬꬄ ጊዳናስ ዲጬስ። 
EPH.2.22	ኢንቴንካ ፆሲ ባ ኣያናን ዳናስ ኢዛስ ዱሳሶ ጊዳና ማላ ኢሲፌ ኬፄቲሼ ዴታ።
EPH.3.1	ሄሳ ጌዶን ታ ጳዉሎሲ ኢንቴስ ኣማኖንታይታ ጊሽ ዬሱስ ኪርስቶሲ ቃቺዳዴ ጊዳዲስ። 
EPH.3.2	ታ ኢንቴና ጎዓና ማላ ፆሲ ኪያቴꬃን ታስ ኦሶስ ኤፃ ኢሚዳይሳ ኢንቴ ቱማፔ ሲዪዴታ። 
EPH.3.3	ሃይሳፌ ካሴ ታ ኢንቴስ ቃንꬃራ ፃፊዳ ማላ ታስ ቆንጪን ታ ኤራናስ ዳንዳዪዳ ፁራይ ሃይሳ። 
EPH.3.4	ሄሳ ጊሽ ኢንቴ ሄሳ ናባቢሼ ኪርስቶሳ ፁራ ታ ኣይ ማላ ኤሪዳኮኔ ኢንቴካ ኤራናስ ዳንዳዬታ። 
EPH.3.5	ሄ ፁራይካ ሃዒ ኣማኒዛ ሃዋሬታሲኔ ናቤታስ ቆንጪዳ ማላ ካሴ ቤኒ ኣꬊዳ ዎዴ ዲዛ ኣሳታስካ ቆንጪቤና። 
EPH.3.6	ሄሲ ሄ ፁራይ ኣይዛቤቲ ሚሺራቾ ቃላ ባጋራ ኢስራዔሌ ናይታራ ኢሲፌ ላቲዛይታ፤ ኢሲፌ ኢሳዴ ኣሳቴꬅ ማላ ጊዲዲ ዬሱስ ኪርስቶሳ ባጋራ ቤቲዳ ሂዶታ ኢሲፌ ጊሼቲ ላቲዛይታ ጊዳናሳ።
EPH.3.7	ታካ ኢዛ ዎልቃ ኦሶ ማላ ታስ ኢሜቲዳ ፆሳ ኪያቴꬃ ኢሞታ ማላ ሃይሳ ሚሺራቾ ቃላ ኦሳንቻ ጊዳዲስ። 
EPH.3.8	ታ ቃስ ሃንኮ ኣማኒዛ ኣሳፔ ላፋ ጊዲኮካ ኦኒካ ዛዋይ ባይንዳ ኪርስቶሳ ዱሬቴꬅ ኣይዛቤታስ ሳባካና ማላ ፆሳ ኪያቴꬃን ሃይሲ ታስ ኢሜቲዴስ። 
EPH.3.9	ሄሳꬆካ ዉርሲካ ሜꬊዳ ፆሳን ቤኒ ዎዴ ቆቴቲ ዲዛ ፆኦሳስ ፁራ ቆፋይ ኣዛኮኔ ኡባስ ታ ቆንጪሳና ማላ ታስ ፆሳ ኪያቴꬂ ኢሜቲዴስ። 
EPH.3.10	ኢዛ ቆፋይ ሃዒ ዎዴ ዎሳ ኬꬃ ባጋራ ዱማ ዱማ ሜꬋይ ዲዛ ፆሳ ሂላቴꬂ ሳሎን ዲዛ ሃላቃታሲኔ ጎዳታስ ኤሬታና ማላ ሃኒዴስ።
EPH.3.11	ፆሲ ኑ ጎዳ ዬሱስ ኪርስቶሳ ባጋራ ሃይሳ ፖሊዳይ ሜርና ባ ቆፋ ማላ። 
EPH.3.12	ኑኒ ኢዛይታ ጊዲዳ ጊሺኔ ኢዛን ኣማኒዳ ጊሽ ጌሻቴꬃራኔ ሂርጋይ ባይንዳ ኑኒ ፆሳኮ ሺቃና ዳንዳዮስ። 
EPH.3.13	ሄሳ ጊሽ ኢንቴ ቦንቼታና ማላ ታኒ ኢንቴ ጊሽ ታ ቦላ ጋኪዳ ዋዬዛን ኢንቴ ኡፋይስ ቃንፆንታ ማላ ታ ኢንቴና ሃዳራ ጋይስ።
EPH.3.14	ሄሳ ጊሽ ታኒ ፆሳ ሲንꬃን ጉልባታይስ። 
EPH.3.15	ሳሎን ዲዛይኔ ቢታ ቦላ ዲዛ ኢዛሶ ኣሳይ ዉሪካ ኢዚ ሱንꬂን ሱሜስ። 
EPH.3.16	ኢንቴ ጋርሳ ባጋራ ሚናና ማላ ኣያና ባጋራ ኢዛ ቦንቾ ዱሬቴꬃይ ኢንቴስ ኢሜታና ማላ ታ ዎሳይስ። 
EPH.3.17	ሄሲካ ኪርስቶሲ ኢንቴ ዎዝናን ኣማኖን ዳና ማላኔ ቃሴካ ኢንቴ ኢዛን ፃጲዲ ሲቆን ሚናና ማላ። 
EPH.3.18	ኪርስቶሳ ሲቆስ ኣሆቴꬃይ፥ ኣዱሳቴꬃይ፥ ꬎቃቴꬃይኔ ጪማቴꬃይ ኣይ ጊናኮ ኢንቴ ኣማኒዛ ኣሳ ኡባራ ኢሲፌ ሻኪ ኤራና ማላ። 
EPH.3.19	ኢንቴ ፆሳ ኩሜꬃራ ሻኪ ኤሪዲ ኢዛን ኩሜꬅ ጊዳና ማላ ኣሳ ኤራፔ ቦላ ጊዲዳ ኪርስቶሳ ሲቆ ኢንቴ ኤራና ማላ ታ ዎሳይስ። 
EPH.3.20	ሄሳ ጊሽ ኑ ጊዶን ኦꬂዛ ባ ዎልቃ ጊና ኑ ዎሲዛይሳፌኔ ዎይኮ ኑ ቆፒዛይሳፌ ኡባፌ ቦላራ ኬሂ ዳርሲ ኦꬃናስ ዳንዳዪዛ ፆሳስ፥ 
EPH.3.21	ዎሳ ኬꬃን ቃሴካ ዬሱስ ኪርስቶሳ ባጋራ ዎዴ ኡባን ሜርናፔ ሜርና ጋካናስ ኢዛስ ቦንቾይ ጊዶ። ኣሚን።
EPH.4.1	ሄሳ ጊሽ ጎዳ ሱንꬃን ቃሼቲዳ ታኒ ኢንቴ ፄይጌቲዳ ፄይሳስ ቤሲዛ ዱስ ዳና ማላ ኢንቴና ዎሳይስ። 
EPH.4.2	ሙሌካ ኣሽኬታኔ ሹጎታ ጊዲቴ። ኢሶይ ኢሳራ ሲቆን ዲቴኔ ኢሶይ ኢሳ ዳንዳዪቴ። 
EPH.4.3	ሳሮቴꬅ ኢሚዛ ኣያና ኢሲፌቴꬅ ናጋናስ ሚኒቴ። 
EPH.4.4	ኢንቴ ፄይጌቲዳ ጋላስ ኢሲ ሂዶታኮ ፄይጌቲዳ ማላ ኢሲ ኣሳቴꬂኔ ኢሲ ኣያናይ ዴስ። 
EPH.4.5	ኢሲ ጎዳይ፥ ኢሲ ኣማኖይኔ ኢሲ ፂንቃታይ ዴስ። 
EPH.4.6	ኡባፌ ቦላራ ጊዲዳይ፥ ኡባ ቦላ ኦꬂዛይ፥ ኡባሶን ዲዛይ፥ ኡባስ ኣዋ ጊዲዳ ኢሲ ፆሲ ዴስ።
EPH.4.7	ጊዲኮካ ኪርስቶሲ ኢማና ጊ ቃቺዳ ማላ ኑስ ኢሳስ ኢሳስ ዱማ ዱማ ኢሞቴꬂ ኢሜቲዴስ። 
EPH.4.8	ሄሳ ጊሽ
EPH.4.8	“ኢዚ ፑዴ ኬዚዳ ዎዴ ዲዖ ዲዒዴስ፤
EPH.4.8	ኣሳስ ኪያቴꬃ ኢሞታ ኢሚዴስ”
EPH.4.8	ጌቴቲ ጌሻ ማፃፋን ፃፌቲዴስ። 
EPH.4.9	ሂስቲን “ኢዚ ፑዴ ኬዚዴስ” ጉሲ ቃሴካ ዱጌ ቢታ ጋርስ ዎꬊዴስ ጉስ ጊዶንታ ኣጊኮ ሄሲ ኣይ ጉሴ? 
EPH.4.10	ኢዚ ዱጌ ጋርሴ ዎꬊዳይሲ ኩሜꬅ ኣላሜ ሜꬌቴꬅ ኩማና ማላ ሳሎፔካ ቦላ ኬዚዳይ ኢዛ።
EPH.4.11	ኢሲ ኢሲ ኣሳቲ ሃዋሬታ፥ ባጋቲ ናቤታ፥ ሃራቲ ሚሺራቾ ቃላ ሳባኬ፥ ባጋይቲ ቃሴ ሄሚዛይታኔ ታማርሲዛይታ ጊዳና ማላ ኢዚ ኢሞታ ኢሚዴስ። 
EPH.4.12	ሄሲካ ኪርስቶሳ ኣሳቴꬅ ጊዲዳ ዎሳ ኬꬂያ ኬፄታና ማላ ኣማኒዛይታ ኣማኖ ኦሶስ ጊጊሳናሳ። 
EPH.4.13	ሄሲካ ሃናናይ ኑ ዉሪካ ፆሳ ና ኣማኖኒኔ ኢዛ ኤሮን ቤቲዛ ኢሲፌቴꬃኮ ጋኪዲ ኩሜꬃ ኣስ ጊዳናስ ኪርስቶሳን ኑኒ ኪርስቶሳꬆ ኩሜꬂኔ ፖሎ ጊዳና ማላ።
EPH.4.14	ሄሳ ጊሽ ኣባ ቦላ ዴንዲዛ ጎቴ ጫርኮይ ሄኔ ሃ ሾጬቺዛ ማላ ዱማ ዱማ ቲሚርቴ ጫርኮን ኣሳ ጌኔኒኔ ባሌꬆን ኣኔ ኑኒ ሄኔ ሃ ጶንቄቲሼ ቄሪ ጉꬃ ናይታ ማላ ሃኖኮ። 
EPH.4.15	ሄሳꬆ ሃኖ ኣጊዲ ቱማ ሲቆን ሃሳዪሼ ሁዔ ጊዲዳይሳኮ ሃኒዛዛን ኡባን ኣኔ ዲጮስ። ሄ ሁዔዚካ ኪርስቶሳ። 
EPH.4.16	ኢዛ ጌዶን ኣሳቴꬂ ዉሪ ፃጶን ኦይኬቲዲ ኢሲ ኢሲ ኣሳቴꬂ ባ ኦሶ ኦꬂሼ ዉሪካ ሲቆን ዲጬሲኔ ባናካ ሚንꬄስ። 
EPH.4.17	ኣይዛቤታ ማላ ጮ ሜላ ቆፋን ሜላ ሲሜሬታናስ ኢንቴስ ቤሴና ጋዳ ታ ኢንቴና ዞራይስ። 
EPH.4.18	ኢስታ ዎዝናይ ሙሚዳ ጊሺኔ ዩሺ ቆፖንታ ጊሽ ኢስታ ዎዝና ኣይፌይ ቆቂዴስ። ኢስቲ ፆሳ ዴዖፔ ሻኬቲዳ። 
EPH.4.19	ኢስታ ዎዝናይ ዶጪዳ ጊሽ ካሎይ ባይንዳ ባ ኮይዳ ማላ ባና ካልꬆንታ ኣሞኒኔ ቱናቴꬃን ዳናስ ዎጋይ ባይንዳ ኢታ ኦሶስ ባና ኣꬂ ኢሚዳ።
EPH.4.20	ኢንቴ ቃሴ ኪርስቶሳ ሄሳ ማላን ኤሪቤይኬታ። 
EPH.4.21	ኤ ቱሙካ ኢንቴ ኢዛ ጊሽ ሲዪዴታኔ ዬሱሳን ዲዛ ቱማ ኢዛፔ ታማሪዴታ። 
EPH.4.22	ኢንቴ ካሴ ዲዛ ዱሳይ ባሌꬂዛ ኣሞን ቂታቲዳ ጊሽ ካሴ ጬጋ ኣሳቴꬅ ኢንቴፌ ቃሪ ዬጋና ማላ ታማሪዴታ። 
EPH.4.23	ቃሴካ ኢንቴ ቆፋይ ኣያናን ኦራፆ። 
EPH.4.24	ቱሙ ፂሎቴꬃኒኔ ጌሻቴꬃን ፆሴ ሚሳታና ሜꬌቲዳ ኦራꬃ ኣሳቴꬅ ማይዒቴ። 
EPH.4.25	ኑ ዉሪካ ኢሲ ኣሾ ጊዲዳ ጊሽ ዎርዶቴꬅ ዲጊዲ ኑኒ ኑ ጋርሳን ኢሶይ ኢሳራ ኣኔ ቱማ ሃሳዮስ። 
EPH.4.26	ሃንቄቲቴ ሺን ናጋራ ኦꬆፍቴ፤ ኢንቴ ሃንቆን ዲሺን ኣዋ ኣርሼይ ዉሎፎ። 
EPH.4.27	ፃላዔስ ሶሆ ኢሞፍቴ። 
EPH.4.28	ካሴ ካይሶቲዛዴይ ሃይሳፌ ጉዬ ካይሶቶፓ። ጊዶ ኣቲን ሜቶቴቲዲ ኢዛ ዎሲዛይታስ ኢሚዛ ሚሽ ኢዛ ኩሼን ዳና ማላ ሎዖ ሚሽ ባ ኩሼራ ኦꬂ ዴማናስ ዳቡሮ።
EPH.4.29	ኮሺዛ ማላ ሃንኮ ሲዪዛይታ ጎዒዛዚኔ ማዲዛ ቃላፔ ኣቲን ጎዖይ ባይንዳ ቃላይ ኢንቴ ዱናፔ ኬዞፖ። 
EPH.4.30	ኢንቴ ኣታና ጋላሳስ ኣታሜቲዳ ፆሳ ፂሎ ኣያና ሚሺሶፒቴ። 
EPH.4.31	ጫሞ ዮዖ ዉርሲ ሃንቆካ፥ ዪሎ፥ ኦሽ፥ ጫሼ፥ ቃሴካ ሃንኮ ሃራ ኢታቴꬅ ዉርሲ ኢንቴፌ ዲጊቴ። 
EPH.4.32	ኢንቴና ፆሲ ኪርስቶሳ ባጋራ ኣቶ ጊዳ ማላ ኢንቴካ ኢንቴ ጋርሳን ኣቶ ኣቶ ጌቴቲቴ፤ ኢሶይ ኢሳራ ኪያታኔ ኢሶይ ኢሳስ ቃꬌቲዛይታ ጊዲቴ። 
EPH.5.1	ሄሳ ጊሽ ኢንቴ ዶሴቲዛ ናይታ ማላ ፆሴ ሚሳቲቴ። 
EPH.5.2	ኪርስቶሲ ኑና ሲቂዳ ማላ ቃሴካ ኑ ጊሽ ባና ሳዊዛ ያርሾ ኦꬅ ፆሳስ ኢሚዳ ማላ ኢንቴካ ሲቆን ሲሜሬቲቴ። 
EPH.5.3	ላይማይ ዎይኮ ቱናቴꬂ ዎይኮ ኡዜቴꬂ ሙሌካ ኢንቴ ጊዶን ቤቶይ ኣቲን ዚጊርሲካ ሲዬቶፎ። ሄሳ ማላይ ጌሻ ፆሳ ኣሳስ ቤሴና። 
EPH.5.4	ኢንቴ ጋላታ ጋላቲዛይታ ጊዲቴ ኣቲን ኣሴ ዬላቺዛ ላፋ ሃሳያይ ጮ ኤያቴꬃ ዮዖይ ኢንቴስ ቤሶንታ ጊሽ ሄሳ ማላይ ኢንቴ ጋርሳን ዶፖ። 
EPH.5.5	ቃሴካ ኢንቴ ላይማቲዛይታስ ዎይኮ ቱናታስ ዎይኮ ኡዜቲዛይታሲኔ ኤቃስ ጎይኒዛይታስ ኪርስቶሳ ካዎቴꬃኒኔ ፆሳ ካዎቴꬃን ኢስታስ ላታሶይ ባይንዳይሳ ኢንቴ ኤሪቴ።
EPH.5.6	ኢንቴና ኦኒካ ዎርዶ ሃሳዮን ባሌꬆፎ። ጋሶይካ ፆሳ ሃንቆይ ኢዛስ ኣዛዜቶንታ ናይታ ቦላ ያናይ ሃይታንታ ማላና። 
EPH.5.7	ሄሳ ጊሽ ሄሳንታ ማላራ ዙፔቶፒቴ። 
EPH.5.8	ካሴ ኢንቴ ꬉማ ሺን ጎዳን ሃዒ ኢንቴ ፖዖ። ኢንቴ ፖዖ ናይታ ማላ ዲቴ። 
EPH.5.9	ፖዖስ ኣይፌይ ሎዔቴꬃን፥ ፂሎቴꬃኒኔ ቱማቴꬃን ኡባን ዴስ።
EPH.5.10	ሄሳꬆካ ጎዳ ኡፋይሲዛ ሚሽ ኮዪቴ። 
EPH.5.11	ኣይፌይ ባይንዳ ꬉማ ኦሶራ ኢንቴስ ኣይኮ ጋጎቴꬂ ዶፖ። ሄሳፌ ኢታ ኦሶ ቆንጬ ኬሲቴ። 
