MAT.1.1	ዳዉቴ ና፥ ኣብራሃሜ ና ጊዲዳ ዬሱስ ኪርስቶሳ ዬሌቴꬃ ዛርኬይ ሃይሳፌ ካሊዛይሳ፤
ACT.13.37	ፆሲ ኢዛ ሃይቆፔ ዴንꬂዳይሲ ኢዚ ጊዲኮ ዎቂቤና። 
ACT.13.38	ሄሳ ጊሽ ታ ኢሻቶ! ናጋራስ ማሮቴꬂ ቤቲዛይ ዬሱሳ ባጋራ ጊዲዳይሲ ኢንቴስ ሳባኬቲዳይሳ ኤሪቴ። 
ACT.13.39	ኢዛ ኣማኒዛዴይ ዉሪ ካሴ ሙሴ ዎጋ ባጋራ ዴሞንታ ፂሎቴꬅ ዴማና። 
ACT.13.40+ACT.13.41	ሄሳ ጊሽ ካሴ ናቤቲ
ACT.13.40+ACT.13.41	‘ኢንቴኖ ቂꬊዛይቶ ፄሊቴ፥ ማላሌቲቴኔ፥ ꬋዪቴ፥
ACT.13.40+ACT.13.41	ኢንቴስ ኦኒካ ዮቲን ኣማናናስ ኢንቴና ሜቲዛ ሚሽ
ACT.13.40+ACT.13.41	ታ ኢንቴ ዎዴን ኦꬃና’ ጊዳ ቃላይ ኢንቴ ቦላ ጋኮንታ ማላ ናጌቲቴ” ጊዴስ።
ACT.13.42	ጳዉሎሲኔ ባርናባሲ ኣይሁዳታ ዎሳ ኬꬃፌ ኬዚሺን ኣሳይ ኢስታ ሄሳ ኢስቲ ዮቲዳ ቃላ ካሊዛ ሳምባታ ጋላስ ዛሪ ዮታና ማላ ዎሲዴስ። 
ACT.13.43	ሺቆይ ላሌቲዳፔ ጉዬ ዳሮ ኣይሁዳቲኔ ኣይሁዳታ ኣማኖን ጌሊዲ ፆሴ ጎይኒዛ ኣሳቲ ጳዉሎሳኔ ባርናባሳ ካሊዳ። ጳዉሎሳንቲካ ኢስታ ቆፍሲሼ ኢስቲ ፆሳ ኪያቴꬃን ሚኒ ዳና ማላ ዞሪዳ።
ACT.13.44	ካሊዛ ሳምባታ ጋላስ ካታማ ኣሳፔ ጉꬃቲ ፃላላ ኣቲን ዳሪዛ ባጋይ ዉሪ ጎዳ ቃላ ሲያና ሺቂዴስ። 
ACT.13.45	ኣይሁዳቲካ ዳሮ ዴሬ ቤዪዲ ቃናቴቴꬃን ኩሚዳ። ጳዉሎሳ ሃሳያ ኤቄቲሼ ኢዛ ጫዪዳ።
ACT.13.46+ACT.13.47	ጳዉሎሲኔ ባርናባሲ ባቦንታ ፃላቴꬃን “ፆሳ ቃላይ ኮይሮ ኢንቴስ ዮቴታናስ ቤሴስ። ጊዶ ኣቲን ኢንቴ ቃላ ሌቂዴታ። ኢንቴስ ሜርና ዴዖይ ቤሶንታይሳ ኢንቴርካ ኢንቴ ቦላ ፒርዲዳ ጊሽ ሃዒ ኑኒ ጌዴ ኣይዛቤታኮ ባና ኮዮስ። ቃሴካ ጎዳይ ኑና ‘ኣሳስ ኣቶቴꬃ ቃላ ቢታ ጋፃ ጋꬃና ማላ ታ ኔና ኣይዛቤታስ ፖዖ ሂስታ ኪታዲስ’ ጊ ኣዛዚዴስ” ጊዳ።
ACT.13.48	ኣይዛቤቲ ሄሳ ሲይዲ ዳሮ ኡፋዬቲዳ። ጎዳ ቃላሲካ ቦንቾ ኢሚዳ። ሜርና ዴዖስ ጊጌቲዳ ዴሬይ ዉሪ ኣማኒዴስ። 
ACT.13.49	ጎዳ ቃላይ ሄራን ዲዛ ዴሬ ኡባሶ ጋኪዴስ። 
ACT.13.50	ኣይሁዳቲ ቃስ ኣያና ሃኖን ካሴፔ ሚኒዛይታኔ ዱሳን ቦንቼቲዳ ማጫሳታ ሄሳꬆካ ካታማን ዲዛ ጊታ ኣሳታ ዴንꬄꬂዲ ጳዉሎሳ ቦላኔ ባርናባሳ ቦላ ጎዴቴꬂ ዴንꬂዲ ባ ዴሬፔ ኬሲ ጎዲዳ። 
ACT.13.51	ጳዉሎሲኔ ባርናባሲ ኣሳይ ኢስታ ኢፂዳይሳ ቤሳናስ ባ ቶሆ ቦላ ዲዛ ጉዱላ ፒቲዲ ኢቆኒዮኔ ጌቴቲዛሶ ቢዳ። 
ACT.13.52	ኣማኒዛይቲ ኡፋይሳኒኔ ፂሎ ኣያናን ኩሚዳ።
ACT.14.1	ኢቆኒዮኔን ጳዉሎሲኔ ባርናባሲ ኢሲፌ ኣይሁዳታ ዎሳ ኬꬄ ጌሊዳ። ሄንካ ኢስቲ ኣሳ ሎዔꬅ ታማርሲዳ ጊሽ ጊሪኬ ኣሳፔኔ ኣይሁዳ ኣሳፔ ዳሮይ ኣማኒዴስ። 
ACT.14.2	ሂንኮ ኣማኖንታ ኣይሁዳ ኣሳይ ኣይዛቤታ ኢስታ ቦላ ዴንꬄꬂዲ ኣሳይ ኣማኒዛይታ ኢፃና ማላ ኦꬂዴስ። 
ACT.14.3	ጳዉሎሲኔ ባርናባሲ ጎዳ ጊሽ ፃላቴꬃራ ኣሳስ ዮቲሼ ሄን ዳሮ ዎዴ ጋምዒዳ። ጎዳይካ ኢስቲ ዮቲዛ ኢዛ ቃላ ጊታ ማላታራኔ ዎልቃማ ኦሶን ቆንጪሲ ማርካቲዴስ። 
ACT.14.4	ካታማ ኣሳይ ባ ጊዶን ናምዑ ኬዚ ሻኬቲዲ ባጋይ ኣይሁዳታ ባጋ ባጋይ ጳዉሎሳንታ ባጋ ጊዲዴስ።
ACT.14.5	ሄ ዎዴ ኣይሁዳቲኔ ኣይዛቤቲ ባና ካሌꬂዛይታራ ኢሲፌ ጊዲዲ ኢስታ ዋይሳናሲኔ ሹቻን ጫዳናስ ኮይዳ። 
ACT.14.6	ኢስቲካ ሄሳ ኤሪዳ ማላ ሊስቲራኔ ዴርቤኔ ጌቴቲዛሶ ጌዴ ሊቃዖኒያ ካታማታኔ ሄ ሄራን ዲዛ ዴሬ ባቃቲዳ። 
ACT.14.7	ሄንካ ሚሺራቾ ቃላ ሳባኮ ዶሚዳ።
ACT.14.8	ሊስቲራን ዬሌቶሳፔ ባ ቶሆራ ሃሙቲ ኤሮንታ ኢሲ ቶሆ ሲላ ኣዴይ ዴስ። 
ACT.14.9+ACT.14.10	ሄሳዴይ ጳዉሎሲ ሳባኪሺን ኡቲ ሲዬስ፤ ጳዉሎሲካ ኢዛኮ ቲሺ ሂስቲ ፄሊዲ ኣዴዛ ፓꬃና ኣማኖይ ኢዛ ቦላ ዲዛይሳ ቤዪዲኔ ቃላ ꬎቁ ሂስቲዲ “ሲቲ ጋዳ ኔ ቶሆን ኤቃ!” ጊዴስ። ኣዴዚ ሄራካ ጉፒ ዴንዲዲ ሃሙꬅ ኦይኪዴስ።
ACT.14.11	ኣሳይ ጳዉሎሲ ኦꬂዳይሳ ቤዪዲ ሊቃዖኒያ ቃላራ “ኤቃ ፆሳቲ ኣስ ሚሳቲዲ ሃ ኑኮ ዎꬊዳ” ጊዲ ዋሲዴስ። 
ACT.14.12	ባርናባሳ “ዲያ” ጊዳ ጳዉሎሳካ ሃሳዪዛ ዋናይ ኢዛ ጊዲዳ ጊሽ “ሄርሜኔ” ጊዳ። 
ACT.14.13	ካታማፔ ኣሲ ባይንዳሶን ዲዛ ዲያ ጌቴቲዛ ኤቃ ኬꬃ ቄሴይ ኮርማታኔ ፃፄቲ ጊጊዳ ጪሽ ጌዴ ካታማ ጌሊዛ ኦጌ ቦላ ኤፊዲ ዴሬዛራ ኢሲፌ ጊዲዲ ጳዉሎሳሲኔ ባርናባሳስ ያርሻና ኮዪዴስ።
ACT.14.14	ሃዋሬቲ ባርናባሲኔ ጳዉሎሲ ሄሳ ሲዪዳ ማላ ባ ማይዖ ዳኪዲ ጌዴ ዴሬዛ ጊዶ ዎፂዳ፤ ባ ቃላ ꬎቁ ሂስቲዲ ሂዝጊዳ፤ 
ACT.14.15	“ሃይቶ ኣሳቶ! ሃይሳ ኣዛስ ኦꬄቲ? ኑካ ኢንቴ ማላ ኣሳኮ! ኢንቴካ ቃሴ ሃይሳ ሜላ ሃዳ ዮዖፔ ሃኪዲ ሳሎኔ ሳዓ፥ ኣባካ፥ ኣባታ ጊዶን ዲዛይታ ዉርሲ ሜꬊዳ ዴዖ ፆሳኮ ኢንቴ ሲማና ማላ ኢንቴስ ሚሺራቾ ቃላ ሳባኮስ። 
ACT.14.16	ኢዚ ካሴ ኣꬊዳ ዬሌቴꬃይኔ ዴሬይ ዉሪካ ባ ኮይዳ ማላ ሃናናስ ዬዲ ቤሲዴስ። 
ACT.14.17	ጊዶ ኣቲን ፆሲ ሳሎፔ ኢራኔ ሄሳꬆካ ካꬂ ካፂዛ ዎዴታ ኢሚዲ ኢንቴ ዎዝና ካꬃኒኔ ኡፋይሳ ኩንꬂዴስ፤ ኡፋይሳካ ኢንቴና ካልꬂዲ ሎዖ ኦሶን ባና ማርካይ ባይንዳ ኣጊቤና” ጊዳ። 
ACT.14.18	ሄሳ ዉርሲ ሃሳዪዲ ኣሳይ ኢስታስ ያርሾንታ ማላ ዋይዲ ዲጊዳ።
ACT.14.19	ኣይሁዳቲ ቃስ ኣንፆኪያፔኔ ኢቆኒዮኔፔ ዪዳ ኣሳይ ኣሳ ዞሪዲ ጳዉሎሳ ሹቻን ጫዳና ማላ ኣማንꬂዳ። ጳዉሎሳካ ሹቻን ጫዲዲኔ ሃይቂዴስ ጊ ጎቺዲ ካታማፔ ጌዴ ካሬ ኬሲዳ። 
ACT.14.20	ጊዶ ኣቲን ኣማኒዛይቲ ኢዛ ዩዪ ኣꬊ ናጊሺን ጳዉሎሲ ዴንዲዲ ጌዴ ካታማ ጌሊዴስ። ዎንቴꬃ ጋላስ ባርናባሳራ ኢሲፌ ዴርቤኔ ጌቴቲዛሶ ቢዳ።
ACT.14.21	ጳዉሎሲኔ ባርናባሲ ዳርቤን ሚሺራቾ ቃላ ሳባኪዳ ዳሮ ኣሳ ኣማንꬂዳፔ ጉዬ ጌዴ ሊስቲራ፥ ኢቆኒዮኔኔ ኣንፆኪያ ሲሚዳ። 
ACT.14.22	ኣማንዛይታ ዎዝና ሚንꬄꬂሼ ኢስቲ ኣማኖን ሚኒ ዳና ማላ ዞሪሼ “ኑ ፆሳ ካዎቴꬅ ጌላናስ ዳሮ ሜቶ ጊዶራ ኣꬋናስ ኮሼስ” ጊዳ። 
ACT.14.23	ሄሳፌ ጉዬ ዱማ ዱማ ዎሳ ኬꬃታን ጪማታ ዶሪዳፔ ጉዬ ፆማኒኔ ዎሳን ኣማኔቲዳ ጎዳስ ሃዳራ ኣꬂ ኢሚዳ።
ACT.14.24	ጲሲዲያራ ኣꬊዲ ጲንፊሊያ ሲሚዳ። 
ACT.14.25	ጴርጌኔን ቃላ ሳባኪዲ ዱጌ ኣፃሊያ ጌቴቲዛሶ ዎꬊዳ። 
ACT.14.26	ኣፃሊያፔካ ሃዒ ጋካናስ ኢስቲ ኦꬂዳ ኦሶዛ ሃዳራ ኢስታስ ኢሜቲዳ ካታማ ሶሪያን ዲዛ ኣንፆኪያ ማርካቤን ጌሊዲ ሲሚዳ።
ACT.14.27	ሄ ጋኪዳ ማላ ዎሳ ኬꬃ ኣሳ ዉርሲ ሺሺዲ ፆሲ ኢስታራ ኦꬂዳይሳ ቃሴካ ኣይዛቤታስ ኣማኖ ፔንጌይ ዋኒ ዶዬቲዳኮኔ ዉርሲ ዮቲዳ። 
ACT.14.28	ሄን ኣማኒዛይታራ ዳሮ ዎዴ ጋምዒዳ።
ACT.15.1	ኢሲ ኢሲ ኣሳቲ ዩሁዳፔ ዱጌ ኣንፆኪያ ዎꬊዲ “ኢንቴ ሙሴ ዎጋ ማላ ቃፃሬቶንታ ኣጊኮ ኦኒካ ኣታናስ ዳንዳዬኬታ” ጊዲ ኣማኒዛይታ ታማርሶ ዶሚዳ። 
ACT.15.2	ሄሲካ ጳዉሎሳኔ ባርናባሳ ጊታ ፓላማኒኔ ኦሻ ጊዶ ጌልꬂዴስ፤ ሄሳ ጊሽ ጳዉሎሲኔ ባርናባሲ ሃራ ኢሲ ኢሲ ኣማኒዛ ኣሳታራ ዬሩሳላሜ ኬዚዲ ሃ ዮዖዛ ጊሽ ጪማታኔ ሃዋሬታ ኦይቻና ማላ ጌቴቲዴስ።
ACT.15.3	ሄሳ ጊሽ ዎሳ ኬꬃያ ኢስታ ዬሩሳላሜ ባና ማላ ኪቲን ኢስቲ ፒንቄራኔ ሳማሪያራ ኣꬊ ቢሼ ሄን ዲዛ ኣሳ ኣይዛቤቲ ኣማኖን ሲሚዳይሳ ዮቲዳ፤ ሄ ዎዴ ኣማኒዛይቲ ሄሳ ሲይዲ ኬሂ ኡፋዬቲዳ። 
ACT.15.4	ኢስቲ ዬሩሳላሜ ጋኪን ዎሳ ኬꬃ ኣሳይ ሃዋሬቲኔ ጪማቲ ኢስታ ሞኪ ኤኪዳ፤ ኪቴቲ ቢዳይቲካ ፆሲ ኢስታራ ጊዲዲ ኦꬂዳይሳ ዉርሲ ኢስታስ ዮቲዳ። 
ACT.15.5	ፋርሳዌታ ባጋ ኣሳታፔ ኣማኒዳ ኢሲ ኢሲ ኣሳቲ ዴንዲዲ “ኣይዛቤቲ ቃፃሬታናሲኔ ሙሴ ዎጋ ናጋና ማላ ኢስታስ ዮታናስ ቤሴስ” ጊዳ።
ACT.15.6	ሃዋሬቲኔ ጪማቲ ሄ ዮዖዛ ጊዶ ሎዔꬅ ፄላናስ ሺቂዳ። 
ACT.15.7	ዳሮ ፓላማፔ ጉዬ ጴፅሮሲ ዴንዲ ኤቂዲ፥ “ታ ኢሻቶ! ጉꬃ ዎዴፔ ካሴ ፆሲ ታና ኢንቴ ጊዶፌ ዶሪዲ ኣይዛቤቲ ታ ዱናፔ ሚሺራቾ ቃላ ሲይዲ ኣማናና ማላ ኦꬂዳይሳ ኢንቴ ኤሬታ። 
ACT.15.8	ኣሳ ዎዝና ኤሪዛ ፆሲ ኑስ ኢሚዳይሳ ማላ ኢስታስካ ፂሎ ኣያና ኢሚዲ ኢስታ ባስ ኤኪዳይሳ ማርካቲዴስ። 
ACT.15.9	ኢስታ ዎዝናካ ኣማኖን ጌሺዲ ኑ ጊዶኒኔ ኢስታ ጊዶን ኣይኮ ሻኮካ ኦꬂቤና። 
ACT.15.10	ሄሳ ጊሽ ኑ ኣዋቲኔ ኑካ ቶካናስ ዳንዳዮንታ ቃምባራ ኣማኒዛይታ ቶሳናስ ኢንቴ ኣዛስ ፆሴ ፓጬቲ? 
ACT.15.11	ኑ ኣቲዳይ ሊኬ ኢስታꬆካ ጎዳ ዬሱሳ ኣꬎ ኪያቴꬃን ጊዲዳይሳ ኣማኖስ” ጊዴስ።
ACT.15.12	ሺቂዳ ኣሳይ ዉሪካ ጮዑ ጊን ባርናባሲኔ ጳዉሎሲ ፆሲ ኢስታ ባጋራ ኣይዛቤታ ጊዶን ኦꬂዳ ጊታ ማላታታ ጊሽ ዮቲሺን ማላሌቲዲ ሎዔꬂ ሲዪዴስ። 
ACT.15.13	ኢስቲ ዮቲ ዉርሲሺን ያቆቤይ ዴንዲ ኤቂዲ ሂዝጊዴስ “ታ ኢሻቶ! ታ ጊዛይሳ ሲዪቴ፤ 
ACT.15.14	ፆሲ ኣይዛቤታፔ ባስ ጊዳና ዴሬ ካሴቲዲ ኢዚ ዎስቲ ፄይጊ ዎꬂዳኮ ሲሞኒ ኑስ ሎዔꬂ ዮቲዴስ። 
ACT.15.15	ካሴ ናቤታን ሂዝጊ ፃፌቲዳ ቃላይ ሃይሳራ ጋጌስ።
ACT.15.16	‘ሃይሳፌ ጉዬ ታ ሲማዳ
ACT.15.16	ላሌቲዳ ዳዉቴ ኬꬄ ኬፃና፤
ACT.15.16	ላሌቲዳይሳ ዛራ ኤሳና፤ ዛራዳካ ኬፃና።
ACT.15.17	ሄሲካ ኣቲዳ ኣሳይ ጎዳ ኮያና ማላኔ
ACT.15.17	ታ ሱንꬃን ፄይጌቲዳ ኣይዛቤቲ ታና ኮያና
ACT.15.17	ማላ ጌስ ዉርሲ ኦꬂዳ ፆሲ፤ 
ACT.15.18	ሃይሳ ኮይሮፔካ ኤርሲዳ ፆሲ ታና’ ጊዴስ።
ACT.15.19	“ሄሳ ጊሽ ሃ ፆሳኮ ሲሚዳ ኣይዛቤታ ኑ ሜቶꬆንታ ማላ ሃይሲ ታ ባጋራ ታስ ቃሾ። 
ACT.15.20	ጊዶ ኣቲን ኤቃስ ያርሼቲዲ ቱኒዳ ካꬅ ሞፒቴ፤ ላይማፔ ሃኪቴ፤ ባዉቲ ሃይቂዳ ሜሄ ኣሾ ሞፒቴ፤ ሱꬅ ኡዮፒቴ ጊዲ ኑ ኢስታስ ፃፋና ቤሴስ። 
ACT.15.21	ሙሴ ዎጋይ ጊዲኮ ቤኒሶፌ ሳምባታ ሳምባታ ጋላስ ኣይሁዳታ ዎሳ ኬꬃን ናቤቤቲሼኔ ካታማይ ዲዛሶን ሳባኬቲሼ ዴስ” ጊዴስ።
ACT.15.22	ሄ ዎዴ ሃዋሬቲኔ ጪማቲ ኩሜꬃ ዎሳ ኬꬃ ኣሳራ ጊዲዲ ባ ጊዶፌ ኢሲ ኢሲ ኣሳታ ዶሪዲ ጳዉሎሳራኔ ባርናባሳራ ጋꬂ ኣንፆኪያ ዬዳናስ ቃቺዳ። ኣማኒዛ ኣሳ ጊዶፌ ዋናቲዛይታ ባርሳባሳ ጌቴቲዛ ዩሁዳኔ ሲላሴ ዶሪዳ። 
ACT.15.23	ኢስታ ኩሼን ኢሚ ዬዲዳ ዳብዳቤዚ “ኢንቴ ኢሻታፔ፥ ሃዋሬታፔ፥ ጪማታፔ፥ ኣይዛቤታፔ ኣማኒዳ ኣንፆኪያኒኔ ሶሪያን፥ ኪልቂያንካ ዲዛ ኣማኒዛይታስ ኑ ሳሮካይ ኢንቴና ጋኮ።
ACT.15.24	“ኢሲ ኢሲ ኣሳቲ ኑፔ ጊዶንታ ባ ባጋራ ኑ ኣቻፌ ቢዲ ባ ሃሳያን ኢንቴ ዎዝና ያኔ ሃኔ ቃꬂዳይሳኔ ኢንቴና ቡልዓኪዳይሳ ኑ ሲዪዶስ። 
ACT.15.25	ሄሳ ጊሽ ጉꬃ ኣሳታ ዶሪዲ ዶሴቲዳ ባርናባሳራኔ ጳዉሎሳራ ኢንቴኮ ዬዳናስ ኑ ዉሪካ ቃላ ጋጊዶስ። 
ACT.15.26	ኢስቲ ጎዳ ዬሱስ ኪርስቶሳ ጊሽ ባ ሼምፖ ኣꬂ ኢሚዳይታ። 
ACT.15.27	ሄሳ ጊሽ ኑ ኢንቴስ ፃፊዳይሳ ኢስቲ ኢንቴስ ባ ዱናራ ሎዔꬂ ዮታና ማላ ዩሁዳኔ ሲላሴ ኢንቴኮ ዬዲዶስ። 
ACT.15.28	ሃይታ ኢንቴስ ኮሺዛ ዮዖታፔ ሃራ ዴፆ ቶሆ ኑ ኢንቴ ቦላ ዎꬆንታ ማላ ኑሲኔ ፂሎ ኣያናስ ሎዖ ሚሳቲ ቤቲዴስ። 
ACT.15.29	ሄሲካ ኢንቴ ኤቃስ ሹኬቲዳ ኣሾፔ፥ ሱꬃፌ፥ ባዉቲ ሃይቂዳ ሜሄ ኣሾፔኔ ላይማፔ ኢንቴ ሃካና ማላ፤ ኢንቴ ሃይታ ሚሳቲዛይታፔ ሃኪኮ ኢንቴስ ሎዖ፤ ሳሮን ዲቴ” ጌስ።
ACT.15.30	ኪቴቲዳ ኣሳቲ ሞይዜቲዲ ዱጌ ኣንፆኪያ ዎꬊዳ፤ ሄን ኣማኒዛይታ ዉርሲ ሺሺዲ ኤሂዳ ዳብዳቤዛ ኢስታስ ኢሚዳ። 
ACT.15.31	ዴሬይካ ናባቢዲ ሚንꬄꬂዛ ቃላን ኡፋዬቲዴስ። 
ACT.15.32	ዩሁዳይኔ ሲላሲ ናቤታ ጊዲዳ ጊሽ ዳሮ ዞሪዲ ኣማኒዛይታ ሚንꬄꬂዳ። 
ACT.15.33	ሄን ጉꬃ ዎዴ ጋምዒዲ ኣማኒዛ ኣሳይ ሞይዚን ጉዬ ባና ኪቲዳይታኮ ሲሚዳ። 
ACT.15.34	ሲላሲ ቃስ ሄን ኣታናስ ኮዪዴስ። 
ACT.15.35	ጳዉሎሲኔ ባርናባሲ ሃራ ዳሮ ኣሳታራ ጊዲዲ ጎዳ ቃላ ታማርሲሼኔ ሳባኪሼ ኣንፆኪያን ጋምዒዳ።
ACT.15.36	ጳዉሎሲ ጉꬃ ዎዴ ጋምዒዲ ባርናባሳ “ኑ ካሴ ጎዳ ቃላ ዮቲዳ ኡባ ካታማታ ቢዲ ኣማንዛይቲ ኣይ ማላ ዲዛኮኔ ኣኔ ዩዪ ቤዮስ፥ ዴንዳ” ጊዴስ። 
ACT.15.37	ባርናባሲካ ማርቆሳ ጌቴቲዛ ዮሃኒሲ ኢስታራ ባና ማላ ኮዪዴስ። 
ACT.15.38	ጳዉሎሲ ቃስ ኢዛ ኤኪ ባናስ ኮይቤና፤ ጋሶይካ ካሴ ማርቆሲ ኢስታፌ ሻኬቲዲ ጲንፊሊያ ጊዛሶን ጉዬ ኣቲዲ ኢስታራ ኦሶስ ሲንꬅ ኬዞንታ ኣጊዳ ጊሻሳ። 
ACT.15.39	ሂስቲን ዳሮ ፓላማይ ኢስታ ጊዶን ሜꬌቲዳ ጊሽ ባ ጊዶን ሻኬቲ ዎꬊዳ፤ ሄሳ ጊሽ ባርናባሲ ማርቆሳ ኤኪዲ ማርካቤን ጌሊዲ ቆጲሮሴ ቢዴስ። 
ACT.15.40	ጳዉሎሲ ቃስ ሲላሴ ዶሪዴስ። ኣማንዛይቲካ ጳዉሎሳ ጎዳ ኣꬎ ኪያቴꬃስ ሃዳራ ኢሚዳፔ ጉዬ ኢዚ ኢስታፌ ሻኬቲዲ ቢዴስ። 
ACT.15.41	ኣማኒዛይታ ሚንꬄꬂሼ ሶሪያራኔ ኪልቂያራ ኣꬊ ቢዴስ።
ACT.16.1	ጳዉሎሲ ዴርቤኔ ጌቴቲዛሶኔ ሊስቲራ ጋኪዲ ኢዛ ኣዋይ ጊሪኬ ኣስ፥ ኣዪያ ቃስ ኣይሁዳ ኣስ ጊዲዳ ፂምቶሳ ጌቴቲዛ ኢሲ ኣማኒዛዴ ሄን ዴሚዴስ። 
ACT.16.2	ኢዚካ ሊስቲራኒኔ ኢቆኒዮን ኣማኒዛ ኣሳ ኣቻን ሎዖ ማርካቴꬅ ዲዛዴ። 
ACT.16.3	ጳዉሎሲካ ፂምቶሳ ባናራ ኤኪ ባናስ ኮዪዴስ። ሄሳ ጊሽ ሄ ሄራን ኣይሁዳታ ጊሽ ጊዲ ፂምቶሳ ቃፃሪዴስ። ጋሶይካ ኣይሁዳቲ ፂምቶሳ ኣዋይ ጊሪኬ ኣስ ጊዲዳይሳ ኤሪዛ ጊሻሳ።
ACT.16.4	ኢስቲ ኢሲ ካታማፔ ሃራ ካታማ ኣꬊ ኣꬊ ቢሼ ሃዋሬቲኔ ዬሩሳላሜ ዎሳ ኬꬃ ጪማቲ ዬዲዳ ኪታ ኣሳይ ኤኪዲ ናጋና ማላ ኣማኒዛ ኣሳስ ኢሚ ኢሚ ኣꬊዳ። 
ACT.16.5	ዎሳ ኬꬃ ኣሳይ ኣማኖን ሚኒ ሚኒ ቢዴስ፤ ቃሴ ኣሳይካ ቆዳን ጋላስ ጋላስ ጉጄቲ ጉጄቲ ቢዴስ።
ACT.16.6	ጳዉሎሲኔ ኢዛራ ዲዛ ዛታቲ ቃላ ኢሲያን ሳባኮንታ ማላ ፂሎ ኣያናይ ዲጊዳ ጊሽ ፒርጊያራኔ ጋላቲያ ዴሬራ ኣꬊ ቢዳ። 
ACT.16.7	ኢስቲ ሚሲያ ጌቴቲዛሶ ጋካና ማቲሼ ቢቲኒያ ጌቴቲዛሶ ጌላና ቆፒን ዬሱሳ ኣያናይ ኢስታ ዲጊዴስ። 
ACT.16.8	ሄሳ ጊሽ ሚሲያራ ኣꬊዲ ፂሮዓዳ ጌቴቲዛሶ ዎꬊዳ። 
ACT.16.9	ኢሲ ማቂዶኒያ ኣሲ ኤቂዲ ጳዉሎሳ ሃ ማቂዶኒያ ፒናዳ ኑና ማዳ ጊሺን ጳዉሎሲ ኦማርስ ኣጁታን ቤዪዴስ። 
ACT.16.10	ኢዚካ ሄ ኣጁታ ቤዪዲ ፆሲ ኑ ኢስታስ ሚሺራቾ ቃላ ዮታና ማላ ፄይጊዴስ ጊ ቃቺዲ ኑ ሄራካ ጌዴ ማቂዶኒያ ባና ኮዪዶስ።
ACT.16.11	ማርካቤራ ፂሮዓዳ ጌቴቲዛሶፔ ዴንዲዲ ሲቲ ጊዲ ሳሞቲራቄ ጌቴቲዛሶ ቢዶስ። ዎንቴꬃ ጋላስ ናጱሌ ጊዛሶ ሲንꬅ ሃሙꬅ ጉጂዶስ። 
ACT.16.12	ሄፔካ ኦሮሜ ኣሳይ ቶራን ሃሪዳ ዴሬ ጊዲዳ ማቂዶኒያ ዴሬ ዋና ካታማ ጊዲዳ ፒሊጲሲዮሴ ጌቴቲዛሶ ጌሊዶስ። ሄንካ ኡንዴና ዎዴ ኡቲዶስ።
ACT.16.13	ሳምባታ ጋላስ ዎሳ ዎሲዛሶ ኮዪሼ ካታማ ጌሊዛሶ ፔንጌ ኬዚዲ ዱጌ ሻፋ ዎꬎስ፤ ኑ ሄን ኡቲዲ ሺቂ ዲዛ ማጫሳስ ቃላ ዮቲዶስ። 
ACT.16.14	ቃላ ሎዔꬂ ሲዪዛ ማጫሳታፔ ኢሲ ሊዲያ ጌቴቲዛራ ኢዛካ ፆሴ ጎይንዛሮኔ ቲያፂሮኔ ካታማፔ ያዳ ዞዖ ሃሬ ማይዖ ዛልዒዛሮ ጳዉሎሲ ዮቲዛ ቃላ ኢዛ ዎዝናን ዎꬃ ሲያና ማላ ጎዳይ ኢዚ ዎዝና ዶዪዴስ። 
ACT.16.15	ኢዛኔ ኢዚሶ ኣሳይካ ፃማቄቲዳፔ ጉዬ ኢዛ ኢስታ ታ ፆሴ ኣማኒዲ ኢንቴ ቱሙ ኤሪዳ ጊዲኮ ሃ ታሶ ዪዲ ጉꬃ ዎዴ ዲሺቴ ጋዳ ኢስታ ሚንꬃ ዎሳዱስ።
ACT.16.16	ኢሲ ጋላስ ኑ ዎሳሶ ቢሺን ካዮ ካዮታ ማሮትዛ ኢሲ ጋራዴ ና ዲዛራ ኑና ዴማዱስ። ኢዛካ ባ ማሮቴꬃን ባና ኣይሲዛይታስ ዳሮ ሚሽ ጌልꬃዉስ። 
ACT.16.17	ሃና ጋራዴ ናያ ጳዉሎሳኔ ኑና ካላ ካላ “ሃይቲ ኣሳቲ ኢንቴስ ኢንቴ ኣታና ኦጌ ዮቲዛይቲ ዎጋ ፆሳ ኦሳንቻታ” ጋ ጋ ዋሳዱስ። 
ACT.16.18	ሄሳካ ዳሮ ጋላስ ሺራ ሺራ ጋዱስ። ጊዶ ኣቲን ጳዉሎሲ ሃ ኢዚ ቃላን ዳሮ ሜቶቲዳ ጊሽ ኢዚኮ ሲሚዲ ኢዚ ዱናራ ሃሳዪዛ ቱና ኣያናዛ “ኔ ኢዚፔ ኬዛና ማላ ታ ኔና ጎዳ ዬሱስ ኪርስቶሳ ሱንꬃን ኣዛዛይስ” ጊዴስ። ሄ ኣያናይ ሄራካ ዬጊ ኢዚፔ ኬዚዴስ።
ACT.16.19	ኢዞ ኣይሲዛ ኣሳቲ ኢስታስ ሚሼ ዴሚዛ ኦጌይ ዱፂን ኢስታ ኡፋይሲ ቃንፄቲዳይሲ ኢስታስ ጌሊን ጳዉሎሳኔ ሲላሴ ኦይኪዲ ቢታራ ጎቺዲ ዋናቲ ዲዛሶ ጊያ ጊዶ ኤፊዳ። 
ACT.16.20	ዴሬ ኣይሲዛ ዋናታኮ ሺሺዲ “ሃይቲ ኣሳቲ ባስ ኣይሁዳ ኣስ ጊዲ ኡቲዲ ኑ ካታማ ቡላኬቴስ፤ 
ACT.16.21	ቃሴ ኑ ኦሮሜ ኣሳቲ ኤካናስ ዎይኮ ኦꬃናስ ኑስ ቤሶንታ ዎጋ ኑ ኣሳ ጊዶን ላሌቴስ” ጊዳ።
ACT.16.22	ዴሬይካ ኢሲ ቦላ ጊዲዲ ጳዉሎሳ ቦላኔ ሲላሴ ቦላ ዴንዲዴስ። ዴራ ኣይሲዛይቲ ጳዉሎሳንታ ማይዖ ቃሪ ኤኪዲ ዱርቃራ ቆፃና ማላ ኣዛዚዳ። 
ACT.16.23	ኢታ ቡካ ቡኪዲ ጌዴ ቃሾ ኬꬃን ዬጊዳ። ቃሾ ኬꬃ ናጊዛይሲካ ኢስታ ሎዔꬂ ናጋና ማላ ኣዛዚዳ። 
ACT.16.24	ኢዚካ ሄሳ ማላ ሚኖ ኣዛዞ ኤኪዲ ቃሾ ኬꬃስ ዋና ጊዶ ኪፊሌ ጌልꬂዲ ኢስታ ቶሆ ጊታ ዱሩማራ ሺሺ ቃቺዴስ።
ACT.16.25	ጊዲ ጊዶꬅ ጊዲሺን ጳዉሎሲኔ ሲላሲ ዎሳኒኔ ማዛሙሬን ፆሳ ጋላቲሺን ቃሾ ኣሳይ ኢስታ ዬꬃኔ ጋላታ ኤዝጊ ሲዪዴስ። 
ACT.16.26	ሃሳዓይ ባይንዳ ዲንጋቴ ቃሾ ኬꬃ ፃጶፔ ቃꬂዛ ሚኖ ቢታ ቃꬂ ሃኒዴስ፤ ሄራካ ቃሾ ኬꬃ ፔንጌቲ ዶዬቲዳ። ቃሼቲዳ ኡባ ኣሳ ቃሾይ ቢርሼቲዴስ። 
ACT.16.27	ቃሾ ኬꬃ ናጊዛይሲ ꬊስኮፌ ቤጊዲ ቃሾ ኬꬃ ፔንጌቲ ዶያ ዲዛይሳ ቤዪዲ ቃሾ ኣሳይ ዉሪ ኬሲ ኤኪዳ ሚሳቲን ባና ዎꬋና ማሻ ሾዲዴስ። 
ACT.16.28	ጳዉሎሲ ቃስ ባ ቃላ ꬎቁ ሂስቲዲ “ኑ ዉሪ ሃን ዶስ! ኔ ቦላ ኣይኔ ኢታ ኦꬆፋ” ጊ ዋሲዴስ።
ACT.16.29	ቃሾ ኬꬃ ናጊዛይሲ ፆምፔ ዎሲ ኤኪዲ ጌዴ ጊዶ ጉፒ ጌሊዴስ፤ ኮኮርሼ ጳዉሎሳ ቶሆ ቦላኔ ሲላሴ ቶሆ ቦላ ኩንዲዴስ። 
ACT.16.30	ኢስታ ኤኪ ካሬ ኬዚዲ “ሃ ኣሳቶ! ታ ኣታና ማላ ኣይ ኦꬆ?” ጊዴስ።
ACT.16.31	ኢስቲካ ኢዛስ “ጎዳ ዬሱሳ ኣማና፤ ኔካ ኔሶ ኣሳይካ ኢንቴ ዉሪ ኣታና” ጊዳ። 
ACT.16.32	ሄሳፌ ጉዬ ኢዛሲኔ ኢዛሶን ዲዛ ኣሳስ ኡባስ ጎዳ ቃላ ዮቲዳ። 
ACT.16.33	ቃሾ ኬꬃ ናጊዛይሲ ሄራካ ሄ ጋላስ ቃማራ ኤፊዲ ኢስታ ማዱንꬃ ሜጪዴስ። ሄራካ ኢዚኔ ኢዛሶ ኣሳይ ዉሪ ፃማቄቲዳ። 
ACT.16.34	ቃሾ ኬꬃ ናጊዛይሲካ ኢስታ ባ ኬꬄ ኤፊዲ ኢስታስ ካꬅ ኣꬂዴስ። ባሶ ኣሳ ኡባራ ፆሳ ኣማኒዳ ጊሽ ኣዴዚ ዳሮ ኡፋዪዴስ።
ACT.16.35	ጋዴይ ዎንቲሺን ዴሬ ኣይሲዛይቲ “ሄይታ ኣሳታ ቢርሻ ዬዳ” ጊዲ ባ ሹሜታ ቃሾ ኬꬃ ናጊዛይሳኮ ዬዲዳ። 
ACT.16.36	ቃሾ ኬꬃ ናጊዛይሲካ ኢስታስ “ዴሬ ኣይሲዛይቲ ኢንቴ ቢርሼታና ማላ ኣዛዚዳ፤ ሄሳ ጊሽ ሃዒ ሳሮን ኬዚ ቢቴ” ጊዲ ጳዉሎሳስ ዮቲዴስ። 
ACT.16.37	ጳዉሎሲ ቃስ “ኑ ኦሮሜ ዬሌቴꬅ ጊዲሺን ፒርዳይ ባይንዳ ዴሬ ሲንꬃን ዱርቃራ ቡኪዲኔ ቃሾ ኬꬃን ዬጊዳ። ሂስቲን ሃዒ ቃስ ኑና ቆታራ ኣሲ ኤሮንታ ኬሳና ኮዪዞ? ሄሲ ሃኔና፤ ኢስቲ ዪዲ ባርካ ቢርሼቶ!” ጊዴስ።
ACT.16.38	ሹሜቲ ሄ ኢዚ ጊዳ ቃላ ዴሬ ኣይሲዛይታስ ዮቲዳ ኢስቲካ ጳዉሎሲኔ ሲላሲ ኦሮሜ ዬሌታ ጊዲዳይሳ ሲይዲ ዳጋሚዳ። 
ACT.16.39	ዪዲ ኢስታፌ ማሬቴꬅ ኦይቺዲ ዎይኔፔ ኬሲዳ። ኢስቲ ሄ ካታማዮ ኣጊዲ ሃራሶ ባና ማላ ኢስታ ዎሲዳ።
ACT.16.40	ጳዉሎሲኔ ሲላሲ ቃሾ ኬꬃፌ ኬዚዲ ሊዲያሶ ቢዳ። ሄንካ ዲዛ ኣማኒዛይቲ ኢስታ ዳሮ ሚንꬄꬂዲ ሄፔ ኬዚ ቢዳ።
ACT.17.1	ጳዉሎሲኔ ሲላሲ ኣንፊጶላኔ ኣጶሎኒያ ጌቴቲዛ ዴሬራ ኣꬊዲ ታሶሎንቄ ጌቴቲዛ ዴሬ ቢዳ። ሄንካ ኣይሁዳታ ዎሳ ኬꬂ ዴስ። 
ACT.17.2	ጳዉሎሲካ ኢዛስ ዶሴ ጊዲዳ ማላ ኣይሁዳታ ዎሳ ኬꬄ ጌሊዴስ። ሄꬑ ሳሚንታ ኩሜꬅ ቃላፔ ኤኪ ኤኪ ኢስታራ ሃሳዬቲዴስ። 
ACT.17.3	ኪርስቶሲ ዋዬ ኤካናሲኔ ሃይቂ ዴንዳናስ ቤሲዛይሳ ቆንጪሲ ኣማንꬆን “ሃይሲ ታ ሳባኪዛ ዬሱሲ ኢዚ ኪቴቲ ያና ጌቴቲዳይሳኮ!” ጊዴስ። 
ACT.17.4	ኣይሁዳታፔ ኢሲ ኢሲ ኣሳይ ባ ሲዪዳይሳ ኣማኒዲ ጳዉሎሳራኔ ሲላሴራ ኢሲፌ ጊዲዴስ። ቃሴካ ዳሮ ዴሬይ ፆሴ ባቢዛ ጊሪኬታፔ ዳሮ ኤሬቲዳ ማጫሳቲ ባ ሲዪዳ ቃላን ኣማኒዲ ኢስታራ ኢሲኖ ጊዲዳ።
ACT.17.5	ኣይሁዳቲ ቃሴ ኢስታ ቃናቲዲ ጊያን ዲዛ ዎርዶ ኣሳታ ሺሺዲ ኩሜꬃ ዴሬዛ ኢስታ ቦላ ዴንꬄꬂዲ ካታማን ሺሮ ሜꬊዳ። ጳዉሎሳኔ ሲላሴ ሺሺዲ ዴራ ሲንꬃን ኤሳናስ ኢሲ ኢያሶኔ ጌቴቲዛይሳሶ ኮያናስ ኤሌሊ ቢዳ። 
ACT.17.6	ጊዶ ኣቲን ኢስታ ኢያሶኔ ኬꬃን ዴሞንታ ኣጊዳ ጊሽ ኢያሶኔኔ ሃራ ኣማኒዛ ኣሳታ ካታማ ዳናታ ሲንꬃራ ጎቺሼ “ሃይቲ ኣሳቲ ዴሬ ዉርሲ ቡልዓኪ ካዒሼ ጋምዒዲ ቃሴ ሃዒ ሃ ዪዳ። 
ACT.17.7	ኢያሶኔይካ ኢስታ ባ ኬꬃን ዎꬂዴስ። ሃይቲ ኣሳቲ ዉሪ ‘ዬሱሳ ጌቴቲዛ ሃራ ካዎይ ዴስ’ ጊዲ ቄሳሬ ዎጋ ኤኬቴና” ጊሼ ዋሲዳ። 
ACT.17.8	ዴሬይኔ ሄ ካታማ ዳናቲ ሄሳ ሲይዲ ባ ጊዶን ቡቄቲዳ። 
ACT.17.9	ኢያሶኔኔ ሃራታካ ዋሴ ፄይጊሲዲ ዬዲዳ።
ACT.17.10	ኣማኒዛይቲ ሄራካ ጳዉሎሳኔ ሲላሴ ቃማራ ቤሪያ ዬዲዳ። ኢስቲካ ሄ ጋኪዳ ማላ ኣይሁዳታ ዎሳ ኬꬄ ጌሊዳ። 
