MAT.1.1	ዳዉቴ ና፥ ኣብራሃሜ ና ጊዲዳ ዬሱስ ኪርስቶሳ ዬሌቴꬃ ዛርኬይ ሃይሳፌ ካሊዛይሳ፤
LUK.8.47	ማጫሳያ ኤሬቶንታ ቆቴታዳ ባናስ ዳንዳዮንታይሳ ኤራዳ ኮኮራሼ ያዳ ዬሱሳ ሲንꬃን ኩንዳዱስ። ኢዛካ ዬሱሳ ዋና ቦቺዳኮኔ ቃሴካ ኤሌራ ዋና ፓፂዳኮ ኡባ ኣሳ ሲንꬃን ዮታዱስ። 
LUK.8.48	ኢዚካ “ታ ናዬ! ኔ ኣማኖይ ኔና ፓꬂዴስ፤ ሳሮን ባ!” ጊዴስ።
LUK.8.49	ዬሱሲ ቡሮ ማጫሳይስ ሃሳያ ቦላ ዲሺን ኣይሁዳ ዎሳ ኬꬄ ሃላቃ ኢያዒሮሳ ኬꬃፌ ኢሲ ኣሲ ኢያዒሮሳስ “ኔ ናያ ሃይቃዱስ፤ ሄሳ ጊሽ ሃይሳፌ ጉዬ ኣስታማሬዛ ሜላ ዳቡርሶፋ!” ጊዴስ።
LUK.8.50	ዬሱሲ ሄሳ ሲይዲ ኢያዒሮሳ “ኣይኮይ ባ፤ ባቦፋ! ኣማና ኣቲን ኔ ናያ ፓፃና” ጊዴስ።
LUK.8.51	ዬሱሲ ኢያዒሮሳ ኬꬄ ጌሊዛ ዎዴ ጴፅሮሳ፥ ዮሃኒሳኔ ያቆቤ ቃሴካ ናይ ኣዋፔኔ ኣዬዪፔ ኣቲን ሃራይ ኦኒካ ኢዛራ ጌላና ማላ ኮይቤና። 
LUK.8.52	ሄ ዎዴ ኣሳይ ዉሪ ናይስ “ዉ ዉይ!” ጊ ዋሲ ዬኪሺን ዬሱሲ “ዬኮፍቴ ኢዛ ኢቻዱስ ኣቲን ሃይቃቤኩ” ጊዴስ።
LUK.8.53	ኣሳይካ ናያ ሃይቂዳይሳ ኤሪዛ ጊሽ ዬሱሳ ቦላ ሚጪዴስ። 
LUK.8.54	ጊዶ ኣቲን ኢዚ ናይ ኩሼ ኦይኪዲ “ታ ናዬ! ዴንዳ!” ጊዴስ። 
LUK.8.55	ናይስ ሼምፖይካ ሲሚዴስ። ሄራካ ዴንዳ ኤቃዱስ፤ ዬሱሲካ ኢዚስ ሚዛ ሚሽ ኢማና ማላ ኣዛዚዴስ። 
LUK.8.56	ናዮ ዬሊዳይቲካ ማላሌቲዳ። ጊዶ ኣቲን ኢዚ ሃኒዳይሳ ኦናስካ ዮቶንታ ማላ ኣዛዚዴስ።
LUK.9.1	ዬሱሲካ ታማኔ ናምዑ ሃዋሬታ ኢሲፌ ፄይጊዲ ዳይዳንꬃታ ኬሳና ማላኔ ሃርጌፌ ፓꬃና ማላ ኢስታስ ዎልቃኔ ጎዳቴꬅ ኢሚዴስ፡ 
LUK.9.2	ቃሴካ ፆሳ ካዎቴꬃ ዮታናሲኔ ሃርጊዛይታ ፓꬃናስ ኢስታ ኪቲዴስ። 
LUK.9.3	ኢስታስ “ኦጌ ቢሼ ጉፌ ዎይኮ፥ ቃራፂቴ ዎይኮ፥ ቁማ ዎይኮ፥ ሚሼ ዎይኮ ናምዑ ማይዖ ኦይኪ ባናስ ኮሼና። 
LUK.9.4	ኢንቴካ ሄ ካታማይፔ ኬዛና ጋካናስ ኮይሮ ጌሊዳ ኦና ኬꬃንካ ጊዲን ሄን ጋምዒቴ። 
LUK.9.5	ካታማ ኣሳይ ኢንቴና ሞኪ ኤኮንታ ኢፂኮ ሄ ካታማይፔ ኬዚዲ ኢንቴና ሞኮንታይታስ ማርካ ጊዳና ማላ ኢንቴ ቶሆን ዲዛ ጉዱላ ፒቲዲ ኬዚቴ” ጊዴስ።
LUK.9.6	ኢስቲካ ጎዳይ ጊዳ ማላ ኬዚዲ ሚሺራቾ ቃላ ዮቲሼኔ ሃርጋንቻታ ፓꬂሼ ጉታን ጉታን ዩዪዳ።
LUK.9.7+LUK.9.8	ሄ ዎዴ ኢሲ ኢሲ ኣሳቲ “ዮሃኒሲ ሃይቆፔ ዴንዲዴስ” ባጋይቲ “ኤላሲ ኬዚዲ ቤቲዴስ።” ቃሴ ባጋይቲ “ቤኒ ናቤታፔ ኢሶይ ሃይቆፔ ዴንዲዴስ” ጊዲ ሃሳዬቲዛ ጊሽ ዩሁዳ ቢታ ሃሪዛ ሄርዶሲ ሄሳ ሲይዲ ሃኒዛ ሚሻን ባ ዎዝናን ሜቶቴቲዴስ። 
LUK.9.9	ሄርዶሲካ “ታኒ ኢዛ ቆꬌ ቃንፂዳ ፃማቂዛ ዮሃኒሲ ሃይቂዴስ። ሂስቲን ኢዛ ጊሽ ሃይሳ ማላ ሃሳዬቲሺን ታ ሲዪዛይስ ኢዚ ኦኔ?” ጊዲ ኢዛ ባ ኣይፌራ ቤያና ኮይዴስ።
LUK.9.10	ሃዋሬቲካ ሲሚዲ ኢስቲ ኦꬂዳይሳ ዉርሲ ዬሱሳስ ዮቲዳ። ኢዚካ ኢስታ ፃላ ባናራ ኤኪዲ ቤቴሳይዳ ጌቴቲዛ ፖቄꬃን ዲዛ ካታማ ቢዴስ። 
LUK.9.11	ጊዶ ኣቲን ዳሮ ኣሳይ ሄሳ ኤሪዲ ኢስታ ካሊዴስ። ኢዚካ ኢስታ ሞኪ ኤኪዲ ፆሳ ካዎቴꬃ ጊሽ ዮቲዴስ። ቃሴካ ሃርጌፌ ፓꬃናስ ቤሲዛይታ ፓꬂዴስ።
LUK.9.12	ጋዴይ ሌምዒሺን ታማኔ ናምዑ ሃዋሬቲ ኢዛኮ ሺቂዲ “ኑኒ ዲዛይ ባዞ ቢታን ጊዲዳ ጊሽ ኣሳይ ቢዲ ባስ ኣቃናሶኔ ሚዛ ሚሽ ኮያና ማላ ኣሳ ሞይዛ” ጊዳ።
LUK.9.13	ጊዶ ኣቲን ኢዚ ኢስታስ ዛሪዲ “ኢንቴ ኢስታስ ሚዛዝ ኢሚቴ” ጊዴስ። ኢስቲካ “ኑስ ኢቻሹ ኡኬꬃፌኔ ናምዑ ሞሌፔ ሃራይ ባ። ሃ ኣሳስ ጊዲዛ ካꬅ ኮሺኮ ሻማናስ ቤሴስ” ጊዳ። 
LUK.9.14	ዬሱሲካ ባና ካሊዛይታ “ኣሳ ኢቻሹ ታሙ፥ ኢቻሹ ታሙ ሂስቲ ሻኪ ሻኪ ኡቲሲቴ” ጊዴስ። ሄንካ ኢቻሹ ሺ ጊዲዛ ኣቱማሳይ ዴስ። 
LUK.9.15	ዬሱሳ ካሊዛይቲካ ዬሱሲ ኣዛዚዳ ማላ ኣሳ ዉርሲ ኡቲሲዳ። 
LUK.9.16	ዬሱሲካ ኢቻሹ ኡኬꬃኔ ናምዑ ሞሌታ ኦይኪዲ ፑዴ ሳሎ ፄሊዲ ፆሳ ጋላቲዴስ። ኢዚካ ኡኬꬃ ሜንꬂዲ ኣሳ ጋꬃና ማላ ባና ካሊዛይታስ ኢሚዴስ። 
LUK.9.17	ኣሳይ ዉሪካ ሚዲ ካሊዴስ። ዬሱሳ ካሊዛይቲካ ኣሳፔ ኣቲዳ ታማኔ ናምዑ ሌማቴ ኩሜꬅ ማዳፌ ዴንꬂዳ።
LUK.9.18	ኢሲ ጋላስ ዬሱሲ ባርካ ዎሲሺን ኢዛ ካሊዛይቲ ኢዛኮ ዪዳ። ኢዚካ ኢስታ “ኣሳይ ታና ኦና ጊዜ?” ጊዲ ኦይቺዴስ።
LUK.9.19	ኢስቲካ ኢዛስ “ኢሲ ኢሲ ኣሳይ ፃማቂዛ ዮሃኒሳ፤ ባጋይቲ ኤላሳ፤ ሃራቲ ቃሴ ቤኒ ናቤታፔ ኢሶይ ሃይቆፔ ዴንዲዴስ ጌቴስ” ጊዳ።
LUK.9.20	ኢዚካ ኢስታ “ኢንቴች ታና ኦና ጌቲ?” ጊዲ ኦይቺዴስ። ጴፅሮሲካ “ኔኒ ፆሳፌ ኪቴቲዳ ኪርስቶሳ” ጊዲ ዛሪዴስ። 
LUK.9.21	ዬሱሲካ ኢስታ “ሃይሳ ኦናስካ ዮቶፒቴ” ጊዲ ሚንꬂ ዮቲዲ 
LUK.9.22	ቃሴካ “ኣሳ ናይ ዳሮ ዋዬ ኤካናስ ቤሴስ፤ ዴሬ ጪማታን፥ ቄሴ ሃላቃታኒኔ ሙሴ ዎጋ ፃፊዛይታን ኢፄታናኔ ኢስታ ኩሼን ሃይቃናሲኔ ሄꬓንꬆ ጋላሳን ሃይቆፔ ዴንዳና” ጊዴስ።
LUK.9.23+LUK.9.24	ቃሴካ ኡባስ “ባ ሼምፖ ኣሻና ጊዛ ኣሲ ዉሪ ꬋይሳና ሺን ባ ሼምፖ ታ ጊሽ ጊዲ ꬋይሲዛ ኣሲ ኣሻና። ሄሳ ጊሽ ታና ካላና ኮዪዛ ኣሲ ዲኮ ባና ካዶ፤ ኡባ ጋላስ ባ ማስቃሌ ቶኪዲ ታና ካሎ። 
LUK.9.25	ኣሲ ኣላሜ ጎዓ ሙሌ ዴሚዲ ባ ሼምፖ ꬋይሲኮ ኣዛ ጎዓይ ዲዜ? 
LUK.9.26	ኦኒካ ታናኒኔ ታ ቃላን ዬላቲኮ ኣሳ ናይ ባ ቦንቾራ፥ ኣዋ ቦንቾራኔ ጌሻ ኪታንቻታ ቦንቾራ ዪዛ ዎዴ ታኒ ኢዛን ዬላታና። 
LUK.9.27	ታ ኢንቴስ ቱሙ ጋይስ፤ ሃይሳን ኤቂዳ ኣሳፔ ሃይቃናፔ ሲንꬃን ፆሳ ካዎቴꬅ ቤያና ኢሲ ኢሲ ኣሳቲ ዴቴስ” ጊዴስ።
LUK.9.28	ዬሱሲ ሄሳ ጊዳ ኦሱፑን ጋላሳ ማላፔ ጉዬ ዎሳናስ ዙማ ቦላ ኬዚዴስ። ቢሼ ባናራ ጴፅሮሳ፥ ዮሃኒሳኔ ያቆቤ ኤኪ ቢዴስ። 
LUK.9.29	ኢዚ ዎሲሺን ኢዛ ኣይፌሶይ ላሜቲዴስ። ኢዛ ሜꬋይካ ዎልቃንꬃ ማላ ፆሊቂዲ ቦቲዴስ። 
LUK.9.30	ናምዑ ኣሳቲ ሙሴይኔ ኤላሲ ኢዛራ ሃሳዬቲዳ 
LUK.9.31	ኢስቲካ ቦንቾራ ቆንጪዲ ዬሩሳላሜን ፖሌታና ዲዛ ዬሱሳ ሃይቆ ጊሽ ሃሳዔቲዳ። 
LUK.9.32	ጴፅሮሳኔ ኢዛራ ዲዛይታ ዴፆ ꬊስኮይ ኦይኪዴስ። ኢስቲካ ꬊስኮፌ ቤጊዲ ዬሱሳ ቦንቾኔ ናምዑ ኣሲ ኢዛራ ኤቂዳይታ ቤዪዳ። 
LUK.9.33	ሄ ናምዑ ኣሳቲ ዬሱሳፔ ሻኬቲ ቢሺን ጴፅሮሲ ዬሱሳ “ጎዶ! ኢሲ ዳሴ ኔስ፥ ኢሲ ዳሴ ሙሴስ፥ ኢሲ ዳሴ ኤላሳስ ኦꬂዲ ሃን ዲዛኮ ኑስ ሎዖኮ! ሺን” ጊዴስ። ጊዶ ኣቲን ጴፅሮሲ ባ ጊዛይሳ ኤሮንታ ጊዴስ።
LUK.9.34	ኢዚ ሄሳ ሃሳዪሺን ሻራይ ዪዲ ኢስታ ጌንꬂዴስ። ሻራ ጊዶ ጌሊዲ ባቢዳ። 
LUK.9.35	ሻራ ጊዶፌካ “ታኒ ዶሪዳ ታ ናይ ሃይሳ፤ ኢዛ ሲዪቴ” ጊዛ ቃላይ ሴቴቲዴስ። 
LUK.9.36	ቃላይ ሴቴቲዳ ዎዴ ዬሱሲ ፃላ ቤቲዴስ። ዬሱሳ ካሊዛይቲካ ሃኒዳ ሚሻ ዉርሲ ባ ዎዝናን ኦይኪዳ ኣቲን ኦናስካ ዮቲቤቴና።
LUK.9.37	ዎንቴꬃ ጋላስ ኢስቲ ዙማ ቦላፌ ዎꬊን ዳሮ ኣሳይ ዪዲ ዬሱሳራ ጋጊዴስ። 
LUK.9.38	ሄ ዎዴ ኣሳ ጊዶፌ ኢሳዴይ ቃላ ꬎቁ ሂስቲዲ “ታማሪሲዛይሶ! ታስ ኢሲ ናይ ፃላ ዲዛ ጊሽ ኢዛ ኔ ፄላና ማላ ታ ኔና ዎሳይስ። 
LUK.9.39	ኢዛ ኢታ ኣያናይ ኦይኪሺን ሃሳዓይ ባይንዳ ዋሴስ፤ ቃኬቲሼ ዱናራ ጎፖንቶ ኬሴስ፤ ቆሆ ጋꬂዳፔ ጉዬ ዳሮ ዋይሲዲ ኣጌስ። 
LUK.9.40	ኔና ካሊዛይቲ ናዛፔ ኬሳና ማላ ኢስታ ታ ዎሳዲስ፤ ጊዶ ኣቲን ኬሳና ዳንዳዪቤቴና” ጊዴስ።
LUK.9.41	ዬሱሲካ ኢስታስ ዛሪዲ “ኣማኖንታ ሃ ዎዴ ዎቤ ኣሳቶ! ታኒ ኢንቴናራ ኣይዴ ጋካናስ ዳኔ? ኢንቴናካ ኣይዴ ጋካናስ ዳንዳያኔ? ናዛ ኣኔ ሃ ኤሃ!” ጊዴስ።
LUK.9.42	ናዚ ዪሺን ኢታ ኣያናይ ኢዛ ቦላፌ ዬጊን ቃኬቲዴስ። ዬሱሲካ ኢታ ኣያናዛ ሴሪዲ ናዛ ፓꬂዲ ናዛ ኣዋስ ኢሚዴስ። 
LUK.9.43	ኣሳይካ ዉሪ ፆሳ ጊታቴꬃን ማላሌቲዴስ።
LUK.9.43	ኢዚ ኦꬂዳይሳን ኣሳይ ዉሪ ማላሌቲሺን ዬሱሲ ባና ካሊዛይታ 
LUK.9.44	“ኣሳ ናይ ኣሳ ኩሼን ኣꬊዲ ኢሜታና፤ ኢንቴካ ሃ ዮዖዛ ባሎፒቴ” ጊዴስ።
LUK.9.45	ጊዶ ኣቲን ኢዚ ጊዛይሲ ኢስታስ ጌሊቤና። ኣይስ ጊኮ ኢስቲ ኣኬኮንታ ማላ ዮዖዚ ኢስታፌ ጌሜቲዴስ፤ ዛሪዲካ ኦይቾንታ ማላ ባቢዳ።
LUK.9.46	ኢዛ ካሊዛይቲ “ኦኒ ኦናፔ ኣꬊዜ?” ጊዲ ባ ጊዶን ፓላሜቲዳ። 
LUK.9.47	ዬሱሲካ ኢስታ ዎዝና ቆፋ ኤሪዲ ጉꬃ ና ኤኪ ዪዲ ባ ማታን ኤሲዲ 
LUK.9.48	“ሃ ጉꬃ ና ታ ሱንꬃን ኤኪዛዴይ ኦኒካ ዲኮ ታና ኤኬስ፤ ታና ኤኪዛዴይካ ታና ኪቲዳይሳ ኤኬስ። ኢንቴ ኡባፌ ጉꬃ ኣሲ ኢዚ ኡባፌ ኣꬌስ” ጊዴስ። 
LUK.9.49	ዮሃኒሲካ “ጎዶ! ኢሲ ኣሲ ኔ ሱንꬃን ዳይዳንꬅ ኬሲሺን ቤይዶስ። ጊዶ ኣቲን ኢዚ ኑናራ ካሎንታ ጊሽ ዲጋናስ ኮይዶስ” ጊዴስ።
LUK.9.50	ዬሱሲካ “ኢንቴና ኢፆንታ ኣሲ ዉሪ ኢንቴ ባጋ ጊዲዳ ጊሽ ዲጎፍቴ” ጊዴስ።
LUK.9.51	ዬሱሲ ሳሎ ቢዛ ዎዴይ ማቲዳ ጊሽ ዬሩሳላሜ ባናስ ዴንዲዴስ። 
LUK.9.52	ኢዚካ ሲንꬃꬂዲ ኣሴ ኪቲዴስ። ኢስቲካ ኮሺዛ ሚሽ ጊጊሳናፔ ካሴቲዲ ሳማሪያ ቢታን ዲዛ ኢሲ ጉታ ቢዳ። 
LUK.9.53	ጊዶ ኣቲን ዴሬይ ኢዚ ዬሩሳላሜ ቢዛይሳ ኤሪዳ ጊሽ ሞኪ ኤኪቤቴና። 
LUK.9.54	ኢዛ ካሊዛይታፔ ያቆቤይኔ ዮሃኒሲ ሃኒዛይሳ ቤዪዲ “ጎዶ! ኤላሲ ኦꬆይሳꬆ ‘ታማይ ሳሎፔ ዎꬊዲ ኢስታ ዲፕ ሂስቶ!’ ጊዲ ኣዛዛና ማላ ኮያይ?” ጊዳ። 
LUK.9.55	ጊዶ ኣቲን ዬሱሲ ኢስታኮ ዩዪዲ “ኢንቴስ ኣይ ማላ ኣያናይ ዲዛኮኔ ኤሬኬቲ? ኣሳ ናይ ዪዳይ ኣሳ ሼምፖ ኣሻናስ ኣቲን ꬋይሳናስ ጊዴና” ጊዲ ኢስታ ሴሪዴስ። 
LUK.9.56	ኢስቲ ዉሪካ ሃራ ጉታ ቢዳ።
LUK.9.57	ኢስቲካ ቢርሺን ኢሲ ኣሲ ኢስታኮ ሺቂዲ “ታኒ ኔኒ ቢዛ ኡባሶ ኔና ታ ካላና” ጊዴስ።
LUK.9.58	ዬሱሲ “ዎርኬናታስ ኣቂዛ ኦላይ፥ ካፎታስ ቃሴ ኣቂዛ ካፎ ኬꬂ ዴስ፤ ጊዶ ኣቲን ኣሳ ናስ ባ ሁዔ ኣይሲዛሶይካ ባዋ” ጊዴስ።
LUK.9.59	ዬሱሲካ ሂንኮይሳ “ታና ካላ” ጊዴስ። ሄ ኣዴዚካ “ጎዶ! ታ ካሴታ ባዳ ታ ኣዋ ሞጎ?” ጊዴስ።
LUK.9.60	ዬሱሲካ “ኣጋጋ፥ ሃይቂዳይቲ ሃይቂዳይታ ሞጌቶ። ኔኒ ጊዲኮ ባዳ ፆሳ ካዎቴꬃ ኣሳስ ዮታ” ጊዴስ።
LUK.9.61	ቃሴካ ሃራ ኣሲ “ጎዶ! ታ ኔና ካላና ሺን ኮይሮ ሶ ባዳ ታ ኬꬃ ኣሳ ሳሮ ጋዳ ዮዖ?” ጊዴስ። 
LUK.9.62	ጊዶ ኣቲን ዬሱሲ “ቦራ ካሶ ኦይኪዲ ጎዪሼ ጉዬ ዛሪ ፄሊዛዴይ ኦኒካ ፆሳ ካዎቴꬃስ ቤሴና” ጊዴስ።
LUK.10.1	ሄሳፌ ጉዬ ጎዳይ ሃራ ላፑን ታማኔ ናምዑ ኣስ ዶሪዲ ሱንꬂዴስ። ኢስታካ ናምዑ ናምዑ ሂስቲዲ ኢዚ ባና ሶሆታኔ ካታማታ ዉርሲካ ኢስቲ ካሴቲዲ ባና ማላ ኪቲዴስ። 
LUK.10.2	“ማፃ ጋኪዳ ካꬃይ ዳሮ፤ ካꬃ ማፂ ሺሺዛይቲ ጉꬃታ ሄሳ ጊሽ ካꬃ ጎዳይ ካꬃ ማፂዲ ሺሺዛይታ ካꬃይ ዲዛሶ ዬዳና ማላ ዎሲቴ። 
LUK.10.3	ሄሳ ጊሽ ቢቴ ዶርሳቲ ካና ሱይቴ ጊዶራ ቢዛ ማላ ታ ኢንቴና ዬዳይስ። 
LUK.10.4	ኮሮጆ ዎይኮ ቃራፂቴ ዎይኮ ጫማ ኤኮፍቴ፤ ኦጌ ቦላ ኦናካ ሳሮ ጎፒቴ። 
LUK.10.5	“ኢንቴ ኦና ኬꬂካ ጌሊዛ ጊዲኮ ኮይሮቲዲ ‘ኬꬃ ኣሶ ሳሮ!’ ጊቴ። 
LUK.10.6	ሄ ኬꬃን ሳሮ ዶሲዛ ኣሲ ዲኮ ኢንቴ ሳሮታይ ሄ ኬꬃን ሼምፓና፤ ሳሮ ዶሲዛ ኣሲ ዶንታ ኣጊኮ ኢንቴ ሳሮታይ ኢንቴስ ሲማና። 
LUK.10.7	ኢንቴስ ማና ሺሺዳ ካꬅ ዉርሲ ሚሼኔ ኡዪሼ ሄ ኢንቴ ጌሊዳ ኬꬃን ኡቲቴ፤ ኦꬂዛዴስ ባ ዎልቃ ዋጋ ኤካናስ ኢዛስ ቤሴስ። ሃ ኬꬃፌ ሄ ኬꬄ ዩዮፒቴ። 
LUK.10.8	“ኢንቴ ኣይ ካታማካ ጋኪዛ ዎዴ ኣሳይ ኢንቴና ሞኪ ኤኪኮ ኢስቲ ኢንቴስ ኣꬂዳ ቁማ ሚቴ። 
LUK.10.9	ሄ ካታማን ዲዛ ሃርጋንቻታ ፓꬂዲ ፆሳ ካዎቴꬂ ኢንቴኮ ማቲዴስ ጊዲ ዮቲቴ። 
LUK.10.10	ጊዶ ኣቲን ኢንቴ ቢዲ ኢሲ ካታማ ጌሊሺን ሄ ካታማ ኣሳይ ኢንቴና ሞኪ ኤኮንታ ኢፂኮ ሄ ካታማ ኣሳይ ሺቂዛ ዱቡሻ ኬዚዲ፤ 
LUK.10.11	‘ኑ ቶሆ ቦላ ዲዛ ኢንቴ ካታማ ጉዱላ ኢንቴስ ማርካ ጊዳና ማላ ኑ ቶሆ ቦላፌ ፒቶስ ሺን ፆሳ ካዎቴꬃይ ኢንቴኮ ማቲዳይሳ ኤሪቴ’ ጊቴ። 
LUK.10.12	ታ ኢንቴስ ዮታይስ ፒርዳ ጋላስ ሄ ካታማ ፒርዳፌ ሶዶሜ ካታማ ፒርዳይ ካዉሼ ጊዳና። 
LUK.10.13	“ኩራዚኔ ኔና ኣዬ-ኣና! ቤቴሳይዳ ኔና ኣዬ ኣና! ኢንቴናን ኦሴቲዳ ማላታቲ ፂሮሴኒኔ ሲዶናን ኦሴቲዳኮ ኢስቲካ ማይዖ ማይዒዲኔ ቢዲንꬅ ጎርፔቲዲ ሄ ዎዴ ቤኒ ማሬታናሺን። 
LUK.10.14	ጊዶ ኣቲን ፒርዳ ዎዴ ኢንቴፌ ፂሮሴሲኔ ሲዶናስ ካዉያና። 
LUK.10.15	ሃኔ ቂፊርናሆሜ ፑዴ ሳሎ ꬎቁ ꬎቁ ጋዲ? ኔኒ ዱጌ ሲዖሌ ዎꬋና፥ 
LUK.10.16	“ኢንቴ ጊዛይሳ ሲዪዛ ኣሲ ታና ሲዬስ፤ ኢንቴና ኤኮንታ ኣሲ ታናካ ኤኬና፤ ታና ኤኮንታይካ ታና ኪቲዳይሳ ኤኬና” ጊዴስ። 
LUK.10.17	ላፑን ታማኔ ናምዓቲካ ኡፋዬቲሼ ሲሚዲ “ጎዶ! ሃራይ ኣቶ ሺን ዳይዳንꬃቲካ ኔ ሱንꬃን ኑስ ሃሬቲዳ” ጊዲ ዮቲዳ።
LUK.10.18	ኢዚካ ኢስታስ “ፃላዔይ ዎልቃንꬃ ማላ ሳሎፔ ኩንዲሺን ታ ቤያዲስ።
LUK.10.19	“ሂስቲኮ ሾሻኔ ማሲማሶ ኢንቴ ዬꬋና ማላ ሞርኬ ዎልቃ ኡባ ቦላ ኢንቴስ ጎዳቴꬅ ኢማዲስ፤ ኢንቴና ቆሂዛ ኢሲ ሚሺካ ዴና። 
LUK.10.20	ኢንቴ ሱንꬃይ ሳሎን ፃፌቲዳ ጊሽ ኡፋዬቲቴ ኣቲን ቱና ኣያናቲ ኢንቴስ ሃሬቲዳ ጊሽ ኡፋዬቶፍቴ” ጊዴስ።
LUK.10.21	ሄ ዎዴ ዬሱሲ ፂሎ ኣያናን ኡፋዬቲዲ “ሳሎሲኔ ሳዓስ ጎዳ ጊዲዳ ኣቦ ሃይሳ ዉርሳካ ኣꬎ ኤራንቻታፔኔ ኤራቻታፔ ቆታዳ ቄሪ ጉꬃ ናይታስ ኔ ቆንጪሲዳ ጊሽ ታኒ ኔና ጋላታይስ፤ ኤ፥ ታ ኣዋዉ! ሃይሲ ኔ ሎዖ ሼኔይ ሃኒዴስ።
LUK.10.22	“ዉሪ ታ ኣዋ ማታፔ ታስ ኢሜቲዴስ፤ ቃሴካ ኢዛ ናይ ኦናኮኔ ኣዋፔ ኣቲን ኤሪዛይ ባዋ። ኣዋይ ኦናኮኔ ናዛፔ ኣቲን ዎይኮ ናዚ ኢዛስ ቆንጪሳናስ ዶሲዳዴፔ ኣቲን ኤሪዛዴይ ባዋ” ጊዴስ። 
LUK.10.23	ባና ካሊዛይታኮ ሲሚዲ ኢስታስ ዱማ “ኢንቴ ቤዪዛይሳ ቤዪዛ ኣይፌቲ ኣንጄቲዳይታ። 
LUK.10.24	ታ ኢንቴስ ቱማ ጋይስ ዳሮ ናቤቲኔ ካዎቲ ኢንቴ ሃዒ ቤዪዛይሳ ቤያናስ ኮይዲ ቤይቤቴና፤ ኢንቴ ሃዒ ሲዪዛይሳካ ሲያናስ ኮይዲ ሲይቤቴና” ጊዴስ።
LUK.10.25	ኢሲ ጋላስ ሙሴ ዎጋ ታማርሲዛ ኢሲ ኣሲ ዬሱሳ ፓጫናስ ኮይዲ “ታማሪሲዛይሶ ታኒ ሜርና ዴዖ ላታናስ ኣይ ኦꬆ?” ጊዲ ኦይቺዴስ። 
LUK.10.26	ዬሱሲካ ዛሪዲ “ዎጋ ማፃፋን ኣይ ጌቴቲ ፃፌቲዴ? ኢዛፔ ኔስ ጌሊዳይ ኣዜ?” ጊዲ ኦይቺዴስ።
LUK.10.27	ኣዴዚ ዛሪዲ “ኔ ጎዳ ፆሳ ኔ ኩሜꬃ ዎዝናፔ፥ ኔ ኩሜꬃ ሼምፖፌ፥ ኔ ኩሜꬃ ዎልቃፌኔ፥ ኔ ኩሜꬃ ቆፋፔ ሲቃ፤ ኔ ላጌካ ኔ ሁዔ ማላ ሲቃ ጌስ” ጊዲ ዛሪዴስ። 
LUK.10.28	ዬሱሲካ “ሎዖ ዛራዳሳ። ኔኒካ ሄሳꬆ ኦꬂኮ ሜርና ዴዖ ዴማና” ጊዴስ። 
LUK.10.29	ኣዴዚ ባና ፂሊሳናስ ኮይዲ “ሂስቲን ታ ላጌይ ኦኔ?” ጊዲ ዬሱሳ ኦይቺዴስ
LUK.10.30	ዬሱሲካ ዛሪዲ “ኢሲ ኣዴዚ ዬሩሳላሜፔ ኢያርኮ ዎꬊሺን ፓንጋቲ ዴሚዲ ኢዛ ማይዖ ቃሪ ኤኪዳ፤ ኬሂ ቆፄሬꬂዲ ሃይቆፔኔ ፓፃፔ ጊዶን ዬጊ ኣጊዲ ቢዳ። 
LUK.10.31	ኢሲ ቄሴይ ሄ ኦጌራ ባሲ ዱጌ ዎꬊሼ ኣሙንሶንታ ሄ ቆፄቲዳ ኣዴዛ ዴሚዲ ፖቄꬃራ ዬጊ ኣꬊዴስ። 
LUK.10.32	ቃሴካ ኢሲ ሌዌ ባጋ ኣሳፔ ኢሲ ኣዴዚ ሄ ኦጌራ ኣꬊሼ ቆፄቲዳ ኣዴዛ ቤዪዲ ሃዒካ ፖቂዲ ኣꬊዴስ። 
LUK.10.33	ኢሲ ሳማሪያ ቢታ ኣሲ ሄ ኦጌራ ኣꬊ ቢሼ ቆፄቲዳ ኣዴዛ ቦላ ጋኪ ዎꬊዴስ፤ ኣዴዛ ቤዪዲኔ ኬሂ ሚሼቲዴስ። 
LUK.10.34	ኣዴዛኮ ሺቂዲኔ ማዱንꬃ ꬋላና ማላ ዎጋራ ሚꬃ ዛይቴኔ ዎይኔ ጫጄ ማዱንꬃ ቦላ ጉሲዲ ቃቺዴስ፤ ኣዴዛ ባ ሃሬ ቶጊሲዲ ኢማꬂ ሼምፒዛሶ ኤፊዲ ሎዔꬂ ፄሊዴስ። 
LUK.10.35	ዎንቴꬃ ጋላስ ኢማꬂ ሼምፒዛ ኬꬃ ጎዳስ ናምዑ ዲናሬ ኢሚዲኔ ‘ኔና ሃራ ሚሻ ኬሲሲኮ ታ ሲማሼ ኔስ ኢማና፤ ኔፔ ኬሳዳ ሎዔꬃ ናጋ’ ጊዴስ።
LUK.10.36	“ሂስቲኮ ሃ ሄꬑ ኣሳታፔ ፓንጋታን ቆፄቲዲ ሃይቆፔኔ ፓፃፔ ጊዶን ዬጌቲዳዴስ ኬሂ ማታ ላጌይ ኔስ ኣዋይሳ ሚሳቲዜ?” ጊዴስ።
LUK.10.37	ሙሴ ዎጋ ታማርሲዛይሲካ “ሄሲ ኔ ሚቼቲዳይሳኔ ማዲዳይሳ!” ጊዴስ። ዬሱሲካ ኢዛስ “ኔካ ባዳ ኢዛይሳꬆ ኦꬃ” ጊዴስ።
LUK.10.38	ዬሱሲኔ ኢዛ ካሊዛይቲ ኦጌ ቢሺን ዬሱሲ ኢሲ ጉታ ጌሊዴስ፤ ማርታ ጌቴቲዛ ኢሲ ማጫሲያ ባሶን ዬሱሳ ሞካ ኤካዱስ። 
LUK.10.39	ኢዚስ ማራሞ ጌቴቲዛ ኢሲ ሚቼያ ዳዉስ። ማራማካ ኢዛፔ ቃላ ሲያሼ ጎዳ ቶሆ ጋርሳን ኡታዱስ። 
LUK.10.40	ጊዶ ኣቲን ማርታይ ኦሶ ዳሮፔ ዴንዲዳይሳን ዳቡራዳ ዬሱሳኮ ሺቃዳ “ጎዶ! ታ ሚቺያ ኦሶ ዉርሳ ታ ቦላ ኣጋዳ ኡቲሺን ኔኒ ጮዑ ጋይ? ኢዛ ታና ማዳና ማላ ኢዚስ ዮታ ኣቲን” ጋዱስ።
LUK.10.41	ጊዶ ኣቲን ጎዳይ “ሃኔ ማርታኔ! ኔኒ ዳሮ ሚሻ ጊሽ ቆፋ ዳራሳ፤ ዲርባታሳ፤ ቱጋታሳ። 
LUK.10.42	ኮሺዛይ ጊዲኮ ኢሲ ሚሽ ፃላ፤ ማራማካ ሎዖ ኤፃ ዶራዱስ፤ ሄሲካ ኢዚፔ ኤኬቴና።”
LUK.11.1	ኢሲ ጋላስ ዬሱሲ ኢሲሶን ዎሲዴስ፤ ኢዚ ዎሳ ዉርሲሺን ኢዛ ካሊዛይታፔ ኢሶይ “ጎዶ! ፃማቂዛ ዮሃኒሲ ባና ካሊዛይታ ዎሳ ታማርሲዳይሳꬆ ኔካ ኑና ዎሳ ታማርሳ!” ጊዴስ።
LUK.11.2	ኢዚካ ኢስታስ “ዎሲሼ
LUK.11.2	‘ኑ ኣዋዉ! ኔ ሱንꬂ ኣንጄቶ፤
LUK.11.2	ኔ ካዎቴꬂ ሃዮ፤
LUK.11.3	ሃቺስ ጊዲዛ ቁማ ኑስ ኢማ፤
LUK.11.4	ኑና ቆሂዳይታ ኑ ማሪዛ ማላ ኑና ማራ፤
LUK.11.4	ፓጬንካ ኑና ጌልꬆፋ’ ጊ ዎሲቴ” ጊዴስ።
LUK.11.5+LUK.11.6	ቃሴካ “ኢንቴፌ ኢሳዴስ ላጌይ ዲኮ ሌላ ጊዶꬅ ሄ ላጌዛሶ ቢዲ ‘ታስ ኢሲ ኢማꬂ ኦጌፔ ዪን ሚዛና ካꬅ ባይንዳ ጊሽ ሄꬑ ሶሎይ ዲኮ ታስ ታልዓሪኪ?’ 
LUK.11.7	ላጌዚካ ዛሪዲ ‘ታና ዋይሶፓ፤ ካሬይካ ጎርዴቲዴስ፤ ታኒካ ናይታራ ኢቻዲስ። ሃዒ ዴንዳዳ ኢማናስ ዳንዳይኬ’ ጋንዴ? 
LUK.11.8	ታካ ኢንቴስ ዮታይስ ላጌቴꬃ ጊሽ ዴንዲዲ ኢሞንታ ኣጊኮካ ኢዚ ኦይቾን ሳሌꬂዳ ጊሽ ዴንዲዲ ኮዪዛይሳ ዉርሲ ኢሚዴስ።
LUK.11.9	“ሄሳ ጊሽ ታኒ ኢንቴስ ጊዛይ፤ ዎሲቴ ኢንቴስ ኢሜታና፤ ኮዪቴ ኢንቴ ዴሜና፤ ካሬ ቆፂቴ ኢንቴስ ዶዬታና። 
LUK.11.10	ኣይስ ጊኮ ዎሲዛይ ዉሪ ኤካና፤ ኮዪዛይካ ዴሜና ካሬ ቆፂዛዴስካ ዶዬታና።
LUK.11.11	“ኢንቴፌ ኣዋ ጊዲ ኡቲዲ ኢዚ ዬሊዳ ናይ ሞሌ ኦይቺኮ ሾሽ ኢሚዛይ ዳንዴ? 
LUK.11.12	ዎይኮ ጱጱሌ ኦይቺኮ ማሲማሶ ኢሚዛይ ዳንዴ? 
LUK.11.13	ኢንቴ ኢታታ ጊዲሼ ኢንቴ ናይታስ ሎዖ ኢሞታ ኢሞ ኤሪኮ፤ ሳሎን ዲዛ ኢንቴ ኣዋይ ባና ዎሲዛይታስ ፂሎ ኣያናን ዎስቲ ዳርሲ ኢሜኔ?” ጊዴስ።
LUK.11.14	ኢሲ ጋላስ ዬሱሲ ሃሳይሶንታ ዱዴ ዳይዳንꬅ ኬሲዴስ። ዳይዳንꬃዚካ ኬዚዳፔ ጉዬ ዱና ዱዴ ኣዴዚ ሃሳይዴስ፤ ቤዪዳ ኣሳቲካ ዳርሲ ማላሌቲዳ። 
LUK.11.15	ጊዶ ኣቲን ኢሲ ኢሲ ኣሳቲ “ቢዔሊዜቡላ ጌቴቲዛ ዳይዳንꬃታ ሃላቃን ዳይዳንꬃታ ኬሴስ” ጊዳ። 
LUK.11.16	ኢሲ ኢሲ ኣሳይ ኢዛ ፓጫናስ “ሳሎፔ ማላታ ቤሳ” ጊዲ ኦይቺዳ። 
LUK.11.17	ጊዶ ኣቲን ዬሱሲ ኢስታ ቆፋ ኤሪዲ “ባ ጊዶን ሻኬቲዛ ካዎቴꬂ ዉሪ ꬋያና፤ ባ ጊዶን ሲጋይ ባይንዳ ኬꬂካ ኩንዳና። 
LUK.11.18	ኢንቴ ታና ‘ቢዔሊዜቡላን ዳይዳንꬃታ ኬሴስ’ ጊዲ ሃሳዬታ ሺን ፃላዔይካ ባ ጊዶን ኢሶይ ኢሳፌ ሻኬቲኮ ኢዛ ካዎቴꬂ ዋኒ ሚናኔ? 
LUK.11.19	ሂስቲኮ ታኒ ዳይዳንꬃታ ቢዔሊዜቡላ ኬሲኮ ኢንቴ ናይቲ ኦናን ኬሳንዴቶ? ሄሳ ጊሽ ኢንቴ ናይቲ ኢንቴ ቦላ ፒርዲዛይታ ጊዳና። 
LUK.11.20	ጊዶ ኣቲን ታኒ ዳይዳንꬃታ ኬሲዛይ ፆሳ ዎልቃን ጋኪዴስ፤ ፆሳ ካዎቴꬃይ ኢንቴኮ ማቲዳሮ ኤሪቴ።
LUK.11.21	“ሚኖ ኣሲ ሎዔꬂ ጊፄቲዲ ባ ኬꬄ ናጊኮ ኬꬃን ዲዛ ሚሺ ሎዖን ናጌቴስ። 
LUK.11.22	ጊዶ ኣቲን ኢዛፔ ሃራ ሚኖ ኣሲ ዪዲ ፆኒኮ ኢዚ ኣማኔቲዳ ኦላ ሚሻታ ዎꬂ ኤኪዲ ኢዛስ ዲዛ ሃሮዛካ ዉርሲ ሃራስ ጊሻና።
LUK.11.23	“ታናራ ጊዶንታይ ታናራ ኤቄቴስ፤ ታናራካ ሺሾንታዴይ ላሌስ፥ 
LUK.11.24	“ቱና ኣያናይ ኣሳፔ ኬዚዳ ዎዴ ሼምፖሶ ኮዪሼ ሃꬂ ባይንዳ ሜላ ሶን ዋዬቴስ፤ ሼምፖሶይ ꬋይኮ ‘ታኒ ካሴ ኬዚዳሶ ጉዬ ሲማና’ ጌስ። 
LUK.11.25	ኢዛፔ ሲሚዲ ዪሺን ካሴ ኢዚ ኣጊ ቢዳ ኬꬃይ ፒቴቲዲኔ ጊጊ ኡቲዳይሳ ዴሜስ። 
LUK.11.26	ሄሳፌ ሲሚ ቢዲ ባፔ ኢቲዛ ሃራ ላፑን ዳይዳንꬃታ ባናራ ኤኪዲ ዬስ፤ ኢስቲካ ጌሊዲ ሄን ዳና፤ ሄሳዴስካ ኮይሮይሳፌ ጉዬይሲ ኬሂ ኢታ ጊዳና” ጊዳ።
LUK.11.27	ዬሱሲ ሄሳ ሃሳዪዛ ዎዴ ኣሳ ጊዶፌ ኢሲ ማጫስ ዲዛራ ባ ቃላ ꬎቁ ኦꬃዳ “ኔና ቶኪዳ ቃንꬂኔ ኔ ꬋሚዳ ꬋንꬃቲ ኣንጄቲዳይታ” ጋዱስ።
LUK.11.28	ጊዶ ኣቲን ኢዚ “ኣንጄቲዳይቲ ፆሳ ቃላ ሲይዲ ኣዛዜቲዛይታ” ጊዴስ።
LUK.11.29	ዳሮ ዴሬይ ዬሱሳኮ ሺቂዳ ዎዴ ዬሱሲ “ሃይሲ ዬሌታይ ኢታ ዬሌታ፤ ጊታ ማላታ ቤያናስ ኮዬስ። ጊዶ ኣቲን ዮናሳ ማላታፔ ሃራ ዱማ ማላታይ ኢሜቴና። 
LUK.11.30	ጋሶይካ ዮናሲ ናናዌ ኣሳስ ማላታ ጊዲዳ ማላ ኣሳ ናይ ታኒ ሃ ዬሌታስ ማላታ ጊዳና። 
